ticker,date,sentiment_score,sentiment_label,content_type,title
SCHW,2026-05-04,0.921529620885849,positive,news,Toronto-Dominion Bank (TSE:TD) Upgraded by Scotiabank to Sector Outperform Rating
SCHW,2026-05-04,-0.019340209662914276,neutral,news,Charles Schwab Corp. (FELE) Form 144 entry lists restricted stock figures
SCHW,2026-05-04,-0.006168259307742119,neutral,news,[144] CENTERPOINT ENERGY INC SEC Filing
SCHW,2026-05-04,-0.9664741409942508,negative,news,Schwab Trading Activity Index drops in April as retail clients turn cautious (SCHW:NYSE)
SCHW,2026-05-04,-0.9614492869004607,negative,news,Schwab Trading Activity Index™: STAX Score Drops in April as Retail Clients Cut Tech Exposure
SCHW,2026-05-04,-0.9580661440268159,negative,news,Builders FirstSource (NYSE:BLDR) Price Target Cut to $81.00 by Analysts at Deutsche Bank Aktiengesellschaft
SCHW,2026-05-04,0.9389627054333687,positive,news,Varma Mutual Pension Insurance Co Raises Position in The Charles Schwab Corporation $SCHW
SCHW,2026-05-04,0.49697406124323606,positive,news,"After $260M GPU deal, Axe Compute CEO heads to Schwab and Cheddar"
SCHW,2026-05-04,-0.9496749918907881,negative,news,The Charles Schwab Corporation $SCHW Shares Sold by Truist Financial Corp
SCHW,2026-05-03,-0.3621917963027954,negative,news,Horizon Investments LLC Has $9.78 Million Stock Position in The Charles Schwab Corporation $SCHW
SCHW,2026-05-03,0.09086260199546814,positive,news,"Cornerstone Planning Group LLC Sells 327,080 Shares of The Charles Schwab Corporation $SCHW"
SCHW,2026-05-02,-0.013934208080172539,neutral,news,Schwab intermediate-term US Treasury ETF declares monthly distribution of $0.0795
SCHW,2026-05-02,-0.9200909100472927,negative,news,"Strs Ohio Sells 47,577 Shares of The Charles Schwab Corporation $SCHW"
SCHW,2026-05-02,0.012329330667853355,neutral,news,"PFA Pension Forsikringsaktieselskab Purchases Shares of 1,119,170 The Charles Schwab Corporation $SCHW"
SCHW,2026-05-02,0.0214824415743351,neutral,news,"ETFs Investing in Lineage, Inc. Stocks"
SCHW,2026-05-02,0.889222901314497,positive,news,Charles R. Schwab co-chairman sells $15.4m in SCHW stock
SCHW,2026-05-02,0.7609686627984047,positive,news,Charles R. Schwab co-chairman sells $15.4m in SCHW stock
SCHW,2026-05-01,0.9081204831600189,positive,news,Charles R. Schwab co-chairman sells $15.4m in SCHW stock
SCHW,2026-05-01,-0.23661740124225616,neutral,news,Charles R. Schwab co-chairman sells $15.4m in SCHW stock
SCHW,2026-05-01,0.0001803860068321228,neutral,news,[144] BKV Corp SEC Filing
SCHW,2026-05-01,0.17825028114020824,neutral,news,Schwab 5-10 year corporate bond ETF declares monthly distribution of $0.0947
SCHW,2026-05-01,-0.10789214074611664,neutral,news,META (NASDAQ: META) files Form 144 showing RSU lapses and a 392-share sale
SCHW,2026-05-01,-0.9657702287659049,negative,news,Virtus Investment Partners (NASDAQ:VRTS) Shares Gap Down - Time to Sell?
SCHW,2026-05-01,0.14720690995454788,neutral,news,Schwab ultra-short income ETF declares monthly distribution of $0.0822
SCHW,2026-05-01,-0.005150247365236282,neutral,news,Schwab Core Bond ETF declares monthly distribution of $0.0942
SCHW,2026-05-01,0.9347740914672613,positive,news,LPLA Q1 Earnings Beat Estimates as Revenues and Advisory Assets Jump
SCHW,2026-05-01,0.16038189828395844,neutral,news,Schwab high yield bond ETF declares monthly distribution of $0.1449
SCHW,2026-05-01,0.21601172536611557,neutral,news,Schwab Municipal Bond ETF declares monthly distribution of $0.0740
SCHW,2026-05-01,0.00831291452050209,neutral,news,SCHW Stock Price and Chart — TSX:SCHW
SCHW,2026-05-01,-0.8856806866824627,negative,news,"New York State Teachers Retirement System Sells 49,223 Shares of The Charles Schwab Corporation $SCHW"
SCHW,2026-05-01,0.9335527373477817,positive,news,Danske Bank A S Raises Stake in The Charles Schwab Corporation $SCHW
SCHW,2026-05-01,0.9097706563770771,positive,news,Toronto-Dominion Bank (TSE:TD) Shares Cross Above 200 Day Moving Average - What's Next?
SCHW,2026-05-01,0.24009982962161303,neutral,news,Teens ring NYSE bell as Schwab puts $20M into investing lessons
SCHW,2026-05-01,0.17363954335451126,neutral,news,Charles Schwab Corp. touted long-short RIA accounts to Wall Street as a hot new 'win-win' revenue source until 'geopolitical instability' suddenly curbed its appetite for rising risk
SCHW,2026-05-01,0.9092415096238256,positive,news,Is the Schwab U.S. Dividend Equity ETF the Right Buy for This Market?
SCHW,2026-05-01,0.008576257154345512,neutral,news,"ETFs Investing in Phillips Edison & Company, Inc. Stocks"
SCHW,2026-05-01,-0.028813159093260765,neutral,news,Diluted shares outstanding of Charles Schwab Corp Shs Unsponsored Canadian Depository Receipt Hedged Reg
SCHW,2026-05-01,-0.3356529772281647,negative,news,"Radian Group (NYSE:RDN) EVP Edward Hoffman Sells 15,000 Shares"
SCHW,2026-04-30,-0.005089147016406059,neutral,news,Equity in earnings of Charles Schwab Corp Shs Unsponsored Canadian Depository Receipt Hedged Reg
SCHW,2026-04-30,0.919624924659729,positive,news,"Earnings Flash (LPLA) LPL Financial Holdings Inc. Reports Q1 Revenue $4.94B, vs. FactSet Est of $4.51B"
SCHW,2026-04-30,0.9342946484684944,positive,news,Active ETFs Draw Record Flows as Fee Barriers Fall
SCHW,2026-04-30,2.7747824788093567e-05,neutral,news,[144] EXTREME NETWORKS INC SEC Filing
SCHW,2026-04-30,0.1757802516222,neutral,news,"How Investors May Respond To Charles Schwab (SCHW) Earnings, Crypto Launch, Dividends, And Buybacks"
SCHW,2026-04-30,0.0034988094121217728,neutral,news,Charles Schwab Corp Deposit Shs Repr 1/100th Non-Cum Perp Pfd Shs Series F
UNH,2026-05-05,0.6969562266021967,positive,news,"QRG Capital Management Inc. Purchases 36,295 Shares of Merck & Co., Inc. $MRK"
UNH,2026-05-05,0.9065122976899147,positive,news,Major health insurers show signs of recovery – but a key test looms
UNH,2026-05-05,-0.0881062000989914,neutral,news,UnitedHealthcare removes prior approval requirements for 30% of healthcare services
UNH,2026-05-05,0.9135055309161544,positive,news,PFA Pension Forsikringsaktieselskab Invests $9.01 Million in Humana Inc. $HUM
UNH,2026-05-05,0.20426928717643023,neutral,news,Is UnitedHealth Stock a Generational Buying Opportunity?
UNH,2026-05-05,-0.8135109767317772,negative,news,UnitedHealth to Make It Easier for Patients to Get a Range of Procedures
UNH,2026-05-05,0.9313738290220499,positive,news,UnitedHealth Integrates AI to Enhance Operations
UNH,2026-05-05,0.5897495895624161,positive,news,Is UnitedHealth Stock a Generational Buying Opportunity?
UNH,2026-05-05,0.3552964171394706,neutral,news,Why Is Everyone Talking About UnitedHealth Stock?
UNH,2026-05-04,-0.06425372511148453,neutral,news,"WEX (NYSE: WEX) strikes Impactive deal, adds 3 directors and splits Chair-CEO roles"
UNH,2026-05-04,-0.9566570008173585,negative,news,"TDOC Q1 Earnings Miss, Revenues Down Y/Y on BetterHelp Weakness"
UNH,2026-05-04,0.287344210781157,neutral,news,"Beat the Market Like Zacks: Vicor, NVIDIA, UnitedHealth in Focus"
UNH,2026-05-04,-0.7997201271355152,negative,news,UNH DCF Analysis: Intrinsic Value $323 vs Price $369
UNH,2026-05-04,-0.9084433438256383,negative,news,France fines Novo Nordisk and Eli Lilly over ads for anti-obesity drugs
UNH,2026-05-04,0.9381424840539694,positive,news,Strs Ohio Grows Stake in Humana Inc. $HUM
UNH,2026-05-04,-0.8693557158112526,negative,news,"Comerica Bank Sells 4,526 Shares of Humana Inc. $HUM"
UNH,2026-05-04,-0.8651152029633522,negative,news,What happens when Humana is the last Medicare Advantage insurer
UNH,2026-05-03,-0.477306991815567,negative,news,Pfizer Scores an FDA Approval and a Patent Win in One Week. Here’s What the Stock Could Return by 2028
UNH,2026-05-03,0.9313997533172369,positive,news,UnitedHealth Stock Is Up 17% After Q1 Revenue Beat. Here’s What the Turnaround Looks Like
UNH,2026-05-03,-0.7654966786503792,negative,news,Vanguard Group Inc. Decreases Stake in Pool Corporation $POOL
UNH,2026-05-03,0.9168339688330889,positive,news,Hussman Strategic Advisors Inc. Invests $2.69 Million in Humana Inc. $HUM
UNH,2026-05-03,0.008898407220840454,positive,news,Danske Bank A S Raises Position in Humana Inc. $HUM
UNH,2026-05-03,0.92887616250664,positive,news,Benjamin Edwards Inc. Boosts Position in UnitedHealth Group Incorporated $UNH
UNH,2026-05-03,0.9112281650304794,positive,news,Artemis Investment Management LLP Makes New Investment in CVS Health Corporation $CVS
UNH,2026-05-03,0.10679875314235687,neutral,news,What's Going on With UnitedHealth Stock?
UNH,2026-05-03,0.9192351279780269,positive,news,What's Going on With UnitedHealth Stock?
UNH,2026-05-03,0.8673745337873697,positive,news,What's Going on With UnitedHealth Stock?
UNH,2026-05-03,-0.9161447323858738,negative,news,Strs Ohio Decreases Position in UnitedHealth Group Incorporated $UNH
UNH,2026-05-02,0.46623894572257996,positive,news,"Horizon Investments LLC Sells 27,059 Shares of UnitedHealth Group Incorporated $UNH"
UNH,2026-05-02,0.1322594815865159,neutral,news,PFA Pension Forsikringsaktieselskab Takes Position in UnitedHealth Group Incorporated $UNH
UNH,2026-05-02,0.9358735531568527,positive,news,Davis Selected Advisers Raises Stock Holdings in UnitedHealth Group Incorporated $UNH
UNH,2026-05-02,0.08368262648582458,positive,news,Citizens Financial Group Inc. RI Reduces Position in UnitedHealth Group Incorporated $UNH
UNH,2026-05-02,0.9373825322836637,positive,news,"Ashton Thomas Securities LLC Buys 3,894 Shares of UnitedHealth Group Incorporated $UNH"
UNH,2026-05-02,-0.8591960929334164,negative,news,Pool Corporation $POOL Shares Acquired by Academy Capital Management
UNH,2026-05-02,-0.0054457467049360275,neutral,news,CNC - Centene Corp Stock Price and Quote
UNH,2026-05-01,0.301458683796227,neutral,news,All Rhode Island CVS Pharmacy® locations now accept WIC for infant formula
UNH,2026-05-01,0.5032413899898529,positive,news,Humana (NYSE:HUM) Given New $214.00 Price Target at JPMorgan Chase & Co.
UNH,2026-05-01,0.9187989458441734,positive,news,UnitedHealth Stock Just Made Goldman’s Top Buys List. Here’s Why.
UNH,2026-05-01,0.5338634550571442,positive,news,UnitedHealth Pops 14.5% After Q1 Beat: Still a Buy or Too Late Now?
UNH,2026-05-01,-0.09515144303441048,neutral,news,LPCVW | Launchpad Cadenza Acquisition Corp Insider Trading
UNH,2026-05-01,0.7599583361297846,positive,news,"Humana (NYSE:HUM) Stock Price Expected to Rise, Cantor Fitzgerald Analyst Says"
UNH,2026-05-01,-0.9559665061533451,negative,news,Humana (NYSE:HUM) Price Target Raised to $250.00
UNH,2026-05-01,0.07720261067152023,neutral,news,10 Exceptional Stocks With Double-Digit Dividend Raises
UNH,2026-05-01,0.8274727091193199,positive,news,Mizuho Forecasts Strong Price Appreciation for Humana (NYSE:HUM) Stock
UNH,2026-05-01,0.9417461147531867,positive,news,ResMed Inc. (NYSE:RMD) Q3 2026 Earnings Call Transcript
UNH,2026-05-01,0.9307082165032625,positive,news,Alignment Healthcare (ALHC) Is Up 8.2% After Q1 Turn to Profitability and Raised 2026 Outlook – Has The Bull Case Changed?
UNH,2026-05-01,-0.6341747343540192,negative,news,Pekin Hardy Strauss Inc. Decreases Holdings in UnitedHealth Group Incorporated $UNH
AMGN,2026-05-05,-0.8325816765427589,negative,news,What’s at stake in Amgen’s showdown with the FDA?
AMGN,2026-05-05,-7.283128798007965e-05,neutral,news,Amgen Inc. Shs Sponsored Canadian Depository Receipt Hedged Reg S Cash Flow – TSX:AMGN
AMGN,2026-05-05,0.8958578631281853,positive,news,QRG Capital Management Inc. Increases Stake in Amgen Inc. $AMGN
AMGN,2026-05-04,0.245413932017982,neutral,news,Standing Bone Strong: Introducing a New Awareness Symbol for Osteoporosis
AMGN,2026-05-04,-0.03163544274866581,neutral,news,[144] AMGEN INC SEC Filing
AMGN,2026-05-04,-0.9026551991701126,negative,news,"Chevron Q1 2026 Earnings: Adjusted EPS Beats by 46%, But Margin Pressure Persists"
AMGN,2026-05-04,0.9206227790564299,positive,news,Amgen to Invest $300 Million in Expanding Puerto Rico Biologics Plant
AMGN,2026-05-04,0.9288376551121473,positive,news,Amgen to invest additional $300 million to boost US manufacturing footprint
AMGN,2026-05-04,0.12965683173388243,neutral,news,Bristol Myers Squibb ties science to soccer in World Cup campaign voiced by Ali Krieger
AMGN,2026-05-04,0.8831525407731533,positive,news,"Amgen announces additional $300 million U.S. manufacturing investment, totaling nearly $2 billion over the last year"
AMGN,2026-05-04,0.9195629842579365,positive,news,"AMGEN ANNOUNCES ADDITIONAL $300 MILLION U.S. MANUFACTURING INVESTMENT, TOTALING NEARLY $2 BILLION OVER THE LAST YEAR"
AMGN,2026-05-04,-0.9513058168813586,negative,news,Guggenheim cuts Amgen stock price target to $340 on valuation
AMGN,2026-05-04,-0.9615950770676136,negative,news,TWIST BIOSCIENCE ($TWST) Releases Q2 2026 Earnings
AMGN,2026-05-04,-0.5647176802158356,negative,news,Baron Health Care Fund’s Performance Impacted by Amgen (AMGN) Omission
AMGN,2026-05-04,0.822865717113018,positive,news,"Truist Financial Corp Sells 37,080 Shares of Amgen Inc. $AMGN"
AMGN,2026-05-04,-0.9509749915450811,negative,news,Guggenheim Trims Amgen Price Target to $340: Is the Biotech Giant Losing Its Edge?
AMGN,2026-05-04,-0.9528875052928925,negative,news,Gouws Capital LLC Lowers Stock Position in Amgen Inc. $AMGN
AMGN,2026-05-04,0.03916405886411667,neutral,news,Amgen Sees C-Suite Shifts
AMGN,2026-05-04,0.936678878031671,positive,news,Amgen Inc. $AMGN Shares Purchased by Ascent Wealth Partners LLC
AMGN,2026-05-04,-0.09320998191833496,negative,news,"How Investors Are Reacting To Biogen (BIIB) Earnings Beat, Lower Guidance, And Felzartamab China Deal"
AMGN,2026-05-03,-0.7892991229891777,negative,news,Amgen Inc. $AMGN Shares Sold by PKO Investment Management Joint Stock Co
AMGN,2026-05-03,0.643713042140007,positive,news,"Hussman Strategic Advisors Inc. Acquires Shares of 8,400 Amgen Inc. $AMGN"
AMGN,2026-05-03,0.8811012753285468,positive,news,"PFA Pension Forsikringsaktieselskab Takes Position in Paychex, Inc. $PAYX"
AMGN,2026-05-03,-0.91357696428895,negative,news,Amgen Inc. $AMGN Shares Sold by Horizon Investments LLC
AMGN,2026-05-03,0.9385559391230345,positive,news,Did Amgen’s Raised 2026 Outlook and AI-Focused Overhaul Just Shift AMGN’s Investment Narrative?
AMGN,2026-05-03,0.9051936916075647,positive,news,"Kymera Advances STAT6 Degrader KT-621 in Phase 2b Atopic Dermatitis, Asthma Trials"
AMGN,2026-05-03,0.010119160637259483,neutral,news,Amgen Inc. Shs Sponsored Canadian Depository Receipt Hedged Reg S Trade Ideas — FWB:AMG0
AMGN,2026-05-03,0.6071173399686813,positive,news,Do Sarepta Therapeutics’ (SRPT) Bullish Earnings Forecasts and Vanguard Stake Hint at a Shifting Risk Profile?
AMGN,2026-05-03,0.7479627574793994,positive,news,FDA Expanded Access Puts Revolution Medicines Daraxonrasib Thesis To The Test
AMGN,2026-05-02,0.9365966469049454,positive,news,Amgen Q1 2026: Revenue Grows 6% as Six Key Drivers Outpace Patent Losses
AMGN,2026-05-02,0.3519626799970865,neutral,news,Research Alert: CFRA Keeps Buy Rating On Shares Of Amgen Inc.
AMGN,2026-05-02,0.9339094962924719,positive,news,"Vanguard Group Inc. Raises Holdings in American Healthcare REIT, Inc. $AHR"
AMGN,2026-05-02,0.802266176789999,positive,news,Is Philip Morris International Stock Undervalued Stock Or Value Trap?
AMGN,2026-05-02,-0.5605577081441879,negative,news,"Analysts Have Conflicting Sentiments on These Healthcare Companies: Amgen (AMGN), Immunome (IMNM) and Resmed (RMD)"
AMGN,2026-05-02,-0.959689998999238,negative,news,Amgen Inc. $AMGN Shares Sold by Strs Ohio
AMGN,2026-05-02,-0.48760388791561127,negative,news,"Analysts Have Conflicting Sentiments on These Healthcare Companies: Amgen (AMGN), Immunome (IMNM) and Resmed (RMD)"
AMGN,2026-05-02,-0.5692091137170792,negative,news,"Analysts Have Conflicting Sentiments on These Healthcare Companies: Amgen (AMGN), Immunome (IMNM) and Resmed (RMD)"
AMGN,2026-05-02,-0.42676401138305664,negative,news,"PFA Pension Forsikringsaktieselskab Purchases Shares of 342,594 Amgen Inc. $AMGN"
AMGN,2026-05-02,-0.8935405313968658,negative,news,"Jennison Associates LLC Sells 91,343 Shares of Amgen Inc. $AMGN"
AMGN,2026-05-02,0.9387149568647146,positive,news,"Pictet Asset Management Holding SA Purchases 790,175 Shares of WAVE Life Sciences Ltd. $WVE"
AMGN,2026-05-02,-0.9503917070105672,negative,news,A Look At Regeneron Pharmaceuticals (REGN) Valuation After Recent Share Price Weakness
AMGN,2026-05-02,-0.9488009577617049,negative,news,ZLAB: Diversified Pipeline And DLL3 Partnerships Will Support Long-Term Expansion
AMGN,2026-05-02,-0.9323010705411434,negative,news,TWST - Twist Bioscience Corp Stock Price and Quote
AMGN,2026-05-02,-0.9638305995613337,negative,news,Amgen Inc (AMGN) Shares Fall 4.8% -- What GF Score of 93 Tells Investors
AMGN,2026-05-02,0.7737069651484489,positive,news,Amgen (AMGN) Margin Expansion In Q1 2026 Tests Cautious Growth Narratives
AMGN,2026-05-02,0.737104456871748,positive,news,Analysts Offer Insights on Healthcare Companies: Amgen (AMGN) and Icon (ICLR)
AMGN,2026-05-02,0.8980339877307415,positive,news,"Amgen Earnings Call Highlights Growth Engines, Tax Risk"
AMGN,2026-05-01,-0.9635856216773391,negative,news,Amgen Inc (AMGN) Shares Fall 4.8% -- What GF Score of 93 Tells Investors
MMM,2026-05-05,0.6935312747955322,positive,news,FedEx Stock Rebounds After Drop As Amazon Push Raises Competition Concerns
MMM,2026-05-05,-0.9638829929754138,negative,news,"ICICI Bank, L&T drag Nifty below 24,050; Sensex falls 252 points as rupee hits record low"
MMM,2026-05-05,0.9404679164290428,positive,news,3M Stock (US88579Y1010): Q1 2026 Earnings Beat Expectations with Adjusted EPS $2.85
MMM,2026-05-05,-0.9382756352424622,negative,news,Amazon Supply Chain Launch Triggers Massive Selloff for GXO and UPS Stocks
MMM,2026-05-05,-0.9569293577224016,negative,news,How Amazon's latest move triggered a global logistics stock selloff
MMM,2026-05-05,0.18503853399306536,neutral,news,"Engine Bay Cleaning Products Market Is Going to Boom | 3M, WD-40 Company, Zep Inc"
MMM,2026-05-05,0.3657540865242481,neutral,news,The Electric Revolution at Mercedes-Benz: HPQ Silicon and Cenovus Energy Deliver Range and Green Energy
MMM,2026-05-05,-0.952688124962151,negative,news,"Amazon.com, Inc. (AMZN.US) Opens Supply Chain Network; United Parcel Service, Inc. (UPS.US) and FedEx Corporation (FDX.US) Shares Plunge"
MMM,2026-05-05,0.5958423465490341,positive,news,"Amazon.com, Inc. (AMZN.US) Opens Supply Chain Network; United Parcel Service, Inc. (UPS.US) and FedEx Corporation (FDX.US) Shares Plunge"
MMM,2026-05-04,0.8675585980527103,positive,news,Amazon's New Offering Could Be Its Most Disruptive Since AWS
MMM,2026-05-04,0.024635015055537224,neutral,news,"3M CO (MMM) SVP exercises 1,441 RSUs; 517 shares withheld"
MMM,2026-05-04,-0.9386635776609182,negative,news,"UPS, FedEx shares plummet as Amazon opens up logistics network to other businesses"
MMM,2026-05-04,0.41393749974668026,neutral,news,Press Release: CooperCompanies Appoints Paul Keel to Its Board of Directors
MMM,2026-05-04,0.14325900003314018,neutral,news,"As annual meetings go virtual, Fastenal still makes it personal"
MMM,2026-05-04,0.65226249396801,positive,news,CooperCompanies appoints Paul Keel to board of directors By Investing.com
MMM,2026-05-04,0.28223849553614855,neutral,news,"Envista CEO Paul Keel joins CooperCompanies board, audit panel"
MMM,2026-05-04,0.011071158573031425,neutral,news,"3M (MMM) EVP Banovetz exercises 13,420 RSUs, with 6,120 shares for taxes"
MMM,2026-05-04,-0.060414280742406845,neutral,news,"3M (NYSE: MMM) CEO exercises 8,578 RSUs and withholds 3,912 shares for taxes"
MMM,2026-05-04,0.924887839704752,positive,news,Kodiak Gas Services (NYSE:KGS) Reaches New 52-Week High - Still a Buy?
MMM,2026-05-04,-0.9607383031398058,negative,news,"FedEx, UPS Shares Tumble on Amazon’s ‘Watershed’ Logistics Move"
MMM,2026-05-04,0.5642492324113846,positive,news,General Dynamics (NYSE:GD) Given New $313.00 Price Target at The Goldman Sachs Group
MMM,2026-05-04,0.926421046257019,positive,news,"UBS Adjusts Price Target on Textron to $100 From $99, Maintains Neutral Rating"
MMM,2026-05-04,-0.8791563995182514,negative,news,"Vanguard Group Inc. Has $661.56 Million Stock Holdings in Ormat Technologies, Inc. $ORA"
MMM,2026-05-04,-0.0024202223867177963,neutral,news,"JPMorgan Chase (NYSE: MMM) discloses 46.2M shares, 8.8% of 3M"
MMM,2026-05-04,0.5539729446172714,positive,news,EXCLUSIVE: FibroBiologics Targets 2026 Data Readout After Trial Progress For Diabetic Foot Ulcer Study
MMM,2026-05-04,0.8849307121708989,positive,news,"Sun Financial Inc Makes New $904,000 Investment in Deere & Company $DE"
MMM,2026-05-04,0.9049797467887402,positive,news,"Oppenheimer Asset Management Inc. Purchases 135,602 Shares of MDU Resources Group, Inc. $MDU"
MMM,2026-05-04,0.5274483021348715,positive,news,"Introducing Amazon Supply Chain Services: Amazon’s logistics network, now open to every business"
MMM,2026-05-04,0.5870359363034368,positive,news,"Amazon Launches Amazon Supply Chain Services, Opening Its Logistics Network to All Businesses"
MMM,2026-05-04,0.8443428250029683,positive,news,"FSA Advisors Inc. Purchases Shares of 10,152 3M Company $MMM"
MMM,2026-05-04,0.6875378908589482,positive,news,"Fluoropolymers Market: Asia-Pacific Leads; The Chemours Company, Daikin Industries Ltd. & Solvay S.A. Drive Growth"
MMM,2026-05-03,0.9286760576069355,positive,news,"VELA Investment Management LLC Makes New $3.10 Million Investment in Gildan Activewear, Inc. $GIL"
MMM,2026-05-03,0.8960824534296989,positive,news,"403,354 Shares in 3M Company $MMM Bought by PFA Pension Forsikringsaktieselskab"
MMM,2026-05-03,0.925840187817812,positive,news,"MDU Resources Group, Inc. (NYSE:MDU) Given Consensus Rating of ""Hold"" by Analysts"
MMM,2026-05-03,0.9386175908148289,positive,news,"iRhythm Technologies Q1 2026 Results Beat Revenue Expectations, Raise Full-Year Guidance"
MMM,2026-05-03,0.011452844366431236,neutral,news,"SOLV SEC Filings - Solventum Corporation 10-K, 10-Q, 8-K Forms"
MMM,2026-05-02,-0.6258735358715057,negative,news,3M Company PFAS Risk Returns As Wisconsin Greystone Tests Draw New Scrutiny
MMM,2026-05-02,0.8704089112579823,positive,news,JPMorgan Chase’s New Filing Shows the $31.4 Billion Number Investors Are Watching
MMM,2026-05-02,0.844706367701292,positive,news,MP Materials Stock Faces Rare Earth Test as China Supply Signals Shift Before Earnings
MMM,2026-05-02,0.9066814724355936,positive,news,Eaton Stock Just Hit a Fresh High. Tuesday’s Earnings May Decide What Comes Next
MMM,2026-05-02,0.8716112226247787,positive,news,RTX Stock Watch: Patriot Missile Work Mounts as U.S. Fast-Tracks $8.6 Billion Arms Sales
MMM,2026-05-02,-0.9250630456954241,negative,news,"US Bancorp DE Buys 60,356 Shares of Graco Inc. $GGG"
MMM,2026-05-02,0.3699425607919693,positive,news,Water hookups ordered near golf course built atop PFAS waste
MMM,2026-05-02,0.3318132506683469,neutral,news,"Hotels, Sustainability & Coffee: This Week’s Top Stories"
MMM,2026-05-02,0.9239775324240327,positive,news,McKesson (NYSE:MCK) Upgraded at Wall Street Zen
MMM,2026-05-02,0.6393947396427393,positive,news,Can Arista Networks Outrun Ciena in the Next Rally?
MMM,2026-05-02,-0.018820805475115776,neutral,news,MMM Price History for 3M Company Stock
MMM,2026-05-01,-0.8039838224649429,negative,news,"Short Interest in Guardant Health, Inc. (NASDAQ:GH) Decreases By 15.0%"
MMM,2026-05-01,-0.921972912736237,negative,news,"Worker sues 3M, alleges ""wheelchair ramp"" remark and firing after harassment report"
MMM,2026-05-01,0.9335977043956518,positive,news,"First Solar, Inc. (NASDAQ:FSLR) Q1 2026 Earnings Call Transcript"
SLB,2026-05-05,-0.9350047260522842,negative,news,RNC Capital Management LLC Lowers Stake in SLB Limited $SLB
SLB,2026-05-05,-0.9476993158459663,negative,news,"Highland Capital Management LLC Sells 38,048 Shares of SLB Limited $SLB"
SLB,2026-05-05,0.8986873924732208,positive,news,Icahn Enterprises (IEP) Q1 Earnings Report Preview: What To Look For
SLB,2026-05-04,0.862941118888557,positive,news,Argus Lifts SLB Price Target to $66 From $58
SLB,2026-05-04,0.9405435770750046,positive,news,ConocoPhillips Gains Strength Amid NYSE Composite Momentum
SLB,2026-05-04,0.8821751549839973,positive,news,Amcor Stock Outlook: Is Wall Street Bullish or Bearish?
SLB,2026-05-04,0.8157962057739496,positive,news,"Baker Hughes, Halliburton, SLB win Equinor drilling and well services contracts on Norwegian shelf"
SLB,2026-05-04,0.9062602426856756,positive,news,Equinor commits $1.6 billion to drilling activity on Norwegian Continental Shelf
SLB,2026-05-04,-0.9488034956157207,negative,news,SLB stock wavers after earnings. How the Iran war disrupted its recovery.
SLB,2026-05-04,-0.9322201441973448,negative,news,Investors brace for Expro earnings amid industry headwinds By Investing.com
SLB,2026-05-04,-0.039608268067240715,neutral,news,"Slb Limited/nv Insider Sold Shares Worth $2,998,766, According to a Recent SEC Filing"
SLB,2026-05-04,0.9310550205409527,positive,news,"Equinor extends drilling, well services contracts for $1.8 billion"
SLB,2026-05-04,0.9197839871048927,positive,news,A Look At Helmerich & Payne (HP) Valuation As Geopolitical Tensions Lift Oil And Gas Prices
SLB,2026-05-03,0.3599194139242172,neutral,news,Is Dow Inc Stock Worth Watching After Recent Losses
SLB,2026-05-03,0.9337767055258155,positive,news,Will SLB's (SLB) Digital Bets and Completed Buyback Shift Its Balanced Investment Narrative?
SLB,2026-05-02,0.9152858313173056,positive,news,Cenovus Energy Inc $CVE Shares Bought by Vanguard Group Inc.
SLB,2026-05-01,0.8628893867135048,positive,news,"Great Elm Capital Corp Today's Market Trends | GECC Stock Real-Time Quotes, Trading Strategies & Related Analysis | TradingKey"
SLB,2026-05-01,0.011391784995794296,neutral,news,"Slb EVP, geographies Steve Gassen sells $2.99m in shares"
SLB,2026-05-01,0.006335096433758736,neutral,news,EVP Steve Gassen (NYSE: SLB) exercises options and sells shares
