ticker,date,sentiment_score,sentiment_label,content_type,title
UPS,2026-05-06,-0.9018630441278219,negative,news,Delta Air Lines Cuts Snacks On Short Flights
UPS,2026-05-06,-0.9628102462738752,negative,news,UPS Stock Slides As Amazon Launches Supply Chain Platform
UPS,2026-05-06,0.18259851075708866,neutral,news,Sen. Grassley visits North Liberty trucking company
UPS,2026-05-05,0.24294888973236084,positive,news,There May Be Reason For Hope In United Parcel Service's (NYSE:UPS) Disappointing Earnings
UPS,2026-05-05,0.9323261212557554,positive,news,"Earnings Flash (GXO) GXO Logistics, Inc. Reports Q1 Revenue $3.30B, vs. FactSet Est of $3.22B"
UPS,2026-05-05,0.7848529033362865,positive,news,"FedEx, ServiceNow expand collaboration on supply chain tools"
UPS,2026-05-05,0.7518083825707436,positive,news,"UPS Tries To Stabilize As Amazon's Logistics Update Slams Stock - Amazon.com (NASDAQ:AMZN), United Parcel"
UPS,2026-05-05,0.8943099826574326,positive,news,Is Amazon.com (AMZN) One of the Best Blue Chip Stocks to Invest in According to Billionaires?
UPS,2026-05-05,0.9359590522944927,positive,news,BMO Capital Markets Issues Positive Forecast for Old Dominion Freight Line (NASDAQ:ODFL) Stock Price
UPS,2026-05-05,-0.9382756352424622,negative,news,Amazon Supply Chain Launch Triggers Massive Selloff for GXO and UPS Stocks
UPS,2026-05-05,-0.9210305064916611,negative,news,"Amazon.com, Inc. (AMZN.US) Opens Supply Chain Network; United Parcel Service, Inc. (UPS.US) and FedEx Corporation (FDX.US) Shares Plunge"
UPS,2026-05-05,0.17627363465726376,neutral,news,"Truckload Freight Service Market Is Going to Boom | J.B. Hunt Transport Services, Schneider National"
UPS,2026-05-05,-0.9569293577224016,negative,news,How Amazon's latest move triggered a global logistics stock selloff
UPS,2026-05-05,0.8941655158996582,positive,news,"UPS and FedEx: Amazon's For-Hire Delivery Push Becomes Reality, but Risk Manageable"
UPS,2026-05-05,-0.9263213183730841,negative,news,US Stock Market: Amazon.com Inc. logistics expansion sparks broad selloff in US transport stocks
UPS,2026-05-05,-0.2429993338882923,neutral,news,"Hut 8 chief legal officer Victor Semah sells $808,149 in stock"
UPS,2026-05-05,-0.952688124962151,negative,news,"Amazon.com, Inc. (AMZN.US) Opens Supply Chain Network; United Parcel Service, Inc. (UPS.US) and FedEx Corporation (FDX.US) Shares Plunge"
UPS,2026-05-05,0.5958423465490341,positive,news,"Amazon.com, Inc. (AMZN.US) Opens Supply Chain Network; United Parcel Service, Inc. (UPS.US) and FedEx Corporation (FDX.US) Shares Plunge"
UPS,2026-05-04,-0.7744733616709709,negative,news,"Amazon.com, Inc. (AMZN.US) Opens Supply Chain Network; United Parcel Service, Inc. (UPS.US) and FedEx Corporation (FDX.US) Shares Plunge"
UPS,2026-05-04,-0.9585642088204622,negative,news,Old Dominion Freight Line Inc. stock underperforms Monday when compared to competitors
UPS,2026-05-04,0.16899427399039268,neutral,news,"UPS' Package Margins Still Pressured, but Cost Takeout on Track"
UPS,2026-05-04,-0.9662720956839621,negative,news,"FedEx, UPS shares sink on ‘watershed’ Amazon logistics move"
UPS,2026-05-04,-0.953466696664691,negative,news,"FedEx, RXO, and United Parcel Service Shares Are Falling, What You Need To Know"
UPS,2026-05-04,-0.8229990005493164,negative,news,"Heartland Express and Expeditors Stocks Trade Down, What You Need To Know"
UPS,2026-05-04,-0.8123910203576088,negative,news,"Stock Market Today: SPY, QQQ Pull Back as Middle East Tensions Ramp Oil Prices"
UPS,2026-05-04,-0.9386635776609182,negative,news,"UPS, FedEx shares plummet as Amazon opens up logistics network to other businesses"
SLB,2026-05-11,0.9212588472291827,positive,news,OneSubsea targets next-gen technologies with purchase of Norwegian subsea business
SLB,2026-05-11,0.9329533940181136,positive,news,SLB OneSubsea Completes Acquisition of Subsea Business of Envirex Group AS
SLB,2026-05-11,0.8434758614748716,positive,news,"Nwam LLC Acquires Shares of 75,089 SLB Limited $SLB"
SLB,2026-05-11,0.9291892861947417,positive,news,Bernstein Adjusts Price Target on SLB to $71 From $56.10
SLB,2026-05-10,-0.5260347574949265,negative,news,A Look At Veralto (VLTO) Valuation After Q1 2026 Beat Guidance Raise And Capital Deployment
SLB,2026-05-10,0.1317482814192772,neutral,news,Discipline and Rules-Based Execution in SLB Response
SLB,2026-05-10,0.9388188095763326,positive,news,Nwam LLC Makes New Investment in Halliburton Company $HAL
SLB,2026-05-10,-0.9542412599548697,negative,news,Manning & Napier Advisors LLC Has $6.32 Million Stake in SLB Limited $SLB
SLB,2026-05-09,0.9119539745151997,positive,news,"SLB, Baker Hughes CEOs warn Iran war will reshape global energy markets"
SLB,2026-05-09,0.877562876790762,positive,news,"RPC, Inc. (NYSE:RES) Q1 2026 Earnings Call Transcript"
SLB,2026-05-09,-0.32686328887939453,negative,news,Generali Asset Management SPA SGR Grows Position in SLB Limited $SLB
SLB,2026-05-09,0.36159249767661095,neutral,news,Why Is SLB Stock Trending Right Now
SLB,2026-05-09,0.9003962837159634,positive,news,"SLB Limited (NYSE:SLB) Given Consensus Recommendation of ""Moderate Buy"" by Analysts"
SLB,2026-05-09,-0.939691124483943,negative,news,Cheniere Energy Partners (NYSE:CQP) Stock Price
SLB,2026-05-08,0.8710552668198943,positive,news,Viavi Solutions Stock Gains Focus Amid Nasdaq Market Rotation
SLB,2026-05-08,0.9365190137177706,positive,news,Halliburton Stock (US4062161017): Analyst Upgrade and Strong Q1 2026 Results Drive Investor Interest
SLB,2026-05-08,-0.9623166136443615,negative,news,SLB Limited $SLB is Olstein Capital Management L.P.'s 9th Largest Position
SLB,2026-05-08,0.9210116863250732,positive,news,Principal Financial Group Inc. Raises Holdings in SLB Limited $SLB
SLB,2026-05-08,0.9389084074646235,positive,news,ASR Vermogensbeheer N.V. Boosts Holdings in SLB Limited $SLB
SLB,2026-05-08,-0.8691330496221781,negative,news,TechnipFMC (NYSE:FTI) - Stock Analysis
SLB,2026-05-07,-0.9595319861546159,negative,news,"SLB (NYSE:SLB) Director Sells $108,660.00 in Stock"
SLB,2026-05-07,0.15794118493795395,neutral,news,"Slb director Patrick de La Chevardiere sells $108,660 in shares"
SLB,2026-05-07,-0.31429123505949974,neutral,news,"SLB (SLB) director trims holdings with 2,000-share stock sale"
SLB,2026-05-07,-0.021502824500203133,neutral,news,"SLB director files Form 144: 2,000 shares on Mar 25 and 2,000 on Mar 26 (SLB)"
SLB,2026-05-07,-0.13602010160684586,neutral,news,[IRANNOTICE] SLB LIMITED/NV SEC Filing
SLB,2026-05-07,-0.9172476138919592,negative,news,Schlumberger stock price forecast: $52.50 support in focus as SLB loses 3.37%
SLB,2026-05-07,0.859451818279922,positive,news,Innovation Factori Beijing: Digital transformation of underground gas storage
SLB,2026-05-07,-0.004496738314628601,neutral,news,EQT (NYSE:EQT) Stock Price
SLB,2026-05-07,0.8665796993300319,positive,news,Barclays Adjusts Price Target on SLB to $66 From $51
SLB,2026-05-07,0.8329210602678359,positive,news,Premier Fund Managers Ltd Invests $9.89 Million in SLB Limited $SLB
SLB,2026-05-07,-0.8677637279033661,negative,news,"Lmcg Investments LLC Sells 31,936 Shares of SLB Limited $SLB"
SLB,2026-05-07,0.935100331902504,positive,news,Here is why AerCap (AER) is Among the 10 Best European Stocks That Beat Earnings Estimates to Buy
SLB,2026-05-07,0.926859037950635,positive,news,Mitsubishi UFJ Asset Management Co. Ltd. Raises Stock Holdings in SLB Limited $SLB
SLB,2026-05-07,0.849818529561162,positive,news,Innovation Factori Beijing: Digital transformation of underground gas storage
SLB,2026-05-07,0.9388474598526955,positive,news,Ormat Technologies Reports First Quarter 2026 Financial Results
SLB,2026-05-07,0.8671297840774059,positive,news,1 Energy Stock Worth Your Attention and 2 We Question
SLB,2026-05-06,0.037595237605273724,neutral,news,"After 25 years leading Tenaris, Paolo Rocca leaves CEO post for COO"
SLB,2026-05-06,0.9360822290182114,positive,news,Higher output and asset sale reshape SM Energy (NYSE: SM)
SLB,2026-05-06,-0.9537924760952592,negative,news,Why Halliburton (HAL) Shares Are Trading Lower Today
SLB,2026-05-06,0.06994293257594109,neutral,news,Tips and tricks: Converging equilibrium towers
SLB,2026-05-06,0.2838155319914222,neutral,news,The beauty of choosing purpose over convenience
SLB,2026-05-06,0.13096689898520708,neutral,news,It’s not your father’s wireline anymore…
SLB,2026-05-06,0.3307288885116577,positive,news,SLB Ltd. stock outperforms competitors despite losses on the day
SLB,2026-05-06,0.3577333511784673,neutral,news,OptiFlow
SLB,2026-05-06,0.9190561566501856,positive,news,Sldc awarded a two-rig drilling contract by SLB in Kuwait
SLB,2026-05-06,0.9319627434015274,positive,news,"Privium Fund Management B.V. Purchases 19,108 Shares of SLB Limited $SLB"
SLB,2026-05-06,-0.9234462529420853,negative,news,"Four Days Left Until RPC, Inc. (NYSE:RES) Trades Ex-Dividend"
SLB,2026-05-06,-0.8732201075181365,negative,news,Horizon Investments LLC Has $1.87 Million Stock Holdings in SLB Limited $SLB
SLB,2026-05-06,-0.605034850537777,negative,news,Smart Sand (Nasdaq:SND) - Stock Analysis
SLB,2026-05-05,0.9268401935696602,positive,news,Helmerich Payne earnings up next: Can losses narrow?
T,2026-05-11,0.9298240691423416,positive,news,AT&T stock (US00206R1023): Latest developments and business overview
T,2026-05-11,0.6756046283990145,positive,news,"Preparing for The Quantum Era: AT&T Business Debuts Post-Quantum Cryptography Secure SD-WAN, Powered by Cisco"
T,2026-05-11,0.06715500075370073,neutral,news,"Verizon offers bondholders cash exits, $50 extra for early tenders"
T,2026-05-11,0.9331054352223873,positive,news,"Swiss Life Asset Management Ltd Acquires 656,706 Shares of AT&T Inc. $T"
T,2026-05-11,-0.8658798784017563,negative,news,AT&T Inc. $T Shares Sold by Securian Asset Management Inc.
T,2026-05-11,0.9094744315370917,positive,news,American Airlines Eyes Record 75 Million Passengers This Summer
T,2026-05-10,0.8446160750463605,positive,news,American Airlines is ready for a record-breaking summer travel season in 2026
T,2026-05-10,0.9401293117552996,positive,news,Why 25 of 29 Analysts Back T-Mobile Stock With a $263 Mean Price Target in 2026
T,2026-05-10,0.9340884108096361,positive,news,Osprey Private Wealth LLC Has $2.38 Million Position in Verizon Communications Inc. $VZ
T,2026-05-09,0.9293354898691177,positive,news,AT&T: Locking In A 6.2-6.3% Yield With Baby Bonds And Preferred Stock (NYSE:T)
T,2026-05-09,0.9377631451934576,positive,news,T-Mobile US Inc. stock (US8725901040): Q1 beat and broadband push lift TMUS shares
T,2026-05-09,-0.9144143462181091,negative,news,Crown Castle Inc. stock (US22822V1017): Tower and fiber operator faces pressure from rate cuts and capex plans
T,2026-05-09,0.9389113299548626,positive,news,"T-Mobile US, Inc. stock (US8725901040): Earnings beat and subscriber growth drive shares higher in 2"
T,2026-05-09,0.9309497745707631,positive,news,MGO One Seven LLC Boosts Holdings in AT&T Inc. $T
T,2026-05-09,-0.038146764039993286,negative,news,AT&T Inc. $T Shares Sold by Generali Asset Management SPA SGR
T,2026-05-09,0.6373007586225867,positive,news,Majority owner TDS moves to buy the rest of Array in stock deal
T,2026-05-09,0.9284889632835984,positive,news,AT&T Inc. $T Shares Purchased by Crossmark Global Holdings Inc.
T,2026-05-09,0.7369948253035545,positive,news,AT&T Inc. stock (US00206R1023): Q1 beats and guidance keep focus on convergence story
T,2026-05-09,0.9202477429062128,positive,news,$45B for dividends and buybacks: AT&T sticks with 2026-2028 plan
T,2026-05-08,-0.9490126296877861,negative,news,"'Uncertainty' weighs on Telus results, but company hopeful AI can bring new revenue"
T,2026-05-08,0.6648196633905172,positive,news,Array Digital's Run as a Public Firm Is Nearing the End
T,2026-05-08,0.8486102232709527,positive,news,JPMorgan Chase provides AT&T with large loan for construction of new HQ campus
T,2026-05-08,0.9311074120923877,positive,news,AT&T Leads in the 2026 Gartner® Critical Capabilities for Global WAN Services Research with Highest Use Case Score
T,2026-05-08,-0.962661124765873,negative,news,Telus reports first-quarter profit and revenue down from year ago
T,2026-05-08,-0.9399786163121462,negative,news,"Engineer says AT&T unit fired him for flagging slurs, suspected fraud"
T,2026-05-08,0.052343202754855156,neutral,news,"(AD) Array Digital Infrastructure Expects 2026 Total Operating Revenue Range $200M-$215M, vs. FactSet Est of $209.M"
T,2026-05-08,0.28961489349603653,neutral,news,"[10-Q] ARRAY DIGITAL INFRASTRUCTURE, INC. Quarterly Earnings Report"
T,2026-05-08,0.5356336496770382,positive,news,Array Digital (NYSE: AD) Q1 profit surges as spectrum deals close
T,2026-05-08,0.9344982840120792,positive,news,International Assets Investment Management LLC Boosts Position in AT&T Inc. $T
T,2026-05-08,-0.9558825828135014,negative,news,Telus reports first-quarter profit and revenue down from year ago
T,2026-05-08,0.9238951420411468,positive,news,Verizon Communications Inc. $VZ Shares Bought by Sequoia Financial Advisors LLC
T,2026-05-08,0.865820461884141,positive,news,"AT&T to Webcast Fireside Chat with John Stankey at the 2026 J.P. Morgan Global Technology, Media and Communications Conference on May 19"
T,2026-05-08,0.9412020724266768,positive,news,Motorola Solutions Q1 2026 Earnings Call Transcript
T,2026-05-08,-0.8355483487248421,negative,news,Charter Second Line Launch Tests Mobile Growth Hopes After Share Slump
T,2026-05-08,0.9134681290015578,positive,news,"Generali Asset Management SPA SGR Purchases 40,394 Shares of Verizon Communications Inc. $VZ"
T,2026-05-08,0.6919285533949733,positive,news,AT&T Expands Kris Levin-Snow’s Role to Include DIB Portfolio
T,2026-05-08,0.12175535224378109,neutral,news,Lumen Technologies (NYSE:LUMN) - Stock Analysis
T,2026-05-08,0.9152798103168607,positive,news,AT&T Fiber expands into more Lafayette-area homes and business
T,2026-05-08,0.8910703836008906,positive,news,Qualcomm Expands Open RAN Leadership Role by Joining OCUDU Ecosystem Foundation
T,2026-05-07,0.9028167882934213,positive,news,TELUS and Powerfleet launch exclusive AI-powered Vision 360 technology to address new Canadian safety mandates
T,2026-05-07,-0.9503941591829062,negative,news,"TELUS Corp. stock remains steady Thursday, still outperforms market"
T,2026-05-07,0.7201460301876068,positive,news,Crown Castle (NYSE: CCI) pivots to towers with $8.4B fiber sale
T,2026-05-07,-0.9665878834202886,negative,news,AT&T Inc. stock underperforms Thursday when compared to competitors
T,2026-05-07,0.795330386608839,positive,news,IHS Towers completes fiber exit in Brazil amid major portfolio overhaul
T,2026-05-07,0.6966074137017131,positive,news,"IQSTEL CEO goes live today to discuss AI, digital health and growth"
T,2026-05-07,0.9376758262515068,positive,news,"Swedbank AB Purchases 80,794 Shares of AT&T Inc. $T"
T,2026-05-07,-0.2657625079154968,negative,news,Verizon Communications (NYSE:VZ) - Stock Analysis
T,2026-05-07,-0.9097754508256912,negative,news,Vodafone Group (Nasdaq:VOD) - Stock Analysis
T,2026-05-07,-0.931432705372572,negative,news,"Bokf Na Sells 35,761 Shares of Verizon Communications Inc. $VZ"
CL,2026-05-11,0.8059165580198169,positive,news,Colgate-Palmolive stock (US1941621039): Dividend hike and upcoming payout
CL,2026-05-11,-0.22290575876832008,neutral,news,"Colgate-Palmolive (India) Schedules Board Meeting on May 22, 2026 to Approve FY26 Audited Results and Consider Dividend"
CL,2026-05-11,0.0786663293838501,positive,news,A Look At Spectrum Brands Holdings (SPB) Valuation After Recent Share Price Volatility
CL,2026-05-10,0.013498574495315552,positive,news,The Bull Case For Church & Dwight (CHD) Could Change Following Flat Q1 Results And Rising E-Commerce Mix
CL,2026-05-10,-0.9039717800915241,negative,news,"Oxbow Advisors LLC Sells 34,327 Shares of Colgate-Palmolive Company $CL"
CL,2026-05-10,-0.9519739467650652,negative,news,Colgate-Palmolive Stock: Too Expensive For A Defensive Firm (NYSE:CL)
CL,2026-05-10,0.45091694593429565,positive,news,Crossmark Global Holdings Inc. Trims Stake in Colgate-Palmolive Company $CL
CL,2026-05-09,-0.9482057206332684,negative,news,There May Be Some Bright Spots In Colgate-Palmolive's (NYSE:CL) Earnings
CL,2026-05-09,0.6413920521736145,positive,news,There May Be Some Bright Spots In Colgate-Palmolive's (NYSE:CL) Earnings
CL,2026-05-09,0.936917195096612,positive,news,Sequoia Financial Advisors LLC Boosts Holdings in Colgate-Palmolive Company $CL
CL,2026-05-09,0.9314285423606634,positive,news,Unilever plc stock (GB00B10RZP78): Q1 sales beat and buyback amid break-up plan
CL,2026-05-08,0.697948569431901,positive,news,Colgate-Palmolive wins Compliance Week’s Rising Star 2025
CL,2026-05-08,-0.7767067831009626,negative,news,NLPC Rips Colgate-Palmolive at Annual Meeting for Clinging to DEI
CL,2026-05-08,-0.4017172157764435,negative,news,"Truist Financial Corp Sells 20,560 Shares of Colgate-Palmolive Company $CL"
CL,2026-05-08,0.9045180222019553,positive,news,Principal Financial Group Inc. Has $77.15 Million Position in Colgate-Palmolive Company $CL
CL,2026-05-08,0.9053685516119003,positive,news,Colgate-Palmolive (CL) Valuation Check After Q1 Earnings Beat And Reaffirmed Sales Guidance
CL,2026-05-08,0.9326629973948002,positive,news,Colgate-Palmolive’s Q1 Earnings Call: Our Top 5 Analyst Questions
CL,2026-05-08,-0.029748568311333656,neutral,news,Dividend calendar of ardmore shipping corp.
CL,2026-05-08,-0.9396432694047689,negative,news,"Earnings call transcript: APA Corp Q1 2026 beats estimates, stock dips By Investing.com"
CL,2026-05-07,-0.02899783104658127,neutral,news,Dividend calendar of triple flag precious metals corp.
CL,2026-05-07,-0.3582639694213867,negative,news,"Earnings call transcript: Goodyear Q1 2026 shows mixed results, stock dips"
CL,2026-05-07,0.05592702887952328,neutral,news,"Compared to estimates, Colgate-Palmolive (CL) Q1 earnings: A look at key metrics"
CL,2026-05-07,-0.9559745881706476,negative,news,Procter & Gamble Stock Is Down 14% From Its 52-Week High: Here’s the Path to $176 by 2028
CL,2026-05-07,0.16067084670066833,positive,news,Premier Fund Managers Ltd Decreases Stock Position in Colgate-Palmolive Company $CL
CL,2026-05-07,0.9333414696156979,positive,news,Mitsubishi UFJ Asset Management Co. Ltd. Increases Holdings in Colgate-Palmolive Company $CL
CL,2026-05-07,0.9241332411766052,positive,news,Colgate-Palmolive’s Q1 Earnings Call: Our Top 5 Analyst Questions
CL,2026-05-07,0.6496030390262604,positive,news,Bokf Na Has $6.77 Million Stock Position in Colgate-Palmolive Company $CL
CL,2026-05-06,-0.8816902562975883,negative,news,Spectrum Brands And Oaktree Deal Refocuses Value On Home And Personal Care
CL,2026-05-06,0.6129518672823906,positive,news,"Kimberly Clark VP Andrew Scribner sells $401,310 in stock"
CL,2026-05-06,0.5485552400350571,positive,news,Edgewell Personal Care Releases Q2 2026 Financial Results
CL,2026-05-06,0.8685464207082987,positive,news,"CEO pay, bonuses and board proposals at Movado Group (NYSE: MOV)"
CL,2026-05-06,0.020173847675323486,neutral,news,Analysts Offer Insights on Consumer Goods Companies: Colgate-Palmolive (CL) and Costco (COST)
CL,2026-05-06,-0.7371300309896469,negative,news,Analysts Offer Insights on Consumer Goods Companies: Colgate-Palmolive (CL) and Costco (COST)
CL,2026-05-06,0.8272924348711967,positive,news,Swedbank AB Has $330.34 Million Stake in Colgate-Palmolive Company $CL
CL,2026-05-06,0.5000108927488327,positive,news,Is Colgate Palmolive (CL) Price Still Attractive After Modest Recent Gains?
CL,2026-05-05,0.9039877951145172,positive,news,enpro inc. Positive Earnings Pre-Announcements
CL,2026-05-05,0.9326025657355785,positive,news,Barclays Forecasts Strong Price Appreciation for Colgate-Palmolive (NYSE:CL) Stock
CL,2026-05-05,0.9362303055822849,positive,news,Varma Mutual Pension Insurance Co Boosts Holdings in Colgate-Palmolive Company $CL
CL,2026-05-05,-0.039817243814468384,negative,news,"Intact Investment Management Inc. Sells 65,100 Shares of Colgate-Palmolive Company $CL"
CL,2026-05-05,0.6274613877758384,positive,news,"23,217 Shares in Colgate-Palmolive Company $CL Acquired by PFA Pension Forsikringsaktieselskab"
CL,2026-05-05,-0.7629195153713226,negative,news,Procter & Gamble (NYSE:PG) - Stock Analysis
CL,2026-05-04,0.9232368748635054,positive,news,JPMorgan Chase & Co. Issues Positive Forecast for Colgate-Palmolive (NYSE:CL) Stock Price
CL,2026-05-04,0.7125469744205475,positive,news,"Colgate-Palmolive Maintained 2026 Earnings Guidance Despite Shrinking Gross Margins, UBS Says"
CL,2026-05-04,0.9331610575318336,positive,news,Can PG's Cost Discipline Neutralize Weak Consumer Volumes?
CL,2026-05-04,0.8016401529312134,positive,news,"Colgate-Palmolive's (CL) ""Outperform"" Rating Reaffirmed at Royal Bank Of Canada"
CL,2026-05-04,0.937499200925231,positive,news,JPMorgan Lifts Colgate Price Target to $96: Why Emerging Markets Are Powering the Defensive Trade
CL,2026-05-04,0.9371942803263664,positive,news,UBS raises Colgate-Palmolive stock price target on strong quarter
CL,2026-05-04,0.9211160019040108,positive,news,UBS raises Colgate-Palmolive stock price target on strong quarter
CL,2026-05-04,0.9365924149751663,positive,news,UBS raises Colgate-Palmolive stock price target on strong quarter By Investing.com
CL,2026-05-04,0.9377132374793291,positive,news,"B. Riley Raises Price Target on Bandwidth to $55 From $27, Keeps Buy Rating"
SO,2026-05-11,0.9298104792833328,positive,news,Vistra Q1 Earnings Beat Estimates as Hedging Fortifies Visibility
SO,2026-05-11,0.7693096995353699,positive,news,Is Wall Street Underestimating This Under-The-Radar AI Stock Pick in Cathie Wood’s Portfolio?
SO,2026-05-11,0.7691631428897381,positive,news,Southern Company stock (US8425871071): Powering US homes with regulated utilities
SO,2026-05-11,0.9241442661732435,positive,news,Teradyne (TER) Could Be In The Next Phase Of AI Investing
SO,2026-05-11,-0.3019138537347317,neutral,news,Make DTE Pay Act would penalize utility companies for pollution violations
SO,2026-05-11,0.9364245310425758,positive,news,The Southern Company (SO) Price Target Raised Following Better-than-Expected Q1 Report
SO,2026-05-10,0.8699712390080094,positive,news,Georgia Power adding resiliency to coastal electric grid
SO,2026-05-10,0.0069578103721141815,neutral,news,"DUK SEC Filings - Duke Energy Corp 10-K, 10-Q, 8-K Forms"
SO,2026-05-10,-0.7188902124762535,negative,news,"Two Years After Completion, Plant Vogtle Still Looms Over the Nuclear Debate"
SO,2026-05-09,-0.028003506362438202,neutral,news,AEP - American Electric Power Company Inc Stock Price and Quote
SO,2026-05-09,-0.2807123064994812,negative,news,NextEra Energy (NEE) AI Power Bet Hits Kansas Data Center Snag
SO,2026-05-09,0.9034373620525002,positive,news,Crossmark Global Holdings Inc. Has $24.68 Million Stock Holdings in Southern Company (The) $SO
SO,2026-05-09,0.9293488450348377,positive,news,Southern Company stock (US8425871071): Dividend hike and earnings outlook in focus for US investors
SO,2026-05-09,0.9349857941269875,positive,news,Raymond James Raises its Price Target on Southern Company (SO) to $104
SO,2026-05-08,-0.9182702880352736,negative,news,Georgia Power hearings at PSC reveal data centers aren’t paying their fair share for fuel
SO,2026-05-08,0.9375343695282936,positive,news,"Southern Company Stock (US8425871071): Q1 Earnings Beat on Rising Power Usage, Shares Up 3.4% on Apr"
SO,2026-05-08,-0.7682061996310949,negative,news,Advocates question Georgia Power fuel rates amid data center boom
SO,2026-05-08,-0.8321504518389702,negative,news,Advocates question Georgia Power fuel rates amid data center boom
SO,2026-05-07,-0.918798653408885,negative,news,Advocates question Georgia Power fuel rates amid data center boom
SO,2026-05-07,-0.01617501489818096,neutral,news,Is most-watched stock Southern Company (The) (SO) worth betting on now?
SO,2026-05-07,0.9359252564609051,positive,news,"Nanobiotix Shares Hit a Record High of €38.40, Up 7.61%"
SO,2026-05-07,0.9347088821232319,positive,news,Southern Company (The) $SO Shares Bought by Mitsubishi UFJ Asset Management Co. Ltd.
SO,2026-05-07,-0.95612807944417,negative,news,Providence First Trust Co Lowers Stock Position in Southern Company (The) $SO
SO,2026-05-07,0.9243010729551315,positive,news,Principal Financial Group Inc. Raises Stock Holdings in Southern Company (The) $SO
SO,2026-05-07,-0.01250690221786499,neutral,news,Georgia Power urges storm preparation as severe weather approaches
SO,2026-05-07,0.8634830210357904,positive,news,Georgia Power Begins Construction of Battery Storage System : CEG
SO,2026-05-06,-0.9668038496747613,negative,news,Southern Co. stock underperforms Wednesday when compared to competitors
SO,2026-05-06,0.7955169174820185,positive,news,Ted Turner helped launch Southern Company’s first utility-scale solar
SO,2026-05-06,-0.0331380870193243,neutral,news,Georgia Power breaks ground on electricity plant to serve data centers
SO,2026-05-06,0.2079911744222045,neutral,news,Georgia Power encourages customers to be storm ready this May
SO,2026-05-06,0.9321370562538505,positive,news,Nuclear reaches 41% of TVA’s power supply
SO,2026-05-06,0.7890297025442123,positive,news,"For the first time ever, the average annual salary of a public power generation company exceeded 100.."
SO,2026-05-06,0.935158496722579,positive,news,Southern Company Electricity Sales Rise on Data Center Demand Surge
SO,2026-05-05,0.9260256690904498,positive,news,Georgia Power strengthens coastal grid with major upgrades across Savannah region
SO,2026-05-05,0.9386117123067379,positive,news,Does DOE Loans and 25th Dividend Hike Change The Bull Case For Southern (SO)?
SO,2026-05-05,0.9132140167057514,positive,news,TC Energy approves U.S. gas expansion after strong quarter
SO,2026-05-05,0.9381959401071072,positive,news,Why Southern Company (SO) Is Riding Data Center Power Demand
SO,2026-05-05,0.9291493482887745,positive,news,"TVA interim President talks revenues, plans for the future in Quarterly Report"
