ticker,date,sentiment_score,sentiment_label,content_type,title
AAPL,2026-02-03,-0.6853221952915192,negative,news,"December CRE deal volume sinks further, but office is a surprising bright spot"
AAPL,2026-02-03,0.8389211148023605,positive,news,Qualcomm Inc. (QCOM): Navigating Global Smartphone Challenges with 5G and IoT Strength
AAPL,2026-02-03,0.7911689933389425,positive,news,Is AXT’s New Independent Audit Chair a Turning Point for AXTI’s Governance and AI Ambitions?
AAPL,2026-02-03,0.7114618420600891,positive,news,"Jim Cramer Notes ""Western Digital Stock Has Been One of the Best Performers of This Era"""
AAPL,2026-02-03,0.5318551426753402,positive,news,Apple CarPlay Ultra Is Finally Coming To Another Car This Year
AAPL,2026-02-03,0.822014108300209,positive,news,PayPal stock jumps in premarket ahead of Q4 earnings: what investors watch today
AAPL,2026-02-03,0.9152978342026472,positive,news,"VeriSign, Inc. $VRSN Shares Purchased by Cornerstone Planning Group LLC"
AAPL,2026-02-03,-0.9253350496292114,negative,news,Apple Inc. $AAPL Shares Sold by Washington Trust Bank
AAPL,2026-02-03,0.9264315199106932,positive,news,"National Pension Service Has $45.64 Million Position in VeriSign, Inc. $VRSN"
AAPL,2026-02-03,0.23566761054098606,neutral,news,The Truth About Life360 Inc: Is This Tracking App Actually Worth Your Money?
AAPL,2026-02-03,-0.9564479468390346,negative,news,Intel Corporation $INTC Shares Sold by Heritage Investors Management Corp
AAPL,2026-02-03,-0.9295488372445107,negative,news,Apple Inc. $AAPL is Bristlecone Advisors LLC's 4th Largest Position
AAPL,2026-02-03,0.3779835104942322,positive,news,Apple CEO Tim Cook Just Gave Great News to Micron Investors
AAPL,2026-02-03,0.9350703116506338,positive,news,Apple Inc. $AAPL Shares Acquired by Solidarity Wealth LLC
AAPL,2026-02-03,-0.9635134469717741,negative,news,Opera (OPRA) Is Down 9.8% After Raising 2025 Revenue Guidance Above US$608 Million - What's Changed
AAPL,2026-02-03,-0.8269971534609795,negative,news,Universal Technical Institute (UTI) Reports Q4: Everything You Need To Know Ahead Of Earnings
AAPL,2026-02-03,0.5456570237874985,positive,news,PayPal Acquires Cymbio Amid Competitive Pressures
AAPL,2026-02-03,0.9135369844734669,positive,news,TSMC’s US$165b US Chip Bet And The New Taiwan US Tariff Deal
AAPL,2026-02-02,0.04671810660511255,neutral,news,3 Cheap Stocks to Buy Now as Small Caps Heat Up
AAPL,2026-02-02,0.6067698914557695,positive,news,LifeLock Tax Scam Alert Highlights Gen Digital Identity Protection Role
AAPL,2026-02-02,0.9351480137556791,positive,news,Why Is Expedia (EXPE) Stock Soaring Today
AAPL,2026-02-02,0.911180766299367,positive,news,Key facts: Apple gains in India; launches new AirTag; acquires Q.ai
AAPL,2026-02-02,0.8179076816886663,positive,news,Morgan Stanley starts Circle at Equal-weight as regulation and rates cloud upside
AAPL,2026-02-02,0.9300139080733061,positive,news,Why Micron (MU) Stock Is Up Today
AAPL,2026-02-02,-0.9550176924094558,negative,news,PayPal Earnings Preview as Branded Checkout Growth Slows
AAPL,2026-02-02,-0.8036111295223236,negative,news,Skyworks Solutions (NASDAQ:SWKS) Price Target Cut to $68.00 by Analysts at Morgan Stanley
AAPL,2026-02-02,0.9184890817850828,positive,news,This Stock Is Vital to the Tech Industry and Could Be a Huge Winner This Year
AAPL,2026-02-02,-0.9573977710679173,negative,news,Morgan Stanley survey shows electronics spending intentions are worsening
AAPL,2026-02-02,-0.9581909254193306,negative,news,Cirrus Logic slips as Loop Capital downgrades on risk-reward (CRUS:NASDAQ)
AAPL,2026-02-02,0.8788507357239723,positive,news,Nordson Corporation stock hits 52-week high at 275.55 USD
AAPL,2026-02-02,0.02157844975590706,neutral,news,Retirees Should Know One Third of FlexShares Dividend Fund Is Actually Technology Stocks
AAPL,2026-02-02,0.9326266255229712,positive,news,"Strong iPhone Sales will Boost Apple’s Holiday Quarter, with Google AI deal in Spotlight"
AAPL,2026-02-02,0.20850985776633024,neutral,news,Pacer’s Dividend Multiplier ETF Cleverly Magnifies Yield To Pay Monthly Income
AAPL,2026-02-02,0.9081257618963718,positive,news,RELX Updates Total Voting Rights to 1.82 Billion Shares
AAPL,2026-02-02,0.93645790964365,positive,news,"McDonald’s discounts, meal bundles lift traffic, says BTIG as it upgrades stock"
AAPL,2026-02-02,-0.7529780119657516,negative,news,Cloudastructure Launches ATM Equity Program with Maxim
AAPL,2026-02-02,-0.9041579123586416,negative,news,Skyworks price target lowered to $68 from $89 at Morgan Stanley
AAPL,2026-02-02,-0.3457317017018795,neutral,news,"Here Are Monday’s Top Wall Street Analyst Research Calls: Apple, Autodesk, Chevron, Circle Internet, McDonalds, Microsoft, Micron Technology, Spotify, and More"
AAPL,2026-02-02,-0.8997247107326984,negative,news,Sagimet Biosciences Reports Positive Phase 3 Acne Data
AAPL,2026-02-02,0.18446801602840424,neutral,news,Creator Studio vs. Creative Cloud: Can Apple’s new suite take on Adobe?
AAPL,2026-02-02,0.30144912376999855,neutral,news,Should Franklin U.S. Large Cap Multifactor Index ETF (FLQL) Be on Your Investing Radar?
AAPL,2026-02-02,-0.9607224594801664,negative,news,Principal Financial Group Inc. Has $194.29 Million Stake in Adobe Inc. $ADBE
AAPL,2026-02-02,0.08923004381358624,neutral,news,The Truth About Sonos Inc: Is This ‘Smart Sound’ Stock a Hidden Steal or Just Hype?
AAPL,2026-02-02,-0.9621418034657836,negative,news,Sonos Q4 Earnings Preview: Revenue Forecast and Stock Performance Analysis - News and Statistics
AAPL,2026-02-02,0.5495172273367643,positive,news,The Truth About Life360 Inc: Is This Tracking App Actually Worth Your Money?
AAPL,2026-02-02,-0.9461995884776115,negative,news,Arm CEO: UK's risk aversion is holding back tech startups
AAPL,2026-02-02,-0.8681620620191097,negative,news,Associated Banc Corp Has $151.18 Million Stake in Apple Inc. $AAPL
AAPL,2026-02-02,0.9290176872164011,positive,news,Taiwan Semiconductor Manufacturing Company Is One of the 2021 TIME100 Most Influential Companies
AAPL,2026-02-02,-0.9688251451589167,negative,news,Sonos (SONO) Q4 Earnings Report Preview: What To Look For
AAPL,2026-02-02,0.1909744953736663,neutral,news,iShares U.S. Technology ETF
IBM,2026-02-03,0.9375391378998756,positive,news,Bernstein and Stifel Lift IBM Price Targets After Q4 Results
IBM,2026-02-03,0.8214342445135117,positive,news,"Corning stock steadies before U.S. open after JPMorgan sticks with Overweight, insider sale disclosed"
IBM,2026-02-03,0.9364680014550686,positive,news,Here’s What Analysts Are Saying About International Business Machines (IBM)
IBM,2026-02-03,0.9293377418071032,positive,news,Here's What Analysts Are Saying About International Business Machines (IBM)
IBM,2026-02-03,-0.9314798880368471,negative,news,"Valmont Industries, Inc. $VMI Shares Sold by Strs Ohio"
IBM,2026-02-03,0.932802826166153,positive,news,International Business Machines Corporation $IBM is Pettee Investors Inc.'s 8th Largest Position
IBM,2026-02-03,0.9357143361121416,positive,news,Bernstein Raises International Business Machines (IBM) Target but Flags Full Valuation After Q4 Beat
IBM,2026-02-03,0.927307590842247,positive,news,What To Expect From STERIS's (STE) Q4 Earnings
IBM,2026-02-03,-0.42965322732925415,negative,news,Assessing DXC Technology (DXC) Valuation After Recent Share Price Rebound
IBM,2026-02-03,0.7907180935144424,positive,news,Trump Says He Agreed To Trade Deal With India: Narendra Modi 'Agreed' To Stop Buying Russian Oil
IBM,2026-02-03,0.916063703596592,positive,news,Bernstein Raises International Business Machines (IBM) Target but Flags Full Valuation After Q4 Beat
IBM,2026-02-03,0.9264531396329403,positive,news,Bernstein Raises International Business Machines (IBM) Target but Flags Full Valuation After Q4 Beat
IBM,2026-02-02,0.9302511885762215,positive,news,International Business Machines (NYSE:IBM) Shares Up 2.6% on Insider Buying Activity
IBM,2026-02-02,0.8768567834049463,positive,news,"Jim Cramer Says ""IBM's the Rare AI Winner With a Fairly Low Price-to-Earnings Multiple"""
IBM,2026-02-02,0.9202968329191208,positive,news,IBM stock price rises 3% in New York trade as shutdown vote looms and earnings glow lingers
IBM,2026-02-02,0.9289817996323109,positive,news,Forget Rigetti Computing: Serious Investors Are Placing Their Chips on This Enterprise‑Ready Quantum Platform
IBM,2026-02-02,0.913322189822793,positive,news,Forget Rigetti Computing: Serious Investors Are Placing Their Chips on This Enterprise-Ready Quantum Platform
IBM,2026-02-02,0.9251016722992063,positive,news,Forget Rigetti Computing: Serious Investors Are Placing Their Chips on This Enterprise‑Ready Quantum Platform
IBM,2026-02-02,0.9342661686241627,positive,news,Can IBM's Lucrative Federal Contracts Boost Its Future Growth?
IBM,2026-02-02,0.8047242141328752,positive,news,Cisco Systems stock hits 52-week high at 80.82 USD
IBM,2026-02-02,0.05686245858669281,neutral,news,Better hires Loveen Advani as new CFO
IBM,2026-02-02,0.935738081112504,positive,news,Investor Optimism Soars: Analysts Boost Lumentum’s Price Target
IBM,2026-02-02,0.9396972097456455,positive,news,Mutual Advisors LLC Grows Stock Position in GE Vernova Inc. $GEV
IBM,2026-02-02,0.14018358197063208,neutral,news,"AI Leads Family Office Investment Themes, JPMorgan Says"
IBM,2026-02-02,0.5257233679294586,positive,news,Praxis Precision Medicines (NASDAQ:PRAX) Now Covered by Analysts at Wells Fargo & Company
IBM,2026-02-02,-0.9399598706513643,negative,news,MSCI Inc $MSCI Shares Sold by Donaldson Capital Management LLC
IBM,2026-02-02,0.7745556347072124,positive,news,Is IonQ Stock a Buy Now?
IBM,2026-02-02,0.3024192452430725,positive,news,Amdocs Earnings: What To Look For From DOX
IBM,2026-02-02,-0.9654422234743834,negative,news,Gartner (IT) Q4 Earnings Report Preview: What To Look For
IBM,2026-02-02,0.8974375743418932,positive,news,"Watsco, Inc. $WSO Shares Purchased by Truist Financial Corp"
IBM,2026-02-02,0.9380185510963202,positive,news,IBM Shares Pop on Strong AI Growth. Is It Too Late to Buy the Stock?
IBM,2026-02-01,0.665653869509697,positive,news,Amdocs Earnings: What To Look For From DOX
IBM,2026-02-01,0.930759877897799,positive,news,Leidos Targets 2030 With ENTRUST Deal And OpenAI AI Push
IBM,2026-02-01,0.9088516440242529,positive,news,This Security Leader Is Turning Surging Cyber Threats Into Recurring Revenue
IBM,2026-02-01,0.8734482927247882,positive,news,This Security Leader Is Turning Surging Cyber Threats Into Recurring Revenue
IBM,2026-02-01,0.8881310969591141,positive,news,Jim Cramer Believes International Business Machines (IBM) Is Undervalued
IBM,2026-02-01,0.9366356898099184,positive,news,Why Stifel Says International Business Machines (IBM) Remains a Top Large-Cap Defensive AI Stock
IBM,2026-02-01,0.9364394880831242,positive,news,Why Stifel Says International Business Machines (IBM) Remains a Top Large-Cap Defensive AI Stock
IBM,2026-02-01,0.0983671210706234,neutral,news,"AI-powered travel concierge Market Current Status and Future Prospects| Sabre Corporation , Booking Holdings"
IBM,2026-02-01,-0.9629009598866105,negative,news,Teacher Retirement System of Texas Has $1.75 Million Stake in Pitney Bowes Inc. $PBI
IBM,2026-02-01,-0.883475698530674,negative,news,UMB Bank n.a. Has $12.45 Million Holdings in International Business Machines Corporation $IBM
IBM,2026-02-01,0.9326473977416754,positive,news,"Donaldson Capital Management LLC Acquires 150,831 Shares of International Business Machines Corporation $IBM"
IBM,2026-02-01,-0.9577060239389539,negative,news,Retirement Systems of Alabama Has $3.55 Million Position in Centene Corporation $CNC
IBM,2026-02-01,0.9178656712174416,positive,news,Budget 2026: IT Stocks Gain After Tax Holiday Proposal for Cloud Data Centres
IBM,2026-02-01,0.701069456525147,positive,news,Maximus Expands AI Role In SNAP As States Face 2027 Funding Shift
IBM,2026-01-31,0.19302901532500982,neutral,news,TechTarget’s Outlook on 2026
IBM,2026-01-31,-0.9606761541217566,negative,news,"IBM stock price: Insider buy, new board pick and shutdown risk set up Monday trade"
IBM,2026-01-31,0.8475260455161333,positive,news,BLOK ETF: Investing in Blockchain Technology Beyond Crypto
IBM,2026-01-31,0.9328478518873453,positive,news,"Jim Cramer on International Business Machines: ""Inexpensive Stock Even Here"""
IBM,2026-01-31,0.9300791621208191,positive,news,This 'Outdated' IBM Technology Just Did Something It Hasn't Done in 20 Years
HD,2026-02-03,-0.8755386658012867,negative,news,"Peterson Wealth Services Decreases Stake in The Home Depot, Inc. $HD"
HD,2026-02-03,0.44688746333122253,positive,news,"Strengthening Families & Communities LLC Purchases 7,783 Shares of The Home Depot, Inc. $HD"
HD,2026-02-03,0.8648504568263888,positive,news,"Silphium Asset Management Ltd Increases Position in The Home Depot, Inc. $HD"
HD,2026-02-03,0.9386594407260418,positive,news,"Jones Financial Companies Lllp Acquires 24,816 Shares of The Home Depot, Inc. $HD"
HD,2026-02-03,0.598453494720161,positive,news,Uncommon wins Chobani—and 9 other agency reviews to know about
HD,2026-02-02,0.07101077120751143,neutral,news,Home Depot Grill Showdown: Why Backyard Cooks Are Flocking to These Grills in 2026
HD,2026-02-02,0.6812864476814866,positive,news,Home Depot's Billy Bastek leads $20M fundraising effort for cancer research center
HD,2026-02-02,-0.9373877197504044,negative,news,Law firm investigating Home Depot after 800 Georgia layoffs announced
HD,2026-02-02,0.17998497746884823,neutral,news,Brokers Suggest Investing in Home Depot (HD): Read This Before Placing a Bet
HD,2026-02-02,-0.9498306326568127,negative,news,"ETFs in Spotlight as Tesla Tops Q4 Earnings, Dips on Revenue Miss"
HD,2026-02-02,-0.953233883716166,negative,news,Home Depot cuts 800 jobs
HD,2026-02-02,0.9035854274407029,positive,news,"Atlantic Union Bankshares Corp Acquires 40,232 Shares of The Home Depot, Inc. $HD"
HD,2026-02-02,-0.9461288750171661,negative,news,"The Home Depot, Inc. $HD Shares Sold by AGF Management Ltd."
HD,2026-02-02,-0.7015674561262131,negative,news,"Convergence Investment Partners LLC Sells 5,493 Shares of The Home Depot, Inc. $HD"
HD,2026-02-02,0.9366958122700453,positive,news,"Bank of New York Mellon Corp Raises Stock Holdings in Dollar Tree, Inc. $DLTR"
HD,2026-02-02,0.9336593141779304,positive,news,"Worksport Provides 2026 Business Update: Clean Energy Products Shipping Now, OEM and Major Distribution Conversations Deepen, Record Growth Forecasted"
HD,2026-02-02,0.9031870663166046,positive,news,P&G bets big on retail integration as CPGs question incrementality
HD,2026-02-01,0.9301292207092047,positive,news,Home Depot Completes Major Acquisition to Bolster Professional Contractor Business
HD,2026-02-01,0.92728341370821,positive,news,Home Depot Completes Major Acquisition to Bolster Professional Contractor Business
HD,2026-02-01,0.9289600495249033,positive,news,"Worksport Provides 2026 Business Update: Clean Energy Products Shipping Now, OEM and Major Distribution Conversations Deepen, Record Growth Forecasted"
HD,2026-02-01,0.40780481696128845,positive,news,Home Depot stock: what could move HD shares after Friday’s rise
HD,2026-02-01,0.5737662268802524,positive,news,Seventy Brings Innovative Shower Products to The Home Depot
HD,2026-02-01,-0.8259619884192944,negative,news,3 arrested after Wauwatosa retail theft at Home Depot
HD,2026-01-31,0.6725627332925797,positive,news,Tractor Supply Nashville Support And What It May Mean For TSCO Investors
HD,2026-01-31,0.05363440699875355,neutral,news,The Truth About Sherwin-Williams: Is This Paint Giant Still Worth Your Money or Way Overhyped?
HD,2026-01-31,-0.9463954707607627,negative,news,"Federated Hermes Inc. Sells 66,615 Shares of The Home Depot, Inc. $HD"
HD,2026-01-31,0.7792108859866858,positive,news,"National Pension Service Acquires 58,887 Shares of The Home Depot, Inc. $HD"
HD,2026-01-31,-0.8896793350577354,negative,news,"L.M. Kohn & Company Has $466,000 Stock Position in The Home Depot, Inc. $HD"
HD,2026-01-30,-0.0037123113870620728,neutral,news,America's only fully integrated rare earth producer sets Feb. 26 Q4 results call
HD,2026-01-30,-0.9645706135779619,negative,news,"Home Depot, UPS, and Amazon confirm major shakeups with company-wide cuts"
HD,2026-01-30,0.9220054298639297,positive,news,Afraid of an AI Correction This Year? This Industrial Stock Has AI Upside With Value Pricing
HD,2026-01-30,0.9411196978762746,positive,news,"Ace Hardware, Menards lead key trend Home Depot and Lowe’s missed"
HD,2026-01-30,-0.9516607699915767,negative,news,Home Depot (Atlanta) WARN Act Investigation
HD,2026-01-30,-0.9599032578989863,negative,news,"Townsquare Capital LLC Has $4.54 Million Position in The Home Depot, Inc. $HD"
HD,2026-01-30,-0.11002691090106964,neutral,news,"4,659 Shares in The Home Depot, Inc. $HD Acquired by Y Intercept Hong Kong Ltd"
HD,2026-01-30,0.9355360623449087,positive,news,"Mirae Asset Global Investments Co. Ltd. Raises Position in Lowe's Companies, Inc. $LOW"
HD,2026-01-30,-0.8465112447738647,negative,news,"AustralianSuper Pty Ltd Sells 35,175 Shares of The Home Depot, Inc. $HD"
HD,2026-01-30,0.4483710080385208,positive,news,"Alpha Cubed Investments LLC Boosts Stock Position in The Home Depot, Inc. $HD"
HD,2026-01-30,0.9262867970392108,positive,news,"Worksport Provides 2026 Business Update: Clean Energy Products Shipping Now, OEM and Major Distribution Conversations Deepen, Record Growth Forecasted"
HD,2026-01-29,-0.9460672223940492,negative,news,"Home Depot laying off hundreds of employees at Atlanta support center, moving to in-office schedule"
HD,2026-01-29,-0.9498021258041263,negative,news,Home Depot's layoffs centered on hundreds of remote jobs
HD,2026-01-29,-0.9580219257622957,negative,news,"Home Depot Cuts 800 Jobs, Orders Corporate Workers Back to Office Full Time"
HD,2026-01-29,-0.731388870626688,negative,news,Home Depot vs. Floor & Decor: Which stock holds more promise now?
HD,2026-01-29,-0.957119801081717,negative,news,"Home Depot Cuts 800 Workers, Orders Corporate Workers Back to Office Full Time"
HD,2026-01-29,0.7386517822742462,positive,news,"Strategic Advisors LLC Invests $1.02 Million in Lowe's Companies, Inc. $LOW"
HD,2026-01-29,0.9354343432933092,positive,news,"Lowe's Companies, Inc. (NYSE:LOW) Receives Average Recommendation of ""Moderate Buy"" from Brokerages"
HD,2026-01-29,-0.9399586208164692,negative,news,"AE Wealth Management LLC Has $52.24 Million Stock Holdings in The Home Depot, Inc. $HD"
HD,2026-01-29,-0.9329569712281227,negative,news,Home Depot Cuts 800 Jobs and Mandates Office Return
HD,2026-01-29,0.9340595863759518,positive,news,Fastenal Highlights Digital And Large Customers As Valuation And Risks Weighed
HD,2026-01-29,-0.9480451010167599,negative,news,"Home Depot cuts 800 jobs, orders corporate staff back to office full time"
MS,2026-02-03,-0.873452752828598,negative,news,"Principal Financial Group, Inc. $PFG Shares Sold by AlphaQuest LLC"
MS,2026-02-03,-0.9363737422972918,negative,news,Citigroup Inc. (NYSE:C) Short Interest Down 12.7% in January
MS,2026-02-03,-0.7234570980072021,negative,news,Morgan Stanley and RBC Capital lower Oracle (ORCL) price targets
MS,2026-02-03,0.402736097574234,neutral,news,Nomura hired a Hong Kong banking MD from Morgan Stanley after bonuses
MS,2026-02-03,0.2628000173717737,neutral,news,Ameriprise Financial Inc.: Sleepy Boomer Stock Or Secret Cash Machine Gen Z Is Sleeping On?
MS,2026-02-03,-0.7779492288827896,negative,news,American Assets Capital Advisers LLC Trims Stock Position in FTAI Aviation Ltd. $FTAI
MS,2026-02-03,-0.9665026403963566,negative,news,Clarivate (NYSE:CLVT) Reaches New 12-Month Low - Should You Sell?
MS,2026-02-03,0.9372867047786713,positive,news,"Strengthening Families & Communities LLC Increases Stock Position in Automatic Data Processing, Inc. $ADP"
MS,2026-02-03,-0.4546084702014923,negative,news,Morgan Stanley resumes Walt Disney stock coverage with Overweight rating
MS,2026-02-03,0.3061569631099701,positive,news,AbbVie Inc. $ABBV Shares Sold by Sollinda Capital Management LLC
MS,2026-02-03,0.9263304965570569,positive,news,Thrivent Financial for Lutherans Has $33.68 Million Holdings in S&P Global Inc. $SPGI
MS,2026-02-03,0.9109994601458311,positive,news,Mutual Advisors LLC Raises Stake in Hewlett Packard Enterprise Company $HPE
MS,2026-02-03,-0.9311682842671871,negative,news,Pettee Investors Inc. Trims Stake in AbbVie Inc. $ABBV
MS,2026-02-03,-0.9563245242461562,negative,news,Analysts Cut Bank of America (BAC) Price Targets Amid Adjusted Provisions and Buyback Pause
MS,2026-02-03,-0.24468791484832764,negative,news,RBC Highlights Wells Fargo (WFC) Growth Strategy and Capital Management Plans
MS,2026-02-03,0.9363416042178869,positive,news,RBC Boosts Morgan Stanley (MS) Price Target on Strong Fourth-Quarter Results
MS,2026-02-03,-0.956650847569108,negative,news,"Morgan Stanley lowers Renault, Stellantis on ‘consensus denial’ over volume OEMs"
MS,2026-02-03,-0.4808342084288597,negative,news,"Principal Financial Group Inc. Sells 26,296 Shares of Hershey Company (The) $HSY"
MS,2026-02-03,0.8981222026050091,positive,news,"AGF Management Ltd. Has $18.82 Million Stock Holdings in Take-Two Interactive Software, Inc. $TTWO"
MS,2026-02-03,-0.24798238091170788,neutral,news,Sequans Communications (SQNS) Expected to Announce Earnings on Tuesday
MS,2026-02-03,-0.9574358416721225,negative,news,"Targa Resources, Inc. $TRGP Shares Sold by Principal Financial Group Inc."
MS,2026-02-03,-0.6219594180583954,negative,news,"Federated Hermes Inc. Sells 13,667 Shares of Stanley Black & Decker, Inc. $SWK"
MS,2026-02-03,0.7492838427424431,positive,news,"National Pension Service Has $43.45 Million Holdings in T. Rowe Price Group, Inc. $TROW"
MS,2026-02-03,0.9331938764080405,positive,news,National Pension Service Raises Position in Halliburton Company $HAL
MS,2026-02-03,-0.5991102159023285,negative,news,Morgan Stanley downgrades Stellantis stock to Equalweight on investment lag By Investing.com
MS,2026-02-03,-0.9469143999740481,negative,news,Principal Financial Group Inc. Decreases Stake in Intercontinental Exchange Inc. $ICE
MS,2026-02-03,0.9332126434892416,positive,news,Rio Tinto Stock: Dividend Giant At A Crossroads As China Jitters Clash With Copper Hype
MS,2026-02-03,-0.8818420730531216,negative,news,Jefferies Financial Group Lowers Tenable (NASDAQ:TENB) Price Target to $24.00
MS,2026-02-03,0.7473867386579514,positive,news,"Alkermes (NASDAQ:ALKS) Director Sells $2,115,684.00 in Stock"
MS,2026-02-03,-0.3610198646783829,negative,news,"Ionis Pharmaceuticals (NASDAQ:IONS) EVP Elizabeth Hougen Sells 6,988 Shares"
MS,2026-02-03,-0.22827991098165512,neutral,news,"Ionis Pharmaceuticals (NASDAQ:IONS) EVP Eugene Schneider Sells 6,179 Shares"
MS,2026-02-03,-0.9551324434578419,negative,news,Gogo (NASDAQ:GOGO) Sets New 12-Month Low - Here's Why
MS,2026-02-02,0.03377925418317318,neutral,news,Nano Dimension Ltd. Adopts Shareholder Rights Agreement to Protect Long-Term Interests
MS,2026-02-02,-0.9432447673752904,negative,news,BMO Fined $4 Million for Overcharging Customers
MS,2026-02-02,0.8348079584538937,positive,news,BioAge Labs (NASDAQ:BIOA) Trading 8% Higher - Here's Why
MS,2026-02-02,0.0009461566805839539,neutral,news,Form 424B2 BARCLAYS BANK PLC
MS,2026-02-02,-0.9321225425228477,negative,news,Engaged Capital nominates three directors to BlackLine board By Investing.com
MS,2026-02-02,0.9338114615529776,positive,news,Imperial Oil (TSE:IMO) Price Target Raised to C$107.00
MS,2026-02-02,0.4061254560947418,positive,news,SMCI Stock Rises Ahead Of Q2 Earnings — What Does The Street Expect?
MS,2026-02-02,-0.4273248314857483,negative,news,"The Algorithm as Architect: Inside Amazon’s 14,000-Role AI Displacement Strategy"
MS,2026-02-02,0.9256158359348774,positive,news,RBC Snags $430-Million UBS Team in Georgia
MS,2026-02-02,0.9367879517376423,positive,news,Brookdale Senior Living’s Stock Surges Amid Broker Upgrades and Positive Guidance
MS,2026-02-02,0.629749059677124,positive,news,"Invesco Bond Fund (VBF): Quiet ticker, loud signals – what the latest move in this closed?end bond"
MS,2026-02-02,0.039798833429813385,neutral,news,"Morgan Stanley Maintains The AES Corp(AES.US) With Buy Rating, Maintains Target Price $24"
MS,2026-02-02,0.922062074765563,positive,news,CMS Energy price target raised to $75 from $74 at Morgan Stanley
MS,2026-02-02,0.5961134731769562,positive,news,Why Coherent stock is jumping today as a unit sale closes and earnings loom
MS,2026-02-02,0.927863197401166,positive,news,‘Down but Not Out’: Morgan Stanley Sees 50% Upside for Microsoft Stock After Selloff
MS,2026-02-02,-0.7081923931837082,negative,news,Morgan Stanley Downgrades Humana (HUM) with Significant PT Cut
PFE,2026-02-03,0.9312887750566006,positive,news,"Palantir, PayPal, Teradyne, Tesla, Pfizer, AMD, Merck, and More Market Movers"
PFE,2026-02-03,-0.9595995955169201,negative,news,Pfizer stock slips after Q4 2025 results (PFE:NYSE)
PFE,2026-02-03,0.45150312781333923,positive,news,Pfizer Inc. (NYSE:PFE) Beats Q4 2025 Estimates but Muted Outlook Tempers Investor Reaction
PFE,2026-02-03,-0.9589003454893827,negative,news,Merck stock dips as 2026 outlook falls short of expectations (MRK:NYSE)
PFE,2026-02-03,0.9258270114660263,positive,news,Pfizer posts trial data for obesity therapy (PFE:NYSE)
PFE,2026-02-03,0.8971085157245398,positive,news,Pfizer’s Ultra-Long-Acting Injectable GLP-1 RA Shows Robust and Continued Weight Loss with Monthly Dosing in Phase 2b Trial
PFE,2026-02-03,0.9158018212765455,positive,news,Pfizer’s Ultra-Long-Acting Injectable GLP-1 RA Shows Robust and Continued Weight Loss with Monthly Dosing in Phase 2b Trial
PFE,2026-02-03,0.9159330353140831,positive,news,Pfizer Beats Sales Estimates on Demand for Older Drugs
PFE,2026-02-03,0.8803616985678673,positive,news,Pfizer beats fourth quarter profit estimates on robust drug demand
PFE,2026-02-03,0.9298935309052467,positive,news,Pfizer Reports Solid Full-Year 2025 Results And Reaffirms 2026 Guidance
