ticker,date,sentiment_score,sentiment_label,content_type,title
AAPL,2026-05-11,-0.04419989883899689,neutral,news,Apple Updates macOS 26 With Bigger Changes Coming: What To Know
AAPL,2026-05-11,0.9384599346667528,positive,news,Swiss Life Asset Management Ltd Boosts Stock Position in RTX Corporation $RTX
AAPL,2026-05-11,-0.9612794369459152,negative,news,Medtronic PLC $MDT Stock Position Decreased by Swiss Life Asset Management Ltd
AAPL,2026-05-11,-0.10399681329727173,neutral,news,The MacBook Neo Just Killed Apple’s Worst-Kept Secret. It’s the End of an Era
AAPL,2026-05-11,0.814816065132618,positive,news,Skyworks Solutions stock (US83088M1027): Q2 earnings beat with EPS of $1.15
AAPL,2026-05-11,0.8944036448374391,positive,news,"Kepler Cheuvreux Suisse SA Acquires Shares of 56,136 VeriSign, Inc. $VRSN"
AAPL,2026-05-11,0.9375457465648651,positive,news,"Mirabaud Asset Management Ltd Grows Stake in The TJX Companies, Inc. $TJX"
AAPL,2026-05-11,-0.8438931927084923,negative,news,"Nicholas Company Inc. Lowers Holdings in Skyworks Solutions, Inc. $SWKS"
AAPL,2026-05-11,0.9161009406670928,positive,news,Broadcom Inc. stock (US11135F1012): Semiconductor leader navigating AI boom
AAPL,2026-05-11,0.8581559816375375,positive,news,CUDA Proves Nvidia Is a Software Company
AAPL,2026-05-11,0.8200006396509707,positive,news,Berkshire Hathaway stock (US0846707026): Diversified conglomerate with strong US market exposure
AAPL,2026-05-11,0.8317713961005211,positive,news,Citi’s Manthey Says US Stock Outperformance Has Further to Run
AAPL,2026-05-11,0.7152631646022201,positive,news,"Amazon.com, Inc. (AMZN.US) Reportedly Prepares First Swiss Franc Bond Issuance"
AAPL,2026-05-11,0.9310511015355587,positive,news,Intel Corporation (INTC.US) Premarket Up Nearly 4% on Report to Manufacture Some Apple Inc. (AAPL.US) Device Chips
AAPL,2026-05-11,0.8907992243766785,positive,news,Intel Corporation (INTC.US) Premarket Up Nearly 4% on Report to Manufacture Some Apple Inc. (AAPL.US) Device Chips
AAPL,2026-05-11,-0.9454703442752361,negative,news,Hendershot Investments Inc. Lowers Position in Apple Inc. $AAPL
AAPL,2026-05-11,-0.6657723188400269,negative,news,The Walt Disney Company $DIS Stock Holdings Decreased by Bryn Mawr Trust Advisors LLC
AAPL,2026-05-11,-0.018036603927612305,negative,news,Why BofA remains cautious on Intel stock despite ongoing rally
AAPL,2026-05-11,0.9337488450109959,positive,news,Apple Inc. $AAPL Shares Purchased by Discipline Wealth Solutions LLC
AAPL,2026-05-11,0.9333631414920092,positive,news,"Berkeley Inc Buys 5,144 Shares of Apple Inc. $AAPL"
AAPL,2026-05-11,0.938829705119133,positive,news,Apple Inc. $AAPL Position Raised by CM Wealth Advisors LLC
AAPL,2026-05-11,0.848190498072654,positive,news,Argo Wealth Advisory LLC Makes New $1.42 Million Investment in Apple Inc. $AAPL
AAPL,2026-05-11,-0.8546532168984413,negative,news,"Apex Wealth Management LLC Sells 3,912 Shares of Apple Inc. $AAPL"
AAPL,2026-05-11,0.5224374942481518,positive,news,Earnings Preview | Will the 'divine assist' from the Apple-Intel deal help Applied Materials deliver Q2 results that justify its high valuation?
AAPL,2026-05-11,0.9087987756356597,positive,news,Corning Hits Record High After Signing Up AI Clients
AAPL,2026-05-11,0.9358218964189291,positive,news,"TRB Advisors LP Boosts Apple Inc Stake by 22,000 Shares"
AAPL,2026-05-11,-0.8979515768587589,negative,news,NewSquare Capital Trims Stake in Invesco Dorsey Wright Momentum ETF
AAPL,2026-05-11,-0.916848324239254,negative,news,Assessing Whether Apple (AAPL) Looks Overvalued As Recent Returns Extend Multi Year Momentum
AAPL,2026-05-11,-0.7991518601775169,negative,news,"Grabar Law Office Investigates Claims on Behalf of Shareholders of Skyworks Solutions, Inc. (SKWS) As Securities Fraud Class Action Survives Motion to Dismiss"
AAPL,2026-05-10,0.9253577906638384,positive,news,Opera (NasdaqGS:OPRA) Valuation Check After Strong Q1 2026 Results And Upgraded Revenue Guidance
AAPL,2026-05-10,0.8937519565224648,positive,news,Ambev S.A. Just Bought 24 Million Shares—Why ABEV3’s Rally Is Now Under Pressure
AAPL,2026-05-10,0.9343228405341506,positive,news,AI-Heavy IWFG ETF Volume Surges 28-Fold on Nvidia Buzz
AAPL,2026-05-10,0.6320053860545158,positive,news,QQQM Is a Better Buy Than QQQ -- For 1 Powerful Reason
AAPL,2026-05-10,0.6997208520770073,positive,news,QQQM Is a Better Buy Than QQQ -- For 1 Powerful Reason
AAPL,2026-05-10,0.9374998947605491,positive,news,MONECO Advisors Increases Stake in Invesco BulletShares Bond ETF
AAPL,2026-05-10,0.9014644990675151,positive,news,MONECO Advisors Loads Up on This Defined-Maturity Bond ETF -- Here's Why It Matters
AAPL,2026-05-10,0.7147449404001236,positive,news,TSMC to remain top Apple chipmaker despite reported Intel deal: Experts
AAPL,2026-05-10,0.9393976964056492,positive,news,AI wins have Alphabet poised to become world’s biggest company
AAPL,2026-05-10,-0.9205160979181528,negative,news,"Swedbank AB Sells 8,000 Shares of Masimo Corporation $MASI"
AAPL,2026-05-10,0.49005550891160965,positive,news,Apple agrees to $250M settlement over claims it overhyped iPhone AI features
AAPL,2026-05-10,0.9395683640614152,positive,news,Globalstar Reports 17 Percent Revenue Growth in Q1 Amid Pending Amazon Merger
AAPL,2026-05-10,0.04935190640389919,neutral,news,SCHB and SPTM Are Both Excellent Broad Market Funds. Here's How to Choose.
AAPL,2026-05-10,0.8219452928751707,positive,news,Prediction: This Nvidia-Backed Artificial Intelligence (AI) Company Might Be the Next Meme Stock. Here's Why It's Actually a Buy at $13 Per Share.
AAPL,2026-05-10,0.9328593257814646,positive,news,"Oxbow Advisors LLC Grows Stake in VeriSign, Inc. $VRSN"
AAPL,2026-05-10,-0.9520976906642318,negative,news,Midwest Trust Co Decreases Stock Position in Qualcomm Incorporated $QCOM
AAPL,2026-05-10,0.9356313217431307,positive,news,"State of New Jersey Common Pension Fund D Purchases Shares of 35,686 Globalstar, Inc. $GSAT"
AAPL,2026-05-10,-0.022698650136590004,neutral,news,"VIK Stock News Today | Earnings, Events & Price Alerts"
AAPL,2026-05-10,0.9405673863366246,positive,news,"What Emerson Electric (EMR)'s Earnings Beat, Guidance Hike and Tech-Savvy Board Pick Mean For Shareholders"
AAPL,2026-05-10,0.9388645198196173,positive,news,"What Emerson Electric (EMR)'s Earnings Beat, Guidance Hike and Tech-Savvy Board Pick Mean For Shareholders"
AAPL,2026-05-10,0.9373310822993517,positive,news,Apple Inc. $AAPL is Nations Financial Group Inc. IA ADV's 3rd Largest Position
CRM,2026-05-11,0.45169638097286224,positive,news,Salesforce Trades at a Discounted Valuation: Time to Buy the Stock?
CRM,2026-05-11,0.9085532799363136,positive,news,Wells Fargo Sticks to Its Hold Rating for Salesforce (CRM)
CRM,2026-05-11,-0.9419784024357796,negative,news,Salesforce stock (US78409V1044): $25B buyback and strong Q4 earnings
CRM,2026-05-11,0.8930153846740723,positive,news,Intapp’s AI Momentum And Buybacks Raise A Deeper Question About Its Profit Path (INTA)
CRM,2026-05-11,0.23974232841283083,neutral,news,Cloudera Launches Zero-Copy Connector for ServiceNow AI Workflows
CRM,2026-05-10,0.9428299441933632,positive,news,Will Raised 2026 Guidance and AI Momentum Change BlackLine's (BL) Long-Term Growth Narrative?
CRM,2026-05-10,0.9378452003002167,positive,news,Vanguard Group Inc. Has $232.34 Million Position in Getty Realty Corporation $GTY
CRM,2026-05-10,-0.5211481750011444,negative,news,Wall Street Zen Downgrades Mach Natural Resources (NYSE:MNR) to Hold
CRM,2026-05-09,-0.21171212568879128,neutral,news,Jim Cramer on Salesforce: “It’s Tough Because the Market Hates Software”
CRM,2026-05-09,0.9078601663932204,positive,news,Open Text Corporation (NASDAQ:OTEX) Q3 2026 Earnings Call Transcript
CRM,2026-05-09,0.8594385571777821,positive,news,"Salesforce, Inc. stock (US79466L3024): Q1 FY27 earnings date set for May 27, 2026, as AI?driven CRM"
CRM,2026-05-09,-0.9334465675055981,negative,news,Salesforce Inc. stock (US78409V1044): AI?driven growth and $25 billion buyback in focus ahead of Q1
CRM,2026-05-09,0.825117414817214,positive,news,"Pearl Planning LLC Purchases Shares of 3,056 Oracle Corporation $ORCL"
CRM,2026-05-09,-0.9191089104861021,negative,news,DSS (DSS) Short Interest & Short Float | Updated May 2026 $DSS
CRM,2026-05-08,0.9296619854867458,positive,news,Salesforce Inc. stock (US78409V1044): AI strategy lifts CRM shares after strong Q4 results and buyback plan
CRM,2026-05-08,0.8468052186071873,positive,news,"Okta (OKTA) maps AI-era strategy, board refresh and executive pay in 2026 proxy"
CRM,2026-05-08,0.9325886964797974,positive,news,Tyler Technologies (TYL) Gets A Major Target Hike As SaaS Momentum Accelerates
CRM,2026-05-08,-0.9677735045552254,negative,news,Salesforce Inc. stock underperforms Friday when compared to competitors
CRM,2026-05-08,0.2309563346207142,neutral,news,"AI should remove friction, not agents, from contact centers"
CRM,2026-05-08,0.9370359666645527,positive,news,Five9 surges 63% in three weeks after Fair Value analysis spotted opportunity
CRM,2026-05-08,-0.9481739886105061,negative,news,"Cybin Inc. (NASDAQ:HELP) Given Consensus Rating of ""Buy"" by Brokerages"
CRM,2026-05-08,-0.9576126411557198,negative,news,SoundHound AI Stock Falls After Record Q1 Revenue Leaves One Big Question
CRM,2026-05-08,0.9395705256611109,positive,news,Five9 surges 63% in three weeks after Fair Value analysis spotted opportunity
CRM,2026-05-08,-0.1799794938415289,neutral,news,CCC Intelligent Solutions Holdings Inc. (CCC) Leadership & Management Team Analysis
CRM,2026-05-07,-0.0536152720451355,negative,news,Blackbaud (Nasdaq:BLKB) - Stock Analysis
CRM,2026-05-07,0.2515915334224701,positive,news,Boyd Gaming declares $0.20 quarterly dividend
CRM,2026-05-07,-0.8977780155837536,negative,news,Salesforce Inc. stock outperforms competitors on strong trading day
CRM,2026-05-07,0.9395156446844339,positive,news,Salesforce Inc Stock (CRM) Moved Up by 3.23% on May 7: A Full Analysis
CRM,2026-05-07,-0.9592976635321975,negative,news,"Adobe Falls 27% YTD, Trades at a Discount: What Should Investors Do?"
CRM,2026-05-07,0.8745659068226814,positive,news,Salesforce Inc’s (CRM) New Reporting Structure To Give Better Insights Into AI Driven Growth
CRM,2026-05-07,0.8080917843617499,positive,news,Teradata's latest targets putting agentic AI into production
CRM,2026-05-07,0.6779141947627068,positive,news,Is It Time To Reassess Trimble (TRMB) After Strong Year To Date Share Performance
CRM,2026-05-07,0.938590994104743,positive,news,Tyler Technologies (NYSE:TYL) Is Posting Promising Earnings But The Good News Doesn’t Stop There
CRM,2026-05-07,0.93089066632092,positive,news,BofA raises Yeti stock price target to $44 ahead of earnings
CRM,2026-05-07,0.6199878333136439,positive,news,"Wyndham’s New ChatGPT Tool Lets Users Book 8,400 Hotels"
CRM,2026-05-07,-0.8195134699344635,negative,news,"Swedbank AB Has $119.23 Million Holdings in Tyler Technologies, Inc. $TYL"
CRM,2026-05-07,-0.9489208813756704,negative,news,Intapp (INTA) Q3 Loss Of US$15.5 Million Tests Profitability Narrative
CRM,2026-05-07,-0.02858404815196991,neutral,news,"Salesforce, Inc. (CRM) is a trending stock: Facts to know before betting on it"
CRM,2026-05-07,0.7629001885652542,positive,news,Support agents get case summaries inside Salesforce with eGain AI
CRM,2026-05-07,0.5816023740917444,positive,news,Tired of phone trees? eGain launches AI agent for natural conversation
CRM,2026-05-06,0.9395888336002827,positive,news,Zillow (ZG) Q1 2026 Earnings Call Transcript
CRM,2026-05-06,0.9321578070521355,positive,news,Salesforce’s AI Strength Builds Momentum In S&P 500 Index
CRM,2026-05-06,-0.8891057781875134,negative,news,Mizuho raises Everest Group stock price target to $388 on earnings
CRM,2026-05-06,0.9293569903820753,positive,news,Photronics Hits New High As Nasdaq Today Drives Tech Momentum
CRM,2026-05-06,0.003062952309846878,neutral,news,Salesforce will post quarterly results May 27 after the market closes
CRM,2026-05-06,0.4815892679616809,neutral,news,"Salesforce says it will hire 1,000 ‘AI-native’ new grads"
CRM,2026-05-06,0.5984144760295749,positive,news,Tableau in transition as AI forces BI vendors to evolve
CRM,2026-05-06,0.9378694798797369,positive,news,Banco Santander Brasil SA ADR (BSBR) Looks to Score Double With AI
CRM,2026-05-06,0.46244885586202145,neutral,news,Atlassian MCP updates take aim at AI token usage
CRM,2026-05-06,0.8911999613046646,positive,news,Is the Market Missing the Point on Salesforce Inc (CRM)’s AI Positioning?
AMAT,2026-05-11,0.9321806877851486,positive,news,Why Teradyne (TER) Is Up 6.6% After Surging Q1 Earnings And Fresh Q2 Guidance
AMAT,2026-05-11,0.9413235690444708,positive,news,Lam Research Stock Trades Near 52-Week High: Buy More or Book Profits?
AMAT,2026-05-11,0.9172229347750545,positive,news,"Applied Materials (AMAT) Earnings Preview: AI Chip Demand, Capital Expenditure Trends, & Trade Setups - In Progress"
AMAT,2026-05-11,0.7711227480322123,positive,news,A $5B chip R&D hub: how Applied Materials and TSMC aim to scale AI
AMAT,2026-05-11,0.9214860806241632,positive,news,"B. Riley Adjusts Price Target on Applied Materials to $530 From $485, Maintains Buy Rating"
AMAT,2026-05-11,0.3257143795490265,positive,news,GlobalFoundries stock hits 52-week high at 76.41 USD
AMAT,2026-05-11,0.9316126834601164,positive,news,Applied Materials Inc. stock (US0382221051): AI-driven momentum lifts shares and analyst target ahea
AMAT,2026-05-10,0.5780882388353348,positive,news,"Top US Stocks To Watch This Week: AMAT, Cisco, Nebius And Circle"
AMAT,2026-05-10,0.2258706260472536,neutral,news,"Stocks To Watch This Week: Walmart, Cisco, and Applied Materials Face a Big Test for AI and Consumer Spending"
AMAT,2026-05-10,0.9447924951091409,positive,news,Air Products & Chemicals (APD) Posts 19% Adjusted EPS Growth on Higher On-Site Volumes
AMAT,2026-05-10,0.920605257153511,positive,news,Enphase Energy (ENPH) Signs $52M Safe Harbor Deal for Domestic IQ9 Microinverters
AMAT,2026-05-10,0.9352506287395954,positive,news,FormFactor (FORM) Is Up 6.4% After AI-Fueled Q2 Guidance and Margin Outlook - Has The Bull Case Changed?
AMAT,2026-05-09,0.7845467925071716,positive,news,Novanta Earnings: What To Look For From NOVT
AMAT,2026-05-09,0.9101731339469552,positive,news,Evergy (EVRG) Reports Q1 EPS Beat
AMAT,2026-05-09,0.9361625919118524,positive,news,Calpine Acquisition Strengthens Constellation Energy Corporation (CEG) as a High-Growth Utility Stock
AMAT,2026-05-09,0.8992342986166477,positive,news,Jim Cramer on CVS: “I Would Argue That It’s Cheaper”
AMAT,2026-05-09,0.0250789076089859,neutral,news,7 Stocks Expecting a Post-earnings Jolt - Including Applied Materials and Cisco Systems
AMAT,2026-05-09,0.7873435015790164,positive,news,Jim Cramer on Goldman Sachs: “I Think That It’s Going Higher”
AMAT,2026-05-09,0.9326915610581636,positive,news,"Jim Cramer on Becton, Dickinson: “The Company Showed Excellent Execution Across the Board”"
AMAT,2026-05-09,-0.002611527219414711,neutral,news,POET - POET Technologies Inc Stock Price and Quote
AMAT,2026-05-09,0.9376631872728467,positive,news,Microsoft Deal Strengthens Black Hills Corporation (BKH) Prospects as a High Growth Utility Stock to Buy
AMAT,2026-05-09,0.9287180304527283,positive,news,Applied Materials Inc. stock (US0382221051): AI?driven rally pushes shares toward new highs ahead of
AMAT,2026-05-09,0.9361626245081425,positive,news,"Applied Materials, Inc. stock (US0382221051): AI-driven rally ahead of earnings"
AMAT,2026-05-09,0.8760313764214516,positive,news,Talos Energy (TALO) Beats Forecasts in Q1 Report
AMAT,2026-05-09,-0.1283518671989441,neutral,news,Is It Too Late To Consider Taiwan Semiconductor Manufacturing (NYSE:TSM) After Its 1‑Year Surge?
AMAT,2026-05-09,0.9222988709807396,positive,news,IES Holdings (IESC) Subsidiary to Acquire Broadwind Texas Facility Assets
AMAT,2026-05-09,0.9314799625426531,positive,news,Is Intuit Inc. (INTU) One of the Best American AI Stocks to Buy Now?
AMAT,2026-05-09,0.9364136196672916,positive,news,Here’s why Sterling Infrastructure (STRL) is Among the 10 Best Quality Stocks to Buy and Hold for the Next 5 Years
AMAT,2026-05-09,0.9364572372287512,positive,news,Oppenheimer Raises its Price Target on Everus Construction (ECG) to $180
AMAT,2026-05-09,0.9350684024393559,positive,news,Raymond James Raises its Price Target on Monolithic Power (MPWR)
AMAT,2026-05-09,0.9160674382001162,positive,news,Transocean (RIG) – Among the 10 Best Energy Stocks to Buy Under $20 According to Billionaires
AMAT,2026-05-09,0.9244062285870314,positive,news,"Fluence, Applied Materials, Kopin, Epam Trending With Analysts"
AMAT,2026-05-09,0.9350151587277651,positive,news,"Should KLA’s Stock Split, Dividend Hike and Completed Buyback Require Action From KLA (KLAC) Investors?"
AMAT,2026-05-09,-0.016418712213635445,neutral,news,"Applied Materials Stock Jumps 6.0% In A Day, Now Is Not The Time To Buy The Stock"
AMAT,2026-05-09,0.8187955305911601,positive,news,Why Aeva Technologies (AEVA) Is Building Momentum Across Automotive and Physical AI
AMAT,2026-05-09,-0.5125371515750885,negative,news,TransAlta (TAC) Reports Q1 adjusted EPS of C$0.60
AMAT,2026-05-09,0.9311560373753309,positive,news,Mizuho Raises its Price Target on Duke Energy (DUK) to $139
AMAT,2026-05-09,0.9145834296941757,positive,news,Why ASX and IONQ May Gain 15%+ in the Quantum-Semiconductor Space
AMAT,2026-05-08,0.7295859232544899,positive,news,Pier Capital LLC Makes New $3.54 Million Investment in Camtek Ltd. $CAMT
AMAT,2026-05-08,0.19963520392775536,neutral,news,ChipMOS Technologies stock (BMG2113B1081): Taiwan-based chip packaging specialist with US exposure
AMAT,2026-05-08,0.9164502630010247,positive,news,Is Applied Materials (AMAT) One of the Best Inflation-Hedge Stocks to Buy for 2026?
AMAT,2026-05-08,0.9240722944959998,positive,news,Synaptics (NASDAQ:SYNA) Trading 12.1% Higher on Analyst Upgrade
AMAT,2026-05-08,0.5967153999954462,positive,news,IonQ (IONQ) to acquire SkyWater (SKYT) in cash-and-stock merger deal
AMAT,2026-05-08,0.9316988792270422,positive,news,PDF Solutions Jumps 7.7% Amid Sector-Wide Rally
AMAT,2026-05-08,0.9333101436495781,positive,news,Applied Materials Earnings Momentum Sparks Analyst Optimism
AMAT,2026-05-08,0.9334615617990494,positive,news,Why Analysts Are Growing More Confident In Lam Research (LRCX)
AMAT,2026-05-08,0.2939853249117732,neutral,news,All-In on AI: How the United States and Taiwan Are Deepening Their Chip Partnership
AMAT,2026-05-08,0.9072459861636162,positive,news,"Unity Software's Q1 Earnings Miss Estimates, Revenues Increase Y/Y"
AMAT,2026-05-08,0.9370023272931576,positive,news,Applied Materials Inc Stock (AMAT) Moved Up by 4.75% on May 8: A Full Analysis
SBUX,2026-05-11,0.9291370175778866,positive,news,Starbucks Corp. stock (US8552441094): Recent expansion and operational updates
SBUX,2026-05-10,-0.0002774335443973541,neutral,news,Pumpkin Spice Latte: Why the Fall Favorite Still Matters in 2026
SBUX,2026-05-10,0.9346870165318251,positive,news,MGO One Seven LLC Increases Stock Position in Starbucks Corporation $SBUX
SBUX,2026-05-10,0.940466471016407,positive,news,Warren Buffett and Berkshire Hathaway's Domino's Pizza Investment Update as of May 2026 - News and Statistics
SBUX,2026-05-10,-0.8426167163997889,negative,news,Lucky Strike Accused of Racking Up a Bowling Monopoly
SBUX,2026-05-09,0.9243575930595398,positive,news,Starbucks Corp. stock (US8552441094): Q2 2026 beats expectations as shares rise on earnings surprise
SBUX,2026-05-09,-0.9498625304549932,negative,news,Wesbanco Bank Inc. Lowers Stock Holdings in Starbucks Corporation $SBUX
SBUX,2026-05-09,0.9354117009788752,positive,news,ASR Vermogensbeheer N.V. Boosts Stake in Starbucks Corporation $SBUX
SBUX,2026-05-09,0.3465650249272585,neutral,news,"Starbucks Corp (SBUX) Stock Price, Quote, News & History"
SBUX,2026-05-08,0.9420464187860489,positive,news,"Chipotle Mexican Grill Q1 2026 Earnings: Traffic Returns, Comps Beat Estimates - News and Statistics"
SBUX,2026-05-08,0.5365778440609574,positive,news,Humana poaches Starbucks data chief for C-suite role
SBUX,2026-05-08,0.8028116328641772,positive,news,Chipotle opens Park 11 location in Belleville with Tulfra Real Estate
SBUX,2026-05-08,0.7653118744492531,positive,news,"Starbucks Just Ended Seven Quarters of Declining Comps, Here Is Why the Margin Chart Still Matters"
SBUX,2026-05-08,0.5904781147837639,positive,news,Chipotle coming soon
SBUX,2026-05-08,0.933237349614501,positive,news,"GRIMES & Co WEALTH MANAGEMENT LLC Buys 7,165 Shares of PepsiCo, Inc. $PEP"
SBUX,2026-05-08,-0.8346881568431854,negative,news,Is Chipotle Mexican Grill (CMG) Attractive After A 35% One-Year Share Price Slide?
SBUX,2026-05-08,0.9304431211203337,positive,news,"Starbucks CEO, international, sells $233,621 in company stock"
SBUX,2026-05-07,-0.0026878640055656433,neutral,news,"Starbucks (SBUX) executive sells 2,229 shares in planned stock trade"
SBUX,2026-05-07,0.9379766080528498,positive,news,Earnings call transcript: Brixmor Property Q1 2026 beats expectations with strong NOI growth
SBUX,2026-05-07,0.07654436212033033,neutral,news,Starbucks makes Nashville move amid Seattle struggles
SBUX,2026-05-07,0.9363792221993208,positive,news,"McDonald's passes $34B in quarterly sales, loyalty spending tops $9B"
SBUX,2026-05-07,0.9356003776192665,positive,news,Gateway Investment Advisers LLC Boosts Holdings in Monster Beverage Corporation $MNST
SBUX,2026-05-07,0.034703295677900314,neutral,news,Positioning for a Big Move: SBUX Long Straddle Trade Idea
SBUX,2026-05-06,0.35525850113481283,neutral,news,Ferrari Files Q1 2026 Interim Financial Report with U.S. SEC
SBUX,2026-05-06,0.5883596995845437,positive,news,Smurfit Westrock Directors Receive RSU Vesting and New Equity Awards
SBUX,2026-05-06,0.27122127171605825,neutral,news,Papa Johns Is Teaming Up with Pixar to Make Toy Story Pizzas
SBUX,2026-05-06,0.5996047994121909,positive,news,Wall Street Breakfast Podcast: Soda & Chips: McDonald's And AMD In Focus
SBUX,2026-05-06,0.8614392541348934,positive,news,Starbucks Corporation $SBUX Shares Sold by Principal Financial Group Inc.
SBUX,2026-05-06,0.21482306718826294,positive,news,"Darden's Cost Edge Still Stands, but Weak Sentiment and Rising Costs Keep Pressure Elevated"
SBUX,2026-05-06,-0.954768224619329,negative,news,"'Ask for a little more': Chipotle CEO, customers at odds over portions"
SBUX,2026-05-06,0.9406987745314837,positive,news,Did Brinker’s Upgraded 2026 Guidance and Chili’s Sales Streak Just Shift Brinker International's (EAT) Investment Narrative?
SBUX,2026-05-06,0.8668617783114314,positive,news,"Why Starbucks picked Nashville over Seattle for expansion, according to local business reporter"
SBUX,2026-05-06,0.5747670382261276,positive,news,"Why Starbucks picked Nashville over Seattle for expansion, according to local business reporter"
SBUX,2026-05-05,0.1585078639909625,neutral,news,You Can Finally Recreate Starbucks’ Sweet Cream Cold Brew at Home With This New Offering
SBUX,2026-05-05,-0.022001838311553,neutral,news,"SBUX (NASDAQ: SBUX) selling notice: Brady Brewer reports 4,458 shares sold"
SBUX,2026-05-05,0.8718593595549464,positive,news,Sterling Investment Management LLC Invests $1.76 Million in Kimberly-Clark Corporation $KMB
SBUX,2026-05-05,0.6171566545963287,positive,news,Can McDonald’s Share Bounce Back With Upcoming Earnings?
SBUX,2026-05-05,-0.9160890020430088,negative,news,Truist Financial Corp Reduces Holdings in Starbucks Corporation $SBUX
SBUX,2026-05-05,-0.6994881480932236,negative,news,Earnings To Watch: HCI Group (HCI) Reports Q1 Results Tomorrow
SBUX,2026-05-05,-0.9126115031540394,negative,news,Bloomin' Brands (BLMN) Q1 Earnings Report Preview: What To Look For
SBUX,2026-05-05,0.8986873924732208,positive,news,Icahn Enterprises (IEP) Q1 Earnings Report Preview: What To Look For
SBUX,2026-05-04,0.8099734652787447,positive,news,Starbucks launches $1.1 billion tender offer for senior notes
SBUX,2026-05-04,0.21209856029599905,neutral,news,"Starbucks moves to buy back up to $1.1B of debt, with May 15 deadline"
SBUX,2026-05-04,-0.043632058426737785,neutral,news,6 Consumer Discretionary Stocks With Whale Alerts In Today's Session
SBUX,2026-05-04,0.8728335946798325,positive,news,"Jim Cramer Big, Explosive Prediction About Starbucks (SBUX)"
SBUX,2026-05-04,0.9343212973326445,positive,news,Is Starbucks Stock a Buy After Its 2026 Turnaround Report?
SBUX,2026-05-04,0.6943794060498476,positive,news,Intact Investment Management Inc. Raises Stake in Kimberly-Clark Corporation $KMB
SBUX,2026-05-04,0.9227090887725353,positive,news,Starbucks Corporation $SBUX Shares Acquired by Intact Investment Management Inc.
SBUX,2026-05-04,0.04578693211078644,neutral,news,"The Zacks Analyst Blog Highlights Philip Morris International, Honeywell, Starbucks and United-Guardian"
SBUX,2026-05-04,0.7399989888072014,positive,news,Why Starbucks (SBUX) Is Up 8.2% After Mixed Q2 Results And Higher Earnings Guidance
BAC,2026-05-11,0.9350080583244562,positive,news,Bank of America Corp. stock (US0605051046): Q1 earnings beat with $1.11 EPS
BAC,2026-05-11,0.9341123420745134,positive,news,Three reasons why markets have advanced despite worries
BAC,2026-05-11,0.9065897986292839,positive,news,"KeyBanc reiterates Dollar Tree stock rating, raises Q1 estimates By Investing.com"
BAC,2026-05-11,-0.7958601079881191,negative,news,BofA Securities India settles with markets regulator for alleged violation of insider trading norms
BAC,2026-05-11,-0.31014934182167053,negative,news,Wynn Resorts (NASDAQ:WYNN) Given New $140.00 Price Target at Bank of America
BAC,2026-05-11,0.7834273260086775,positive,news,C.H. Robinson Worldwide stock (US12468P1049): Logistics provider joins BofA's investment list
BAC,2026-05-11,0.9379371656104922,positive,news,"Swiss Life Asset Management Ltd Buys 23,628 Shares of Bank of America Corporation $BAC"
