ticker,date,sentiment_score,sentiment_label,content_type,title
SLB,2026-05-01,0.9414071459323168,positive,news,"How Investors May Respond To Veralto (VLTO) Earnings Beat, Guidance Hike, Acquisitions And Buyback Completion"
SLB,2026-05-01,0.05718637444078922,neutral,news,"SLB (SLB) non-employee director receives 3,428-share stock award under plan"
SLB,2026-05-01,0.6940676653757691,positive,news,"Director at SLB (NYSE: SLB) receives 3,428-share equity grant"
SLB,2026-05-01,0.02584652788937092,neutral,news,"SLB (NYSE: SLB) director awarded 3,428 shares under stock plan"
SLB,2026-05-01,0.02556954137980938,neutral,news,"SLB (SLB) director receives 3,428-share award, now holds 22,099"
SLB,2026-05-01,0.024029740132391453,neutral,news,"Director James Hackett receives 5,450 SLB (NYSE: SLB) shares"
SLB,2026-05-01,0.11167287267744541,neutral,news,"SLB (NYSE: SLB) director receives 3,428-share equity grant under board plan"
SLB,2026-05-01,0.053655846044421196,neutral,news,"SLB (NYSE: SLB) director awarded 3,428 shares in stock grant"
SLB,2026-05-01,0.9344615172594786,positive,news,"Petrobras (PBR) brings Búzios P-79 FPSO online early, boosting capacity"
SLB,2026-05-01,-0.002559227868914604,neutral,news,Fidelity files Form 144 notice for SLB (NASDAQ: SLB) share lots
SLB,2026-05-01,0.8572355611249804,positive,news,SLB Wins Two 2026 OTC Spotlight on New Technology Awards
SLB,2026-05-01,0.8420077548362315,positive,news,SLB AlphaSight Launch And Africa Digital Push Reframe Growth Story
SLB,2026-05-01,0.05736164283007383,neutral,news,"Halliburton Insider Sold Shares Worth $363,510, According to a Recent SEC Filing"
SLB,2026-05-01,0.9288608832284808,positive,news,Subsea7 and SLB alliance secures Angola contract with ExxonMobil
SLB,2026-04-30,0.0020134933292865753,neutral,news,Vanguard holds 112.25M SLB shares (7.47%) — SLB Ltd (NYSE: SLB)
SLB,2026-04-30,0.020272431895136833,neutral,news,SLB (NYSE:SLB) - Stock Analysis
SLB,2026-04-30,0.9276790507137775,positive,news,Raymond James Adjusts SLB Price Target to $62 From $58
SLB,2026-04-30,0.8036227081902325,positive,news,SLB launches AlphaSight geosteering service
SLB,2026-04-30,0.7790783513337374,positive,news,Is Archrock's (AROC) 2026 Backlog Strength Quietly Rewriting Its LNG Demand Story?
SLB,2026-04-30,0.7855284819379449,positive,news,"Drilling And Completion Fluids Market Size, Share | CAGR of 3.8%"
SLB,2026-04-30,0.8691391036845744,positive,news,SLB launches AlphaSight reservoir mapping solution
SLB,2026-04-30,0.4372811373323202,neutral,news,"Crude Oil Flow Improvers Market Set to Boom Rapidly, Witnessing Strong Growth Through 2033 |Halliburton Company, BASF SE, LiquidPower Specialty Products Inc., Schlumberger Ltd."
SLB,2026-04-30,0.9195378310978413,positive,news,SLB Expands Digital Toolkit With S&P Software As Valuation Questions Grow
SLB,2026-04-30,0.9389397203922272,positive,news,SLB Announces First-Quarter 2026 Results
SLB,2026-04-30,0.7149594724178314,positive,news,Precision Drilling Announces 2026 First Quarter Unaudited Financial Statements
SLB,2026-04-29,0.8528560549020767,positive,news,"Green Plains and HighPeak Energy Shares Skyrocket, What You Need To Know"
SLB,2026-04-29,0.5291545419022441,positive,news,Akin Advises SLB on Its Acquisition of S&P Global Energy’s Upstream Software Portfolio
SLB,2026-04-29,-0.0012581832706928253,neutral,news,"SLB (SLB) CEO Olivier Le Peuch sells 25,000 shares under 10b5-1 plan"
SLB,2026-04-29,0.10358740389347076,neutral,news,SLB gibt Ergebnisse des ersten Quartals 2026 bekannt
SLB,2026-04-29,0.9417810961604118,positive,news,Nabors highlights resilience in international drilling amid Middle East tensions
SLB,2026-04-29,0.9378583021461964,positive,news,TechnipFMC (FTI) Declares Quarterly Dividend of $0.05 per Share
NFLX,2026-05-05,0.9303349228575826,positive,news,Paramount+ Is Improving Rapidly and Beginning to Mitigate the Ongoing Decline in Traditional TV
NFLX,2026-05-05,0.9313674960285425,positive,news,"WT Wealth Management Has $2.50 Million Holdings in Netflix, Inc. $NFLX"
NFLX,2026-05-05,0.9349983213469386,positive,news,"Morse Asset Management Inc Buys 57,611 Shares of Netflix, Inc. $NFLX"
NFLX,2026-05-05,0.9325552973896265,positive,news,"Principal Financial Group Inc. Boosts Holdings in Netflix, Inc. $NFLX"
NFLX,2026-05-05,0.6847322583198547,positive,news,"The Zacks Analyst Blog Highlights Disney, Comcast, Netflix and Warner Bros"
NFLX,2026-05-05,0.9416388086974621,positive,news,"Netflix, Inc. $NFLX Shares Bought by Intact Investment Management Inc."
NFLX,2026-05-05,0.010569047182798386,neutral,news,Lululemon Stock Investors Might Be Surprised to See This
NFLX,2026-05-05,-0.08100731670856476,neutral,news,Lululemon Stock Investors Might Be Surprised to See This
NFLX,2026-05-05,0.9361925693228841,positive,news,"Heartland Bank & Trust Co Has $1.43 Million Stake in Netflix, Inc. $NFLX"
NFLX,2026-05-05,0.898886090144515,positive,news,"21,134 Shares in Netflix, Inc. $NFLX Bought by Fulcrum Wealth Advisors LLC"
NFLX,2026-05-05,0.9351871199905872,positive,news,"Avidian Wealth Enterprises LLC Has $2 Million Position in Netflix, Inc. $NFLX"
NFLX,2026-05-05,0.9321690518409014,positive,news,"Alliance Wealth Advisors LLC UT Purchases 21,264 Shares of Netflix, Inc. $NFLX"
NFLX,2026-05-04,0.019377469085156918,neutral,news,Netflix (NFLX) director Jay Hoag receives grant of 679 stock options
NFLX,2026-05-04,0.031759195029735565,neutral,news,Netflix (NASDAQ: NFLX) director receives 679 stock options grant
NFLX,2026-05-04,0.038495118729770184,neutral,news,Director at Netflix (NASDAQ: NFLX) granted 679 stock options
NFLX,2026-05-04,0.015468556433916092,neutral,news,Netflix (NFLX) director Elinor Mertz receives 679 stock options priced at $92.06
NFLX,2026-05-04,0.0046110600233078,neutral,news,Netflix (NASDAQ: NFLX) director receives grant of 679 stock options
NFLX,2026-05-04,0.0830586114898324,neutral,news,Netflix grants options to chief accounting officer | NFLX Insider Trading
NFLX,2026-05-04,0.690035848878324,positive,news,Netflix (NASDAQ: NFLX) director granted 679 non-qualified stock options
NFLX,2026-05-04,-0.004548344761133194,neutral,news,Director Anne Sweeney gets 679 Netflix (NFLX) options at 92.06
NFLX,2026-05-04,0.05557774938642979,neutral,news,Ann Mather (NASDAQ: NFLX) awarded 679 Netflix stock options
NFLX,2026-05-04,-0.8389378767460585,negative,news,"Microsoft, Netflix, and 10 More Stocks Unfairly Punished On Earnings"
NFLX,2026-05-04,0.0036616846919059753,neutral,news,Market Factors: How Scotiabank’s stock picks dramatically outperform the benchmark
NFLX,2026-05-04,0.7514194063842297,positive,news,SIVR Beats SLV. Here Is Why.
NFLX,2026-05-04,0.9361776858568192,positive,news,"Varma Mutual Pension Insurance Co Buys 570,575 Shares of Netflix, Inc. $NFLX"
NFLX,2026-05-04,0.7233822271227837,positive,news,"Plush Toys Market Size Surging with 8.9% CAGR | By Key Players: Mattel Inc., Hasbro Inc., Spin Master Corp., Ty Inc., Melissa & Doug LLC, Bandai Namco Holdings"
NFLX,2026-05-04,0.816327640786767,positive,news,"Peregrine Investment Management Inc. Invests $8.65 Million in Netflix, Inc. $NFLX"
NFLX,2026-05-04,0.9233591221272945,positive,news,"Pinnacle Wealth Management Advisory Group LLC Acquires 28,907 Shares of Netflix, Inc. $NFLX"
NFLX,2026-05-04,0.9395164605230093,positive,news,"Truist Financial Corp Has $170.77 Million Position in Netflix, Inc. $NFLX"
NFLX,2026-05-04,0.22142964601516724,positive,news,"Sun Financial Inc Makes New $1.13 Million Investment in Netflix, Inc. $NFLX"
NFLX,2026-05-04,0.34988980274647474,neutral,news,"Lattice Capital Management LLC Raises Holdings in Netflix, Inc. $NFLX"
NFLX,2026-05-04,0.9367301538586617,positive,news,"Elite Wealth Management Inc. Acquires 26,249 Shares of Netflix, Inc. $NFLX"
NFLX,2026-05-04,0.8834531791508198,positive,news,"Bellecapital International Ltd. Has $5.10 Million Stock Position in Netflix, Inc. $NFLX"
NFLX,2026-05-04,0.754909947514534,positive,news,"Ascent Wealth Partners LLC Grows Stock Position in Netflix, Inc. $NFLX"
NFLX,2026-05-04,0.9275670554488897,positive,news,"Advisors Preferred LLC Has $1.55 Million Stock Holdings in Netflix, Inc. $NFLX"
NFLX,2026-05-04,0.9039752054959536,positive,news,AMC Stock Pops Overnight As Netflix Leans Into Theatres for ‘Narnia’ — CEO Hails ‘Massive Development’
NFLX,2026-05-04,0.6536355502903461,positive,news,Walt Disney Company Shs -CAD hedged- Canadian Depositary Receipt Repr Shs Reg S Trade Ideas — TSX:DIS
NFLX,2026-05-04,0.16485808975994587,neutral,news,YieldMax NFLX option income strategy ETF announces weekly distribution of $0.0687
NFLX,2026-05-04,0.916643712669611,positive,news,The Walt Disney Company (DIS): Navigating the Multi-Platform Transformation and Parks Super-Cycle
NFLX,2026-05-04,-0.9421615600585938,negative,news,Why Tilray's Marijuana Rescheduling Sizzle Has Fizzled
NFLX,2026-05-03,0.903030514717102,positive,news,"Is Netflix, Inc. (NFLX) A Good Stock To Buy Now?"
NFLX,2026-05-03,0.1980978548526764,positive,news,"Woodard & Co. Asset Management Group Inc. ADV Buys New Position in Netflix, Inc. $NFLX"
NFLX,2026-05-03,0.9245228171348572,positive,news,"Mcdonald Partners LLC Buys 10,936 Shares of Netflix, Inc. $NFLX"
CL,2026-05-05,-0.039817243814468384,negative,news,"Intact Investment Management Inc. Sells 65,100 Shares of Colgate-Palmolive Company $CL"
CL,2026-05-05,0.6274613877758384,positive,news,"23,217 Shares in Colgate-Palmolive Company $CL Acquired by PFA Pension Forsikringsaktieselskab"
CL,2026-05-04,0.9232368748635054,positive,news,JPMorgan Chase & Co. Issues Positive Forecast for Colgate-Palmolive (NYSE:CL) Stock Price
CL,2026-05-04,0.7125469744205475,positive,news,"Colgate-Palmolive Maintained 2026 Earnings Guidance Despite Shrinking Gross Margins, UBS Says"
CL,2026-05-04,0.9331610575318336,positive,news,Can PG's Cost Discipline Neutralize Weak Consumer Volumes?
CL,2026-05-04,0.8016401529312134,positive,news,"Colgate-Palmolive's (CL) ""Outperform"" Rating Reaffirmed at Royal Bank Of Canada"
CL,2026-05-04,0.937499200925231,positive,news,JPMorgan Lifts Colgate Price Target to $96: Why Emerging Markets Are Powering the Defensive Trade
CL,2026-05-04,0.9371942803263664,positive,news,UBS raises Colgate-Palmolive stock price target on strong quarter
CL,2026-05-04,0.9211160019040108,positive,news,UBS raises Colgate-Palmolive stock price target on strong quarter
CL,2026-05-04,0.9365924149751663,positive,news,UBS raises Colgate-Palmolive stock price target on strong quarter By Investing.com
CL,2026-05-04,0.9377132374793291,positive,news,"B. Riley Raises Price Target on Bandwidth to $55 From $27, Keeps Buy Rating"
CL,2026-05-04,-0.04595522582530975,neutral,news,atlanticus holdings corporation Earnings dates
CL,2026-05-04,0.7505213767290115,positive,news,BMO upgrades Dow stock rating on Iran supply disruption impact
CL,2026-05-04,0.9334224946796894,positive,news,"Deutsche Bank Adjusts Colgate-Palmolive Price Target to $99 From $98, Maintains Buy Rating"
CL,2026-05-04,0.8791626580059528,positive,news,"JPMorgan Adjusts Price Target on Colgate-Palmolive to $96 From $95, Maintains Overweight Rating"
CL,2026-05-04,0.9356591086834669,positive,news,"Colgate-Palmolive gains after strong Q1, reiterated full-year guidance"
CL,2026-05-03,0.9332815166562796,positive,news,Does Colgate-Palmolive’s Q1 2026 Results And New Savings Plan Change The Bull Case For CL?
CL,2026-05-03,0.9153181379660964,positive,news,Is Colgate-Palmolive Company (CL) A Good Stock To Buy Now?
CL,2026-05-03,0.9250854505226016,positive,news,Is The Procter & Gamble Company (PG) A Good Stock To Buy Now?
CL,2026-05-03,0.9095575409010053,positive,news,"CX Institutional Purchases 15,983 Shares of Colgate-Palmolive Company $CL"
CL,2026-05-02,-0.7358228117227554,negative,news,US Bancorp DE Decreases Holdings in Colgate-Palmolive Company $CL
CL,2026-05-02,0.9357986319810152,positive,news,Colgate-Palmolive Company (NYSE:CL) Q1 2026 Earnings Call Transcript
CL,2026-05-02,0.9362346809357405,positive,news,Colgate-Palmolive (NYSE: CL) grows Q1 2026 sales while expanding major productivity program
CL,2026-05-02,-0.96250906214118,negative,news,Colgate-Palmolive (CL) One Off Loss Hits Margins And Tests Premium P E Narrative
CL,2026-05-02,0.9260123390704393,positive,news,"Colgate-Palmolive Company (NYSE:CL) Receives Consensus Rating of ""Moderate Buy"" from Brokerages"
CL,2026-05-02,0.9178661722689867,positive,news,Colgate-Palmolive Co (CL) Q1 2026 Earnings Call Highlights: Strong Growth Amidst Cost Challenges By GuruFocus
CL,2026-05-01,-9.105540812015533e-05,neutral,news,Colgate-Palmolive Company 2026 Q1 - Results - Earnings Call Presentation (NYSE:CL) 2026-05-01
CL,2026-05-01,0.14958864450454712,positive,news,Church & Dwight (CHD) Q1 2026 Earnings Preview: Tariff Mitigation and Organic Growth Hold the Key
CL,2026-05-01,-0.003669288009405136,neutral,news,The Goldman Sachs Group Stock Recommendations & Analyst Ratings 2026
CL,2026-05-01,0.8032089024782181,positive,news,Oil Prices Up 9% for the Week
CL,2026-05-01,0.9285210464149714,positive,news,Colgate-Palmolive beats Q1 2026 earnings estimates
CL,2026-05-01,-0.9569498635828495,negative,news,"Colgate-Palmolive Q1 Profit Down, Backs FY26 Earnings, Sales Growth View; Stock Up"
CL,2026-05-01,-0.830833338201046,negative,news,Colgate-Palmolive beats Q1 2026 earnings estimates
CL,2026-05-01,0.9033099301159382,positive,news,Colgate-Palmolive beats Q1 estimates on strong international demand By Reuters
CL,2026-05-01,-0.9315531272441149,negative,news,Colgate-Palmolive Company $CL Stock Holdings Lowered by Savoir Faire Capital Management L.P.
CL,2026-05-01,0.8287069499492645,positive,news,Colgate-Palmolive beats Q1 estimates on strong international demand
CL,2026-05-01,-0.7778755128383636,negative,news,Colgate-Palmolive (NYSE: CL) lifts Q1 sales and expands savings program
CL,2026-05-01,0.9405579604208469,positive,news,Colgate-Palmolive’s (NYSE:CL) Q1 CY2026 Sales Beat Estimates
CL,2026-05-01,0.904911246150732,positive,news,"Colgate-Palmolive tops Q1 expectations after broad-based growth, shares gain"
CL,2026-05-01,-0.9244250506162643,negative,news,"Dominion Energy, Inc. Q1 Profit Declines"
CL,2026-05-01,0.9177357312291861,positive,news,Colgate-Palmolive: Q1 Earnings Snapshot
CL,2026-05-01,0.9193358477205038,positive,news,Colgate-Palmolive: Q1 Earnings Snapshot
CL,2026-05-01,0.9320547357201576,positive,news,Colgate-Palmolive's Q1 net sales above forecast at $5.3B
CL,2026-05-01,0.8942318595945835,positive,news,Colgate-Palmolive Q1 net sales above forecast at $5.3B
CL,2026-05-01,0.8256675042212009,positive,news,"Earnings Flash (CL) Colgate-Palmolive Company Posts Q1 Adjusted EPS $0.97 per Share, vs. FactSet Est of $0.96"
CL,2026-05-01,0.6904151737689972,positive,news,State of New Jersey Common Pension Fund D Has $20.19 Million Stake in Colgate-Palmolive Company $CL
CL,2026-05-01,-0.9105139821767807,negative,news,Danica Pension Livsforsikringsaktieselskab Decreases Stock Position in Colgate-Palmolive Company $CL
CL,2026-05-01,0.8677303679287434,positive,news,O’Reilly Automotive Inc (ORLY) Q1 2026 Earnings Call Highlights: Strong Sales Growth and ... By GuruFocus
CL,2026-05-01,0.8779635764658451,positive,news,Colgate-Palmolive Earnings Are Imminent; These Most Accurate Analysts Revise Forecasts Ahead Of Earnings Call
CL,2026-05-01,0.9234871659427881,positive,news,Colgate-Palmolive: Q1 Earnings Snapshot
BRK-B,2026-05-04,0.6873804116621614,positive,news,"Berkshire Under Greg Abel: $234M Buyback, $397B Cash Pile"
BRK-B,2026-05-04,0.9320066068321466,positive,news,Berkshire Hathaway reports higher Q1 operating earnings under new CEO Greg Abel
BRK-B,2026-05-04,0.9059926494956017,positive,news,Berkshire Hathaway (BRK.B) Stock: Q1 Profit Jumps 18% as Cash Pile Hits Record $397 Billion
BRK-B,2026-05-03,0.8336927816271782,positive,news,"Greg Abel steps into Buffett’s arena, Berkshire shareholders like what they saw (BRK.B:NYSE)"
BRK-B,2026-05-02,0.9151330627501011,positive,news,Berkshire Hathaway (BRK.B) Stock: Greg Abel’s First Quarter Shows $397B Cash Stockpile
BRK-B,2026-05-02,0.07584058493375778,neutral,news,Greg Abel Faces First Berkshire Meeting As Valuation Gap Draws Focus
BRK-B,2026-05-02,0.9348097145557404,positive,news,"Berkshire Hathaway Q1 operating earnings +18% Y/Y, cash hits $397.4B"
BRK-B,2026-05-02,0.5008591711521149,positive,news,Berkshire Hathaway Inc. First Quarter 2026 Earnings Release
BRK-B,2026-05-01,0.11810057610273361,neutral,news,Berkshire Hathaway Has Entered a New Era With Greg Abel at the Helm
BRK-B,2026-05-01,-0.529500849545002,negative,news,Berkshire Hathaway CEO Greg Abel Reveals This Year’s Meeting Will Be A Little Different
BRK-B,2026-04-30,-0.9643703224137425,negative,news,Berkshire’s Ailing Share Price Clouds Abel’s First Annual Meeting as CEO
BRK-B,2026-04-27,0.35389051865786314,neutral,news,Berkshire Hathaway Inc. Class B Trade Ideas — BSESOF:BRYN
BRK-B,2026-04-26,0.2310564834624529,neutral,news,Berkshire Hathaway’s $370 Billion Question: Greg Abel Faces First Big Test After Warren Buffett
BRK-B,2026-04-26,0.03103802353143692,neutral,news,Berkshire Hathaway Inc. Class B Trade Ideas — BSESOF:BRYN
BRK-B,2026-04-22,0.21411742083728313,neutral,news,"Tom Russo’s Investing Style: Global Brands, Quality Compounders, Long-Term Value"
BRK-B,2026-04-21,0.9394592978060246,positive,news,Walmart’s Market Cap Surpasses Berkshire Hathaway for First Time in Nearly Twelve Years
BRK-B,2026-04-19,0.12183164898306131,neutral,news,Berkshire Hathaway (B) stock (US0846707026): Why Google Discover changes matter more now
BRK-B,2026-04-19,0.19069917686283588,neutral,news,Berkshire Hathaway (B) stock (US0846707026): Why Google Discover changes matter more now
BRK-B,2026-04-17,0.18156224209815264,neutral,news,Berkshire Hathaway (NYSE: BRK) issues multi-maturity senior notes due 2029–2056
BRK-B,2026-04-14,-0.00709235854446888,neutral,news,Berkshire Hathaway Inc. Class B Trade Ideas — BSESOF:BRYN
BRK-B,2026-04-14,-0.0007950998842716217,neutral,news,Berkshire Hathaway Inc. Class B Revenue Breakdown – BSESOF:BRYN
BRK-B,2026-04-13,0.030458586290478706,neutral,news,Berkshire Hathaway Inc. Class B Trade Ideas — BSESOF:BRYN
BRK-B,2026-04-13,-0.0203570406883955,neutral,news,Berkshire Hathaway Inc. Shs -B CAD hedged- Canadian Depositary Receipt Repr Shs B Reg S Trade Ideas
BRK-B,2026-04-10,0.08903281763195992,neutral,news,Buffett Reflects On Apple Sale As Berkshire Balances Patience And Opportunity
BRK-B,2026-04-09,-0.8572577778249979,negative,news,"Berkshire brokerage must face commission lawsuit despite settlement, judge rules - report (BRK.B:NYSE)"
BRK-B,2026-04-09,-0.006068810820579529,neutral,news,Berkshire Hathaway Inc. Class B Trade Ideas — NYSE:BRK.B
BRK-B,2026-04-08,0.015943337231874466,neutral,news,Berkshire Hathaway Inc. Class A Trade Ideas — BOATS:BRK.A
BRK-B,2026-04-08,0.0023276470601558685,neutral,news,Berkshire Hathaway Inc. Class B Trade Ideas — BSESOF:BRYN
BRK-B,2026-04-08,0.06910793110728264,neutral,news,Berkshire Hathaway Inc. Class A Trade Ideas — BOATS:BRK.A
BRK-B,2026-04-03,0.7559389173984528,positive,news,Berkshire Hathaway (B) stock: Why it's lagging but analysts see upside
BRK-B,2026-04-03,0.6565461242571473,positive,news,Berkshire Hathaway (BRK.B) Insures Ships Traveling Through the Strait of Hormuz
BRK-B,2026-04-03,-0.14344192296266556,neutral,news,Berkshire Hathaway Inc. Class A Trade Ideas — BOATS:BRK.A
BRK-B,2026-04-01,0.7916491776704788,positive,news,The Oracle’s Resilience: Berkshire Hathaway Snaps Eight-Day Slide as Buffett Eyes Market ‘Fear’
BRK-B,2026-03-31,0.0005320385098457336,neutral,news,Berkshire Hathaway Inc. Class B Trade Ideas — HAN:BRYN
BRK-B,2026-03-31,0.9355558231472969,positive,news,Warren Buffett's Energy Picks Soared as Berkshire Hathaway Had 8 Straight Losing Sessions
BRK-B,2026-03-30,-0.9640937875956297,negative,news,Berkshire Hathaway (BRK.A) Records Longest Losing Streak Since 2018 Under New CEO Abel
BRK-B,2026-03-29,-0.9540807586163282,negative,news,Berkshire Hathaway Stock Drops for 8 Days. Is It a Good Time to Buy?
BRK-B,2026-03-29,-0.8227420970797539,negative,news,Berkshire Hathaway Just Notched an 8-Day Losing Streak. Is It a Good Time to Buy the Stock?
BRK-B,2026-03-29,-0.9650931069627404,negative,news,Berkshire Hathaway (BRK.A) Records Longest Losing Streak Since 2018 Under New CEO Abel
BRK-B,2026-03-29,0.14916132856160402,neutral,news,"OMAH Promises Monthly Income From Berkshire Holdings, With One Major Catch"
BRK-B,2026-03-28,0.15933953132480383,neutral,news,Berkshire Hathaway Under Greg Abel Balancing Oxychem Deal And Cash Choices
BRK-B,2026-03-28,-0.9628930734470487,negative,news,Berkshire shares suffer longest losing streak in more than 7 years
BRK-B,2026-03-28,-0.024462968111038208,neutral,news,Cash per share of Berkshire Hathaway Inc. Class B – BSESOF:BRYN
BRK-B,2026-03-28,0.06653385423123837,neutral,news,Ajit Jain (NYSE: BRK) reports charitable gift of Berkshire Hathaway Class B shares
BRK-B,2026-03-27,-0.03942478075623512,neutral,news,Operating cash flow per share of Berkshire Hathaway Inc. Class B – BSESOF:BRYN
BRK-B,2026-03-27,-0.006212102249264717,neutral,news,Berkshire Hathaway Inc. (Class B)
BRK-B,2026-03-21,-0.7779207527637482,negative,news,Why Berkshire Hathaway Stock Barely Budged as Wall Street Sank on Oil Fears
BRK-B,2026-03-20,-0.8119002282619476,negative,news,Berkshire Hathaway Inc stock faces valuation scrutiny amid leadership transition and cash pile chall
BRK-B,2026-03-20,-0.6049225479364395,negative,news,Berkshire Hathaway Inc stock faces valuation scrutiny amid leadership transition and cash pile chall
BRK-B,2026-03-19,0.022571058943867683,neutral,news,Warren Buffett (BRK) donates 2 Berkshire Hathaway Class A shares to charity
MPC,2026-05-05,-0.042503245174884796,neutral,sec_filing,MPC 8-K Filing - 2026-05-05
PFE,2026-05-05,-0.04460453614592552,neutral,sec_filing,PFE 8-K Filing - 2026-05-05
PFE,2026-05-05,-0.06336233764886856,neutral,sec_filing,PFE 10-Q Filing - 2026-05-05
PYPL,2026-05-05,-0.0627766028046608,neutral,sec_filing,PYPL 8-K Filing - 2026-05-05
AXP,2026-05-04,-0.05440523847937584,neutral,sec_filing,AXP 8-K Filing - 2026-05-04
MRK,2026-05-04,-0.0570007786154747,neutral,sec_filing,MRK 10-Q Filing - 2026-05-04
META,2026-05-04,-0.045412153005599976,neutral,sec_filing,META 8-K Filing - 2026-05-04
GILD,2026-05-04,-0.03659874014556408,neutral,sec_filing,GILD 8-K Filing - 2026-05-04
USB,2026-05-04,-0.06993379630148411,neutral,sec_filing,USB 10-Q Filing - 2026-05-04
OXY,2026-05-04,-0.03497013635933399,neutral,sec_filing,OXY 8-K Filing - 2026-05-04
AXP,2026-05-04,-0.05440523847937584,neutral,sec_filing,AXP 8-K Filing - 2026-05-04
XOM,2026-05-04,-0.04700271040201187,neutral,sec_filing,XOM 10-Q Filing - 2026-05-04
XOM,2026-05-04,-0.022313913330435753,neutral,sec_filing,XOM 8-K Filing - 2026-05-04
RTX,2026-05-04,-0.028429044410586357,neutral,sec_filing,RTX 8-K Filing - 2026-05-04
JPM,2026-05-01,-0.09710703045129776,neutral,sec_filing,JPM 10-Q Filing - 2026-05-01
CVX,2026-05-01,-0.02824178896844387,neutral,sec_filing,CVX 8-K Filing - 2026-05-01
AAPL,2026-05-01,-0.0825091926380992,neutral,sec_filing,AAPL 10-Q Filing - 2026-05-01
BAC,2026-05-01,-0.051123373210430145,neutral,sec_filing,BAC 10-Q Filing - 2026-05-01
GS,2026-05-01,-0.07353901769965887,neutral,sec_filing,GS 10-Q Filing - 2026-05-01
GS,2026-05-01,-0.04668164998292923,neutral,sec_filing,GS 8-K Filing - 2026-05-01
AMGN,2026-05-01,-0.058964524418115616,neutral,sec_filing,AMGN 10-Q Filing - 2026-05-01
TMO,2026-05-01,-0.08196612913161516,neutral,sec_filing,TMO 10-Q Filing - 2026-05-01
MPC,2026-05-01,-0.03783098980784416,neutral,sec_filing,MPC 8-K Filing - 2026-05-01
DE,2026-05-01,-0.0504572968930006,neutral,sec_filing,DE 8-K Filing - 2026-05-01
KO,2026-05-01,-0.041118139401078224,neutral,sec_filing,KO 8-K Filing - 2026-05-01
VZ,2026-05-01,-0.07978602591902018,neutral,sec_filing,VZ 10-Q Filing - 2026-05-01
IBM,2026-05-01,-0.0327055174857378,neutral,sec_filing,IBM 8-K Filing - 2026-05-01
CSCO,2026-05-01,-0.05332800932228565,neutral,sec_filing,CSCO 8-K Filing - 2026-05-01
WMT,2026-04-30,-0.06142667308449745,neutral,sec_filing,WMT 8-K Filing - 2026-04-30
WFC,2026-04-30,-0.06378022767603397,neutral,sec_filing,WFC 8-K Filing - 2026-04-30
CAT,2026-04-30,-0.037497565150260925,neutral,sec_filing,CAT 8-K Filing - 2026-04-30
CI,2026-04-30,-0.05419164150953293,neutral,sec_filing,CI 8-K Filing - 2026-04-30
CI,2026-04-30,-0.07660193182528019,neutral,sec_filing,CI 10-Q Filing - 2026-04-30
MA,2026-04-30,-0.06370682455599308,neutral,sec_filing,MA 10-Q Filing - 2026-04-30
MA,2026-04-30,-0.04234103485941887,neutral,sec_filing,MA 8-K Filing - 2026-04-30
INTC,2026-04-30,-0.02681354247033596,neutral,sec_filing,INTC 8-K Filing - 2026-04-30
PYPL,2026-04-30,-0.061513034626841545,neutral,sec_filing,PYPL 8-K Filing - 2026-04-30
KO,2026-04-30,-0.08585482183843851,neutral,sec_filing,KO 10-Q Filing - 2026-04-30
AAPL,2026-04-30,-0.04056346043944359,neutral,sec_filing,AAPL 8-K Filing - 2026-04-30
AMGN,2026-04-30,-0.04178714379668236,neutral,sec_filing,AMGN 8-K Filing - 2026-04-30
META,2026-04-30,-0.0639171889051795,neutral,sec_filing,META 10-Q Filing - 2026-04-30
GOOGL,2026-04-30,-0.08338872902095318,neutral,sec_filing,GOOGL 10-Q Filing - 2026-04-30
MRK,2026-04-30,-0.04301197826862335,neutral,sec_filing,MRK 8-K Filing - 2026-04-30
LLY,2026-04-30,-0.058407606557011604,neutral,sec_filing,LLY 10-Q Filing - 2026-04-30
LLY,2026-04-30,-0.034118153154850006,neutral,sec_filing,LLY 8-K Filing - 2026-04-30
BMY,2026-04-30,-0.1049802927300334,neutral,sec_filing,BMY 10-Q Filing - 2026-04-30
BMY,2026-04-30,-0.06332356855273247,neutral,sec_filing,BMY 8-K Filing - 2026-04-30
AMZN,2026-04-30,-0.08251620456576347,neutral,sec_filing,AMZN 10-Q Filing - 2026-04-30
COP,2026-04-30,-0.08359012100845575,neutral,sec_filing,COP 10-Q Filing - 2026-04-30
COP,2026-04-30,-0.07231981493532658,neutral,sec_filing,COP 8-K Filing - 2026-04-30
