ticker,date,sentiment_score,sentiment_label,content_type,title
SCHW,2026-06-24,0.4679575636982918,positive,news,Charles Schwab (SCHW) Stock Could Be 25% Below Fair Value After Asset Growth Surge
SCHW,2026-06-24,-0.9566712332889438,negative,news,"AdvisorNet Financial Inc Sells 3,378 Shares of Lockheed Martin Corporation $LMT"
SCHW,2026-06-24,0.13859860226511955,neutral,news,Cboe launches prediction market suite with binary option contracts on S&P 500
SCHW,2026-06-24,0.12500236555933952,neutral,news,Cboe launches prediction market suite with binary option contracts on S&P 500
SCHW,2026-06-24,0.06675676256418228,neutral,news,Brandywine Realty Trust (BDN) Institutional Confidence
SCHW,2026-06-24,0.04634830728173256,neutral,news,"ETFs Investing in Enliven Therapeutics, Inc. Stocks"
SCHW,2026-06-24,0.21489206794649363,neutral,news,2 Minutes on the Markets | U.S. Insights
SCHW,2026-06-23,0.20558778615668416,neutral,news,"Cboe Introduces Cboe Predicts, Launching First Products in New Prediction Markets Suite"
SCHW,2026-06-23,0.5651451498270035,positive,news,Wealthfront Launches Custodial Accounts for Young Investors
SCHW,2026-06-23,0.23521278332918882,neutral,news,"Cboe Introduces Cboe Predicts, Launching First Products in New Prediction Markets Suite"
SCHW,2026-06-23,-0.22221580147743225,negative,news,Charles Schwab Corp. stock outperforms competitors on strong trading day
SCHW,2026-06-23,-0.9573573404923081,negative,news,Winners And Losers Of Q1: Stifel (NYSE:SF) Vs The Rest Of The Investment Banking & Brokerage Stocks
SCHW,2026-06-23,0.9077958287671208,positive,news,Is Schwab Fundamental U.S. Broad Market ETF (FNDB) a Strong ETF Right Now?
SCHW,2026-06-23,0.9117888836190104,positive,news,"Charles Schwab wins Civic 50 nod again, with $100M+ in community giving"
SCHW,2026-06-23,0.8563543753698468,positive,news,Charles Schwab Recognized Among Nation’s Most Community-Minded Companies for 10th Consecutive Year
SCHW,2026-06-23,-0.3269706815481186,neutral,news,"Under cover of a holiday weekend, two 'risky' Schwab stories break; RIAs get a shorter leash, again, on long-short funds, and retail investors get unleashed to enter prediction markets-- news reports"
SCHW,2026-06-22,-0.9058423396199942,negative,news,"Investors sue Blue Owl adviser, allege inflated marks drove windfall fees"
SCHW,2026-06-22,0.9219098929315805,positive,news,Schwab US Large-Cap Growth ETF offers strong AI tech exposure with top firms like Nvidia and Apple.
SCHW,2026-06-22,-0.005312386900186539,neutral,news,"Charles Schwab (OCC) Form 144: Open-market share entries of 13,000; 7,800; 1,552"
SCHW,2026-06-22,0.6884779911488295,positive,news,Schwab's Prediction Market Push: What Investors Should Know
SCHW,2026-06-22,0.9250898640602827,positive,news,Charles Schwab (SCHW) Reports Record May Core Net New Assets
SCHW,2026-06-21,0.31020835787057877,neutral,news,Charles Schwab is working with Cboe to launch S&P 500 'yes-or-no' binary options contracts: WSJ
SCHW,2026-06-20,0.8712571980431676,positive,news,Charles Schwab (SCHW) Enters Prediction Markets After SpaceX IPO Liquidity Strain
SCHW,2026-06-20,0.005644673481583595,neutral,news,"ETFs Investing in Extreme Networks, Inc. Stocks"
SCHW,2026-06-20,0.9343746490776539,positive,news,Snap-On Incorporated $SNA Position Boosted by Auto Owners Insurance Co
PFE,2026-06-25,0.8076558634638786,positive,news,What Bristol-Myers Squibb (BMY)'s Phase 3 Izalontamab Results Mean For Shareholders
PFE,2026-06-25,0.9206361621618271,positive,news,"VKTX Stock Eyes Best Week In 2 Years: Retail Bulls Bet Q3 Obesity Data Could Put Novo, Big Pharma In Buyout Play"
PFE,2026-06-24,0.4022502857260406,neutral,news,Oncology consulting services to speed the path to approval
PFE,2026-06-24,0.9034410836175084,positive,news,TRYNGOLZA® (olezarsen) approved by the FDA as the first and only treatment to reduce triglycerides and the risk of acute pancreatitis in patients with severe hypertriglyceridemia (sHTG)
PFE,2026-06-24,-0.4985476844012737,negative,news,Pfizer Freed From US States’ Drug Price-Fixing Conspiracy Claims
PFE,2026-06-24,-0.20492172241210938,negative,news,Pfizer Freed From US States’ Drug Price-Fixing Conspiracy Claims
PFE,2026-06-24,0.864073577336967,positive,news,"Pfizer granted FDA label expansion for breast cancer drug, Ibrance"
PFE,2026-06-24,0.9324768912047148,positive,news,Pfizer Advances New Pediatric Pneumococcal “Catch-Up” Vaccine in Phase 3 Trial
PFE,2026-06-24,0.4047574559226632,neutral,news,Nike names former Pfizer CFO David Denton as finance chief
PFE,2026-06-24,-0.9578935252502561,negative,news,Case Summary: Sangamo Therapeutics Chapter 11
PFE,2026-06-24,-0.7086163572967052,negative,news,Recent pharma exec shake-ups signal strategic shifts
PFE,2026-06-24,-0.026414550840854645,neutral,news,Nike names Pfizer CFO David Denton to replace Matthew Friend
PFE,2026-06-24,0.75090416893363,positive,news,Nike names Pfizer CFO David Denton to replace Matthew Friend
PFE,2026-06-24,-0.9635696997866035,negative,news,"Biotech firm files for bankruptcy with $115M debt; Eli Lilly, Astellas bet on it anyway"
PFE,2026-06-24,0.8452709540724754,positive,news,"Analysts Offer Insights on Healthcare Companies: AbbVie (ABBV), Pfizer (PFE) and Insulet (PODD)"
PFE,2026-06-24,0.15985588915646076,neutral,news,"Analysts Offer Insights on Healthcare Companies: AbbVie (ABBV), Pfizer (PFE) and Insulet (PODD)"
PFE,2026-06-24,0.9175539622083306,positive,news,"Zacks Investment Ideas feature highlights: IBB, Novartis, Pfizer and Eli Lilly's"
PFE,2026-06-24,0.8835901115089655,positive,news,"China approval for Eli Lilly GLP-1 pill to come as soon as 2026, executive says"
PFE,2026-06-24,0.014480045065283775,neutral,news,Pfizer Invites Public to View and Listen to Webcast of August 4 Conference Call with Analysts
PFE,2026-06-24,0.22389112040400505,neutral,news,"Crescent Biopharma general counsel sells $21,911 in shares"
PFE,2026-06-24,0.9174903444945812,positive,news,The Strategy That Beat the Market by Shunning US Dominance: VanEck's TDIV at 10 Years
PFE,2026-06-23,0.21195727214217186,neutral,news,"Nike, Inc. Taps Pfizer CFO to Fill its CFO Role as Matthew Friend Plans Departure"
PFE,2026-06-23,0.16127756424248219,neutral,news,Nike Hires Pfizer's Denton to Take Over for Departing CFO
PFE,2026-06-23,0.9340115077793598,positive,news,Merck & Co Inc Stock (MRK) Moved Up by 3.23% on Jun 23: Key Drivers Unveiled
PFE,2026-06-23,-0.8806936573237181,negative,news,CAFC Affirms Enanta Coronavirus Patent Invalid for Lack of Written Description Support in Provisional Application
PFE,2026-06-23,-0.7084718272089958,negative,news,"UPDATE: Lilly, Astellas circle Sangamo assets as biotech files for bankruptcy"
PFE,2026-06-23,-0.3859500288963318,negative,news,Viatris Soared 54%: Time To Be More Careful (Rating Downgrade) (NASDAQ:VTRS)
PFE,2026-06-23,0.08893075585365295,positive,news,Pfizer patent win against Enanta upheld on appeal (PFE:NYSE)
PFE,2026-06-23,-0.9459309354424477,negative,news,Pfizer drug acquired in Seagen deal disappoints in lung cancer study
PFE,2026-06-23,-0.7332873493432999,negative,news,Pfizer Keeps Win in Patent Lawsuit Aimed at Paxlovid Antiviral
PFE,2026-06-23,0.027582385577261448,neutral,news,Pfizer Invites Public to View and Listen to Webcast of August 4 Conference Call with Analysts
PFE,2026-06-23,0.8882971527054906,positive,news,Does US manufacturing give drugmakers a speed edge?
PFE,2026-06-23,0.9338026354089379,positive,news,Cantor Fitzgerald reiterates Crescent Biopharma stock rating
PFE,2026-06-23,0.9288990050554276,positive,news,Pfizer's Mixed Phase III Data for Sigvotatug Vedotin in NSCLC
PFE,2026-06-23,0.23210872523486614,neutral,news,H.C. Wainwright reiterates Enanta stock rating on FDA alignment
PFE,2026-06-23,0.7220335677266121,positive,news,IGC Pharma's AI tool cuts Alzheimer’s data prep from 28 hours to 2.5
PFE,2026-06-23,0.7671092674136162,positive,news,IGC Pharma's AHA Agentic AI Platform Reduces Alzheimer's Data Harmonization Time by 90% in Representative Workflow
PFE,2026-06-23,0.26845977269113064,neutral,news,Avalo Therapeutics appoints Ron Philip to board of directors
PFE,2026-06-23,0.9076422099024057,positive,news,Avalo Therapeutics appoints Ron Philip to board of directors By Investing.com
PFE,2026-06-23,0.7932805549353361,positive,news,Pfizer (PFE) Misses Main Goal For Lung Cancer Drug But Sees Subgroup Hope
PFE,2026-06-23,-0.9244635812938213,negative,news,Pfizer lung cancer drug fails in late-stage trial (PFE:NYSE)
PFE,2026-06-23,0.7127830637618899,positive,news,Avalo Therapeutics Appoints Ron Philip to Board of Directors
PFE,2026-06-23,0.8340564891695976,positive,news,IGC Pharma's AHA Agentic AI Platform Reduces Alzheimer's Data Harmonization Time by 90% in Representative Workflow
PFE,2026-06-23,-0.920188088901341,negative,news,PFIZER INC : Jefferies reiterates its Buy rating
PFE,2026-06-23,0.9090366326272488,positive,news,Pfizer’s experimental drug misses main goal of lung cancer trial
PFE,2026-06-23,-0.824478879570961,negative,news,Pfizer's Lung Cancer Drug Trial Fails To Boost Survival
PFE,2026-06-23,0.9187574461102486,positive,news,Pfizer's Cancer Drug Trial Results Mixed Yet Promising
PFE,2026-06-23,0.4459683895111084,positive,news,Pfizer’s lung cancer drug trial fails to boost survival
PFE,2026-06-22,0.9420894747599959,positive,news,How Teva’s Ecopipam Tourette NDA and AUSTEDO Data Will Impact Teva Pharmaceutical Industries (TEVA) Investors
PFE,2026-06-22,0.06961871311068535,neutral,news,"Exosomes Pipeline 2026: Therapies Under Investigation, Clinical Trials Milestones, and FDA Approvals by DelveInsight | Innovex Therapeutics, Coya Therapeutics, EV Therapeutics, Endosome Therapy StemXO"
MDT,2026-06-25,0.9315383452922106,positive,news,How An ALZpath Alzheimer’s Test Deal And Dividend Streak At Abbott (ABT) Has Changed Its Investment Story
MDT,2026-06-25,-0.5470328405499458,negative,news,"Stifel Adjusts Price Target on Boston Scientific to $65 From $75, Maintains Buy Rating"
MDT,2026-06-25,0.9360866621136665,positive,news,Needham Remains Bullish On Medtronic (MDT) Amid Renal Device Growth
MDT,2026-06-24,0.09746488556265831,neutral,news,Intuitive Surgical : ISRG
MDT,2026-06-24,0.18924371153116226,neutral,news,Do Intuitive Surgical’s (ISRG) New Commercial Leaders Reframe Its Resilience Amid FDA Scrutiny?
MDT,2026-06-24,0.7913598362356424,positive,news,Bullish Senseonics Holdings Insiders Loaded Up On US$612.0k Of Stock
MDT,2026-06-23,0.08026503026485443,neutral,news,Top 3 Dividend Stocks Offering Up To 5.3% Yield
MDT,2026-06-23,0.6964330077171326,positive,news,Insulet hires first chief R&D officer amid growing competition
MDT,2026-06-23,-0.9146949909627438,negative,news,Jim Cramer on Intuitive Surgical: “Too Much Competition”
MDT,2026-06-23,-0.4596080183982849,negative,news,Is Procedure Growth Broad-Based Enough to Support ISRG's 2026 Outlook?
MDT,2026-06-23,0.12042601779103279,neutral,news,Accenture And 2 US Dividend Stocks With Stable Income And Growth
MDT,2026-06-23,-0.932919654995203,negative,news,Jim Cramer on Boston Scientific: “This Whole Cohort Is Just Too Hard to Own”
MDT,2026-06-22,0.013644490391016006,neutral,news,Enovis Corp (ENOV) Earnings Forecast: Future EPS & Revenue Growth Estimates
MDT,2026-06-22,0.9328663386404514,positive,news,Medtronic plc (MDT) Stock Analysis: Exploring a 23.52% Upside Potential Amid Strong Buy Ratings
MDT,2026-06-22,0.9104219088330865,positive,news,Penumbra Expands Portfolio With Approval To Treat Stroke; Acquisition by Boston on Track
MDT,2026-06-22,0.12659770995378494,neutral,news,"SI-BONE strategy focuses on differentiated sacropelvic implants, shares on Nasdaq in a competitive m"
MDT,2026-06-22,0.6049014199525118,positive,news,VASRO Research Highlights Ainos' Expansion of Smell AI Into Patient-Level Breath Intelligence
MDT,2026-06-22,-0.8515405934303999,negative,news,Cyberattacks on medtech companies become a frequent occurrence
MDT,2026-06-22,0.06958364322781563,neutral,news,Cencora Inc (COR) Earnings Forecast: Future EPS & Revenue Growth Estimates
MDT,2026-06-21,0.9355968721210957,positive,news,Medtronic (MDT) Completes $550M Acquisition of Scientia Vascular
MDT,2026-06-20,-0.028582006692886353,negative,news,Medtronic (MDT) Stock Could Be 12.2% Undervalued After Strong Revenue Growth
MDT,2026-06-20,0.7055395096540451,positive,news,Medtronic (MDT) Stock Could Be 12.2% Undervalued After Strong Revenue Growth
MDT,2026-06-19,0.13367289304733276,positive,news,"Analysts Offer Insights on Healthcare Companies: Odyssey Therapeutics, Inc. (ODTX), Capricor Therapeutics (CAPR) and Medtronic (MDT)"
MDT,2026-06-19,0.865539226680994,positive,news,Medtronic completes acquisition of Scientia Vascular
MDT,2026-06-19,0.7989234868437052,positive,news,Cytokinetics (CYTK) Stock Could Be 15% Undervalued After Myqorzo Approval
MDT,2026-06-18,0.8020451366901398,positive,news,Medtronic PLC stock outperforms competitors on strong trading day
MDT,2026-06-18,0.9344712756574154,positive,news,"Medtronic plc FY 2026: Revenue $36.36B, EPS $3.73— 10-K Summary"
MDT,2026-06-18,-0.0360336285084486,neutral,news,[IRANNOTICE] Medtronic plc SEC Filing
MDT,2026-06-18,0.10184862092137337,neutral,news,Tandem Diabetes Care Inc (TNDM) Earnings Forecast: Future EPS & Revenue Growth Estimates
MDT,2026-06-18,0.07560830749571323,neutral,news,BioLife Solutions Inc (BLFS) Earnings Forecast: Future EPS & Revenue Growth Estimates
MDT,2026-06-18,0.9182480163872242,positive,news,American Society of Anesthesiologists Announces 12-Year Collaboration with Medtronic as a Corporate Supporter | Newswise
MDT,2026-06-18,0.9044241504743695,positive,news,American Society of Anesthesiologists Announces 12-Year Collaboration with Medtronic as a Corporate Supporter | Newswise
MDT,2026-06-18,0.07753228396177292,neutral,news,Adapthealth Corp (AHCO) Earnings Forecast: Future EPS & Revenue Growth Estimates
MDT,2026-06-18,0.88777622487396,positive,news,This Undervalued Medical-Devices Stock Is Poised for a Rebound
MDT,2026-06-18,0.8640421740710735,positive,news,InfuSystem Holdings Inc (INFU) Earnings Forecast: Future EPS & Revenue Growth Estimates
MDT,2026-06-18,0.9416867671534419,positive,news,Is Intuitive Surgical Stock Undervalued in 2026 After Operating Margins Hit 31%?
MDT,2026-06-18,0.04826047644019127,neutral,news,Pulmonx Corp (LUNG) Earnings Forecast: Future EPS & Revenue Growth Estimates
MDT,2026-06-18,0.025847846642136574,neutral,news,Envista Holdings Corp (NVST) Earnings Forecast: Future EPS & Revenue Growth Estimates
MDT,2026-06-18,-0.5981116853654385,negative,news,Stevanato Group SpA (STVN) Earnings Forecast: Future EPS & Revenue Growth Estimates
MDT,2026-06-18,0.1494728922843933,neutral,news,Orchestra Biomed Holdings Inc (OBIO) Institutional Confidence
MDT,2026-06-18,0.17618758045136929,neutral,news,Novocure Ltd (NVCR) Earnings Forecast: Future EPS & Revenue Growth Estimates
MDT,2026-06-18,0.04927751049399376,neutral,news,AtriCure Inc (ATRC) Earnings Forecast: Future EPS & Revenue Growth Estimates
MDT,2026-06-18,0.05343802459537983,neutral,news,Solventum Corp (SOLV) Earnings Forecast: Future EPS & Revenue Growth Estimates
MDT,2026-06-18,0.04458844102919102,neutral,news,Treace Medical Concepts Inc (TMCI) Earnings Forecast: Future EPS & Revenue Growth Estimates
MDT,2026-06-18,0.07805357128381729,neutral,news,STERIS plc (STE) Earnings Forecast: Future EPS & Revenue Growth Estimates
MDT,2026-06-18,-0.36396709829568863,negative,news,"Analysts’ Opinions Are Mixed on These Healthcare Stocks: enGene Holdings (ENGN), Medtronic (MDT) and Roivant Sciences (ROIV)"
MDT,2026-06-18,0.09431695938110352,neutral,news,SINTX Technologies Inc (SINT) Earnings Forecast: Future EPS & Revenue Growth Estimates
MDT,2026-06-17,0.16295259445905685,neutral,news,Neuraxis Inc (NRXS) Earnings Forecast: Future EPS & Revenue Growth Estimates
MDT,2026-06-17,-0.45416535809636116,negative,news,SI-BONE Inc (SIBN) Earnings Forecast: Future EPS & Revenue Growth Estimates
MDT,2026-06-17,0.08254764415323734,neutral,news,Invo Fertility Ord Shs (IVF) Earnings Forecast: Future EPS & Revenue Growth Estimates
LMT,2026-06-25,-0.9572220649570227,negative,news,Rocket Lab's Stock Plunge Defies $2.2 Billion Backlog and Military Nod
LMT,2026-06-25,0.051992266438901424,neutral,news,"KBR names LaRouche, Veasey to lead planned spinoff By Investing.com"
LMT,2026-06-25,0.1200046157464385,neutral,news,KBR picks leaders for $5B Mission Technology spin-off
LMT,2026-06-25,-0.5714379101991653,negative,news,Corundum Group Inc. Has $11.51 Million Position in Lockheed Martin Corporation $LMT
LMT,2026-06-24,0.8801291016861796,positive,news,Lockheed Martin wins $216 million in new defense contracts
LMT,2026-06-24,-0.9629898276180029,negative,news,Lockheed Martin (LMT) Falls More Steeply Than Broader Market: What Investors Need to Know
LMT,2026-06-24,0.9073572997003794,positive,news,Boeing awarded $2B deal to build next-gen comms sats for Space Force
LMT,2026-06-24,0.47140989266335964,neutral,news,LMT vs. LHX: Which Defense Stock Has the Stronger Competitive Edge?
LMT,2026-06-24,0.9164720568805933,positive,news,"Arqit Quantum (NASDAQ:ARQQ) climbs after fresh U.S. quantum security deals, SEC filing"
LMT,2026-06-24,-0.9019511267542839,negative,news,Aditxt (NASDAQ:ADTX) stock rally triggers questions around old share figures after latest SEC filing
LMT,2026-06-24,0.5409162491559982,positive,news,Legal Advantage Investments Inc. Acquires New Shares in Lockheed Martin Corporation $LMT
LMT,2026-06-24,-0.9478316120803356,negative,news,Atlantic International stock rally puts $430 million Dutch wins against going-concern warning
LMT,2026-06-24,0.9019670002162457,positive,news,"TTM Technologies Opens Ultra-HDI Manufacturing Facility in Syracuse, NY, Advancing America's Defense Electronics Industrial Base"
LMT,2026-06-23,0.8481150632724166,positive,news,Lockheed Martin Wins $8.4 Billion Army Missile Contract Boost
LMT,2026-06-23,0.9337354162707925,positive,news,Lockheed Martin wins $8.4B missile contract modification By Investing.com
LMT,2026-06-23,0.8634066954255104,positive,news,Lockheed Martin Secures $8.4B Contract Modification for Missile Production (LMT)
LMT,2026-06-23,0.7491287998855114,positive,news,"Trump says Ford, GM in talks with defense contractors about possible weapons production"
LMT,2026-06-23,-0.9166628085076809,negative,news,Lockheed Martin Corp. stock underperforms Tuesday when compared to competitors despite daily gains
LMT,2026-06-23,-0.5672842264175415,negative,news,Q1 Earnings Roundup: Leidos (NYSE:LDOS) And The Rest Of The Defense Contractors Segment
LMT,2026-06-23,0.7530508413910866,positive,news,CACI taps Lockheed Martin executive David Young for key leadership post
LMT,2026-06-23,0.8290378823876381,positive,news,"Earnings call transcript: TechPrecision posts q4 profit, guides for stronger 2027"
LMT,2026-06-23,0.7009836994111538,positive,news,Lockheed Martin Partners with European Industry for NATO Next Generation Modelling and Simulation Competition
LMT,2026-06-23,0.8017127052880824,positive,news,Ondas’s Sentrycs partners with Lockheed Martin to counter evolving aerial threats
LMT,2026-06-23,0.8850228320807219,positive,news,Ondas subsidiary partners with Lockheed Martin on drone defense
LMT,2026-06-23,-0.8378240913152695,negative,news,Lockheed Martin Corporation (LMT) is Attracting Investor Attention: Here is What You Should Know
LMT,2026-06-23,-0.9680057470686734,negative,news,"2,843 Shares in Lockheed Martin Corporation $LMT Acquired by Worth Asset Management LLC"
LMT,2026-06-23,0.8584344740957022,positive,news,Palladyne AI Wins U.S. Army Contracts for Autonomous Drone Swarms and Gremlin-X Tactical UAV Program
LMT,2026-06-23,0.9379577105864882,positive,news,Signal Advisors Wealth LLC Grows Holdings in RTX Corporation $RTX
LMT,2026-06-23,0.939879048615694,positive,news,LMG Wealth Partners LLC Increases Stake in General Motors Company $GM
LMT,2026-06-23,0.8305551703087986,positive,news,GM In Discussion With RTX And L3Harris For Munition Production Boost
LMT,2026-06-23,0.9317095428705215,positive,news,HII Secures Aircraft Carrier and Amphibious Ship Support Contract
LMT,2026-06-22,0.8535583093762398,positive,news,Lockheed Martin wins $83 million Army missile contract
LMT,2026-06-22,-0.9669339209794998,negative,news,Lockheed Martin Corp Stock (LMT) Moved Down by 3.70% on Jun 22: Facts Behind the Movement
LMT,2026-06-22,0.1989572010934353,neutral,news,BigBear.ai Stock (BBAI) Opinions on Insider Buying and Defense AI Contracts
LMT,2026-06-22,-0.9618382705375552,negative,news,Winners And Losers Of Q1: Leonardo DRS (NASDAQ:DRS) Vs The Rest Of The Defense Contractors Stocks
LMT,2026-06-22,0.9124214500188828,positive,news,How Investors May Respond To V2X (VVX) Surging Institutional Ownership And Contract-Driven Earnings Narrative
LMT,2026-06-22,-0.9678836190141737,negative,news,Lockheed Martin Corp. stock underperforms Monday when compared to competitors
LMT,2026-06-22,-0.8652594909071922,negative,news,China hits US rare earth companies with export bans
LMT,2026-06-22,0.9256715923547745,positive,news,HII Secures Aircraft Carrier and Amphibious Ship Support Contract
LMT,2026-06-22,0.9219439458101988,positive,news,RTX: Raytheon Powers Growth While Valuation Caps Returns
LMT,2026-06-22,0.47180244512856007,neutral,news,CACI Appoints Dave Young as Chief Operating Officer
LMT,2026-06-22,-0.845364224165678,negative,news,"China adds 10 US firms, including rare-earth miner, to export control list"
LMT,2026-06-22,0.9365673419088125,positive,news,The Bull Case For General Dynamics (GD) Could Change Following New Abrams Tank Upgrade Contract Extension - Learn Why
LMT,2026-06-22,0.28377270605415106,neutral,news,[8-K] CACI INTERNATIONAL INC /DE/ Reports Material Event
LMT,2026-06-22,0.742648446932435,positive,news,CACI Names Dr. Dave Young Chief Operating Officer
LMT,2026-06-22,0.28937043622136116,neutral,news,RTX (RTX) Sells Blue Canyon To MDA Space As It Reshapes Its Portfolio
LMT,2026-06-22,0.9207041803747416,positive,news,Lockheed Martin Corporation $LMT Shares Acquired by SG Americas Securities LLC
LMT,2026-06-22,0.9147638771682978,positive,news,Rockefeller Capital Management L.P. Has $41.55 Million Stock Position in General Motors Company $GM
LMT,2026-06-22,-0.927377900108695,negative,news,General Motors Company $GM Stock Position Lessened by Pacer Advisors Inc.
VLO,2026-06-25,0.9288685154169798,positive,news,"Valero Energy outlines robust cash returns, shares stay in focus on the NYSE"
VLO,2026-06-25,0.8674363140016794,positive,news,Is Marathon Petroleum Stock at $247 a Buy in 2026? Here’s What Investors Need to Know
VLO,2026-06-25,0.6332809701561928,positive,news,Phillips 66 CEO Mark Lashier warned of greater refining and petrochemical earnings volatility from Hormuz disruptions
VLO,2026-06-24,0.6290578171610832,positive,news,"Occidental Petroleum CEO buys $249,852 in company stock By Investing.com"
VLO,2026-06-24,0.9359254594892263,positive,news,"Phillips 66 CEO warns of refining, petrochemical earnings volatility from Hormuz disruptions"
VLO,2026-06-24,0.9162333933636546,positive,news,"Marathon Petroleum Is Back, But Cycles Still Matter"
VLO,2026-06-24,0.8913588374853134,positive,news,Rockefeller Capital Management L.P. Has $16.96 Million Stock Position in Valero Energy Corporation $VLO
VLO,2026-06-24,0.8727466315031052,positive,news,Sky Quarry announces Foreland refinery's entrance into the production phase
VLO,2026-06-24,0.6382959820330143,positive,news,Nevada's Only Refinery Is Switching On -- Just as the West Loses the Capacity It Can't Replace
VLO,2026-06-23,0.8536797594279051,positive,news,Waste Heat-to-Power Deal With Kanin Could Be A Game Changer For Phillips 66 (PSX)
VLO,2026-06-23,-0.9617254501208663,negative,news,ConocoPhillips (NYSE:COP) Slips As Crude Oil Pressure Builds
VLO,2026-06-23,0.36596168112009764,neutral,news,The brothers of Himax: from obscurity to billions
VLO,2026-06-23,0.9420669302344322,positive,news,Can Valero Sustain Profitability Amid Energy Market Volatility?
VLO,2026-06-22,0.9274207577109337,positive,news,Valero Energy Corp. stock outperforms competitors on strong trading day
VLO,2026-06-22,0.3188242167234421,neutral,news,"Barclays initiates Darling Ingredients stock at Equalweight, $58 target"
VLO,2026-06-22,0.9335348969325423,positive,news,"Hsbc Holdings PLC Buys 158,470 Shares of Valero Energy Corporation $VLO"
VLO,2026-06-22,-0.9221516735851765,negative,news,Phillips 66 $PSX Shares Sold by Hsbc Holdings PLC
VLO,2026-06-22,0.6719724610447884,positive,news,"Barclays initiates Darling Ingredients stock at Equalweight, $58 target By Investing.com"
VLO,2026-06-22,0.03256809152662754,neutral,news,Valero Energy Corp (VLO) Earnings Forecast: Future EPS & Revenue Growth Estimates
VLO,2026-06-21,0.9322031857445836,positive,news,"ARS Investment Partners LLC Purchases 65,599 Shares of Marathon Petroleum Corporation $MPC"
VLO,2026-06-21,0.02824259828776121,neutral,news,Valero Energy Stock - Sunday background on refining giant
VLO,2026-06-21,-0.899387713521719,negative,news,Phillips 66 Stock - weekly review and refining sector check
VLO,2026-06-21,-0.92691645398736,negative,news,VanEck Oil Refiners ETF rated Hold amid value appeal and bearish technical signals.
VLO,2026-06-20,0.9260383863002062,positive,news,Phillips 66 (PSX) Stock Could Be 12.9% Undervalued on Its Growth Narrative
VLO,2026-06-19,-0.5201515853404999,negative,news,Calumet Specialty Products Stock - Weekly review in the energy sector
VLO,2026-06-19,-0.31248457357287407,neutral,news,Valero Energy Stock - Weekly review and refining sector backdrop
VLO,2026-06-19,0.9384149499237537,positive,news,Valero Energy Corporation $VLO Shares Bought by Pacer Advisors Inc.
VLO,2026-06-19,0.7800014764070511,positive,news,"16,787 Shares in Valero Energy Corporation $VLO Acquired by Blue Capital Inc."
VLO,2026-06-19,0.17401529848575592,neutral,news,CrossGen Wealth LLC Acquires New Position in Valero Energy Corporation $VLO
