ticker,date,sentiment_score,sentiment_label,content_type,title
EOG,2026-01-31,0.631316838786006,positive,news,20 Stocks with the Lowest Forward PE Ratio
EOG,2026-01-31,0.9367450773715973,positive,news,Petrobras (PBR) Announces Increase in Estimates Proven Reserves
EOG,2026-01-31,0.9378747642040253,positive,news,Petrobras (PBR) Announces Increase in Estimated Proven Reserves
EOG,2026-01-31,0.02389262430369854,neutral,news,Discipline and Rules-Based Execution in EOG Response
EOG,2026-01-31,0.08522480353713036,neutral,news,Civitas Merger With SM Energy Reshapes Valuation And Investor Exposure
EOG,2026-01-30,0.9247886454686522,positive,news,Stocks showing improving market leadership: Core Natural Resources earns 82 RS rating
EOG,2026-01-30,0.929180396720767,positive,news,EOG Resources (EOG) Price Target Raised to $127 at Wells Fargo
EOG,2026-01-30,0.8841997347772121,positive,news,EOG Resources (EOG) Price Target Raised to $127 at Wells Fargo
EOG,2026-01-30,0.9004167951643467,positive,news,EOG Resources (EOG) Price Target Raised to $127 at Wells Fargo
EOG,2026-01-29,0.7997793452814221,positive,news,Energy Benchmarks Firm as Ovintiv Adds Former Hess E&P Chief to Board
EOG,2026-01-29,0.8594661485403776,positive,news,Olenox Industries Signs Letter of Intent to Acquire Vivakor’s Midstream Business in Oklahoma STACK Play
EOG,2026-01-29,-0.8895232491195202,negative,news,"Morgan Stanley notes strong Q4 operations for EOG Resources, Inc. (EOG) but soft cash flow"
EOG,2026-01-29,0.9137498857453465,positive,news,"Mirae Asset Global Investments Co. Ltd. Buys 23,046 Shares of EOG Resources, Inc. $EOG"
EOG,2026-01-29,0.7738020410761237,positive,news,"Federated Hermes Inc. Acquires 83,631 Shares of EOG Resources, Inc. $EOG"
EOG,2026-01-29,0.6097402125597,positive,news,"Morgan Stanley Notes Strong Q4 Operations for EOG Resources, Inc. (EOG) but Soft Cash Flow"
EOG,2026-01-29,0.06344106793403625,positive,news,"Piper Sandler Maintains Neutral Rating on EOG, Lowers Price Targ"
EOG,2026-01-29,-0.9518564073368907,negative,news,"Why Investors Shouldn't Be Surprised By Vista Energy, S.A.B. de C.V.'s (BMV:VISTAA) Low P/E"
EOG,2026-01-28,0.6287279278039932,positive,news,"Piper Sandler Maintains Neutral Rating on EOG, Lowers Price Target"
EOG,2026-01-28,0.6289938241243362,positive,news,OMS Energy Technologies secures $2.2 million in specialty connector orders
EOG,2026-01-28,0.06739143468439579,neutral,news,TotalEnergies Stock Price — TTE Chart
EOG,2026-01-28,0.9174144398421049,positive,news,"Analysts Are Bullish on Top Energy Stocks: Schlumberger (SLB), Infinity Natural Resources, Inc. Class A (INR)"
EOG,2026-01-27,0.932278617285192,positive,news,TechnipFMC plc $FTI Stake Raised by Barlow Wealth Partners Inc.
EOG,2026-01-27,0.8211927451193333,positive,news,ENB-PFA.TO Enbridge Inc. (TSX) C$22.93 close 26 Jan 2026: Forecasts to watch
EOG,2026-01-27,0.9357459414750338,positive,news,Analyst Raises Comstock Resources (CRK) Price Target to $20
EOG,2026-01-27,-0.5601511746644974,negative,news,Jefferies Sticks to Their Hold Rating for Crescent Energy Company Class A (CRGY)
EOG,2026-01-26,0.9341302011162043,positive,news,"EQT Price Target Raised to $71, ‘Buy’ Rating Maintained"
EOG,2026-01-26,-0.26236608624458313,negative,news,EOG Resources (NYSE:EOG) Price Target Lowered to $151.00 at Susquehanna
EOG,2026-01-26,0.6526909936219454,positive,news,"Siebert Williams Shanks Adjusts Price Target on EOG Resources to $150 From $145, Maintains Buy Rating"
EOG,2026-01-26,-0.7921740934252739,negative,news,"Strs Ohio Sells 16,667 Shares of EOG Resources, Inc. $EOG"
EOG,2026-01-26,-0.8205573186278343,negative,news,TC Energy Corporation $TRP Shares Sold by Intact Investment Management Inc.
EOG,2026-01-25,0.9310823697596788,positive,news,Battalion Oil Surges with New Midstream Partnership
EOG,2026-01-25,0.9334485121071339,positive,news,Battalion Oil’s Strategic Midstream Partnership Boosts Production
EOG,2026-01-25,0.6076005501672626,positive,news,"Y Intercept Hong Kong Ltd Purchases Shares of 44,992 EOG Resources, Inc. $EOG"
EOG,2026-01-25,-0.9418712481856346,negative,news,"Resona Asset Management Co. Ltd. Sells 11,199 Shares of EOG Resources, Inc. $EOG"
EOG,2026-01-25,0.9333392418920994,positive,news,"Mitsubishi UFJ Trust & Banking Corp Has $74.85 Million Stake in EOG Resources, Inc. $EOG"
EOG,2026-01-25,-0.9047035202383995,negative,news,"Campbell & CO Investment Adviser LLC Sells 49,804 Shares of Range Resources Corporation $RRC"
EOG,2026-01-25,0.5237593566998839,positive,news,"Baillie Gifford & Co. Has $16.15 Million Stock Holdings in EOG Resources, Inc. $EOG"
EOG,2026-01-25,0.9367422368377447,positive,news,Baker Avenue Asset Management LP Increases Position in Exxon Mobil Corporation $XOM
TMUS,2026-02-03,0.9422223679721355,positive,news,AT&T Inc. (T): A Bull Case Theory
TMUS,2026-02-03,-0.9643248273059726,negative,news,T-Mobile lays off hundreds of Washington workers amid 'changing business needs'
TMUS,2026-02-02,0.5910002319142222,positive,news,New smart belt uses AT&T network to alert caregivers when seniors fall
TMUS,2026-02-02,-0.8988117706030607,negative,news,"T-Mobile to lay off 393 workers in various locations in Washington by April 2, warn notice shows"
TMUS,2026-02-02,-0.3266644701361656,neutral,news,Verizon eyes replacements for consumer unit head Sampath amid exit rumors - FT (VZ:NYSE)
TMUS,2026-02-02,0.9282865636050701,positive,news,"AT&T takes over Lumen home fiber for $5.75B, 1M join network"
TMUS,2026-02-02,0.9133761366829276,positive,news,"SES Partners with Chunghwa Telecom to Integrate Multi-Orbit Satellite, Cloud, and IoT Applications"
TMUS,2026-02-02,0.025681108236312866,neutral,news,MGM Slam In Las Vegas Announces First Round Match-Ups
TMUS,2026-02-01,0.8483540453016758,positive,news,Verizon's CEO Just Admitted Its Pricing Strategy Cost the Company 2.25 Million Customers
TMUS,2026-01-31,0.2253515124320984,positive,news,AT&T stock jumps as telecoms rally; what to watch before Monday’s open
TMUS,2026-01-31,-0.2820413112640381,negative,news,T-Mobile stock jumps 4% as Verizon buyback talk grabs attention — what to watch next for TMUS
TMUS,2026-01-31,0.8909933138638735,positive,news,T2 and PlusAI partner to accelerate rollout of Level 4 autonomous trucks in Japan
TMUS,2026-01-31,-0.563566192984581,negative,news,American Tower Faces DISH Default While Reinforcing Contract And Cash Flow Story
TMUS,2026-01-30,0.9349542893469334,positive,news,Verizon Posts Best Subscriber Growth Since 2019
TMUS,2026-01-30,-0.683863565325737,negative,news,Benchmark Names T-Mobile (TMUS) a 2026 Best Idea
TMUS,2026-01-30,-0.34610846638679504,negative,news,Benchmark Names T-Mobile (TMUS) a 2026 Best Idea
TMUS,2026-01-29,-0.9339510267600417,negative,news,Dish Defaults on American Tower Payments
TMUS,2026-01-29,-0.9557357346639037,negative,news,"Rising Costs, Shrinking Affordability: The State of the Auto Market in 2025"
TMUS,2026-01-29,0.06474086828529835,neutral,news,The Truth About Crown Castle Inc.: Is This ‘Boring’ Stock Low?Key a 5G Power Play?
TMUS,2026-01-29,0.6795926382765174,positive,news,"Toyota becomes T-Mobile Arena’s first auto sponsor, with SUV giveaways"
TMUS,2026-01-29,0.9398920331150293,positive,news,"AT&T Earnings: Competition Remains Intense, but Management’s Outlook Points to Stability"
TMUS,2026-01-28,0.9411802068352699,positive,news,"After Reviewing AT&T's 2025 Results, We've Moved Our Fair Value Estimate Up Slightly to $27"
TMUS,2026-01-28,0.934794595465064,positive,news,Southwest Airlines Reports Fourth Quarter and Full Year 2025 Results
TMUS,2026-01-28,0.7899981243535876,positive,news,The MGM Slam Presented by Capital One and The CW Network Announce Broadcast Rights Agreement
TMUS,2026-01-28,0.784547102637589,positive,news,"Should You Be Excited About T-Mobile US, Inc.'s (NASDAQ:TMUS) 20% Return On Equity?"
TMUS,2026-01-28,-0.8951090592890978,negative,news,Hardman Johnston Global Equity Sold Corteva (CTVA) as It Failed to Observe a Clear Value-Creation Rationale
TMUS,2026-01-28,-0.9024474490433931,negative,news,Hardman Johnston Global Equity Sold Corteva (CTVA) as It Failed to Observe a Clear Value-Creation Rationale
TMUS,2026-01-28,-0.9451108053326607,negative,news,Hardman Johnston Global Equity Strategy Sold T-Mobile (TMUS) due to Rising Competitive Pricing Pressures
TMUS,2026-01-28,0.3288351446390152,neutral,news,Five reasons to go rugged in public safety: Sonim Technologies on building phones for fireground realties
TMUS,2026-01-28,-0.9320620037615299,negative,news,Hardman Johnston Global Equity Strategy Sold T-Mobile (TMUS) due to Rising Competitive Pricing Pressures
TMUS,2026-01-28,-0.2427743524312973,negative,news,Here’s Why Hardman Johnston Global Equity Strategy Sold Vertex Pharmaceuticals (VRTX)
TMUS,2026-01-27,0.5219915211200714,positive,news,Surge in Options Trading Volume for Lumen and Coupang
TMUS,2026-01-27,0.187523340806365,neutral,news,Telco Data Monetization Market Is Going to Boom |• Amdocs • Ericsson
TMUS,2026-01-27,-0.9510172791779041,negative,news,T Brings IoT Solutions to AWS Marketplace: Will it Boost Prospects?
TMUS,2026-01-27,-0.9127078615128994,negative,news,Verizon Stock Before Q4 Earnings: A Sensible Buy or Risky Move?
TMUS,2026-01-27,0.7968439310789108,positive,news,Bernstein Sees Tougher Competitive Landscape Taking Shape for Verizon (VZ) and Peers
TMUS,2026-01-27,-0.9211510941386223,negative,news,Expedia laid off some employees and promoted new job openings
TMUS,2026-01-26,0.9293865226209164,positive,news,T-Mobile US Inc. stock outperforms competitors on strong trading day
TMUS,2026-01-26,-0.7155580595135689,negative,news,"Wells Fargo Adjusts Price Target on T-Mobile US to $225 From $260, Maintains Overweight Rating"
TMUS,2026-01-26,-0.9619724182412028,negative,news,"The list of companies laying off staff this year includes Citi and T-Mobile, with dozens of others like Meta warning of job cuts"
TMUS,2026-01-26,0.9296079380437732,positive,news,T-Mobile US Unveils Major Capital Return Strategy Amid Strong Operational Performance
TMUS,2026-01-25,0.23166769184172153,neutral,news,T-Mobile US to redeem $3 billion of 4.750% senior notes due 2028
TMUS,2026-01-25,-0.8578107617795467,negative,news,Analysts Lower T-Mobile (TMUS) Price Targets
TMUS,2026-01-25,-0.9458535332232714,negative,news,Analysts Lower T-Mobile (TMUS) Price Targets
TMUS,2026-01-24,0.6282373368740082,positive,news,"Bernstein Names AT&T (T) Top Telecom Pick for 2026, Barclays Stays Neutral"
TMUS,2026-01-24,0.909374974668026,positive,news,T-Mobile stock price: TMUS closes higher as $3 billion debt redemption looms
TMUS,2026-01-24,0.9314008168876171,positive,news,"Zoom, T-Mobile and Southwest Airlines Consider India GCC Establishments"
TMUS,2026-01-24,0.12584736943244934,positive,news,Does Acer’s Patent Suit and T-Satellite Push Signal a Turning Point for T-Mobile’s (TMUS) Edge?
TMUS,2026-01-23,0.22511493973433971,neutral,news,T-Mobile Activates Free Cellular Starlink in the US As Winter Storm Rolls In
TMUS,2026-01-23,0.15397028252482414,neutral,news,T-Mobile Activates Free Cellular Starlink in the US As Winter Storm Rolls In
CL,2026-02-03,0.8937491551041603,positive,news,A Look At Colgate-Palmolive (CL) Valuation After Q4 Earnings Beat And 2030 Growth Plan Unveiling
CL,2026-02-03,0.7672695415094495,positive,news,Kimberly-Clark Corporation (KMB): A Bull Case Theory
CL,2026-02-03,0.9274015910923481,positive,news,P&G stock ends higher near $153 as shutdown headlines build — what to watch next
CL,2026-02-02,0.8818674236536026,positive,news,Kimberly-Clark Corporation (KMB): A Bull Case Theory
CL,2026-02-02,0.9407811835408211,positive,news,Jefferies Financial Group Issues Positive Forecast for Colgate-Palmolive (NYSE:CL) Stock Price
CL,2026-02-02,0.9325945843011141,positive,news,Citigroup Raises Price Target for Colgate-Palmolive (CL) to $105
CL,2026-02-02,0.9029364138841629,positive,news,P&G stock price today: Procter & Gamble edges higher as shutdown clouds key data
CL,2026-02-02,0.923717675730586,positive,news,Colgate-Palmolive Analysts Boost Their Forecasts Following Better-Than-Expected Q4 Results
CL,2026-02-02,0.9349647685885429,positive,news,Colgate-Palmolive stock rating reiterated at Buy by UBS on strong Q4
CL,2026-02-02,-0.9616173710674047,negative,news,"Company News for Feb 2, 2026"
CL,2026-02-02,0.009550008922815323,neutral,news,UBS Reiterates Buy Rating on Colgate-Palmolive Company (CL)
CL,2026-02-02,0.06488353759050369,neutral,news,Franklin Resources (NYSE:BEN) Financial Services View Russell 1000 Etf Stability
CL,2026-02-02,0.9340944848954678,positive,news,Colgate-Palmolive (CL): Piper Sandler Raises Price Target to $96
CL,2026-02-02,0.930671276524663,positive,news,"Raymond James Adjusts Price Target on Colgate-Palmolive to $100 From $95, Maintains Outperform Rating"
CL,2026-02-02,0.9375071991235018,positive,news,Morgan Stanley raises Colgate-Palmolive stock price target to $100 on strong emerging markets growth
CL,2026-02-02,0.9294194635003805,positive,news,Are Wall Street Analysts Bullish on Colgate-Palmolive Stock?
CL,2026-02-02,0.9341207053512335,positive,news,Colgate-Palmolive (NYSE:CL) Price Target Raised to $100.00 at Bank of America
CL,2026-02-02,0.4216713197529316,neutral,news,"Colgate-Palmolive Company (CL) PT Raised to $100 at Morgan Stanley, 'Top HPC Pick'"
CL,2026-02-02,0.9370219670236111,positive,news,Colgate-Palmolive stock price target raised to $96 from $86 at TD Cowen
CL,2026-02-02,0.4250019630417228,neutral,news,Colgate-Palmolive Company (CL) PT Raised to $100 at Evercore ISI
CL,2026-02-02,0.9363249465823174,positive,news,Money Concepts Capital Corp Increases Position in Colgate-Palmolive Company $CL
CL,2026-02-02,0.9391277562826872,positive,news,Colgate-Palmolive Company (CL) PT Raised to $96 at TD Cowen
CL,2026-02-02,0.878040624782443,positive,news,Colgate-Palmolive Company (CL) PT Raised to $94 at Wells Fargo
CL,2026-02-02,0.3187817931175232,positive,news,Colgate-Palmolive reports full-year 2025 sales growth as impairment weighs on GAAP earnings
CL,2026-02-02,-0.902507845312357,negative,news,Earnings To Watch: Clorox (CLX) Reports Q4 Results Tomorrow
CL,2026-02-01,-0.7917236983776093,negative,news,Assessing Clorox (CLX) Valuation After Recent Share Price Rebound And Longer Term Weakness
CL,2026-02-01,-0.8603546768426895,negative,news,Colgate Palmolive (CL) One Off US$1.0b Charge Tests Premium P/E Narrative
CL,2026-02-01,0.8922096453607082,positive,news,Procter & Gamble stock rose while Wall Street slid — what to watch before Monday
CL,2026-02-01,0.2626000642776489,positive,news,TriNet stock jumps on Friday — what TNET investors are watching ahead of Feb. 12 earnings
CL,2026-02-01,0.9054618813097477,positive,news,Colgate-Palmolive (CL) stock price jumps nearly 6% after outlook — what to watch before Monday
CL,2026-02-01,0.9388597551733255,positive,news,Colgate-Palmolive Stock Outperforms Amid Strong Q4 Performance and Analyst Upgrades
CL,2026-02-01,0.9368676859885454,positive,news,Mediolanum International Funds Ltd Increases Holdings in Colgate-Palmolive Company $CL
CL,2026-02-01,0.9296817630529404,positive,news,National Pension Service Has $168.64 Million Stock Holdings in Colgate-Palmolive Company $CL
CL,2026-01-31,0.9313145913183689,positive,news,Colgate-Palmolive’s 2030 Plan Weighs Latin America Rebound And Pet Nutrition
CL,2026-01-31,0.9196418300271034,positive,news,Colgate-Palmolive Company (NYSE:CL) Q4 2025 Earnings Call Transcript
CL,2026-01-31,-0.8876739554107189,negative,news,"Colgate-Palmolive Q4 2025 Results: Adjusted EPS $0.95, Revenue $5.23B - News and Statistics"
CL,2026-01-31,0.9380460809916258,positive,news,Colgate-Palmolive forecasts upbeat annual sales as essentials spending holds firm
CL,2026-01-31,0.9402486309409142,positive,news,Winnow Wealth LLC Grows Stock Position in Colgate-Palmolive Company $CL
CL,2026-01-31,-0.678934246301651,negative,news,"Federated Hermes Inc. Sells 31,342 Shares of Colgate-Palmolive Company $CL"
CL,2026-01-31,-0.2726386487483978,negative,news,Colgate-Palmolive (CL) Climbs 6% on Upbeat Outlook Despite Headwinds
CL,2026-01-30,-0.0019123852252960205,negative,news,Colgate-Palmolive (CL) Climbs 6% on Upbeat Outlook Despite Headwinds
CL,2026-01-30,0.9375687874853611,positive,news,Colgate-Palmolive Reports Q4 2025 Results; Net Sales Up 5.8%
CL,2026-01-30,0.9425994008779526,positive,news,Colgate-Palmolive Partners with WHO Foundation to Expand Oral Health Initiative
CL,2026-01-30,0.8832475543022156,positive,news,Colgate-Palmolive outlines 1% to 4% organic sales growth target for 2026 amid volatile category trends
CL,2026-01-30,0.8963057715445757,positive,news,Coca-Cola stock hits all-time high at 74.38 USD
CL,2026-01-30,0.028042687103152275,neutral,news,"People on the Move: Bazooka Brands, Murphy USA & Performance Food Group"
CL,2026-01-30,0.944080900400877,positive,news,Selective Insurance Group reports Q4 FY25 results with higher revenues and profitability
CL,2026-01-30,0.8911447897553444,positive,news,"Colgate Sales Rise, but Consumer Uncertainty Clouds Outlook"
CL,2026-01-30,0.9218563232570887,positive,news,CL Earnings: Colgate-Palmolive Stock Skyrockets over 5% as Sales Growth Beats Estimates on LATAM Rebound
CL,2026-01-30,0.9370332229882479,positive,news,Colgate-Palmolive (CL) stock gains after Q4 FY25 sales and earnings top expectations
MDLZ,2026-02-03,-0.1933363378047943,negative,news,"Mediolanum International Funds Ltd Sells 57,425 Shares of Hershey Company (The) $HSY"
MDLZ,2026-02-03,0.8676159447059035,positive,news,"Peterson Wealth Services Acquires 9,557 Shares of Hershey Company (The) $HSY"
MDLZ,2026-02-02,0.9355300180613995,positive,news,Jefferies Financial Group Issues Positive Forecast for Hershey (NYSE:HSY) Stock Price
MDLZ,2026-02-02,0.7584568150341511,positive,news,"What CFOs at Adobe, Dataminr, and Huntington say about scaling AI"
MDLZ,2026-02-01,0.6198709458112717,positive,news,John B. Sanfilippo & Son (NASDAQ:JBSS) Could Easily Take On More Debt
MDLZ,2026-02-01,0.7486443072557449,positive,news,"Truist Financial Corp Purchases 11,600 Shares of Hershey Company (The) $HSY"
MDLZ,2026-02-01,0.9011366181075573,positive,news,Keurig Dr Pepper: Quiet Rally or Value Trap? What The Latest Numbers Really Say
MDLZ,2026-01-31,-0.17414671182632446,negative,news,"Analysts Offer Insights on Consumer Goods Companies: Walmart (WMT), Altria Group (MO) and Mondelez International (MDLZ)"
MDLZ,2026-01-31,-0.4497296214103699,negative,news,Big Food gets leaner with divestitures and breakups as consumers turn away from packaged snacks
MDLZ,2026-01-31,0.904022871516645,positive,news,Winnow Wealth LLC Invests $1.07 Million in Hershey Company (The) $HSY
MDLZ,2026-01-31,-0.9094863161444664,negative,news,Bank of New York Mellon Corp Decreases Stake in Hershey Company (The) $HSY
MDLZ,2026-01-31,-0.9502403102815151,negative,news,A Look At Simply Good Foods (SMPL) Valuation After A Year Of Weak Shareholder Returns
MDLZ,2026-01-30,0.3787750359624624,neutral,news,One Liberty Properties acquires 10 industrial properties for $56.7 million By Investing.com
MDLZ,2026-01-30,0.9210450360551476,positive,news,One Liberty Properties acquires 10 industrial properties for $56.7 million
MDLZ,2026-01-29,-0.9663974298164248,negative,news,Earnings Preview: Darling Ingredients (DAR) Q4 Earnings Expected to Decline
MDLZ,2026-01-29,-0.8858214467763901,negative,news,"Hain Celestial Group Up 15%, Insiders Still Down After US$1.46m Purchase"
MDLZ,2026-01-29,0.7116751428693533,positive,news,Hershey (HSY) Projected to Post Earnings on Thursday
MDLZ,2026-01-27,0.04711749963462353,neutral,news,Mondelēz International to Present at CAGNY Conference on February 17
MDLZ,2026-01-27,0.9296338194981217,positive,news,Does Mondelez’s Experiential Snacking Push in Canada Reshape Its Brand Power Story for MDLZ?
MDLZ,2026-01-27,0.9123492361977696,positive,news,Strs Ohio Has $2.97 Million Stake in Hershey Company (The) $HSY
MDLZ,2026-01-27,0.9157388927415013,positive,news,Teacher Retirement System of Texas Raises Position in Hershey Company (The) $HSY
MDLZ,2026-01-27,0.10137307643890381,positive,news,"CIBC Asset Management Inc Sells 10,306 Shares of Hershey Company (The) $HSY"
MDLZ,2026-01-25,0.9368293900042772,positive,news,1834 Investment Advisors Co. Increases Stock Position in Hershey Company (The) $HSY
MDLZ,2026-01-24,-0.7052798718214035,negative,news,Morgan Stanley Sees Rising Competitive Pressure Weighing on Conagra (CAG)
MDLZ,2026-01-24,-0.9180267006158829,negative,news,Universal Beteiligungs und Servicegesellschaft mbH Decreases Stock Position in Hershey Company (The) $HSY
MDLZ,2026-01-23,0.7309275586158037,positive,news,Mondelēz International’s Global R&D Team Opens Applications for CoLab Tech 2026
MDLZ,2026-01-22,-0.12936421111226082,neutral,news,"Hershey (NYSE:HSY) CFO Steven Voskuil Sells 1,500 Shares"
MDLZ,2026-01-22,0.8332289541140199,positive,news,"Top 5 US Food Stocks to Watch, According to Morgan Stanley By Investing.com"
MDLZ,2026-01-22,0.6452860701829195,positive,news,Mondelēz International’s Global R&D Team Opens Applications for CoLab Tech 2026
MDLZ,2026-01-22,-0.8762102536857128,negative,news,"P&G reports slower sales amid government shutdown, economic uncertainty"
MDLZ,2026-01-22,0.15566182136535645,positive,news,Morgan Stanley Downgrades J.M. Smucker As Pressures Contrast With Valuation
MDLZ,2026-01-22,0.8564203036949039,positive,news,Is Joe Scalzo’s Return to Simply Good Foods (SMPL) Altering The Investment Case For Simply Good Foods (SMPL)?
MDLZ,2026-01-21,0.7862551510334015,positive,news,Mondelez Canada Launches Test How Experiential Snacking Supports MDLZ Growth
MDLZ,2026-01-21,0.46888541243970394,neutral,news,PepsiCo CEO says sustainability debate needs a ‘reframe’ at Davos
MDLZ,2026-01-21,0.9236701251938939,positive,news,Mars-Kellanova: The $36bn merger transforming the snacking sector
MDLZ,2026-01-21,-0.48740094155073166,negative,news,1 Consumer Stock on Our Watchlist and 2 We Question
MDLZ,2026-01-21,0.032052893191576004,neutral,news,"5,630 Shares in Hershey Company (The) $HSY Acquired by Dynasty Wealth Management LLC"
MDLZ,2026-01-20,0.32916679978370667,positive,news,Investors Can Find Comfort In Simply Good Foods' (NASDAQ:SMPL) Earnings Quality
MDLZ,2026-01-18,0.8529650885611773,positive,news,The Bull Case For Hershey (HSY) Could Change Following Its Shaq Gummies And Flagship Bar Push
MDLZ,2026-01-18,-0.9240174647420645,negative,news,The Bull Case For J. M. Smucker (SJM) Could Change Following Dividend Hike And Morgan Stanley Downgrade
MDLZ,2026-01-16,0.7992636188864708,positive,news,Assessing Campbell Soup (CPB) Valuation After Confidence In Premium Brands And Tariff Management
MDLZ,2026-01-16,-0.8410100862383842,negative,news,Kraft Heinz margin threatened from private labels and price wars
MDLZ,2026-01-16,0.8663939945399761,positive,news,Consumer Defensives: Consumer-Valued Innovation Is Crucial to Withstanding Unrelenting Inflation
MDLZ,2026-01-16,0.9128303565084934,positive,news,Why Mondelez International Is a Top Pick Among Food Manufacturers
MDLZ,2026-01-16,0.47153307404369116,neutral,news,"Rep. Rick Larsen Sells Off Shares of Verisk Analytics, Inc. (NASDAQ:VRSK)"
MDLZ,2026-01-16,0.07329118996858597,neutral,news,"Rep. Rick Larsen Purchases Shares of Darden Restaurants, Inc. (NYSE:DRI)"
MDLZ,2026-01-15,0.8761816434562206,positive,news,Assessing J. M. Smucker (SJM) Valuation After Recent Share Price Rebound And Mixed Return Profile
MDLZ,2026-01-15,0.9287239909172058,positive,news,Hershey unveils new dream candy combos ahead of Valentine’s Day
MDLZ,2026-01-15,0.7618351811543107,positive,news,Kraft Heinz demerger: Will the $28.7bn break-up pay off?
MDLZ,2026-01-15,-0.8265776112675667,negative,news,"Manning & Napier Advisors LLC Sells 27,998 Shares of Hershey Company (The) $HSY"
PEP,2026-02-03,-0.005146443843841553,neutral,sec_filing,PEP 10-K Filing - 2026-02-03
MPC,2026-02-03,-0.04168980196118355,neutral,sec_filing,MPC 8-K Filing - 2026-02-03
PEP,2026-02-03,-0.03615286946296692,neutral,sec_filing,PEP 8-K Filing - 2026-02-03
PYPL,2026-02-03,-0.05933933146297932,neutral,sec_filing,PYPL 8-K Filing - 2026-02-03
PFE,2026-02-03,-0.03985185734927654,neutral,sec_filing,PFE 8-K Filing - 2026-02-03
MRK,2026-02-03,-0.041270727291703224,neutral,sec_filing,MRK 8-K Filing - 2026-02-03
DIS,2026-02-03,-0.03420586325228214,neutral,sec_filing,DIS 8-K Filing - 2026-02-03
GS,2026-02-02,-0.04977557063102722,neutral,sec_filing,GS 8-K Filing - 2026-02-02
COF,2026-02-02,-0.05374200455844402,neutral,sec_filing,COF 8-K Filing - 2026-02-02
IBM,2026-02-02,-0.031505947932600975,neutral,sec_filing,IBM 8-K Filing - 2026-02-02
DIS,2026-02-02,-0.06674480717629194,neutral,sec_filing,DIS 10-Q Filing - 2026-02-02
CVX,2026-01-30,-0.03470145910978317,neutral,sec_filing,CVX 8-K Filing - 2026-01-30
IBM,2026-01-30,-0.036840133368968964,neutral,sec_filing,IBM 8-K Filing - 2026-01-30
XOM,2026-01-30,-0.02449205331504345,neutral,sec_filing,XOM 8-K Filing - 2026-01-30
BA,2026-01-30,-0.010352298617362976,neutral,sec_filing,BA 10-K Filing - 2026-01-30
AMGN,2026-01-30,-0.042033905163407326,neutral,sec_filing,AMGN 8-K Filing - 2026-01-30
VZ,2026-01-30,-0.05708255060017109,neutral,sec_filing,VZ 8-K Filing - 2026-01-30
VZ,2026-01-30,-0.05708255060017109,neutral,sec_filing,VZ 8-K Filing - 2026-01-30
CHTR,2026-01-30,-0.025258852168917656,neutral,sec_filing,CHTR 10-K Filing - 2026-01-30
V,2026-01-30,-0.08303472585976124,neutral,sec_filing,V 10-Q Filing - 2026-01-30
AXP,2026-01-30,-0.059660809114575386,neutral,sec_filing,AXP 8-K Filing - 2026-01-30
CHTR,2026-01-30,-0.07026026956737041,neutral,sec_filing,CHTR 8-K Filing - 2026-01-30
CVX,2026-01-30,-0.03470145910978317,neutral,sec_filing,CVX 8-K Filing - 2026-01-30
AAPL,2026-01-30,-0.08806090243160725,neutral,sec_filing,AAPL 10-Q Filing - 2026-01-30
USB,2026-01-29,-0.06083911471068859,neutral,sec_filing,USB 8-K Filing - 2026-01-29
META,2026-01-29,-0.013634778559207916,neutral,sec_filing,META 10-K Filing - 2026-01-29
