ticker,date,sentiment_score,sentiment_label,content_type,title
DE,2026-06-02,0.9087321944534779,positive,news,"DE, AGCO, CNH Stocks Get A Boost From Citi After Trump Slashes Agri Equipment Tariffs – Firm Calls It ‘Incremental Positive’ For The Sector"
DE,2026-06-02,0.9248892869800329,positive,news,"DE, AGCO, CNH stocks get a boost from Citi after Trump slashes agri equipment tariffs – firm calls it 'incremental positive' for the sector"
DE,2026-06-02,0.914452388882637,positive,news,"Deere (DE) Shares Skyrocket, What You Need To Know"
DE,2026-06-02,0.9250567071139812,positive,news,"Deere (DE) Shares Skyrocket, What You Need To Know"
DE,2026-06-02,0.9317990355193615,positive,news,"Deere jumps as investors refocus on Q2 beat, steady FY26 outlook, and construction strength"
DE,2026-06-02,0.9306794069707394,positive,news,Deere & Co. stock outperforms competitors on strong trading day
DE,2026-06-02,0.8940936140716076,positive,news,Deere reaps benefits of IEEPA tariff refund and construction demand
DE,2026-06-02,0.5485816299915314,positive,news,Trump Cuts Tariffs On Some Steel And Aluminum Products To Boost US Manufacturing— But AI Infrastructure May Be Doing More To Drive The Factory Boom
DE,2026-06-02,0.7290632165968418,positive,news,Deere stock jumps on tariff cut for farm equipment By Investing.com
DE,2026-06-02,-0.003444831818342209,neutral,news,Deere & Company (DE) Announces Board Member Dmitri Stockton's Decision Not to Seek Re-election
DE,2026-06-02,0.9362188056111336,positive,news,Deere & Company $DE Shares Acquired by Natixis Advisors LLC
DE,2026-06-02,0.9320527967065573,positive,news,"Geode Capital Management LLC Has $321.18 Million Stock Holdings in BWX Technologies, Inc. $BWXT"
DE,2026-06-01,-0.17934096045792103,neutral,news,Deere (NYSE: DE) director Dmitri Stockton to step down after 2027 meeting
DE,2026-06-01,-0.8887853715568781,negative,news,John Deere Faces New Antitrust Lawsuit Over Equipment Repair Restrictions
DE,2026-06-01,0.01351211592555046,neutral,news,Murphy Tractor president Bill Buckles to retire; search underway for next leader
DE,2026-06-01,-0.36494553089141846,negative,news,Deere reports dip in earnings; full-year picture remains positive
DE,2026-06-01,0.6060671983286738,positive,news,"Deere Debuts 844, 904 X-Tier Loaders with EVT Drive"
DE,2026-06-01,0.15261447429656982,positive,news,John Deere company Analysis: 3 Key Levels Above 200-Day EMA
DE,2026-06-01,0.9190137628465891,positive,news,Deere & Company $DE Shares Bought by MUFG Securities EMEA plc
DE,2026-06-01,-0.896422378718853,negative,news,Deere & Company $DE Shares Sold by Intech Investment Management LLC
DE,2026-06-01,-0.533096194267273,negative,news,Deere & Company $DE Shares Sold by Commonwealth of Pennsylvania Public School Empls Retrmt SYS
DE,2026-06-01,0.7613990921527147,positive,news,JOHN DEERE INTRODUCES 844 AND 904 X-TIER WHEEL LOADERS
DE,2026-05-31,0.013053638860583305,neutral,news,What Does Deere & Company's (NYSE:DE) Share Price Indicate?
DE,2026-05-31,0.9316161070019007,positive,news,Deere & Company $DE Shares Purchased by Northwestern Mutual Wealth Management Co.
DE,2026-05-31,0.9049014551565051,positive,news,Founders Financial Securities LLC Increases Stock Holdings in Procter & Gamble Company (The) $PG
DE,2026-05-31,0.924115196801722,positive,news,Eurizon Capital SGR S.p.A. Invests $50.66 Million in Deere & Company $DE
DE,2026-05-30,0.02649427205324173,neutral,news,"Analysts’ Opinions Are Mixed on These Industrial Goods Stocks: American Superconductor (AMSC), Pool (POOL) and Deere (DE)"
MPC,2026-06-05,0.8989664036780596,positive,news,Total Wealth Planning & Management Inc. Makes New Investment in Marathon Petroleum Corporation $MPC
MPC,2026-06-05,0.8300445899367332,positive,news,Marathon Petroleum and DAQO New Energy have been highlighted as Zacks Bull and Bear of the Day
MPC,2026-06-05,0.7285457029938698,positive,news,Marathon Petroleum and DAQO New Energy have been highlighted as Zacks Bull and Bear of the Day
MPC,2026-06-05,-0.28620412945747375,negative,news,Marathon Petroleum and DAQO New Energy have been highlighted as Zacks Bull and Bear of the Day
MPC,2026-06-05,0.9361463040113449,positive,news,Cibc World Market Inc. Has $34.78 Million Position in Marathon Petroleum Corporation $MPC
MPC,2026-06-04,-0.009976370260119438,neutral,news,"MPC (NYSE: MPC) files Form 144 for 1,372 and 4,964-share notices"
MPC,2026-06-04,-0.16386012360453606,neutral,news,Raizen to sell Argentina downstream business to Mercuria for $1.42 billion
MPC,2026-06-04,-0.910559456795454,negative,news,Intech Investment Management LLC Trims Stock Position in Marathon Petroleum Corporation $MPC
MPC,2026-06-04,0.9342685360461473,positive,news,"Valero Energy Corporation (VLO) Hit a 52 Week High, Can the Run Continue?"
MPC,2026-06-04,-0.960703918710351,negative,news,Mplx Lp $MPLX Position Trimmed by Goldman Sachs Group Inc.
MPC,2026-06-04,0.010743200778961182,positive,news,Bank of New York Mellon Corp Has $717.40 Million Stock Holdings in Marathon Petroleum Corporation $MPC
MPC,2026-06-03,0.9092024499550462,positive,news,Marathon Petroleum's Top Safety Performance Recognized at AFPM Safety Awards
MPC,2026-06-03,0.9051581118255854,positive,news,Marathon Petroleum's Top Safety Performance Recognized at AFPM Safety Awards
MPC,2026-06-03,-0.8189670220017433,negative,news,Marathon Petroleum Corp. stock underperforms Wednesday when compared to competitors despite daily gains
MPC,2026-06-03,0.7841788586229086,positive,news,Shepherd Street Advisors LLC Buys New Shares in Marathon Petroleum Corporation $MPC
MPC,2026-06-02,0.9342233650386333,positive,news,Marathon Petroleum Corp. stock outperforms competitors on strong trading day
MPC,2026-06-02,0.11369951255619526,neutral,news,SPDR S&P Oil & Gas E&P ETF vs. Global X MLP & Energy Infrastructure ETF Comparison - News and Statistics
MPC,2026-06-02,0.020601361989974976,positive,news,Marathon Petroleum stock hits all-time high at $264.22 USD By Investing.com
MPC,2026-06-02,0.940485643222928,positive,news,"Castor Maritime Inc. Reports Net Income of $69.2 Million for the Three Months Ended March 31, 2026"
MPC,2026-06-02,0.9293539375066757,positive,news,Marathon Petroleum Corp (NYSE:MPC) Technical Breakout Setup Scores Perfect 10 for Momentum and 9 for Consolidation
MPC,2026-06-02,0.9143295595422387,positive,news,"Zacks Investment Ideas feature highlights: XLE, Valero, Marathon and Phillips 66"
MPC,2026-06-02,0.9367827977985144,positive,news,MUFG Securities EMEA plc Boosts Stock Position in Marathon Petroleum Corporation $MPC
MPC,2026-06-02,-0.894782580435276,negative,news,Nomura Asset Management Co. Ltd. Lowers Holdings in Marathon Petroleum Corporation $MPC
MPC,2026-06-02,0.8420933252200484,positive,news,Norges Bank Takes Position in Marathon Petroleum Corporation $MPC
MPC,2026-06-02,0.8995323535054922,positive,news,AXQ Capital LP Invests $1.99 Million in Marathon Petroleum Corporation $MPC
MPC,2026-06-02,-0.9532639654353261,negative,news,Goldman Sachs expects elevated refined fuel margins through 2026 on Hormuz disruption
MPC,2026-06-01,0.90324392542243,positive,news,Marathon Petroleum Corp. stock outperforms competitors on strong trading day
MPC,2026-06-01,0.9280373025685549,positive,news,Are Oils-Energy Stocks Lagging Kolibri Global Energy Inc. (KGEI) This Year?
MPC,2026-06-01,0.5922379791736603,positive,news,Petrobras Cuts Diesel Prices by 9.6% Under Govt Subsidy Program
MPC,2026-06-01,0.9358225855976343,positive,news,Reaves W H & Co. Inc. Raises Stock Holdings in Marathon Petroleum Corporation $MPC
MPC,2026-06-01,0.19803057238459587,neutral,news,Best Growth Stocks to Buy for June 1st
MPC,2026-06-01,0.9215217111632228,positive,news,"Eurizon Capital SGR S.p.A. Buys Shares of 55,781 Marathon Petroleum Corporation $MPC"
MPC,2026-06-01,0.5950757265090942,positive,news,Civeo Corp stock (CA1787811027): shares trade steady as investors look beyond latest quarterly updat
MPC,2026-05-31,-0.5354587435722351,negative,news,Savant Capital LLC Lowers Holdings in Marathon Petroleum Corporation $MPC
MPC,2026-05-31,0.9377141203731298,positive,news,Bearing Point Capital LLC Increases Stock Holdings in Marathon Petroleum Corporation $MPC
MPC,2026-05-30,0.9040831718593836,positive,news,National Pension Service Has $144 Million Stock Position in Marathon Petroleum Corporation $MPC
MPC,2026-05-30,-0.9668590677902102,negative,news,Talos Energy (TALO) Earnings Date and Reports 2026
MPC,2026-05-29,0.9244179371744394,positive,news,Costco Wholesale Beats Q3 Estimates as Gas Station Loyalty Creates a New Member Acquisition Engine. What’s Next?
MPC,2026-05-29,-0.9658265756443143,negative,news,Marathon Petroleum Corp. stock outperforms competitors despite losses on the day
MPC,2026-05-29,0.927437137812376,positive,news,Phillips 66 Rose 7% Over the Last 30 Days. Here’s What Could Drive the Stock in 2026
MPC,2026-05-29,0.737598248757422,positive,news,3 Energy Growth Stocks Riding Supply Risks and Strong Demand
MPC,2026-05-29,-0.9560668952763081,negative,news,Geode Capital Management LLC Decreases Stock Position in Marathon Petroleum Corporation $MPC
MPC,2026-05-29,0.9157818127423525,positive,news,"Geode Capital Management LLC Purchases 45,340 Shares of Phillips 66 $PSX"
MPC,2026-05-29,0.8573682010173798,positive,news,Bleakley Financial Group LLC Makes New Investment in Marathon Petroleum Corporation $MPC
MPC,2026-05-28,0.9197029396891594,positive,news,Marathon Petroleum Corp. stock outperforms competitors on strong trading day
MPC,2026-05-28,0.9366898946464062,positive,news,Bath & Body Works Q1 Beat Masks Body Care Drag: Is the $600M FCF Floor Enough to Buy?
MPC,2026-05-28,0.8837866298854351,positive,news,Best Momentum Stock to Buy for May 28th
MPC,2026-05-28,0.9366583246737719,positive,news,"Allstate Corp Acquires 12,613 Shares of Marathon Petroleum Corporation $MPC"
MPC,2026-05-27,0.9318299107253551,positive,news,Marathon Petroleum Corp (NYSE:MPC) Passes the Screen for Reliable Dividend Growth
MPC,2026-05-27,-0.9234174638986588,negative,news,Legal & General Group Plc Has $278.77 Million Position in Marathon Petroleum Corporation $MPC
VZ,2026-06-05,-0.9458166752010584,negative,news,WCG Wealth Advisors LLC Has $3.21 Million Holdings in Verizon Communications Inc. $VZ
VZ,2026-06-05,0.9341765772551298,positive,news,"T-Mobile US, Inc. $TMUS Shares Purchased by Cibc World Market Inc."
VZ,2026-06-04,0.9020225396379828,positive,news,"Verizon declares quarterly dividend on June 4, 2026"
VZ,2026-06-04,0.9302183892577887,positive,news,"Verizon declares quarterly dividend on June 4, 2026"
VZ,2026-06-04,0.8327558925375342,positive,news,"Verizon declares quarterly dividend on June 4, 2026"
VZ,2026-06-04,-0.9669641405344009,negative,news,Verizon Communications Inc. stock underperforms Thursday when compared to competitors
VZ,2026-06-04,-0.9676609905436635,negative,news,Verizon Communications Inc Stock (VZ) Moved Down by 4.06% on Jun 4: A Full Analysis
VZ,2026-06-04,-0.9646965460851789,negative,news,T-Mobile US Inc Stock (TMUS) Moved Down by 3.09% on Jun 4: What Signal Does It Send?
VZ,2026-06-04,-0.23588798195123672,neutral,news,Court rules against cell service providers over right to jury trial in FCC proceedings
VZ,2026-06-04,0.9239600915461779,positive,news,Verizon Communications (VZ) Announced Results for Annual 2026 Shareholder Meeting
VZ,2026-06-04,0.9199314918369055,positive,news,Vornado adds 62K sf lease to winning streak at Penn 2
VZ,2026-06-04,-0.9410280399024487,negative,news,"T-Mobile US, Inc. $TMUS Shares Sold by TD Asset Management Inc"
VZ,2026-06-04,0.0661951769143343,neutral,news,Verizon Communications Executive VP & Chief Human Resources Officer Samantha Hammock Sells 82% Of Holding
VZ,2026-06-04,0.45658825244754553,neutral,news,Should Invesco S&P 500 High Dividend Low Volatility ETF (SPHD) Be on Your Investing Radar?
VZ,2026-06-04,0.8915329724550247,positive,news,Cibc World Market Inc. Increases Stock Position in Verizon Communications Inc. $VZ
VZ,2026-06-03,-0.939981784671545,negative,news,Why Verizon Communications (VZ) Dipped More Than Broader Market Today
VZ,2026-06-03,-0.9063561614602804,negative,news,Contractor evidence and Verizon internal communications make the case that the FCC can no longer ignore
VZ,2026-06-03,-0.9663454443216324,negative,news,Verizon Communications Inc Stock (VZ) Moved Down by 3.42% on Jun 3: Drivers Behind the Movement
VZ,2026-06-03,-0.9670030674897134,negative,news,AT&T Inc Stock (T) Moved Down by 3.63% on Jun 3: A Full Analysis
VZ,2026-06-03,-0.9657383300364017,negative,news,Cogent (CCOI) Down 3.7% Since Last Earnings Report: Can It Rebound?
VZ,2026-06-03,-0.005407663062214851,neutral,news,Verizon announces pricing terms of previously announced tender offers and consent solicitations
VZ,2026-06-03,-0.8968958556652069,negative,news,AT&T most at risk as consumers migrate towards satellite -- Oppenheimer (T:NYSE)
VZ,2026-06-03,0.5320532023906708,positive,news,Q3 EPS Estimate for Antero Midstream Boosted by Analyst
VZ,2026-06-03,0.26456491369754076,neutral,news,"AT&T offers home internet: fiber bundles as low as $35, up to $420 off"
VZ,2026-06-03,0.12485760450363159,positive,news,Marble Wealth LLC Takes $1.56 Million Position in Verizon Communications Inc. $VZ
VZ,2026-06-03,-0.8418518900871277,negative,news,"Natixis Advisors LLC Sells 521,464 Shares of Verizon Communications Inc. $VZ"
VZ,2026-06-03,0.936437408439815,positive,news,"CIBC Asset Management Inc Purchases 666,510 Shares of Verizon Communications Inc. $VZ"
VZ,2026-06-02,-0.008661594241857529,neutral,news,"Transcript : T-Mobile US, Inc. Presents at 2026 Evercore Global TMT Conference, Jun-02-2026 12"
VZ,2026-06-02,0.005512559786438942,neutral,news,"Verizon (VZ) HR chief Samantha Hammock sells 73,069 shares in open-market trade"
VZ,2026-06-02,0.004421520978212357,neutral,news,Verizon announces pricing terms of its tender offers and
VZ,2026-06-02,-0.95752062369138,negative,news,Array Digital Infrastructure stock hits all-time high of 52.28 USD
VZ,2026-06-02,0.030068187043070793,neutral,news,Verizon extends early participation date for note exchange offers; early tenders reported
VZ,2026-06-02,0.05032029561698437,neutral,news,Verizon announces extension of early participation date and early results of its private exchange offers and consent solicitations for 11 series of notes open to certain investors
VZ,2026-06-02,0.34082641545683146,neutral,news,Verizon extends early participation date for debt exchange offers
VZ,2026-06-02,0.23889619763940573,neutral,news,Verizon (VZ) extends note exchange deadline and reports early tender uptake
VZ,2026-06-02,0.20012495294213295,neutral,news,Principal Amount Tendered as of the Original Any and All Notes Early Participation Date
VZ,2026-06-02,0.030359743162989616,neutral,news,Verizon announces extension of early participation date and early results of its private exchange offers and consent solicitations for 11 series of notes open to certain investors
VZ,2026-06-02,0.9112747777253389,positive,news,"Verizon tender offer now targets $1.4B of debt, gives holders time to act"
VZ,2026-06-02,0.06179895903915167,neutral,news,Verizon bond swap draws up to 85.89% in one issue so far
VZ,2026-06-01,0.5065871048718691,positive,news,"Array completes $1.17 billion spectrum sale, declares $11 dividend"
VZ,2026-06-01,0.1056346520781517,neutral,news,"Array (NYSE: TDS) sells spectrum to Verizon, declares $11 special dividend"
VZ,2026-06-01,0.04666003305464983,neutral,news,Array Digital (NYSE: AD) to pay $11 special dividend after $1.0B Verizon sale
VZ,2026-06-01,0.03703103307634592,neutral,news,Array completes sale of select spectrum assets to Verizon for $1.0 billion
VZ,2026-06-01,0.12142445798963308,neutral,news,Cliff Jones Named Lab Chief of FCC’s Office of Engineering and Technology
VZ,2026-06-01,0.930628128349781,positive,news,Full Transcript: Assurant Q1 2026 Earnings Call
VZ,2026-06-01,0.6077458495274186,positive,news,PLDT and Smart empower CALABARZON MSMEs through digital marketing and cybersecurity workshops
VZ,2026-05-31,0.9401144804432988,positive,news,Verizon’s (VZ) Growing Cash Flow Continues to Support its Dividend
VZ,2026-05-31,0.916948800906539,positive,news,Norges Bank Takes $1.17 Billion Position in American Tower Corporation $AMT
VZ,2026-05-31,-0.7033759504556656,negative,news,"Savant Capital LLC Sells 31,314 Shares of Verizon Communications Inc. $VZ"
VZ,2026-05-30,0.9363258201628923,positive,news,"AT&T, T-Mobile, And Verizon Joint Venture Opens New Doors For AST SpaceMobile (NASDAQ: ASTS) Stock"
CL,2026-06-05,-0.5999720394611359,negative,news,Colgate-Palmolive (CL) Valuation Check After Key Leadership Changes In Global Oral Care And Marketing
CL,2026-06-05,0.6853056540712714,positive,news,"Colgate Optic White® x Chicha San Chen Proudly Debut the ""Dental-Grade Teeth Whitening Lab"""
CL,2026-06-04,0.6006742510944605,positive,news,Recyclable Toothpaste Tubes
CL,2026-06-04,0.6891958555206656,positive,news,Recyclable Toothpaste Tubes
CL,2026-06-04,0.2543277833610773,neutral,news,US soccer captain Tim Ream shares his childhood bedwetting story
CL,2026-06-03,0.6815426023676991,positive,news,Colgate-Palmolive México Launches Recyclable Toothpaste Tube
CL,2026-06-03,-0.9463387848809361,negative,news,Colgate-Palmolive on Pace for Largest Percent Decrease Since April 2025 -- Data Talk
CL,2026-06-03,0.10244497656822205,neutral,news,"Colgate-Palmolive Launches Serving Smiles, a New Podcast Delivering Health Conversations Gen Z Actually Want to Have"
CL,2026-06-03,0.12895349320024252,neutral,news,"Colgate-Palmolive Launches Serving Smiles, a New Podcast Delivering Health Conversations Gen Z Actually Want to Have"
CL,2026-06-03,-0.5880491584539413,negative,news,Is CL Overvalued? DCF Says Worth $43
CL,2026-06-03,-0.9664742453023791,negative,news,Clorox Co. stock underperforms Friday when compared to competitors
CL,2026-06-02,0.8996215024963021,positive,news,Colgate-Palmolive Extends Historic University Partnership
CL,2026-06-01,0.27100295294076204,neutral,news,Colgate-Palmolive appoints Ram Raghavan as Chief Marketing Officer
CL,2026-06-01,0.7052250858396292,positive,news,Colgate-Palmolive elevates Ram Raghavan to CMO
CL,2026-06-01,0.05747018940746784,neutral,news,Colgate-Palmolive appoints Ram Raghavan as chief marketing officer
CL,2026-06-01,0.23352359235286713,neutral,news,"Colgate-Palmolive elevates Samir Singh to President, Enterprise Oral Care"
CL,2026-06-01,0.69439119938761,positive,news,Colgate-Palmolive appoints Ram Raghavan as chief marketing officer
CL,2026-06-01,0.5263493256643414,positive,news,"CXO Moves: Exec movements across Colgate‑Palmolive, Asian Paints, OpenAI, Anthropic, Truecaller and more"
CL,2026-06-01,0.9289632979780436,positive,news,Colgate-Palmolive Co stock (US1845021021): CL trades near recent highs as S&P 500 consumer staple consolidates
CL,2026-06-01,0.7135342955589294,positive,news,Is Colgate-Palmolive (CL) Pricing Look Stretched After Recent Defensive Stock Interest
CL,2026-05-31,0.4714579563587904,neutral,news,Ram Raghavan Promoted to Global Chief Marketing Officer at Colgate-Palmolive
CL,2026-05-31,0.11361106671392918,neutral,news,Colgate Palmolive names Ram Raghavan as global CMO
CL,2026-05-30,0.8780378792434931,positive,news,How Investors Are Reacting To Colgate-Palmolive (CL) Shifting Toward Volume-Led Growth Amid Inflation Pressures
CL,2026-05-30,0.8541246391832829,positive,news,Colgate-Palmolive elevates Ram Raghavan to Global Chief Marketing Officer
CL,2026-05-30,0.22462872974574566,neutral,news,Ram Raghavan appointed chief marketing officer at Colgate-Palmolive
CL,2026-05-30,0.7233656207099557,positive,news,Colgate-Palmolive elevates Ram Raghavan to Chief Marketing Officer
CL,2026-05-30,0.8276536539196968,positive,news,There May Be Reason For Hope In Colgate-Palmolive (India)'s (NSE:COLPAL) Disappointing Earnings
CL,2026-05-29,0.38694775477051735,neutral,news,Ram Raghavan takes over as global chief marketing officer at Colgate-Palmolive
CL,2026-05-29,0.9089537225663662,positive,news,Kimberly-Clark’s Kenvue Deal Recasts Growth Story In Consumer Health
CL,2026-05-29,0.32458179723471403,neutral,news,Top Colgate-Palmolive (CL) Competitors 2026
CL,2026-05-29,0.04102898668497801,neutral,news,"Samir Singh appointed President, Enterprise Oral Care at Colgate-Palmolive; to join global leadership team"
CL,2026-05-29,-0.24499686062335968,neutral,news,"Analysts’ Opinions Are Mixed on These Consumer Goods Stocks: McCormick & Company (MKC), Colgate-Palmolive (CL) and Kroger Company (KR)"
CL,2026-05-29,-0.022985689342021942,neutral,news,KVUE News | KENVUE INC (NYSE:KVUE)
CL,2026-05-29,-0.5722588449716568,negative,news,Colgate-Palmolive (CL) Q4 Earnings and Revenues Surpass Estimates
CL,2026-05-28,0.8676325269043446,positive,news,Colgate Expands Childhood Oral Health Outreach
CL,2026-05-28,0.9356117714196444,positive,news,Here’s Why Colgate-Palmolive Stock Could Return Around 6% Annually Through 2028
CL,2026-05-28,0.8620061054825783,positive,news,"Colgate Bright Smiles, Bright Futures® and TeamSmile Celebrate 20-Year Partnership, Helping Deliver $24 Million in Free Dental Care"
CL,2026-05-28,-0.35258951783180237,negative,news,"Earnings call transcript: USA Compression misses EPS, beats revenue in Q1 2026"
CL,2026-05-27,0.6864888705313206,positive,news,Colgate-Palmolive Vote Keeps DEI Criteria And Combined Chair CEO Structure
CL,2026-05-27,0.9320879252627492,positive,news,Is Colgate Too Dependent on Pricing Actions for Revenue Growth?
CL,2026-05-27,0.12367904186248779,positive,news,Procter & Gamble Co Stock (PG) Moved Up by 3.39% on May 27: What Signal Does It Send?
CL,2026-05-27,0.012896865606307983,positive,news,Dollar Tree earnings on deck: Can multi-price offset headwinds?
CL,2026-05-27,0.9405196215957403,positive,news,Colgate-Palmolive (CL) Still Looks Like an Oral-Care Cash Compounder
CL,2026-05-26,-0.5637620538473129,negative,news,Can Procter & Gamble's Pricing Strategy Sustain Growth in 2026?
CL,2026-05-26,-0.8022211045026779,negative,news,Colgate-Palmolive (CL) Valuation Check After Mixed Short Term Share Price Performance
CL,2026-05-26,-0.9666835460811853,negative,news,Colgate-Palmolive (India) Ltd slips for fifth straight session
CL,2026-05-25,-0.9667773395776749,negative,news,"Colgate FY26 net profit falls to Rs 1,325.31 Cr"
CL,2026-05-25,0.9319525435566902,positive,news,Colgate-Palmolive ad spends rise 10% in Q4 FY26 amid premiumisation push
CL,2026-05-25,0.4035407602787018,positive,news,"Colgate-Palmolive India shares upgraded by Nomura, but majority analysts still say 'sell'"
CL,2026-05-24,0.16546036303043365,neutral,news,Is Colgate-Palmolive (CL) Still Reasonably Priced After Its Recent Share Price Climb?
D,2026-06-05,-0.384878009557724,negative,news,CEG Trades Below 50 and 200 Day SMA: Buy Opportunity or Wait for Now?
D,2026-06-05,0.9315920462831855,positive,news,Analyst Upgrades Dominion Energy (D) Following NextEra Deal Announcement
D,2026-06-05,0.9360286574810743,positive,news,Analyst Upgrades Dominion Energy (D) Following NextEra Deal Announcement
D,2026-06-05,0.7986587882041931,positive,news,NextEra Energy (NEE) – Among the 10 Best Renewable Energy Stocks to Buy According to Billionaires
D,2026-06-04,0.7688500368967652,positive,news,Southern Highlights Grid Upgrades As New Corporate Affairs Leader Steps In
D,2026-06-04,0.8653147779405117,positive,news,Dominion Energy Inc. stock outperforms competitors on strong trading day
D,2026-06-04,-0.9675458446145058,negative,news,WEC Energy (WEC) Down 3.4% Since Last Earnings Report: Can It Rebound?
D,2026-06-04,0.3850481119006872,neutral,news,Dominion Energy South Carolina customers can double their rebate on pool pumps through June 30
D,2026-06-04,-0.9663075422868133,negative,news,Richmond down to six Fortune 500s in latest rankings
D,2026-06-04,0.6255111936479807,positive,news,"Energy Transition Meets AI Boom: Siemens Energy, RE Royalties, and NextEra Energy in Focus"
D,2026-06-03,-0.7910911217331886,negative,news,Public Service Enterprise Group’s 2031 Notes Reshape Debt And Funding Outlook
D,2026-06-03,-0.9174755048006773,negative,news,Loudoun homeowners battle Dominion Energy to save threatened property values
D,2026-06-03,-0.9683156199753284,negative,news,Dominion Energy Inc. stock underperforms Wednesday when compared to competitors
D,2026-06-03,-0.9485118808224797,negative,news,"Rain runoff across East Tennessee is the fourth lowest in 152 years, TVA says"
D,2026-06-03,-0.05155287683010101,neutral,news,Dominion Energy opens summer cooling assistance program for Virginia households
D,2026-06-02,0.9045104570686817,positive,news,WEC Energy Group stock (US92939U1060): shares ease as NYSE price consolidates after June investor up
D,2026-06-02,0.09381248243153095,neutral,news,Dominion Energy opens summer cooling assistance program for Virginia households
D,2026-06-02,-0.4494362026453018,negative,news,Dominion Energy schedules Wednesday morning outages for Batesburg-Leesville upgrades
D,2026-06-02,0.5830823732540011,positive,news,Dominion Energy SC readies for hurricane season year-round
D,2026-06-02,0.474727988243103,positive,news,Is Xcel Energy (XEL) a Safe Bet for Dividend Investors
D,2026-06-02,-0.9301088768988848,negative,news,|‘Too soon’ to see NC’s effects from a NextEra-Dominion deal
D,2026-06-01,-0.9533316064625978,negative,news,Dominion Energy Inc (D) Stock Down 3.5% but Still Overvalued -- GF Score: 77/100
D,2026-06-01,-0.9435625281184912,negative,news,Dominion Energy Inc stock (US2358511028): shares ease after recent ex-dividend date
D,2026-06-01,-0.9649146907031536,negative,news,Nextera Energy Inc Stock (NEE) Moved Down by 3.32% on Jun 1: A Full Analysis
D,2026-06-01,0.9301497768610716,positive,news,NextEra Energy Inc. stock (US65339F1012): shares steady as hurricane-season preparations and fund ho
D,2026-06-01,0.11015605926513672,positive,news,Dominion Energy Inc. stock outperforms competitors despite losses on the day
