ticker,date,sentiment_score,sentiment_label,content_type,title
JPM,2026-05-27,-0.00649123452603817,neutral,news,"Transcript : Howmet Aerospace Inc. Presents at Bernstein 42nd Annual Strategic Decisions Conference, May-27-2026 08"
JPM,2026-05-27,0.8740608543157578,positive,news,"MGM Resorts International (NYSE:MGM) Upgraded to ""Overweight"" at JPMorgan Chase & Co."
JPM,2026-05-27,-0.015280133113265038,neutral,news,Truist Financial Maintains JPMorgan(JPM.US) With Hold Rating
JPM,2026-05-27,0.9369645826518536,positive,news,FedEx Stock Expected to Rise After Spin-Off of Freight Business
JPM,2026-05-27,0.24008746165782213,neutral,news,Patented: JPMorgan Chase's Systems for Using a Cryptogram Lockbox and More North Texas Inventive Activity
JPM,2026-05-27,0.8462496576830745,positive,news,INTRODUCING | SoFi Becomes First U.S National Bank to Offer a Stablecoin Directly to Retail Customers on a Public Blockchain
JPM,2026-05-27,0.7877384219318628,positive,news,"Royal Palms Capital LLC Acquires Shares of 113,857 Teva Pharmaceutical Industries Ltd. $TEVA"
JPM,2026-05-27,0.92899807728827,positive,news,"King Luther Capital Management Corp Acquires 7,718 Shares of Arthur J. Gallagher & Co. $AJG"
JPM,2026-05-27,0.932953929528594,positive,news,Freedom Broker Raises Target on Bank of America (BAC) After Strong Q1 Results
JPM,2026-05-27,0.26681896205991507,neutral,news,Royal Palms Capital LLC Invests $4.14 Million in Regions Financial Corporation $RF
JPM,2026-05-27,0.9316766001284122,positive,news,"Jackson Creek Investment Advisors LLC Acquires 39,329 Shares of Par Pacific Holdings, Inc. $PARR"
JPM,2026-05-27,-0.3424355275928974,neutral,news,JPMorgan (JPM) launches auto-callable notes paying ≥13.50% with Nov 2026 call
JPM,2026-05-27,-0.5002230852842331,negative,news,"Legal & General Group Plc Sells 15,825 Shares of Arthur J. Gallagher & Co. $AJG"
JPM,2026-05-27,0.9390085972845554,positive,news,Radian Group Inc. $RDN Shares Acquired by Jefferies Financial Group Inc.
JPM,2026-05-27,0.9330757660791278,positive,news,"Jefferies Financial Group Inc. Buys Shares of 23,240 Penske Automotive Group, Inc. $PAG"
JPM,2026-05-27,-0.8802821673452854,negative,news,"Nexstar Media Group, Inc. $NXST Shares Sold by New Age Alpha Advisors LLC"
JPM,2026-05-27,0.9322982989251614,positive,news,"TTM Technologies, Inc. $TTMI Shares Bought by Royce & Associates LP"
JPM,2026-05-27,-0.5769263356924057,negative,news,"Jefferies Financial Group Inc. Sells 11,146 Shares of AutoZone, Inc. $AZO"
JPM,2026-05-27,0.933320913463831,positive,news,"Jefferies Financial Group Inc. Grows Stake in Arista Networks, Inc. $ANET"
JPM,2026-05-27,0.9288531672209501,positive,news,"15,078 Shares in Hershey Company (The) $HSY Acquired by Jefferies Financial Group Inc."
JPM,2026-05-27,0.9342818474397063,positive,news,"Northwestern Mutual Wealth Management Co. Increases Position in Kinsale Capital Group, Inc. $KNSL"
JPM,2026-05-27,0.9205266181379557,positive,news,Northwestern Mutual Wealth Management Co. Has $2.10 Million Stock Holdings in SouthState Bank Corporation $SSB
JPM,2026-05-27,-0.6639192253351212,negative,news,Range Resources Corporation $RRC Shares Sold by Jefferies Financial Group Inc.
JPM,2026-05-27,0.8192161098122597,positive,news,"LSV Asset Management Purchases 26,400 Shares of Post Holdings, Inc. $POST"
JPM,2026-05-27,0.8912193421274424,positive,news,Flputnam Investment Management Co. Increases Stake in Wells Fargo & Company $WFC
JPM,2026-05-27,0.9255982236936688,positive,news,North Dakota State Investment Board Buys New Holdings in JPMorgan Chase & Co. $JPM
JPM,2026-05-27,0.7963782660663128,positive,news,Passumpsic Savings Bank Invests $3.10 Million in JPMorgan Chase & Co. $JPM
JPM,2026-05-27,0.9296186808496714,positive,news,JPMorgan Chase & Co. $JPM Shares Bought by Rossmore Private Capital
JPM,2026-05-27,-0.9444928262382746,negative,news,Employees Retirement System of Texas Lowers Holdings in Intercontinental Exchange Inc. $ICE
JPM,2026-05-27,0.9100873023271561,positive,news,Employees Retirement System of Texas Increases Stock Holdings in Fastenal Company $FAST
JPM,2026-05-27,-0.0504967886954546,neutral,news,JPMorgan exits substantial holder position in Temple & Webster
JPM,2026-05-27,-0.4118644744157791,negative,news,"Cary Street Partners Financial LLC Acquires 10,900 Shares of Walmart Inc. $WMT"
JPM,2026-05-27,0.8411561474204063,positive,news,JPMorgan upgrades HB Fuller stock rating to neutral on uncertainty By Investing.com
JPM,2026-05-27,0.9285348551347852,positive,news,"Micron Hits $1 Trillion, Overtakes JPMorgan, Walmart And Eli Lilly - Micron Technology (NASDAQ:MU)"
JPM,2026-05-27,0.9394973367452621,positive,news,"Allstate Corp Has $5.13 Million Stock Position in The Travelers Companies, Inc. $TRV"
JPM,2026-05-27,0.935460994951427,positive,news,"Allstate Corp Buys 12,416 Shares of Ross Stores, Inc. $ROST"
JPM,2026-05-27,0.9062217762693763,positive,news,"Allstate Corp Has $5.92 Million Stock Holdings in Regeneron Pharmaceuticals, Inc. $REGN"
JPM,2026-05-27,0.9321314543485641,positive,news,Allstate Corp Has $6.93 Million Stock Holdings in Duke Energy Corporation $DUK
JPM,2026-05-27,0.9356704438105226,positive,news,"AlphaQuest LLC Has $2.69 Million Stock Position in Principal Financial Group, Inc. $PFG"
JPM,2026-05-27,0.9249241650104523,positive,news,Oppenheimer Reiterates Buy Rating on Elastic N.V. (ESTC)
JPM,2026-05-27,0.9179882444441319,positive,news,"Analysts Revise Price Targets on Mercury Systems, Inc. (MRCY) Following Q3 Earnings Report"
V,2026-05-27,0.934093956835568,positive,news,Integrity Alliance LLC. Increases Holdings in International Business Machines Corporation $IBM
V,2026-05-27,-0.8433428034186363,negative,news,"Legal & General Group Plc Cuts Holdings in EOG Resources, Inc. $EOG"
V,2026-05-26,0.8911869851872325,positive,news,BILL Transforms SMB Payments With Embedded Finance
V,2026-05-26,-0.025642886757850647,neutral,news,"Berkshire sells Visa, Domino's, and Pool Corp: Should you follow?"
V,2026-05-26,-0.8046595901250839,negative,news,"Berkshire Sells Visa, Domino's, and Pool Corp: Should You Follow?"
V,2026-05-26,-0.6980353742837906,negative,news,"Tandem Investment Advisors Inc. Sells 93,396 Shares of Brown & Brown, Inc. $BRO"
V,2026-05-26,-0.9468238949775696,negative,news,Phillips 66 $PSX Shares Sold by Todd Asset Management LLC
V,2026-05-26,-0.9017797783017159,negative,news,Pool Corporation $POOL Shares Sold by Swedbank AB
V,2026-05-26,-0.9083940833806992,negative,news,William Blair Investment Management LLC Has $25.41 Million Stake in Agree Realty Corporation $ADC
V,2026-05-26,-0.9504232304170728,negative,news,"Royce & Associates LP Sells 86,621 Shares of Vontier Corporation $VNT"
V,2026-05-26,0.9389843000099063,positive,news,Jefferies Financial Group Inc. Invests $6.19 Million in HF Sinclair Corporation $DINO
V,2026-05-25,-0.9395667780190706,negative,news,"Main Street Research LLC Has $256,000 Stock Holdings in Linde PLC $LIN"
V,2026-05-25,-0.5617989003658295,negative,news,Hantz Financial Services Inc. Trims Stock Position in MSCI Inc $MSCI
V,2026-05-25,0.9339731968939304,positive,news,"Axxcess Wealth Management LLC Buys 21,075 Shares of Corteva, Inc. $CTVA"
V,2026-05-25,0.19175383634865284,neutral,news,"AT&T, Verizon, T-Mobile & Others Form C2 ISAC Cybersecurity Information Sharing Group"
V,2026-05-25,-0.962944089435041,negative,news,"Visa-backed PayMate ties unpaid employee dues to long-pending DigiAsia deal, funding"
V,2026-05-24,0.03907303512096405,neutral,news,Mastercard Incorporated Class A Trade Ideas — BX:M4I
V,2026-05-24,-0.9061588495969772,negative,news,"HS Management Partners LLC Sells 488,550 Shares of PayPal Holdings, Inc. $PYPL"
V,2026-05-24,0.934516666457057,positive,news,"Jefferies Financial Group Inc. Buys 472,000 Shares of Bank Of Montreal $BMO"
V,2026-05-24,0.9358619023114443,positive,news,Western Digital Corporation $WDC Position Raised by PNC Financial Services Group Inc.
V,2026-05-24,-0.8978039957582951,negative,news,HP Inc. $HPQ Shares Sold by Handelsbanken Fonder AB
V,2026-05-24,0.9301541559398174,positive,news,"Northwestern Mutual Wealth Management Co. Acquires 55,412 Shares of Fastenal Company $FAST"
V,2026-05-24,0.933649268001318,positive,news,"EverSource Wealth Advisors LLC Buys 11,062 Shares of Texas Pacific Land Corporation $TPL"
V,2026-05-24,0.9340192209929228,positive,news,"Axxcess Wealth Management LLC Raises Holdings in Altria Group, Inc. $MO"
V,2026-05-24,0.3335385322570801,neutral,news,"PayPal Holdings, Inc. Trade Ideas — LS:A14R7U"
V,2026-05-23,0.9402472395449877,positive,news,Guinness Asset Management LTD Has $54.25 Million Position in Salesforce Inc. $CRM
V,2026-05-23,0.927287058904767,positive,news,"100,000 Shares in Oracle Corporation $ORCL Bought by Mizuho Markets Americas LLC"
V,2026-05-23,-0.5826946347951889,negative,news,Edwards Lifesciences Corporation $EW Shares Sold by Rathbones Group PLC
V,2026-05-23,0.9134552571922541,positive,news,"Resona Asset Management Co. Ltd. Buys Shares of 93,653 Flex Ltd. $FLEX"
V,2026-05-23,0.9287247359752655,positive,news,"PayPal Holdings, Inc. $PYPL Shares Purchased by HighTower Advisors LLC"
V,2026-05-23,0.9074270306155086,positive,news,"Visa and Trip.com Group Unveil New Strategic Initiative to Connect Travel Planning, Lifestyle Experiences and Secure Payment Solutions"
V,2026-05-22,0.781141065992415,positive,news,"Cerebras Systems' Chips May Be 15X Faster Than Some of Nvidia's Blackwell Models, but Nvidia Has 2 Distinct Advantages"
V,2026-05-22,0.8980594724416733,positive,news,"Visa and Trip.com Group Ink Strategic Collaboration, Enabling Consumers to Chase Their Passions Through Travel"
V,2026-05-22,-0.029272526502609253,negative,news,6 Charts on SpaceX’s S-1 Financials
V,2026-05-22,0.923445294611156,positive,news,Leonteq Securities AG Invests $1.32 Million in Howmet Aerospace Inc. $HWM
V,2026-05-22,0.1047762893140316,neutral,news,Mastercard Incorporated Class A Trade Ideas — BVL:MAUS
V,2026-05-22,0.18102686572819948,neutral,news,Ralph Lauren (NYSE: RL) outlines global footprint and multi-year transformation
V,2026-05-22,0.042316441424191,neutral,news,Berkshire Hathaway Inc. Class B Trade Ideas — BVL:BRK/BUS
V,2026-05-22,0.004181684926152229,neutral,news,Visa Inc. Class A Trade Ideas — BVL:VUS
V,2026-05-22,-0.0443249698728323,neutral,news,Cost of goods sold of Visa Inc. Class A – BVL:VUS
V,2026-05-21,-0.9531768122687936,negative,news,Berkshire Hathaway Eliminates Domino’s Pizza Stake As Greg Abel Cuts Portfolio Companies
V,2026-05-21,-0.035932956263422966,neutral,news,Diluted shares outstanding of Visa Inc. Class A – BVL:VUS
V,2026-05-21,0.007987050339579582,neutral,news,Visa Inc. Class A Cash Flow – BVL:VUS
V,2026-05-21,0.04437880031764507,neutral,news,"Gordon Reid's Top Picks: Apple Inc, Celanese & Visa"
V,2026-05-21,-0.0382886566221714,neutral,news,Taxes of Visa Inc. Class A – BVL:VUS
V,2026-05-21,0.9055866966955364,positive,news,AmEx Expands Sports Commerce Strategy With Fanatics Tie-Up
V,2026-05-21,-0.051599033176898956,neutral,news,Visa Inc. Class A Dividends – BVL:VUS
V,2026-05-21,0.9241221807897091,positive,news,Visa Inc. Class A Earnings and Revenue – BVL:VUS
PFE,2026-05-27,0.07810563407838345,neutral,news,Pfizer to Webcast Healthcare Conference Discussion
PFE,2026-05-27,0.9144173935055733,positive,news,UBS maintains Pfizer stock rating ahead of cancer drug trial results
PFE,2026-05-27,0.7907721269875765,positive,news,UBS maintains Pfizer stock rating ahead of cancer drug trial results
PFE,2026-05-27,0.02096338663250208,neutral,news,Pfizer Invites Public to View and Listen to Webcast of Pfizer Discussion at Healthcare Conference
PFE,2026-05-27,0.019263980910182,neutral,news,Pfizer Invites Public to View and Listen to Webcast of Pfizer Discussion at Healthcare Conference
PFE,2026-05-27,0.8343468494713306,positive,news,"Lilly wheels and deals, Moderna gets boost on hantavirus scare, ASCO excitement builds"
PFE,2026-05-27,0.9150443095713854,positive,news,"Mizuho Adjusts Price Target on EOG Resources to $157 From $149, Maintains Neutral Rating"
PFE,2026-05-27,0.9353016838431358,positive,news,"Pfizer (PFE.US) has received approval in China for a new formulation of its blockbuster anti-infective innovative drug, further enhancing the treatment regimen for invasive fungal diseases in children."
PFE,2026-05-27,0.9200931191444397,positive,news,BofA Raises Price Target on Pfizer (PFE) Following Strong Q1 Results
PFE,2026-05-27,0.8884971076622605,positive,news,"UBS Maintains Pfizer(PFE.US) With Hold Rating, Maintains Target Price $27"
PFE,2026-05-26,0.9360730219632387,positive,news,AstraZeneca PLC (AZN): Onco-Blockbuster Scaling and Biologics Fab Integration Drive Intrinsic Expansion Toward Upside Valuation Targets
PFE,2026-05-26,0.8437322787940502,positive,news,"Pfizer's BRAFTOVI® Becomes First Pfizer Therapy to Receive Priority Access Under Ontario's FAST Program, Accelerating Treatment for Canadians with Metastatic Colorectal Cancer"
PFE,2026-05-26,-0.9475346114486456,negative,news,BridgeBio Pharma (BBIO) Downgraded by Raymond James Amid Competitive Pressures
PFE,2026-05-26,0.34395039081573486,positive,news,Pfizer Beats Q1 Estimates and Advances Its Pipeline. Here’s Whether It Is Worth Buying at $26
PFE,2026-05-26,0.3771755089983344,neutral,news,GSK : to showcase long-term outcomes and pipeline expansion with latest oncology research at ASCO and EHA
PFE,2026-05-26,-0.9622379466891289,negative,news,BridgeBio stock downgraded at Raymond James (PFE:NYSE)
PFE,2026-05-26,0.9133549509570003,positive,news,Is Pfizer Inc. (PFE) One of the Best Medical Stocks to Invest in According to Billionaires?
PFE,2026-05-26,0.8270389507524669,positive,news,Lilly lands vaccine trifecta with 3 new biotech buys valued at $3.8B
PFE,2026-05-26,0.8988359812647104,positive,news,"Pfizer's BRAFTOVI® Becomes First Pfizer Therapy to Receive Priority Access Under Ontario's FAST Program, Accelerating Treatment for Canadians with Metastatic Colorectal Cancer"
PFE,2026-05-26,0.012142473831772804,neutral,news,"Abeona plans Jefferies fireside chat, Goldman investor meetings"
PFE,2026-05-26,-0.09104245528578758,neutral,news,"Citi Maintains Pfizer(PFE.US) With Hold Rating, Maintains Target Price $27"
PFE,2026-05-26,0.052685728296637535,neutral,news,Cumberland Pharmaceuticals (NASDAQ: CPIX) to divest marketed brands to Apotex for $100M
PFE,2026-05-26,-0.8181717470288277,negative,news,"Jefferies Financial Group Inc. Trims Stock Position in Regeneron Pharmaceuticals, Inc. $REGN"
PFE,2026-05-26,0.8221902456134558,positive,news,"Novartis AG stock (CH0012005267): Spin-off, oncology focus and pipeline updates in the spotlight"
PFE,2026-05-26,0.5271444637328386,positive,news,Caution with BioNTech! Novo Nordisk Accelerates! Buying Opportunity in Vidac Pharma Stock?
PFE,2026-05-26,0.5872914344072342,positive,news,Pfizer (PFE) Valuation Check After New HYMPAVZI Approval Vaccine Data And Oncology Collaboration
PFE,2026-05-26,0.7283731466159225,positive,news,"Narcolepsy Market Trends, Innovation, and Future Growth Outlook to 2034 – DelveInsight | Taisho Pharmaceutical, Jazz Pharma, Suven Life Sciences Limited, Alza Corporation, Cephalon, Orphan Medical"
PFE,2026-05-25,0.6011701226234436,positive,news,"Sir Pascal Soriot: Veterinary Scientist, Pharmaceutical Transformer, and Executive Director and CEO of AstraZeneca"
PFE,2026-05-25,0.9324409337714314,positive,news,AstraZeneca plc stock (GB0009895292): FDA approval for Datroway puts oncology pipeline in the spotli
PFE,2026-05-25,0.8895661812275648,positive,news,Pfizer Inc. stock (US7170811035): Cancer focus and pipeline updates keep investors watching PFE
PFE,2026-05-25,0.9219447048380971,positive,news,Novartis AG stock (CH0012005267): Pharma player focuses on core business and pipeline momentum
PFE,2026-05-25,0.7130158096551895,positive,news,Johnson & Johnson $JNJ Stock Holdings Lessened by Legal & General Group Plc
PFE,2026-05-25,0.9408402759581804,positive,news,Johnson & Johnson $JNJ is Sectoral Asset Management Inc.'s 7th Largest Position
PFE,2026-05-25,0.9201724212616682,positive,news,GSK plc (GSK) Stock Analysis: Attractive 12.23% Potential Upside Amid Strong Dividend Yield
PFE,2026-05-25,0.9427372291684151,positive,news,"Choate Investment Advisors Buys 13,581 Shares of Merck & Co., Inc. $MRK"
PFE,2026-05-25,0.19238293170928955,neutral,news,"Merck & Co., Inc. stock (US58933Y1055): Key takeaways from the latest Keytruda and pipeline updates"
PFE,2026-05-25,-0.7514401748776436,negative,news,Spotting Winners: Pfizer (NYSE:PFE) And Branded Pharmaceuticals Stocks In Q1
PFE,2026-05-24,0.2949570119380951,positive,news,A Look At Teva (NYSE:TEVA) Valuation After EMA Accepts Filing For Monthly Schizophrenia Injection
PFE,2026-05-24,-0.9423219449818134,negative,news,Takeda Workforce Cuts Reshape Costs While Valuation Signals Possible Upside
PFE,2026-05-24,0.017702272161841393,neutral,news,Pfizer Inc To Discuss Data From An Ongoing Phase 1/2 Study Of mRNA-Based Vaccine Candidate Against SARS-CoV-2 Call Transcript
PFE,2026-05-24,0.857290836982429,positive,news,"Merck & Co., Inc. stock (US58933Y1055): cancer franchise drives outlook after latest Keytruda data"
PFE,2026-05-24,0.1064312756061554,neutral,news,"Health News Roundup: CureVac files expanded patent lawsuit against Pfizer/BioNTech over mRNA technology; AstraZeneca's China boss says drugmaker will seek to ""love the Communist Party"" and more"
PFE,2026-05-24,-0.6149068176746368,negative,news,Pfizer Collaboration Targets Faster Cancer Trials While Shares Trade Below Value
PFE,2026-05-23,-0.3826567828655243,negative,news,Cumberland Partners Ltd Has $12.29 Million Position in Johnson & Johnson $JNJ
PFE,2026-05-23,0.9375707693397999,positive,news,Americana Partners LLC Grows Stock Position in Johnson & Johnson $JNJ
PFE,2026-05-22,0.9250493440777063,positive,news,"CING Stock Price, Quote & Chart | CINGULATE INC (NASDAQ:CING)"
PFE,2026-05-22,0.07198851276189089,neutral,news,AZN News | ASTRAZENECA PLC (NYSE:AZN)
PFE,2026-05-22,-0.7541979271918535,negative,news,Pfizer class action alleges website tracked users despite cookie opt-outs
PFE,2026-05-22,0.8763543926179409,positive,news,"Merck & Co., Inc. stock (US58933Y1055): Key cancer drug data and dividend profile in focus"
PFE,2026-05-22,0.7990558799356222,positive,news,Cantor Fitzgerald reiterates Overweight on ORIC Pharmaceuticals stock By Investing.com
AMGN,2026-05-27,-0.5798705443739891,negative,news,Is It Too Late To Consider Amgen (AMGN) After Its Strong Multi Year Share Price Run?
AMGN,2026-05-27,0.9342063441872597,positive,news,King Luther Capital Management Corp Increases Position in Amgen Inc. $AMGN
AMGN,2026-05-26,0.7585079418495297,positive,news,Amgen Named One of Newsweek’s Most Trustworthy Companies in America 2026
AMGN,2026-05-26,-0.16283941268920898,negative,news,AMGN Stock Down 13% in 3 Months: Buy the Dip or Book Profits?
AMGN,2026-05-26,-0.45169779658317566,negative,news,Assessing Amgen (AMGN) Valuation After Japan Safety Concerns Over Rare Disease Drug
AMGN,2026-05-26,0.9150735111907125,positive,news,"Fisher Asset Management LLC Purchases 118,273 Shares of Amgen Inc. $AMGN"
AMGN,2026-05-26,-0.9595049098134041,negative,news,A Look At Regeneron Pharmaceuticals (REGN) Valuation After Recent Trial Wins And New Research Partnership
AMGN,2026-05-26,0.9348343759775162,positive,news,Allstate Corp Has $13.13 Million Holdings in Amgen Inc. $AMGN
AMGN,2026-05-26,0.180817149579525,neutral,news,Roivant Shelf Plan Raises Questions On Dilution And Pipeline Funding
AMGN,2026-05-25,-0.08713559992611408,neutral,news,Amgen (AMGN) Announces Retirement of CFO Peter Griffith
AMGN,2026-05-25,0.9393569994717836,positive,news,10 Cheap NASDAQ Stocks to Buy Right Now
AMGN,2026-05-25,0.8314251052215695,positive,news,"Wealthquest Corp Acquires Shares of 3,374 Amgen Inc. $AMGN"
AMGN,2026-05-25,0.9347068630158901,positive,news,Legal & General Group Plc Boosts Stock Holdings in Amgen Inc. $AMGN
AMGN,2026-05-25,0.9334053117781878,positive,news,Amgen Inc. $AMGN Shares Bought by New Age Alpha Advisors LLC
AMGN,2026-05-25,0.9271212769672275,positive,news,Simplify Asset Management Inc. Makes New Investment in Amgen Inc. $AMGN
AMGN,2026-05-25,0.9184858165681362,positive,news,Amgen Inc. (AMGN) Stock Analysis: Strong ROE and Promising Outlook in the Healthcare Sector
AMGN,2026-05-25,-0.5200256109237671,negative,news,Is Booking Stock Undervalued Stock Or Value Trap?
AMGN,2026-05-24,-0.8987262081354856,negative,news,Amgen Inc. $AMGN Shares Sold by Swedbank AB
AMGN,2026-05-24,0.8188732415437698,positive,news,Amgen Inc. $AMGN is Smead Capital Management Inc.'s 5th Largest Position
AMGN,2026-05-23,0.11745739262551069,neutral,news,Does Amgen’s CFO Transition and Board Structure Shape a New Governance Story for AMGN?
AMGN,2026-05-23,-0.3829049989581108,neutral,news,Does Amgen’s CFO Transition and Board Structure Shape a New Governance Story for AMGN?
AMGN,2026-05-23,0.0367712015286088,neutral,news,Amgen Inc. (AMGN) is attracting investor attention: Here is what you should know
AMGN,2026-05-23,0.8992522042244673,positive,news,Mizuho initiates Q32 Bio stock coverage with Outperform rating
AMGN,2026-05-23,0.12150079663842916,neutral,news,"Legato Capital Management LLC Acquires Shares of 8,328 Amgen Inc. $AMGN"
AMGN,2026-05-23,0.9259725026786327,positive,news,Axxcess Wealth Management LLC Raises Position in Amgen Inc. $AMGN
AMGN,2026-05-23,-0.510800376534462,negative,news,"Amgen (NASDAQ:AMGN) Upgraded by Wall Street Zen to ""Buy"" Rating"
AMGN,2026-05-23,-0.8564992621541023,negative,news,Amgen Inc. (NASDAQ: AMGN) Stock Trades Near $330 as Japan Drug Safety Crisis Raises Concerns
AMGN,2026-05-22,0.9376835562288761,positive,news,BeOne Medicines: Recent FDA Approval Rewrites One-Drug Narrative
AMGN,2026-05-22,0.3680214062333107,neutral,news,Amgen (AMGN) director Ellen Kullman receives 665-share RSU equity grant
AMGN,2026-05-22,0.8966106381267309,positive,news,Erasca Merck Pact Puts ERAS 0015 KEYTRUDA Combo In Investor Focus
AMGN,2026-05-22,0.5301403217017651,positive,news,Amgen (NASDAQ: AMGN) director Brian Druker receives 665-share RSU grant
AMGN,2026-05-22,0.878575355745852,positive,news,Breakingviews - Honeywell quantum IPO tests financial paradox
AMGN,2026-05-22,-0.9343672143295407,negative,news,Inside Microsoft’s high-stakes push to win back its AI lead
AMGN,2026-05-22,0.9336534515023232,positive,news,Keudell Morrison Wealth Management Makes New Investment in Amgen Inc. $AMGN
AMGN,2026-05-22,-0.44927420280873775,neutral,news,"Rx Rundown: Parabilis Medicines, Boston Scientific, Amgen and more"
AMGN,2026-05-22,0.17636223137378693,neutral,news,Amgen (AMGN) director Omar Ishrak receives 665-share stock grant in Form 4
AMGN,2026-05-22,0.9106708578765392,positive,news,Mizuho initiates Q32 Bio stock coverage with Outperform rating By Investing.com
AMGN,2026-05-22,0.8730601323768497,positive,news,"Global Retirement Partners LLC Purchases 5,691 Shares of Amgen Inc. $AMGN"
AMGN,2026-05-22,0.6961908005177975,positive,news,"Amgen (AMGN) director Amy E. Miles awarded 665 RSUs, now holds 5,640 shares"
AMGN,2026-05-22,0.6321998331695795,positive,news,"Amgen (NASDAQ: AMGN) director granted 665-share equity award, now holds 18,284"
AMGN,2026-05-22,-0.8925243616104126,negative,news,"Amgen Inc. Stock 12‑Month Price Target Cut to $352.32, Implies 4% Upside"
AMGN,2026-05-22,0.8765184311196208,positive,news,Amgen Inc. (AMGN): Navellier’s Long-Term Pick on Pipeline Strength and Sales Growth
AMGN,2026-05-21,0.12756950594484806,neutral,news,"Amgen’s ‘boomerang’ CFO reaps $12.5M in cash, retention bonuses"
AMGN,2026-05-21,0.06113013997673988,neutral,news,"Amgen CFO Change Puts Focus On Debt, Growth And Capital Discipline"
MMM,2026-05-26,-0.307829312980175,neutral,news,Q1 Earnings Roundup: JBT Marel (NYSE:JBTM) And The Rest Of The General Industrial Machinery Segment
MMM,2026-05-26,0.8195360964164138,positive,news,"Global Precipitated Silica Market Forecast 2036: How Evonik Industries AG, Solvay SA & PPG Industries Inc. Are Driving Industry Growth Across India, China & USA"
MMM,2026-05-26,0.8292423216626048,positive,news,The National Coalition of Certification Centers and 3M award national scholarships to skilled trades students nationwide
MMM,2026-05-26,-0.06452399492263794,negative,news,"Morningstar Investment Management LLC Lowers Stake in EOG Resources, Inc. $EOG"
MMM,2026-05-26,0.9223441667854786,positive,news,"Legal & General Group Plc Purchases 41,769 Shares of The Travelers Companies, Inc. $TRV"
MMM,2026-05-26,0.4347631260752678,neutral,news,3M Company stock (US88579Y1010): Spin-off of Solventum reshapes the industrial giant
MMM,2026-05-26,0.6343285040929914,positive,news,Elsevier Foundation Chemistry for Climate Action Challenge 2026: turning waste into climate action
MMM,2026-05-26,0.739265076816082,positive,news,"Allstate Corp Boosts Stock Holdings in The Home Depot, Inc. $HD"
MMM,2026-05-25,-0.9428953565657139,negative,news,Chemours (CC) Valuation In Focus As EPA Eases Refrigerant Rules And Policy Support Shifts
MMM,2026-05-24,0.9353643087670207,positive,news,3M Company stock (US88579Y1010): turnaround story after spin-off and fresh legal settlement
MMM,2026-05-24,0.9171149246394634,positive,news,Otis Worldwide Corp. stock (US68902V1070): solid Q1 2026 results and dividend keep elevator speci
MMM,2026-05-24,-0.9147458523511887,negative,news,"Mativ Holdings, Inc. (NYSE:MATV) Is About To Go Ex-Dividend, And It Pays A 4.6% Yield"
MMM,2026-05-24,-0.9336497355252504,negative,news,"UBS Group AG Sells 104,401 Shares of Tecnoglass Inc. $TGLS"
MMM,2026-05-24,0.9350359160453081,positive,news,A Look At 3M (MMM) Valuation As Road Marking Demand And Infrastructure Spending Gain Traction
MMM,2026-05-24,0.3022473491728306,neutral,news,"3M Company stock (US88579Y1010): spin-off, earnings pressure and legal risks in focus"
MMM,2026-05-24,0.9278778694570065,positive,news,Connors Investor Services Inc. Acquires New Shares in The Boeing Company $BA
