ticker,date,sentiment_score,sentiment_label,content_type,title
AAPL,2026-06-05,0.9335796665400267,positive,news,Western Wealth Management LLC Has $71.53 Million Holdings in Apple Inc. $AAPL
AAPL,2026-06-05,0.761541873216629,positive,news,"TD Asset Management Inc Has $147.60 Million Stake in VeriSign, Inc. $VRSN"
AAPL,2026-06-05,0.9307213053107262,positive,news,"6,045 Shares in CSW Industrials, Inc. $CSW Purchased by Intech Investment Management LLC"
AAPL,2026-06-05,-0.9246590477414429,negative,news,Apple to shutter store this month in struggling California mall in latest blow
AAPL,2026-06-05,-0.9408414140343666,negative,news,Grey Ledge Advisors LLC Cuts Stock Holdings in Apple Inc. $AAPL
AAPL,2026-06-05,0.011943906545639038,neutral,news,"Galaxy Digital tokenized stock (xStock) price today, GLXYx to USD live price, marketcap and chart"
AAPL,2026-06-05,0.024228811264038086,positive,news,Intuit Stock Pulls Back to Support – Smart Entry?
AAPL,2026-06-05,0.9288777206093073,positive,news,Freemont Management S.A. Has $13.89 Million Holdings in Apple Inc. $AAPL
AAPL,2026-06-05,0.9362768661230803,positive,news,BNP Paribas Financial Markets Grows Position in Texas Pacific Land Corporation $TPL
AAPL,2026-06-05,0.930627016350627,positive,news,Apple Inc. $AAPL is Cardinal Point Capital Management ULC's 2nd Largest Position
AAPL,2026-06-05,0.9244699794799089,positive,news,"AI: TSMC, the 'Fed of the global chip economy', Speaks. AI-RTZ #1108"
AAPL,2026-06-05,0.898621360771358,positive,news,Is nLIGHT (LASR) Quietly Recasting Its Moat Around Defense‑Focused Directed Energy?
AAPL,2026-06-04,0.9134822683408856,positive,news,Nvidia's AI Infrastructure Deepens as Apple Moves Siri Workloads to Cloud GPUs
AAPL,2026-06-04,-0.9435831080190837,negative,news,Apple closing 3 stores in these 3 states in June. See locations
AAPL,2026-06-04,0.7427742779254913,positive,news,AMD takes a third of server CPU market as shipments grow
AAPL,2026-06-04,0.9322537137195468,positive,news,Think Dell's 245% Rally Was Wild? This ETF Turned It Into An 810% Moonshot
AAPL,2026-06-04,0.03106285911053419,neutral,news,"Scilex sets June 15, 2026, as payment date for Semnur Pharmaceuticals stock dividend to its shareholders."
AAPL,2026-06-04,0.9046531990170479,positive,news,"Banking On Breakouts: UBS, Citi Charts Shape Up"
AAPL,2026-06-04,-0.9536532890051603,negative,news,WealthTrust Asset Management LLC Lowers Stake in Apple Inc. $AAPL
AAPL,2026-06-04,0.8660697326995432,positive,news,"Kesler Norman & Wride LLC Invests $1.04 Million in VeriSign, Inc. $VRSN"
AAPL,2026-06-04,0.9220809061080217,positive,news,TSMC 2nm Mass Production Puts Valuation And AI Role In Focus
AAPL,2026-06-04,-0.8181877881288528,negative,news,Sierra Summit Advisors LLC Has $26.66 Million Stock Position in Apple Inc. $AAPL
AAPL,2026-06-04,-0.8022111654281616,negative,news,"Oxbow Advisors LLC Sells 1,643 Shares of Apple Inc. $AAPL"
AAPL,2026-06-04,-0.8595060929656029,negative,news,Apple Inc. $AAPL Stake Lowered by Nwam LLC
AAPL,2026-06-04,0.8976961243897676,positive,news,Income Insurance Ltd Makes New Investment in Apple Inc. $AAPL
AAPL,2026-06-04,0.8965780641883612,positive,news,"NWM Advisors LLC Purchases Shares of 19,040 Apple Inc. $AAPL"
AAPL,2026-06-04,0.937577748671174,positive,news,Did First Financial Bancorp's ESOP Shelf Registration and Elevated Dividend Just Shift FFBC's Investment Narrative?
AAPL,2026-06-04,0.13008288946002722,neutral,news,Nearly 36% of Berkshire Hathaway's Portfolio Is in These 2 Stocks. Are They Buys Right Now?
AAPL,2026-06-04,0.9375598262995481,positive,news,Ballast Rock Private Wealth LLC Takes $7.97 Million Position in Apple Inc. $AAPL
AAPL,2026-06-04,-0.8801049217581749,negative,news,Financial Alternatives Inc Trims Position in Apple Inc. $AAPL
AAPL,2026-06-04,-0.0013964027166366577,neutral,news,"Analysts Offer Insights on Technology Companies: Apple (AAPL), Aehr Test Systems (AEHR) and Shopify (SHOP)"
AAPL,2026-06-04,-0.19873829185962677,neutral,news,APPLE INC : UBS reiterates its Neutral rating
AAPL,2026-06-04,0.2661961615085602,positive,news,The iShares MSCI World ETF: A Record High Surrounded by a Thicket of Risks
AAPL,2026-06-04,-0.00603126548230648,neutral,news,SGI Enhanced Market Leaders ETF (LDRX) ETF Holders - Institutional Ownership
AAPL,2026-06-04,0.036498081870377064,neutral,news,"SGI Enhanced Market Leaders ETF (LDRX) Stock Price, Holdings, Dividend Yield"
AAPL,2026-06-04,0.028022510930895805,neutral,news,Arista Networks director Giancarlo sells $1.35m in company stock
AAPL,2026-06-04,-0.2653430476784706,neutral,news,Apple’s New Ad Is a Brutal Jab at Google Chrome and Its Privacy Policies
AAPL,2026-06-03,0.9093276858329773,positive,news,Assessing Aehr Test Systems (AEHR) Valuation After Powerful Share Price Momentum And Insider Selling
AAPL,2026-06-03,0.3237386355176568,neutral,news,"Intermedia Intelligent Communications, Kddi Corporation, and Nec Corporation Launch Cloud Calling for Univerge Blue"
AAPL,2026-06-03,0.5995847880840302,positive,news,Amazon Ends Walmart's 13‑Year Hold On The S&P 500 Revenue Crown — But There's A Catch
AAPL,2026-06-03,-0.928095493465662,negative,news,Is PayPal the Ultimate Asymmetric Fintech Bet at 8x Earnings?
AAPL,2026-06-03,-0.1873205229640007,neutral,news,CCIA Asks Supreme Court to Hear Apple v. Epic Case
AAPL,2026-06-03,-0.877334002405405,negative,news,Google's $80 Billion AI Raise Cost Alphabet The #2 Spot To Apple: What Do Prediction Markets Say?
AAPL,2026-06-03,0.9309342298656702,positive,news,Schwab's (NYSEARCA: FNDF) International ETF Delivers 46% Returns While Tackling Concentration Risk
AAPL,2026-06-03,0.8688790155574679,positive,news,Genasys and Intterra Enter into Strategic Partnership to Establish Authoritative Evacuation Information in AwareCA™
AAPL,2026-06-03,0.8196759545244277,positive,news,Apple announces first developer center in Europe ahead of WWDC (AAPL:NASDAQ)
AAPL,2026-06-03,0.2086525373160839,neutral,news,HDV vs. FDVV: One of These High-Dividend ETFs Has a Surprising Secret
AAPL,2026-06-03,-0.9354210263118148,negative,news,5 Reasons Why Customers Avoid Shopping At The Apple Store
AAPL,2026-06-03,0.711449146270752,positive,news,Apple Inc. $AAPL is Tranquility Partners LLC's 3rd Largest Position
AAPL,2026-06-03,0.9385159416124225,positive,news,Apple Reaps AI Benefits Without Capex Burden (Rating Upgrade) (NASDAQ:AAPL)
CRM,2026-06-05,0.878765276633203,positive,news,"AI is taking over IT work, ISG says half of firms will use agentic tools"
CRM,2026-06-05,-0.9637613892555237,negative,news,ServiceNow Stock Plunges 30% in 6 Months: Hold Tight or Book Profits?
CRM,2026-06-05,0.5852006860077381,positive,news,AGI bet: Genius Group (NYSE: GNS) targets $800M dual AI treasury
CRM,2026-06-05,-0.9578139511868358,negative,news,"Prudential PLC Reduces Stock Holdings in United Rentals, Inc. $URI"
CRM,2026-06-05,0.9238852374255657,positive,news,Harvest Fund Management Co. Ltd Grows Holdings in Salesforce Inc. $CRM
CRM,2026-06-05,0.7327172681689262,positive,news,"Prudential PLC Sells 13,578 Shares of Salesforce Inc. $CRM"
CRM,2026-06-05,0.8407091568224132,positive,news,"Salesforce to power FIFA World Cup 2026, 2027 tech | CRM Stock News STOCK TITAN"
CRM,2026-06-05,0.9234685339033604,positive,news,Cibc World Market Inc. Has $47.36 Million Stock Position in Salesforce Inc. $CRM
CRM,2026-06-05,0.9320183899253607,positive,news,"Cardinal Point Capital Management ULC Purchases 3,550 Shares of Amazon.com, Inc. $AMZN"
CRM,2026-06-05,0.9360557580366731,positive,news,Automatic Data Processing Stock Is Making Its Own Waves
CRM,2026-06-05,0.40868568420410156,positive,news,Datadog CRO Sean Walters sells $3.58m in stock
CRM,2026-06-04,0.15431242622435093,neutral,news,"Jim Cramer’s 15 Stock Calls, Including Salesforce and Cisco, and Possible Opportunities"
CRM,2026-06-04,0.8192766243591905,positive,news,"Timken's Q1 Adjusted Earnings, Net Sales Increase; 2026 Outlook Raised"
CRM,2026-06-04,0.907420746050775,positive,news,"Jim Cramer’s 15 Stock Calls, Including Salesforce and Cisco, and Possible Opportunities"
CRM,2026-06-04,0.9399447664618492,positive,news,Salesforce (NYSE: CRM) Agentforce Platform Crosses $1B ARR As AI Revenue Surge Reshapes Enterprise Software Race
CRM,2026-06-04,0.9246126338839531,positive,news,Can EmployeeWorks Become a Major Growth Driver for ServiceNow?
CRM,2026-06-04,0.2739542257040739,neutral,news,ISG to Study Amazon Connect Ecosystem Providers
CRM,2026-06-04,0.7519135372713208,positive,news,Tech Firm Veeva Relocates to 62K-SF Office at Vornado’s Penn 2
CRM,2026-06-04,0.9292231304571033,positive,news,WCG Wealth Advisors LLC Grows Stock Holdings in Salesforce Inc. $CRM
CRM,2026-06-04,0.9345421949401498,positive,news,Sound Shore Management Inc. CT Invests $100.28 Million in Salesforce Inc. $CRM
CRM,2026-06-04,0.9225980397313833,positive,news,Adobe Stock 2026 Outlook: Q2 Earnings on June 11 and a $25 Billion Buyback in Place
CRM,2026-06-04,0.8321051448583603,positive,news,Wells Fargo raises Veeva Systems stock price target on AI potential
CRM,2026-06-04,0.8216061061248183,positive,news,"Marble Wealth LLC Makes New $863,000 Investment in Salesforce Inc. $CRM"
CRM,2026-06-04,0.9388032630085945,positive,news,"Glassy Mountain Advisors Inc. Purchases 2,764 Shares of Salesforce Inc. $CRM"
CRM,2026-06-04,-0.9252134934067726,negative,news,"Anchor Capital Advisors LLC Sells 40,092 Shares of Salesforce Inc. $CRM"
CRM,2026-06-03,0.28668081760406494,positive,news,Assessing Five9 (FIVN) Valuation As Weak Billings And High Costs Raise Profitability Questions
CRM,2026-06-03,0.12878793105483055,neutral,news,News | CoStar World News for June 4
CRM,2026-06-03,0.011953480541706085,neutral,news,Q2 holdings CBO Kirk Coleman sells $1.03 million of company stock
CRM,2026-06-03,0.15218365844339132,neutral,news,Salesforce Appoints Veteran Auditor as Chief Accounting Officer
CRM,2026-06-03,0.4497162699699402,positive,news,Press Release: Virtus Stone Harbor Emerging Markets Income Fund Announces Distributions
CRM,2026-06-03,0.6588713265955448,positive,news,Salesforce Appoints Veteran Auditor as Chief Accounting Officer
CRM,2026-06-03,0.0575694777071476,neutral,news,Autonomous service still needs a human handoff
CRM,2026-06-03,-0.9617292787879705,negative,news,"PagerDuty, Braze, and Asana Stocks Trade Down, What You Need To Know"
CRM,2026-06-03,0.9153762105852365,positive,news,Will AI-Driven Cross-Selling Momentum Reshape EverCommerce's (EVCM) Higher-Value Multiproduct Narrative?
CRM,2026-06-03,0.924370814114809,positive,news,"Palo Alto CEO: ""The SaaS apocalypse is dead, at least in cybersecurity"""
CRM,2026-06-03,-0.9677274818532169,negative,news,Salesforce Inc Stock (CRM) Moved Down by 4.57% on Jun 3: Drivers Behind the Movement
CRM,2026-06-03,0.1650405041873455,neutral,news,How to choose a B2B e-commerce platform
CRM,2026-06-03,0.9376062387600541,positive,news,Salesforce's Agentforce ARR Tops $1B: Can It Fuel More Growth for CRM?
CRM,2026-06-03,0.9370068423449993,positive,news,Salesforce's Agentforce ARR Tops $1B: Can It Fuel More Growth for CRM?
CRM,2026-06-03,-0.07716289162635803,neutral,news,3 Common Sense Reasons to Sell Tesla Stock and Buy the SpaceX IPO
CRM,2026-06-03,-0.967487383633852,negative,news,"IBM, Salesforce Share Losses Lead Dow's 211-Point Drop"
CRM,2026-06-03,0.9295487906783819,positive,news,"Rational Advisors Inc. Purchases 4,703 Shares of Salesforce Inc. $CRM"
CRM,2026-06-03,0.9084470346570015,positive,news,CAMTEK RECEIVES OVER $105 MILLION MULTI-SYSTEM ORDERS FROM A TIER-1 OSAT AND A LEADING HBM MANUFACTURER
CRM,2026-06-03,-0.9606778007000685,negative,news,"Salesforce Inc (Derivatives) price today, CRM to USD live price, marketcap and chart"
CRM,2026-06-03,0.9210729897022247,positive,news,"M.D. Sass LLC Increases Position in Guidewire Software, Inc. $GWRE"
CRM,2026-06-03,-0.6770991757512093,negative,news,Palantir's $369 Billion Valuation Requires Unprecedented Federal Market Share (PLTR)
CRM,2026-06-03,0.9393909480422735,positive,news,Salesforce Inc. $CRM Stake Increased by Bank of New York Mellon Corp
CRM,2026-06-03,0.12386567331850529,neutral,news,fiduciary grade AI delivers trusted professional insights
CRM,2026-06-02,0.8485823981463909,positive,news,"Salesforce shareholders back board, governance and equity plans"
CRM,2026-06-02,0.0176165159791708,neutral,news,Salesforce appoints Guy Wanger as Chief Accounting Officer
AMAT,2026-06-05,0.9363758414983749,positive,news,Applied Materials (AMAT) Continues Its Bull Run as Analyst Sees More Upside
AMAT,2026-06-05,-0.032016534358263016,neutral,news,"Applied Materials Stock Up 12% in One Week, Wait For A Dip To Buy The Stock"
AMAT,2026-06-04,-0.4865548014640808,negative,news,May ETF Flows Reveal a Split Between Traders and Long-Term Investors on Semiconductors
AMAT,2026-06-04,0.8685612501576543,positive,news,Atomera Breakthrough Targets Broader RF Adoption of GaN-on-Silicon
AMAT,2026-06-04,0.9364293590188026,positive,news,Cohu Inc stock (US1924791031): AI-driven outlook lifts 2026 targets and keeps investors focused on semiconductor test demand
AMAT,2026-06-04,0.936261860653758,positive,news,What Do Analysts Say About Lam Research (LRCX)’s Earnings Outlook?
AMAT,2026-06-04,0.9391652941703796,positive,news,AXT's Order Backlog Surge & Capacity Push Fuel Growth Expectations
AMAT,2026-06-04,0.2416798174381256,positive,news,TSMC says AI demand affecting supply
AMAT,2026-06-04,0.8903229907155037,positive,news,Broadcom Earnings: Stock Decline Is an Overreaction to Conservative Guidance
AMAT,2026-06-04,-0.9673213148489594,negative,news,Applied Materials Inc Stock (AMAT) Opened Down by 3.81% on Jun 4: A Full Analysis
AMAT,2026-06-04,0.9142627604305744,positive,news,Mizuho Raises its Price Target on Lam Research (LRCX)
AMAT,2026-06-04,0.9335257578641176,positive,news,Mizuho Raises its Price Target on Lam Research (LRCX)
AMAT,2026-06-04,-0.8760603182017803,negative,news,"TD Asset Management Inc Sells 852,142 Shares of Lam Research Corporation $LRCX"
AMAT,2026-06-04,0.8533140267245471,positive,news,How Applied Materials Is Driving Transformation of the Finance Function with SAP Taulia
AMAT,2026-06-04,-0.9646581597626209,negative,news,"1492 Capital Management LLC Invests $7.53 Million in Applied Optoelectronics, Inc. $AAOI"
AMAT,2026-06-04,0.9123648013919592,positive,news,Assessing Applied Materials (AMAT) Valuation As AI Infrastructure Investment Fuels Multi Year Growth Hopes
AMAT,2026-06-04,0.9386919643729925,positive,news,AMAT: AI Packaging Expansion And WFE Supercycle Will Shape Future Returns
AMAT,2026-06-04,0.8313562124967575,positive,news,ASMPT completes US$120 million sale of ASMPT NEXX to Applied Materials
AMAT,2026-06-03,0.9362426241859794,positive,news,"Advanced Energy Industries Sees Semiconductor, Data Center Strength as Margins Climb"
AMAT,2026-06-03,0.9367021536454558,positive,news,"Applied Materials Eyes 25% Southeast Asia Hiring Growth, Mostly in Singapore, Advances Packaging Efforts"
AMAT,2026-06-03,-0.009112102910876274,neutral,news,[144] APPLIED MATERIALS INC /DE SEC Filing
AMAT,2026-06-03,0.9210680387914181,positive,news,AXTI's Capacity Expansion: Will It Cement AI Supply-Chain Leadership?
AMAT,2026-06-03,0.8552715382538736,positive,news,Navitas Collaborates with NVIDIA MGX™ Ecosystem to Accelerate 800 VDC AI Infrastructure
AMAT,2026-06-03,0.8703647693619132,positive,news,"Market Chatter: Applied Materials Looking to Hire 1,000 Workers in Southeast Asia in 2026"
AMAT,2026-06-03,0.9369139280170202,positive,news,CIBC Asset Management Inc Increases Stake in Lam Research Corporation $LRCX
AMAT,2026-06-03,0.869562529027462,positive,news,Why Lightwave Logic (LWLG) Is Up 6.3% After Nvidia’s Silicon Photonics Endorsement And Insider Updates
AMAT,2026-06-03,-0.9358406700193882,negative,news,Dow (DOW) Unveils Innovative Cooling Solutions at Computex Taipe
AMAT,2026-06-03,0.9359739292412996,positive,news,"SMCI and Applied Materials lead AI equipment surge at Computex, SOXX +5.79%"
AMAT,2026-06-03,0.7108721225522459,positive,news,Quantum startup Quobly raises €115m backed by STMicroelectronics
AMAT,2026-06-03,0.9217119244858623,positive,news,Applied Materials looks to hire 25% more chip talent in Southeast Asia
AMAT,2026-06-03,0.2498605139553547,neutral,news,Applied Materials Inc. stock outperforms competitors on strong trading day
AMAT,2026-06-02,0.9222013410180807,positive,news,MKS Instruments Inc stock (US55306N1046): insider selling and strong post-earnings momentum
AMAT,2026-06-02,0.9425204936414957,positive,news,Cohu (COHU) Is Up 17.1% After Raising 2026 AI Compute Outlook and Market Opportunity Estimate
AMAT,2026-06-02,-0.12665998935699463,neutral,news,"UBS AG (AMUB) offers autocallable GEARS linked to 29-stock basket, 22% call return"
AMAT,2026-06-02,-0.8908636197447777,negative,news,Applied Materials Inc (AMAT) Stock Up 7.0% but GF Value Says Overvalued -- GF Score: 85/100
AMAT,2026-06-02,0.05317121185362339,neutral,news,"UBS (AMUB) launches Autocallable Contingent-Yield Notes due June 5, 2028"
AMAT,2026-06-02,0.9119981890544295,positive,news,GlobalFoundries Completes Acquisition of Synopsys’ Processor IP Solutions Business
AMAT,2026-06-02,0.9386439844965935,positive,news,Applied Materials stock hits all-time high at 485.96 USD
AMAT,2026-06-02,0.9331596698611975,positive,news,"Applied Materials and Photronics Stocks Trade Up, What You Need To Know"
AMAT,2026-06-02,0.9365835152566433,positive,news,Applied Materials stock hits all-time high at 485.96 USD By Investing.com
AMAT,2026-06-02,0.9255185052752495,positive,news,"Applied Materials and Photronics Stocks Trade Up, What You Need To Know"
AMAT,2026-06-02,-0.01637730747461319,neutral,news,"Transcript : Applied Materials, Inc. Presents at Bank of America 2026 Global Technology Conference, Jun-02-2026 08"
AMAT,2026-06-02,0.9331788178533316,positive,news,Applied Materials Inc. stock outperforms competitors on strong trading day
AMAT,2026-06-02,0.8942717965692282,positive,news,Intel CEO says TSMC a ‘partner’ in chip production
AMAT,2026-06-02,0.928440872579813,positive,news,Lam Research stock hits all-time high at 333.44 USD
AMAT,2026-06-02,0.9233987089246511,positive,news,Ichor Holdings Jumps 6.4% Amid Sector-Wide Rally
AMAT,2026-06-02,0.9382805489003658,positive,news,Applied Materials Inc Stock (AMAT) Moved Up by 4.01% on Jun 2: Key Drivers Unveiled
AMAT,2026-06-02,0.9216883946210146,positive,news,TD Cowen Maintains Applied Materials(AMAT.US) With Buy Rating
AMAT,2026-06-02,0.877597130369395,positive,news,Applied Materials: The AI Stock That Wins No Matter Which Chip Wins
AMAT,2026-06-02,0.8932354962453246,positive,news,GlobalFoundries expands 'Physical AI' with Synopsys ARC unit
TGT,2026-06-05,0.22401227056980133,neutral,news,Target Corp. stock (US87612E1064): valuation metrics in focus after recent ownership filing
TGT,2026-06-05,-0.8656138777732849,negative,news,"J.W. Cole Advisors Inc. Sells 40,063 Shares of Walmart Inc. $WMT"
TGT,2026-06-05,0.6469380035996437,positive,news,Is Trending Stock Target Corporation (TGT) a Buy Now?
TGT,2026-06-05,-0.955854712985456,negative,news,"Bank of New York Mellon Corp Sells 521,837 Shares of Target Corporation $TGT"
TGT,2026-06-04,0.9337730817496777,positive,news,Costco Wholesale (NASDAQ:COST) Stock Price Up 1.1% - Should You Buy?
TGT,2026-06-04,0.060919743962585926,neutral,news,"Target buys land in new Iredell County retail development for $755,000"
TGT,2026-06-04,0.9278819356113672,positive,news,Target Corp. stock (US87612E1064): shares trade steady after 2026 guidance update
TGT,2026-06-04,0.9354921411722898,positive,news,Sivia Capital Partners LLC Boosts Stake in Walmart Inc. $WMT
TGT,2026-06-04,0.9316707784309983,positive,news,Costco Growth Drivers Test Rich Valuation As China And Digital Expand
TGT,2026-06-04,0.9387642070651054,positive,news,Walmart Inc. $WMT Position Boosted by Nvest Financial LLC
TGT,2026-06-04,0.05332265794277191,neutral,news,"Norges Bank Takes Position in BJ's Wholesale Club Holdings, Inc. $BJ"
TGT,2026-06-04,0.9403323158621788,positive,news,"Cibc World Market Inc. Purchases 128,070 Shares of The TJX Companies, Inc. $TJX"
TGT,2026-06-04,0.9360750820487738,positive,news,"Cibc World Market Inc. Acquires 281,454 Shares of Walmart Inc. $WMT"
TGT,2026-06-03,0.9315263424068689,positive,news,"Macy’s Inc. Posts Strong Q1, Cites Gains at All Retail Nameplates, Raises Outlook"
TGT,2026-06-03,-0.8947059214115143,negative,news,Target Corp. stock (US87612E1064): shares ease after solid Q1 update and dividend declaration
TGT,2026-06-03,0.940321896225214,positive,news,"Costco May sales hit $24B, digitally enabled comps up 21%"
TGT,2026-06-03,0.054478419944643974,neutral,news,Is Target coming for Prime Day? Circle Deal Days kicks off June 23
TGT,2026-06-03,0.9375373795628548,positive,news,"Is Costco Stock a Buy, Hold or Sell After Its Q3 Earnings Beat?"
TGT,2026-06-03,0.7648101896047592,positive,news,Is Target Stock Outperforming the Dow?
TGT,2026-06-03,0.9197659408673644,positive,news,"Is Costco Stock a Buy, Hold or Sell After Its Q3 Earnings Beat?"
TGT,2026-06-03,0.8851651605218649,positive,news,Target debuts $367M food distribution center in Colorado
TGT,2026-06-03,0.9343933137133718,positive,news,Walmart Inc. $WMT Position Boosted by Phillips Wealth Planners LLC
TGT,2026-06-03,-0.6221507415175438,negative,news,Analysts Offer Insights on Consumer Goods Companies: General Mills (GIS) and Dollar General (DG)
TGT,2026-06-03,0.18077571503818035,neutral,news,From Walmart Health to the C-suite: Dave Caspers takes over Ardent Health
TGT,2026-06-03,0.7947287410497665,positive,news,Ardent Health names Dave Caspers as new CEO
TGT,2026-06-03,0.936683002859354,positive,news,"CIBC Asset Management Inc Raises Stock Holdings in The TJX Companies, Inc. $TJX"
TGT,2026-06-03,-0.9063447415828705,negative,news,Walmart Inc. $WMT Shares Sold by Bank of New York Mellon Corp
TGT,2026-06-03,0.9380855355411768,positive,news,"BNP Paribas Buys 9,019 Shares of The TJX Companies, Inc. $TJX"
TGT,2026-06-02,0.5081992829218507,positive,news,"Motley Fool names Realty Income, Coca-Cola, Target as top dividend picks"
TGT,2026-06-02,0.17262056469917297,positive,news,How Low Can Home Depot Stock Go?
TGT,2026-06-02,0.7412746269255877,positive,news,"How grocery stores become health hubs at Kroger, Hy-Vee's 1,200-leader summit"
TGT,2026-06-02,0.8092361129820347,positive,news,Amazon's Prime Day Returns as Consumer Spending Faces a Test
TGT,2026-06-02,0.9132780153304338,positive,news,Wall Street Analysts Are Bullish on Top Healthcare Picks
TGT,2026-06-02,-0.8992509804666042,negative,news,"Thompson Siegel & Walmsley LLC Decreases Stake in The TJX Companies, Inc. $TJX"
TGT,2026-06-02,-0.7519654557108879,negative,news,"Natixis Advisors LLC Sells 14,205 Shares of The TJX Companies, Inc. $TJX"
TGT,2026-06-02,0.2148469900712371,neutral,news,Target’s June sale: up to 45% off plus free Starbucks treat
TGT,2026-06-02,0.875693392008543,positive,news,An AI overhaul at Macy’s is fueling the 168-year-old retailer’s turnaround
TGT,2026-06-02,-0.9139363188296556,negative,news,Kenvue Inc. $KVUE Shares Sold by Moors & Cabot Inc.
TGT,2026-06-02,0.09629315137863159,neutral,news,"Insider Sell Alert: Cara Sylvester Sells 10,000 Shares of Target Corp (TGT)"
TGT,2026-06-01,-0.3202716335654259,neutral,news,"Target (TGT) executive Cara Sylvester sells 10,000 shares in open market"
TGT,2026-06-01,0.8840914443135262,positive,news,Target Opens Its Largest Food Distribution Center In Denver Suburb
TGT,2026-06-01,0.9260952770709991,positive,news,Target Cuts Ribbon on Its Largest Food Distribution Center Yet
TGT,2026-06-01,0.7961059687659144,positive,news,Target supports food category with specialized distribution center
TGT,2026-06-01,0.9368333276361227,positive,news,"ADM, Darling Ingredients, UNFI Among Top Staples Stocks by EPS Revisions (XLP:NYSEARCA)"
TGT,2026-06-01,-0.9068067409098148,negative,news,Target Corp. stock outperforms competitors despite losses on the day
TGT,2026-06-01,0.9390054810792208,positive,news,Dollar General Q1 Preview: Will Higher Gas Prices Help Discount Retailer?
TGT,2026-06-01,-0.9502131612971425,negative,news,Frozen Cheese Bread Sold at Costco and Walmart Recalled for Potential Salmonella Contamination
TGT,2026-06-01,0.9363471865653992,positive,news,Dollar General Gears Up for Q1 Earnings: Key Elements to Watch
TGT,2026-06-01,0.9427167940884829,positive,news,Is Costco's 9.8% Comparable Sales Growth Stronger Than It Looks?
BLK,2026-06-05,0.8270528102293611,positive,news,BlackRock surpasses 5% ownership in Finnish pharma company Orion Oyj
BLK,2026-06-05,0.6489232014864683,positive,news,"Orion Corporation: Disclosure Under Chapter 9 Section 10 of the Securities Market Act (BlackRock, Inc.)"
BLK,2026-06-05,0.9391017397865653,positive,news,Assessing Invesco (IVZ) Valuation After A Recent Share Price Move And Strong 1-Year Return
BLK,2026-06-05,0.9348994232714176,positive,news,"Is EPS Surge, Record Assets and AI Efficiency Altering The Investment Case For Bank of New York Mellon (BNY)?"
BLK,2026-06-05,0.9319076389074326,positive,news,Vanguard’s VOO ETF Reaches Trillion-Dollar Milestone
BLK,2026-06-05,0.12635280471295118,neutral,news,Syensqo - Participation notification by BlackRock Inc.
BLK,2026-06-05,0.9177875677123666,positive,news,Vanguard’s VOO ETF Reaches Trillion-Dollar Milestone
BLK,2026-06-05,0.9294932764023542,positive,news,Morgan Stanley boosts Bitcoin holdings by over 220 BTC via MSBT ETF
BLK,2026-06-05,0.011643152683973312,neutral,news,"ETFs Investing in Nomura Real Estate Holdings, Inc. Stocks"
BLK,2026-06-04,-0.9482033988460898,negative,news,"ENNIS, INC. ($EBF) CEO 2026 Pay Revealed"
BLK,2026-06-04,0.838268413208425,positive,news,Working the Core: Where Bond ETF Flows Are Heading in 2026
BLK,2026-06-04,0.8916936628520489,positive,news,BMO Should See Some Balance Sheet Growth in US Segment in the Second Half of 2026
