ticker,date,sentiment_score,sentiment_label,content_type,title
AAPL,2026-05-27,0.932637644931674,positive,news,Simon Property Group stock hits 52-week high at 208.43 USD
AAPL,2026-05-27,-0.9677528622560203,negative,news,Qualcomm Inc Stock (QCOM) Moved Down by 7.03% on May 27: What Investors Need To Know
AAPL,2026-05-27,0.8122545666992664,positive,news,Cirrus Logic vs. Skyworks: Which Chip Stock is the Smarter Buy?
AAPL,2026-05-27,-0.149921715259552,negative,news,Apple Cinema is trying to appease the wrath of Apple's lawyers
AAPL,2026-05-27,0.5911412425339222,positive,news,"Analysts Offer Insights on Technology Companies: Apple (AAPL), Marvell (MRVL) and F5, Inc. (FFIV)"
AAPL,2026-05-27,-0.9048228301107883,negative,news,Verdence Capital Advisors LLC Lowers Position in Apple Inc. $AAPL
AAPL,2026-05-27,-0.9363556243479252,negative,news,McGinn Penninger Investment Management Inc. Trims Holdings in Intel Corporation $INTC
AAPL,2026-05-27,-0.5637779012322426,negative,news,Meta Platforms Inc Class A
AAPL,2026-05-27,0.8801485430449247,positive,news,Nvidia CEO brands Taiwan 'epicentre' of AI revolution
AAPL,2026-05-27,-0.953360253944993,negative,news,Taiwan chip stocks climb after Nvidia announces $150 billion spending plans
AAPL,2026-05-27,0.7565639680251479,positive,news,A Low-Cost Way to Own US Large-Cap Growth
AAPL,2026-05-27,-0.7303231190890074,negative,news,"Nichols & Pratt Advisers LLP MA Sells 10,308 Shares of Apple Inc. $AAPL"
AAPL,2026-05-27,-0.9544855691492558,negative,news,Matisse Capital Reduces Stake in Apple Inc. $AAPL
AAPL,2026-05-27,-0.9401628412306309,negative,news,"Beirne Wealth Consulting Services LLC Sells 6,254 Shares of Apple Inc. $AAPL"
AAPL,2026-05-27,0.2146686315536499,neutral,news,Years of Rewards: $47 Bil From Coca-Cola Stock
AAPL,2026-05-27,-0.9477253230288625,negative,news,Apple Inc. $AAPL Shares Sold by 1834 Investment Advisors Co.
AAPL,2026-05-27,-0.9280356261879206,negative,news,"'It's Time To Fire Google,' Urges Alphabet's Search Engine Rival As DuckDuckGo Blasts AI Overhaul: People"
AAPL,2026-05-27,-0.7621538210660219,negative,news,"Dow Jones Top Company Headlines at 1 AM ET: Apple, Google Warn Encryption Services at Risk With Canada Bill | SK ..."
AAPL,2026-05-27,0.28940150141716003,positive,news,"Mythos threat: Govt, tech firms test their softwares for vulnerabilities"
AAPL,2026-05-27,0.15884614549577236,neutral,news,TSMC’s Outsized Role In Taiwan Markets Faces Huawei Chipmaking Test
AAPL,2026-05-27,0.9263818617910147,positive,news,Apple Stock Hits New Record Highs as AI Doubts Begin to Fade
AAPL,2026-05-26,-0.7678132597357035,negative,news,"Apple, Google push for judicial oversight in Canada online safety bill"
AAPL,2026-05-26,0.1044085007160902,neutral,news,Roundhill AAPL WeeklyPay ETF announces weekly distribution of $0.2465
AAPL,2026-05-26,0.7442554347217083,positive,news,"Ferrari Unveils $640,000 Electric Luce On Luxury EV Future"
AAPL,2026-05-26,0.9381535239517689,positive,news,Strong Content & Advertising Aids Apple's Services: More Upside Ahead?
AAPL,2026-05-26,0.9327917378395796,positive,news,Apple Rose 14% in 30 Days. Here’s How Much the Stock Could Rise in 2026
AAPL,2026-05-26,0.9290963038802147,positive,news,Strong Content & Advertising Aids Apple's Services: More Upside Ahead?
AAPL,2026-05-26,0.8594804191961884,positive,news,Apple: Will Agentic AI Be The Next Driver Of Valuation?
AAPL,2026-05-26,0.6941098384559155,positive,news,XLK vs. IYW: State Street Tech ETF Tops iShares Fund in Cost
AAPL,2026-05-26,0.9096776265650988,positive,news,VONG vs. IWO: Vanguard Russell 1000 Growth ETF Has Outperformed iShares Rival
AAPL,2026-05-26,0.9324399661272764,positive,news,"Apple seen as key beneficiary of emerging agentic AI smartphone market, BofA says"
AAPL,2026-05-26,0.9363043457269669,positive,news,Jabil Circuit stock hits all-time high at 373.9 USD
AAPL,2026-05-26,0.874897675588727,positive,news,Should Fidelity Value Factor ETF (FVAL) Be on Your Investing Radar?
AAPL,2026-05-26,0.19099642522633076,neutral,news,Is American Century U.S. Quality Growth ETF (QGRO) a Strong ETF Right Now?
AAPL,2026-05-26,0.8979585375636816,positive,news,Is NYLI U.S. Large Cap R&D Leaders ETF (LRND) a Strong ETF Right Now?
AAPL,2026-05-26,0.04637845605611801,neutral,news,Worthington Steel plans $900 million note offering for acquisition By Investing.com
AAPL,2026-05-26,0.8377671837806702,positive,news,"Royce & Associates LP Has $79.20 Million Stock Holdings in Cirrus Logic, Inc. $CRUS"
AAPL,2026-05-26,0.9073348492383957,positive,news,"Amkor Technology to expand Peoria semiconductor campus, bring 3,000 new jobs"
AAPL,2026-05-26,-0.7980274334549904,negative,news,19 Basis Points Stand Between iShares MSCI World ETF’s Gold Rating and Market Leadership
AAPL,2026-05-26,0.8077505007386208,positive,news,Why Is Innovator International Developed Managed Floor ETF (IFLR) Stock Down Today?
AAPL,2026-05-26,0.9272730648517609,positive,news,Should Invesco QQQ (QQQ) Be on Your Investing Radar?
AAPL,2026-05-26,-0.9654820039868355,negative,news,Ferrari shares slide after debut of Luce electric supercar (RACE)
AAPL,2026-05-26,0.9137705210596323,positive,news,The Walt Disney Company $DIS Shares Acquired by LSV Asset Management
AAPL,2026-05-26,0.9373213052749634,positive,news,Facet Wealth Inc. Boosts Holdings in Apple Inc. $AAPL
AAPL,2026-05-26,-0.9461188763380051,negative,news,Apple Inc. $AAPL Shares Sold by BKM Wealth Management LLC
AAPL,2026-05-26,0.9208982456475496,positive,news,Dumont & Blake Investment Advisors LLC Has $19.48 Million Position in Apple Inc. $AAPL
AAPL,2026-05-26,-0.44273726642131805,negative,news,SpaceX’s $1.75 Trillion Shadow Looms Over Gold-Rated iShares MSCI World ETF
AAPL,2026-05-26,0.8209245800971985,positive,news,Elevated Financial Group LLC Takes Position in Apple Inc. $AAPL
AAPL,2026-05-26,0.9320018216967583,positive,news,"Abacus FCF Advisors LLC Buys 54,156 Shares of Apple Inc. $AAPL"
AAPL,2026-05-26,0.9094128757715225,positive,news,Is Life360’s Record Q1 And US$225m Buyback Altering The Investment Case For Life360 (ASX:360)?
CSCO,2026-05-27,0.791321711614728,positive,news,Cisco report finds no closed frontier AI model is safe from multi-turn attacks
CSCO,2026-05-27,0.9370382400229573,positive,news,"Knights of Columbus Asset Advisors LLC Has $21.41 Million Holdings in Cisco Systems, Inc. $CSCO"
CSCO,2026-05-27,-0.8093078657984734,negative,news,"Cisco Systems, Inc. $CSCO Shares Sold by King Luther Capital Management Corp"
CSCO,2026-05-27,0.9304127404466271,positive,news,"M3 Wealth Management LLC Takes Position in Cisco Systems, Inc. $CSCO"
CSCO,2026-05-27,0.9364848816767335,positive,news,"Integrity Alliance LLC. Acquires 23,810 Shares of Cisco Systems, Inc. $CSCO"
CSCO,2026-05-27,0.40513893961906433,positive,news,"Flputnam Investment Management Co. Sells 11,733 Shares of Cisco Systems, Inc. $CSCO"
CSCO,2026-05-27,-0.9381701536476612,negative,news,Flputnam Investment Management Co. Reduces Holdings in International Business Machines Corporation $IBM
CSCO,2026-05-27,0.9419546015560627,positive,news,"Citi Raises TP on Cisco Systems, Inc. (CSCO.US) to USD135 and Ciena Corporation (CIEN.US) to USD660; Optical Networking Growth Resilient"
CSCO,2026-05-27,0.9350218698382378,positive,news,"Citi Raises TP on Cisco Systems, Inc. (CSCO.US) to USD135 and Ciena Corporation (CIEN.US) to USD660; Optical Networking Growth Resilient"
CSCO,2026-05-27,0.9395186910405755,positive,news,"Citi Raises TP on Cisco Systems, Inc. (CSCO.US) to USD135 and Ciena Corporation (CIEN.US) to USD660; Optical Networking Growth Resilient"
CSCO,2026-05-27,0.9073780262842774,positive,news,Should Calix’s AI-Native Workflows and Wi‑Fi 7 Push Require Action From Calix (CALX) Investors?
CSCO,2026-05-26,0.9384601823985577,positive,news,AI Buildout Fuels Record Results for These Companies
CSCO,2026-05-26,-0.035042308270931244,neutral,news,"[144] CISCO SYSTEMS, INC. SEC Filing"
CSCO,2026-05-26,-0.015059908851981163,neutral,news,"Cisco (NASDAQ: CSCO) SVP Nichlas Fink reports 29,804-share ownership stake"
CSCO,2026-05-26,-0.07473835721611977,neutral,news,Barclays (DJP) sells autocallable LIRNs with $12.56 call and 200% participation
CSCO,2026-05-26,0.48421449586749077,positive,news,Healthcare embraces AI while facing an identity security gap: report
CSCO,2026-05-26,0.9325966760516167,positive,news,Bank of America Increases Cisco Systems (NASDAQ:CSCO) Price Target to $135.00
CSCO,2026-05-26,0.9353663772344589,positive,news,"Ciena, Cisco get price target hikes at BofA as optical networking growth stays strong (CIEN:NYSE)"
CSCO,2026-05-26,0.8579735793173313,positive,news,"Cisco Systems, Inc. stock (US17275R1023): analyst moves and software shift keep the network giant in focus"
CSCO,2026-05-26,0.8879316728562117,positive,news,NetApp Stock Surges Ahead Of Earnings As Data Storage Rival Everpure Chases Breakout
CSCO,2026-05-26,0.8623493313789368,positive,news,Orla Mining and BitFuFu have been highlighted as Zacks Bull and Bear of the Day
CSCO,2026-05-26,0.93820471316576,positive,news,How Strong Q3 Results And Upbeat Outlook At Fabrinet (FN) Has Changed Its Investment Story
CSCO,2026-05-26,0.7457302659749985,positive,news,BofA Adjusts Price Target on Cisco Systems to $135 From $114
CSCO,2026-05-26,-0.9318895787000656,negative,news,"Kestra Investment Management LLC Cuts Stake in Cisco Systems, Inc. $CSCO"
CSCO,2026-05-26,0.8905233908444643,positive,news,"Cisco Systems, Inc. Stock 12‑Month Price Target Raised to $129.2, Implies 7% Upside"
CSCO,2026-05-26,-0.5448961704969406,negative,news,International Business Machines Corporation $IBM Stake Reduced by Global Assets Advisory LLC
CSCO,2026-05-26,0.9392079086974263,positive,news,Seaview Investment Managers LLC Takes $7.80 Million Position in International Business Machines Corporation $IBM
CSCO,2026-05-26,0.9197078179568052,positive,news,Is Harmonic (HLIT) Quietly Redefining Its Competitive Moat With Brownfield Fiber-Grade Deployments?
CSCO,2026-05-26,0.8175866045057774,positive,news,"Palo Alto Networks lands former Fortinet executive Rajeev K Abichandani as director, channels for India & SAARC"
CSCO,2026-05-26,0.9344062730669975,positive,news,"Bleakley Financial Group LLC Grows Stock Holdings in Cisco Systems, Inc. $CSCO"
CSCO,2026-05-26,0.48725493997335434,positive,news,"Allstate Corp Has $23.17 Million Stock Holdings in Cisco Systems, Inc. $CSCO"
CSCO,2026-05-25,0.9353837445378304,positive,news,Rosenblatt Raises its Price Target on Cisco Systems (CSCO)
CSCO,2026-05-25,0.938133355230093,positive,news,Rosenblatt Raises its Price Target on Cisco Systems (CSCO)
CSCO,2026-05-25,0.9166393028572202,positive,news,Intel Foundry’s Rio Rancho Facility To Become Its Crown Jewel In Production of Next-Gen Glass Substrates
CSCO,2026-05-25,0.9386402945965528,positive,news,"Cisco Systems, Inc. $CSCO Position Increased by Todd Asset Management LLC"
CSCO,2026-05-25,0.14612966030836105,neutral,news,Should iShares MSCI USA Min Vol Factor ETF (USMV) Be on Your Investing Radar?
CSCO,2026-05-25,0.5560551583766937,positive,news,"Glenview Trust Co Has $32.42 Million Stock Position in Cisco Systems, Inc. $CSCO"
CSCO,2026-05-25,0.9292851611971855,positive,news,"Genus Capital Management Inc. Has $19.05 Million Stake in Cisco Systems, Inc. $CSCO"
CSCO,2026-05-25,0.709582507610321,positive,news,"Cisco Systems, Inc. stock (US17275R1023): strong AI momentum meets fresh job cuts"
CSCO,2026-05-24,0.9376959782093763,positive,news,"Arista Networks (ANET) Is Up 8.5% After AI-Focused Beat, Guidance Hike And Gartner Leadership Gains"
CSCO,2026-05-24,0.9459956036880612,positive,news,F5 (FFIV) Is Up 8.6% After Deepening Red Hat AI Security Integration Has The Bull Case Changed?
CSCO,2026-05-24,0.9378350609913468,positive,news,Okta’s Forrester Leader Rating Tests Identity Story And Stock Momentum
CSCO,2026-05-24,0.049205780029296875,positive,news,"OLD Republic International Corp Decreases Stake in Cisco Systems, Inc. $CSCO"
CSCO,2026-05-24,-0.1406797468662262,negative,news,"Catalyst Funds Management Pty Ltd Has $932,000 Stake in Cisco Systems, Inc. $CSCO"
CSCO,2026-05-24,-0.9408781826496124,negative,news,"Palo Networks CEO Nikesh Arora: It is mistake to believe that AI productivity gains automatically means fewer employees, in fact for engineers ..."
CSCO,2026-05-23,0.8811906529590487,positive,news,NOK - Nokia Corp ADR Stock Price and Quote
CSCO,2026-05-23,0.9272596165537834,positive,news,"11,313 Shares in Cisco Systems, Inc. $CSCO Bought by Karras Company Inc."
CSCO,2026-05-23,-0.9611659394577146,negative,news,"Cumberland Partners Ltd Lowers Stock Holdings in Cisco Systems, Inc. $CSCO"
CSCO,2026-05-23,0.9095403999090195,positive,news,Arista’s Gartner Win Extends Story Beyond AI Data Centers Into Campuses
CSCO,2026-05-23,0.932892139069736,positive,news,"Americana Partners LLC Acquires 17,293 Shares of Cisco Systems, Inc. $CSCO"
QCOM,2026-05-27,-0.9649863019585609,negative,news,"Qualcomm, Wolfspeed lead chip decliners as sector slips ahead of Marvell's results (QCOM:NASDAQ)"
QCOM,2026-05-27,0.3960889736190438,neutral,news,Inside Broadcom’s bet on a 2nm chip for future AI agents
QCOM,2026-05-27,0.22225353121757507,neutral,news,How Will Viasat Stock React To Its Upcoming Earnings?
QCOM,2026-05-27,0.923175391741097,positive,news,Ghe LLC Has $4.09 Million Stock Holdings in Qualcomm Incorporated $QCOM
QCOM,2026-05-27,0.9239920303225517,positive,news,Bleakley Financial Group LLC Grows Position in Qualcomm Incorporated $QCOM
QCOM,2026-05-27,0.8939603418111801,positive,news,What's Fueling Cirrus Logic's Recent Stock Surge
QCOM,2026-05-27,0.9331852328032255,positive,news,Micron and SK Hynix surpass $1 trillion valuation milestone on surging AI memory demand
QCOM,2026-05-26,0.9321530479937792,positive,news,Qualcomm Inc (QCOM) Shares Surge 4.5% -- What GF Score of 79 Tells Investors
QCOM,2026-05-26,0.8724694456905127,positive,news,Applied Materials Partners with SCREEN To Bring Advanced Wafer Cleaning Technologies to EPIC Center
QCOM,2026-05-26,0.1693578064441681,positive,news,BlackBerry Just Hit a New 52-Week High. Here's Why
QCOM,2026-05-26,0.9232967160642147,positive,news,Qualcomm Inc. stock outperforms competitors on strong trading day
QCOM,2026-05-26,-0.026420412585139275,neutral,news,UDR Inc | 8-K: Current report
QCOM,2026-05-26,0.8671359694562852,positive,news,"Computex to feature keynote speeches by Qualcomm, Intel, Marvell, NXP CEOs"
QCOM,2026-05-26,0.9168584421277046,positive,news,Trending Industry Today: Qualcomm Leads Gains In CPU Concept Stocks
QCOM,2026-05-26,0.9085295116528869,positive,news,Qualcomm Strikes AI Chip Deal With TikTok Owner ByteDance
QCOM,2026-05-26,0.9367502983659506,positive,news,Qualcomm Inc Stock (QCOM) Moved Up by 5.74% on May 26: A Full Analysis
QCOM,2026-05-26,0.9337736275047064,positive,news,Qualcomm stock hits all-time high at $247.91
QCOM,2026-05-26,0.929772038012743,positive,news,Anterix Inc stock hits 52-week high at 64.61 USD
QCOM,2026-05-26,-0.4866054058074951,negative,news,What Are Wall Street Analysts' Target Price for Cintas Corporation Stock?
QCOM,2026-05-26,0.16460439888760448,neutral,news,Terra Quantum to Go Public in $3.5 Billion SPAC Deal With Axiom Intelligence
QCOM,2026-05-26,0.09643512964248657,neutral,news,QUALCOMM Incorporated (QCOM) Is a Trending Stock: Facts to Know Before Betting on It
QCOM,2026-05-26,0.4641686398535967,neutral,news,Magnachip to Showcase MV MOSFET Portfolio for AI Servers and Data Centers Alongside Its Broader Power Semiconductor Portfolio at PCIM Europe 2026
QCOM,2026-05-26,-0.937998354434967,negative,news,"Fisher Asset Management LLC Sells 54,160 Shares of Qualcomm Incorporated $QCOM"
QCOM,2026-05-26,-0.06632426381111145,negative,news,"Hantz Financial Services Inc. Sells 2,304 Shares of Qualcomm Incorporated $QCOM"
QCOM,2026-05-26,0.25708163995295763,neutral,news,"Computex to feature keynote speeches by Qualcomm, Intel, Marvell, NXP CEOs"
QCOM,2026-05-26,-0.06973692774772644,negative,news,Prospera Financial Services Inc Has $3.51 Million Stock Holdings in Qualcomm Incorporated $QCOM
QCOM,2026-05-26,0.9237722773104906,positive,news,"Cary Street Partners Financial LLC Buys 7,893 Shares of Qualcomm Incorporated $QCOM"
QCOM,2026-05-26,0.7004235545173287,positive,news,InterDigital to Spotlight Sensing Expertise and Innovation at IEEE ICC’26
QCOM,2026-05-26,0.9218293204903603,positive,news,Atlatl Advisers LLC Has $3.02 Million Position in Lam Research Corporation $LRCX
QCOM,2026-05-26,0.9353528451174498,positive,news,Allstate Corp Grows Stock Holdings in Qualcomm Incorporated $QCOM
QCOM,2026-05-26,0.03220479562878609,neutral,news,Qualcomm Cofounder's Granddaughter Sells Up to $2 Million in QCOM Stock Near Record High
QCOM,2026-05-26,-0.9604007583111525,negative,news,"TSMC employees angered by layoff, bonus cut rumors despite record profits"
QCOM,2026-05-25,0.929525513201952,positive,news,Can Qualcomm's Expanded Stellantis Tie-Up Boost Its Shares?
QCOM,2026-05-25,-0.964338461868465,negative,news,"As Zscaler Doubles Down on AI Security, ZS Stock Still Needs More to Justify Its Steep Valuation"
QCOM,2026-05-25,-0.9283023420721292,negative,news,"Arm Holdings plc (ARM) to Face US Antitrust Probe over Chip Tech, Bloomberg News Reports"
QCOM,2026-05-25,0.9166695484891534,positive,news,"QUALCOMM Incorporated stock (US7475251036): AI boom, analyst caution and new strategy phase"
QCOM,2026-05-25,0.9360059052705765,positive,news,Genus Capital Management Inc. Increases Stock Position in Qualcomm Incorporated $QCOM
QCOM,2026-05-25,0.8929342087358236,positive,news,Huawei plans new smartphone chips this fall as rivalry with Nvidia and Apple heats up
QCOM,2026-05-25,0.053160227835178375,neutral,news,Regulating the AI Revolution: What Investors Need to Know
QCOM,2026-05-24,0.8792519052512944,positive,news,Qualcomm Stock Is the Sleeping Giant of the AI Revolution. It’s Starting to Wake Up.
QCOM,2026-05-24,0.16884584724903107,neutral,news,"Connected Car News: Hyundai, Mazda, Stellantis, Applied Intuition, Qualcomm, MathWorks, Renesas, Silicon Motion, Diodes Inc., Veoneer, AEye, MN8 Energy, Solera | auto connected car news"
QCOM,2026-05-24,0.011155035346746445,neutral,news,"Autonomous & Self-Driving Vehicle News: Waymo, Alphabet, May Mobility, Toyota, NTT, Lyft, Uber, Nuro, CPUC, Lucid,, Hyundai, Qualcomm, WeRide, Stellantis, Wayve, Hesai Group & Mercedes | auto connected car news"
QCOM,2026-05-24,0.41121140122413635,positive,news,Arm Holdings PLC (NASDAQ: ARM) Extends Weekly Rally to Nearly 50% on AI Chip Architecture Dominance
QCOM,2026-05-24,0.7855961350724101,positive,news,"DRAM, MAGS ETF Issuer Eyes AI Photonics Opportunity With New Optical Stocks Fund"
QCOM,2026-05-24,0.9159935116767883,positive,news,Skyworks Solutions delivers 68% return after Fair Value signal
QCOM,2026-05-24,0.9114811709150672,positive,news,Stellantis: Expanded Qualcomm Partnership To Power Next-Generation Vehicles With Snapdragon Digital Chassis
QCOM,2026-05-24,0.4852306693792343,positive,news,Qualcomm Incorporated $QCOM Shares Sold by Smead Capital Management Inc.
QCOM,2026-05-24,0.9296933952718973,positive,news,"Pathfinder Wealth Consulting Inc. Takes $623,000 Position in Qualcomm Incorporated $QCOM"
AMZN,2026-05-27,-0.9100382141768932,negative,news,"$800B AI Binge Led By AMZN, MSFT Feeds Wall Street’s Worst Nightmare - Amazon.com (NASDAQ:AMZN), BlackRoc"
AMZN,2026-05-27,0.9370414782315493,positive,news,Union Pacific stock hits 52-week high at 276.44 USD
AMZN,2026-05-27,-0.2166447937488556,negative,news,Costco Fell 8% This Week. Here’s How Much the Stock Could Rise in 2026
AMZN,2026-05-27,0.7251347387209535,positive,news,"Amazon licenses AI shopping technology to retailers, signs Kate Spade parent Tapestry as early adopter"
AMZN,2026-05-27,0.7593276314437389,positive,news,Hantavirus Ship Shines Light on Problem SNES Tackles – Initiating Coverage
AMZN,2026-05-27,0.7041729837656021,positive,news,A Look At Vipshop Holdings (VIPS) Valuation After Profit Beat And Earnings Forecast Upgrades
AMZN,2026-05-27,0.8212351379916072,positive,news,UBS joins Korean AI startup Upstage IPO banks to attract foreign investors
AMZN,2026-05-27,-0.5485358089208603,negative,news,Fed Fighting FOMO
AMZN,2026-05-27,0.9241082025691867,positive,news,Wolfe Names Amazon (AMZN) a Top Internet Sector Pick
AMZN,2026-05-27,0.9043150097131729,positive,news,"Jefferies Financial Group Inc. Purchases Shares of 72,900 IonQ, Inc. $IONQ"
AMZN,2026-05-27,-0.9036603681743145,negative,news,"TCI Wealth Advisors Inc. Sells 3,656 Shares of Amazon.com, Inc. $AMZN"
AMZN,2026-05-27,-0.938927548006177,negative,news,"Amazon.com, Inc. $AMZN Shares Sold by Triasima Portfolio Management inc."
AMZN,2026-05-27,0.5234425142407417,positive,news,"Truist Financial Corp Acquires 21,407 Shares of Amazon.com, Inc. $AMZN"
AMZN,2026-05-27,0.15053540095686913,neutral,news,"Sun Financial Inc Makes New $2.30 Million Investment in Amazon.com, Inc. $AMZN"
AMZN,2026-05-27,0.9375365283340216,positive,news,"Headinvest LLC Increases Stake in Amazon.com, Inc. $AMZN"
AMZN,2026-05-27,0.9326253980398178,positive,news,"Avidian Wealth Enterprises LLC Has $19.32 Million Position in Amazon.com, Inc. $AMZN"
AMZN,2026-05-27,-0.9224367924034595,negative,news,"B.O.S.S. Retirement Advisors LLC Decreases Stock Holdings in Amazon.com, Inc. $AMZN"
AMZN,2026-05-27,-0.39096301794052124,negative,news,"Amazon.com, Inc. $AMZN is Elite Wealth Management Inc.'s 4th Largest Position"
AMZN,2026-05-27,-0.9494454571977258,negative,news,A Look At JD.com (NasdaqGS:JD) Valuation After Recent Share Price Swings
AMZN,2026-05-27,0.9349805815145373,positive,news,United Microelectronics (UMC) Hits All-Time High on Expansion Initiatives
AMZN,2026-05-27,0.12378520984202623,neutral,news,Proximic by Comscore's 2026 football guide targets 4.5B hours of NFL viewing
AMZN,2026-05-27,0.08342596143484116,neutral,news,Alphabet Inc. Class C Trade Ideas — BOATS:GOOG
AMZN,2026-05-26,0.8856802843511105,positive,news,EQIX: Hyperscale Cloud Clusters and AI Liquid Cooling Mandates Fuel Intrinsic Expansion Toward Bullish Valuation Frameworks
AMZN,2026-05-26,0.9217071989551187,positive,news,Did Synchrony’s Massive Buyback and Dividend Hike Just Recast Synchrony Financial's (SYF) Investment Narrative?
AMZN,2026-05-26,0.8835604134947062,positive,news,Uber’s $11.6 Billion Bid for DoorDash Rival Is About Future Proofing It From Robots
AMZN,2026-05-26,0.8538739085197449,positive,news,Texas company to build data center near Alexandria that will employ 200
AMZN,2026-05-26,0.9153475612401962,positive,news,"Autodesk expected to deliver first quarter earnings beat, in-line outlook"
AMZN,2026-05-26,0.9285897659137845,positive,news,Billionaire Stanley Druckenmiller Just Sold 2 Key AI Stocks. He Bought Broadcom Instead.
AMZN,2026-05-26,-0.2519738972187042,negative,news,What Is Going On With IonQ Stock On Tuesday?
AMZN,2026-05-26,0.3451763838529587,neutral,news,Realty Income scoops up Chicagoland industrial center for $124 million
AMZN,2026-05-26,0.8733014026656747,positive,news,"Safe Pro Group (NASDAQ: SPAI) Surpasses 50,000 AI-Powered Landmine and UXO Detections in Ukraine"
AMZN,2026-05-26,0.06975819356739521,neutral,news,"J.B. Hunt EVP Spencer Frazier sells $516,405 in company stock"
AMZN,2026-05-26,0.6655503734946251,positive,news,"Google, Kaiser Permanente, Urban Outfitters Leaders Join GS1"
AMZN,2026-05-26,-0.8853726089000702,negative,news,Is eBay Stock A Compounding Engine?
AMZN,2026-05-26,-0.9275945592671633,negative,news,Berkshire Hathaway Exited UnitedHealth. Here’s What That Means for UNH at $388
AMZN,2026-05-26,0.8746655136346817,positive,news,SCHD ETF is beating S&P 500 and Nasdaq 100: does it have more upside?
AMZN,2026-05-26,0.862660413607955,positive,news,Nvidia challenges Intel and AMD in the CPU market
AMZN,2026-05-26,0.8729890957474709,positive,news,JB Hunt Transport Services stock hits all-time high at $265.34
AMZN,2026-05-26,0.9165863394737244,positive,news,JB Hunt Transport Services stock hits all-time high at $265.34 By Investing.com
AMZN,2026-05-26,0.9285288490355015,positive,news,Nvidia challenges Intel and AMD in the CPU market
AMZN,2026-05-26,0.7834663419052958,positive,news,"Safe Pro Celebrates 50,000th AI-Powered Landmine Detection Milestone Pioneering Modernized Force Protection and Humanitarian Innovation"
AMZN,2026-05-26,0.9151613637804985,positive,news,American Airlines stock jumps as the airline picks Starlink for in-flight Wi-Fi service
AMZN,2026-05-26,0.5566387502476573,positive,news,"Safe Pro Celebrates 50,000th AI-Powered Landmine Detection"
AMZN,2026-05-26,0.4824370453134179,neutral,news,EagleNXT VISION System Achieves Milestone with Listing on U.S. Army Online Marketplace
AMZN,2026-05-26,0.6422123955562711,positive,news,"BGIN Blockchain Launches ASIC Customization Unit and Delivers First 3,000 Mining Rigs"
AMZN,2026-05-26,0.11838672123849392,neutral,news,"As Amazon And Others Turn To AI Hiring Tools, PepsiCo Doubles Down On 'Hustle' And Curiosity"
AMZN,2026-05-26,-0.4377630613744259,negative,news,"Arete Adjusts Price Target on eBay to $111 From $113, Maintains Neutral Rating"
JPM,2026-05-27,-0.7644797191023827,negative,news,McKesson Stock Is Down 24% From Its 52-Week High: Analysts See 46% Upside to $1101 Target
JPM,2026-05-27,-0.07970607466995716,neutral,news,TD Bank (NYSE: TD) offers 5-year autocallable barrier notes at ~7.40%
JPM,2026-05-27,0.0029066726565361023,neutral,news,"Transcript : NXP Semiconductors N.V. Presents at TD Cowen's 54th Annual Technology, Media & Telecom Conference, May-27-2026 09"
JPM,2026-05-27,0.9302443228662014,positive,news,JPMorgan Lifts Cost Guidance With Traders Eying Another Big Haul
JPM,2026-05-27,-0.6776914931833744,negative,news,Mastercard Incorporated Class A Trade Ideas — HAN:M4I
JPM,2026-05-27,0.006855197250843048,neutral,news,"JPMorgan (JPM) offers $501K auto-callable indexed notes, 8.10% coupon"
JPM,2026-05-27,-0.043719397857785225,neutral,news,[424B2] JPMORGAN CHASE & CO Prospectus Supplement
