ticker,date,sentiment_score,sentiment_label,content_type,title
AAPL,2026-06-25,-0.9678587219677866,negative,news,Apple Inc Stock (AAPL) Moved Down by 4.79% on Jun 25: Drivers Behind the Movement
AAPL,2026-06-25,0.9393234625458717,positive,news,Snap-On stock hits all-time high at $400.99 By Investing.com
AAPL,2026-06-25,-0.9611222678795457,negative,news,MarketAxess stock hits 52-week low at $112.5
AAPL,2026-06-25,0.928148677572608,positive,news,Home Depot Stock Capital Return Hits $68 Bil
AAPL,2026-06-25,0.9338259696960449,positive,news,Alliant Energy stock hits all-time high at 75.86 USD By Investing.com
AAPL,2026-06-25,-0.8813381679356098,negative,news,"Apple Hikes MacBook, iPad Prices As Tim Cook Blames AI For Driving Up Memory Costs — ‘This Is A Hundred-Year Flood’"
AAPL,2026-06-25,0.8550928309559822,positive,news,Apple Raises Mac And iPad Prices To Counter Memory Shortages
AAPL,2026-06-25,-0.5470628440380096,negative,news,"Apple raises Mac and iPad prices due to chip shortage, shares plunge 5%"
AAPL,2026-06-25,-0.014761954545974731,neutral,news,Form 13D/A Navigator Holdings Ltd. For: 25 June By Investing.com
AAPL,2026-06-25,0.17744395043700933,neutral,news,SCHD vs. VIG: Which Dividend ETF Is Better?
AAPL,2026-06-25,-0.728958485648036,negative,news,App Store Antitrust: Supreme Court Weighs Apple Bid to Kill Contempt Finding
AAPL,2026-06-25,-0.9184765834361315,negative,news,Should You Invest in the Invesco NASDAQ Internet ETF (PNQI)?
AAPL,2026-06-25,0.9112866073846817,positive,news,"VeriSign, Inc. $VRSN Shares Purchased by Assenagon Asset Management S.A."
AAPL,2026-06-25,-0.02682342939078808,neutral,news,Form 4 Sunstone Hotel Investors Inc For: 24 June By Investing.com
AAPL,2026-06-25,0.9157815268263221,positive,news,BetMGM and MGM Resorts International Extend Partnership With MLB
AAPL,2026-06-25,-0.037930889055132866,neutral,news,Form 4 CoStar Group Inc For: 24 June By Investing.com
AAPL,2026-06-25,-0.08343653194606304,neutral,news,Form 4 Patrick Industries Inc For: 24 June By Investing.com
AAPL,2026-06-25,-0.05550301820039749,neutral,news,Form 4 Reservoir Media Inc For: 24 June By Investing.com
AAPL,2026-06-24,-0.10808633826673031,neutral,news,Form 4 Ingevity Corp For: 24 June By Investing.com
AAPL,2026-06-24,-0.08188439719378948,neutral,news,Form 4 Hershey Co For: 24 June By Investing.com
AAPL,2026-06-24,-0.04766981489956379,neutral,news,Form 4 Verastem Inc For: 24 June By Investing.com
AAPL,2026-06-24,-0.09084325097501278,neutral,news,Form 4 DLH Holdings Corp For: 24 June By Investing.com
AAPL,2026-06-24,-0.0168471559882164,neutral,news,Form 4 Freedom Holding Corp For: 24 June By Investing.com
AAPL,2026-06-24,-0.08363495580852032,neutral,news,Form 4 Candel Therapeutics Inc For: 24 June By Investing.com
AAPL,2026-06-24,0.8431975524872541,positive,news,VICI Properties acquires Canadian casino assets for $144.4m By Investing.com
AAPL,2026-06-24,0.12835005298256874,neutral,news,Form 8K Burke Herbert Financial Services Corp For: 23 June By Investing.com
AAPL,2026-06-24,-0.14011907763779163,neutral,news,Form 4 Timberland Bancorp Inc For: 24 June By Investing.com
AAPL,2026-06-24,-0.03761284798383713,neutral,news,Form 144 Slide Insurance Holdings For: 24 June By Investing.com
AAPL,2026-06-24,-0.024720147252082825,neutral,news,Form 13G WeShop Holdings Ltd For: 23 June By Investing.com
AAPL,2026-06-24,-0.09941198863089085,neutral,news,Form 144 CREDIT ACCEPTANCE CORP For: 24 June By Investing.com
AAPL,2026-06-24,0.21032991260290146,neutral,news,"BioCryst Pharmaceuticals options trading jumps to 13,522"
AAPL,2026-06-24,0.48015800677239895,positive,news,"VOO is up 0.6% today, on UBER stock price movement"
AAPL,2026-06-24,0.8915267325937748,positive,news,Spruce Power launches AI initiative to cut costs By Investing.com
AAPL,2026-06-24,0.006708202883601189,neutral,news,(AAPD) and the Role of Price-Sensitive Allocations
AAPL,2026-06-24,0.9323229473084211,positive,news,Trico Bancshares stock hits 52-week high at 53.25 USD By Investing.com
AAPL,2026-06-24,-0.028852611780166626,neutral,news,Form 144 PUBLIC SERVICE ENTERPRISE GROUP INC For: 24 June By Investing.com
AAPL,2026-06-24,-0.9277880396693945,negative,news,Old Second Bancorp Inc stock hits 52-week high at 22.68 USD
AAPL,2026-06-24,0.18058694154024124,neutral,news,Apple to Begin Foldable iPhone Production in July After Resolving Hinge Issues
AAPL,2026-06-24,-0.8953109011054039,negative,news,Apple’ s AI Upgrade Probably Won’t Be a Game Changer for AAPL Stock
AAPL,2026-06-24,0.8699322231113911,positive,news,Apple (AAPL) BofA Stays Bullish as Price Increases Could Offset Higher Memory Costs
AAPL,2026-06-24,0.8523107096552849,positive,news,Apple (NASDAQ: AAPL) Edges Out NVIDIA (NASDAQ: NVDA) As The Smarter Buy For Investors Seeking Value And Growth
AAPL,2026-06-24,0.936514699831605,positive,news,Edwards Lifesciences stock hits 52-week high at 89.7 USD By Investing.com
AAPL,2026-06-24,-0.01585925556719303,neutral,news,Form DEF 14A Helen of Troy Ltd For: 24 June By Investing.com
AAPL,2026-06-24,0.9304317627102137,positive,news,Guardant Health stock hits 52-week high at 135.89 USD By Investing.com
AAPL,2026-06-24,0.9263461865484715,positive,news,Iron Mountain stock hits all-time high at 134.23 USD
AAPL,2026-06-24,0.9247355116531253,positive,news,ProAssurance Corp stock hits 52-week high at $24.99 By Investing.com
AAPL,2026-06-24,0.8928658338263631,positive,news,Qualcomm’s Acquisition Of Modular: Why CEO Cristiano Amon Believes It’s A 'Pivotal Moment' For The AI Industry
AAPL,2026-06-24,0.15277383290231228,neutral,news,"Dr. Cheng Chen joins LightInTheBox (NYSE: LITB) board, key committees"
AAPL,2026-06-24,0.9228317374363542,positive,news,AmerX initiates WidePoint stock coverage with buy rating By Investing.com
AAPL,2026-06-24,0.17490683495998383,neutral,news,"Tyler Gates, CEO of The Glimpse Group, Joins Industry Leaders for Panel on Defense Tech and Domestic Supply Chains"
ORCL,2026-06-25,-0.9653227580711246,negative,news,"Intuit (INTU) Down More than 57% YTD, Here’s What You Need to Know"
ORCL,2026-06-25,0.707899808883667,positive,news,TD Cowen Maintains a Buy Rating on Boston Scientific (BSX)
ORCL,2026-06-25,0.9383630231022835,positive,news,Why is International Business Machines stock surging today?
ORCL,2026-06-25,0.9272236172109842,positive,news,"KeyBanc Adjusts Price Target on Cisco Systems to $130 From $125, Maintains Overweight Rating"
ORCL,2026-06-25,-0.9461955167353153,negative,news,"SG Americas Securities LLC Reduces Stock Position in Diamondback Energy, Inc. $FANG"
ORCL,2026-06-25,0.9311184687539935,positive,news,KeyBanc Raises PT on Arista Networks (ANET) Stock
ORCL,2026-06-25,0.6436510533094406,positive,news,"Ashoka WhiteOak Capital Pte Ltd Has $11.45 Million Stake in MercadoLibre, Inc. $MELI"
ORCL,2026-06-25,0.9370039105415344,positive,news,Is Sandisk (SNDK) a Good Stock to Buy for the Long Term?
ORCL,2026-06-25,0.9305421411991119,positive,news,What Does Wall Street Say About Devon Energy (DVN)?
ORCL,2026-06-25,0.9360298402607441,positive,news,Is Linde (LIN) One of the 10 Reliable Dividend Stocks to Buy for Long-Term Investors?
ORCL,2026-06-25,0.8999671768397093,positive,news,Merck (MRK) Stock Gets New Outperform Rating from CICC
ORCL,2026-06-25,0.5765947923064232,positive,news,Eli Lilly and Company (LLY) – Among the 10 Reliable Dividend Stocks to Buy for Long-Term Investors
ORCL,2026-06-25,0.9339906964451075,positive,news,Stifel Raises Texas Instruments (TXN) Target After Semiconductor Momentum Improves
ORCL,2026-06-25,-0.9583886442705989,negative,news,Is Oracle (ORCL) One of the Top 10 Blue Chip Stocks with Growing Dividends?
ORCL,2026-06-24,0.0011785253882408142,neutral,news,"Gitlab, Inc. Class A Trade Ideas — HAM:8K2"
ORCL,2026-06-24,0.4116288125514984,positive,news,Friedman Industries declares $0.04 quarterly dividend
ORCL,2026-06-24,0.0946896942332387,neutral,news,"HSBC survey: AI helps U.S. investors research, but not decide"
ORCL,2026-06-24,0.886685511097312,positive,news,SoFi Bets on Innovation and Scale While Ally Prioritizes Dividends and Auto Lending Discipline
ORCL,2026-06-24,-0.8069769069552422,negative,news,Astera Labs Stock Fell 10% After Its Nasdaq-100 Debut: Here’s What Has to Hold Up the Stock Now
ORCL,2026-06-24,-0.9118106001988053,negative,news,Oracle sues Wisconsin utility regulators over financial requirements for data centers
ORCL,2026-06-24,-0.8577313087880611,negative,news,"Oracle sues PSC, seeking to relax data center rules"
ORCL,2026-06-24,0.8974498622119427,positive,news,Canadian Solar’s e-STORAGE to supply battery system in Michigan
ORCL,2026-06-24,0.9298066273331642,positive,news,"Despite concerns, Oracle 10-K supports revenue outlook for fiscal 2027: Evercore (ORCL:NYSE)"
ORCL,2026-06-24,-0.4596530571579933,negative,news,"Arm, Western Digital among market cap stock movers on Wednesday"
ORCL,2026-06-24,0.9279549364000559,positive,news,"Signal Advisors Wealth LLC Has $1.64 Million Stock Position in United Rentals, Inc. $URI"
ORCL,2026-06-24,-0.8109737187623978,negative,news,"SVB Wealth LLC Has $11.65 Million Stock Holdings in The Home Depot, Inc. $HD"
ORCL,2026-06-24,0.9340805914252996,positive,news,"Signal Advisors Wealth LLC Acquires 10,702 Shares of Procter & Gamble Company (The) $PG"
ORCL,2026-06-24,0.92587401997298,positive,news,"Cidel Asset Management Inc. Buys 4,383 Shares of Motorola Solutions, Inc. $MSI"
ORCL,2026-06-24,-0.967348497826606,negative,news,"Did Oracle Need To Fire 21,000 Because It Is In Trouble?"
ORCL,2026-06-24,-0.9675772641785443,negative,news,"Oracle's workforce down 21,000 amid AI-driven restructuring"
ORCL,2026-06-23,-0.021713752299547195,neutral,news,Direxion Daily ORCL Bull 2X ETF declares quarterly distribution of $0.0630
ORCL,2026-06-23,-0.9546488467603922,negative,news,"Oracle layoffs: 21,000 jobs cut, software giant trades human talent for AI tech amid the SaaSpocalypse"
ORCL,2026-06-23,0.4217894608154893,neutral,news,CData aims to simplify AI development with latest features
ORCL,2026-06-23,0.5736097693443298,positive,news,Global Interactive Technologies Stock Moves Higher but Latest Filing Flags Warning
ORCL,2026-06-23,-0.9676964040845633,negative,news,"21,000 Oracle jobs vanish amid Big Red's big bets on AI"
ORCL,2026-06-23,0.8724276162683964,positive,news,Pegasystems (PEGA) Launches Software Features to Integrate External AI Agents into Workflows
ORCL,2026-06-23,-0.9211087264120579,negative,news,"Oracle Stock Is Down 44% in the Last 9 Months. Is This a Buying Opportunity, or Is More Downside Ahead?"
ORCL,2026-06-23,-0.9682354484684765,negative,news,"Market movers: SpaceX, Carnival Corp, Oracle..."
ORCL,2026-06-23,-0.966283893212676,negative,news,"Oracle sheds 21,000 roles over the past year amid wave of AI layoffs from tech giants"
ORCL,2026-06-23,-0.4785972163081169,negative,news,SpaceX Just Needs the Money
ORCL,2026-06-23,-0.9652800532057881,negative,news,"Oracle says AI helped drive layoffs of 21,000 employees"
ORCL,2026-06-23,0.5818756595253944,positive,news,BitMine’s Ethereum Bet Is Only Part of the Story
ORCL,2026-06-23,0.4336932133883238,neutral,news,"Royalties & licensing: investors can win with ARM Holdings, RE Royalties and Franco-Nevada!"
ORCL,2026-06-23,-0.9659484564326704,negative,news,"Oracle cuts 21,000 jobs in a year as AI-driven automation reshapes workforce"
ORCL,2026-06-23,-0.9542062086984515,negative,news,Tesla Stock Heads For Red June — Jefferies Warns It Could Become a SpaceX Proxy As Merger Talk Builds
ORCL,2026-06-23,-0.9627828719094396,negative,news,Tesla Stock Heads For Red June — Jefferies Warns It Could Become a SpaceX Proxy As Merger Talk Builds
ORCL,2026-06-23,0.6214992823079228,positive,news,Networking the Future in Nashville: Murari on Oracle Opportunities
ORCL,2026-06-23,-0.9669359102845192,negative,news,"Tech giant Oracle cuts 21,000 jobs as it embraces AI"
ORCL,2026-06-22,-0.9657598119229078,negative,news,"Oracle workforce shrinks by about 21,000 employees amid AI adoption"
ORCL,2026-06-22,-0.9662287626415491,negative,news,"Oracle workforce shrinks by about 21,000 employees amid AI adoption"
AMZN,2026-06-25,0.9316983483731747,positive,news,Corning GLW Stock Jumps As Amazon AI Data Center Deal Lifts Outlook
AMZN,2026-06-25,0.820479791611433,positive,news,"Exclusive | Walmart, in Biggest Deal in Two Years, Buys Advertising Tech Firm"
AMZN,2026-06-25,0.17553176544606686,neutral,news,Moody’s AI Skills Set to Transform Financial Analysis
AMZN,2026-06-25,0.2226444035768509,neutral,news,How Moody’s Encodes Financial Expertise into AI Skills
AMZN,2026-06-25,0.8628076491877437,positive,news,EC clears Liberty Global VodafoneZiggo move
AMZN,2026-06-25,0.9230605661869049,positive,news,Micron drives global rally tech stock rally as traders abandon their fear of an AI bubble
AMZN,2026-06-25,0.8970408225432038,positive,news,Is ResMed Inc. (RMD) Stock Still a Long-Term Winner as OSA Market Expansion Continues?
AMZN,2026-06-25,0.4262199401855469,neutral,news,"LVS, MGM Resorts, Galaxy Ent and Aristocrat all make Forbes’ latest ‘Global 2000’ list"
AMZN,2026-06-25,0.18402337934821844,neutral,news,Hotels are building the AI discovery layer. OTAs are harvesting it
AMZN,2026-06-25,0.9341770801693201,positive,news,Home Depot Inc Stock (HD) Moved Up by 5.62% on Jun 25: What Investors Need To Know
AMZN,2026-06-25,0.5256147161126137,positive,news,"3 Reasons to Buy Costco Right Now, and 1 Reason to Avoid It"
AMZN,2026-06-25,0.8662946112453938,positive,news,"3 Reasons to Buy Costco Right Now, and 1 Reason to Avoid It"
AMZN,2026-06-25,0.9209639383479953,positive,news,"Is Amazon.com, Inc. (AMZN) the Best AI Chip Stock to Buy for the Long Term?"
AMZN,2026-06-25,0.9024383444339037,positive,news,"Is Amazon.com, Inc. (AMZN) the Best AI Chip Stock to Buy for the Long Term?"
AMZN,2026-06-25,0.9156809840351343,positive,news,BMO Capital Reiterates Buy Rating on Amazon.com (AMZN) Stock
AMZN,2026-06-25,0.9252923829481006,positive,news,"Walmart Expands Advertising Business with Vibe.co Acquisition, WSJ Reports"
AMZN,2026-06-25,0.9362794868648052,positive,news,"Why Did UAL, GLW, ABSI Stocks Surge To 52-Week Highs Today?"
AMZN,2026-06-25,0.7464873911812901,positive,news,MIND C.T.I. Ltd (MNDO): A Small-Cap Value Opportunity Hidden in Plain Sight
AMZN,2026-06-24,0.22166788578033447,positive,news,"Taboola.com (TBLA) Opens DeeperDive To External AI, Is The Upside Already Priced In?"
AMZN,2026-06-24,-0.9512083185836673,negative,news,"Showdown between Cigna, UC Health and One Medical threatens patients, employers"
AMZN,2026-06-24,-0.9334715101867914,negative,news,The One Metric That Makes Costco Wholesale Stock Vulnerable
AMZN,2026-06-24,0.7556355893611908,positive,news,Plug Power Lost 97% of Its Value Over Five Years. The Margin Turnaround in 2026 Is Why Analysts Are Starting to Look Again
AMZN,2026-06-24,-0.018091589212417603,neutral,news,Nvidia's Huang calls black market data centers made of smuggled parts a 'dead end'
AMZN,2026-06-24,0.9329825472086668,positive,news,Lowe's Companies Inc Stock (LOW) Moved Up by 3.19% on Jun 24: A Full Analysis
AMZN,2026-06-24,-0.9482135334983468,negative,news,GameStop Withdraws CEO Compensation Proposal in Move To Advance Bid for eBay
AMZN,2026-06-24,0.8305629603564739,positive,news,Amazon Prime Day Puts ETFs in Focus
AMZN,2026-06-24,0.8970045335590839,positive,news,Elon Musk Gives A Nod As Nvidia Argues AI Data Centers Aren't The Water Drain Many Believe: 'Numbers May Surprise You'
AMZN,2026-06-24,-0.014392506331205368,neutral,news,"RBC (RY) launches auto-callable notes tied to AMZN, GOOGL and NVDA (14.25%+ coupon)"
AMZN,2026-06-24,0.8034845441579819,positive,news,FedEx Q4: The Pivot You Can't See On The Income Statement (NYSE:FDX)
AMZN,2026-06-24,0.9318916443735361,positive,news,"Corning Stock Skyrockets on AI-Related Demand, Spurring Unusual Call Option Buying"
AMZN,2026-06-24,0.9303141105920076,positive,news,Amazon Prime Day total online spending beats estimate on day one
AMZN,2026-06-24,0.9294228777289391,positive,news,Amazon Prime Day total online spending beats estimate on day one
AMZN,2026-06-24,0.8609447963535786,positive,news,"GameStop drops CEO package, heightens focus on eBay takeover"
AMZN,2026-06-24,0.7837313497439027,positive,news,How IBUY Taps Into Prime Day's Online Retail Boom
AMZN,2026-06-24,0.010164111852645874,neutral,news,"Brendan Caldwell's Top Picks: PriceSmart, Materion & Ryman Hospitality Properties"
AMZN,2026-06-24,0.911482784897089,positive,news,Amazon.com Inc Stock (AMZN) Moved Up by 3.21% on Jun 24: Facts Behind the Movement
AMZN,2026-06-24,0.9033864233642817,positive,news,"GameStop CEO on His eBay Pursuit: ‘I’m Not Going to Stop, I’m Not Going to Go Away’"
AMZN,2026-06-24,0.937894138507545,positive,news,Brown Capital Management highlights Credo Technology as key fund addition amid AI infrastructure growth
AMZN,2026-06-24,0.9258721899241209,positive,news,Amazon Prime Day Online Spending Beats Estimate on Day 1
AMZN,2026-06-24,0.9120089318603277,positive,news,Major shareholders extend lock-up period for One and One Green
AMZN,2026-06-24,0.9278061436489224,positive,news,Amazon Strengthens Bedrock Ecosystem: What's Next for Enterprise AI?
AMZN,2026-06-24,0.117023766040802,positive,news,CVB Financial Corporation stock hits 52-week high at 21.63 USD
AMZN,2026-06-24,0.9339168276637793,positive,news,Home Depot Inc Stock (HD) Moved Up by 3.38% on Jun 24: What Investors Need To Know
AMZN,2026-06-24,0.9364887773990631,positive,news,Corning Inc Stock (GLW) Moved Up by 4.19% on Jun 24: A Full Analysis
AMZN,2026-06-24,0.8224564376287162,positive,news,Corning Unveils Glass Bridge for CPO and Glass-Core Packaging
AMZN,2026-06-24,-0.48653918132185936,negative,news,Vale Calls July Extraordinary Meeting to Vote on Board Shake-Up and Chair Election
WMT,2026-06-25,0.9313122285529971,positive,news,Gen Z shoppers are a 'tremendous opportunity': Coach and Kate Spade CEO
WMT,2026-06-25,0.06268951017409563,neutral,news,"New Florida Costco opened early, when and where is the next one?"
WMT,2026-06-25,0.9251613095402718,positive,news,Kroger raises annual dividend 11% to $1.56 per share
WMT,2026-06-25,0.4184196889400482,positive,news,"3 Reasons to Buy Costco Right Now, and 1 Reason to Avoid It"
WMT,2026-06-25,0.7995336041785777,positive,news,"Walmart (WMT) Expands Shapermint Into 1,600 More Stores Nationwide"
WMT,2026-06-24,0.33314394671469927,neutral,news,Walmart acquires TV ad platform Vibe.co
WMT,2026-06-24,0.5090013025328517,positive,news,Kroger links with TikTok on targeted ads
WMT,2026-06-24,-0.050449758768081665,negative,news,Constellation Energy (CEG) Stock: Retail Giant's Historic Nuclear Agreement Signals Turnaround
WMT,2026-06-24,0.0015320628881454468,neutral,news,"Licensable picture: At the Dover Walmart, associate Emory Hodge uses the company phone to scan an item to cross it off the list as he gathers orders"
WMT,2026-06-24,0.9280527345836163,positive,news,Kroger Stock Outlook Hinges on Digital Growth & Private-Label Strength
WMT,2026-06-24,0.8662149156443775,positive,news,"Kroger Stock Is Tied to Retail Media, Private Label, and Value Trends"
WMT,2026-06-24,0.32957303524017334,neutral,news,"Kroger Stock Is Tied to Retail Media, Private Label, and Value Trends"
WMT,2026-06-24,0.9039724785834551,positive,news,Kroger Stock Outlook Hinges on Digital Growth & Private-Label Strength
WMT,2026-06-24,0.9335969518870115,positive,news,"Casey's Stock Outlook Hinges on Food, Fuel and Store Growth"
WMT,2026-06-24,0.9417926408350468,positive,news,Transcript: Crown Crafts Q4 2026 Earnings Conference Call
WMT,2026-06-24,0.2505603190511465,neutral,news,Amazon Prime Day total online spending beats estimate on day one
WMT,2026-06-24,0.8718642499297857,positive,news,Walmart strikes first nuclear power deal for electricity from Illinois site
WMT,2026-06-24,0.6726193660870194,positive,news,"Target leans on new brands, exclusives for school shopping"
WMT,2026-06-24,0.8786822445690632,positive,news,Rockefeller Capital Management L.P. Has $14.59 Million Stock Holdings in e.l.f. Beauty $ELF
WMT,2026-06-24,0.8846411062404513,positive,news,"Shapermint Expands to 1,600 Additional Walmart Stores Nationwide Comfort-First Shapewear Brand Accelerates Retail Growth Across the U.S."
WMT,2026-06-24,-0.3283444344997406,negative,news,Should Rejected Governance Changes and Pulled ESG Proposals at BJ's (BJ) Prompt a Rethink of Its Membership-Led Strategy?
WMT,2026-06-24,0.8774323789402843,positive,news,Walmart's Wide Moat Endures as Digital and Omnichannel Scale Reinforce Its Competitive Position
WMT,2026-06-24,0.22326228208839893,neutral,news,"The Clover Valley Macaroni & Cheese Dinner from Dollar General Corp. - low price, simple comfort for"
WMT,2026-06-23,-0.8249785378575325,negative,news,First Financial Bancorp (FFBC) Stock Could Be 38.5% Below Fair Value After Recent Gains
WMT,2026-06-23,0.8343552816659212,positive,news,We’ve Found 14 Best Buy Deals Worth Buying This Prime Day
WMT,2026-06-23,0.9304511416703463,positive,news,6 Retail Stocks To Watch During Amazon Prime Day: Report Shows Potential Winners
WMT,2026-06-23,0.9045187048614025,positive,news,"Floor And Decor and Kroger Stocks Trade Up, What You Need To Know"
WMT,2026-06-23,0.9168843626976013,positive,news,Amazon Prime Day Deal Hunters Watch Prices Closely
WMT,2026-06-23,0.917300408706069,positive,news,Amazon Prime Day shoppers plan to hold out for steep discounts
WMT,2026-06-23,0.8411285476759076,positive,news,Walmart signs first nuclear power deal with Constellation
WMT,2026-06-23,0.7724157571792603,positive,news,"Walmart, 7-Eleven, Albertsons, and BP used AI to raise gas prices, lawsuit alleges"
WMT,2026-06-23,0.8539244495332241,positive,news,"Burlington Debuts 2 MSF Distribution Center in Ellabell, Georgia"
WMT,2026-06-23,0.8941945424303412,positive,news,Walmart to Buy Vibe in Effort to Fuel TV Ad Business
WMT,2026-06-23,0.9239531438797712,positive,news,How Kroger is leaning on pricing and stores to reset its value proposition
WMT,2026-06-23,0.9381744265556335,positive,news,Can Dollar General Keep Expanding Earnings in Fiscal 2026?
WMT,2026-06-23,-0.12494948506355286,negative,news,Can Dollar General Keep Expanding Earnings in Fiscal 2026?
WMT,2026-06-23,0.9191636731848121,positive,news,Why Membership Trends Make BJ's Wholesale a Retail Stock to Watch
WMT,2026-06-23,0.9144822098314762,positive,news,Why Membership Trends Make BJ's Wholesale a Retail Stock to Watch
WMT,2026-06-23,0.5427693612873554,positive,news,Walmart to Acquire Vibe.co to Expand Access to Connected TV Advertising
WMT,2026-06-23,0.9197181630879641,positive,news,Walmart signs first nuclear power deal with Constellation
WMT,2026-06-23,0.8696653959341347,positive,news,Walmart to Acquire Vibe.co to Expand Access to Connected TV Advertising
SCHW,2026-06-25,0.7125116139650345,positive,news,Ecopetrol SA (EC) Institutional Confidence
SCHW,2026-06-24,0.9179213121533394,positive,news,Schwab's Stress Test Ace: A Capital Fortress in an Uncertain Market
SCHW,2026-06-24,0.13717898726463318,positive,news,BNY and State Street plan to boost dividends after stress tests; others discuss results (BNY:NYSE)
SCHW,2026-06-24,0.9313918184489012,positive,news,"Schwab receives 2026 CCAR results, maintains 2.5% buffer"
SCHW,2026-06-24,0.09094520285725594,neutral,news,"Parents may be cringe, but talking investing isn’t."
SCHW,2026-06-24,0.9157944917678833,positive,news,Charles Schwab Discloses Results of the Federal Reserve’s 2026 Comprehensive Capital Analysis and Review
SCHW,2026-06-24,0.9409025590866804,positive,news,Charles Schwab Discloses Results of the Federal Reserve’s 2026 Comprehensive Capital Analysis and Review
SCHW,2026-06-24,0.9195419270545244,positive,news,Franklin Resources' Arm Expands Crypto Capabilities With 250 Digital Buyout
SCHW,2026-06-24,-0.9568373765796423,negative,news,Charles Schwab Corp. stock outperforms competitors despite losses on the day
SCHW,2026-06-24,0.04005432687699795,neutral,news,Schwab Announces Its Summer Business Update
SCHW,2026-06-24,0.1285534342750907,neutral,news,Cboe Global Markets launches Cboe Predicts
SCHW,2026-06-24,0.0003358684480190277,neutral,news,Schwab International Dividend Equity ETF declares quarterly distribution of $0.3571
SCHW,2026-06-24,0.05415763333439827,neutral,news,SPLB vs. SCHQ: Which Long-Term Bond ETF Is the Better Buy for Investors?
SCHW,2026-06-24,0.02944030426442623,neutral,news,Schwab Ariel Opportunities ETF declares quarterly distribution of $0.0336
SCHW,2026-06-24,0.3309086221270263,neutral,news,Cboe brings prediction markets into the regulated mainstream with binary options launch
SCHW,2026-06-24,-0.040186669677495956,neutral,news,Schwab US Large-Cap ETF declares quarterly distribution of $0.0763
SCHW,2026-06-24,0.18765941262245178,neutral,news,Schwab Fundamental US Broad Market ETF declares quarterly distribution of $0.1101
SCHW,2026-06-24,-0.3990812376141548,neutral,news,Schwab US Large-Cap Value ETF declares quarterly distribution of $0.1566
SCHW,2026-06-24,0.03164641931653023,neutral,news,Schwab US Broad Market ETF declares quarterly distribution of $0.0753
SCHW,2026-06-24,-0.019563883543014526,neutral,news,Schwab US Large-Cap Growth ETF declares quarterly distribution of $0.0337
SCHW,2026-06-24,-0.016855815425515175,neutral,news,Schwab US Dividend Equity ETF declares quarterly distribution of $0.2525
SCHW,2026-06-24,-0.004061674699187279,neutral,news,Schwab US REIT ETF declares quarterly distribution of $0.1683
SCHW,2026-06-24,0.011827737092971802,neutral,news,Schwab Fundamental US Large Company ETF declares quarterly distribution of $0.1180
SCHW,2026-06-24,0.1167502012103796,neutral,news,Schwab Fundamental International Small Equity ETF declares semi-annual distribution of $0.2780
SCHW,2026-06-24,0.19060281477868557,neutral,news,Schwab Fundamental US Small Company ETF declares quarterly distribution of $0.0966
