ticker,date,sentiment_score,sentiment_label,content_type,title
GS,2026-02-19,0.06910794787108898,neutral,news,"45,205 Shares in Stoke Therapeutics, Inc. $STOK Acquired by Principal Financial Group Inc."
GS,2026-02-19,-0.8323617875576019,negative,news,Goldman Sachs lowers Fiverr stock price target on revenue reset
GS,2026-02-19,-0.5619821920990944,negative,news,Fiverr International Ltd. (FVRR) PT Lowered to $24 at Goldman Sachs
GS,2026-02-19,0.9337272588163614,positive,news,Goldman's Wealth Management Business Emerges as Durable Growth Engine
GS,2026-02-19,0.8784137591719627,positive,news,Banco de Chile Stock: Quiet Latin Bank With U.S. Dollar Upside?
GS,2026-02-19,0.781690739095211,positive,news,Howmet Aerospace Prices $1.2 Billion Debt for Acquisition
GS,2026-02-18,0.9012681478634477,positive,news,"Cohler Matt, KKR director, buys $4.5m in company stock"
GS,2026-02-18,0.36696025263518095,neutral,news,RBC hires Goldman’s Noel Reyes to lead equity algorithm innovation - Bloomberg
GS,2026-02-18,-0.801461985334754,negative,news,Form 424B2 JPMORGAN CHASE & CO
GS,2026-02-18,0.9308350998908281,positive,news,"Amazon.com Inc., Goldman Sachs share gains lead Dow's nearly 150-point jump"
GS,2026-02-18,-0.5048949532210827,negative,news,Goldman Sachs EV and Battery Stocks: Top 10 Stock Picks
GS,2026-02-18,0.792710485868156,positive,news,Howmet Aerospace prices $1.2 billion notes offering to fund acquisition By Investing.com
GS,2026-02-18,0.8960069566965103,positive,news,Kosmos Energy Announces Earnings Schedule and Goldman Sachs Raises Target
GS,2026-02-18,-0.46494849771261215,negative,news,"Goldman Sachs CEO Owns 'Very Little' Bitcoin, Backs Bessent on Clarity Act"
GS,2026-02-18,-0.09446577355265617,neutral,news,"Goldman CEO Solomon, Long a Crypto Skeptic, Says He Owns Bitcoin"
GS,2026-02-18,-0.010793088003993034,neutral,news,Form 424B2 GOLDMAN SACHS GROUP INC
GS,2026-02-18,-0.13705453276634216,negative,news,Bitcoin ETFs See $105M In Outflows As Unknown iShares Bitcoin Trust Buyer Emerges
GS,2026-02-18,0.11061893403530121,neutral,news,"USA Compression Partners, LP (NYSE:USAC) Receives Average Recommendation of ""Reduce"" from Analysts"
GS,2026-02-18,0.9361681770533323,positive,news,Goldman's Wealth Management Business Emerges as Durable Growth Engine
GS,2026-02-18,0.9298506062477827,positive,news,CenterPoint Energy earnings up next: Texas growth story in focus
GS,2026-02-18,0.9135720115154982,positive,news,Burford Capital (NYSE:BUR) Coverage Initiated at Bank of America
GS,2026-02-18,0.14054766669869423,neutral,news,Avoiding Lag: Real-Time Signals in (GSEE) Movement
GS,2026-02-18,0.9299827124923468,positive,news,Is Wall Street Bullish or Bearish on Jacobs Solutions Stock?
GS,2026-02-18,-0.8764524981379509,negative,news,"JPMorgan Adjusts Price Target on General Mills to $42 From $46, Maintains Underweight Rating"
GS,2026-02-18,0.5782693363726139,positive,news,"Hodges Capital Management Inc. Acquires 50,700 Shares of CLEAR Secure, Inc. $YOU"
GS,2026-02-18,-0.6616736948490143,negative,news,"Hodges Capital Management Inc. Sells 26,518 Shares of SharkNinja, Inc. $SN"
GS,2026-02-18,-0.9423383269459009,negative,news,Robert Half Inc. $RHI Position Cut by Heartland Advisors Inc.
GS,2026-02-18,0.8955305200070143,positive,news,"Advisors Capital Management LLC Acquires 316,107 Shares of OUTFRONT Media Inc. $OUT"
GS,2026-02-18,0.8809603303670883,positive,news,Public Sector Pension Investment Board Grows Position in SiriusPoint Ltd. $SPNT
GS,2026-02-18,0.9101363979279995,positive,news,"Aberdeen Group plc Buys 34,122 Shares of Jacobs Solutions Inc. $J"
GS,2026-02-18,0.8846886921674013,positive,news,"Ladder Capital (NYSE:LADR) Downgraded to ""Strong Sell"" Rating by Zacks Research"
GS,2026-02-18,0.5152576388791203,positive,news,"Figure Technology Solutions, Inc. Announces Upsized Secondary Public Offering of Series A Blockchain Common Stock"
GS,2026-02-18,0.9383648429065943,positive,news,CenterBook Partners LP Has $5.67 Million Stock Holdings in The Charles Schwab Corporation $SCHW
GS,2026-02-18,0.47948774695396423,positive,news,"The Goldman Sachs Group, Inc. $GS Shares Purchased by Waycross Partners LLC"
GS,2026-02-18,0.9303910052403808,positive,news,"NEOS Investment Management LLC Acquires 9,549 Shares of Royal Caribbean Cruises Ltd. $RCL"
GS,2026-02-18,0.8971641827374697,positive,news,"SCP Investment LP Has $18.55 Million Stake in Lineage, Inc. $LINE"
GS,2026-02-18,0.6568411588668823,positive,news,"M&G PLC Buys Shares of 2,436 The Goldman Sachs Group, Inc. $GS"
GS,2026-02-18,0.933686388656497,positive,news,"First National Bank of Omaha Buys New Position in Ollie's Bargain Outlet Holdings, Inc. $OLLI"
GS,2026-02-18,0.9153618114069104,positive,news,Principal Financial Group Inc. Boosts Stock Position in Petroleo Brasileiro S.A.- Petrobras $PBR
GS,2026-02-18,-0.6343049351125956,negative,news,Goldman Sachs Plans To Remove Diversity Criteria From Board Selection Process: Report
GS,2026-02-18,0.2394823580980301,neutral,news,"Principal Financial Group Inc. Buys Shares of 16,172 Power Solutions International, Inc. $PSIX"
PYPL,2026-02-19,-0.842690471559763,negative,news,"PAYPAL HOLDINGS, INC. (PYPL) SHAREHOLDER ALERT Bernstein"
PYPL,2026-02-19,-0.012772569432854652,neutral,news,"CenterBook Partners LP Acquires Shares of 66,054 PayPal Holdings, Inc. $PYPL"
PYPL,2026-02-19,-0.6749388836324215,negative,news,"PYPL Investors Have Opportunity to Lead PayPal Holdings, Inc. Securities Fraud Lawsuit with the Schall Law Firm"
PYPL,2026-02-18,-0.4541429169476032,negative,news,"PYPL Investors Have Opportunity to Lead PayPal Holdings, Inc. Securities Fraud Lawsuit"
PYPL,2026-02-18,-0.8829345740377903,negative,news,"INVESTOR ALERT: Securities Class Action Filed Against PayPal Holdings, Inc. – Investors Encouraged to Contact Kirby McInerney LLP"
PYPL,2026-02-18,-0.9453846514225006,negative,news,"INVESTOR ALERT: Securities Class Action Filed Against PayPal Holdings, Inc. – Investors Encouraged to Contact Kirby McInerney LLP"
PYPL,2026-02-18,-0.6131379343569279,negative,news,"PYPL Investors Have Opportunity to Lead PayPal Holdings, Inc. Securities Fraud Lawsuit with the Schall Law Firm"
PYPL,2026-02-18,-0.9669585712254047,negative,news,"PYPL Stockholder Alert: Shareholder Rights Law Firm Robbins LLP Reminds Investors of the Class Action Lawsuit Against PayPal Holdings, Inc."
PYPL,2026-02-18,-0.9635361358523369,negative,news,"PAYPAL LAWSUIT ALERT: Bragar Eagel & Squire, P.C. Announces"
PYPL,2026-02-18,-0.933264241553843,negative,news,"PAYPAL LAWSUIT ALERT: Bragar Eagel & Squire, P.C. Announces"
PYPL,2026-02-18,-0.8063570614904165,negative,news,"Rosen Law Firm Urges PayPal Holdings, Inc. (NASDAQ: PYPL) Stockholders with Large Losses to Contact the Firm for Information About Their Rights"
PYPL,2026-02-18,-0.9589174799621105,negative,news,"Truist Lowers PayPal (PYPL) Estimates Due to Slower Volume, Take Rate Compression"
PYPL,2026-02-18,0.9324599653482437,positive,news,Here’s Why Gator Capital Sold PayPal (PYPL)
PYPL,2026-02-18,-0.4694765619933605,negative,news,Here's Why Gator Capital Sold PayPal (PYPL)
PYPL,2026-02-18,-0.9289529621601105,negative,news,"INVESTOR DEADLINE: PayPal Holdings, Inc. Investors with Substantial Losses Have Opportunity to Lead Class Action Lawsuit, Robbins Geller Rudman & Dowd LLP Announces"
PYPL,2026-02-18,-0.9562507644295692,negative,news,"Fifth Third Bancorp Lowers Holdings in PayPal Holdings, Inc. $PYPL"
PYPL,2026-02-18,-0.9561968920752406,negative,news,"Vanguard Group Inc. Has $5.69 Billion Stock Holdings in PayPal Holdings, Inc. $PYPL"
PYPL,2026-02-18,-0.9522685455158353,negative,news,"Truist Lowers PayPal (PYPL) Estimates Due to Slower Volume, Take Rate Compression"
PYPL,2026-02-18,-0.942955669015646,negative,news,"Truist Lowers PayPal (PYPL) Estimates Due to Slower Volume, Take Rate Compression"
PYPL,2026-02-17,-0.9533327082172036,negative,news,"INVESTOR ALERT: PayPal Holdings, Inc. Investors with"
PYPL,2026-02-17,-0.9618929792195559,negative,news,"SHAREHOLDER ALERT: Levi & Korsinsky, LLP Notifies Investors"
PYPL,2026-02-17,-0.9603276941925287,negative,news,"Law Offices of Howard G. Smith Encourages PayPal Holdings, Inc. (PYPL) Shareholders To Inquire About Securities Fraud Class Action"
PYPL,2026-02-17,-0.9638881850987673,negative,news,"Investor Notice: Robbins LLP Informs Investors of the PayPal Holdings, Inc. Class Action"
PYPL,2026-02-17,-0.7783880829811096,negative,news,Can Western Union Beat Q4 Earnings on Consumer Services Strength?
PYPL,2026-02-17,0.9382239300757647,positive,news,OLB Group Stock Skyrockets On PayPal Partnership
PYPL,2026-02-17,-0.9133739769458771,negative,news,PYPL's Transaction Revenues: Will it Pave the Way or Hinder Growth?
PYPL,2026-02-17,0.8419173061847687,positive,news,"OLB surges on PayPal partnership news, with micro-cap volatility amplifying the move"
PYPL,2026-02-17,0.9319460261613131,positive,news,OLB Group stock soars after PayPal partnership announcement
PYPL,2026-02-17,0.8948094174265862,positive,news,This Nano-Cap Stock Doubled Today — What’s Driving The Surge?
PYPL,2026-02-17,0.8807949619367719,positive,news,OLB Group partners with PayPal to enhance merchant checkout options
PYPL,2026-02-17,0.8962097242474556,positive,news,"The OLB Group, Inc. Announces Global Partnership With PayPal to Enhance SecurePay Payment Gateway Platform, Accelerate Digital Payments for Small and Mid-Sized Merchants"
PYPL,2026-02-17,0.9327015224844217,positive,news,"The OLB Group, Inc. Announces Global Partnership With PayPal to Enhance SecurePay Payment Gateway Platform, Accelerate Digital Payments for Small and Mid-Sized Merchants"
PYPL,2026-02-17,0.5617082994431257,positive,news,"PayPal Holdings, Inc. $PYPL Shares Acquired by NEOS Investment Management LLC"
PYPL,2026-02-17,-0.9632660150527954,negative,news,"PayPal Holdings, Inc. $PYPL Shares Sold by Shell Asset Management Co."
PYPL,2026-02-16,-0.39662638306617737,negative,news,"Fiserv, Inc. $FISV Shares Sold by Todd Asset Management LLC"
PYPL,2026-02-16,0.9336020927876234,positive,news,Fidelity National Information Services (NYSE:FIS) Is Increasing Its Dividend To $0.44
PYPL,2026-02-16,0.6947327423840761,positive,news,Sen. John Boozman Buys First Trust Global Tactical Commodity Strategy Fund (NASDAQ:FTGC) Shares
PYPL,2026-02-16,-0.9627005131915212,negative,news,"Bastion Asset Management Inc. Lowers Stake in PayPal Holdings, Inc. $PYPL"
PYPL,2026-02-16,-0.873789481818676,negative,news,"ABN Amro Investment Solutions Increases Stock Holdings in PayPal Holdings, Inc. $PYPL"
PYPL,2026-02-16,-0.9474186319857836,negative,news,"PayPal Holdings, Inc. $PYPL Stock Holdings Reduced by Aberdeen Group plc"
PYPL,2026-02-16,-0.8461265824735165,negative,news,"Sen. John Boozman Buys PayPal Holdings, Inc. (NASDAQ:PYPL) Stock"
PYPL,2026-02-15,-0.9535509962588549,negative,news,"PYPL Investigation Reminder: Kessler Topaz Meltzer & Check, LLP Encourages PayPal Holdings, Inc. (NASDAQ: PYPL) Investors to Contact the Firm"
PYPL,2026-02-15,0.7944670487195253,positive,news,Alpha Announces 2026 Domestic Sales Commitments
PYPL,2026-02-14,0.4285958409309387,positive,news,How PayPal’s CEO Shake-Up and Soft 2025 Results Could Reshape PayPal Holdings (PYPL) Investors
PYPL,2026-02-14,-0.9096330404281616,negative,news,"Fiserv, Inc. $FISV Shares Sold by Public Sector Pension Investment Board"
PYPL,2026-02-14,0.9299319423735142,positive,news,"DDD Partners LLC Takes $2.45 Million Position in PayPal Holdings, Inc. $PYPL"
MRK,2026-02-19,-0.6194037646055222,negative,news,"King Luther Capital Management Corp Sells 263,609 Shares of Merck & Co., Inc. $MRK"
MRK,2026-02-19,0.933383870869875,positive,news,"Merck Discloses Positive Data For Respiratory Syncytial Virus Antibody Treatment, Seeks FDA Nod For Broader Child Use"
MRK,2026-02-19,0.8234502738341689,positive,news,"3D Protein Structure Analysis Market Report 2026 Featuring Profiles of Merck, Bruker Corp., Thermo Fisher Scientific, JEOL, Spectris and Other Leading Players"
MRK,2026-02-19,0.7617663592100143,positive,news,"3D Protein Structure Analysis Market Report 2026 Featuring Profiles of Merck, Bruker Corp., Thermo Fisher Scientific, JEOL, Spectris and Other Leading Players"
MRK,2026-02-19,0.6948270564898849,positive,news,"$19.8 Billion Cell and Gene Therapy Tools & Reagents Market Outlook, 2030 Featuring Thermo Fisher Scientific, Cytiva (Danaher), Merck, Miltenyi Biotec, Sartorius and More"
MRK,2026-02-19,0.9232241520658135,positive,news,"First National Bank of Omaha Makes New Investment in Merck & Co., Inc. $MRK"
MRK,2026-02-19,0.9328548004850745,positive,news,Merck Announces Positive New Data for ENFLONSIA™ (clesrovimab) for Infants and Children Under 2 Years of Age at Increased Risk for Severe Respiratory Syncytial Virus (RSV) Disease Over Two RSV Seasons
MRK,2026-02-18,0.4026755169034004,neutral,news,Novartis/Unnatural Team Up On Macrocyclic Peptides
MRK,2026-02-18,0.9381605330854654,positive,news,Glaukos Stock Shoots Up After iDose TR Re-administration Approval
MRK,2026-02-18,-0.7857005223631859,negative,news,Illumina Stock is Down 80% From Its All-Time Highs: Can It Recover in 2026?
MRK,2026-02-18,0.8268451620824635,positive,news,Merck Inks AI Drug Discovery Deal With Mayo Clinic To Revolutionize Drug Discovery
MRK,2026-02-18,0.9179765647277236,positive,news,"J&J fleshes out US investment plan, telegraphing $1B cell therapy plant and 500 new jobs in PA"
MRK,2026-02-18,0.9388765320181847,positive,news,Merck & Co. (MRK) Advances on Robust Keytruda Sales and Positive Clinical Trial Results
MRK,2026-02-18,0.6860598875209689,positive,news,"Evinova Announces Strategic Collaborations with Astellas, AstraZeneca and Bristol Myers Squibb Advancing Its AI-Native Platform to Accelerate Global Clinical Development"
MRK,2026-02-18,0.8956909505650401,positive,news,Johnson & Johnson will spend $1 billion on a cell therapy plant on its campus near Ambler
MRK,2026-02-18,0.7973726419731975,positive,news,Crescent Biopharma doses first patient in ASCEND cancer trial
MRK,2026-02-18,0.9381216298788786,positive,news,"Halozyme Therapeutics, Inc. (NASDAQ:HALO) Q4 2025 Earnings Call Transcript"
MRK,2026-02-18,0.8507357556372881,positive,news,How High Can IBRX Stock Go Now? Here’s What Wall Street Thinks After Saudi Nod For Bladder Cancer Filing
MRK,2026-02-18,0.8319470337592065,positive,news,Merck and Mayo Clinic Announce New Research and Development Collaboration to Support AI-Enabled Drug Discovery and Precision Medicine
MRK,2026-02-18,0.5994983110576868,positive,news,Inside Merck and Mayo Clinic’s AI push to speed new treatments
MRK,2026-02-18,0.4365354781039059,neutral,news,Inside Viavi's 30-demo push into AI-driven networks at MWC
MRK,2026-02-18,0.8886324921622872,positive,news,Merck and Mayo Clinic Announce AI Collaboration Agreement
MRK,2026-02-18,0.813768554944545,positive,news,Merck and Mayo Clinic Announce New Research and Development Collaboration to Support AI-Enabled Drug Discovery and Precision Medicine
MRK,2026-02-18,0.44816138315945864,neutral,news,"Animal Performance Enhancers Market Forecast Through 2026-2033: Emerging Trends, Market Drivers, and Strategic Insights Revealed in New Study | Zoetis • Elanco Animal Health • Merck Animal Health"
MRK,2026-02-18,0.7568048276007175,positive,news,Wegovy copycat to be priced competitively with 50-60% discounts: Dr Reddy's
MRK,2026-02-18,-0.6840036362409592,negative,news,"Short Interest in Merck & Co., Inc. (NYSE:MRK) Decreases By 14.6%"
MRK,2026-02-17,-0.9176925085484982,negative,news,Neuphoria Therapeutics Inc. SEC 10-Q Report
MRK,2026-02-17,0.23222799226641655,neutral,news,"Mubadala Investment Co PJSC reports share stake in Pfizer, AbbVie, dissolves in Merck, Dell"
MRK,2026-02-17,-0.0398281067609787,neutral,news,The IRA could hurt market access for more convenient drugs
MRK,2026-02-17,0.034306515008211136,neutral,news,"Sanofi bids adieu to specialty care chief, promotes Manuela Buxo to assume key post"
MRK,2026-02-17,-0.9101208597421646,negative,news,Can BMY's Growth Portfolio Counter Legacy Drugs Decline in 2026?
MRK,2026-02-17,0.9126392379403114,positive,news,Pacer’s Cash Cows ETF Might Be The Perfect ETF To Own Right Now | COWZ
MRK,2026-02-17,0.7060668747872114,positive,news,"Dr Reddy’s says Wegovy copycat to be priced competitively, with 50–60% discounts feasible"
MRK,2026-02-17,0.9329511672258377,positive,news,"Merck & Co., Inc. $MRK Shares Purchased by NEOS Investment Management LLC"
MRK,2026-02-17,0.9385700924322009,positive,news,"GSA Capital Partners LLP Raises Stock Holdings in Merck & Co., Inc. $MRK"
MRK,2026-02-17,0.8936663679778576,positive,news,"Mondrian Investment Partners LTD Invests $138.34 Million in Merck & Co., Inc. $MRK"
MRK,2026-02-17,-0.7168753147125244,negative,news,"Merck & Co., Inc. $MRK Shares Sold by Fifth Third Bancorp"
MRK,2026-02-17,0.7074162047356367,positive,news,"Merit Financial Group LLC Purchases 16,545 Shares of Merck & Co., Inc. $MRK"
MRK,2026-02-17,0.037658113054931164,neutral,news,"Hypoglycemia Pipeline 2025: MOA and ROA Insights, Clinical Trials Status, and Key Companies Involved by DelveInsight | Amphastar Pharma, Eiger BioPharma, Eli Lilly, Novo Nordisk, Xeris Pharma"
MRK,2026-02-17,0.8566856277175248,positive,news,Is State Street SPDR Portfolio S&P 500 High Dividend ETF (SPYD) a Strong ETF Right Now?
MRK,2026-02-16,0.8720486415550113,positive,news,Krystal Biotech’s RMAT Win Puts KB707 At Core Of Oncology Story
MRK,2026-02-16,0.93982894718647,positive,news,Merck Indicates Better Growth Visibility in Post-Keytruda LOE Period
MRK,2026-02-16,-0.9642647402361035,negative,news,Revolution Medicines (RVMD) dives 16.9% as Merck withdraws takeover plan
MRK,2026-02-16,0.9082452077418566,positive,news,"Texas Yale Capital Corp. Has $4.83 Million Stake in Merck & Co., Inc. $MRK"
MRK,2026-02-16,-0.4400786906480789,negative,news,"Vanguard Group Inc. Sells 777,516 Shares of Merck & Co., Inc. $MRK"
MRK,2026-02-16,-0.9010491743683815,negative,news,"M&G PLC Has $30.49 Million Stock Position in Merck & Co., Inc. $MRK"
MRK,2026-02-16,0.9173279628157616,positive,news,"Vanguard Group Inc. Acquires 448,554 Shares of AbbVie Inc. $ABBV"
MRK,2026-02-16,0.8944819774478674,positive,news,ASCO GU 2026: Merck and Protara Poised to Disrupt Bladder and Kidney Cancer Standards
MRK,2026-02-16,0.8332311641424894,positive,news,Gilead strikes $1.5 billion cancer pact with Genhouse Bio
MRK,2026-02-16,0.27994486689567566,positive,news,"Aberdeen Group plc Sells 52,247 Shares of Regeneron Pharmaceuticals, Inc. $REGN"
MDT,2026-02-19,-0.9304334167391062,negative,news,"Vanguard Group Inc. Lowers Holdings in General Mills, Inc. $GIS"
MDT,2026-02-19,-0.6948358565568924,negative,news,Beta Bionics (BBNX) Revenue Growth Outpaces Persistent Losses And Tests Bullish Narratives
MDT,2026-02-18,0.6735853105783463,positive,news,Medtronic PLC (NYSE:MDT) Margin Contracts
MDT,2026-02-18,0.9106869334354997,positive,news,Medtronic nets FDA clearance for robotic spine system
MDT,2026-02-18,-0.660400003194809,negative,news,JPMorgan Chase & Co. Cuts Medtronic (NYSE:MDT) Price Target to $100.00
MDT,2026-02-18,-0.9179502334445715,negative,news,Medtronic Analysts Cut Their Forecasts After Q3 Earnings
MDT,2026-02-18,0.9392973184585571,positive,news,Medtronic plc (NYSE:MDT) Q3 2026 Earnings Call Transcript
MDT,2026-02-18,0.044777631759643555,positive,news,"Leerink Partners Adjusts Price Target on Medtronic to $119 From $120, Maintains Outperform Rating"
MDT,2026-02-18,-0.06462044082581997,neutral,news,"Here Are Wednesday’s Top Wall Street Analyst Research Calls: Cadence Design, Crox, Genuine Parts, Kratos Defense, Medtronic, Palantir, StubHub, Transocean, and More"
MDT,2026-02-18,-0.352846659719944,negative,news,"JPMorgan Adjusts Price Target on Medtronic to $100 From $105, Maintains Neutral Rating"
MDT,2026-02-18,-0.7662025764584541,negative,news,Medtronic’s Q3 2026 revenues reach $9bn on strong PFA demand
MDT,2026-02-18,-0.9405312649905682,negative,news,Medtronic plc Q3 FY2026 Earnings: Revenue Hits $9.0B With Highest Enterprise Growth in 10 Quarters
MDT,2026-02-18,-0.02618575096130371,negative,news,Haemonetics Corporation $HAE Stock Holdings Lessened by Heartland Advisors Inc.
MDT,2026-02-18,0.7672941260971129,positive,news,Cardiovascular Devices Market Booming Rapidly from 2026 to 2033
MDT,2026-02-18,-0.8450641632080078,negative,news,"Natera, Inc. $NTRA Shares Sold by Eagle Health Investments LP"
MDT,2026-02-18,0.9335256982594728,positive,news,AtriCure reports surprise Q4 profit on strong worldwide revenue growth
MDT,2026-02-18,0.676045567728579,positive,news,Medtronic earns FDA clearance for Stealth AXiS spinal surgery system
MDT,2026-02-17,0.9234851812943816,positive,news,Medtronic completes first Hugo case in the US
MDT,2026-02-17,0.9191173575818539,positive,news,"Medtronic's ""Textbook"" Reversal: How High Can It Really Go in 2026?"
MDT,2026-02-17,0.9290120387449861,positive,news,Medtronic completes first U.S. cases with Hugo
MDT,2026-02-17,0.923433474265039,positive,news,Medtronic gets FDA nod for Infuse bone graft in TLIF procedures
MDT,2026-02-17,0.8139094272628427,positive,news,Medtronic Announces FDA approval of Infuse™ bone graft for one-and-two level Transforaminal Lumbar Interbody Fusion (TLIF) spine procedures
MDT,2026-02-17,-0.02683258056640625,negative,news,"Medtronic Q3 FY26 slides reveal strongest revenue growth in 10 quarters, stock dips"
MDT,2026-02-17,0.5080914674326777,positive,news,Medtronic announces first surgery with Hugo™ robotic-assisted surgery system in the U.S. performed at Cleveland Clinic
MDT,2026-02-17,0.9464121740311384,positive,news,Medtronic tops Q3 forecasts with strongest revenue growth in 10 quarters
MDT,2026-02-17,-0.6684431880712509,negative,news,"Earnings live: eToro surges after Q4 profit beat, Medtronic stumbles, DTE Energy pops"
MDT,2026-02-17,0.14118346571922302,neutral,news,"Palo Alto, Opendoor, Carvana And More Stocks With Earnings This Week"
MDT,2026-02-17,0.17249643802642822,positive,news,"MDT Stock Up on Q3 Earnings and Revenue Beat, Margins Down"
MDT,2026-02-17,0.9271495342254639,positive,news,Medtronic Q3 2026 adjusted earnings beat estimates; revenue up 8.7%
MDT,2026-02-17,-0.6626667976379395,negative,news,W.G. Shaheen & Associates DBA Whitney & Co Has $3.14 Million Stock Holdings in Medtronic PLC $MDT
MDT,2026-02-17,-0.9580935202538967,negative,news,"Palo Alto, General Mills and Medtronic fall premarket; Norwegian Cruise Line rises"
MDT,2026-02-17,0.927731104195118,positive,news,"Vanguard Group Inc. Increases Stock Position in Becton, Dickinson and Company $BDX"
MDT,2026-02-17,-0.5550169199705124,negative,news,Danaher reportedy nears $10B deal to buy Masimo
MDT,2026-02-17,-0.938343858346343,negative,news,Medtronic slides after Q3 results on outlook (MDT:NYSE)
MDT,2026-02-17,0.6723413690924644,positive,news,Medtronic: Fiscal Q3 Earnings Snapshot
MDT,2026-02-17,0.8216377943754196,positive,news,Medtronic beats Q3 expectations with highest revenue growth in 10 quarters
MDT,2026-02-17,-0.9328457601368427,negative,news,"(MDT) Medtronic Expects Fiscal 2026 Adjusted EPS Range $5.62 to $5.66, vs. FactSet Est of $5.72"
MDT,2026-02-17,0.05924779176712036,positive,news,Sunoco LP (SUN) Misses Q4 EPS by 143c
MDT,2026-02-17,0.7077700551599264,positive,news,Medtronic announces first surgery with Hugo™ robotic-assisted surgery system in the U.S. performed at Cleveland Clinic
MDT,2026-02-17,0.9377599637955427,positive,news,Medtronic Reports Strong Q3 Fiscal 2026 Results
MDT,2026-02-17,0.9397375695407391,positive,news,Medtronic reports strong third quarter fiscal 2026 results with highest enterprise revenue growth in 10 quarters
MDT,2026-02-17,0.5418935772031546,positive,news,A new Medtronic surgery robot just operated on its first U.S. patient
MDT,2026-02-17,0.7073227409273386,positive,news,Medtronic announces first surgery with Hugo™ robotic-assisted surgery system in the U.S. performed at Cleveland Clinic
MDT,2026-02-17,0.8646355639211833,positive,news,Smart Hospitals Market to See Thriving Worldwide |Medtronic
MDT,2026-02-17,0.9163928618654609,positive,news,"Telemedicine & Digital Health Research Report 2026: A $180 Billion Market by 2031 from $85.5 Billion in 2025 with Teladoc Health, Amwell, Philips, Siemens Healthineers, GE, Medtronic, Oracle Leading"
MDT,2026-02-17,0.9381202403455973,positive,news,Medtronic (MDT): The Sleeping Giant Awakes with Strong Q3 FY26 Momentum
MDT,2026-02-17,0.9261444676667452,positive,news,Colrain Capital LLC Increases Stock Position in Medtronic PLC $MDT
MDT,2026-02-17,0.8491667099297047,positive,news,"Fifth Third Bancorp Purchases 11,806 Shares of Medtronic PLC $MDT"
MDT,2026-02-17,0.5513302534818649,positive,news,Will Lemonade Stock Enjoy Another Major Post-Earnings Win?
UPS,2026-02-19,-0.8580456301569939,negative,news,Is Union Pacific (UNP) Still Attractive After Recent Share Price Strength?
UPS,2026-02-18,0.155006542801857,neutral,news,J.B. Hunt Transport Services Presents at Barclays Conference
UPS,2026-02-18,0.8620462734252214,positive,news,FedEx Stock Just Flashed a Big Signal – Here’s What It Means for You
UPS,2026-02-17,0.6182251423597336,positive,news,"Werner restructures one-way truckload business, takes $44M charge"
UPS,2026-02-17,-0.017720943316817284,neutral,news,"XPO Schedules Fourth Quarter 2024 Earnings Conference Call for Thursday, February 6, 2025"
UPS,2026-02-17,0.9026814587414265,positive,news,A Look At GXO Logistics (GXO) Valuation After Q4 Beat And Upgraded Growth Guidance
UPS,2026-02-15,0.938567265868187,positive,news,"Werner Reports 10th Quarter of Higher Revenues, Earnings"
UPS,2026-02-14,0.20431052334606647,neutral,news,"Algorhythm Holdings' AI system 'dynamically' solves for 'empty' trucking miles, CEO says"
UPS,2026-02-14,0.07259033247828484,neutral,news,TravelCenters of America Opens Nominations for Citizen Driver Award
UPS,2026-02-14,0.9350254647433758,positive,news,"Innovative Solutions and Support, Inc. (NASDAQ:ISSC) Q1 2026 Earnings Call Transcript"
