ticker,date,sentiment_score,sentiment_label,content_type,title
MMM,2026-05-24,0.9369818139821291,positive,news,Catalyst Funds Management Pty Ltd Increases Stake in 3M Company $MMM
MMM,2026-05-23,0.5798937529325485,positive,news,AFFILIATE OF PHOENIX INVESTORS SELLS MEMPHIS X-AI DATA CENTER TO SUBSIDIARY OF SPACEX FOR $185 MILLION
MMM,2026-05-23,-0.21030527353286743,negative,news,Associated Banc Corp Trims Stake in Lam Research Corporation $LRCX
MMM,2026-05-23,0.9326311871409416,positive,news,3M India announces special dividend of ₹506/share; posts blockbuster Q4 results 2026 - Check details
MMM,2026-05-22,0.29671110585331917,neutral,news,"3M Company stock (US88579Y1010): dividend reset, spin-off overhang and legal risks keep investors al"
MMM,2026-05-22,0.927819887176156,positive,news,3M India sees Q4 net profit grow 201% at ₹215 cr as company records double-digit growth in all segments
MMM,2026-05-22,0.719306442886591,positive,news,Global Road Marking Paints & Coatings Market Outlook 2036: India and China Dominate Growth While 3M Company and PPG Traffic Solutions Lead Innovation
MMM,2026-05-22,0.7106668557971716,positive,news,Global Road Marking Paints & Coatings Market Outlook 2036: India and China Dominate Growth While 3M Company and PPG Traffic Solutions Lead Innovation
MMM,2026-05-22,0.9366994984447956,positive,news,3M Company stock (US88579Y1010): Shares edge higher after latest earnings update
MMM,2026-05-22,-0.014747446402907372,neutral,news,BMO News | BANK OF MONTREAL (NYSE:BMO)
MMM,2026-05-22,-0.780495248734951,negative,news,Diamond Hill Capital Management Inc. Has $316.14 Million Position in Labcorp Holdings Inc. $LH
MMM,2026-05-22,0.9416212253272533,positive,news,Handelsbanken Fonder AB Increases Position in Labcorp Holdings Inc. $LH
MMM,2026-05-22,0.9324319325387478,positive,news,Gamco Investors INC. ET AL Boosts Position in Viasat Inc. $VSAT
MMM,2026-05-22,0.5583109008148313,positive,news,3M Company stock (US88579Y1010): New filing points to a fresh insider sale
MMM,2026-05-21,0.9304837444797158,positive,news,Did 3M’s (MMM) AI Data Center Optics Push Just Shift Its Investment Narrative?
MMM,2026-05-21,0.1884555798023939,neutral,news,Minneapolis firm Graco to acquire Greater Cincinnati-based manufacturer for $447M
MMM,2026-05-21,0.0037015192210674286,neutral,news,ETFs Investing in 3M Company Stocks
MMM,2026-05-21,0.937150377780199,positive,news,Honeywell International Inc Stock (HON) Moved Up by 3.35% on May 21: What Investors Need To Know
MMM,2026-05-21,0.9323939066380262,positive,news,Neogen Corp stock (US6404911066): share jumps after strong quarterly update and integration progress
MMM,2026-05-21,0.3465515123680234,neutral,news,3M Company stock (US88579Y1010): Spin-off of Solventum reshapes the conglomerate
MMM,2026-05-21,0.5544829964637756,positive,news,"Tensor Edge Capital LLC Purchases Shares of 150,000 PTC Inc. $PTC"
MMM,2026-05-21,0.9224979123100638,positive,news,"922 Shares in Comfort Systems USA, Inc. $FIX Acquired by Mach 1 Financial Group LLC"
MMM,2026-05-21,0.8455271758139133,positive,news,Minnesota companies cash in on the AI construction boom
MMM,2026-05-21,0.9378248257562518,positive,news,Griffin Asset Management Inc. Increases Position in Qualcomm Incorporated $QCOM
MMM,2026-05-21,-0.017920538783073425,neutral,news,Rep. Josh Gottheimer Sells Off HDFC Bank Limited (NYSE:HDB) Stock
MMM,2026-05-21,-0.36052215099334717,negative,news,Enlight Renewable Energy (NasdaqGS:ENLT) Stock Forecast & Analyst Predictions
MMM,2026-05-21,0.20869892835617065,neutral,news,"Rep. Josh Gottheimer Purchases Shares of CBIZ, Inc. (NYSE:CBZ)"
MMM,2026-05-21,0.9190983334556222,positive,news,"Rep. Josh Gottheimer Buys Advanced Micro Devices, Inc. (NASDAQ:AMD) Shares"
MMM,2026-05-21,-0.44339388608932495,negative,news,Rep. Josh Gottheimer Sells Off Shares of International Business Machines Corporation (NYSE:IBM)
MMM,2026-05-21,0.9025651924312115,positive,news,MarketAxess (NASDAQ:MKTX) Stock Unloaded Rep. Josh Gottheimer
MMM,2026-05-21,0.22728227078914642,positive,news,Rep. Josh Gottheimer Sells Synchrony Financial (NYSE:SYF) Stock
MMM,2026-05-21,0.6139126271009445,positive,news,Rep. Josh Gottheimer Sells Off Shares of 3M Company (NYSE:MMM)
MMM,2026-05-21,0.9307105615735054,positive,news,"Rep. Josh Gottheimer Sells The Goldman Sachs Group, Inc. (NYSE:GS) Stock"
COP,2026-05-27,-0.723189689218998,negative,news,Chevron shareholders reject proposal that requires independent board chair separate from CEO role
COP,2026-05-27,0.8306499421596527,positive,news,ConocoPhillips Stock Trades 14% Below Its 52-Week High: Here’s the Path to $135 by 2028
COP,2026-05-27,-0.012391000986099243,neutral,news,"Update: Market Chatter: Exxon, ConocoPhillips Push for Safeguards Before Returning to Venezuela"
COP,2026-05-27,0.9344814866781235,positive,news,ICE's Total Futures and Options at Record Open Interest as Global Natural Gas and Power Markets Reach Record Levels of Liquidity
COP,2026-05-27,0.9376810379326344,positive,news,Knights of Columbus Asset Advisors LLC Raises Position in ExxonMobil Corporation $XOM
COP,2026-05-27,-0.6762311570346355,negative,news,"Bank of Montreal Sees Iran War, Impact on Oil Supply as Most Significant Risk to N Amer Economy"
COP,2026-05-27,0.5276387892663479,positive,news,"Flputnam Investment Management Co. Buys 7,254 Shares of ExxonMobil Corporation $XOM"
COP,2026-05-26,0.9032007176429033,positive,news,ConocoPhillips Weighs Syria Offshore Entry And Added Geopolitical Risk
COP,2026-05-26,0.7984467837959528,positive,news,"Exxon, ConocoPhillips seek safeguards to return to Venezuela - Bloomberg (XOM:NYSE)"
COP,2026-05-26,0.8745081387460232,positive,news,"Exxon, ConocoPhillips Seek Safeguards to Return to Venezuela"
COP,2026-05-26,0.8367114719003439,positive,news,"Exxon, ConocoPhillips seek safeguards to return to Venezuela"
COP,2026-05-26,0.8902075858786702,positive,news,"Exxon, ConocoPhillips seek safeguards to return to Venezuela"
COP,2026-05-26,-0.9679857874289155,negative,news,ConocoPhillips Stock (COP) Moved Down by 3.43% on May 26: What Investors Need To Know
COP,2026-05-26,0.9366391599178314,positive,news,ConocoPhillips' LNG Strategy Emerges as Key Long-Term Growth Driver
COP,2026-05-26,0.9359825886785984,positive,news,ConocoPhillips' LNG Strategy Emerges as Key Long-Term Growth Driver
COP,2026-05-26,0.5625652372837067,positive,news,"Exxon, ConocoPhillips Push for Safeguards Before Returning to Venezuela, Bloomberg Reports"
COP,2026-05-26,0.9131851838901639,positive,news,How Record Output And Faster Deleveraging At Kosmos Energy (KOS) Has Changed Its Investment Story
COP,2026-05-26,0.9198718210682273,positive,news,Northern Oil & Gas Reaches First Deal for Canadian Energy Assets
COP,2026-05-26,0.9315653517842293,positive,news,ConocoPhillips (COP) Rallied on Rise in Oil Prices
COP,2026-05-26,0.8982212413102388,positive,news,Wells Fargo Keeps Their Buy Rating on EOG Resources (EOG)
COP,2026-05-25,0.8801947049796581,positive,news,Oil Above $90: Is ExxonMobil a Better Buy Than ConocoPhillips?
COP,2026-05-25,0.9101269645616412,positive,news,Tenaris Invests Over CAD 300M in Ontario Pipe Production with Government Support - News and Statistics
COP,2026-05-25,0.8651696345768869,positive,news,Oil Above $90: Is ExxonMobil a Better Buy Than ConocoPhillips?
COP,2026-05-25,0.9237514669075608,positive,news,"Matador Resources: $1.14 Billion Delaware Basin Acquisition Adds 5,154 Net Acres"
COP,2026-05-25,0.9331762604415417,positive,news,Diamondback Energy (FANG) Gains from Oil Price Shocks
COP,2026-05-25,0.9101266376674175,positive,news,Is ConocoPhillips (COP) a Natural Hedge during Uncertainties?
COP,2026-05-25,0.778528705239296,positive,news,Chevron Corporation stock (US1667641005): dividend strength and energy cycle in focus after recent updates
COP,2026-05-25,0.8786252960562706,positive,news,Chevron stock (US1667641005): Q1 earnings beat as revenue missed
COP,2026-05-24,0.6987884603440762,positive,news,"It took over a decade, but NextDecade’s longshot bet to lead LNG in Texas is finally paying off"
COP,2026-05-24,0.9360083620995283,positive,news,Phillips 66 stock (US7185461040): institutional buying and refining margins keep the story in focus
COP,2026-05-24,0.6023063361644745,positive,news,Alaska LNG locks in ConocoPhillips gas for mammoth 807-mile pipeline
COP,2026-05-24,0.8721115328371525,positive,news,Assessing Permian Basin Royalty Trust (PBT) Valuation After Strong Recent Share Price Momentum
COP,2026-05-23,-0.9404168594628572,negative,news,"Brazil development bank BNDES cuts stake in Petrobras, Axia Energia, sources say"
COP,2026-05-23,0.936515555717051,positive,news,EOG Resources Doubles Buybacks To Deepen Cash Returns And Per Share Focus
COP,2026-05-23,-0.9183154571801424,negative,news,ConocoPhillips CEO sounds alarm on a growing oil problem
COP,2026-05-22,-0.9508873242884874,negative,news,Axia Energia SA
COP,2026-05-22,-0.8402036428451538,negative,news,MOS News | MOSAIC CO/THE (NYSE:MOS)
COP,2026-05-22,0.011584334075450897,neutral,news,TEL News | TE CONNECTIVITY PLC (NYSE:TEL)
COP,2026-05-22,0.9193510664626956,positive,news,WTI|W&T Offshore Inc|Price:4.430|Chg%:0.04
COP,2026-05-22,0.9326059445738792,positive,news,Why ConocoPhillips (COP) Is Still a Cash-Flow Bet Amid LNG Project Activity
COP,2026-05-22,0.6169312372803688,positive,news,ConocoPhillips plans 10 wells at Kuparuk
COP,2026-05-22,0.929068012163043,positive,news,"HighTower Advisors LLC Acquires 6,058 Shares of Phillips 66 $PSX"
COP,2026-05-22,-0.92541678622365,negative,news,Diamond Hill Capital Management Inc. Has $388.59 Million Position in ConocoPhillips $COP
COP,2026-05-22,0.935363644734025,positive,news,Suncor Energy stock (CA8672241079): oil sands giant in focus as shares rally in 2026
COP,2026-05-22,-0.9444857556372881,negative,news,Barclays keeps $100 Brent oil forecast for 2026 but risks skew higher
COP,2026-05-22,0.8706888435408473,positive,news,Three Stocks with Consistent Growth and Strong Returns Over Five Years
COP,2026-05-22,0.9147576428949833,positive,news,Glenfarne and ConocoPhillips Secure Gas Supply for Alaska LNG Phase One
COP,2026-05-22,0.00581216998398304,neutral,news,EC Stock Price and Chart — NYSE:EC
COP,2026-05-21,0.7652130797505379,positive,news,NOV declares quarterly and supplemental cash dividends
COP,2026-05-21,0.856310049071908,positive,news,Glenfarne has precedent agreement with ConocoPhillips for gas sales
CMCSA,2026-05-27,0.9413154125213623,positive,news,"Ooma, Inc. (NYSE:OOMA) Q1 2027 Earnings Call Transcript"
CMCSA,2026-05-27,0.8949648719280958,positive,news,Bleakley Financial Group LLC Has $6.97 Million Stock Position in Verizon Communications Inc. $VZ
CMCSA,2026-05-27,0.9310255516320467,positive,news,Allstate Corp Raises Holdings in Comcast Corporation $CMCSA
CMCSA,2026-05-26,0.931936951354146,positive,news,HLIT Stock Jumps As Harmonic’s Broadband Growth Story Accelerates
CMCSA,2026-05-26,0.30870219971984625,neutral,news,Comcast Business gives $20 gift cards to 100 Bella’s Bites tables May 28
CMCSA,2026-05-26,0.8989420458674431,positive,news,Star Wars’ ‘Mandalorian & Grogu’ scores $24M IMAX debut over Memorial Day
CMCSA,2026-05-26,-0.0010684765875339508,neutral,news,Fox Station Vet Patrick Paolini Named Tegna CEO As It Battles Through Nexstar Merger Litigation
CMCSA,2026-05-26,0.7472946345806122,positive,news,How Investors Are Reacting To Comcast (CMCSA) Rural Florida Broadband Push And Competitive Broadband Pressures
CMCSA,2026-05-25,0.9306283909827471,positive,news,Comcast Corp. stock (US20030N1019): solid cash flows meet streaming and broadband pressure
CMCSA,2026-05-25,0.6098159682005644,positive,news,The Trade Desk vs. Magnite: Which Tech Stock Is a Better Buy in 2026?
CMCSA,2026-05-24,-0.7869338821619749,negative,news,PLDT’s ‘butcher’ COO publicly slices telco rivals
CMCSA,2026-05-24,0.9334586197510362,positive,news,Comcast stock (US20030N1019): Q1 revenue growth and broadband trends stay in focus
CMCSA,2026-05-24,0.9349061604589224,positive,news,Comcast Corporation $CMCSA Shares Acquired by Axxcess Wealth Management LLC
CMCSA,2026-05-23,0.3238154277205467,neutral,news,"Customers slowly handing more power to AT&T, T-Mobile, and Verizon"
CMCSA,2026-05-23,-0.8085637837648392,negative,news,Here’s What Analysts Are Saying About Comcast Corporation (CMCSA)
CMCSA,2026-05-23,0.05911535024642944,neutral,news,Imax Takeover: Wall Street Speculates on Who May Bid
CMCSA,2026-05-23,-0.6982958763837814,negative,news,DIS News | WALT DISNEY CO/THE (NYSE:DIS)
CMCSA,2026-05-22,-0.9045311249792576,negative,news,"Netflix, Disney face higher costs under new Canadian content rules"
CMCSA,2026-05-22,-0.15405888855457306,neutral,news,Xfinity Customers Still Have Time to Claim a Part of Comcast's $117.5M Data Breach Settlement
CMCSA,2026-05-22,0.9319466790184379,positive,news,"Could Apple, Amazon, Or Netflix Buy IMAX? This Analyst Sees Rising M&A Appeal For The Company"
CMCSA,2026-05-22,0.9371089674532413,positive,news,Comcast stock (US20030N1019): Q1 earnings beat and dividend keep focus on core cash flow
CMCSA,2026-05-21,0.7752967840060592,positive,news,Nirvana Soul Coffee Serves Up Success with Comcast Business Technology Solutions
CMCSA,2026-05-21,0.353792960755527,neutral,news,Free $10 coffees for first 400 at San Jose's Nirvana Soul
CMCSA,2026-05-21,-0.832141637802124,negative,news,Versant Media Group Leans Into Sports And Digital As Pay TV Fades
CMCSA,2026-05-21,0.599144970998168,positive,news,Comcast Corp stock (US20030N1019): Insider share gift puts focus on ownership structure
CMCSA,2026-05-21,0.13469198346138,neutral,news,Liberty Broadband Corp stock (US5307151044): how the cable holding navigates a changing US media mar
CMCSA,2026-05-21,0.8496173769235611,positive,news,Comcast stock (US20030N1019): insider share gift draws attention to valuation and dividend
CMCSA,2026-05-21,0.31135963555425406,neutral,news,AT&T Launches Build-A-Plan: A Fully Customizable Wireless Experience Where Customers Control What They Pay for
CMCSA,2026-05-21,-0.9437765497714281,negative,news,Nexstar Asks Appeals Court To Fast-Track Its Tegna Merger Fight
CMCSA,2026-05-20,0.19577120058238506,neutral,news,Fox Corp Class B stock (US35137L2043): focus on advertising trends after latest quarterly report
CMCSA,2026-05-20,0.0808102311566472,neutral,news,"Comcast (CMCSA) chair Brian Roberts makes 202,500-share bona fide gift"
CMCSA,2026-05-20,0.8539487347006798,positive,news,AT&T Makes $19 Billion Commitment to Bring High-Speed Connectivity to California
CMCSA,2026-05-20,0.05403265077620745,neutral,news,"Comcast (CMCSA) chair Brian Roberts makes 202,500-share bona fide gift"
CMCSA,2026-05-20,0.8308271751739085,positive,news,"Reliable, High-Speed Internet from Xfinity Coming to Leon County’s Rural Communities"
CMCSA,2026-05-20,0.8324468042701483,positive,news,"Comcast brings high-speed internet to 3,300 rural Florida homes, businesses"
CMCSA,2026-05-20,0.6730378624051809,positive,news,Comcast stock (US20030N1019): dividend and latest earnings keep focus on core cable and streaming bu
CMCSA,2026-05-20,0.13923766743391752,neutral,news,"Comcast stock (US20030N1019): Dividend, conference, and Q1 backdrop in focus"
CMCSA,2026-05-20,0.8007176583632827,positive,news,Comcast Business Helps the Roaming Bean Grow From Coffee Cart to Community Anchor in Pittsburgh’s Strip District
CMCSA,2026-05-20,0.44392275158315897,neutral,news,Comcast’s Bet on Generative AI is Helping the Philadelphia Media Giant Reinvent Innovation
CMCSA,2026-05-20,0.9060370586812496,positive,news,Assessing Verizon (VZ) Valuation As Recent Performance Draws Fresh Investor Attention
CMCSA,2026-05-19,0.2472963947802782,neutral,news,How Investors May Respond To Easterly Government Properties (DEA) After Contrasting Raymond James Rating And Analyst Consensus
CMCSA,2026-05-19,0.009772028774023056,neutral,news,Comcast to Participate in Evercore Investor Conference
CMCSA,2026-05-19,0.03893402870744467,neutral,news,Comcast's Matt Strauss to join Evercore TMT conference June 2
CMCSA,2026-05-19,-0.0011267326772212982,neutral,news,Comcast Corporation (CMCSA) is attracting investor attention: Here is what you should know
CMCSA,2026-05-19,0.8201932492665946,positive,news,From coffee cart to Strip District hub: how Comcast powers Roaming Bean
CMCSA,2026-05-19,-0.9608930479735136,negative,news,Why Jim Cramer Believes Starlink Could Crush Traditional Telecom Giants Like AT&T
CMCSA,2026-05-19,0.9227738287299871,positive,news,Streaming ads get sharper: Comcast tech helps 2026 campaigns
CMCSA,2026-05-19,0.7669893484562635,positive,news,"MUSQ, The Music ETF, Launches Its First Investor Conference to a Sold-Out Advisor Audience"
PM,2026-05-27,0.928417855873704,positive,news,"Jefferies Adjusts PT on Philip Morris International to $180 From $175, Maintains Hold Rating"
PM,2026-05-27,0.12048367131501436,neutral,news,PMI to Present at the dbAccess Global Consumer Conference
PM,2026-05-26,-0.9651680625975132,negative,news,Philip Morris International Inc (PM) Stock Down 4.0% but Still Overvalued -- GF Score: 84/100
PM,2026-05-26,-0.9673449723049998,negative,news,PepsiCo Inc Stock (PEP) Closed Down by 3.27% on May 26: Drivers Behind the Movement
PM,2026-05-26,-0.9661440448835492,negative,news,Philip Morris slips 3.7% as investors reassess recent U.S. nicotine policy tailwinds
PM,2026-05-26,-0.9669798770919442,negative,news,Philip Morris International Inc Stock (PM) Moved Down by 3.00% on May 26: Key Drivers Unveiled
PM,2026-05-26,-0.8022211045026779,negative,news,Colgate-Palmolive (CL) Valuation Check After Mixed Short Term Share Price Performance
PM,2026-05-26,0.3492302466183901,neutral,news,Philip Morris International to Host Webcast of Presentation at the 2026 dbAccess Global Consumer Conference
PM,2026-05-26,0.3901415728032589,neutral,news,Philip Morris International to Host Webcast of Presentation at the 2026 dbAccess Global Consumer Conference
PM,2026-05-26,0.8767917724326253,positive,news,IQOS joins Kantar ranking of the world's 100 most valuable brands
PM,2026-05-26,0.8959231916815042,positive,news,"IQOS One of the Most Valuable Global Brands, According to Kantar’s BrandZ 2026 Ranking"
PM,2026-05-26,0.16614019218832254,neutral,news,Philip Morris International to Host Webcast of Presentation at the 2026 dbAccess Global Consumer Conference
PM,2026-05-24,0.9106199070811272,positive,news,British American Tobacco plc stock (GB0002875804): earnings reset and strategy shift keep investors watching
PM,2026-05-24,0.9375915061682463,positive,news,BofA Raises Philip Morris International (PM) Price Target by $9
PM,2026-05-24,0.9345385311171412,positive,news,BofA Raises Philip Morris International (PM) Price Target by $9
PM,2026-05-24,0.9373566750437021,positive,news,BofA Raises Philip Morris International (PM) Price Target by $9
PM,2026-05-23,0.15617936104536057,neutral,news,Philip Morris (PM) Appoints Massimo Andolina as Group CFO
PM,2026-05-23,0.1711188331246376,neutral,news,Philip Morris (PM) Appoints Massimo Andolina as Group CFO
PM,2026-05-23,0.91655801422894,positive,news,Axxcess Wealth Management LLC Boosts Stock Holdings in Philip Morris International Inc. $PM
PM,2026-05-23,0.937609669752419,positive,news,Philip Morris International Inc. $PM Shares Acquired by Associated Banc Corp
PM,2026-05-23,0.04449906386435032,neutral,news,Philip Morris International (PM) 10K Form and Latest SEC Filings 2026
PM,2026-05-23,0.9159112181514502,positive,news,Analysts Offer Insights on Consumer Goods Companies: Philip Morris (PM) and Turning Point Brands (TPB)
PM,2026-05-22,0.4639555290341377,neutral,news,Philip Morris International CFO Shift Highlights Smoke Free Growth Priorities
PM,2026-05-22,-0.6847367584705353,negative,news,Newport Trust Company LLC Lowers Position in Philip Morris International Inc. $PM
PM,2026-05-22,0.8861864041537046,positive,news,Coca-Cola or Philip Morris: Which Is the Better Short Bet Right Now?
PM,2026-05-22,0.27090352214872837,neutral,news,10 Best Low Risk Stocks to Buy in 2026
PM,2026-05-21,0.93839006498456,positive,news,Philip Morris International Inc. $PM Stock Position Boosted by Global Retirement Partners LLC
PM,2026-05-21,-0.9334823461249471,negative,news,Zyn Fights to Stay Popular in US With Rival Nicotine Pouches Luring Customers
PM,2026-05-21,0.9243222549557686,positive,news,"Trajan Wealth LLC Purchases 17,819 Shares of Philip Morris International Inc. $PM"
PM,2026-05-21,-0.9394065868109465,negative,news,"Republic Services, Inc. $RSG Shares Sold by Handelsbanken Fonder AB"
PM,2026-05-20,0.09252526611089706,neutral,news,Philip Morris appoints insider as group CFO
PM,2026-05-20,-0.9650965668261051,negative,news,Philip Morris International Inc. stock underperforms Wednesday when compared to competitors
PM,2026-05-20,0.8098076600581408,positive,news,Philip Morris International (PM) Appoints New CFO Effective August 2026
PM,2026-05-20,0.072810934856534,neutral,news,Philip Morris names insider Massimo Andolina as CFO
PM,2026-05-20,0.24622821062803268,neutral,news,Philip Morris International Announces Group CFO Succession
PM,2026-05-20,-0.006560511887073517,neutral,news,Massimo Andolina named Group CFO of Philip Morris; Emmanuel Babeau to Serve as Strategic Advisor
PM,2026-05-20,0.8289756001904607,positive,news,Philip Morris (PM) appoints Massimo Andolina as new Group CFO
PM,2026-05-20,0.09257411304861307,neutral,news,Philip Morris International Announces Group CFO Succession
PM,2026-05-20,0.11173947900533676,neutral,news,Philip Morris International Announces Group CFO Succession
PM,2026-05-20,0.5327173620462418,positive,news,PNC Financial Services Group Inc. Has $420.82 Million Stake in Philip Morris International Inc. $PM
PM,2026-05-20,0.92296661157161,positive,news,"ProShare Advisors LLC Purchases 23,142 Shares of Philip Morris International Inc. $PM"
PM,2026-05-20,0.8572918036952615,positive,news,HighTower Advisors LLC Raises Position in Philip Morris International Inc. $PM
PM,2026-05-20,0.9143509678542614,positive,news,Philip Morris International (NYSE:PM) Sets New 52-Week High - What's Next?
PM,2026-05-20,0.8913661642000079,positive,news,"Fairtree Asset Management Pty Ltd Buys Shares of 9,822 Philip Morris International Inc. $PM"
PM,2026-05-20,0.9356808494776487,positive,news,KeyBanc raises Materion stock price target to $223 on earnings beat
PM,2026-05-19,-0.955394284799695,negative,news,Resona Asset Management Co. Ltd. Decreases Stake in Philip Morris International Inc. $PM
PM,2026-05-19,0.9363632947206497,positive,news,KeyBanc raises Materion stock price target to $223 on earnings beat
PM,2026-05-19,0.9249643627554178,positive,news,Citic Securities Upgrades Philip Morris International to Buy From Add
PM,2026-05-18,-0.6291356086730957,negative,news,"Broyhill adds Microsoft, trims Philip Morris International among Q1 moves"
PM,2026-05-18,0.9306790865957737,positive,news,Broyhill Fund Adjusts Portfolio with Moves in Phillip Morris Int
DUK,2026-05-27,0.7825031420215964,positive,news,M3 Wealth Management LLC Acquires New Holdings in Duke Energy Corporation $DUK
DUK,2026-05-27,0.9150889478623867,positive,news,Harbour Investments Inc. Has $6.92 Million Stock Position in Duke Energy Corporation $DUK
DUK,2026-05-27,-0.12051437795162201,neutral,news,TVA deploys drones for power line inspections in southwest Huntsville
DUK,2026-05-27,0.38044076040387154,neutral,news,TVA considers industrial rate change to stop residential ratepayers in TVA service are from covering the cost of infrastructure upgrades and increased power generation caused by data centers
DUK,2026-05-27,0.17591752856969833,neutral,news,TVA considering rate changes to manage power grid stability amid data center discussions
DUK,2026-05-26,-0.9097179565578699,negative,news,Morgan Stanley Revises Duke Energy (DUK) Valuation Following Utility Sector Update
DUK,2026-05-26,0.8857534397393465,positive,news,"Ahead of hurricane season, Duke Energy Foundation awards $130,000 to 10 organizations advancing storm preparedness and community resiliency – Company Announcement - FT.com"
DUK,2026-05-26,0.8353744437918067,positive,news,"Ahead of hurricane season, $130K boosts Florida storm prep"
DUK,2026-05-26,0.9216262046247721,positive,news,Georgia Power deal saves customers $4.04 monthly starting in June after PSC agreement
DUK,2026-05-26,-0.07434110343456268,neutral,news,Self-employed to get lower electricity bills automatically
DUK,2026-05-26,0.8732788674533367,positive,news,Consumers Energy targets tree-related outages with expanded line-clearing
DUK,2026-05-26,0.9335169922560453,positive,news,Duke Energy Corporation $DUK Shares Bought by AlphaQuest LLC
DUK,2026-05-25,0.4059500992298126,positive,news,Legal & General Group Plc Cuts Stake in Duke Energy Corporation $DUK
DUK,2026-05-25,-0.2794345021247864,negative,news,Morningstar Investment Management LLC Trims Position in Duke Energy Corporation $DUK
DUK,2026-05-25,0.9256667532026768,positive,news,"NextEra + Dominion: Great Future, But Way Too Early To Buy (NYSE:NEE)"
DUK,2026-05-24,0.10955027304589748,neutral,news,After Years of Watching Volatility Spikes These Are the 3 Utility ETFs Built for Investors Who Want Income Without Sleepless Nights
DUK,2026-05-24,0.7241262421011925,positive,news,Duke Energy (DUK) Price Target Lowered by $5
DUK,2026-05-24,-0.45670975744724274,negative,news,"OLD Republic International Corp Sells 109,035 Shares of Duke Energy Corporation $DUK"
DUK,2026-05-24,0.9126659911125898,positive,news,Pathfinder Wealth Consulting Inc. Acquires New Stake in Duke Energy Corporation $DUK
DUK,2026-05-23,0.8244255036115646,positive,news,CDL’s $2.29 annual dividend beats Treasury yields despite rising interest rates
DUK,2026-05-23,0.935483779758215,positive,news,Axxcess Wealth Management LLC Has $15.55 Million Stake in Duke Energy Corporation $DUK
DUK,2026-05-23,0.18635690584778786,neutral,news,ABN Amro Investment Solutions Makes New $3.75 Million Investment in Duke Energy Corporation $DUK
