ticker,date,sentiment_score,sentiment_label,content_type,title
COF,2026-02-07,0.3221698496490717,neutral,news,10 Best Financial Stocks to Buy for the Long Term
COF,2026-02-07,-0.9281129576265812,negative,news,State of Michigan Retirement System Lowers Stock Holdings in American Express Company $AXP
COF,2026-02-07,-0.9452983997762203,negative,news,"Jim Cramer Says “I Don’t Want to Own Synchrony, I Want to Own Capital One”"
COF,2026-02-07,-0.8599577378481627,negative,news,"Jim Cramer Says ""I Don't Want to Own Synchrony, I Want to Own Capital One"""
COF,2026-02-07,0.5292309075593948,positive,news,"Jim Cramer Says “I Don’t Want to Own Synchrony, I Want to Own Capital One”"
COF,2026-02-07,-0.013313200324773788,neutral,news,Best savings account bonuses for February 2026 (and how to decide which is best for you)
COF,2026-02-07,0.9277628874406219,positive,news,The Bull Case For American Express (AXP) Could Change Following Dividend Hike And $3.5B Debt Raise
COF,2026-02-06,0.22715347073972225,neutral,news,Capital One approves 2026 executive compensation plans and updates severance policies
COF,2026-02-06,-0.7885158807039261,negative,news,"Keefe, Bruyette & Woods Cuts Golub Capital BDC (NASDAQ:GBDC) Price Target to $14.00"
COF,2026-02-06,-0.9601662121713161,negative,news,"IQ EQ FUND MANAGEMENT IRELAND Ltd Sells 7,551 Shares of American Express Company $AXP"
COF,2026-02-06,-0.7044519633054733,negative,news,Synchrony Financial Balances Mixed Q4 Results With Capital Returns Focus
COF,2026-02-06,-0.8417999893426895,negative,news,A Look At Capital One Financial (COF) Valuation After Recent Share Price Swings
COF,2026-02-06,-0.9353328123688698,negative,news,Synchrony Financial Balances Mixed Q4 Results With Capital Returns Focus
COF,2026-02-06,0.4266054928302765,positive,news,Synchrony Financial Balances Mixed Q4 Results With Capital Returns Focus
COF,2026-02-06,0.931051486171782,positive,news,Inside Bank of America’s plan for credit card growth
COF,2026-02-05,0.9381912378594279,positive,news,Capital One boosts call center results with AI
COF,2026-02-05,-0.10196739435195923,negative,news,American Express Expands UK Small Business Financing As Shares Lag Targets
COF,2026-02-05,0.3574700355529785,positive,news,A Look At Capital One Financial (COF) Valuation After Recent Share Price Swings
COF,2026-02-05,0.9165924973785877,positive,news,"Jefferies Financial Group Inc. (NYSE:JEF) Given Consensus Recommendation of ""Moderate Buy"" by Analysts"
COF,2026-02-05,0.9083761610090733,positive,news,Envestnet Asset Management Inc. Increases Stock Position in Capital One Financial Corporation $COF
COF,2026-02-05,0.07089604623615742,neutral,news,Capital One’s Karam sells $460k in stock
COF,2026-02-04,-0.7833287343382835,negative,news,Anywhere CEO Ryan Schneider Out After 8 Years
COF,2026-02-04,-0.7323678694665432,negative,news,"USAA, Regions Bank end court battle over technologies for depositing checks"
COF,2026-02-04,0.9392180126160383,positive,news,Capital One Financial Corp. (COF) Surged Following Strong Results
COF,2026-02-04,0.9325679941102862,positive,news,Robert W. Baird Keeps Their Buy Rating on Capital One Financial (COF)
COF,2026-02-04,0.9312351085245609,positive,news,Jones Financial Companies Lllp Increases Stake in Capital One Financial Corporation $COF
COF,2026-02-04,-0.9622745858505368,negative,news,Peregrine Asset Advisers Inc. Has $7.88 Million Stock Position in Capital One Financial Corporation $COF
COF,2026-02-03,0.6265355860814452,positive,news,Beyond HODL: Why the Capital One-Brex Deal Validates Black Titan’s DAT+ Vision
COF,2026-02-03,0.061717805452644825,neutral,news,"ARKO Corp. Announces Launch of Initial Public Offering of its Subsidiary, ARKO Petroleum Corp., Seeking to Raise Approximately $200,000,000"
COF,2026-02-03,0.04166992474347353,neutral,news,ARKO Corp. subsidiary launches IPO roadshow to raise $200 million By Investing.com
DHR,2026-02-12,-0.18605279922485352,negative,news,Wealthfront Advisers LLC Has $8.10 Million Stock Holdings in Danaher Corporation $DHR
DHR,2026-02-12,-0.7989534065127373,negative,news,There May Be Some Bright Spots In Bio-Techne's (NASDAQ:TECH) Earnings
DHR,2026-02-12,-0.5158291757106781,negative,news,RFG Advisory LLC Has $1.20 Million Stake in Danaher Corporation $DHR
DHR,2026-02-12,0.9396179784089327,positive,news,Danaher's Upbeat Outlook Bolsters Investor Confidence
DHR,2026-02-11,0.7266554054804146,positive,news,This Diagnostic Company Is Rapidly Expanding in Emerging Markets: What to Know
DHR,2026-02-11,-0.06044340133666992,negative,news,Water Powerhouse at a Crossroads: A Deep Dive into Xylem Inc (XYL) in 2026
DHR,2026-02-11,-0.5376734584569931,negative,news,Water Powerhouse at a Crossroads: A Deep Dive into Xylem Inc (XYL) in 2026
DHR,2026-02-11,-0.9310883972793818,negative,news,Madison Asset Management LLC Lowers Holdings in Danaher Corporation $DHR
DHR,2026-02-11,0.9334205761551857,positive,news,"ING Groep NV Buys 206,976 Shares of Danaher Corporation $DHR"
DHR,2026-02-11,-0.8980371877551079,negative,news,Impax Asset Management Group plc Reduces Holdings in Danaher Corporation $DHR
DHR,2026-02-11,-0.5601956248283386,negative,news,Danaher Corporation $DHR Shares Sold by First National Trust Co
DHR,2026-02-11,0.9368059076368809,positive,news,Do Wall Street Analysts Like Danaher Stock?
DHR,2026-02-11,0.0035078711807727814,neutral,news,The Technical Signals Behind (DHR) That Institutions Follow
DHR,2026-02-11,-0.7181787490844727,negative,news,5 Insightful Analyst Questions From Veralto's Q4 Earnings Call
DHR,2026-02-10,-0.9138043317943811,negative,news,Danaher announces retirement of board member Jessica L. Mega By Investing.com
DHR,2026-02-10,-0.9255946790799499,negative,news,Danaher announces retirement of board member Jessica L. Mega
DHR,2026-02-10,-0.9109236057847738,negative,news,Danaher Announces Retirement of Board Member Jessica Mega
DHR,2026-02-10,-0.9553898591548204,negative,news,Thermo Fisher Scientific stock slides as $3.8 billion bond deal lands — what to watch next
DHR,2026-02-10,0.3057337310165167,neutral,news,Molecular Devices and Automata partner to connect lab instruments end-to-end
DHR,2026-02-10,0.9016913981176913,positive,news,"Automata raises $45M to scale lab automation platform, adds Danaher as strategic investor"
DHR,2026-02-10,0.9290960188955069,positive,news,Becton Dickinson Refocuses On Medtech After Waters Spin Off And Buyback
DHR,2026-02-10,0.8688839832320809,positive,news,Revvity Expands Automation Platforms At SLAS2026 As Investors Weigh Long Term Upside
DHR,2026-02-10,-0.8881001062691212,negative,news,"Federated Hermes Inc. Has $195,000 Stake in Fortive Corporation $FTV"
DHR,2026-02-10,-0.8858030438423157,negative,news,Applied Finance Capital Management LLC Reduces Stock Position in Danaher Corporation $DHR
DHR,2026-02-10,0.921510967426002,positive,news,Johnson Investment Counsel Inc. Grows Holdings in Danaher Corporation $DHR
DHR,2026-02-10,-0.9337842464447021,negative,news,Danaher Corporation $DHR Holdings Trimmed by Foresight Group Ltd Liability Partnership
DHR,2026-02-09,0.1787442099303007,neutral,news,"Waters closes deal for BD biosciences/diagnostics assets, reorganizes into four divisions"
DHR,2026-02-09,0.887725374661386,positive,news,"SCIEX announces Echo® MS+ system integration with ZenoTOF 8600 system, delivering enhanced sensitivity for high-throughput screening"
DHR,2026-02-09,0.8733993847854435,positive,news,"SCIEX announces Echo® MS+ system integration with ZenoTOF 8600 system, delivering enhanced sensitivity for high-throughput screening"
DHR,2026-02-09,0.5577609445899725,positive,news,"Exosomes Market to See Thriving Worldwide | Thermo Fisher Scientific, Inc., Bio-Techne"
DHR,2026-02-09,0.936001118272543,positive,news,Danaher’s Upbeat Forecast Signals a Return to Form
DHR,2026-02-09,0.9329238422214985,positive,news,Danaher’s Upbeat Forecast Signals a Return to Form
DHR,2026-02-09,0.8531911037862301,positive,news,AMETEK Inc.: The Quiet Powerhouse Engineering the Industrial Future
DHR,2026-02-09,0.5455120084807277,positive,news,AMETEK Inc.: The Quiet Powerhouse Engineering the Industrial Future
DHR,2026-02-08,0.16606548428535461,positive,news,Thrivent Financial for Lutherans Trims Stock Position in Fortive Corporation $FTV
DHR,2026-02-07,0.0039324890822172165,neutral,news,"DHR SEC Filings - Danaher Corporation 10-K, 10-Q, 8-K Forms"
DHR,2026-02-07,-0.8360892608761787,negative,news,Taking A Fresh Look At Thermo Fisher Scientific (TMO) Valuation After Recent Share Price Weakness
DHR,2026-02-07,0.1679340898990631,positive,news,"BI Asset Management Fondsmaeglerselskab A S Sells 8,334 Shares of Danaher Corporation $DHR"
DHR,2026-02-07,0.800316259264946,positive,news,Do Danaher’s Bioprocessing Gains and Buybacks Reveal a Sharper Strategic Focus for DHR?
DHR,2026-02-07,-0.7805450260639191,negative,news,Do Danaher’s Bioprocessing Gains and Buybacks Reveal a Sharper Strategic Focus for DHR?
DHR,2026-02-06,0.922491000033915,positive,news,M.D. Sass LLC Has $72.44 Million Position in Danaher Corporation $DHR
DHR,2026-02-06,0.9309789398685098,positive,news,"Envestnet Asset Management Inc. Buys 23,690 Shares of Danaher Corporation $DHR"
DHR,2026-02-05,-0.8398575261235237,negative,news,Is Danaher (DHR) Fairly Priced After Recent Share Price Weakness?
DHR,2026-02-05,-0.9197138920426369,negative,news,Assessing Bio-Techne (TECH) Valuation After Earnings Beat And New Research Product Launches
DHR,2026-02-05,0.9088888168334961,positive,news,The Evolution of a Compounder: A Deep-Dive Into Fortive Corp (FTV)
DHR,2026-02-05,0.7167223617434502,positive,news,"Cold Chain, High Stakes: A Deep Dive into Azenta’s (AZTA) Life Sciences Transformation"
DHR,2026-02-05,0.9350501066073775,positive,news,Bessemer Group Inc. Raises Position in Danaher Corporation $DHR
DHR,2026-02-05,0.8773363293148577,positive,news,ABN AMRO Bank N.V. Makes New $7.27 Million Investment in Danaher Corporation $DHR
DHR,2026-02-04,0.9142888011410832,positive,news,Danaher Corporation (DHR): A Bull Case Theory
MMM,2026-02-12,-0.8867634758353233,negative,news,ING Groep NV Trims Stock Position in Corning Incorporated $GLW
MMM,2026-02-12,-0.9364988775923848,negative,news,Rhumbline Advisers Reduces Holdings in 3M Company $MMM
MMM,2026-02-12,0.14808928780257702,neutral,news,Madison Asset Management LLC Invests $1.53 Million in Sysco Corporation $SYY
MMM,2026-02-12,0.09758880082517862,neutral,news,Key Players in the Transformer Monitoring Market- Hitachi
MMM,2026-02-12,-0.9570051711052656,negative,news,ZoomInfo Technologies Stock Under Pressure in February: Here’s the Path to $12 by Year-End
MMM,2026-02-11,-0.896425623446703,negative,news,"Stellantis issues 'Do Not Drive' alert for 225,000 older US vehicles"
MMM,2026-02-11,-0.577243909239769,negative,news,3M stock hits 52-week high at 174.93 USD
MMM,2026-02-11,0.9238929785788059,positive,news,3M stock hits 52-week high at 174.93 USD By Investing.com
MMM,2026-02-11,-0.9593455698341131,negative,news,3M stock hits 52-week high at 174.93 USD By Investing.com
MMM,2026-02-11,0.9314655791968107,positive,news,"Wealthfront Advisers LLC Buys 2,425 Shares of Northrop Grumman Corporation $NOC"
MMM,2026-02-11,-0.9563829228281975,negative,news,Employment Weakness is Driving the Mood - Raymond James - Commentaries
MMM,2026-02-11,0.9361844314262271,positive,news,"Rockland Trust Co. Invests $1.71 Million in Motorola Solutions, Inc. $MSI"
MMM,2026-02-11,0.8374902149662375,positive,news,Protective Footwear Market size to hit $8.8 Billion by 2035 | Top
MMM,2026-02-11,0.28696181904524565,neutral,news,Flame Resistant Clothing Market Is Going to Boom | DuPont de
MMM,2026-02-11,-0.12130141258239746,negative,news,"Thrivent Financial for Lutherans Sells 17,911 Shares of Hubbell Inc $HUBB"
MMM,2026-02-11,0.9408365786075592,positive,news,STERIS Restructuring And Deals Test Earnings Strength And Dividend Resolve
MMM,2026-02-11,-0.9616197850555182,negative,news,Advisors Asset Management Inc. Reduces Holdings in Corning Incorporated $GLW
MMM,2026-02-11,-0.9559664893895388,negative,news,"With Becton Dickinson Stock Sliding, Have You Assessed The Risk?"
MMM,2026-02-10,-0.7665402367711067,negative,news,Vontier (VNT) To Report Earnings Tomorrow: Here Is What To Expect
MMM,2026-02-10,0.9368828572332859,positive,news,3 Reasons We're Fans of Chart (GTLS)
MMM,2026-02-10,0.8418064331635833,positive,news,"Envestnet Asset Management Inc. Has $54.73 Million Stock Holdings in Live Nation Entertainment, Inc. $LYV"
MMM,2026-02-10,0.01734451949596405,neutral,news,3M Co Executive Engages in Significant Stock Transactions
MMM,2026-02-10,-0.8703305404633284,negative,news,Insurers Lose Bid for Updated Settlement Data in 3M Earplug Case
MMM,2026-02-10,0.7619441812857985,positive,news,Accelerating innovation in 2026: turning digital potential into physical reality across industries
MMM,2026-02-10,0.930065305903554,positive,news,Mimaki secures 3M MCS approval
MMM,2026-02-10,0.4889047993347049,positive,news,How 3M AI Tools Accelerate How Ideas Become Products
MMM,2026-02-10,0.6444551600143313,positive,news,Allianz Asset Management GmbH Acquires New Position in Sirius XM Holdings Inc. $SIRI
MMM,2026-02-10,0.9343232782557607,positive,news,"Principal Financial Group Inc. Purchases 50,189 Shares of Hasbro, Inc. $HAS"
MMM,2026-02-10,0.9346662703901529,positive,news,Applied Finance Capital Management LLC Increases Holdings in LKQ Corporation $LKQ
MMM,2026-02-10,-0.8855854831635952,negative,news,"Applied Finance Capital Management LLC Sells 20,747 Shares of Quanta Services, Inc. $PWR"
MMM,2026-02-10,-0.7601864859461784,negative,news,"S&CO Inc. Sells 6,465 Shares of 3M Company $MMM"
MMM,2026-02-10,-0.9425439350306988,negative,news,State of Michigan Retirement System Has $6.04 Million Position in Biogen Inc. $BIIB
MMM,2026-02-09,-0.6399707943201065,negative,news,"Robert Mailloux Sells 5,274 Shares of Honeywell International (NASDAQ:HON) Stock"
MMM,2026-02-09,0.9403160382062197,positive,news,Credo Technology’s AI Advancement Strengthens Market Position
MMM,2026-02-09,0.9327632579952478,positive,news,RBC Bearings Reports 17% Jump in Quarterly Sales
MMM,2026-02-09,0.9356058808043599,positive,news,"Credo Technology Unveils Blue Heron AI Retimer, Stock Movement Expected"
MMM,2026-02-09,-0.2815763056278229,negative,news,Florida city getting millions in settlement of lawsuit against DuPont
MMM,2026-02-09,0.9325716504827142,positive,news,Profund Advisors LLC Boosts Stock Position in Franco-Nevada Corporation $FNV
MMM,2026-02-09,0.923224669881165,positive,news,"Herbalife Ltd (NYSE:HLF) Given Average Recommendation of ""Moderate Buy"" by Analysts"
MMM,2026-02-09,-0.7816200405359268,negative,news,"Allianz Asset Management GmbH Acquires 215,103 Shares of Navient Corporation $NAVI"
MMM,2026-02-09,0.4393498823046684,positive,news,Do You Believe in the Long-Term Growth Potential of Align Technology (ALGN)?
MMM,2026-02-09,-0.9541777558624744,negative,news,The Daily Chase: Newmont Wants Barrick to Fix Operations Before IPO
MMM,2026-02-09,0.9400996938347816,positive,news,Surging Silver Prices Propel First Majestic Silver's Growth
MMM,2026-02-08,0.9358911011368036,positive,news,"Mizuho Upgrades Solventum (SOLV), Cites Optimistic Dental Outlook, Acera Acquisition"
MMM,2026-02-08,0.9363306220620871,positive,news,"German American Bancorp Inc. Buys 6,813 Shares of RTX Corporation $RTX"
MMM,2026-02-08,-0.421791210770607,negative,news,"Canada Post Corp Registered Pension Plan Acquires 64,127 Shares of Comcast Corporation $CMCSA"
MMM,2026-02-08,0.9280484179034829,positive,news,"Columbia Sportswear Company (NASDAQ:COLM) Given Average Recommendation of ""Hold"" by Brokerages"
CHTR,2026-02-11,0.9286615578457713,positive,news,AMC Networks Inc. Reports Fourth Quarter and Full Year 2025 Results
CHTR,2026-02-11,0.931445880793035,positive,news,AMC Networks Inc. Reports Fourth Quarter and Full Year 2025 Results
CHTR,2026-02-11,0.4237755537033081,positive,news,Eaton (NYSE:ETN) Reaches New 52-Week High - Here's What Happened
CHTR,2026-02-11,0.9363392349332571,positive,news,Verizon (VZ) Gets Target Hike From TD Cowen on Better-Than-Expected Phone Adds
CHTR,2026-02-11,0.9394637998193502,positive,news,"T-Mobile Delivers Best-in-Class Customer Results in Q4, Translating into Durable and Profitable Financial Growth Driven By Widening Differentiation"
CHTR,2026-02-11,-0.9358522882685065,negative,news,Madison Asset Management LLC Has $84.39 Million Holdings in Liberty Broadband Corporation $LBRDK
CHTR,2026-02-11,0.6740694120526314,positive,news,Sparklight Wi‑Fi 7 designed to cut dead zones in and outside your home
CHTR,2026-02-10,0.6791895627975464,positive,news,Stifel lowers Palo Alto Networks stock price target to $200 from $225 By Investing.com
CHTR,2026-02-10,0.21812647581100464,neutral,news,Venice Beach ‘Dunk District’ and HBCU Classic anchor AT&T’s NBA All-Star push
CHTR,2026-02-10,-0.916236917488277,negative,news,Comcast settles with Entropic as battle with MaxLinear rages on
CHTR,2026-02-10,0.2823382942005992,neutral,news,Milestone hires legal chief as it rolls out PSVT nasal spray
CHTR,2026-02-09,0.8720578998327255,positive,news,"Trump blesses Nexstar-Tegna merger, paving way for more consolidation"
CHTR,2026-02-09,0.535035103559494,positive,news,"Nexstar, Tegna shares soar after Trump puts his thumb on the scale in contentious merger"
CHTR,2026-02-08,0.7571709165349603,positive,news,AT&T Inc.: Can the Old-School Telecom Giant Reinvent Itself as a Modern Connectivity Platform?
CHTR,2026-02-07,0.8504590038210154,positive,news,AT&T Inc.: Can the Old-School Telecom Giant Reinvent Itself as a Modern Connectivity Platform?
CHTR,2026-02-07,0.9317336194217205,positive,news,"Liberty Global stock ends higher as Class B shares spike, with earnings next on deck"
CHTR,2026-02-07,0.33198703825473785,neutral,news,Analysts Offer Insights on Financial Companies: IREN (IREN) and KKR & Co (KKR)
CHTR,2026-02-07,0.9420149363577366,positive,news,Is Lumen Technologies Stock Outperforming Its Rivals?
CHTR,2026-02-06,0.5532821584492922,positive,news,Parents get $2.99 kids' smartphone as AT&T rolls out amiGO Jr. and watch
CHTR,2026-02-06,0.9203126421198249,positive,news,Cable One's New CEO Jim Holanda to Start on February 16
CHTR,2026-02-06,0.934614347293973,positive,news,BCE Inc. (NYSE:BCE) Q4 2025 Earnings Call Transcript
CHTR,2026-02-06,0.25577083230018616,positive,news,Analysts Offer Insights on Real Estate Companies: Equity Lifestyle (ELS) and Crown Castle (CCI)
CHTR,2026-02-05,-0.33213653042912483,neutral,news,Asian government’s espionage campaign breached critical infrastructure in 37 countries
CHTR,2026-02-05,0.9372202269732952,positive,news,C3is Stock Skyrockets amid Fleet Expansion and Revenue Growth
CHTR,2026-02-05,0.3443664312362671,positive,news,Clearfield Q1 2026 Earnings Call Transcript
CHTR,2026-02-04,0.29468376003205776,neutral,news,CSG Systems International Reports Fourth Quarter and Full Year 2025 Results
CHTR,2026-02-04,0.9237518720328808,positive,news,Liberty Broadband’s Quiet Rebound: Is LBRDK Turning a Corner or Just Catching Its Breath?
CHTR,2026-02-03,0.9353155456483364,positive,news,Vale’s Stock Surges as Analysts Lift Price Targets Amid Strong Q4 Performance
CHTR,2026-02-03,-0.01572665572166443,neutral,news,Analysts Have Conflicting Sentiments on These Communication Services Companies: Charter Communications (CHTR) and Opera (OPRA)
CHTR,2026-02-03,-0.48745372891426086,negative,news,Analysts Have Conflicting Sentiments on These Communication Services Companies: Charter Communications (CHTR) and Opera (OPRA)
CHTR,2026-02-03,0.6025779042392969,positive,news,"Analysts Offer Insights on Communication Services Companies: Meta Platforms (META), Charter Communications (CHTR) and Comcast (CMCSA)"
CHTR,2026-02-03,0.19051958248019218,neutral,news,"Analysts Offer Insights on Communication Services Companies: Meta Platforms (META), Charter Communications (CHTR) and Comcast (CMCSA)"
CHTR,2026-02-03,0.11608460918068886,neutral,news,"Analysts Offer Insights on Communication Services Companies: Meta Platforms (META), Charter Communications (CHTR) and Comcast (CMCSA)"
CHTR,2026-02-03,0.12784919515252113,neutral,news,"Analysts Offer Insights on Communication Services Companies: Meta Platforms (META), Charter Communications (CHTR) and Comcast (CMCSA)"
CHTR,2026-02-03,0.5347240893170238,positive,news,Ispire Technology Inc. Schedules Earnings Conference Call
CHTR,2026-02-03,0.9369662422686815,positive,news,BofA Boosts Comcast (CMCSA) Price Target Amid Media Asset Reorganization
CHTR,2026-02-03,-0.2114606648683548,negative,news,Analysts Offer Insights on Communication Services Companies: Omnicom Group (OMC) and Charter Communications (CHTR)
CHTR,2026-02-03,0.9350098501890898,positive,news,Semtech Surges with New 5G RedCap Routers Launch
CHTR,2026-02-03,0.9422223512083292,positive,news,AT&T Inc. (T): A Bull Case Theory
CHTR,2026-02-02,0.9315735967829823,positive,news,AerCap Holdings N.V. (AER): A Bull Case Theory
CHTR,2026-02-02,0.5910022687166929,positive,news,New smart belt uses AT&T network to alert caregivers when seniors fall
CHTR,2026-02-02,0.9370907302945852,positive,news,Geron Corporation Anticipates Robust RYTELO Revenue for 2026
CHTR,2026-02-02,0.935737943276763,positive,news,Investor Optimism Soars: Analysts Boost Lumentum’s Price Target
CHTR,2026-02-02,-0.9619907820597291,negative,news,Skyworks Solutions (SWKS) Traded Down in Q4. Here’s Why
CHTR,2026-02-02,0.8894072500988841,positive,news,"100,000 prepaid lines: inside LinkUp Mobile’s growth push"
CHTR,2026-02-02,-0.8708731085062027,negative,news,Comcast (CMCSA) Price Target Reduced at Scotiabank
CHTR,2026-02-02,0.019435565918684006,neutral,news,The 3 Warren Buffett Stocks Berkshire Hathaway Might Sell Next
CHTR,2026-02-02,-0.8918928168714046,negative,news,Charter Communications (CHTR) Net Margin Near 9% Tests Bearish Earnings Narrative
CHTR,2026-02-01,0.30861079692840576,positive,news,Cable One’s Roller-Coaster: Can CABO Reconnect With Growth After A Brutal Year?
CHTR,2026-02-01,0.8952415995299816,positive,news,Charter Continues to Make Modest Progress Bundling Services and Cutting Customer Losses
NEE,2026-02-12,-0.8353122174739838,negative,news,"Mitchell Capital Management Co. Trims Holdings in NextEra Energy, Inc. $NEE"
NEE,2026-02-12,-0.9507214222103357,negative,news,Utility PG&E tightens 2026 profit forecast on strong power demand By Reuters
NEE,2026-02-12,0.9227793728932738,positive,news,"Stratos Wealth Partners LTD. Buys 13,986 Shares of NextEra Energy, Inc. $NEE"
NEE,2026-02-12,0.7266750410199165,positive,news,"NextEra Energy, Inc. (NYSE:NEE) Receives Consensus Rating of ""Moderate Buy"" from Analysts"
NEE,2026-02-12,0.926761981099844,positive,news,"Caisse Des Depots ET Consignations Has $9.33 Million Stock Position in NextEra Energy, Inc. $NEE"
NEE,2026-02-12,0.9068954838439822,positive,news,"Cibc World Market Inc. Grows Stake in NextEra Energy, Inc. $NEE"
NEE,2026-02-12,-0.9600160997360945,negative,news,Cibc World Market Inc. Cuts Holdings in Algonquin Power & Utilities Corp. $AQN
NEE,2026-02-11,0.7655340265482664,positive,news,NextEra Energy Raises Euro Debentures for Long-Term Funding
NEE,2026-02-11,0.7710315138101578,positive,news,"Anthropic to Pay for Grid Upgrades, Preventing Higher Consumer Energy Bills | 2026 - News and Statistics"
NEE,2026-02-11,0.8637342676520348,positive,news,NextEra Energy Raises Euro Debentures for Long-Term Funding
NEE,2026-02-11,-0.007336720824241638,neutral,news,"Hedge Fund and Insider Trading News: Steven Cohen, Ray Dalio, Ken Griffin, Bill Ackman, Warren Buffett, Elliott Management, L1 Capital, Nextera Energy Inc (NEE), TransDigm Group Inc (TDG), and More"
NEE,2026-02-11,0.7009282764047384,positive,news,"NiSource Q4 Earnings Surpass Estimates, Revenues Increase Y/Y"
NEE,2026-02-11,0.9389639738947153,positive,news,"NiSource Q4 Earnings Surpass Estimates, Revenues Increase Y/Y"
NEE,2026-02-11,0.9379776660352945,positive,news,"NiSource Q4 Earnings Surpass Estimates, Revenues Increase Y/Y"
NEE,2026-02-11,0.9242090815678239,positive,news,"NextEra Energy Partners, LP (NYSE:NEP) Q4 2025 Earnings Call Transcript"
NEE,2026-02-11,0.9084300398826599,positive,news,$9.8 Billion Utilities ETF Is A 3% Yielding Backdoor Bet on AI’s Explosive Growth
NEE,2026-02-11,-0.7054768055677414,negative,news,"NextEra Energy, Inc. $NEE Stock Position Trimmed by Rhumbline Advisers"
NEE,2026-02-11,-0.005433632060885429,neutral,news,Nextera Energy CEO Ketchum sells $8.89 million in stock By Investing.com
NEE,2026-02-11,0.9294074522331357,positive,news,Caprock Group LLC Takes $5.97 Million Position in Duke Energy Corporation $DUK
NEE,2026-02-11,0.8524061837233603,positive,news,Fermi nets USD 500m for massive private energy campus in Texas
NEE,2026-02-11,-0.8173185586929321,negative,news,"Essex Investment Management Co. LLC Trims Stock Holdings in NextEra Energy, Inc. $NEE"
NEE,2026-02-11,0.9300673333927989,positive,news,ABC Arbitrage SA Acquires New Position in Duke Energy Corporation $DUK
NEE,2026-02-11,0.16107809636741877,neutral,news,"ING Groep NV Invests $29.52 Million in NextEra Energy, Inc. $NEE"
NEE,2026-02-11,0.9332436639815569,positive,news,NiSource Inc stock hits all-time high at 44.97 USD By Investing.com
NEE,2026-02-11,-0.278532013297081,negative,news,Nextera Energy CEO Ketchum sells $8.89 million in stock
NEE,2026-02-11,0.938630816526711,positive,news,Lee Enterprises outlines $450M digital revenue target by 2030 following $50M equity investment and interest rate reduction
NEE,2026-02-11,-0.8941462077200413,negative,news,"NextEra Energy (NYSE:NEE) CEO Sells $8,898,532.02 in Stock"
NEE,2026-02-10,0.9308202136307955,positive,news,XPLR Infrastructure Q4 2025 Earnings Call Transcript
NEE,2026-02-10,0.5078364321961999,positive,news,TVA proposes keeping Kingston coal plant running past 2027
NEE,2026-02-10,0.9266529511660337,positive,news,Uranium market gathers momentum in 2026: Sprott
