ticker,date,sentiment_score,sentiment_label,content_type,title
UPS,2026-02-14,-0.9575346494093537,negative,news,"Earnings Watch: UPS, ODFL Rise; Knight, P.A.M., Hub, Echo Fall"
UPS,2026-02-14,0.9189687836915255,positive,news,Worksport to Open AI-Integrated Strategic Distribution Center to Boost National Sales Ramp Up
UPS,2026-02-14,0.6537453550845385,positive,news,J.B. Hunt Announces Time-Sensitive Intermodal Service for Mexican Businesses
UPS,2026-02-14,0.10359414760023355,neutral,news,The Truth About ZTO Express (Cayman) Inc: Is This Chinese Delivery Giant a Sleeper Stock Win or Tota
UPS,2026-02-14,0.8831860087811947,positive,news,Armlogi Reports Q2 Fiscal 2026 Financial Results with Increased Revenue but Higher Losses
UPS,2026-02-14,0.22884643450379372,neutral,news,"UPS Stock Price, Forecast & Analysis | UNITED PARCEL SERVICE-CL B (NYSE:UPS)"
UPS,2026-02-13,-0.5284456089138985,negative,news,"UPS grounding 24 Boeing 767s for maintenance, company says"
UPS,2026-02-13,-0.5845826454460621,negative,news,"Ex-Dividend Reminder: United Parcel Service, Ryder System and Atkore"
UPS,2026-02-13,-0.8047220166772604,negative,news,Worker dies from injuries in Valero refinery fire in Oklahoma
UPS,2026-02-13,-0.9491489389911294,negative,news,Meet the Former Karaoke Company That Sank Trucking Stocks
UPS,2026-02-12,-0.9526511235162616,negative,news,Ryder Sees No 'Meaningful' Change in Freight Market in 2026
UPS,2026-02-12,-0.9459036784246564,negative,news,Teamsters Lawsuit Puts UPS Driver Buyouts And Cost Cuts In Focus
UPS,2026-02-12,0.4419850707054138,positive,news,What Does the Market Think About United Parcel Service Inc?
UPS,2026-02-12,0.8893080540001392,positive,news,FedEx targets 14% profit growth in 4-year strategy
UPS,2026-02-12,0.9252216471359134,positive,news,JD.com Expands In Europe With JoyExpress To Support Joybuy Growth
UPS,2026-02-11,-0.027168937027454376,neutral,news,This Is What Whales Are Betting On United Parcel Service
UPS,2026-02-11,-0.9054941236972809,negative,news,How a combined UP-NS railroad would alter market dynamics
UPS,2026-02-10,0.9361420087516308,positive,news,Werner at Stifel Conference: Strategic Growth Amid Market Shifts
UPS,2026-02-10,0.9193868469446898,positive,news,Saia Revenue Hits Quarterly Record As Q4 Earnings Slip
UPS,2026-02-10,0.8054530047811568,positive,news,"JD.com announces JoyExpress, a new delivery service for Europe"
UPS,2026-02-10,0.8600095734000206,positive,news,"FedEx, private equity join together for $9.2B deal"
UPS,2026-02-10,-0.9453457891941071,negative,news,"Radiant Logistics Shares Slip After Q2 Revenue Miss, EPS Beats"
UPS,2026-02-10,0.9349339120090008,positive,news,What Are Wall Street Analysts' Target Price for United Parcel Service Stock?
UPS,2026-02-09,0.9285701494663954,positive,news,A Look At GXO Logistics (GXO) Valuation After New BAE Systems And London Luton Airport Contracts
UPS,2026-02-09,0.9084358718246222,positive,news,United Parcel Service (NYSE:UPS) Has Affirmed Its Dividend Of $1.64
UPS,2026-02-09,0.9401952652260661,positive,news,"RXO, Inc. SEC 10-K Report"
UPS,2026-02-09,-0.36431047320365906,negative,news,Saia faces earnings test as investors question volume recovery By Investing.com
UPS,2026-02-09,0.4274378279224038,neutral,news,3 Ultra-High-Yield Dividend Stocks I'm Still Buying
UPS,2026-02-09,0.3420286476612091,positive,news,MetLife Slips 3% This Week: Here’s Why Analysts Still Sees $104.83 Fair Value
UPS,2026-02-09,0.9037087112665176,positive,news,Cold Chain Market to Reach US$ 919.9 Bn by 2032 as Key Players
UPS,2026-02-08,0.6360830366611481,positive,news,Assessing UPS (UPS) Valuation After Earnings Beat And Reaffirmed 2026 Outlook
UPS,2026-02-08,0.7837875145487487,positive,news,CSX Corp.: How a 19th-Century Railroad Became a 21st-Century Logistics Platform
UPS,2026-02-07,0.7376536158844829,positive,news,CSX Corp.: How a 19th-Century Railroad Became a 21st-Century Logistics Platform
UPS,2026-02-07,-0.19022563099861145,neutral,news,Změna ve vedení XPO a GXO: Brad Jacobs rezignoval na pozici předsedy představenstva
UPS,2026-02-07,0.8310432182624936,positive,news,The Truth About J.B. Hunt Transport: Why Wall Street Suddenly Cares What This Trucker Does Next
UPS,2026-02-06,-0.8136943653225899,negative,news,WERN Q4 Deep Dive: Strategic Restructuring and Dedicated Growth Take Center Stage
UPS,2026-02-06,0.9328375607728958,positive,news,"XPO Logistics, Inc. (NYSE:XPO) Q4 2025 Earnings Call Transcript"
UPS,2026-02-06,0.919621080160141,positive,news,RXO Announces Fourth-Quarter Results
UPS,2026-02-06,0.9410198256373405,positive,news,EnerSys (NYSE:ENS) Q3 2026 Earnings Call Transcript
UPS,2026-02-05,-0.9554285425692797,negative,news,"Stock Market Today: SPY, QQQ Tumble on Trio of Weak Jobs Data as Rate Cut Odds Surge"
SLB,2026-02-19,0.9192298669368029,positive,news,Oil and Gas Drilling Automation Market to Reach US$ 5.1 Billion
SLB,2026-02-19,-0.9105136636644602,negative,news,ProPetro Holding (PUMP) Q3 Loss Narrows To US$0.02 EPS And Tests Turnaround Narrative
SLB,2026-02-18,0.13811712991446257,neutral,news,Using behavioral science to unlock AI for industrial sectors
SLB,2026-02-18,0.8505774214863777,positive,news,SLB stock price rebounds as Equinor awards OneSubsea North Sea upgrade — what to watch next
SLB,2026-02-18,0.8434630110859871,positive,news,Cenovus Energy Inc. (CVE) Target Cut to C$25 on Supply-Side Risk Concerns
SLB,2026-02-18,0.939943291246891,positive,news,SLB OneSubsea wins Equinor deal to boost North Sea field recovery
SLB,2026-02-18,0.9277999754995108,positive,news,Equinor picks OneSubsea for subsea compression upgrade
SLB,2026-02-18,0.9136834209784865,positive,news,TechnipFMC declares $0.05 quarterly dividend payable in April By Investing.com
SLB,2026-02-17,0.9323215493932366,positive,news,OneSubsea Gets Gullfaks Subsea Compression Upgrade by Equinor
SLB,2026-02-17,0.9356473702937365,positive,news,SLB OneSubsea Awarded Subsea Compression Upgrade for Gullfaks Field
SLB,2026-02-17,-0.06924980878829956,negative,news,"How Investors Are Reacting To NOV (NOV) Earnings Miss, Impairments, Buybacks And Tighter M&A Focus"
SLB,2026-02-17,0.8207027805037796,positive,news,SLB Secures Offshore Drilling Agreements for Indonesia’s Tangkulo Deepwater Project
SLB,2026-02-15,-0.48803966492414474,negative,news,Is It Too Late To Consider Oceaneering International (OII) After Its Strong Multi‑Year Run?
SLB,2026-02-15,-0.6250953525304794,negative,news,A Look At SLB (SLB) Valuation After New Offshore Contracts With Mubadala Energy
SLB,2026-02-14,0.9228438716381788,positive,news,Did New Indonesia Deepwater Contracts Just Shift SLB’s (SLB) Offshore Investment Narrative?
SLB,2026-02-14,0.3564328011125326,neutral,news,Öl-Service (Oilfield Services) by Halliburton: The Quiet Backbone Powering the World’s Energy Tra
SLB,2026-02-13,0.9139027632772923,positive,news,"Eni, YPF and XRG Sign Joint Development Agreement Advancing Argentina LNG"
SLB,2026-02-13,0.9216223685070872,positive,news,SLB wins key contracts for Tangkulo gas project in Indonesia
SLB,2026-02-13,0.9018320525065064,positive,news,Multiple offshore drilling contracts for SLB
SLB,2026-02-13,0.9066122733056545,positive,news,Mubadala taps SLB for for drilling services at Andaman Sea project
SLB,2026-02-12,0.8956045708619058,positive,news,SLB wins offshore drilling contracts for Indonesian deepwater project
SLB,2026-02-12,0.5799403451383114,positive,news,Halliburton Taxes Highlight Private Participation in Mexico’s O&G
SLB,2026-02-12,-0.9455245062708855,negative,news,NOV Inc. SEC 10-K Report
SLB,2026-02-12,0.5268963491544127,positive,news,Slb awarded multiple offshore drilling contracts by Mubadala Energy for Tangkulo deepwater development in Indonesia
SLB,2026-02-12,0.823176272213459,positive,news,SLB wins integrated drilling contracts for Indonesia’s Tangkulo deepwater development
SLB,2026-02-12,0.8637061538174748,positive,news,SLB wins offshore drilling pacts for giant Asia gas development
SLB,2026-02-12,0.8578738123178482,positive,news,Slb Wins Multiple Offshore Drilling Contracts by Mubadala Energy for Tangkulo Deepwater Development in Indonesia
SLB,2026-02-12,0.8587314020842314,positive,news,SLB lines up offshore drilling work on Asian deepwater gas project
SLB,2026-02-12,0.9227180173620582,positive,news,Mubadala Hires SLB for Deepwater Drilling Services Offshore Indonesia
SLB,2026-02-12,0.9019950134679675,positive,news,SLB Awarded Multiple Offshore Drilling Contracts by Mubadala Energy for Tangkulo Deepwater Development in Indonesia
SLB,2026-02-12,0.9249329995363951,positive,news,SLB Awarded Multiple Offshore Drilling Contracts by Mubadala Energy for Tangkulo Deepwater Development in Indonesia
SLB,2026-02-12,0.9119901433587074,positive,news,SLB Awarded Multiple Offshore Drilling Contracts by Mubadala Energy for Tangkulo Deepwater Development in Indonesia
SLB,2026-02-12,0.9123174585402012,positive,news,Permian Powerhouse: Devon and Coterra’s $58 Billion Merger Reshapes the American Shale Landscape
SLB,2026-02-12,0.3980048159137368,neutral,news,AI beneath the surface: SLB and NVIDIA advance subsurface intelligence
SLB,2026-02-12,-0.881317775696516,negative,news,New York State Common Retirement Fund Cuts Position in Nabors Industries Ltd. $NBR
SLB,2026-02-12,0.9376455880701542,positive,news,"Slb stock hits 52-week high, reaching 51.69 USD By Investing.com"
SLB,2026-02-12,-0.9602201730012894,negative,news,"Stocks to Watch Wednesday Recap: Netflix, QXO, Moderna, SLB"
SLB,2026-02-11,0.9091397440060973,positive,news,Baker Hughes Agreements Highlight Shift Toward Storage And Low Carbon Projects
SLB,2026-02-11,0.9376170746982098,positive,news,Cost Cuts Power Halliburton's Big Run
SLB,2026-02-11,0.9396630432456732,positive,news,Record 2025 output and reserves highlight Petrobras (NYSE: PBR) pre-salt strength
SLB,2026-02-11,-0.20020386576652527,negative,news,SLB Wins Major Middle East Deals While Trading Below Estimated Fair Value
SLB,2026-02-11,0.9297861270606518,positive,news,SLB Rises in Rank Among Top U.S. Patent Holders
SLB,2026-02-11,0.9204377811402082,positive,news,Texas Instruments stock hits all-time high at $228.87 By Investing.com
SLB,2026-02-11,0.9217324610799551,positive,news,Texas Instruments stock hits all-time high at $228.87 By Investing.com
SLB,2026-02-11,0.648258313536644,positive,news,"Stocks to Watch Wednesday: Netflix, QXO, Moderna, SLB -- WSJ"
SLB,2026-02-11,0.7312582656741142,positive,news,"Slb stock hits 52-week high, reaching 51.69 USD"
SLB,2026-02-11,0.9143409989774227,positive,news,Cost Cuts Power Halliburton's Big Run
SLB,2026-02-11,-0.9659035317599773,negative,news,"Stocks to Watch Wednesday: Warner/Netflix, Moderna, SLB"
SLB,2026-02-11,0.022437764331698418,neutral,news,Understanding the Setup: (SLB) and Scalable Risk
SLB,2026-02-10,0.2996194399893284,neutral,news,"SLB Ltd Options Spot-On: On February 10th, 444.13K Contracts Were Traded, With 830.51K Open Interest"
OXY,2026-02-19,0.8041721805930138,positive,news,Occidental Stock Jumps 6% After Earnings. It’s Not Just About Oil Prices.
OXY,2026-02-19,0.2600452359765768,neutral,news,"Occidental Commences Up to $700M Tender Offers for Select Notes, $58M Sub‑Cap on 2036 Zero Coupon"
OXY,2026-02-19,0.7942371368408203,positive,news,Technical Breakout Setup for Occidental Petroleum Corp (NYSE:OXY)
OXY,2026-02-19,0.9149649199098349,positive,news,"CVNA, FIG, DASH, OXY, RXT: 5 Trending Stocks Today - Carvana (NYSE:CVNA)"
OXY,2026-02-19,0.9314462784677744,positive,news,Occidental Petroleum Releases Q4 2025 Financial Results
OXY,2026-02-18,0.9291743263602257,positive,news,Occidental Petroleum Beats Q4 Earnings Estimates By 67%
OXY,2026-02-18,0.9305288884788752,positive,news,Occidental Petroleum Beats Q4 Earnings Estimates By 67%
OXY,2026-02-18,-0.7553620114922523,negative,news,Occidental: Q4 Earnings Snapshot
OXY,2026-02-18,0.9354869090020657,positive,news,Shale producer Occidental Petroleum beats quarterly profit estimates
OXY,2026-02-18,0.6236474215984344,positive,news,Occidental earnings up next as oil recovery meets lower estimates
OXY,2026-02-18,0.9320376329123974,positive,news,Western Midstream earnings up next: Can revenue meet lofty targets?
OXY,2026-02-18,-0.888656347990036,negative,news,Susquehanna Lowers Occidental Petroleum (OXY) PT Amid Near-Term Oil Oversupply Concerns
OXY,2026-02-18,-0.9455269109457731,negative,news,Susquehanna Lowers Occidental Petroleum (OXY) PT Amid Near-Term Oil Oversupply Concerns
OXY,2026-02-18,-0.9482907950878143,negative,news,Susquehanna Lowers Occidental Petroleum (OXY) PT Amid Near-Term Oil Oversupply Concerns
OXY,2026-02-17,0.008513037115335464,neutral,news,"Occidental earnings, FOMC minutes, housing data: What to Watch"
OXY,2026-02-17,0.8708611046895385,positive,news,Why Energy Stocks Are Rallying While Oil Prices Stall
OXY,2026-02-17,0.9134871494024992,positive,news,Occidental Petroleum Rose 6% in the Last 30 Days. Here’s How Much the Stock Could Rise in 2026
OXY,2026-02-17,0.9308847114443779,positive,news,Wells Fargo Maintains Hold on Enterprise Products Partners (EPD) Shares
OXY,2026-02-16,0.046930739656090736,neutral,news,"Energy Brief: Earnings, Rates, Solar, Global Energy Moves"
OXY,2026-02-16,0.927028700709343,positive,news,COTERRA ENERGY INC (NYSE:CTRA) Emerges as a Prime GARP Selection
OXY,2026-02-16,-0.9120229743421078,negative,news,Should You Buy Occidental Petroleum Stock Before Feb. 18?
OXY,2026-02-16,-0.6491181552410126,negative,news,Should You Buy Occidental Petroleum Stock Before Feb. 18?
OXY,2026-02-16,-0.6891253739595413,negative,news,Occidental Petroleum Earnings Report Preview
OXY,2026-02-15,0.8780528111383319,positive,news,Devon Energy Coterra Merger Redefines Scale And Capital Returns Potential
OXY,2026-02-15,0.4787976434454322,neutral,news,Devon Energy Coterra Merger Redefines Scale And Capital Returns Potential
OXY,2026-02-15,0.09331878274679184,neutral,news,Occidental Petroleum Stock Is Going Off – But Is OXY Actually Worth Your Money?
OXY,2026-02-14,-0.0005574915558099747,neutral,news,Chevron Corp (NY: CVX
OXY,2026-02-14,-0.8687086291611195,negative,news,"Occidental Set to Release Q4 Earnings: Buy, Hold or Sell the Stock?"
OXY,2026-02-14,-0.9580454537644982,negative,news,Weekly Market Update: Stocks Down as Utilities Rise and Financial Services Fall
OXY,2026-02-13,-0.9197903964668512,negative,news,"Gas Prices Slip as LNG Growth Story Stays Intact, FCG ETF Faces Short-Term Pressure"
OXY,2026-02-13,-0.6469357460737228,negative,news,"Gas Prices Slip as LNG Growth Story Stays Intact, FCG ETF Faces Short-Term Pressure"
OXY,2026-02-13,-0.9576670620590448,negative,news,Occidental Petroleum (OXY) stock edges lower in premarket after sharp drop as oil stays in focus
OXY,2026-02-13,0.9016225589439273,positive,news,"Cibc World Market Inc. Acquires 64,632 Shares of Occidental Petroleum Corporation $OXY"
OXY,2026-02-12,-0.2436780482530594,negative,news,'Jaw-dropping' deep-sea oil find sparks global anxiety
OXY,2026-02-12,0.040781253948807716,neutral,news,Oxy Finding 59% Oil Weighting in Northern Midland Barnett—Analysis
OXY,2026-02-12,0.8931083222851157,positive,news,Occidental Refocuses On Upstream Efficiency And Debt After OxyChem Sale
OXY,2026-02-12,-0.961719342507422,negative,news,Occidental (OXY) Q4 Earnings on the Horizon: Analysts' Insights on Key Performance Measures
OXY,2026-02-12,0.8565378859639168,positive,news,DT Midstream (DTM) Earnings Expected to Grow: What to Know Ahead of Next Week's Release
OXY,2026-02-12,0.9217973975464702,positive,news,"ADNOC’s XRG, Argentina’s YPF, Italty’s Eni sign agreement for liquefied gas project"
OXY,2026-02-12,0.8444150323048234,positive,news,What Makes Atlas Energy Solutions (AESI) an Investment Bet?
OXY,2026-02-11,0.46253444999456406,neutral,news,"Martin Marietta Appoints George F. Schoen as Executive Vice President, General Counsel and Corporate Secretary"
OXY,2026-02-11,0.23484967648983002,neutral,news,Lawyer who advised on Disney–Fox deal to head Martin Marietta legal
OXY,2026-02-11,-0.9552234197035432,negative,news,Earnings Preview: Occidental Petroleum (OXY) Q4 Earnings Expected to Decline
OXY,2026-02-11,0.04030108451843262,neutral,news,Occidental Petroleum (OXY) to Release Earnings on Wednesday
OXY,2026-02-11,-0.35175827145576477,negative,news,Assessing Weyerhaeuser (WY) Valuation After Q4 Earnings And Share Buyback Update
OXY,2026-02-11,0.9334083646535873,positive,news,"Northern Oil and Gas reports Q4 hedging gains, record ground game deals"
OXY,2026-02-09,0.9266488589346409,positive,news,Energy compressor Natural Gas Services holds $0.11 quarterly payout
OXY,2026-02-09,0.31997417472302914,neutral,news,"CTRA Stock Price, Forecast & Analysis | COTERRA ENERGY INC (NYSE:CTRA)"
OXY,2026-02-08,0.9328163377940655,positive,news,Canada Post Corp Registered Pension Plan Boosts Stake in Occidental Petroleum Corporation $OXY
OXY,2026-02-08,0.933958625420928,positive,news,Piper Sandler and BofA Raise Occidental (OXY) Price Targets
PG,2026-02-19,-0.8908606618642807,negative,news,"King Luther Capital Management Corp Sells 8,178 Shares of Procter & Gamble Company (The) $PG"
PG,2026-02-19,0.8540266463533044,positive,news,"Alberta Investment Management Corp Acquires 6,700 Shares of Procter & Gamble Company (The) $PG"
PG,2026-02-19,0.9355943575501442,positive,news,Procter & Gamble Seeks Growth Catalyst with Packaging-Free Laundry Innovation
PG,2026-02-18,0.5911048352718353,positive,news,"Tide thinks it's unlocked the future of the $25 billion laundry industry. Meet the evo tile, a waterless detergent pod"
PG,2026-02-18,0.8046522550284863,positive,news,Innventure Issues Statement on Commonwealth Asset Management Schedule 13D and Reiterates Commitment to Value Creation Strategy
PG,2026-02-18,0.7531690206378698,positive,news,Tide Unveils New Type Of Detergent: 'Significant Leap Into The Future'
PG,2026-02-18,0.800524836871773,positive,news,New snack bar wrapper packs in over 30% recycled plastic content
PG,2026-02-18,0.8012042045593262,positive,news,CenterBook Partners LP Makes New $6.60 Million Investment in Procter & Gamble Company (The) $PG
PG,2026-02-18,-0.9087944142520428,negative,news,First National Bank of Omaha Makes New Investment in Procter & Gamble Company (The) $PG
PG,2026-02-18,-0.0028926432132720947,negative,news,"Berenberg cuts Unilever rating after Q4 beat, says turnaround already priced in"
PG,2026-02-18,0.9410762302577496,positive,news,Drucker Wealth 3.0 LLC Boosts Stock Position in Procter & Gamble Company (The) $PG
PG,2026-02-18,-0.8407028615474701,negative,news,Procter & Gamble Company (The) $PG Shares Sold by M&G PLC
PG,2026-02-18,0.2999204434454441,neutral,news,"Tide Unveils World-First Laundry Breakthrough: Introducing Tide evo, the Fiber-Detergent Tile"
PG,2026-02-17,-0.5572484284639359,negative,news,Medifast's (NYSE:MED) Q4 CY2025 Sales Top Estimates
PG,2026-02-17,0.053687949664890766,neutral,news,Investors heavily search Procter & Gamble Company (The) (PG): Here is what you need to know
PG,2026-02-17,-0.9648377834819257,negative,news,What's Going On With Algorhythm Stock Tuesday?
PG,2026-02-17,0.06442936044186354,neutral,news,25 Newly Overvalued Stocks this Week
PG,2026-02-17,0.8743867524899542,positive,news,Can Digital Retail & E-Commerce Boost Procter & Gamble's Volume?
PG,2026-02-17,0.37425628304481506,positive,news,"Insider Selling: Procter & Gamble (NYSE:PG) Insider Sells $2,461,625.32 in Stock"
PG,2026-02-17,0.8965595066547394,positive,news,"Rep. Gilbert Ray Cisneros, Jr. Sells Procter & Gamble Company (The) (NYSE:PG) Shares"
PG,2026-02-17,0.5570321083068848,positive,news,Inside P&G’s waterless version of Tide detergent
PG,2026-02-17,0.9268987867981195,positive,news,"Algorhythm Holdings Defines the “SemiCab Vision” — A Smarter, Connected Freight Network Built for the AI Era"
PG,2026-02-17,0.9210116099566221,positive,news,Investors Heavily Search Procter & Gamble Company (The) (PG): Here is What You Need to Know
PG,2026-02-17,-0.9621765529736876,negative,news,"General Mills cuts annual sales, profit forecasts as weak consumer spending hits demand"
PG,2026-02-17,0.6771886060014367,positive,news,Procter & Gamble Company (The) $PG Shares Acquired by NEOS Investment Management LLC
PG,2026-02-17,0.083777517080307,neutral,news,What Procter & Gamble (PG)'s Executive Stock Sales After Mixed Earnings Mean For Shareholders
PG,2026-02-17,0.9333349075168371,positive,news,Cardano Risk Management B.V. Boosts Stock Holdings in Procter & Gamble Company (The) $PG
PG,2026-02-17,0.9339126907289028,positive,news,Short Interest in Procter & Gamble Company (The) (NYSE:PG) Expands By 23.3%
PG,2026-02-16,0.1423822771757841,neutral,news,Virginie Helias: How P&G Champions Healthcare Sustainability
PG,2026-02-16,0.6075523691251874,positive,news,Virginie Helias: Community Impact at Procter & Gamble
PG,2026-02-16,0.7285777144134045,positive,news,Vanguard Group Inc. Boosts Stock Holdings in Procter & Gamble Company (The) $PG
PG,2026-02-16,-0.889152105897665,negative,news,"Fifth Third Bancorp Sells 15,275 Shares of Procter & Gamble Company (The) $PG"
PG,2026-02-15,0.9385971836745739,positive,news,Procter & Gamble Company (The) $PG Shares Purchased by State of New Jersey Common Pension Fund D
PG,2026-02-15,-0.9182053301483393,negative,news,"Shell Asset Management Co. Sells 19,334 Shares of Procter & Gamble Company (The) $PG"
PG,2026-02-15,0.9286552900448442,positive,news,Procter & Gamble Company (The) $PG Stake Boosted by PNC Financial Services Group Inc.
PG,2026-02-15,0.9366799090057611,positive,news,"HighTower Advisors LLC Buys 49,983 Shares of Procter & Gamble Company (The) $PG"
PG,2026-02-15,0.17392351478338242,neutral,news,Fortune Brands CEO Shift Puts Cost Cuts And Margins In Focus
PG,2026-02-15,-0.9534849775955081,negative,news,Aberdeen Group plc Decreases Stock Position in Procter & Gamble Company (The) $PG
PG,2026-02-15,-0.9469353277236223,negative,news,Procter & Gamble Company (The) $PG Shares Sold by ABN Amro Investment Solutions
PG,2026-02-15,-0.9656987870112062,negative,news,Procter & Gamble stock price: PG shares slip as Italy ad probe and insider sale set up a key week
PG,2026-02-14,-0.8664856031537056,negative,news,Can Clorox (CLX) Sustain Its Transformation While Raising Dividends and Integrating Purell?
PG,2026-02-14,-0.9431838635355234,negative,news,"Proctor (PG)'s a Machine Despite Slow Growth, Says Jim Cramer"
PG,2026-02-14,0.9190915804356337,positive,news,"Proctor (PG)’s a Machine Despite Slow Growth, Says Jim Cramer"
PG,2026-02-14,0.9328123088926077,positive,news,BTC Capital Management Inc. Raises Stock Holdings in Procter & Gamble Company (The) $PG
PG,2026-02-14,0.4009724948555231,neutral,news,The Truth About Procter & Gamble Co: Is This Everyday Giant Still Worth Your Money?
PG,2026-02-13,-0.7241103872656822,negative,news,"Insider Selling: Procter & Gamble (NYSE:PG) CEO Sells 36,093 Shares of Stock"
PG,2026-02-13,-0.5386226326227188,negative,news,"Coombe, Procter & Gamble CEO - grooming, sells $5.86m in PG stock"
PG,2026-02-13,0.9333185218274593,positive,news,Suzano S.A. Just Missed Earnings - But Analysts Have Updated Their Models
PG,2026-02-13,-0.9510500421747565,negative,news,CENTRAL TRUST Co Decreases Position in Procter & Gamble Company (The) $PG
PG,2026-02-13,-0.9056131467223167,negative,news,Assetmark Inc. Reduces Position in Procter & Gamble Company (The) $PG
EL,2026-02-17,-0.9556084098294377,negative,news,Herbalife (HLF) To Report Earnings Tomorrow: Here Is What To Expect
EL,2026-02-16,-0.9686430171132088,negative,news,Earnings To Watch: Medifast (MED) Reports Q4 Results Tomorrow
EL,2026-02-16,-0.9058186076581478,negative,news,A Look At Edgewell Personal Care (EPC) Valuation After Wider Quarterly Loss And Mixed Insider And Analyst Signals
EL,2026-02-16,0.4873342365026474,positive,news,USANA (USNA) To Report Earnings Tomorrow: Here Is What To Expect
EL,2026-02-14,0.9402443310245872,positive,news,Bright Horizons Family Solutions Inc. (NYSE:BFAM) Q4 2025 Earnings Call Transcript
EL,2026-02-14,0.9132620878517628,positive,news,ING Groep NV Purchases New Stake in The Estee Lauder Companies Inc. $EL
EL,2026-02-12,-0.8433290906250477,negative,news,Estée Lauder sues Walmart over alleged counterfeits
EL,2026-02-12,0.9086810313165188,positive,news,Crocs Shares Jump After Q4 Earnings Best Wall Street Expectations
EL,2026-02-12,0.8867537472397089,positive,news,Sharper focus and disciplined execution driving competitive performance
EL,2026-02-11,-0.9044851958751678,negative,news,Estée Lauder sues Walmart over alleged counterfeit beauty sales
EL,2026-02-11,0.9349954221397638,positive,news,Walmart Inc. (WMT) Price Target Increased at Oppenheimer as Firm Eyes Solid Q4
EL,2026-02-11,0.8536874046549201,positive,news,"Personnel Hygiene Stations Market is Going to Boom | Ecolab, Diversey, Rentokil Initial"
EL,2026-02-11,0.8653988000005484,positive,news,E.l.f. Beauty CFO says the lipstick index is alive and well
EL,2026-02-10,-0.8541289493441582,negative,news,Estée Lauder Sues Walmart Over Alleged Counterfeit Products in Marketplace
EL,2026-02-10,-0.5921702831983566,negative,news,Estee Lauder Sues Over Walmart Site Copycat Cosmetics Sales (1)
EL,2026-02-10,-0.7338126078248024,negative,news,Estee Lauder sues Walmart alleging 'despicable' sale of counterfeit beauty products
EL,2026-02-10,-0.9084316166117787,negative,news,Estee Lauder sues Walmart over alleged counterfeit fragrances
EL,2026-02-10,0.9296651557087898,positive,news,5 Consumer Staples Giants to Buy Amid the Sector's Strong Momentum
EL,2026-02-10,0.16345494240522385,neutral,news,"Ecommerce earnings recap: What you missed from e.l.f. Beauty, Tapestry and more"
EL,2026-02-10,-0.9539374802261591,negative,news,Edgewell Personal Care P/E Premium And 1.1% Margin Reinforce Bearish Earnings Narratives
EL,2026-02-09,-0.5530875772237778,negative,news,JELD WEN (NYSE:JELD) Shares Jump And Dip Amid Nyse Composite Market Nerves
