ticker,date,sentiment_score,sentiment_label,content_type,title
BAC,2026-05-11,-0.8761597853153944,negative,news,"Vanguard Group Inc. Sells 112,691 Shares of Comstock Resources, Inc. $CRK"
BAC,2026-05-11,0.3089700061827898,neutral,news,Should Fifth Third’s Comerica Integration and Capital Moves Require Action From Fifth Third Bancorp (FITB) Investors?
BAC,2026-05-11,0.004561182111501694,neutral,news,What Happens to JPMorgan Chase If Jamie Dimon Steps Down?
BAC,2026-05-11,0.9279531454667449,positive,news,"Wesbanco Bank Inc. Acquires Shares of 10,000 Belden Inc $BDC"
BAC,2026-05-11,-0.9352146200835705,negative,news,"Kepler Cheuvreux Suisse SA Sells 42,433 Shares of Costco Wholesale Corporation $COST"
BAC,2026-05-11,0.9006780963391066,positive,news,Dream Finders Homes (NYSE: DFH) makes $704M all-cash bid for Beazer
BAC,2026-05-11,0.938262764364481,positive,news,Kepler Cheuvreux Suisse SA Makes New Investment in Jacobs Solutions Inc. $J
BAC,2026-05-11,-0.7314378507435322,negative,news,Bank of America Tightened Block Trade Rules After Esprit Deal
BAC,2026-05-11,0.5376826003193855,positive,news,Citigroup Inc. $C is Hosking Partners LLP's 2nd Largest Position
BAC,2026-05-11,-0.9038461372256279,negative,news,Hosking Partners LLP Has $62.75 Million Position in Bank of America Corporation $BAC
BAC,2026-05-11,0.8949706926941872,positive,news,Allegion PLC $ALLE Shares Bought by Kepler Cheuvreux Suisse SA
BAC,2026-05-11,0.9383785529062152,positive,news,Chubb Limited $CB Stake Raised by NewEdge Wealth LLC
BAC,2026-05-11,-0.6448033452033997,negative,news,"Byrne Financial Freedom LLC Sells 5,819 Shares of Costco Wholesale Corporation $COST"
BAC,2026-05-11,0.5571598932147026,positive,news,KeyCorp stock (US4932671088): Regional banking leader navigates economic shifts
BAC,2026-05-11,0.3286074697971344,positive,news,"C WorldWide Group Holding A S Has $119.06 Million Holdings in Republic Services, Inc. $RSG"
BAC,2026-05-11,-0.6355221271514893,negative,news,Aubrey Capital Management Ltd Cuts Stock Position in Futu Holdings Limited Sponsored ADR $FUTU
BAC,2026-05-11,0.9299606997519732,positive,news,ABN AMRO Bank N.V. Has $353.21 Million Holdings in Bank of America Corporation $BAC
BAC,2026-05-11,-0.0261175986379385,neutral,news,Loan loss coverage ratio of Bank OZK - 4.625% Series A Non-Cumulative Perpetual Preferred Stock – NASDAQ:OZKAP
BAC,2026-05-10,0.33224284648895264,positive,news,A Look At Norfolk Southern (NSC) Valuation After The Gainesville Inland Port Launch
BAC,2026-05-10,0.22710612416267395,positive,news,Emerson Electric Company (EMR) Receives a Hold from Wells Fargo
BAC,2026-05-10,-0.7272469699382782,negative,news,"UBS Group AG Has $29.60 Million Position in Option Care Health, Inc. $OPCH"
BAC,2026-05-10,-0.5509381294250488,negative,news,UBS Group AG Has $29.95 Million Stock Position in Janus Henderson Group plc $JHG
BAC,2026-05-10,-0.8191681057214737,negative,news,American Tower Corporation $AMT Shares Sold by UNIVEST FINANCIAL Corp
BAC,2026-05-10,-0.6722533702850342,negative,news,Swedbank AB Trims Holdings in The Clorox Company $CLX
BAC,2026-05-10,-0.9588998388499022,negative,news,Nwam LLC Has $3.38 Million Position in CRISPR Therapeutics AG $CRSP
BAC,2026-05-10,0.9378190021961927,positive,news,"Swedbank AB Boosts Stock Position in Expeditors International of Washington, Inc. $EXPD"
BAC,2026-05-10,0.7660733489319682,positive,news,Income Insurance Ltd Invests $1.20 Million in Bank of America Corporation $BAC
BAC,2026-05-10,-0.8821367546916008,negative,news,"UBS Group AG Sells 167,446 Shares of Hub Group, Inc. $HUBG"
BAC,2026-05-10,0.934906117618084,positive,news,MSCI Inc $MSCI is GCQ FUNDS MANAGEMENT PTY Ltd's 2nd Largest Position
BAC,2026-05-10,0.9345592148602009,positive,news,"Plato Investment Management Ltd Acquires 9,901 Shares of Bank of America Corporation $BAC"
BAC,2026-05-10,0.24531078338623047,positive,news,Is Fifth Third Bancorp (FITB) Price Reflecting Its Strong Multi Year Share Performance?
BAC,2026-05-10,0.9257257375866175,positive,news,"Principal Financial Group Inc. Increases Stock Position in Trex Company, Inc. $TREX"
BAC,2026-05-10,0.9371224287897348,positive,news,"Mitsubishi UFJ Asset Management Co. Ltd. Purchases 10,447 Shares of Aercap Holdings N.V. $AER"
BAC,2026-05-10,0.9366709692403674,positive,news,"Generali Asset Management SPA SGR Acquires 20,746 Shares of Gaming and Leisure Properties, Inc. $GLPI"
BAC,2026-05-10,0.9363685306161642,positive,news,M&T Bank Corp Has $1.39 Million Stock Position in Rocket Lab Corporation $RKLB
BAC,2026-05-10,-0.00863209180533886,neutral,news,Number of shareholders of Bank of Hawaii Corp – LSX:875284
BAC,2026-05-10,-0.7272284477949142,negative,news,"Ares Capital Corporation (NASDAQ:ARCC) Given Consensus Rating of ""Moderate Buy"" by Analysts"
BAC,2026-05-10,0.9240658674389124,positive,news,"Hexcel Corporation (NYSE:HXL) Given Average Recommendation of ""Hold"" by Analysts"
BAC,2026-05-10,-0.9391483943909407,negative,news,"Sempra Energy (NYSE:SRE) Lowered to ""Sell"" Rating by Wall Street Zen"
BAC,2026-05-10,0.9332673046737909,positive,news,"UBS Group AG Acquires 33,276 Shares of Nova Ltd. $NVMI"
BAC,2026-05-10,0.022955363616347313,neutral,news,BCS5779935 Seasonals Chart
BAC,2026-05-10,-0.9551680637523532,negative,news,Wells Fargo (WFC) Valuation Check As Recent Returns Raise Questions On Upside Potential
V,2026-05-11,0.9397291019558907,positive,news,Visa Inc. stock (US92826C8394): Exchange offer completes with 98% participation
V,2026-05-11,0.9238310232758522,positive,news,"M&T Bank Corp Takes Position in CareTrust REIT, Inc. $CTRE"
V,2026-05-11,-0.7851896435022354,negative,news,"Centric Wealth Management Sells 15,476 Shares of Procter & Gamble Company (The) $PG"
V,2026-05-11,0.9276797939091921,positive,news,"Beam Wealth Advisors Inc. Purchases Shares of 17,746 Netflix, Inc. $NFLX"
V,2026-05-11,0.9296812424436212,positive,news,"3,016 Shares in Western Digital Corporation $WDC Bought by Asahi Life Asset Management CO. LTD."
V,2026-05-11,0.9380847923457623,positive,news,"ANI Pharmaceuticals, Inc. (NASDAQ:ANIP) Given Consensus Recommendation of ""Moderate Buy"" by Brokerages"
V,2026-05-10,-0.14272326231002808,negative,news,"Celestica, Inc. $CLS Shares Sold by Plato Investment Management Ltd"
V,2026-05-10,0.7755994126200676,positive,news,Principal Financial Group Inc. Takes $36.68 Million Position in Solstice Advanced Mat $SOLS
V,2026-05-10,-0.8350532576441765,negative,news,Generali Asset Management SPA SGR Trims Position in STERIS plc $STE
V,2026-05-10,0.02660440094769001,neutral,news,ETFs Investing in Autoliv Inc. Stocks
V,2026-05-09,0.939542431384325,positive,news,"Vanguard Group Inc. Purchases 34,858 Shares of Leonardo DRS, Inc. $DRS"
V,2026-05-09,0.9316591639071703,positive,news,Vanguard Group Inc. Grows Position in KANZHUN LIMITED Sponsored ADR $BZ
V,2026-05-09,-0.9172440692782402,negative,news,"Vanguard Group Inc. Decreases Position in Patterson-UTI Energy, Inc. $PTEN"
V,2026-05-09,-0.8864524625241756,negative,news,"LiveRamp Holdings, Inc. $RAMP Shares Sold by Vanguard Group Inc."
V,2026-05-09,0.9376949770376086,positive,news,Credo Technology Group Holding Ltd. $CRDO Stock Position Raised by M&T Bank Corp
V,2026-05-09,0.2910883193835616,neutral,news,"Principal Financial Group Inc. Purchases New Position in Fiserv, Inc. $FISV"
V,2026-05-09,0.9372612796723843,positive,news,"Cheniere Energy, Inc. $LNG Shares Purchased by Denali Advisors LLC"
V,2026-05-09,0.9393864767625928,positive,news,"Altria Group, Inc. $MO Holdings Raised by Crossmark Global Holdings Inc."
V,2026-05-08,-0.9658691845834255,negative,news,Fidelity National Information Services Inc. stock underperforms Friday when compared to competitors
V,2026-05-08,0.9374565705657005,positive,news,"FIS Tops Q1 Earnings on Banking Solutions Growth, Margin Expansion"
V,2026-05-08,0.9417292419821024,positive,news,"FIS Tops Q1 Earnings on Banking Solutions Growth, Margin Expansion"
V,2026-05-08,0.9329070094972849,positive,news,"Altria Group, Inc. $MO Shares Acquired by International Assets Investment Management LLC"
V,2026-05-08,0.8967687655240297,positive,news,Redwood Wealth Management Group LLC Makes New Investment in American Express Company $AXP
V,2026-05-08,0.9311863481998444,positive,news,Mitsubishi UFJ Asset Management Co. Ltd. Increases Holdings in ResMed Inc. $RMD
V,2026-05-08,-0.9507021941244602,negative,news,"Principal Financial Group Inc. Lowers Holdings in Axsome Therapeutics, Inc. $AXSM"
V,2026-05-08,-0.6819386035203934,negative,news,"Principal Financial Group Inc. Has $65.66 Million Position in Old Dominion Freight Line, Inc. $ODFL"
V,2026-05-08,0.8652798868715763,positive,news,"Principal Financial Group Inc. Acquires 2,047,400 Shares of Smartstop Self Storage REIT Inc $SMA"
V,2026-05-08,0.9323279689997435,positive,news,"Generali Asset Management SPA SGR Purchases 11,320 Shares of Bank Of Montreal $BMO"
V,2026-05-08,-0.9304374475032091,negative,news,Is Fidelity National Information Services (FIS) Now Attractively Priced After Steep One Year Share Slump
V,2026-05-08,0.04115295596420765,neutral,news,Freedom Holding (Nasdaq:FRHC) - Stock Analysis
V,2026-05-07,0.8248082771897316,positive,news,Can Fidelity National Beat Q1 Earnings on Banking Solutions Strength?
V,2026-05-07,0.9401472080498934,positive,news,Can Fidelity National Beat Q1 Earnings on Banking Solutions Strength?
V,2026-05-07,-0.9656998934224248,negative,news,Brink's (BCO) Q1 EPS Drop To US$0.78 Tests Bullish Earnings Growth Narrative
V,2026-05-07,-0.8888954296708107,negative,news,NCR Voyix Sees Revenue Dip and other Digital Transactions News briefs from 5/7/26
V,2026-05-07,0.40886256750673056,neutral,news,"EA SPORTS FC™ and LALIGA Launch New York Community Pitch as Part of FC FUTURES Program, Designed by Local Artist BG183"
V,2026-05-07,0.9402883145958185,positive,news,Global Payments Inc. (NYSE:GPN) Q1 2026 Earnings Call Transcript
V,2026-05-07,0.9415043666958809,positive,news,"Jack Henry & Associates, Inc. (NASDAQ:JKHY) Q3 2026 Earnings Call Transcript"
V,2026-05-07,-0.9036642648279667,negative,news,American Express Company $AXP Shares Sold by Swedbank AB
V,2026-05-07,0.9209369337186217,positive,news,"Equinix, Inc. $EQIX Stock Position Raised by Mitsubishi UFJ Asset Management Co. Ltd."
V,2026-05-07,-0.5756910741329193,negative,news,Swedbank AB Has $115.59 Million Holdings in Deere & Company $DE
V,2026-05-07,0.8497716272249818,positive,news,Principal Financial Group Inc. Has $99.96 Million Holdings in Howmet Aerospace Inc. $HWM
V,2026-05-07,0.205124631524086,neutral,news,Realty Income vs Agree Realty: Monthly Dividend Showdown
V,2026-05-06,0.02560766041278839,neutral,news,Why eBay Should Ignore GameStop and Use Bitcoin to Save $1.2 Billion in Transaction Costs
V,2026-05-06,0.9287625066936016,positive,news,Global Payments Inc. (NYSE:GPN) Announces Quarterly Dividend of $0.25
V,2026-05-06,-0.8163643404841423,negative,news,"Sun Country Airlines (NASDAQ:SNCY) COO Sells $18,847.36 in Stock"
V,2026-05-06,0.9411760959774256,positive,news,Global Payments Q1 Earnings Beat Estimates on Worldpay Momentum
V,2026-05-06,0.9408660139888525,positive,news,Full Transcript: Jack Henry & Associates Q3 2026 Earnings Call - Jack Henry & Associates (NASDAQ:JKHY
V,2026-05-06,0.8963979538530111,positive,news,"Wilson Asset Management International PTY Ltd. Acquires 26,028 Shares of Life360, Inc. $LIF"
V,2026-05-06,0.9295084457844496,positive,news,UBS Group AG Raises Stake in SouthState Bank Corporation $SSB
PFE,2026-05-11,0.8985609291121364,positive,news,"BMO Capital Maintains Pfizer(PFE.US) With Buy Rating, Maintains Target Price $34"
PFE,2026-05-11,0.9039585329592228,positive,news,Moderna Stock Is Up 6% Today: Is It Outperforming Other Vaccine Stocks Like Pfizer and Novavax?
PFE,2026-05-11,0.7153693530708551,positive,news,Thermo Fisher Sci. stock (US8835561023): Leader in life sciences tools
PFE,2026-05-11,0.9383722674101591,positive,news,"Pfizer stock (US7170811035): Surpasses Q1 earnings, reaffirms 2026 guidance"
PFE,2026-05-11,0.16283120773732662,neutral,news,"AI For Pharma And Biotech Market Is Going to Boom | BioXcel Therapeutics, BenevolentAI, NVIDIA Corporation"
PFE,2026-05-11,0.8897828836925328,positive,news,BridgeBio Pharma (BBIO): Leveraging Attruby® Revenue to Fuel a Rare Disease Pipeline Targeting Breakthroughs in ADH1 and Achondroplasia
PFE,2026-05-11,0.7791140805929899,positive,news,"Fabry Disease Treatment Market to Reach USD 3,530.5 Million"
PFE,2026-05-10,0.9103821516036987,positive,news,Pfizer Stock Faces a Fresh COVID Patent Overhang as Investors Wait for Its Next Growth Act
PFE,2026-05-10,0.8229266107082367,positive,news,Why Hut 8 Stock Is Suddenly a $9.8 Billion AI Data Center Bet
PFE,2026-05-10,0.6547671593725681,positive,news,Sarepta Broadens Beyond Elevidys With siRNA Progress And FDA Milestones
PFE,2026-05-10,0.8964619338512421,positive,news,"LEGN: Scaling Carvykti Profitability, Driving Frontline Multiple Myeloma Adoption, and Pivoting to In Vivo Cell Therapy in 2026"
PFE,2026-05-10,0.9369423389434814,positive,news,"What Pfizer (PFE)'s Earnings Beat, Reaffirmed Guidance and Oncology Wins Mean For Shareholders"
PFE,2026-05-09,-0.9004786312580109,negative,news,Is It Too Late To Consider Johnson & Johnson (JNJ) After A 46.9% One Year Rally?
PFE,2026-05-09,0.782252149656415,positive,news,A Look At Regeneron Pharmaceuticals (REGN) Valuation After Otarmeni’s Accelerated FDA Approval
PFE,2026-05-09,0.6139939157292247,positive,news,Opportunities to Drive Change in Alopecia Areata
PFE,2026-05-09,-0.006552921608090401,neutral,news,"Zoetis Inc (CHIX:ZOEd) Stock Price, Trades & News"
PFE,2026-05-09,0.6586466869339347,positive,news,Johnson & Johnson CEO: America’s innovation advantage starts with health
PFE,2026-05-09,0.9334952961653471,positive,news,M&T Bank Corp Has $1.79 Million Holdings in Regency Centers Corporation $REG
PFE,2026-05-09,-0.9531339565292001,negative,news,"Crossmark Global Holdings Inc. Has $24.83 Million Stock Position in Merck & Co., Inc. $MRK"
PFE,2026-05-09,-0.9538285918533802,negative,news,Pfizer Inc. stock (US7170811035): Q1 2026 results and recent share price move
PFE,2026-05-09,0.9355113301426172,positive,news,Here is Why Pfizer (PFE) One of the Best High Volume Stocks to Invest In
PFE,2026-05-09,0.9251351468265057,positive,news,"Eli Lilly Stock Hits Bottleneck After 400% Surge in Five Years, Novo Nordisk Poised for a Comeback with 4% Dividend Yield"
PFE,2026-05-08,0.9396763481199741,positive,news,Stifel raises Aclaris Therapeutics price target to $4 on pipeline
PFE,2026-05-08,0.24472365900874138,neutral,news,Deal Watch: GSK Calls On Halozyme’s Enhanze In Cancer ADC Administration
PFE,2026-05-08,0.9331903867423534,positive,news,Johnson & Johnson Advances Dual-Pathway Strategy in Refractory IBD
PFE,2026-05-08,-0.26311996579170227,negative,news,Traws Pharma Stock Jumps As Biotech Targets Hantavirus After Cruise Ship Deaths
PFE,2026-05-08,0.1815036302432418,neutral,news,GLP-1 battle heats up between Eli Lilly and Novo Nordisk
PFE,2026-05-08,0.5678891241550446,positive,news,AbbVie (NYSE: ABBV) grows Q1 2026 sales while boosting R&D and deals
PFE,2026-05-08,-0.9630282334983349,negative,news,Pfizer Inc. stock underperforms Friday when compared to competitors
PFE,2026-05-08,0.9349808413535357,positive,news,Novavax Stock Jumps As Pfizer Deal And Q1 Beat Energize Traders
PFE,2026-05-08,0.5333662619814277,positive,news,Gene Therapy Briefs: Regeneron Wins FDA Approval for First Neurosensory Gene Therapy
PFE,2026-05-08,0.9371327692642808,positive,news,"Moleculin Biotech Secures Strategic Additional Patent, Strengthening Global Positioning of Annamycin"
PFE,2026-05-08,0.902519372291863,positive,news,Zymeworks Inc. (NASDAQ:ZYME) Q1 2026 Earnings Call Transcript
PFE,2026-05-08,0.40196485444903374,neutral,news,Ensysce CEO outlines abuse-resistant opioid approach in Amsterdam
PFE,2026-05-08,0.18994192499667406,neutral,news,Artiva Biotherapeutics Announces Pricing of $300 Million Underwritten Offering of Common Stock and Pre-Funded Warrants
PFE,2026-05-08,0.8816004581749439,positive,news,Amneal Pharmaceuticals (NASDAQ: AMRX) posts Q1 profit surge and inks $375M Kashiv acquisition
PFE,2026-05-08,-0.7571191415190697,negative,news,A Look At Teva Pharmaceutical Industries (NYSE:TEVA) Valuation After Strong Q1 2026 And Biopharma Pipeline Progress
PFE,2026-05-08,0.7943905703723431,positive,news,FDA pushes back weekly Alzheimer's shot decision to Aug. 24
PFE,2026-05-08,0.2775281798094511,neutral,news,Lady Gaga Partners with Pfizer to Raise Migraine Awareness
PFE,2026-05-07,0.909327769652009,positive,news,"Eli Lilly To Invest $4.5 Billion More In Indiana Manufacturing Sites - AstraZeneca (NYSE:AZN), Johnson &"
PFE,2026-05-07,-0.8941711112856865,negative,news,"[8-K] CAPRICOR THERAPEUTICS, INC. Reports Material Event"
PFE,2026-05-07,-0.48650792241096497,negative,news,Zymeworks (NASDAQ: ZYME) monetizes Ziihera royalties and boosts cash above $400M
PFE,2026-05-07,0.8691105879843235,positive,news,Prime Medicine (NasdaqGM:PRME) Stock Forecast & Analyst Predictions
PFE,2026-05-07,0.7882173284888268,positive,news,Healthy Returns: First Ozempic generics in Canada will be a test case for Novo Nordisk
PFE,2026-05-07,0.6123526757583022,positive,news,Pfizer Works to Address Inequities in IBD Care
PFE,2026-05-07,0.02464541792869568,positive,news,Weis Markets blames capped drug prices for low pharmacy gains
PFE,2026-05-07,0.9318439681082964,positive,news,"Novavax, Inc. Stock Jumps: Why Pfizer’s Matrix-M Deal Drove a Surprise Q1 Revenue Beat"
PFE,2026-05-07,0.9378711432218552,positive,news,Is Pfizer Stock Worth Buying After a Q1 2026 Beat and Patent Win?
PFE,2026-05-07,0.5788651155307889,positive,news,Pfizer’s Next Lyme Shot: What a Fifth-Dose VLA15 Trial Signals for PFE Investors
PFE,2026-05-07,0.6388245327398181,positive,news,MBX Biosciences Announces Appointment of Mark Soued as Chief Commercial Officer and Inducement Grant Award
AMGN,2026-05-11,0.8845413792878389,positive,news,Amgen stock (US0311621009): Pharma giant navigates C-suite transition and Q1 growth
AMGN,2026-05-11,-0.9444596655666828,negative,news,Swiss Life Asset Management Ltd Reduces Stake in Amgen Inc. $AMGN
AMGN,2026-05-11,0.9263720102608204,positive,news,Nicholas Company Inc. Makes New Investment in Amgen Inc. $AMGN
AMGN,2026-05-11,-0.9404870886355639,negative,news,Amgen Inc. $AMGN Shares Sold by Securian Asset Management Inc.
AMGN,2026-05-11,0.9328968627378345,positive,news,Amgen’s New Puerto Rico Biologics Investment Might Change The Case For Investing In Amgen (AMGN)
AMGN,2026-05-11,0.8992894580587745,positive,news,"Merck, Amgen double down on bad cholesterol to vanquish number 1 killer"
AMGN,2026-05-10,0.9285951852798462,positive,news,"NewEdge Wealth LLC Acquires 7,521 Shares of Amgen Inc. $AMGN"
AMGN,2026-05-10,0.9264512220397592,positive,news,Sotyktu Psoriatic Arthritis Nod Broadens Bristol Myers Squibb Immunology Story
AMGN,2026-05-09,0.6561079174280167,positive,news,"Earnings call transcript: Amgen Q1 2026 beats EPS forecast, stock dips"
AMGN,2026-05-09,0.9381708558648825,positive,news,Amgen Inc. stock (US0311621009): U.S. manufacturing push and Q1 2026 results in focus
AMGN,2026-05-09,0.8955011162906885,positive,news,Amgen Inc. stock (US0311621009): Biotech giant eyes growth amid patent cliffs and pipeline bets
AMGN,2026-05-09,-0.6820711195468903,negative,news,Is It Time To Reconsider Alnylam Pharmaceuticals (ALNY) After Recent RNAi Progress And Volatile Price Moves
AMGN,2026-05-09,0.9350102785974741,positive,news,Crossmark Global Holdings Inc. Has $15.62 Million Stock Position in Amgen Inc. $AMGN
AMGN,2026-05-09,0.9374006306752563,positive,news,Ethic Inc. Boosts Stock Position in Amgen Inc. $AMGN
AMGN,2026-05-09,-0.7629673555493355,negative,news,Is It Time To Reassess Amgen (AMGN) After A Steady Share Price And Strong DCF Case
AMGN,2026-05-08,-0.5474640130996704,negative,news,Is Sarepta Therapeutics (SRPT) A Potential Opportunity After Sharp Multi‑Year Share Price Declines?
AMGN,2026-05-08,-0.8422146923840046,negative,news,Assessing Regeneron (REGN) After Recent Share Price Weakness And Strong Valuation Signals
AMGN,2026-05-08,0.40230850875377655,positive,news,Is Amgen Stock Poised for a Rally?
AMGN,2026-05-08,0.3207647232338786,neutral,news,InflaRx Unveils Izicopan Strategic Shift And $150m Offering
AMGN,2026-05-08,0.5717158392071724,positive,news,"Structure Therapeutics Reports 16% Weight Loss With Oral GLP-1RA Aleniglipron in Phase 2, Prepares for Phase 3 Obesity Trial and ADA 2026 Data Presentations"
AMGN,2026-05-08,0.9382415190339088,positive,news,FY2026 EPS Estimates for Amgen Boosted by Erste Group Bank
AMGN,2026-05-08,0.9295595102012157,positive,news,Generali Asset Management SPA SGR Raises Stake in Amgen Inc. $AMGN
AMGN,2026-05-08,-0.9413711074739695,negative,news,"GRIMES & Co WEALTH MANAGEMENT LLC Sells 4,111 Shares of Amgen Inc. $AMGN"
AMGN,2026-05-08,0.0076251570135355,neutral,news,"Amgen (AMGN) EVP granted RSUs, 17,022 options; 408 shares for taxes"
AMGN,2026-05-08,0.11692138761281967,neutral,news,Amgen (NASDAQ: AMGN) EVP gets major equity grants and tax share withholding
AMGN,2026-05-08,-0.16571301221847534,neutral,news,[Form 4] AMGEN INC Insider Trading Activity
AMGN,2026-05-08,0.004048194736242294,neutral,news,"Amgen (AMGN) EVP James Bradner granted RSUs, options; 407 shares withheld for taxes"
AMGN,2026-05-08,0.05710533820092678,neutral,news,"Amgen (AMGN) HR SVP awarded RSUs, options and withholds shares for tax"
AMGN,2026-05-08,0.07145078480243683,neutral,news,"Amgen (NASDAQ: AMGN) EVP Reese awarded RSUs, stock options and withholds shares for taxes"
AMGN,2026-05-08,0.5155396368354559,positive,news,Amgen (NASDAQ: AMGN) director receives stock award and updates holdings
AMGN,2026-05-08,0.4747579023241997,positive,news,[Form 4] AMGEN INC Insider Trading Activity
AMGN,2026-05-08,0.7586050555109978,positive,news,Amgen (NASDAQ: AMGN) director Omar Ishrak granted new stock award
AMGN,2026-05-08,-0.9295877330005169,negative,news,Akebia Therapeutics (AKBA) Losses Narrow To US$9.1 Million Challenging Bearish Profitability Narratives
AMGN,2026-05-07,0.014548717066645622,neutral,news,Amgen finance and R&D chiefs will speak in a public webcast May 13
AMGN,2026-05-07,0.7335430821403861,positive,news,"CytomX fills 40-patient colon cancer study, sets 2026 data"
AMGN,2026-05-07,-0.6612313240766525,negative,news,"CytomX (NASDAQ: CTMX) posts Q1 loss, $250M equity raise and trial updates"
AMGN,2026-05-07,-0.7643423527479172,negative,news,Revolution Medicines Balances RAS Patent Dispute With Daraxonrasib Phase 3 Momentum
AMGN,2026-05-07,0.06107422895729542,neutral,news,AMGEN TO PRESENT AT THE BANK OF AMERICA MERRILL LYNCH GLOBAL HEALTHCARE CONFERENCE
AMGN,2026-05-07,-0.9331446513533592,negative,news,Arrowhead Pharmaceuticals (NASDAQ: ARWR) posts Q2 2026 loss as prior milestone revenue fades
AMGN,2026-05-07,0.5620438307523727,positive,news,Zai Lab Announces First Quarter 2026 Financial Results and Recent Corporate Updates
AMGN,2026-05-07,0.9382360931485891,positive,news,"Amgen's Q1 earnings top estimates, 16 drugs deliver double-digit gains"
UPS,2026-05-11,0.9081046413630247,positive,news,Cencora (NYSE:COR) Could Be A Buy For Its Upcoming Dividend
UPS,2026-05-11,0.9313664371147752,positive,news,FedEx Corp. stock (US31428X1063): Q3 earnings and Freight spin?off in focus
UPS,2026-05-10,-0.36490902304649353,negative,news,A Look At C.H. Robinson (CHRW) Valuation After Amazon’s Supply Chain Push And Supreme Court Liability Risks
UPS,2026-05-10,-0.011301308870315552,neutral,news,"UPS SEC Filings - United Parcel 10-K, 10-Q, 8-K Forms"
UPS,2026-05-08,0.04226475674659014,neutral,news,[Form 4] UNITED PARCEL SERVICE INC Insider Trading Activity
UPS,2026-05-08,0.9343506786972284,positive,news,Jim Cramer Just Couldn’t Stop Praising Amazon.com (AMZN)
UPS,2026-05-08,0.9415771756321192,positive,news,Is GXO Logistics' (GXO) Tech-Driven Profit Return Reshaping Its Long-Term Earnings Narrative?
UPS,2026-05-07,-0.9643464796245098,negative,news,United Parcel Service (UPS) Is Down 5.6% After Amazon Expands Logistics Services To SMBs
UPS,2026-05-07,-0.941984610632062,negative,news,Over a dozen new lawsuits related to Louisville UPS plane crash filed
UPS,2026-05-07,0.9145490378141403,positive,news,FedEx’s MD-11 comeback to start with short cargo flight to Miami
UPS,2026-05-07,0.48023941926658154,positive,news,FedEx’s MD-11 comeback to start with short cargo flight to Miami
UPS,2026-05-07,0.010743215680122375,neutral,news,Is It Too Late To Consider C.H. Robinson Worldwide (CHRW) After A 96% One Year Surge
UPS,2026-05-07,-0.9153968272730708,negative,news,"UPS, Boeing, General Electric facing new lawsuits in connection to deadly plane crash"
UPS,2026-05-07,-0.7199392206966877,negative,news,"Pilot’s estate, UPS, Boeing, General Electric named in new lawsuits in connection to deadly plane crash"
UPS,2026-05-07,0.6878274977207184,positive,news,What's Wrong With Transportation Sector? Buy These ETFs Instead
UPS,2026-05-07,-0.730353094637394,negative,news,FedEx (NYSE:FDX) - Stock Analysis
UPS,2026-05-07,0.8532966421917081,positive,news,UPS Announces Quarterly Dividend
UPS,2026-05-06,0.8156009279191494,positive,news,UPS Announces Quarterly Dividend
UPS,2026-05-06,-0.01453997753560543,neutral,news,UPS Announces Quarterly Dividend
UPS,2026-05-06,-0.9351979196071625,negative,news,UPS (NYSE: UPS) Q1 2026 earnings hit by lower volume and restructuring costs
UPS,2026-05-06,0.9329411499202251,positive,news,"CPKC, CSX Upgrade SMX Premium Service"
UPS,2026-05-06,0.9148538075387478,positive,news,United Parcel Service Inc. Cl B stock underperforms Wednesday when compared to competitors despite daily gains
UPS,2026-05-06,-0.9308018237352371,negative,news,UPS Stock Tries To Stabilize After Sharp Drop As Amazon Expands Into Logistics
UPS,2026-05-06,-0.8091289447620511,negative,news,Expeditors International of Washington (NYSE:EXPD) - Stock Analysis
