ticker,date,sentiment_score,sentiment_label,content_type,title
MRK,2026-06-06,0.9449531510472298,positive,news,"Merck & Co., Inc. (NYSE:MRK) Rating Increased to Buy at Wall Street Zen"
MRK,2026-06-06,0.8547697626054287,positive,news,Assessing Bristol Myers Squibb (BMY) Valuation After Fresh EU Opdivo Approval And New Phase 3 Oncology Data
MRK,2026-06-05,0.9349058773368597,positive,news,Is Merck & Co. (MRK) One of the Best Cheap Stocks to Buy for Beginners?
MRK,2026-06-05,0.9309710040688515,positive,news,"UnitedHealth, Eli Lilly Lead Healthcare Rebound as Investors Seek Stability"
MRK,2026-06-05,0.8932370776310563,positive,news,AGEN BOT+BAL: What the BATTMAN Trial Means for mCRC
MRK,2026-06-05,0.5548798888921738,positive,news,AGEN Early Access Revenues Signal a New Path Ahead of Approval
AMGN,2026-06-10,0.6954434998333454,positive,news,Pfizer Stock 2026: CEO Lays Out the Case for a Growth Surge
AMGN,2026-06-10,0.8722100108861923,positive,news,Motley Fool Asset Management LLC Increases Position in Amgen Inc. $AMGN
AMGN,2026-06-10,0.9284758530557156,positive,news,How Is Biogen’s Stock Performance Compared to Other Biotech Stocks?
AMGN,2026-06-10,0.5914474725723267,positive,news,Assessing Incyte (INCY) Valuation After Strong Recent Share Price Momentum
AMGN,2026-06-10,0.9028528900817037,positive,news,How WHO’s Maftivimab Priority for Bundibugyo Trials At Regeneron Pharmaceuticals (REGN) Has Changed Its Investment Story
AMGN,2026-06-10,0.9377236161381006,positive,news,Mizuho Boosts UnitedHealth (UNH) Target as Managed Care Outlook Improves
AMGN,2026-06-09,0.9362330548465252,positive,news,Deere (DE) Could Benefit As Farm Equipment Demand Begins To Stabilize
AMGN,2026-06-09,0.9297795258462429,positive,news,"Is Autodesk, Inc. (ADSK) among the Best Automation Stocks to Buy for Warehouse Construction?"
AMGN,2026-06-09,0.898240543436259,positive,news,Infleqtion (INFQ) Expands UK Quantum Activities with Quantum Innovation Cente
AMGN,2026-06-09,0.8860431937500834,positive,news,Is Honeywell International Inc. (HON) Among the Best Quantum Computing Stocks to Invest In According to Hedge Funds?
AMGN,2026-06-09,-0.9209765065461397,negative,news,Gilead Balances Trodelvy Setback With Once Weekly HIV Progress
AMGN,2026-06-09,0.9053336903452873,positive,news,Alvotech Takes The Lead On Vedolizumab
AMGN,2026-06-09,-0.8591617569327354,negative,news,Franklin Resources Inc. Has $712.09 Million Stake in Amgen Inc. $AMGN
AMGN,2026-06-09,0.91406384203583,positive,news,Everspin Technologies to join Russell 2000 index on June 26 By Investing.com
AMGN,2026-06-09,0.4738014489412308,positive,news,Cerity Partners LLC Has $134.82 Million Stock Holdings in Amgen Inc. $AMGN
AMGN,2026-06-09,0.07757395505905151,positive,news,Goldman Sachs Trims Amgen (AMGN) Valuation but Sticks with Buy Rating
AMGN,2026-06-08,0.8696689317002892,positive,news,"Moderna CLO Klinger sells $173,550 in shares"
AMGN,2026-06-08,0.15413224883377552,neutral,news,Destra Multi‑Alternative Fund (DMA) reports NAV -2.54% while market price +8.65%
AMGN,2026-06-08,-0.9573854776099324,negative,news,Amgen Inc. stock underperforms Monday when compared to competitors
AMGN,2026-06-08,0.9195108227431774,positive,news,"ADA26: T1 and T2 diabetes readouts from Roche, MannKind and Lilly"
AMGN,2026-06-08,0.9149009501561522,positive,news,J&J lights up $1bn offer for pan-KRAS developer Firefly
AMGN,2026-06-08,0.8545694872736931,positive,news,Amgen Inc. (AMGN) is Attracting Investor Attention: Here is What You Should Know
AMGN,2026-06-08,0.9067249284125865,positive,news,Sanofi Wins EU Nod for Subcutaneous Sarclisa in Multiple Myeloma
AMGN,2026-06-08,0.16978673357516527,neutral,news,"O Shaughnessy Asset Management LLC Buys 27,035 Shares of Amgen Inc. $AMGN"
AMGN,2026-06-08,0.8595782592892647,positive,news,"Hilton Head Capital Partners LLC Purchases Shares of 3,798 Amgen Inc. $AMGN"
AMGN,2026-06-08,-0.8613506928086281,negative,news,Los Angeles Capital Management LLC Decreases Stake in Amgen Inc. $AMGN
AMGN,2026-06-08,0.937463104724884,positive,news,Is Sarepta Therapeutics (SRPT) Quietly Rewriting Its Risk Profile With New Equity Plans And Q1 Profitability?
AMGN,2026-06-08,0.8663115133531392,positive,news,"FDA accepts Alvotech's application for AVT16, a biosimilar to Entyvio, advancing treatment options for inflammatory diseases."
AMGN,2026-06-08,0.935422096401453,positive,news,Brandywine Global Investment Management LLC Has $140 Million Holdings in Amgen Inc. $AMGN
AMGN,2026-06-08,0.877626808360219,positive,news,Roche announces global collaboration with Nurix
AMGN,2026-06-07,0.8141321782022715,positive,news,AMGEN PRESENTS NEW DATA ACROSS ITS CARDIOMETABOLIC PORTFOLIO AT AMERICAN DIABETES ASSOCIATION 86TH SCIENTIFIC SESSIONS
AMGN,2026-06-07,-0.005936603993177414,neutral,news,"Arrowhead Pharmaceuticals, Inc. Trade Ideas — XETR:HDP1"
AMGN,2026-06-07,0.7372135296463966,positive,news,"What to know about MariTide, Amgen’s experimental GLP-1 drug"
AMGN,2026-06-07,0.2536756359040737,neutral,news,"What to know about MariTide, Amgen’s experimental GLP-1 drug"
AMGN,2026-06-07,0.9285178827121854,positive,news,Should Amgen’s (AMGN) IMDYLLTRA Win and Rare-Disease Data Shift Its High-Need Portfolio Strategy?
AMGN,2026-06-07,0.9382435958832502,positive,news,Capital International Inc. CA Has $139.28 Million Position in Amgen Inc. $AMGN
AMGN,2026-06-07,-0.8637665640562773,negative,news,Amgen Inc. $AMGN Shares Sold by Capital International Ltd. CA
AMGN,2026-06-07,-0.8551068753004074,negative,news,Capital International Investors Decreases Stock Position in Amgen Inc. $AMGN
AMGN,2026-06-07,-0.9244138244539499,negative,news,Capital Research Global Investors Cuts Position in Amgen Inc. $AMGN
AMGN,2026-06-07,0.9241349473595619,positive,news,Capital World Investors Boosts Holdings in Amgen Inc. $AMGN
AMGN,2026-06-07,-0.157512366771698,negative,news,Capital Group Investment Management PTE. LTD. Reduces Position in Amgen Inc. $AMGN
AMGN,2026-06-07,0.9381119217723608,positive,news,"Capital Group Private Client Services Inc. Acquires 4,879 Shares of Amgen Inc. $AMGN"
AMGN,2026-06-07,0.19475035555660725,neutral,news,"Cytokinetics, Incorporated Trade Ideas — XETR:KK3A"
AMGN,2026-06-06,0.34589868783950806,positive,news,"Vestcor Inc Sells 10,133 Shares of Amgen Inc. $AMGN"
AMGN,2026-06-06,0.9391649328172207,positive,news,Amgen Inc. $AMGN Position Boosted by Vise Technologies Inc.
AMGN,2026-06-06,0.9378604013472795,positive,news,MCF Advisors LLC Increases Position in Amgen Inc. $AMGN
AMGN,2026-06-06,0.9187991125509143,positive,news,How a US$2 Billion Generative AI RNAi Deal At Alnylam Pharmaceuticals (ALNY) Has Changed Its Investment Story
AMGN,2026-06-06,0.21030205488204956,positive,news,"J.W. Cole Advisors Inc. Sells 6,407 Shares of Amgen Inc. $AMGN"
AMGN,2026-06-06,-0.8671667277812958,negative,news,Fjarde AP Fonden Fourth Swedish National Pension Fund Cuts Stake in Amgen Inc. $AMGN
HON,2026-06-10,-0.7509831935167313,negative,news,"Barclays Cuts Honeywell International Price Target to $239 From $251, Maintains Overweight Rating"
HON,2026-06-10,0.5438506044447422,positive,news,Honeywell Separates its Automation and Aerospace Brands
HON,2026-06-10,-0.1035633385181427,negative,news,Honeywell (HON) Sticks with Full-Year Forecast as Aerospace Separation Nears
HON,2026-06-10,0.03986984025686979,neutral,news,Honeywell Spin Off Reshapes Aerospace And Automation Investment Choices
HON,2026-06-10,-0.05471949093043804,neutral,news,Honeywell Spin Off Reshapes Aerospace And Automation Investment Choices
HON,2026-06-09,0.9346121773123741,positive,news,Why Analysts Believe Honeywell’s (HON) Automation Story Is Gaining Strength
HON,2026-06-09,-0.8387472182512283,negative,news,Honeywell sees small relief after monthly slide ahead of Investor Day: What to watch?
HON,2026-06-09,0.6670939177274704,positive,news,"Huge, Unusual Volume in Long-Term Puts in Honeywell Shows Investors Are Bullish"
HON,2026-06-09,0.8990088393911719,positive,news,"RideNow Group, Inc. Announces Major Expansion of RideNow Tallahassee: New 27,000-Square-Foot Facility is the Panhandle's Premier Powersports Destination"
HON,2026-06-09,0.8831441067159176,positive,news,Honeywell Aerospace prepares to launch as independent public company headquartered in Phoenix
HON,2026-06-09,0.08644279092550278,neutral,news,Honeywell reaffirms 2026 forecast ahead of aerospace spinoff
HON,2026-06-09,-0.9390071500092745,negative,news,Honeywell International Stock Plummets 11% With 6-Day Losing Streak
HON,2026-06-09,-0.9613409107550979,negative,news,Honeywell International Stock In Shambles: Down -11% With 6-Day Losing Streak
HON,2026-06-09,0.9066318972036242,positive,news,What Drove Honeywell's Strong Q4 2025 Performance
HON,2026-06-08,0.012181591242551804,neutral,news,Honeywell International Inc. (HON) 2026 Guidance/Update Call - Slideshow (NASDAQ:HON) 2026-06-08
HON,2026-06-08,0.9315515384078026,positive,news,Honeywell (HON) Has a Backlog-and-Automation Engine the Conglomerate Label Misses
HON,2026-06-08,-0.01865909993648529,neutral,news,"Honeywell Advances Aerospace Spin-Off, Reverse Split Plan"
HON,2026-06-08,0.3085460662841797,positive,news,Honeywell Expects to Absorb Iran Impact as War De-Escalates
HON,2026-06-08,0.015867512673139572,neutral,news,Honeywell expects to absorb Iran impact as war de-escalates
HON,2026-06-08,-0.8855401948094368,negative,news,Honeywell reaffirms annual forecast ahead of aerospace spinoff
HON,2026-06-08,0.27135198935866356,neutral,news,Honeywell International Inc. Reaffirms Earnings Guidance for the Year 2026
HON,2026-06-08,0.09632631205022335,neutral,news,Honeywell reaffirms 2026 outlook ahead of aerospace spin-off
HON,2026-06-08,-0.33313409984111786,negative,news,Honeywell Updates Investors Ahead of Aerospace Breakup. What to Know.
HON,2026-06-08,0.9295534938573837,positive,news,Honeywell Backs Full-Year Guidance Ahead of Aerospace Spinoff
HON,2026-06-08,-0.9658331098034978,negative,news,Honeywell stock falls as 2026 EPS guidance disappoints
HON,2026-06-08,0.6293581090867519,positive,news,Honeywell reaffirms 2026 guidance ahead of aerospace spin-off
HON,2026-06-08,0.51987724006176,positive,news,HONEYWELL REAFFIRMS 2026 OUTLOOK AHEAD OF HONEYWELL AEROSPACE SPIN-OFF; INITIATES 2026 OUTLOOK FOR HONEYWELL TECHNOLOGIES
HON,2026-06-08,0.06273182854056358,neutral,news,HONEYWELL REAFFIRMS 2026 OUTLOOK AHEAD OF HONEYWELL AEROSPACE SPIN-OFF; INITIATES 2026 OUTLOOK FOR HONEYWELL TECHNOLOGIES
HON,2026-06-08,0.9234463982284069,positive,news,Capital Research Global Investors Has $797.35 Million Stock Holdings in Honeywell International Inc. $HON
HON,2026-06-08,0.93445635586977,positive,news,Franklin Resources Inc. Increases Holdings in Honeywell International Inc. $HON
HON,2026-06-08,-0.9497193181887269,negative,news,Honeywell International Inc. $HON Shares Sold by Clearbridge Investments LLC
HON,2026-06-08,0.9268876146525145,positive,news,Honeywell International Inc. $HON Shares Purchased by Brandywine Global Investment Management LLC
HON,2026-06-07,0.8109497809782624,positive,news,Is Honeywell International Inc. (HON) A Good Stock To Buy Now?
HON,2026-06-07,0.16446813568472862,neutral,news,Honeywell International Insiders Sold US$2.0m Of Shares Suggesting Hesitancy
HON,2026-06-07,-0.6780180484056473,negative,news,ING Groep NV Reduces Position in Honeywell International Inc. $HON
HON,2026-06-07,0.09071964398026466,neutral,news,Thin-wall machining with high-temperature alloys
HON,2026-06-07,-0.31662651896476746,negative,news,The Next Quantum Computing IPO CEO Just Told CNBC 'It Is Not 10 to 15 Years Out. It's Very Much Now'
HON,2026-06-06,-0.0161806121468544,neutral,news,"Smart Investor: Undervalued Dividend Raisers, Launching SpaceX Coverage and Stock Market Outlook"
HON,2026-06-05,-0.8907341435551643,negative,news,A Look At Kyivstar Group (NasdaqGS:KYIV) Valuation As Shares Show Recent Mixed Returns
HON,2026-06-05,0.015388496220111847,neutral,news,Honeywell Sets Aerospace Spin-Off and Reverse Split
HON,2026-06-05,0.07547758519649506,neutral,news,Honeywell (NASDAQ: HON) details Aerospace spin-off timing and 1-for-2 reverse split
HON,2026-06-05,0.8749961210414767,positive,news,Air Products Expands Missouri Manufacturing and Logistics Center with $70 Million Investment
HON,2026-06-05,0.9393881447613239,positive,news,Howmet Gains From Defense Aerospace Strength: Can the Momentum Last?
HON,2026-06-05,0.9370449092239141,positive,news,Is General Motors Stock Outperforming the Dow?
HON,2026-06-05,0.7366582304239273,positive,news,Is MetLife Stock Outperforming the S&P 500?
HON,2026-06-05,-0.9267912972718477,negative,news,Honeywell International Inc. (HON) stock falls amid market uptick: What investors need to know
HON,2026-06-05,-0.465227335691452,negative,news,Quantum Computing’s Biggest IPO Prices Strong and Then Fizzles
EMR,2026-06-10,0.5993528366088867,positive,news,Emerson Electric (EMR) Valuation Check After New SiMa.ai Industrial AI Collaboration
EMR,2026-06-10,-0.5319006592035294,negative,news,Emerson Electric Co. $EMR Shares Sold by Erste Asset Management GmbH
EMR,2026-06-10,-0.8162009492516518,negative,news,Brandes Investment Partners LP Has $120.52 Million Position in Emerson Electric Co. $EMR
EMR,2026-06-09,0.9325830703601241,positive,news,Bernstein initiates Emerson stock coverage with outperform rating
EMR,2026-06-09,0.758657842874527,positive,news,Emerson Electric Co. stock outperforms competitors on strong trading day
EMR,2026-06-09,0.9329783953726292,positive,news,Emerson (EMR) Teams Up With Aramco On A Technology Initiative With Bigger Implications
EMR,2026-06-09,0.9029073398560286,positive,news,Analysts Offer Insights on Industrial Goods Companies: Parker Hannifin (PH) and Fastenal Company (FAST)
EMR,2026-06-08,0.8393094399943948,positive,news,Illinois Tool Works stock (US4523081093): Industrial earnings story with steady margins in focus
EMR,2026-06-08,0.8388863876461983,positive,news,Emerson Electric Co. (EMR) Partners with SiMa.ai to Pursue $153.9 Billion Industrial AI Opportunities
EMR,2026-06-08,0.9350733458995819,positive,news,"ING Groep NV Buys Shares of 63,192 Emerson Electric Co. $EMR"
EMR,2026-06-08,-0.6483371406793594,negative,news,"Clearbridge Investments LLC Sells 309,325 Shares of Emerson Electric Co. $EMR"
EMR,2026-06-07,0.9194810772314668,positive,news,What Emerson Electric (EMR)'s Industrial AI and Corrosion Deals Mean For Shareholders
EMR,2026-06-07,0.8901089616119862,positive,news,WINTON GROUP Ltd Invests $6.10 Million in Emerson Electric Co. $EMR
EMR,2026-06-07,-0.9450285583734512,negative,news,"Fjarde AP Fonden Fourth Swedish National Pension Fund Sells 9,300 Shares of Emerson Electric Co. $EMR"
EMR,2026-06-07,-0.36685094237327576,negative,news,"TD Asset Management Inc Sells 11,090 Shares of Emerson Electric Co. $EMR"
EMR,2026-06-06,-0.9488371023908257,negative,news,"Cibc World Market Inc. Sells 100,326 Shares of Emerson Electric Co. $EMR"
EMR,2026-06-05,-0.9657568354159594,negative,news,Emerson Electric Co. stock underperforms Friday when compared to competitors
EMR,2026-06-05,0.026519954204559326,positive,news,Emerson's Intelligent Devices Segment Gains Momentum: Can It Sustain?
EMR,2026-06-05,0.9304208550602198,positive,news,Emerson Electric Co. (EMR) is Attracting Investor Attention: Here is What You Should Know
EMR,2026-06-05,0.9369894508272409,positive,news,Emerson Electric Co. $EMR Shares Acquired by CIBC Asset Management Inc
EMR,2026-06-04,0.9318292569369078,positive,news,RBC Capital raises Emerson stock price target on cost management
EMR,2026-06-04,0.9396854331716895,positive,news,Eaton Rallies 32% YTD: Should Investors Bet on the Stock Now?
EMR,2026-06-04,0.9362206049263477,positive,news,Eaton Rallies 32% YTD: Should Investors Bet on the Stock Now?
EMR,2026-06-04,0.9387365952134132,positive,news,Eaton Rallies 32% YTD: Should Investors Bet on the Stock Now?
EMR,2026-06-04,-0.9563193060457706,negative,news,Emerson Electric (EMR) Down 4.8% Since Last Earnings Report: Can It Rebound?
EMR,2026-06-04,-0.9562090877443552,negative,news,Emerson Electric (EMR) Down 4.8% Since Last Earnings Report: Can It Rebound?
EMR,2026-06-04,0.049447525292634964,neutral,news,Don't Ignore The Insider Selling In Emerson Electric
EMR,2026-06-04,0.5638481080532074,positive,news,Is Emerson Electric Stock Underperforming the S&P 500?
EMR,2026-06-04,0.8802263773977757,positive,news,Bank of New York Mellon Corp Increases Position in Emerson Electric Co. $EMR
EMR,2026-06-03,0.9380955267697573,positive,news,Dover Corp. stock (US25985P1030): shares edge higher after recent gains on NYSE
EMR,2026-06-03,0.9421148933470249,positive,news,AMETEK Inc. stock (US0311001004): NYSE shares edge higher on steady volume and institutional interest
EMR,2026-06-03,0.9318081215023994,positive,news,Emerson Electric Co. $EMR Shares Acquired by Westpac Banking Corp
EMR,2026-06-03,0.9386408310383558,positive,news,Marble Wealth LLC Buys New Position in Emerson Electric Co. $EMR
EMR,2026-06-03,0.8993331268429756,positive,news,Global Hyperscale Data Center Deal Might Change The Case For Investing In Generac Holdings (GNRC)
EMR,2026-06-02,0.9353418853133917,positive,news,AMETEK Inc stock (US0311001004): Shares rise as NYSE volume stays solid after recent institutional buying
EMR,2026-06-02,0.03172717057168484,neutral,news,"Emerson Electric (NYSE: EMR) EVP-linked trust sells 11,500 shares"
EMR,2026-06-02,0.5596022754907608,positive,news,Assessing Emerson Electric (EMR) Valuation After New AI And Corrosion Management Partnerships
EMR,2026-06-02,0.9282731488347054,positive,news,Emerson Electric Co. $EMR Shares Acquired by MUFG Securities EMEA plc
EMR,2026-06-02,0.46402429044246674,positive,news,"Emerson Electric Insiders Sell US$2.6m Of Stock, Possibly Signalling Caution"
EMR,2026-06-02,0.18693751096725464,positive,news,"BNP Paribas Sells 51,057 Shares of Emerson Electric Co. $EMR"
EMR,2026-06-01,-0.9506899919360876,negative,news,Emerson Electric Co. stock underperforms Monday when compared to competitors
EMR,2026-06-01,-0.015074493363499641,neutral,news,[144] EMERSON ELECTRIC CO SEC Filing
EMR,2026-06-01,0.9168826621025801,positive,news,Emerson Electric Co. $EMR Stock Position Raised by Nomura Asset Management Co. Ltd.
EMR,2026-05-31,0.9350336566567421,positive,news,Norges Bank Takes $1.05 Billion Position in Emerson Electric Co. $EMR
EMR,2026-05-31,0.9322708640247583,positive,news,Northwestern Mutual Wealth Management Co. Has $61.02 Million Stock Holdings in Emerson Electric Co. $EMR
EMR,2026-05-31,0.927077654749155,positive,news,Intech Investment Management LLC Grows Position in Emerson Electric Co. $EMR
EMR,2026-05-31,0.9215006418526173,positive,news,Eurizon Capital SGR S.p.A. Takes $50.22 Million Position in Emerson Electric Co. $EMR
EMR,2026-05-30,-0.9584680702537298,negative,news,National Pension Service Decreases Holdings in Emerson Electric Co. $EMR
EMR,2026-05-29,0.9174560829997063,positive,news,Emerson Electric Co. stock underperforms Friday when compared to competitors despite daily gains
EMR,2026-05-29,0.8444518968462944,positive,news,"Geode Capital Management LLC Acquires 76,488 Shares of Emerson Electric Co. $EMR"
NFLX,2026-06-10,0.9360254593193531,positive,news,Raymond James notes strong May data for Electronic Arts stock
NFLX,2026-06-10,0.9217198416590691,positive,news,May’s Spending Trends: UK spending returns to growth as confidence begins to recover
NFLX,2026-06-10,0.936814472079277,positive,news,"Netflix, Inc. $NFLX Position Increased by Motley Fool Wealth Management LLC"
NFLX,2026-06-10,0.6080804765224457,positive,news,"Cunning Capital Partners LP Has $3.75 Million Position in Netflix, Inc. $NFLX"
NFLX,2026-06-10,0.9398518484085798,positive,news,"Uber Technologies, Inc. (NYSE:UBER) Receives Average Recommendation of ""Moderate Buy"" from Analysts"
NFLX,2026-06-10,0.27305367588996887,neutral,news,Hotels face speed problem as video platforms reshape the booking journey
NFLX,2026-06-09,0.870462853461504,positive,news,"Stock Market Today, June 9: Payoneer Global Surges on Reports of $2.7 Billion Nuvei Acquisition Offer"
NFLX,2026-06-09,0.9209875175729394,positive,news,Mtron wins $6.8M follow-on order for US defense radar components through 2030
NFLX,2026-06-09,0.9344374220818281,positive,news,"Netflix, Inc. $NFLX Shares Bought by Westerkirk Capital Inc."
NFLX,2026-06-09,0.8847909169271588,positive,news,Colgate-Palmolive (CL) Has a Category-Leadership Engine That Deserves More Respect Than the Slow-Staples Label
NFLX,2026-06-09,0.9355540424585342,positive,news,"Monetary Management Group Inc. Increases Holdings in Netflix, Inc. $NFLX"
NFLX,2026-06-08,-0.14749282598495483,neutral,news,Viewpoint: The wide world of the TV sports business (by Kirk Varner)
NFLX,2026-06-08,-0.9635813739150763,negative,news,Why Investors Bailed on Beyond Meat Last Month
NFLX,2026-06-08,0.8735145442187786,positive,news,Accenture vs. EPAM Systems: Which Tech Consulting Stock Is a Better Buy in 2026?
NFLX,2026-06-08,0.009618153795599937,neutral,news,Netflix finds its Scooby-Doo for upcoming live-action series
NFLX,2026-06-08,-0.9590770192444324,negative,news,"Should You Buy Costco Wholesale Stock While It's Below $1,000?"
NFLX,2026-06-08,-0.9492710595950484,negative,news,"Should You Buy Costco Wholesale Stock While It's Below $1,000?"
NFLX,2026-06-08,0.06922617647796869,neutral,news,HUYA Inc stock (US44840F1084): Chinese game-streaming player after latest earnings
NFLX,2026-06-08,0.9292310699820518,positive,news,"Is Netflix, Inc. (NFLX) A Good Stock To Buy Now?"
NFLX,2026-06-08,-0.5285281836986542,negative,news,"West Family Investments Inc. Buys 18,409 Shares of Netflix, Inc. $NFLX"
NFLX,2026-06-08,0.9344555381685495,positive,news,"Erste Asset Management GmbH Raises Stake in Netflix, Inc. $NFLX"
NFLX,2026-06-07,0.45326679293066263,neutral,news,Versant's GammaTime Deal Tests Old TV IP In A Microdrama Funnel
NFLX,2026-06-07,0.2636052127927542,neutral,news,"Will Ferrell's New Comedy Series 'The Hawk' Premieres on Netflix July 16, 2026"
NFLX,2026-06-07,-0.8430742397904396,negative,news,The Walt Disney Company $DIS Shares Sold by ING Groep NV
NFLX,2026-06-07,0.9392727585509419,positive,news,"Syon Capital LLC Boosts Stake in Netflix, Inc. $NFLX"
NFLX,2026-06-07,0.9378097262233496,positive,news,"ING Groep NV Raises Stock Position in Netflix, Inc. $NFLX"
NFLX,2026-06-07,0.9307735366746783,positive,news,"Netflix, Inc. $NFLX Stock Holdings Increased by Nemes Rush Group LLC"
NFLX,2026-06-07,-0.9393589198589325,negative,news,Clearbridge Investments LLC Lowers Holdings in The Walt Disney Company $DIS
NFLX,2026-06-06,-0.0833838488906622,neutral,news,Netflix names new board chair as co-founder departs
NFLX,2026-06-06,0.2562660165131092,neutral,news,"VGIT vs FIGB: Which Bond ETF is Better on Cost, Yield, and Risk?"
NFLX,2026-06-06,0.9230279186740518,positive,news,"Vise Technologies Inc. Acquires 20,680 Shares of The Walt Disney Company $DIS"
NFLX,2026-06-06,-0.9613894009962678,negative,news,"Prestige Wealth Management Group LLC Sells 42,718 Shares of Warner Bros. Discovery, Inc. $WBD"
NFLX,2026-06-06,0.5918468981981277,positive,news,BI Asset Management Fondsmaeglerselskab A S Has $31.72 Million Position in The Walt Disney Company $DIS
NFLX,2026-06-05,0.0743074705824256,neutral,news,4 ETFs You Want to Own Right Now
NFLX,2026-06-05,0.0019339211285114288,neutral,news,TKO Stock Price and Chart — NYSE:TKO
NFLX,2026-06-05,0.043783389031887054,neutral,news,"Netflix Shareholders Approve 2026 Proposals, New Board Chair"
NFLX,2026-06-05,-0.04197845421731472,neutral,news,"Netflix names longtime director Jay Hoag as chairman, succeeding Reed Hastings"
NFLX,2026-06-05,0.9238954149186611,positive,news,SNSE Stock Surges To 21-Month High – Everything To Know About Its Faeth Therapeutics Acquisition
NFLX,2026-06-05,-0.05365126207470894,neutral,news,Netflix Picks Venture Capitalist Jay Hoag as Chairman
NFLX,2026-06-05,0.06915255263447762,neutral,news,"A Lincoln Educational Director Sold Over 15,000 Company Shares. Here's What Investors Should Know."
NFLX,2026-06-05,-0.9167631063610315,negative,news,"Netflix, Disney+ And Amazon Just Dodged Massive Canadian Streaming Levies That Would Have Cost Billions"
NFLX,2026-06-05,0.9136596135795116,positive,news,Netflix Stock Signals Upside as Bernstein Defends Streaming Giant With $110 Price Target
NFLX,2026-06-05,-0.7923527508974075,negative,news,Toro (NYSE:TTC) Price Target Cut to $100.00 by Analysts at Robert W. Baird
NFLX,2026-06-05,-0.05769282579421997,negative,news,Wall Street Bulls Look Optimistic About Netflix (NFLX): Should You Buy?
NFLX,2026-06-05,-0.7877181768417358,negative,news,Will Massive Buyback and Insider Selling Change Super Group (SGHC)'s Capital Allocation Narrative?
NFLX,2026-06-05,0.9141143038868904,positive,news,Prediction: TMC The Metals Company Will Soar Over the Next Year. Here's 1 Reason Why.
NFLX,2026-06-05,0.8646724224090576,positive,news,Netflix Stock (NFLX) Rises as Canada Reverses Content Requirement
CHTR,2026-06-09,0.6505805151537061,positive,news,Liberty Broadband Corp stock (US5307151044): share consolidation after merger with GCI Liberty
CHTR,2026-06-09,-0.9590210104361176,negative,news,"Franklin Resources Inc. Decreases Holdings in Charter Communications, Inc. $CHTR"
CHTR,2026-06-09,0.36222126614302397,neutral,news,Liberty Broadband stock (US5303071071): shares draw attention after unusual trading
CHTR,2026-06-09,0.04211435467004776,neutral,news,CHARTER NAMES CHRIS HACKER HEAD OF CORPORATE SECURITY
CHTR,2026-06-08,-0.05704861879348755,neutral,news,"AT&T, T-Mobile and Verizon join cable's 'STRIKE' force against network vandalism"
CHTR,2026-06-07,0.8953623678535223,positive,news,Is Harmonic Inc. (HLIT) A Good Stock To Buy Now?
CHTR,2026-06-06,-0.9553300719708204,negative,news,Charter Communications (CHTR) Valuation Check As Stock Decline Meets Heavy Investment In Upgrades And AI
CHTR,2026-06-05,0.9244487434625626,positive,news,VZ Shares Rise 8.6% in Six Months: What's the Next Move for Investors?
