ticker,date,sentiment_score,sentiment_label,content_type,title
BA,2026-04-26,0.9382026605308056,positive,news,This is Why HEICO Corporation (HEI) is The Best Industrial Stock Following Sherwood Avionics and Accessories Acquisition
BA,2026-04-26,0.9389377646148205,positive,news,Vanguard Group Inc. Has $15.41 Billion Position in The Boeing Company $BA
BA,2026-04-26,-0.866980941966176,negative,news,"Stock Analysis: Sell ASO and DXC, Watch BA | 2026 Market Insights - News and Statistics"
BA,2026-04-26,0.927570816129446,positive,news,Boeing Regains Delivery Lead Over Airbus As Q1 Revenues Jump
BA,2026-04-25,0.9389055157080293,positive,news,Coca-Cola Stock Is Up 11% in 2026: Here’s What Could Drive KO Next
BA,2026-04-25,0.937093110755086,positive,news,Boeing Reports $22.2B in Q1 Revenue as All Three Segments Grow Simultaneously
BA,2026-04-25,0.19443896412849426,neutral,news,Robot.com: Former Boeing CFO Gregory Smith Appointed To Board
BA,2026-04-25,0.9358577113598585,positive,news,Universal Beteiligungs und Servicegesellschaft mbH Increases Position in Northrop Grumman Corporation $NOC
BA,2026-04-25,0.9304447285830975,positive,news,Concurrent Investment Advisors LLC Has $15.41 Million Stock Holdings in The Boeing Company $BA
BA,2026-04-25,-0.8793752640485764,negative,news,Does GE's (GE) Revenue Jump and Buybacks Offset Softer Guidance in Its Aerospace Story?
BA,2026-04-25,-0.8156875595450401,negative,news,"Analysts’ Opinions Are Mixed on These Technology Stocks: Teledyne Technologies (TDY), International Business Machines (IBM) and ServiceNow (NOW)"
BA,2026-04-25,0.8447081185877323,positive,news,"U S Global Investors Inc. Grows Stake in Alaska Air Group, Inc. $ALK"
BA,2026-04-25,0.8942176997661591,positive,news,"Eastern Bankshares Earnings Call Highlights Growth, Caution"
BA,2026-04-25,0.9358966257423162,positive,news,World Kinect Lifts EPS Outlook After Marine Surge
BA,2026-04-24,-0.7818922102451324,negative,news,Xenetic Biosciences Grants Equity Award to Interim CEO
BA,2026-04-24,0.8710068967193365,positive,news,Life Time Group Shareholders Back Board and Governance Plans
BA,2026-04-24,-0.2654343247413635,negative,news,"Citizens Financial Investors Back Board, Reject Voting Proposal"
BA,2026-04-24,-0.518363893032074,negative,news,Kartoon Studios Completes Debt-for-Equity Settlement Agreement
BA,2026-04-24,0.8740704031661153,positive,news,"Willis Lease (NASDAQ: WLFC) plans stock split, more shares and pay vote"
BA,2026-04-24,0.1233786940574646,neutral,news,"Analysts’ Opinions Are Mixed on These Technology Stocks: Teledyne Technologies (TDY), International Business Machines (IBM) and ServiceNow (NOW)"
BA,2026-04-24,0.48722610250115395,positive,news,European Defense Rearmament Is Reshaping Markets: These 3 ETFs Capture the Shift
BA,2026-04-24,0.9210750609636307,positive,news,Kaiser Aluminum Corporation (NASDAQ:KALU) Q1 2026 Earnings Call Transcript
BA,2026-04-24,0.9256836753338575,positive,news,Procore Adds AI Leader to Board for Growth
BA,2026-04-24,0.9379137698560953,positive,news,Hexcel Corporation (NYSE:HXL) Q1 2026 Earnings Call Transcript
BA,2026-04-24,0.8807777836918831,positive,news,Boeing’s defense arm surges while company stays unprofitable
BA,2026-04-24,-0.7646889090538025,negative,news,Cadinha & Co. LLC Decreases Position in The Boeing Company $BA
BA,2026-04-24,0.8476943746209145,positive,news,Lockheed Martin Corporation (NYSE:LMT) Q1 2026 Earnings Call Transcript
BA,2026-04-24,-0.4285113885998726,negative,news,Boeing Company Trade Ideas — MUN:BCO
BA,2026-04-24,0.7759219566360116,positive,news,Absher Wealth Management LLC Boosts Stake in The Boeing Company $BA
BA,2026-04-24,0.8832446532323956,positive,news,"Ryanair Holdings PLC (NASDAQ:RYAAY) Receives Average Rating of ""Moderate Buy"" from Analysts"
BA,2026-04-24,0.35056476294994354,positive,news,Why Boeing’s ‘Not Applicable’ Mine Safety Disclosure Still Matters for Investors
BA,2026-04-24,-0.01046076975762844,neutral,news,AerSale® Announces Date for First Quarter 2026 Earnings Release Conference Call
BA,2026-04-24,0.9395551159977913,positive,news,Hexcel Q1 Earnings Call Highlights
BA,2026-04-24,0.9267743909731507,positive,news,"StandardAero outlines 2026 double-digit earnings growth and $270M–$300M cash flow target as LEAP, CFM56 programs ramp"
BA,2026-04-24,0.911757661961019,positive,news,Vertical Aerospace achieves major milestone with eVTOL flight development
BA,2026-04-23,0.8695441754534841,positive,news,RB Global Advances BigIron Acquisition with FTC Clearance
BA,2026-04-23,0.3926609456539154,positive,news,Confirmed: Boeing 777X To Enter Service In 2027 After 7-Year & $15 Billion Delay
BA,2026-04-23,0.27403989527374506,neutral,news,GCI Liberty Gains Full Voting Control Under Chairman Malone
BA,2026-04-23,-0.7590613923966885,negative,news,AngioDynamics Files Patent Suit to Protect Thrombectomy Technology
BA,2026-04-23,0.7471302449703217,positive,news,Venture Global Issues New Senior Secured Notes Offering
BA,2026-04-23,0.8396599143743515,positive,news,Sky Quarry Expands At-The-Market Equity Offering Program
DE,2026-04-27,0.9289331790059805,positive,news,Caterpillar Inc. stock (US1491231015): Is infrastructure demand strong enough to unlock new upside?
DE,2026-04-27,-0.7723113745450974,negative,news,"State of Michigan Retirement System Sells 2,300 Shares of Deere & Company $DE"
DE,2026-04-27,0.0032937824726104736,positive,news,"Sanctuary Advisors LLC Sells 1,833 Shares of Deere & Company $DE"
DE,2026-04-27,0.9339299453422427,positive,news,"Concurrent Investment Advisors LLC Buys 6,507 Shares of Deere & Company $DE"
DE,2026-04-27,0.9179142992943525,positive,news,Anchyra Partners LLC Makes New $1.48 Million Investment in Deere & Company $DE
DE,2026-04-27,0.9380056131631136,positive,news,What To Expect From Xylem’s (XYL) Q1 Earnings
DE,2026-04-26,0.3468099692836404,neutral,news,Caterpillar Inc. stock (US1491231015): Why Google Discover changes matter more now for heavy machine
DE,2026-04-26,-0.9669924420304596,negative,news,Lindsay Corporation Shares Plunge Following Second Quarter Earnings Miss
DE,2026-04-26,0.9059434942901134,positive,news,Is Deere & Company (DE) A Good Stock To Buy Now?
DE,2026-04-26,0.9366016890853643,positive,news,Caterpillar Inc. stock (US1491231015): Why services growth is suddenly worth a closer look
DE,2026-04-26,0.9046672722324729,positive,news,"Vanguard Group Inc. Acquires 198,332 Shares of Deere & Company $DE"
DE,2026-04-26,0.9129389403387904,positive,news,"Cwm LLC Acquires 100,523 Shares of Amcor PLC $AMCR"
DE,2026-04-26,-0.9642771556973457,negative,news,Stanley Black & Decker Inc. stock underperforms Wednesday when compared to competitors
DE,2026-04-25,0.9303445927798748,positive,news,ETF investors cheer as Deere & Company surges 13% after earnings beat
DE,2026-04-25,-0.892314437776804,negative,news,Should Deere’s (DE) Expected Q2 Profit Drop Reshape How Investors View Its Precision Tech Story?
DE,2026-04-25,0.8196964468806982,positive,news,Intellia Therapeutics Stock Jumps After Hours Ahead of First Phase 3 In Vivo CRISPR Readout
DE,2026-04-25,-0.9422327354550362,negative,news,eBay Inc. Stock Slides 5% as Depop Deal Faces UK Test Before Earnings
DE,2026-04-25,-0.9626898895949125,negative,news,Deere Stock Tumbles Before Earnings as Wall Street Tests John Deere’s 2026 Rebound
DE,2026-04-25,-0.924631305038929,negative,news,Klingman & Associates LLC Decreases Position in Deere & Company $DE
DE,2026-04-25,0.9230986582115293,positive,news,John Deere agrees to buy US construction tech firm Tenna
DE,2026-04-25,0.9245485821738839,positive,news,Deere & Company $DE Shares Acquired by Teacher Retirement System of Texas
DE,2026-04-25,0.9120036037638783,positive,news,Foresight Signs an Agreement with a Leading European Car Manufacturer to Advance its Stereo Vision AI-Based Solution
DE,2026-04-25,-0.659446194767952,negative,news,Calamos Advisors LLC Has $23.57 Million Holdings in Deere & Company $DE
DE,2026-04-25,0.9132650420069695,positive,news,"Deere soars to all-time high after beat-and-raise Q1 report, sees 2026 as ag cycle bottom"
DE,2026-04-24,-0.9672183045186102,negative,news,Deere & Co Stock (DE) Moved Down by 3.70% on Apr 24: Key Drivers Unveiled
DE,2026-04-24,-0.9563806429505348,negative,news,Deere & Co. stock underperforms Friday when compared to competitors
DE,2026-04-24,-0.9541741982102394,negative,news,Deere slides 3.1% as investors refocus on soft ag-equipment demand and tariff/legal overhangs
DE,2026-04-24,0.09420792013406754,neutral,news,Get Paid 10% to Buy PWR at a 30% Discount – Here’s How
DE,2026-04-24,0.91973926872015,positive,news,"Cash Rich, Low Price – Gartner Stock to Break Out?"
DE,2026-04-24,-0.9303056374192238,negative,news,Arizona State Retirement System Decreases Holdings in Deere & Company $DE
DE,2026-04-24,0.9311640299856663,positive,news,Magna International (MGA) Projected to Post Quarterly Earnings on Friday
DE,2026-04-23,0.014509046450257301,neutral,news,"John Deere Capital Corp files for $500 million 4.375% senior notes due April 15, 2031"
DE,2026-04-23,0.0052301958203315735,neutral,news,"John Deere Capital Corp files for $500 million 4.125% senior notes due January 18, 2029"
DE,2026-04-23,-0.7798467949032784,negative,news,Deere & Co. stock underperforms Thursday when compared to competitors despite daily gains
DE,2026-04-23,0.33155681006610394,neutral,news,Beyond spraying: John Deere reveals See & Scout built on precision ag tech
DE,2026-04-23,0.9312796192243695,positive,news,Juno Financial Group LLC Makes New Investment in Deere & Company $DE
DE,2026-04-23,0.9370222687721252,positive,news,Rothschild & Co Wealth Management UK Ltd Grows Stock Position in Deere & Company $DE
DE,2026-04-23,0.8739866241812706,positive,news,"United Asset Strategies Inc. Buys 3,592 Shares of Deere & Company $DE"
DE,2026-04-23,-0.1908549964427948,negative,news,"OVERSEA CHINESE BANKING Corp Ltd Sells 5,000 Shares of Deere & Company $DE"
DE,2026-04-23,-0.4108991324901581,negative,news,Intuit Stock Pulls Back to Support – Smart Entry?
DE,2026-04-22,-0.9577580727636814,negative,news,Deere (DE) Stock Sinks As Market Gains: What You Should Know
DE,2026-04-22,0.8456959305331111,positive,news,Deere & Company $DE is M&T Bank Corp's 6th Largest Position
DE,2026-04-22,0.7418474871665239,positive,news,How John Deere Beat the Great Depression With the Model A and B
DE,2026-04-22,-0.47320036590099335,negative,news,"Boston Trust Walden Corp Sells 2,771 Shares of Deere & Company $DE"
DE,2026-04-21,-0.9087621793150902,negative,news,Terex Corp. Experiences Valuation Adjustment Amid Mixed Performance Metrics and Competitive Landscape
DE,2026-04-21,0.9334419015794992,positive,news,American Express Stock Hits Record $72B Revenue as Platinum Refresh Delivers
DE,2026-04-21,-0.9672304969280958,negative,news,Deere & Co. stock underperforms Tuesday when compared to competitors
DE,2026-04-21,0.3371697664260864,positive,news,The Flat Guidance Fear: Why Extra Space Storage Stock May Be Mispriced in 2026
DE,2026-04-21,-0.6191891357302666,negative,news,John Deere agrees to pay $99 million to farmers over claims they’re monopolizing repairs and overcharging farmers
DE,2026-04-21,0.9395499993115664,positive,news,TD Waterhouse Canada Inc. Increases Position in Howmet Aerospace Inc. $HWM
VLO,2026-04-27,0.9098943499848247,positive,news,"Advisors Capital Management LLC Acquires 6,164 Shares of Phillips 66 $PSX"
VLO,2026-04-26,-0.944419520907104,negative,news,California is sacrificing its economic future on the altar of climate change
VLO,2026-04-26,-0.7927482426166534,negative,news,Valero Energy Corporation $VLO Position Decreased by Munich Reinsurance Co Stock Corp in Munich
VLO,2026-04-24,0.9295094963163137,positive,news,Morgan Stanley Boosts Valero Energy (NYSE:VLO) Price Target to $222.00
VLO,2026-04-24,0.9319093134254217,positive,news,"B. Metzler seel. Sohn & Co. AG Purchases 4,623 Shares of Valero Energy Corporation $VLO"
VLO,2026-04-23,0.8459170311689377,positive,news,Jones Act Waiver Triggers First Foreign-Flag US Crude Shipment by Phillips 66
VLO,2026-04-23,-0.48528085090219975,negative,news,"Exclusive-Valero partially restarts Port Arthur, Texas refinery after blast, sources say"
VLO,2026-04-23,0.8817753493785858,positive,news,XCF CEO to Participate in ROTH London Conference Amid Growing UK Jet Fuel Supply Pressures
VLO,2026-04-22,0.5536287650465965,positive,news,Western Gateway Pipeline Advances as Phillips 66 and Kinder Morgan Secure Shipper Commitments
VLO,2026-04-22,0.5955625772476196,positive,news,Important Factors to Watch Ahead of BP's Q1 Earnings Release
VLO,2026-04-22,0.9309351835399866,positive,news,M&T Bank Corp Has $61.74 Million Position in Valero Energy Corporation $VLO
VLO,2026-04-22,0.9295346736907959,positive,news,Valero Energy Hits Day High with Strong 3.14% Intraday Surge
VLO,2026-04-21,0.7397509887814522,positive,news,What's Going On With Chevron Stock On Monday?
VLO,2026-04-21,0.03932286147028208,neutral,news,CVR Energy (NYSE: CVI) details 2026 virtual meeting and exec pay vote
VLO,2026-04-21,0.5472750961780548,positive,news,Valero Energy Corp. stock outperforms competitors on strong trading day
VLO,2026-04-21,0.7068879380822182,positive,news,"Fund Update: 24,753 VALERO ENERGY (VLO) shares added to Guinness Asset Management LTD portfolio"
VLO,2026-04-21,0.4703504480421543,positive,news,"Broadcom, Capital One And Alibaba On CNBC’s ‘Final Trades’ - Broadcom (NASDAQ:AVGO), Alibaba Gr Hldgs (NY"
VLO,2026-04-21,0.523322407156229,positive,news,Scorpio Tankers Inc stock (MHY7542C1306): Why tanker rate volatility matters more now
VLO,2026-04-21,0.07888563442975283,neutral,news,Marathon Petroleum stock (US56585A1025): Why refined product margins matter more now
VLO,2026-04-20,0.6950219133868814,positive,news,"Phillips 66, Kinder Morgan Advance Western Gateway Pipeline"
VLO,2026-04-20,-0.06637018918991089,negative,news,Valero Energy Corp. stock outperforms competitors on strong trading day
VLO,2026-04-20,-0.9483793452382088,negative,news,"Valero partially restarts Port Arthur, Texas, refinery after blast"
VLO,2026-04-20,-0.9196483474224806,negative,news,Raymond James reiterates SM Energy stock Underperform rating on oil price decline
VLO,2026-04-20,0.9204680072143674,positive,news,Enbridge Inc stock (CA29250N1050): Why pipeline stability matters more now for energy investors?
VLO,2026-04-20,0.3384817838668823,positive,news,Does Delek US Holdings’ (DK) Bigger Credit Facility Reveal a Shift in Balance‑Sheet Strategy?
VLO,2026-04-20,0.939604265615344,positive,news,Enlight Renewable Energy Ltd. (ENLT) Beats Q3 Earnings and Revenue Estimates
VLO,2026-04-19,0.8214191310107708,positive,news,Cwm LLC Has $17.17 Million Stock Position in Phillips 66 $PSX
VLO,2026-04-19,0.5402278173714876,positive,news,AZZ Inc stock (US05481B1052): Why mobile-first delivery now matters more for industrial investors
VLO,2026-04-19,0.39365027751773596,neutral,news,Phillips 66 stock (US74460D1090): Why Google Discover changes matter more now
VLO,2026-04-18,0.8673984738998115,positive,news,Ultrapar Participações S.A. stock (BRUGPAACNOR8): Why does its diversified energy model matter more now for U.S. investors?
VLO,2026-04-18,0.9319843649864197,positive,news,Valero Energy: An Oil Refiner That Will Grow Even With An Open Strait Of Hormuz (NYSE:VLO)
VLO,2026-04-18,-0.9331857152283192,negative,news,Valero Energy Corp. stock underperforms Friday when compared to competitors
VLO,2026-04-18,0.099069744348526,positive,news,Phillips 66 declares $1.27 quarterly dividend per share
VLO,2026-04-17,-0.9669651770964265,negative,news,Valero Energy Corp (VLO) Shares Fall 7.5% -- What GF Score of 74 Tells Investors
VLO,2026-04-17,0.17685758601874113,neutral,news,Valero Energy Corp stock (US91913Y1001): Why refining margins now matter more than ever for investor
VLO,2026-04-17,0.7668632054701447,positive,news,Valero Energy Corp stock (US91913Y1001): Why refining margins now matter more than ever for investor
VLO,2026-04-17,-0.9666529502719641,negative,news,ConocoPhillips Stock (COP) Moved Down by 5.26% on Apr 17: Facts Behind the Movement
VLO,2026-04-17,-0.9630740722641349,negative,news,Valero Energy Corp. stock underperforms Friday when compared to competitors
VLO,2026-04-17,0.8414119593799114,positive,news,"First Mid Bancshares, Inc. (NASDAQ:FMBH) Given Consensus Rating of ""Moderate Buy"" by Brokerages"
VLO,2026-04-17,-0.7779476717114449,negative,news,"Oil Above $90, Pump Above $4 — And 7 Energy Stocks Still Trading At A Wide Discount"
VLO,2026-04-16,-0.9182790126651525,negative,news,Report: Valero Energy Partially Restarts Port Arthur Refinery in Texas After Explosion Incident
VLO,2026-04-16,-0.6728218421339989,negative,news,"Exclusive: Valero partially restarts Port Arthur, Texas refinery after blast, sources say"
VLO,2026-04-16,0.9137185290455818,positive,news,Valero Energy Corp. stock outperforms competitors on strong trading day
VLO,2026-04-16,-0.8836158104240894,negative,news,"Hormuz Closed, Oil At $90 — These 7 Stocks Haven't Repriced - APA (NASDAQ:APA), Devon Energy (NYSE:DVN)"
VLO,2026-04-16,0.6213237261399627,positive,news,Phillips 66 Weighs Renewables Shift And California Pipeline Against Future Returns
VLO,2026-04-16,-0.464433878660202,negative,news,Short Interest in Valero Energy Corporation (NYSE:VLO) Declines By 25.9%
VLO,2026-04-15,0.8964811889454722,positive,news,Valero Energy Corp stock (US91913Y1001): Why does its refining edge matter more now for U.S. investo
VLO,2026-04-15,0.6523821270093322,positive,news,Eni S.p.A. stock (IT0003128367): Why does its energy transition strategy matter more now?
VLO,2026-04-15,0.7141163721680641,positive,news,"Citigroup Adjusts Valero Energy Price Target to $246 From $212, Maintains Neutral Rating"
VLO,2026-04-15,-0.5340431481599808,negative,news,"Analysts Offer Insights on Energy Companies: Valero Energy (VLO), EOG Resources (EOG) and Chevron (CVX)"
VZ,2026-04-27,0.9297878853976727,positive,news,Verizon Stock In Rally-Mode After Beat-and-Raise
VZ,2026-04-27,0.8837343342602253,positive,news,"410,382 Shares in Verizon Communications Inc. $VZ Acquired by Managed Asset Portfolios LLC"
VZ,2026-04-27,0.8898516297340393,positive,news,"Verizon's Q1 revenue up 2.9% to $34.4B, below expectations"
VZ,2026-04-27,0.936655854806304,positive,news,Verizon (NYSE: VZ) lifts 2026 EPS guidance on Q1 growth in profit and cash flow
VZ,2026-04-27,0.9358243308961391,positive,news,Verizon posts first positive first-quarter phone adds since 2013
VZ,2026-04-27,-0.9486106112599373,negative,news,Comerica Bank Reduces Stock Position in Verizon Communications Inc. $VZ
VZ,2026-04-27,0.9118897877633572,positive,news,Verizon’s stock rises as the company posts surprise subscriber growth under new CEO
VZ,2026-04-27,0.6420968472957611,positive,news,Verizon: Q1 Earnings Snapshot
VZ,2026-04-26,0.931793924421072,positive,news,Major Earnings Reports Ahead for Verizon (VZ) and Domino's Pizza (DPZ)
VZ,2026-04-26,0.9248095322400331,positive,news,T-Mobile US (TMUS): One of the Hottest Low Risk High Growth Companies
VZ,2026-04-26,-0.7544422149658203,negative,news,Teachers Retirement System of The State of Kentucky Lowers Stock Holdings in Verizon Communications Inc. $VZ
VZ,2026-04-26,0.93699617870152,positive,news,Verizon Communications Inc. $VZ Shares Acquired by Vanguard Group Inc.
VZ,2026-04-26,-0.9336838256567717,negative,news,Sanctuary Advisors LLC Cuts Stock Holdings in Verizon Communications Inc. $VZ
VZ,2026-04-26,0.13533160090446472,positive,news,"Richard C. Young & CO. LTD. Sells 50,067 Shares of Verizon Communications Inc. $VZ"
VZ,2026-04-26,0.8837009537965059,positive,news,"Advisors Capital Management LLC Purchases 465,131 Shares of Verizon Communications Inc. $VZ"
VZ,2026-04-25,0.933688260614872,positive,news,Verizon Communications Inc. $VZ Stock Position Lifted by Munich Reinsurance Co Stock Corp in Munich
VZ,2026-04-25,0.3485393226146698,positive,news,Verizon Communications Inc. $VZ Shares Sold by Solidarity Wealth LLC
VZ,2026-04-25,-0.7904743943363428,negative,news,"Calamos Advisors LLC Sells 31,802 Shares of Verizon Communications Inc. $VZ"
VZ,2026-04-24,-0.39488887786865234,negative,news,"Weekly Market Update: Stocks Flat as Energy Rises, Healthcare Falls"
VZ,2026-04-24,-0.9670826131477952,negative,news,Verizon Communications (NYSE:VZ) Trading Down 1.6% - Time to Sell?
VZ,2026-04-24,-0.9671864975243807,negative,news,Verizon Communications Inc. stock underperforms Friday when compared to competitors
VZ,2026-04-24,-0.7141886353492737,negative,news,Verizon (VZ) Wins an Injunction Prohibiting T-Mobile’s Ad Campaign Promising Significant Savings
VZ,2026-04-24,-0.7787959165871143,negative,news,Verizon Avoids $175 Million Verdict Due to Patent Owner’s Delay
VZ,2026-04-24,0.11273843795061111,neutral,news,Verizon (NYSE: VZ) EVP receives additional phantom stock units
VZ,2026-04-24,0.04770838934928179,neutral,news,Verizon (VZ) insider adds phantom stock via deferred compensation award
VZ,2026-04-24,0.48088264092803,positive,news,Verizon (VZ) CEO awarded new phantom stock in deferred plan
VZ,2026-04-24,0.935743760317564,positive,news,"América Móvil, S.A.B. de C.V. (NYSE:AMX) Q1 2026 Earnings Call Transcript"
VZ,2026-04-24,0.500174593180418,positive,news,Verizon (NYSE: VZ) EVP gains phantom stock units via deferred plan
VZ,2026-04-24,0.8766749314963818,positive,news,Verizon earnings on deck: Can CEO turnaround deliver subscriber growth?
VZ,2026-04-24,0.019644413143396378,neutral,news,How Will Verizon Communications Stock React To Its Upcoming Earnings?
VZ,2026-04-24,-0.542622298002243,negative,news,Burke & Herbert Financial Services Q1 2026 Earnings Report
VZ,2026-04-24,-0.31426987051963806,negative,news,Arizona State Retirement System Decreases Stake in Verizon Communications Inc. $VZ
VZ,2026-04-24,0.8106322232633829,positive,news,Uniti Bets Big on Fiber Growth After Windstream Merger
VZ,2026-04-23,0.9284417070448399,positive,news,Verizon Communications (NYSE:VZ) Shares Up 2.7% - Still a Buy?
VZ,2026-04-23,0.9321891143918037,positive,news,ASTS Gains As FCC Approval Validates SpaceMobile Technology
VZ,2026-04-23,0.8824786259792745,positive,news,KKR invests $1.5bn in tower company Vertical Bridge
VZ,2026-04-23,0.008194390684366226,neutral,news,VZ4795624 Bond Analysis — Key Metrics
VZ,2026-04-23,-0.6770880073308945,negative,news,T-Mobile US (TMUS) Tops List of Oversold Communication Services Stocks
VZ,2026-04-23,0.028632191009819508,neutral,news,VZ4388863 Bond Analysis — Key Metrics
VZ,2026-04-23,0.8657302507199347,positive,news,"Verizon Frontline Network Slice available for laptops, tablets and smartphones nationwide"
VZ,2026-04-23,0.89401486935094,positive,news,"First responders get dedicated Verizon 5G on phones, tablets, laptops"
VZ,2026-04-23,0.9290351308882236,positive,news,Verizon Communications Inc. $VZ Shares Purchased by Teacher Retirement System of Texas
VZ,2026-04-23,-0.8512401729822159,negative,news,Williams-Sonoma price driven lower by important resistance - Forecast today - 23-04-2026
VZ,2026-04-23,0.9353718487545848,positive,news,Villere ST Denis J & Co. LLC Grows Holdings in Verizon Communications Inc. $VZ
VZ,2026-04-23,0.16143092513084412,positive,news,Crown Castle Is Nearing the End of Its Transformation Into a Stable US Wireless Tower Firm
VZ,2026-04-23,-0.4826020896434784,negative,news,"Meritage Portfolio Management Has $293,000 Stock Position in Verizon Communications Inc. $VZ"
VZ,2026-04-22,0.8843063432723284,positive,news,Crown Castle Q1 2026 Earnings Call: Complete Transcript
VZ,2026-04-22,-0.5355190485715866,negative,news,Earnings call transcript: Crown Castle’s Q1 2026 earnings miss but future guidance steady
VZ,2026-04-22,0.9241077043116093,positive,news,AT&T Earnings: Wireless Competition Remains Challenging; Full Steam Ahead on Network Investment
VZ,2026-04-22,-0.7390155885368586,negative,news,House Appropriators Move to Block NextNav Proposal
PEP,2026-04-27,0.6348641663789749,positive,news,Coca-Cola’s Q1 2026 Preview: Pricing Power and Tariff Exposure Test the Defensive Rally
PEP,2026-04-27,0.9352913778275251,positive,news,Keurig Dr Pepper reports Q1 2026
PEP,2026-04-27,0.40206415113061666,neutral,news,Hershey’s new sustainability strategy offers blueprint for balancing business & ESG needs
PEP,2026-04-27,0.6109489798545837,positive,news,"State of Michigan Retirement System Has $52.55 Million Stake in PepsiCo, Inc. $PEP"
PEP,2026-04-27,-0.9430129043757915,negative,news,"Sanctuary Advisors LLC Decreases Stock Holdings in PepsiCo, Inc. $PEP"
PEP,2026-04-27,0.46201691031455994,positive,news,"Comerica Bank Has $66.48 Million Stake in PepsiCo, Inc. $PEP"
PEP,2026-04-27,0.8550762990489602,positive,news,"D.A. Davidson & CO. Acquires 98,130 Shares of PepsiCo, Inc. $PEP"
PEP,2026-04-27,-0.9497215710580349,negative,news,"Bernstein downgrades Campbell’s stock rating on soup, snack woes"
PEP,2026-04-27,-0.940013824030757,negative,news,"Bernstein downgrades Campbell’s stock rating on soup, snack woes By Investing.com"
PEP,2026-04-27,0.9376997519284487,positive,news,"Advisors Capital Management LLC Buys 78,313 Shares of Hershey Company (The) $HSY"
PEP,2026-04-26,0.6665179561823606,positive,news,The Coca-Cola Company stock (US1912161007): Is its global brand moat strong enough to unlock new upside?
PEP,2026-04-26,0.9140655286610126,positive,news,"PepsiCo, Inc. $PEP Shares Purchased by Vanguard Group Inc."
PEP,2026-04-26,0.8960455320775509,positive,news,"Coca-Cola, Colgate-Palmolive, and PepsiCo: Dividend Growth Stocks for 2026 - News and Statistics"
PEP,2026-04-26,-0.9438834227621555,negative,news,"Advisors Capital Management LLC Cuts Stock Position in PepsiCo, Inc. $PEP"
PEP,2026-04-26,0.9262718260288239,positive,news,"AEGON ASSET MANAGEMENT UK Plc Buys 181,232 Shares of PepsiCo, Inc. $PEP"
PEP,2026-04-26,0.001154102385044098,neutral,news,Is Coca-Cola (KO) Offering A Fair Entry Point At Around US$76 Per Share
