ticker,date,sentiment_score,sentiment_label,content_type,title
BAC,2026-04-27,0.8107133656740189,positive,news,APA Corporation $APA Shares Bought by Zurcher Kantonalbank Zurich Cantonalbank
BAC,2026-04-27,0.031771037727594376,neutral,news,HCA Announces Proposed Public Offering of Senior Notes
BAC,2026-04-27,-0.9471092391759157,negative,news,Stifel reiterates Buy on Hayward stock ahead of earnings
BAC,2026-04-27,0.9318011691793799,positive,news,"Middleton & Co. Inc. MA Buys 8,242 Shares of American Water Works Company, Inc. $AWK"
BAC,2026-04-27,0.8626789171248674,positive,news,Scorpio Tankers Inc. Announces New Credit Facility
BAC,2026-04-27,0.933929331600666,positive,news,Scorpio Tankers secures $50M credit facility from BofA
BAC,2026-04-27,0.9399996232241392,positive,news,Bank of America Securities Reiterates Buy Rating on Capital One Financial (COF) Stock
BAC,2026-04-27,0.9374943822622299,positive,news,Nippon Life Global Investors Americas Inc. Has $48.36 Million Stock Position in Bank of America Corporation $BAC
BAC,2026-04-27,-0.6507374495267868,negative,news,S&P 500: Sell in May and go away? BofA weighs in
BAC,2026-04-27,-0.7185845766216516,negative,news,"State of Michigan Retirement System Sells 89,900 Shares of Bank of America Corporation $BAC"
BAC,2026-04-27,0.9336528908461332,positive,news,"M&T Bank Corp Has $4.91 Million Holdings in Selective Insurance Group, Inc. $SIGI"
BAC,2026-04-27,0.929699482396245,positive,news,Vanguard Group Inc. Raises Stock Position in Crown Castle Inc. $CCI
BAC,2026-04-27,-0.7878075689077377,negative,news,"Teacher Retirement System of Texas Sells 146,691 Shares of Jacobs Solutions Inc. $J"
BAC,2026-04-27,-0.9028450846672058,negative,news,"Teacher Retirement System of Texas Sells 26,794 Shares of Keysight Technologies Inc. $KEYS"
BAC,2026-04-27,0.8577493103221059,positive,news,"Vanguard Group Inc. Buys 387,100 Shares of Marsh & McLennan Companies, Inc. $MRSH"
BAC,2026-04-27,-0.9587610624730587,negative,news,Morgan Stanley $MS Shares Sold by M&T Bank Corp
BAC,2026-04-27,0.9250146523118019,positive,news,"Merit Financial Group LLC Purchases 13,458 Shares of JPMorgan Chase & Co. $JPM"
BAC,2026-04-27,0.9066182896494865,positive,news,Better Buy Right Now: American Express vs. Bank of America
BAC,2026-04-27,-0.935460539534688,negative,news,"Comerica Bank Sells 5,534 Shares of Union Pacific Corporation $UNP"
BAC,2026-04-27,0.2299199104309082,neutral,news,Calamos Advisors LLC Acquires New Stake in Icon Plc $ICLR
BAC,2026-04-27,0.6828249646350741,positive,news,"19,306 Shares in Bank of America Corporation $BAC Purchased by Anchyra Partners LLC"
BAC,2026-04-27,0.343959990888834,neutral,news,ON THE MOVE: Optiver Gets Lawrence Tanzman; Seamus O’Neill to B. Riley
BAC,2026-04-27,0.9351474847644567,positive,news,"Aprio Wealth Management LLC Purchases 24,893 Shares of Bank of America Corporation $BAC"
BAC,2026-04-27,0.9372808011248708,positive,news,"Advisors Capital Management LLC Acquires 16,018 Shares of MetLife, Inc. $MET"
BAC,2026-04-27,0.9205453488975763,positive,news,"Anchyra Partners LLC Invests $48.01 Million in T. Rowe Price Group, Inc. $TROW"
BAC,2026-04-27,0.9343284284695983,positive,news,"Aprio Wealth Management LLC Raises Position in The Goldman Sachs Group, Inc. $GS"
BAC,2026-04-27,-0.3964179456233978,negative,news,"Omnicom Group Inc. (NYSE:OMC) Given Average Rating of ""Hold"" by Brokerages"
BAC,2026-04-27,-0.06018122285604477,neutral,news,Case: Bank of America Corp. v. City of Miami and Wells Fargo & Co. v. City of Miami
BAC,2026-04-27,-0.5663723610341549,negative,news,HDFC Bank Vs ICICI Bank Vs Axis Bank: Dividend Yield Or Fixed Deposit? Which Creates More Wealth
BAC,2026-04-26,0.9050487093627453,positive,news,Short Interest in Barclays PLC (NYSE:BCS) Decreases By 54.9%
BAC,2026-04-26,0.4366260915994644,positive,news,Bank of America’s $16 Billion Oracle AI Data Center Deal Puts Wall Street’s AI Bet Under a Harsh Light
BAC,2026-04-26,0.03815250564366579,neutral,news,Business People: Channon Lemon joins the board at First Energy
BAC,2026-04-26,-0.9588232766836882,negative,news,"Bank of America Cuts Pentair (PNR) PT to $88, Sees Weak Q1 Ahead"
BAC,2026-04-26,-0.6712801903486252,negative,news,Imperial Oil Limited $IMO Shares Sold by Universal Beteiligungs und Servicegesellschaft mbH
BAC,2026-04-26,0.9408900905400515,positive,news,"Gaming and Leisure Properties, Inc. $GLPI Shares Bought by Universal Beteiligungs und Servicegesellschaft mbH"
BAC,2026-04-26,0.9322358872741461,positive,news,MGM Resorts International $MGM Stake Lifted by Teachers Retirement System of The State of Kentucky
BAC,2026-04-26,0.9387430967763066,positive,news,"Vanguard Group Inc. Boosts Holdings in Analog Devices, Inc. $ADI"
BAC,2026-04-26,0.27585652470588684,positive,news,"Vanguard Group Inc. Sells 202,187 Shares of Howmet Aerospace Inc. $HWM"
BAC,2026-04-26,-0.9347189292311668,negative,news,"Universal Beteiligungs und Servicegesellschaft mbH Sells 37,562 Shares of Coterra Energy Inc. $CTRA"
BAC,2026-04-26,0.9374464768916368,positive,news,COPT Defense Properties $CDP Shares Acquired by Zurcher Kantonalbank Zurich Cantonalbank
BAC,2026-04-26,-0.9492656597867608,negative,news,"Zurcher Kantonalbank Zurich Cantonalbank Sells 156 Shares of NVR, Inc. $NVR"
BAC,2026-04-26,0.9354518633335829,positive,news,Simon Quick Advisors LLC Raises Stock Holdings in Caterpillar Inc. $CAT
BAC,2026-04-26,-0.8843044079840183,negative,news,Simon Quick Advisors LLC Trims Stake in Bank of America Corporation $BAC
BAC,2026-04-26,0.42722712457180023,positive,news,"Sanctuary Advisors LLC Acquires 4,809 Shares of The Goldman Sachs Group, Inc. $GS"
BAC,2026-04-26,0.2559915781021118,positive,news,"Impax Asset Management Group plc Sells 17,862 Shares of Prologis, Inc. $PLD"
BAC,2026-04-26,-0.8695962727069855,negative,news,Coca-Cola Europacific Partners $CCEP Shares Sold by Teacher Retirement System of Texas
BAC,2026-04-26,0.8912560101598501,positive,news,"M&T Bank Corp Purchases 20,425 Shares of Advanced Energy Industries, Inc. $AEIS"
BAC,2026-04-26,0.9277279023081064,positive,news,"M&T Bank Corp Increases Stake in PulteGroup, Inc. $PHM"
SCHW,2026-04-27,0.9039804199710488,positive,news,The Charles Schwab Corporation $SCHW Shares Bought by D.A. Davidson & CO.
SCHW,2026-04-27,0.7443186864256859,positive,news,"Moderna, Inc. (NASDAQ:MRNA) Given Average Recommendation of ""Reduce"" by Brokerages"
SCHW,2026-04-26,0.0881730318069458,positive,news,"Argus Cuts Schwab (SCHW) Target after Q1, Sees Continued Growth Ahead"
SCHW,2026-04-26,-0.9572678366675973,negative,news,Charles Schwab earnings beat estimates. The stock slumped.
SCHW,2026-04-26,-0.00804387591779232,neutral,news,Schwab US TIPS ETF declares monthly distribution of $0.1766
SCHW,2026-04-26,0.8683115169405937,positive,news,Abacus FCF Advisors LLC Invests $11.07 Million in The Charles Schwab Corporation $SCHW
SCHW,2026-04-26,0.003647785633802414,neutral,news,Schwab Core Bond ETF declares monthly distribution of $0.0881
SCHW,2026-04-26,0.05634821020066738,neutral,news,Schwab Municipal Bond ETF declares monthly distribution of $0.0784
SCHW,2026-04-25,-0.00558806024491787,neutral,news,ETFs Investing in FMC Corporation Stocks
SCHW,2026-04-25,0.05202894564718008,neutral,news,Schwab Ariel ESG ETF declares $0.0079 dividend
SCHW,2026-04-25,0.9266871651634574,positive,news,"ServisFirst Bancshares, Inc. (NYSE:SFBS) Receives Consensus Rating of ""Moderate Buy"" from Analysts"
SCHW,2026-04-25,0.009384267032146454,neutral,news,Is It Time To Revisit Charles Schwab (SCHW) After The Recent Share Price Pullback?
SCHW,2026-04-25,0.9254313232377172,positive,news,Webull's $100 Million Stock Buyback Plans Give Its Shares a Boost -- Barrons.com
SCHW,2026-04-25,0.04545127600431442,neutral,news,Schwab US broad market ETF declares $0.0692 dividend
SCHW,2026-04-25,0.9269519550725818,positive,news,"The Charles Schwab Corporation (NYSE:SCHW) Receives Average Rating of ""Moderate Buy"" from Brokerages"
SCHW,2026-04-25,0.23846164345741272,neutral,news,Schwab U.S. Large-Cap ETF declares quarterly distribution of $0.0732
SCHW,2026-04-25,0.12549641728401184,neutral,news,Schwab U.S. Large-Cap ETF declares quarterly distribution of $0.0732
SCHW,2026-04-25,-0.8352840021252632,negative,news,Earnings Preview: ING Groep to Report Financial Results Pre-market on April 30
SCHW,2026-04-25,-0.017918448895215988,neutral,news,Schwab intermediate-term US Treasury ETF declares monthly distribution of $0.0802
SCHW,2026-04-24,-0.053091248497366905,neutral,news,Multiple insider sales reported by The Charles Schwab Corp (MTSI) via Form 144
SCHW,2026-04-24,0.022344358265399933,neutral,news,$0.32 a share: Charles Schwab sets May 22 dividend payout
SCHW,2026-04-24,0.01565086841583252,neutral,news,Schwab High Yield Bond ETF declares monthly distribution of $0.1498
SCHW,2026-04-24,-0.9445329466834664,negative,news,The Charles Schwab Corporation (NYSE:SCHW) Announces Quarterly Dividend of $0.32
SCHW,2026-04-24,0.7577750468626618,positive,news,SCHE Offers Higher Yield and Lower Fees Than NZAC
SCHW,2026-04-24,0.9236648809164762,positive,news,Charles Schwab Issues New Series L Preferred Stock
SCHW,2026-04-24,0.9275290155783296,positive,news,"Directional Asset Management Buys Shares of 14,103 The Charles Schwab Corporation $SCHW"
SCHW,2026-04-24,-0.890980426222086,negative,news,Arizona State Retirement System Has $49.17 Million Stock Position in The Charles Schwab Corporation $SCHW
SCHW,2026-04-24,0.8041378185153008,positive,news,Webull Charges Into High-Velocity Trading As US Removes Longstanding Restriction
SCHW,2026-04-23,-0.10904563218355179,neutral,news,"Schwab creates new limits to RIAs using long-short, separately managed accounts."
SCHW,2026-04-23,0.04165888391435146,neutral,news,Local Bounti (NYSE: LOCL) seeks investor vote on major insider share issuance
SCHW,2026-04-23,0.3994508748874068,neutral,news,Charles Schwab Issues New Series L Preferred Stock
SCHW,2026-04-23,-0.2960970252752304,negative,news,Charles Schwab declares $0.32 quarterly dividend per share By Investing.com
SCHW,2026-04-23,0.8006276804953814,positive,news,Charles Schwab declares $0.32 quarterly dividend per share By Investing.com
SCHW,2026-04-23,-0.9295190926641226,negative,news,Charles Schwab declares $0.32 quarterly dividend per share
SCHW,2026-04-23,-0.042758138850331306,neutral,news,Charles Schwab Corp. (RBB) Rule 144 notice lists equity grant resale details
SCHW,2026-04-23,-0.008624773472547531,neutral,news,Schwab High Yield Bond ETF declares monthly distribution of $0.1498
SCHW,2026-04-23,-0.966903273947537,negative,news,Charles Schwab Corp Stock (SCHW) Moved Down by 3.71% on Apr 23: Key Drivers Unveiled
SCHW,2026-04-23,-0.010779839009046555,neutral,news,Charles R. Schwab (SCHW) files Form 144 showing seven Common‑stock sales
SCHW,2026-04-23,0.00558890588581562,neutral,news,"Brag House Holdings, Inc. SEC Filing"
SCHW,2026-04-23,0.09060074016451836,neutral,news,Schwab (NYSE: SCHW) sells $1.48B in 6.100% Series L preferred shares
SCHW,2026-04-23,-0.9656256632879376,negative,news,Charles Schwab Corp. stock outperforms competitors despite losses on the day
SCHW,2026-04-23,0.4893973767757416,positive,news,"Raymond James Q2 Earnings Beat on Higher Revenues, Cost Woes Remain"
SCHW,2026-04-23,-0.7833836227655411,negative,news,Morgan Stanley Lowers Vital Farms (NASDAQ:VITL) Price Target to $15.00
SCHW,2026-04-23,0.9349731309339404,positive,news,Stifel Financial Corp. (NYSE:SF) Q1 2026 Earnings Call Transcript
SCHW,2026-04-23,0.9343389868736267,positive,news,"After Earnings, Is Schwab Stock a Buy, a Sell, or Fairly Valued?"
SCHW,2026-04-23,0.3456488670781255,neutral,news,The Charles Schwab Corporation $SCHW Shares Acquired by Caprock Group LLC
SCHW,2026-04-22,0.36093441490083933,neutral,news,"Charles Schwab Issues $1.5 Billion 6.100% Fixed-Rate Reset Non-Cumulative Perpetual Preferred Stock, Series L – Underwriting Agreement Details and Key Terms 10, 51"
SCHW,2026-04-22,0.8953223470598459,positive,news,Charles Schwab Issues New Series L Preferred Stock
SCHW,2026-04-22,-0.00929461233317852,neutral,news,"[144] Axsome Therapeutics, Inc. SEC Filing"
SCHW,2026-04-22,0.1995331048965454,positive,news,SCHC ETF: Lower Volatility in International vs. U.S. Small Caps | 2026 Analysis - News and Statistics
PNC,2026-04-27,0.8962788861244917,positive,news,"Vanguard Group Inc. Grows Stake in The PNC Financial Services Group, Inc $PNC"
PNC,2026-04-27,0.16763901710510254,positive,news,Orchid Island Capital (NYSE:ORC) Raised to Hold at Wall Street Zen
PNC,2026-04-26,0.932977631688118,positive,news,"Teacher Retirement System of Texas Boosts Stock Holdings in Skyward Specialty Insurance Group, Inc. $SKWD"
PNC,2026-04-26,0.9337301477789879,positive,news,"Richard C. Young & CO. LTD. Increases Stock Holdings in The PNC Financial Services Group, Inc $PNC"
PNC,2026-04-26,-0.9319619704037905,negative,news,"Munich Reinsurance Co Stock Corp in Munich Decreases Position in The PNC Financial Services Group, Inc $PNC"
PNC,2026-04-26,-0.18165040016174316,negative,news,"M&T Bank Corp Sells 147,526 Shares of The PNC Financial Services Group, Inc $PNC"
PNC,2026-04-26,0.49930083751678467,positive,news,PNC Financial starts FirstBank integration after legal close
PNC,2026-04-26,0.018275195732712746,neutral,news,PNC Financial starts FirstBank integration after legal close
PNC,2026-04-26,-0.9157336056232452,negative,news,"BKM Wealth Management LLC Sells 6,029 Shares of Invesco QQQ $QQQ"
PNC,2026-04-25,0.1028923038393259,neutral,news,Director Bryan Scott Salesky receives 844 DSUs at PNC (NYSE: PNC)
PNC,2026-04-25,0.9346228297799826,positive,news,Zurcher Kantonalbank Zurich Cantonalbank Boosts Stock Holdings in KANZHUN LIMITED Sponsored ADR $BZ
PNC,2026-04-25,0.9377473909407854,positive,news,"First Western Financial, Inc. (NASDAQ:MYFW) Q1 2026 Earnings Call Transcript"
PNC,2026-04-25,0.9354713223874569,positive,news,Kercheville Advisors LLC Makes New $1.35 Million Investment in Enterprise Products Partners L.P. $EPD
PNC,2026-04-25,-0.45340728759765625,negative,news,"Teacher Retirement System of Texas Sells 58,813 Shares of The PNC Financial Services Group, Inc $PNC"
PNC,2026-04-25,-0.0021978970617055893,neutral,news,PNC (PNC) director Niblock granted 844 deferred stock units as compensation
PNC,2026-04-25,-0.9431785047054291,negative,news,"Arizona State Retirement System Decreases Stock Holdings in The PNC Financial Services Group, Inc $PNC"
PNC,2026-04-25,0.029808174818754196,neutral,news,"PNC SEC Filings - PNC Financial Services Group 10-K, 10-Q, 8-K Forms"
PNC,2026-04-25,0.1751275146380067,neutral,news,PNC Financial Services Group (PNC) Approves 2026 Omnibus Equity Incentive Plan
PNC,2026-04-25,0.0789903262630105,neutral,news,Highwoods prices $350 million of 5.35% notes due 2033
PNC,2026-04-24,0.7927225157618523,positive,news,PNC Financial Shareholders Approve 2026 Equity Incentive Plan
PNC,2026-04-24,0.7614758918061852,positive,news,Huntington taps Bank of America vet in Pittsburgh as regional banking market director
PNC,2026-04-24,0.2779268594458699,neutral,news,PNC Financial Services Group approves 2026 Omnibus Equity Incentive Plan
PNC,2026-04-24,0.17830248922109604,neutral,news,"[8-K] PNC FINANCIAL SERVICES GROUP, INC. Reports Material Event"
PNC,2026-04-24,0.9123540250584483,positive,news,PNC signs first Charlotte-area lease in planned three-year expansion
PNC,2026-04-24,0.9359060041606426,positive,news,First Western (MYFW) Q1 2026 Earnings Transcript
PNC,2026-04-24,-0.9681284525431693,negative,news,PNC Financial Services Group Inc. stock underperforms Friday when compared to competitors
PNC,2026-04-24,0.6767279300838709,positive,news,PNC (PNC) director receives 844 Deferred Stock Units and reports phantom units
PNC,2026-04-24,0.08884403482079506,neutral,news,PNC (NYSE: PNC) director granted 844 deferred stock units
PNC,2026-04-24,0.17684500198811293,neutral,news,PNC (NYSE: PNC) director granted 844 deferred stock units as compensation
PNC,2026-04-24,0.35831939708441496,neutral,news,Debra Cafaro at PNC (NYSE: PNC) awarded 844 deferred stock units
PNC,2026-04-24,0.03090015798807144,neutral,news,Director at PNC (NYSE: PNC) awarded 844 deferred stock units
PNC,2026-04-24,0.07973013073205948,neutral,news,Director Dachille (NYSE: PNC) receives 844 deferred stock units award
PNC,2026-04-24,0.9303376395255327,positive,news,"Davis Rea LTD. Boosts Position in The PNC Financial Services Group, Inc $PNC"
PNC,2026-04-24,0.941056645475328,positive,news,ACNB Corp's Stellar Q1 Rebound Outpaces Regional Banking Peers
PNC,2026-04-24,-0.8746411949396133,negative,news,PNC Financial Services Group Stock Analysis: Outperformance vs. Underlying Concerns in 2026 - News and Statistics
PNC,2026-04-23,0.868977315723896,positive,news,First Merchants Clears Deal Hurdle As Integration And Growth Plans Loom
PNC,2026-04-23,0.9107410730794072,positive,news,S&T locks in four-year deal with its CEO as the bank pursues expansion opportunities
PNC,2026-04-23,-0.9504430303350091,negative,news,PNC to cut 777 FirstBank jobs this summer
PNC,2026-04-23,0.9353539068251848,positive,news,"West Michigan Advisors LLC Buys New Stake in BWX Technologies, Inc. $BWXT"
PNC,2026-04-23,0.9115250427275896,positive,news,Here's Why We Think PNC Financial Services Group (NYSE:PNC) Might Deserve Your Attention Today
PNC,2026-04-23,-0.9182674195617437,negative,news,WMG Financial Advisors LLC Lowers Holdings in Invesco QQQ $QQQ
PNC,2026-04-23,-0.8069291189312935,negative,news,"Universal Beteiligungs und Servicegesellschaft mbH Has $59.94 Million Stock Holdings in The PNC Financial Services Group, Inc $PNC"
PNC,2026-04-23,0.9385226648300886,positive,news,"Confluence Wealth Services Inc. Buys 3,239 Shares of Invesco QQQ $QQQ"
PNC,2026-04-23,-0.9555958127602935,negative,news,"Confluence Wealth Services Inc. Sells 5,619 Shares of The PNC Financial Services Group, Inc $PNC"
PNC,2026-04-23,-0.6390202045440674,negative,news,Bar Harbor Bankshares (BHB) Non‑Performing Loans Surge Tests Bullish Earnings Growth Narrative
PNC,2026-04-23,0.8479768112301826,positive,news,Q4 2025 PNC Financial Services Group Inc Earnings Call Transcript
PNC,2026-04-23,0.9313679933547974,positive,news,"RBB Bancorp (NASDAQ:RBB) Receives Average Recommendation of ""Hold"" from Brokerages"
PNC,2026-04-22,0.9133789604529738,positive,news,"The PNC Financial Services Group, Inc (PNC) earnings expected to grow: What to know ahead of next week's release"
PNC,2026-04-22,-0.9449564702808857,negative,news,Q1 Earnings Outperformers: PNC Financial Services Group (NYSE:PNC) And The Rest Of The Diversified Banks Stocks
PNC,2026-04-22,0.6437440346926451,positive,news,"PNC: All proposals passed as record results, expansion, and tech investment set the year's priorities"
DHR,2026-04-27,-0.9300449714064598,negative,news,State of Michigan Retirement System Decreases Holdings in Danaher Corporation $DHR
DHR,2026-04-27,0.9366096071898937,positive,news,Advisors Capital Management LLC Has $12.56 Million Stock Position in Danaher Corporation $DHR
DHR,2026-04-27,0.9070098595693707,positive,news,"RT-PCR Market key players 2025-2031 : Abbott, Qiagen, GE"
DHR,2026-04-26,0.7628892939537764,positive,news,Danaher Corp. stock (US2358511028): Why Google Discover changes matter more now
DHR,2026-04-26,0.885760820005089,positive,news,Agilent Technologies Inc. stock (US00846U1016): Why its life sciences leadership matters more now fo
DHR,2026-04-26,0.575977548956871,positive,news,Vanguard Group Inc. Has $13.96 Billion Position in Danaher Corporation $DHR
DHR,2026-04-26,-0.9560239892452955,negative,news,Is Thermo Fisher Scientific (TMO) Offering Value After Recent Share Price Weakness
DHR,2026-04-26,0.9203276038169861,positive,news,Is Qiagen’s (QGEN) New Infection and Oncology Tools Quietly Rewiring Its Diagnostics Moat?
DHR,2026-04-26,0.7854214236140251,positive,news,Danaher Corporation $DHR Shares Purchased by AEGON ASSET MANAGEMENT UK Plc
DHR,2026-04-25,0.874813973903656,positive,news,Edwards Lifesciences Corp. stock outperforms competitors on strong trading day
DHR,2026-04-25,-0.9214769154787064,negative,news,Nomura (NYSE:NMR) Falls After Earnings Miss
DHR,2026-04-25,0.9361096750944853,positive,news,Danaher Corporation (DHR) Reports Q1 Adjusted EPS Beat
DHR,2026-04-25,-0.6149189174175262,negative,news,"Impax Asset Management Group plc Sells 51,641 Shares of Danaher Corporation $DHR"
DHR,2026-04-25,-0.9472571052610874,negative,news,Danaher Corporation $DHR is Montrusco Bolton Investments Inc.'s 6th Largest Position
DHR,2026-04-25,0.936356920748949,positive,news,Coronation Fund Managers Ltd. Boosts Stake in Danaher Corporation $DHR
DHR,2026-04-25,-0.6655603647232056,negative,news,Danaher inks $173M deal to settle investor suit over post-pandemic forecast
DHR,2026-04-25,0.943576262332499,positive,news,Thermo Fisher Raises Outlook As Clario Deal Deepens AI Trial Capabilities
DHR,2026-04-25,0.32986656203866005,neutral,news,Is Danaher’s (DHR) Euro Debt for Masimo a Smart Balance-Sheet Bet or Added Complexity?
DHR,2026-04-24,-0.876030208542943,negative,news,Danaher Execs Face Investor Suit Over Post-COVID Outlook
DHR,2026-04-24,0.8932766206562519,positive,news,"Medicinal Microbiology Market Is Going to Boom | Major Giants bioMérieux SA, Hologic, Cepheid"
DHR,2026-04-24,-0.8410882949829102,negative,news,"Carlisle Q1 Earnings Beat Estimates, Organic Revenues Decline Y/Y"
DHR,2026-04-24,0.04139048047363758,neutral,news,Sealed Air names Kristen Actis-Grande as CFO
DHR,2026-04-24,0.5184510173276067,positive,news,"Human Microbiome Sequencing Technology Market Competitive Analysis to 2034 | Thermo Fisher Scientific Inc., QIAGEN N.V., Microbiome Insights Inc., Leucine Rich Bio Pvt. Ltd., Illumina, Inc etc."
DHR,2026-04-24,-0.9466356988996267,negative,news,M&T Bank Corp Cuts Stake in Danaher Corporation $DHR
DHR,2026-04-24,0.8990847263485193,positive,news,Does Agilent (A) Settling Axion Dispute Clarify Its Push Into Cloud Lab Data Recurring Revenues?
DHR,2026-04-24,-0.8084490150213242,negative,news,Thermo Fisher Scientific (TMO) Margin Hold At 15% Tests Long Term Earnings Concerns
DHR,2026-04-23,0.05646384879946709,neutral,news,Avantor (NYSE: AVTR) taps Ludovic Brellier to lead BMP and transformation
DHR,2026-04-23,0.14936252124607563,neutral,news,Danaher executive joins Avantor to lead product unit and Revival
DHR,2026-04-23,0.02931363135576248,neutral,news,[8-K] MASIMO CORP Reports Material Event
DHR,2026-04-23,-0.9657495869323611,negative,news,Danaher Corp. stock outperforms competitors despite losses on the day
DHR,2026-04-23,0.9310406930744648,positive,news,Danaher’s €3b Euro Debt Issue And What It Means For Valuation
DHR,2026-04-23,-0.8288451731204987,negative,news,Danaher inks $173M deal to settle investor suit over post-pandemic forecast
DHR,2026-04-23,-0.8098465129733086,negative,news,"Danaher Q1 earnings beat estimates, life sciences sales up Y/Y"
DHR,2026-04-23,-0.0960811972618103,negative,news,Danaher reaches $172.5 million settlement with shareholders over post-pandemic outlook
DHR,2026-04-23,0.2578470706939697,positive,news,Danaher Settles Investor Suit Over Projections for $173 Million
DHR,2026-04-23,-0.9233358018100262,negative,news,Danaher Corporation stock hits 52-week low at $180.00
DHR,2026-04-23,-0.9518358111381531,negative,news,Danaher Stock: Masimo Deal Adds Long-Term Potential But Near-Term Pressure (NYSE:DHR)
DHR,2026-04-23,0.6253916919231415,positive,news,Juno Financial Group LLC Makes New Investment in Danaher Corporation $DHR
DHR,2026-04-23,0.8705031331628561,positive,news,GE HealthCare tests MRI dye as gadolinium alternative
DHR,2026-04-23,0.9337104186415672,positive,news,"United Asset Strategies Inc. Purchases 9,953 Shares of Danaher Corporation $DHR"
DHR,2026-04-23,0.2853921726346016,neutral,news,Is Agilent Technologies a Better Buy Than Danaher?
DHR,2026-04-23,-0.26717305183410645,negative,news,"Analysts’ Opinions Are Mixed on These Healthcare Stocks: Beta Bionics, Inc. (BBNX) and Danaher (DHR)"
DHR,2026-04-22,0.1869572065770626,neutral,news,Danaher prices €3 billion senior notes offering
DHR,2026-04-22,0.038793060928583145,neutral,news,Danaher Corp Estimates Net Proceeds From Senior Notes Sale At 2.98 Billion Euros
DHR,2026-04-22,0.07960542663931847,neutral,news,"To help fund its Masimo acquisition, Danaher prices €3B debt"
DHR,2026-04-22,0.11872460320591927,neutral,news,Danaher Corp estimates net proceeds from senior notes sale at 2.98 billion euros
DHR,2026-04-22,0.05436925310641527,neutral,news,Danaher Corp Files For Four-Part Senior Notes Offering Of Up To €3 Billion - SEC Filing
DHR,2026-04-22,-0.7339960187673569,negative,news,"RLI profit slips, but investment income jumps 15% in first quarter"
DHR,2026-04-22,0.061563621275126934,neutral,news,Altimmune Announces Proposed Underwritten Public Offering of Securities
DHR,2026-04-22,0.9315541815012693,positive,news,A $2.24B border wall contract starts as Reliance posts a $4B quarter
BA,2026-04-27,0.22144035249948502,neutral,news,Navy's MQ-25A makes first flight with Lockheed ground controls
BA,2026-04-27,0.876409306190908,positive,news,"Boeing, U.S. Navy Achieve Successful MQ-25A Test Flight"
BA,2026-04-27,0.9144757054746151,positive,news,Clearing the Runway: Boeing’s Q1 2026 Results Show 14% Revenue Growth and Narrowing Losses
BA,2026-04-27,-0.7059746533632278,negative,news,"Nippon Life Global Investors Americas Inc. Sells 23,050 Shares of The Boeing Company $BA"
BA,2026-04-27,0.4824884235858917,positive,news,"CliffsNotes IBM, Boeing Earnings Summaries: Boeing's OK; IBM Is All About What Management Didn't Say"
BA,2026-04-27,0.9347788393497467,positive,news,The Boeing Company $BA Shares Bought by Deltec Asset Management LLC
BA,2026-04-27,0.8796246629208326,positive,news,BOEING CO : Gets a Buy rating from Jefferies
BA,2026-04-27,0.17014788836240768,neutral,news,Lehigh Valley ties to Artemis II moon mission celebrated by economic group
