ticker,date,sentiment_score,sentiment_label,content_type,title
CHTR,2026-06-04,-0.9319442752748728,negative,news,Cisco stock may move 5.8% on earnings release
CHTR,2026-06-04,0.9083449952304363,positive,news,BRC Inc. founder Hafer sells $2.98m in Class A common stock
CHTR,2026-06-03,-0.9495451934635639,negative,news,"Charter, fuboTV, and Inspired Shares Plummet, What You Need To Know"
CHTR,2026-06-03,-0.00980461947619915,neutral,news,"Liberty Global to Release Q2 2026 Results and Host Investor Call on July 24, 2026 1"
CHTR,2026-06-03,-0.6274681985378265,negative,news,AI now powers most customer service – but few firms track if it works
CHTR,2026-06-03,0.26456550136208534,neutral,news,"AT&T offers home internet: fiber bundles as low as $35, up to $420 off"
CHTR,2026-06-03,0.5088055087253451,positive,news,AT&T turns stores into 'Toy Story 5' worlds for families this summer
CHTR,2026-06-02,-0.8774447441101074,negative,news,"Sunstone Hotel Investors, Inc. Experiences Revision in Stock Evaluation Amid Market Dynamics"
CHTR,2026-06-02,0.12660313304513693,neutral,news,New Era Energy & Digital names two senior executives
CHTR,2026-06-01,0.13944431394338608,neutral,news,Liberty Broadband Corp stock (US5312298541): shares trade around mid-30 USD range after recent volat
CHTR,2026-06-01,-0.05695514753460884,neutral,news,1st June – Threat Intelligence Report
CHTR,2026-05-31,-0.7947935163974762,negative,news,Don't Ignore The Insider Selling In Charter Communications
CHTR,2026-05-29,0.47322778403759,positive,news,bioAffinity Technologies (BIAFW) Short Interest & Short Float | Updated May 2026
CHTR,2026-05-29,-0.7482386454939842,negative,news,Liberty Broadband Corp stock (US5307151044): steady trading ahead of next catalysts
CHTR,2026-05-29,-0.7923554573208094,negative,news,Charter Communications Faces Class Suits After ShinyHunters Hack
CHTR,2026-05-29,-0.8053441420197487,negative,news,Charter Communications Faces Class Suits After ShinyHunters Hack
CHTR,2026-05-29,0.5677392035722733,positive,news,"T-Mobile gets drubbed by AT&T, Verizon, Comcast, and Charter in speed"
CHTR,2026-05-29,-0.9525401247665286,negative,news,T-Mobile users will want to delete T-Life after this scary allegation
CHTR,2026-05-29,0.49198539461940527,positive,news,Rentrak Returns: Comscore Sells Movie Data Business For $70M
CHTR,2026-05-28,-0.00232648104429245,neutral,news,Charter Communications director emeritus Rutledge sells $12.7m stock
CHTR,2026-05-28,-0.2320890612900257,neutral,news,"Charter Communications (CHTR) director emeritus logs 87,833-share stock sale"
CHTR,2026-05-28,-0.9640017133206129,negative,news,Charter Communications director emeritus Rutledge sells $12.7m stock
CHTR,2026-05-28,-0.0010996665805578232,neutral,news,"[144] CHARTER COMMUNICATIONS, INC. /MO/ SEC Filing"
CHTR,2026-05-28,-0.03240804746747017,neutral,news,WCN News | WASTE CONNECTIONS INC (NYSE:WCN)
CHTR,2026-05-27,0.8365069907158613,positive,news,KT Skylife Appoints Jee Jung-yong as CEO Amid Push for Media-Telecom Integration
CHTR,2026-05-27,0.8551355628296733,positive,news,Verizon Communications Inc. stock (US92343V1044): Investor focus after latest quarterly update and d
CHTR,2026-05-27,0.0031504910439252853,neutral,news,AER - Aercap Holdings NV Stock Price and Quote
CHTR,2026-05-26,0.9311658907681704,positive,news,How Charter’s Ultra‑Low Latency L4S Internet Rollout At Charter Communications (CHTR) Has Changed Its Investment Story
CHTR,2026-05-26,-0.005503028631210327,neutral,news,"CHTR (NASDAQ) Form 144: Restricted stock vesting, Fidelity listed"
CHTR,2026-05-26,0.9319368340075016,positive,news,HLIT Stock Jumps As Harmonic’s Broadband Growth Story Accelerates
CHTR,2026-05-26,-0.9618148962035775,negative,news,Salesforce Stock Is Down 35% From Its 52-Week High. Here’s What Q1 2027 Earnings Could Change
CHTR,2026-05-26,0.9392649251967669,positive,news,Raymond James upgrades Tectonic Therapeutics stock rating on pipeline potential
CHTR,2026-05-25,0.1917542926967144,neutral,news,"AT&T, Verizon, T-Mobile & Others Form C2 ISAC Cybersecurity Information Sharing Group"
CHTR,2026-05-24,0.6911247754469514,positive,news,"A $750,000 Portfolio. A 2.95% Blended Yield. A $22,125-a-Year Paycheck Most Retirees Build by Accident."
CHTR,2026-05-23,-0.5469800904393196,negative,news,ULTY Paid 68.7% in Distributions While Its Stock Price Fell 47%
CHTR,2026-05-23,0.005859106779098511,neutral,news,8 Communication Services Stocks With Whale Alerts In Today's Session
CHTR,2026-05-22,-0.9220774881541729,negative,news,"Kaltura CCO Natan Israeli sells $5,407 in common stock"
CHTR,2026-05-22,-0.6751093864440918,negative,news,FuelCell Energy stock hits 52-week high at 26.85 USD
CHTR,2026-05-22,0.8834627121686935,positive,news,Is TDS’s Q1 Profit Rebound Above US$1 EPS Altering The Investment Case For Telephone and Data Systems (TDS)?
CHTR,2026-05-22,0.30913858115673065,neutral,news,Sprouts Farmers Market shareholders approve board nominees and key proposals
CHTR,2026-05-21,0.17935281991958618,positive,news,"Ampco Pittsburgh CEO Brett McBrayer buys $29,791 in company stock"
CHTR,2026-05-21,0.13469218462705612,neutral,news,Liberty Broadband Corp stock (US5307151044): how the cable holding navigates a changing US media mar
EL,2026-06-10,0.9224181557074189,positive,news,Franklin Resources Inc. Has $206.53 Million Stock Position in The Estee Lauder Companies Inc. $EL
EL,2026-06-06,0.2077474296092987,neutral,news,Procter & Gamble Stock Capital Return Hits $83 Bil
EL,2026-06-05,-0.12092722952365875,neutral,news,"Did The Estee Lauder Companies, Inc. Insiders Breach their Fiduciary Duties to Shareholders?"
EL,2026-06-04,0.2543285582214594,neutral,news,US soccer captain Tim Ream shares his childhood bedwetting story
EL,2026-06-03,0.34616104885935783,neutral,news,Estée Lauder (NYSE: EL) details $1.551B in approved restructuring charges
EL,2026-06-03,0.33432706352323294,neutral,news,Top Wide-Moat Stocks to Buy for Steady Long-Term Returns
EL,2026-06-03,-0.8802347481250763,negative,news,Assessing Olaplex Holdings (OLPX) Valuation After A Year Of Mixed Returns And Earnings Pressure
EL,2026-06-02,0.9366310629993677,positive,news,"Ulta delivers beauty-fueled beat with top- and bottom-line beat, raises FY26 profit outlook (ULTA:NASDAQ)"
EL,2026-06-02,0.9132780935615301,positive,news,Wall Street Analysts Are Bullish on Top Healthcare Picks
EL,2026-06-01,-0.956524571403861,negative,news,Jim Cramer Discusses the Analyst Price Target Cut for Ulta Beauty
EL,2026-05-30,-0.007957695052027702,neutral,news,EYE - National Vision Holdings Inc Stock Price and Quote
EL,2026-05-30,-0.012399211525917053,neutral,news,How Will Ulta Beauty Stock React To Its Upcoming Earnings?
EL,2026-05-28,0.005789928138256073,neutral,news,Aerin Lauder (NYSE: EL) details 7.2% stake and $120M credit line
EL,2026-05-28,0.09162117727100849,neutral,news,What Does Global Oil Shock Modeling Show Stock Traders?
EL,2026-05-28,0.7761974930763245,positive,news,$270m investment in Connecticut Global Innovation Centre
EL,2026-05-27,0.9357269816100597,positive,news,Innventure (INV) Q4 2025 Earnings Transcript
EL,2026-05-27,0.12367215752601624,positive,news,Procter & Gamble Co Stock (PG) Moved Up by 3.39% on May 27: What Signal Does It Send?
EL,2026-05-26,0.411381259560585,neutral,news,"GE Vernova, Estée Lauder, A Health Care Stock And More On CNBC's 'Final Trades'"
EL,2026-05-26,0.01445450447499752,neutral,news,"GE Vernova, Estée Lauder, AbbVie: CNBC's 'Final Trades' - AbbVie (NYSE:ABBV), Archer-Daniels-Midland (NYS"
EL,2026-05-26,0.925600403919816,positive,news,WPP Media makes striking comeback in media pitches
EL,2026-05-23,-0.9636141434311867,negative,news,AIDX Slides As 20/20 Biolabs Inc. Faces Heavy Selling
EL,2026-05-23,0.5737858265638351,positive,news,"UPDATE 2-Puig dips, Estée Lauder surges after merger talks collapse"
EL,2026-05-23,0.9315642528235912,positive,news,"Zoom Upbeat Q1 Results, Joins Lionsgate Studios, Ross Stores And Other Big Stocks Moving Higher On Friday"
EL,2026-05-23,-0.9374192599207163,negative,news,"Leaks, demands and a phone call: how Estée Lauder's Puig deal fell apart"
EL,2026-05-22,0.9106087852269411,positive,news,"Stock Market Today: Dow Jones, S&P 500 Futures Gain As Investors Eye US-Iran Peace Talks—Estee Lauder, Workday, Zoom In Focus"
EL,2026-05-22,-0.9568668240681291,negative,news,BMNR Stock Faces Selling Overhang After Resale Registration
EL,2026-05-22,-0.027162691578269005,neutral,news,"Final trades: AbbVie, Millrose Properties, Archer-Daniels-Midland, GE Vernova and Estee Lauder"
EL,2026-05-22,-0.764587864279747,negative,news,IOVA Stock Slides As Guidance Tops Wall Street Expectations
EL,2026-05-22,0.03667514584958553,neutral,news,"Final Trades: AbbVie, Millrose Properties, Archer-Daniels-Midland, GE Vernova and Estee Lauder"
EL,2026-05-22,0.9277714528143406,positive,news,Skyworks Solutions Jumps 7.7% Amid Sector-Wide Rally
EL,2026-05-22,0.037968605756759644,positive,news,"Stocks making the biggest moves midday: Dell Technologies, HP, Estee Lauder, Generac & more"
EL,2026-05-22,0.9289961587637663,positive,news,"Zoom Upbeat Q1 Results, Joins Lionsgate Studios, Ross Stores And Other Big Stocks Moving Higher On Friday"
EL,2026-05-22,0.9368241056799889,positive,news,Estée Lauder: We See Prudence in Going It Alone After Talks With Puig End; Shares Attractive
EL,2026-05-22,-0.8549705520272255,negative,news,"Take-Two Interactive, Workday, Estee Lauder jump premarket; Deckers Outdoor slips"
EL,2026-05-22,-0.9504179637879133,negative,news,UPDATE 1-Puig shares fall after collapse of Estée Lauder merger talks
EL,2026-05-22,0.9225843921303749,positive,news,Deckers Outdoor Corp (NYSE:DECK) Passes Peter Lynch's GARP Screen with Strong Financial Health and a Low PEG Ratio
EL,2026-05-22,-0.03233530931174755,neutral,news,Interim CFO Pamela Smith joins Portillo’s (NASDAQ: PTLO) on short-term deal
EL,2026-05-21,0.9256714601069689,positive,news,Watch Estee Lauder and IMAX Higher; Ross Stores Boost Forecast | Stock Movers
EL,2026-05-21,0.008121887221932411,neutral,news,Zumiez sets June 4 date to reveal fiscal 2026 first-quarter results
EL,2026-05-21,-0.6177339106798172,negative,news,Estée Lauder Walks Away From Merger Talks — Stock Surges
EL,2026-05-20,0.600617740303278,positive,news,"3 Cosmetics Stocks Gaining From AI, Wellness and Innovation Trends"
EL,2026-05-20,0.7396583678200841,positive,news,Consumer Staples Sector Regains Momentum in 2026: 5 Top Picks
EL,2026-05-20,0.8874923326075077,positive,news,Investors Can Find Comfort In Herbalife's (NYSE:HLF) Earnings Quality
EL,2026-05-19,0.21999883651733398,positive,news,What To Expect From e.l.f. Beauty’s (ELF) Q1 Earnings
EL,2026-05-18,0.01468602940440178,neutral,news,Estee Lauder (EL) director receives 420 Stock Units in lieu of cash fees
EL,2026-05-18,0.11291846726089716,neutral,news,Estee Lauder (NYSE: EL) director granted 336 stock units as board pay
EL,2026-05-18,0.02724756859242916,neutral,news,Barry Sternlicht (EL) receives 336 deferred Stock Units as Estee Lauder director pay
EL,2026-05-18,-0.8544446118175983,negative,news,Q1 Earnings Outperformers: Inter Parfums (NASDAQ:IPAR) And The Rest Of The Personal Care Stocks
SO,2026-06-10,-0.6744850724935532,negative,news,TIAA Trust National Association Has $6.30 Million Stake in Southern Company (The) $SO
SO,2026-06-10,0.9114465788006783,positive,news,North Dallas Bank & Trust Co. Invests $1.07 Million in Southern Company (The) $SO
SO,2026-06-10,-0.9042409956455231,negative,news,O Shaughnessy Asset Management LLC Has $18.68 Million Stake in Southern Company (The) $SO
SO,2026-06-10,0.010165797546505928,neutral,news,Precision Trading with Southern Company (the) (SO) Risk Zones
SO,2026-06-10,0.01639597676694393,neutral,news,Bowen Reichert Shoemaker Gives an Update on Georgia Power Projects
SO,2026-06-09,0.9007862294092774,positive,news,The Bull Case For Southern (SO) Could Change Following New Equity Shelf And Data Center Demand Tailwind - Learn Why
SO,2026-06-09,-0.954670243896544,negative,news,PG&E Warns of Possible Power Shutoffs as Wildfire Risk Rises in Northern California
SO,2026-06-09,0.8500373270362616,positive,news,Southern Co Launches New Equity Distribution Program
SO,2026-06-08,0.07477542757987976,positive,news,"JPMorgan Chase & Co. Sells 69,146,349 Shares of Southern Company (The) $SO"
SO,2026-06-08,-0.44099703431129456,negative,news,What Utilities Need to Know About the 900-MHz 'NextNav' FCC Proceeding
SO,2026-06-08,-0.6535872220993042,negative,news,Southern Company (The) $SO Shares Sold by Franklin Resources Inc.
SO,2026-06-08,0.8623637603595853,positive,news,Southern Company stock (US8425871071): Dividend stability and grid investments in focus
SO,2026-06-08,0.9142581913620234,positive,news,Assessing Southern Company (SO) Valuation After Data Center Demand Boosts Earnings And Dividend Increase
SO,2026-06-08,0.9120979458093643,positive,news,Assessing Southern Company (SO) Valuation After Data Center Demand Boosts Earnings And Dividend Increase
SO,2026-06-08,0.05404288228601217,neutral,news,Southern Company (NYSE: SO) registers up to 50M shares via ATM and forward deals
SO,2026-06-08,0.05918118171393871,neutral,news,"Southern Company files equity distribution agreement to sell up to 50M common shares, including forward and collared transactions"
SO,2026-06-08,0.10000200755894184,neutral,news,Southern Company (NYSE: SO) launches 50M-share equity and forward sale program
SO,2026-06-08,-0.3786683976650238,negative,news,Southern Co. (SO) gains as market dips: What you should know
SO,2026-06-08,-0.8505094051361084,negative,news,Southern Co. stock outperforms competitors despite losses on the day
SO,2026-06-08,0.1514153778553009,neutral,news,Duke Energy Urges Customers to Cut Power Use as Carolinas Heat Wave Hits
SO,2026-06-08,0.9223010595887899,positive,news,Here is Why The Southern Company (SO) Should Garner Investor Attention
SO,2026-06-07,0.05441662669181824,positive,news,"Capital International Investors Sells 8,412,251 Shares of Southern Company (The) $SO"
SO,2026-06-07,0.9347214978188276,positive,news,"Vise Technologies Inc. Acquires 14,094 Shares of Southern Company (The) $SO"
SO,2026-06-06,-0.5021811351180077,negative,news,How Southern Company (the) Series 2017b 5.25% Junior Subordinated Notes Due December 1 2077 (SOJC) Affects Rotational Strategy Timing
SO,2026-06-06,0.3306661946699023,neutral,news,11 Best Regulated Electric Stocks to Buy Now
SO,2026-06-06,0.3299138881266117,neutral,news,Forget Oklo: Buy This Entrenched High-Yield Utility Giant on the Dip Instead
SO,2026-06-06,0.4673362607136369,neutral,news,11 Best Regulated Electric Stocks to Buy Now
SO,2026-06-05,0.9191284086555243,positive,news,Southern Co. (SO) Gains As Market Dips: What You Should Know
SO,2026-06-05,0.7641341853886843,positive,news,Southern Co Files For Mixed Shelf Offering Size Not Disclosed
SO,2026-06-05,0.012437829747796059,neutral,news,"The Southern Company (SO) files shelf to register equity, senior and subordinated notes"
SO,2026-06-05,0.9153819689527154,positive,news,Fortis Q1 2026 slides: $28.8B capital plan drives 7% rate base growth
SO,2026-06-05,-0.6473096944391727,negative,news,Public Service Commission orders hearing on natural gas company’s rates
SO,2026-06-05,-0.8433290421962738,negative,news,"Georgia Power Rates Dip, But the Savings Aren’t Likely to Last"
SO,2026-06-05,0.8372449176385999,positive,news,"Enphase director Richard Mora sells $44,940 in common stock"
SO,2026-06-04,-0.9614011589437723,negative,news,Assessing Constellation Energy (CEG) Valuation After A Sharp Pullback And Cooling Momentum
SO,2026-06-04,0.09587729908525944,neutral,news,"Outdated Assumptions, New Exposure: What Southern Company Means for Defined Benefit Plans"
SO,2026-06-04,0.7688508266583085,positive,news,Southern Highlights Grid Upgrades As New Corporate Affairs Leader Steps In
SO,2026-06-04,-0.9226134270429611,negative,news,Southern Co. stock underperforms Thursday when compared to competitors despite daily gains
SO,2026-06-04,0.9428265178576112,positive,news,NextEra Energy Outpaces Industry in YTD: How to Play the Stock?
SO,2026-06-04,0.9388358667492867,positive,news,NextEra Energy Outpaces Industry in YTD: How to Play the Stock?
SO,2026-06-04,0.018249154090881348,neutral,news,Hunton Advises on Southern Power Company’s $600M Senior Notes Offering
SO,2026-06-04,0.12687124125659466,neutral,news,Georgia Power urges metro Atlanta residents to prepare for hurricane season
SO,2026-06-04,0.9317707475274801,positive,news,Natixis Advisors LLC Grows Position in Sempra Energy $SRE
SO,2026-06-03,0.9157193209975958,positive,news,"FAA grants Southern Company waiver for autonomous remote monitoring, asset inspections"
SO,2026-06-03,0.023241404443979263,neutral,news,Georgia Power Advises Customers to Prepare for Hurricane Season with Emergency Kits and Outage Plans
SO,2026-06-03,0.5110417874529958,positive,news,Georgia Power gives tips on how to stay ready for severe weather emergencies
SO,2026-06-03,0.833794561214745,positive,news,Georgia Power encourages customers to prepare for hurricane season
SO,2026-06-03,0.9272292461246252,positive,news,Southern Company stock (US8425871071): shares steady as investors eye dividend and regulated growth
SO,2026-06-03,0.9191828947514296,positive,news,Georgia Power reaches tentative agreement with regulatory staff on rate recovery cases
AMZN,2026-06-10,-0.058842895552515984,neutral,sec_filing,AMZN 8-K Filing - 2026-06-10
COF,2026-06-09,-0.05549143999814987,neutral,sec_filing,COF 8-K Filing - 2026-06-09
AVGO,2026-06-09,-0.05755653325468302,neutral,sec_filing,AVGO 10-Q Filing - 2026-06-09
MU,2026-06-09,-0.029429800808429718,neutral,sec_filing,MU 8-K Filing - 2026-06-09
COF,2026-06-08,-0.05477214604616165,neutral,sec_filing,COF 8-K Filing - 2026-06-08
MMM,2026-06-08,-0.06274523213505745,neutral,sec_filing,MMM 8-K Filing - 2026-06-08
MA,2026-06-08,-0.04269099794328213,neutral,sec_filing,MA 8-K Filing - 2026-06-08
HON,2026-06-05,-0.04413982294499874,neutral,sec_filing,HON 8-K Filing - 2026-06-05
NFLX,2026-06-05,-0.0256109070032835,neutral,sec_filing,NFLX 8-K Filing - 2026-06-05
UNH,2026-06-05,-0.06576940417289734,neutral,sec_filing,UNH 8-K Filing - 2026-06-05
WMT,2026-06-05,-0.061715856194496155,neutral,sec_filing,WMT 8-K Filing - 2026-06-05
GOOGL,2026-06-05,-0.057538093999028206,neutral,sec_filing,GOOGL 8-K Filing - 2026-06-05
GOOGL,2026-06-05,-0.057538093999028206,neutral,sec_filing,GOOGL 8-K Filing - 2026-06-05
MSFT,2026-06-05,-0.035387810319662094,neutral,sec_filing,MSFT 8-K Filing - 2026-06-05
MDT,2026-06-03,-0.05950409173965454,neutral,sec_filing,MDT 8-K Filing - 2026-06-03
AVGO,2026-06-03,-0.03945658914744854,neutral,sec_filing,AVGO 8-K Filing - 2026-06-03
COST,2026-06-03,-0.04765009507536888,neutral,sec_filing,COST 10-Q Filing - 2026-06-03
DHR,2026-06-03,-0.044713737443089485,neutral,sec_filing,DHR 8-K Filing - 2026-06-03
CMCSA,2026-06-03,-0.03299954533576965,neutral,sec_filing,CMCSA 8-K Filing - 2026-06-03
GS,2026-06-03,-0.04877718724310398,neutral,sec_filing,GS 8-K Filing - 2026-06-03
LOW,2026-06-02,-0.43284708820283413,neutral,sec_filing,LOW 8-K Filing - 2026-06-02
HON,2026-06-02,-0.04187232442200184,neutral,sec_filing,HON 8-K Filing - 2026-06-02
JPM,2026-06-02,-0.06081237271428108,neutral,sec_filing,JPM 8-K Filing - 2026-06-02
CMCSA,2026-06-02,-0.03429025039076805,neutral,sec_filing,CMCSA 8-K Filing - 2026-06-02
MA,2026-06-02,-0.04492818005383015,neutral,sec_filing,MA 8-K Filing - 2026-06-02
TXN,2026-06-02,-0.04809780791401863,neutral,sec_filing,TXN 8-K Filing - 2026-06-02
CRM,2026-06-02,-0.08547416515648365,neutral,sec_filing,CRM 8-K Filing - 2026-06-02
VZ,2026-06-02,-0.05281682685017586,neutral,sec_filing,VZ 8-K Filing - 2026-06-02
CRM,2026-06-01,-0.08088348247110844,neutral,sec_filing,CRM 8-K Filing - 2026-06-01
SCHW,2026-06-01,-0.03642101027071476,neutral,sec_filing,SCHW 8-K Filing - 2026-06-01
DE,2026-06-01,-0.05042322538793087,neutral,sec_filing,DE 8-K Filing - 2026-06-01
WMT,2026-05-29,-0.08250246848911047,neutral,sec_filing,WMT 10-Q Filing - 2026-05-29
META,2026-05-29,-0.05057145096361637,neutral,sec_filing,META 8-K Filing - 2026-05-29
TGT,2026-05-29,-0.08634001296013594,neutral,sec_filing,TGT 10-Q Filing - 2026-05-29
CVX,2026-05-29,-0.035023873671889305,neutral,sec_filing,CVX 8-K Filing - 2026-05-29
CVX,2026-05-29,-0.035023873671889305,neutral,sec_filing,CVX 8-K Filing - 2026-05-29
XOM,2026-05-29,-0.024974897503852844,neutral,sec_filing,XOM 8-K Filing - 2026-05-29
IBM,2026-05-28,-0.037831252440810204,neutral,sec_filing,IBM 8-K Filing - 2026-05-28
DE,2026-05-28,-0.08865066897124052,neutral,sec_filing,DE 10-Q Filing - 2026-05-28
LOW,2026-05-28,-0.5045215375721455,negative,sec_filing,LOW 10-Q Filing - 2026-05-28
MRK,2026-05-28,-0.048972103744745255,neutral,sec_filing,MRK 8-K Filing - 2026-05-28
COST,2026-05-28,-0.04350101388990879,neutral,sec_filing,COST 8-K Filing - 2026-05-28
VZ,2026-05-28,-0.06269165314733982,neutral,sec_filing,VZ 8-K Filing - 2026-05-28
HD,2026-05-27,-0.09956556838005781,neutral,sec_filing,HD 10-Q Filing - 2026-05-27
JPM,2026-05-27,-0.0717932041734457,neutral,sec_filing,JPM 8-K Filing - 2026-05-27
TMO,2026-05-26,-0.05441662296652794,neutral,sec_filing,TMO 8-K Filing - 2026-05-26
HD,2026-05-26,-0.06407931074500084,neutral,sec_filing,HD 8-K Filing - 2026-05-26
PNC,2026-05-26,-0.07586881890892982,neutral,sec_filing,PNC 8-K Filing - 2026-05-26
MCD,2026-05-22,-0.052171243354678154,neutral,sec_filing,MCD 8-K Filing - 2026-05-22
PEP,2026-05-22,-0.03143959864974022,neutral,sec_filing,PEP 8-K Filing - 2026-05-22
AMZN,2026-05-22,-0.058589523658156395,neutral,sec_filing,AMZN 8-K Filing - 2026-05-22
SCHW,2026-05-22,-0.04878164082765579,neutral,sec_filing,SCHW 8-K Filing - 2026-05-22
MRK,2026-05-22,-0.06339249759912491,neutral,sec_filing,MRK 8-K Filing - 2026-05-22
C,2026-05-21,-0.03927169367671013,neutral,sec_filing,C 8-K Filing - 2026-05-21
EOG,2026-05-21,-0.053197793662548065,neutral,sec_filing,EOG 8-K Filing - 2026-05-21
AMAT,2026-05-21,-0.06543726846575737,neutral,sec_filing,AMAT 10-Q Filing - 2026-05-21
PYPL,2026-05-21,-0.06414861045777798,neutral,sec_filing,PYPL 8-K Filing - 2026-05-21
GILD,2026-05-20,-0.0398480910807848,neutral,sec_filing,GILD 8-K Filing - 2026-05-20
AMGN,2026-05-20,-0.045033106580376625,neutral,sec_filing,AMGN 8-K Filing - 2026-05-20
WFC,2026-05-20,-0.07040848024189472,neutral,sec_filing,WFC 8-K Filing - 2026-05-20
SBUX,2026-05-20,-0.039282795041799545,neutral,sec_filing,SBUX 8-K Filing - 2026-05-20
LLY,2026-05-20,-0.037504322826862335,neutral,sec_filing,LLY 8-K Filing - 2026-05-20
ADI,2026-05-20,-0.08438862767070532,neutral,sec_filing,ADI 10-Q Filing - 2026-05-20
NVDA,2026-05-20,-0.07692901510745287,neutral,sec_filing,NVDA 10-Q Filing - 2026-05-20
NVDA,2026-05-20,-0.041407061740756035,neutral,sec_filing,NVDA 8-K Filing - 2026-05-20
TGT,2026-05-20,-0.05499101243913174,neutral,sec_filing,TGT 8-K Filing - 2026-05-20
T,2026-05-20,-0.06190649978816509,neutral,sec_filing,T 8-K Filing - 2026-05-20
ADI,2026-05-20,-0.05507211945950985,neutral,sec_filing,ADI 8-K Filing - 2026-05-20
CSCO,2026-05-19,-0.09208918176591396,neutral,sec_filing,CSCO 10-Q Filing - 2026-05-19
CHTR,2026-05-19,-0.07519514486193657,neutral,sec_filing,CHTR 8-K Filing - 2026-05-19
AMGN,2026-05-19,-0.043240636587142944,neutral,sec_filing,AMGN 8-K Filing - 2026-05-19
CVS,2026-05-18,-0.05427255481481552,neutral,sec_filing,CVS 8-K Filing - 2026-05-18
MDT,2026-05-18,-0.07045379094779491,neutral,sec_filing,MDT 8-K Filing - 2026-05-18
AXP,2026-05-15,-0.06669715791940689,neutral,sec_filing,AXP 8-K Filing - 2026-05-15
AMD,2026-05-15,-0.060331791639328,neutral,sec_filing,AMD 8-K Filing - 2026-05-15
MS,2026-05-15,-0.0705518126487732,neutral,sec_filing,MS 8-K Filing - 2026-05-15
SBUX,2026-05-15,-0.03930015489459038,neutral,sec_filing,SBUX 8-K Filing - 2026-05-15
INTC,2026-05-15,-0.032797232270240784,neutral,sec_filing,INTC 8-K Filing - 2026-05-15
PYPL,2026-05-15,-0.06759891472756863,neutral,sec_filing,PYPL 8-K Filing - 2026-05-15
AMAT,2026-05-14,-0.0641931314021349,neutral,sec_filing,AMAT 8-K Filing - 2026-05-14
MSFT,2026-05-14,-0.041416801512241364,neutral,sec_filing,MSFT 8-K Filing - 2026-05-14
COP,2026-05-14,-0.06993246637284756,neutral,sec_filing,COP 8-K Filing - 2026-05-14
PSX,2026-05-14,-0.0431807991117239,neutral,sec_filing,PSX 8-K Filing - 2026-05-14
CI,2026-05-13,-0.056129852309823036,neutral,sec_filing,CI 8-K Filing - 2026-05-13
LMT,2026-05-13,-0.03381051868200302,neutral,sec_filing,LMT 8-K Filing - 2026-05-13
UPS,2026-05-13,-0.05198262631893158,neutral,sec_filing,UPS 8-K Filing - 2026-05-13
CSCO,2026-05-13,-0.061044855043292046,neutral,sec_filing,CSCO 8-K Filing - 2026-05-13
MMM,2026-05-13,-0.0757084246724844,neutral,sec_filing,MMM 8-K Filing - 2026-05-13
ABBV,2026-05-12,-0.05474751628935337,neutral,sec_filing,ABBV 8-K Filing - 2026-05-12
V,2026-05-12,-0.05393736995756626,neutral,sec_filing,V 8-K Filing - 2026-05-12
GS,2026-05-12,-0.05368385091423988,neutral,sec_filing,GS 8-K Filing - 2026-05-12
SLB,2026-05-12,-0.06118771433830261,neutral,sec_filing,SLB 8-K Filing - 2026-05-12
ORCL,2026-05-12,-0.028592070564627647,neutral,sec_filing,ORCL 8-K Filing - 2026-05-12
UNH,2026-05-11,-0.06557265669107437,neutral,sec_filing,UNH 8-K Filing - 2026-05-11
UPS,2026-05-11,-0.06908970512449741,neutral,sec_filing,UPS 8-K Filing - 2026-05-11
V,2026-05-11,-0.05529198981821537,neutral,sec_filing,V 8-K Filing - 2026-05-11
BMY,2026-05-08,-0.03809848241508007,neutral,sec_filing,BMY 8-K Filing - 2026-05-08
PEP,2026-05-08,-0.03668865188956261,neutral,sec_filing,PEP 8-K Filing - 2026-05-08
ABBV,2026-05-08,-0.08403778728097677,neutral,sec_filing,ABBV 10-Q Filing - 2026-05-08
VLO,2026-05-08,-0.05023341812193394,neutral,sec_filing,VLO 8-K Filing - 2026-05-08
LLY,2026-05-07,-0.037975139915943146,neutral,sec_filing,LLY 8-K Filing - 2026-05-07
DHR,2026-05-07,-0.04599178209900856,neutral,sec_filing,DHR 8-K Filing - 2026-05-07
GE,2026-05-07,-0.06509202346205711,neutral,sec_filing,GE 8-K Filing - 2026-05-07
