ticker,date,sentiment_score,sentiment_label,content_type,title
BLK,2026-06-04,0.12700153142213821,neutral,news,"Saba Capital (ECAT) trims position with open-market sale of 49,325 shares"
BLK,2026-06-04,0.8506427127867937,positive,news,Citigroup to redeem $3.15 billion in notes due 2027
BLK,2026-06-04,0.9302026480436325,positive,news,"XRP, Bitcoin Both Crashed But One Will Be Faster On The Reversal, Analyst Says"
BLK,2026-06-04,-0.7577150166034698,negative,news,"iShares MSCI World ETF Faces a Congested June Calendar: Dividend, Fed Decision, and Tariff Fallout"
BLK,2026-06-04,0.9323024693876505,positive,news,BlackRock Inc Stock (BLK) Moved Up by 3.02% on Jun 4: Drivers Behind the Movement
BLK,2026-06-04,-0.959437764249742,negative,news,UBS cuts staff jobs outside the United States: Report
BLK,2026-06-04,0.9231894873082638,positive,news,STARTEEPO Increases Xerox Stake to Over 6%
BLK,2026-06-04,0.018497150391340256,neutral,news,"ETFs Investing in StandardAero, Inc. Stocks"
BLK,2026-06-04,-0.04677529260516167,neutral,news,"BlackRock (NYSE: BLK) discloses 12.25M shares, 10.4% of XPO"
BLK,2026-06-04,-0.029782388359308243,neutral,news,"BlackRock (BLK) discloses 1,047,247 shares (16.1%) in iShares BuyWrite ETF"
BLK,2026-06-04,-0.0032495595514774323,neutral,news,BlackRock reports 1.57M Class A shares of DAVE (DAVE)
BLK,2026-06-04,-0.03974943235516548,neutral,news,BlackRock stake disclosed in Teradyne (NASDAQ: TER) — 10.1% ownership
BLK,2026-06-04,-0.00044832564890384674,neutral,news,"BlackRock (PLD) discloses 93.4M shares, a 10.0% stake"
BLK,2026-06-04,0.01165635883808136,neutral,news,"BlackRock (OC) holds 8,069,391 shares — 10.0% stake in Owens Corning"
BLK,2026-06-04,-0.021054264158010483,neutral,news,BlackRock reports 12.9% stake in Universal Technical Institute (UTI)
BLK,2026-06-04,-0.034344712272286415,neutral,news,"BlackRock (NYSE: DLB) holds 6,041,219 Class A shares, 10.0% stake"
BLK,2026-06-04,0.021174997091293335,neutral,news,BlackRock updates 11.6% stake in Flowers Foods (NYSE: FLO)
BLK,2026-06-04,0.8150137569755316,positive,news,Private Credit Has Quietly Outgrown Banks and These 3 ETFs Track the $1.5 Trillion Market Yielding Up to 12 Percent
BLK,2026-06-04,0.0359493475407362,neutral,news,BlackRock Intermediate Muni Income Bond ETF declares monthly distribution of $0.0666
BLK,2026-06-04,0.06012386362999678,neutral,news,ETFs Investing in SiTime Corporation Stocks
BLK,2026-06-04,0.02486637607216835,neutral,news,"Zalando SE: Release according to Article 40, Section 1 of the WpHG [the German Securities Trading Act] with the objective of Europe-wide distribution"
BLK,2026-06-04,0.9162984658032656,positive,news,"Vanguard VOO ETF hits $1 trillion in assets, an industry first"
BLK,2026-06-04,0.0466174203902483,neutral,news,ETFs Investing in INVISIO AB Stocks
BLK,2026-06-04,0.08358106017112732,neutral,news,iShares short-term national muni bond ETF declares monthly distribution of $0.2231
BLK,2026-06-04,-0.4961622357368469,negative,news,Assessing State Street (STT) Valuation After Analyst Optimism On Fee Growth And Digitization
BLK,2026-06-04,0.9295968674123287,positive,news,"Key facts: SAP shifts to AI platform, boosts hiring; BlackRock >3%"
BLK,2026-06-04,0.004156982526183128,neutral,news,Number of shareholders of BlackRock Investment Quality Municipal Trust – NASDAQ:XBKNX
BLK,2026-06-03,-0.03250601515173912,neutral,news,"Core Scientific Insider Sold Shares Worth $283,619, According to a Recent SEC Filing"
BLK,2026-06-03,-0.5926817953586578,negative,news,Here's Why BlackRock (BLK) Fell More Than Broader Market
BLK,2026-06-03,-0.6762415803968906,negative,news,"EQS-PVR: Adtran Holdings, Inc.: Release according to Article 40, Section 1 of the WpHG [the German Securities Trading Act] with the objective of Europe-wide distribution - boerse.de"
BLK,2026-06-03,0.23513841815292835,neutral,news,Do Blue Owl Capital’s (OWL) Insider Sales and New Endorsement Reframe Its Alternative Asset Narrative?
BLK,2026-06-03,0.914794952608645,positive,news,What were the key takeaways from SEI's William Blair presentation
BLK,2026-06-03,0.15963494777679443,neutral,news,Galaxy Digital Expands Prediction Markets As Shares Trade Below Targets
BLK,2026-06-03,-0.07692544907331467,neutral,news,WidsomTree CEO: ETFs with Private Assets Next Step in Industry Evolution
BLK,2026-06-03,0.03173042647540569,neutral,news,"ETFs Investing in Western New England Bancorp, Inc. Stocks"
BLK,2026-06-03,-0.043251633644104004,negative,news,"Cryptocurrencies price prediction: XRP, ETF & Cryptos – American Wrap 03 June"
BLK,2026-06-03,0.9378661774098873,positive,news,Vista Energy ( VIST ): Riding the Vaca Muerta Boom to New Highs
BLK,2026-06-03,-0.7608383595943451,negative,news,General Motors tries to vent off overbought saturation - Forecast today - 03-06-2026
PNC,2026-06-05,0.0552519615739584,neutral,news,Dominion Energy prices $825M of 5.35% senior notes due 2036
PNC,2026-06-05,0.9280804432928562,positive,news,"Bank of New York Mellon Corp Has $255.42 Million Holdings in BJ's Wholesale Club Holdings, Inc. $BJ"
PNC,2026-06-04,0.4385772803798318,neutral,news,Two advisors exit PNC to run $2B high-net-worth firm with LPL
PNC,2026-06-04,0.5249819988384843,positive,news,LPL Financial Welcomes Align Private Wealth
PNC,2026-06-04,0.2135851625353098,neutral,news,"Provident Bank Names Annamaria Vitelli EVP, Chief Wealth Officer and President of Beacon Trust"
PNC,2026-06-04,0.008275210857391357,positive,news,Is PNC Financial Services Stock Outperforming the Dow?
PNC,2026-06-04,-0.9477955941110849,negative,news,Is U.S. Bancorp Stock Underperforming the Nasdaq?
PNC,2026-06-04,-0.4210507273674011,negative,news,Is U.S. Bancorp Stock Underperforming the Nasdaq?
PNC,2026-06-04,0.9349419241771102,positive,news,"Geode Capital Management LLC Acquires 102,864 Shares of Ormat Technologies, Inc. $ORA"
PNC,2026-06-04,0.6019710209220648,positive,news,CEO who co-owns Orioles and Penguins honored with Chicago history award
PNC,2026-06-03,-0.9675362668931484,negative,news,PNC Financial Services Group Inc. stock underperforms Wednesday when compared to competitors
PNC,2026-06-03,0.7257127352058887,positive,news,Ventas Chairman and CEO Debra A. Cafaro to Receive Cyrus McCormick Making History Award for Historic Corporate Achievement
PNC,2026-06-03,0.8270102497190237,positive,news,PNC BANK: Going to Bat for Small Business Winners Announced
PNC,2026-06-03,-0.9207124784588814,negative,news,Sales fall 9% as Virco (NASDAQ: VIRC) swings to Q1 net loss
PNC,2026-06-03,0.15152253676205873,neutral,news,"Pittsburgh maintains 10 Fortune 500 companies, led by PNC"
PNC,2026-06-03,-0.008591582998633385,neutral,news,The PNC Financial Services Group Announces Second Quarter Conference Call Details
PNC,2026-06-03,-0.010717196390032768,neutral,news,The PNC Financial Services Group Announces Second Quarter Conference Call Details
PNC,2026-06-03,-0.0047732386738061905,neutral,news,PNC leaders to review Q2 results on July 15 investor webcast call
PNC,2026-06-03,0.8940663002431393,positive,news,Prosperity Bancshares (PB) Gets a Buy from Morgan Stanley
PNC,2026-06-03,0.8229632461443543,positive,news,"PNC Financial Services Group Inc. Invests $372,000 in USA Rare Earth Inc. $USAR"
PNC,2026-06-03,0.9336334504187107,positive,news,Capital Innovations LLC Invests $2.21 Million in Public Service Enterprise Group Incorporated $PEG
PNC,2026-06-03,-0.012943407520651817,neutral,news,The PNC Financial Services Group Announces Second Quarter Conference Call Details
PNC,2026-06-02,-0.023980289697647095,neutral,news,RPM (RPM) updates $300M receivables facility as Kinser moves to new role
PNC,2026-06-02,0.9083469100296497,positive,news,Kennametal Inc. and Kennametal Europe Gmbh Enter Amendments to Credit Agreements Increasing Revolving Credit and Term Loan Facilities
PNC,2026-06-02,0.8552612513303757,positive,news,PNC Financial Services Group Inc. stock outperforms competitors on strong trading day
PNC,2026-06-02,0.8075455203652382,positive,news,"BW Gestao de Investimentos Ltda. Acquires Shares of 102,473 Core Natural Resources, Inc. $CNR"
PNC,2026-06-01,0.534074705094099,positive,news,Enviri Redeems $475 Million Notes and Terminates AR Facility After Clean Earth Sale
PNC,2026-06-01,-0.9658395648002625,negative,news,PNC Financial Services Group Inc. stock underperforms Monday when compared to competitors
PNC,2026-06-01,0.1630437159910798,neutral,news,Why (PNC) Price Action Is Critical for Tactical Trading
PNC,2026-06-01,-0.8722985200583935,negative,news,"Savant Capital LLC Sells 76,331 Shares of The PNC Financial Services Group, Inc $PNC"
PNC,2026-06-01,-0.8066315352916718,negative,news,"Peapack Gladstone Financial Corp Has $39.92 Million Position in The PNC Financial Services Group, Inc $PNC"
PNC,2026-06-01,-0.8448865935206413,negative,news,"Intech Investment Management LLC Cuts Stock Position in The PNC Financial Services Group, Inc $PNC"
PNC,2026-05-31,0.9366756044328213,positive,news,"MUFG Securities EMEA plc Grows Holdings in The PNC Financial Services Group, Inc $PNC"
PNC,2026-05-31,0.8594640903174877,positive,news,"Norges Bank Takes $735.76 Million Position in Targa Resources, Inc. $TRGP"
PNC,2026-05-31,0.6981279496103525,positive,news,"Eurizon Capital SGR S.p.A. Invests $35.12 Million in The PNC Financial Services Group, Inc $PNC"
PNC,2026-05-30,0.03258756920695305,neutral,news,PNC Financial Services Group Independent Lead Director Andrew Feldstein Sells 35% Of Holding
PNC,2026-05-30,-0.9103139489889145,negative,news,PNC Financial Services Group Independent Lead Director Andrew Feldstein Sells 35% Of Holding
PNC,2026-05-30,0.9342591911554337,positive,news,Zweig DiMenna Associates LLC Makes New $7.74 Million Investment in Microchip Technology Incorporated $MCHP
PNC,2026-05-30,-0.9530219174921513,negative,news,"Zweig DiMenna Associates LLC Sells 487,500 Shares of Super Group (SGHC) Limited $SGHC"
PNC,2026-05-30,0.9344719955697656,positive,news,"Norges Bank Buys New Position in The PNC Financial Services Group, Inc $PNC"
PNC,2026-05-30,-0.9275033511221409,negative,news,"National Pension Service Has $200.20 Million Stake in The PNC Financial Services Group, Inc $PNC"
PNC,2026-05-30,0.8409374207258224,positive,news,"Fideuram Asset Management Ireland dac Invests $1.16 Million in The PNC Financial Services Group, Inc $PNC"
PNC,2026-05-30,0.11691177636384964,neutral,news,"The PNC Financial Services Group, Inc (PNC) surpasses Q1 earnings estimates"
PNC,2026-05-29,-0.9626744845882058,negative,news,Zacks Research Issues Negative Outlook for CBRL Earnings
PNC,2026-05-29,0.028105296194553375,neutral,news,"Analysts Offer Insights on Financial Companies: Western Alliance (WAL), FinVolution Group (FINV) and PNC Financial (PNC)"
PNC,2026-05-29,-0.017522424459457397,negative,news,"Jefferies Financial Group Inc. Sells 4,671 Shares of The PNC Financial Services Group, Inc $PNC"
PNC,2026-05-29,0.9190125279128551,positive,news,"PNC Financial Services Group Inc. Purchases 7,686 Shares of Cirrus Logic, Inc. $CRUS"
PNC,2026-05-29,-0.35263511538505554,negative,news,"Douglas Dynamics, Inc. $PLOW Shares Sold by Legato Capital Management LLC"
PNC,2026-05-29,0.9380385279655457,positive,news,"PNC Financial Services Group Inc. Increases Position in Meta Platforms, Inc. $META"
PNC,2026-05-29,0.9323322428390384,positive,news,"Geode Capital Management LLC Has $1.84 Billion Position in The PNC Financial Services Group, Inc $PNC"
ABT,2026-06-05,-0.17391270212829113,neutral,news,Abbott Laboratories on Pace for Largest Percent Increase Since April 2023 -- Data Talk
ABT,2026-06-05,0.9134290544316173,positive,news,Independent Chair of Insulet Picks Up 66% More Stock
ABT,2026-06-05,0.9280059933662415,positive,news,"Becton, Dickinson and Company (NYSE:BDX) Passed Our Checks, And It's About To Pay A US$1.05 Dividend"
ABT,2026-06-05,-0.8517079744488001,negative,news,Abbott Can’t Drop PediaSure Children’s Growth Deception Suit
ABT,2026-06-05,0.6096300166100264,positive,news,Rep. Josh Gottheimer Purchases Shares of Fabrinet (NYSE:FN)
ABT,2026-06-04,-0.862246498465538,negative,news,Abbott Can’t Drop PediaSure Children’s Growth Deception Suit
ABT,2026-06-04,-0.6064770221710205,negative,news,Abbott Labs must face lawsuit over PediaSure children’s growth claims
ABT,2026-06-04,0.9388324804604053,positive,news,Abbott Laboratories Stock (ABT) Closed Up by 4.18% on Jun 4: Drivers Behind the Movement
ABT,2026-06-04,-0.034171126782894135,neutral,news,Abbott Labs must face lawsuit over PediaSure children’s growth claims
ABT,2026-06-04,0.019261281937360764,neutral,news,"Earnings Flash (PODD) Insulet Posts Q1 Adjusted EPS $1.42, vs. FactSet Est of $1.20"
ABT,2026-06-04,-0.7464622762054205,negative,news,Abbott Labs must face lawsuit over PediaSure children's growth claims
ABT,2026-06-04,-0.019620180130004883,negative,news,Unitedhealth Group Inc Stock (UNH) Moved Up by 5.69% on Jun 4: A Full Analysis
ABT,2026-06-04,0.9319077227264643,positive,news,Why is Insulet stock rallying today?
ABT,2026-06-04,0.8787025036290288,positive,news,Canaccord initiates Pulse Biosciences stock with buy on ablation tech By Investing.com
ABT,2026-06-04,0.10805230215191841,neutral,news,Jim Cramer on GE HealthCare: “Maybe It’s Too Expensive”
ABT,2026-06-04,0.5673724710941315,positive,news,Jim Cramer Says “No One Disputes the Science and Commercial Smarts of Abbott”
ABT,2026-06-04,0.7010694686323404,positive,news,"CereVasc closes $85M Series C to support eShunt system with investment from J&J, Medtronic"
ABT,2026-06-04,0.8417336400598288,positive,news,Insulet Announces U.S. Rollout of Enhanced Omnipod® 5 Algorithm and Expands Compatibility with Abbott’s FreeStyle Libre 3 Plus Sensor
ABT,2026-06-03,-0.7875780947506428,negative,news,Abbott Laboratories Deadline Alert
ABT,2026-06-03,0.8762055668048561,positive,news,Insulet's Omnipod 5 Update: A Masterclass in Personalized Health Tech
ABT,2026-06-03,0.7507419027388096,positive,news,"Insulet Rolls Out New Omnipod 5 Algorithm, Compatibility with Abbott’s FreeStyle Libre 3 Plus"
ABT,2026-06-03,0.8776430198922753,positive,news,Insulet Announces U.S. Rollout of Enhanced Omnipod® 5 Algorithm and Expands Compatibility with Abbott’s FreeStyle Libre 3 Plus Sensor
ABT,2026-06-03,0.8540739612653852,positive,news,5 Algorithm and Expands Compatibility with Abbott’s FreeStyle Libre 3 Plus Sensor
ABT,2026-06-03,0.882228066213429,positive,news,Insulet Corporation Announces U.S. Rollout of Enhanced Omnipod 5 Algorithm and Expands Compatibility with Abbott?S Freestyle Libre 3 Plus Sensor
ABT,2026-06-03,-0.8199345897883177,negative,news,Abbott Laboratories Deadline Alert
ABT,2026-06-02,-0.9354175757616758,negative,news,Is Abbott Laboratories (ABT) Now Attractive After A 33% One Year Share Price Slide
ABT,2026-06-02,0.9189602993428707,positive,news,"At ASCO, Grail points to positive signals in MCED data"
ABT,2026-06-02,0.8509393366985023,positive,news,Can ISRG's Digital Roadmap Unlock the Next Phase of Robotic Surgery?
ABT,2026-06-02,-0.583551861345768,negative,news,Abbott Laboratories Deadline Alert
ABT,2026-06-02,0.038892630487680435,neutral,news,IHI Top Holdings List & Exposure (iShares U.S. Medical Devices ETF)
ABT,2026-06-01,-0.6132403910160065,negative,news,Tax Havens Cost US $40 Billion After Trump Withdraws From Global Deal
ABT,2026-06-01,0.5473168045282364,positive,news,A Look At Becton Dickinson (BDX) Valuation After The Elyra Kidney Stone Care Launch
ABT,2026-06-01,0.9038986079394817,positive,news,Abbott Laboratories stock outperforms competitors on strong trading day
ABT,2026-06-01,-0.4110800623893738,negative,news,"Goldman Sachs Maintains Abbott Laboratories(ABT.US) With Buy Rating, Cuts Target Price to $113"
ABT,2026-06-01,-0.9162176419049501,negative,news,Abbott Accused of Firing Manager for Reporting Kickback Schemes
ABT,2026-06-01,-0.9327818974852562,negative,news,Abbott Accused of Firing Manager for Reporting Kickback Schemes
ABT,2026-06-01,-0.027005743235349655,neutral,news,EBIT per share of Abbott Laboratories Shs UnSponsored Canadian Depository Receipt Hedged – NEO:ABT
ABT,2026-05-31,0.9202732630074024,positive,news,Abbott Laboratories stock (US0028241000): U.S. healthcare name steadies after recent ETF inclusion and portfolio moves
ABT,2026-05-31,-0.8925861064344645,negative,news,NeuroOne Medical Technologies (Nasdaq:NMTC) - Stock Analysis
ABT,2026-05-30,0.9071091320365667,positive,news,Does ACS Endorsement of Cologuard Shape the Bull Case for Abbott Laboratories (ABT) in Cancer Screening?
ABT,2026-05-30,-0.05921754240989685,neutral,news,Abbott Laboratories stock (US0028241000): Insider activity stays in focus
ABT,2026-05-30,-0.7313366830348969,negative,news,Abbott Laboratories Trade Ideas — LS:850103
ABT,2026-05-29,0.862019332125783,positive,news,"Piper Sandler Maintains Abbott Laboratories(ABT.US) With Buy Rating, Maintains Target Price $115"
ABT,2026-05-29,0.8698254600167274,positive,news,BSX vs. ABT: Which Medical Stock Has More Upside Potential?
ABT,2026-05-29,-0.020524028688669205,neutral,news,EW News | EDWARDS LIFESCIENCES CORP (NYSE:EW)
ABT,2026-05-29,0.9007569551467896,positive,news,Wells Fargo Reaffirms Their Buy Rating on Intuitive Surgical (ISRG)
ABT,2026-05-29,0.7157764285802841,positive,news,Abbott gets European OK to market world’s first dual glucose-ketone sensor
ABT,2026-05-29,-0.9591509317979217,negative,news,A Look At Abbott Laboratories (ABT) Valuation After New Approvals For Libre Duo And Ultreon 3.0
ABT,2026-05-29,-0.9626152869313955,negative,news,A Look At Abbott Laboratories (ABT) Valuation After New Approvals For Libre Duo And Ultreon 3.0
ABT,2026-05-28,0.23872032761573792,neutral,news,Exact Sciences Corp. stock (US30063P1057): Abbott buyout clouds listing status and sector role
CAT,2026-06-05,0.9332199692726135,positive,news,"After a 160% AI-Driven Rally, Can Caterpillar Stock Keep Climbing?"
CAT,2026-06-04,0.905708035454154,positive,news,Caterpillar Wins Snowflake 2026 Data Driver in AI Award
CAT,2026-06-04,0.8723200298845768,positive,news,Options Bears Are Betting Against Industrial Stocks
CAT,2026-06-04,0.9312835847958922,positive,news,BHP Group Limited (BHP): 9 Best Silver and Copper Stocks to Buy for the EV Transition
CAT,2026-06-04,-0.9580496232956648,negative,news,Jim Cramer Advises Caller to Cut Losses on Power Solutions After Quarterly Miss
CAT,2026-06-03,-0.9665416711941361,negative,news,Boeing Co Stock (BA) Closed Down by 3.05% on Jun 3: Drivers Behind the Movement
CAT,2026-06-03,0.14139549061655998,neutral,news,"Chicago claims 14 Fortune 500 spots, led by ADM"
CAT,2026-06-03,-0.050688909366726875,neutral,news,10 Industrials Stocks With Whale Alerts In Today's Session
CAT,2026-06-03,-0.05301016569137573,negative,news,"Jim Cramer Talked About 16 Stocks Like Micron and Dell, Along With the AI Infrastructure Spending"
CAT,2026-06-03,0.8911514449864626,positive,news,"Caterpillar, Deere rally as Trump eases tariffs on farm and industrial equipment"
CAT,2026-06-03,0.9290692219510674,positive,news,Shepherd Street Advisors LLC Takes $2.40 Million Position in Taiwan Semiconductor Manufacturing Company Ltd. $TSM
CAT,2026-06-03,0.46498743165284395,neutral,news,How One Engineer Created John Deere’s Most Important Tractors
CAT,2026-06-03,0.873427864164114,positive,news,"Caterpillar, Deere rally as Trump eases tariffs on farm and industrial equipment (CAT:NYSE)"
CAT,2026-06-03,-0.9497653963044286,negative,news,"Anchor Capital Advisors LLC Sells 1,409,056 Shares of CNH Industrial N.V. $CNH"
CAT,2026-06-02,-0.9518369231373072,negative,news,UAW strike hits GM truck supplier American Axle
CAT,2026-06-02,-0.8830953650176525,negative,news,Is Caterpillar Inc (CAT) Overvalued After 5.1% Rally? GF Value Says Overvalued
CAT,2026-06-02,0.9017378930002451,positive,news,"Dow Up 289 Points On Gains For Cisco, Caterpillar Stocks"
CAT,2026-06-02,0.9332498479634523,positive,news,Deere & Co Stock (DE) Moved Up by 5.63% on Jun 2: A Full Analysis
CAT,2026-06-02,-0.9657959323376417,negative,news,Boeing Co Stock (BA) Moved Down by 3.39% on Jun 2: Key Drivers Unveiled
CAT,2026-06-02,0.9320790953934193,positive,news,Donaldson (DCI) boosts earnings and adds Facet in $828.7M cash deal
CAT,2026-06-02,0.9392628110945225,positive,news,Caterpillar Inc Stock (CAT) Moved Up by 4.33% on Jun 2: Key Drivers Unveiled
CAT,2026-06-02,0.4462678227573633,neutral,news,"Dow Rallies 150 Points On Gains In Shares Of Cisco, Caterpillar"
CAT,2026-06-02,0.9378861077129841,positive,news,"Caterpillar Gains 51% YTD: Time to Buy, Sell or Hold the Stock?"
CAT,2026-06-02,0.5390301588922739,positive,news,"Bernstein Maintains Caterpillar(CAT.US) With Hold Rating, Maintains Target Price $879"
CAT,2026-06-02,0.8037111200392246,positive,news,Watch These 5 Non-Tech Stocks Thriving in 2026 on AI Data Center Boom
CAT,2026-06-02,0.824840696528554,positive,news,"NGM’s Carlin Complex gigantic, ever evolving"
CAT,2026-06-02,0.9206334492191672,positive,news,"UBS Maintains Caterpillar(CAT.US) With Hold Rating, Raises Target Price to $900"
CAT,2026-06-02,0.7404736466705799,positive,news,"HPE, Marvell among market cap stock movers on Tuesday"
CAT,2026-06-02,0.5957494042813778,positive,news,National Pension Service Acquires New Shares in CNH Industrial N.V. $CNH
CAT,2026-06-02,0.9368517510592937,positive,news,"Caterpillar Gains 51% YTD: Time to Buy, Sell or Hold the Stock?"
CAT,2026-06-02,0.8452814593911171,positive,news,How New Data Center Engine Plans and 2030 Targets May Shape Cummins' (CMI) Legal-Shadowed Outlook
CAT,2026-06-02,0.9218447590246797,positive,news,"BNP Paribas Financial Markets Purchases 360,898 Shares of CNH Industrial N.V. $CNH"
CAT,2026-06-01,-0.907075023278594,negative,news,Thompson Siegel & Walmsley LLC Has $28.32 Million Stake in CNH Industrial N.V. $CNH
CAT,2026-06-01,-0.9638878842815757,negative,news,Caterpillar Inc. stock underperforms Monday when compared to competitors
CAT,2026-06-01,0.8716576565057039,positive,news,"Caterpillar's Clayton site integrates 'automated ecosystem,' enters 50+ person hiring push"
CAT,2026-06-01,0.9060571659356356,positive,news,"BofA Securities Maintains Caterpillar(CAT.US) With Buy Rating, Maintains Target Price $989"
CAT,2026-06-01,-0.009586486965417862,neutral,news,"Caterpillar 299D For Sale (88195607) from Rebel Auction Co., Inc. [9233] in Hazlehurst, GA"
CAT,2026-06-01,0.9193884003907442,positive,news,"The Home Depot, Inc. $HD Shares Bought by Hillsdale Investment Management Inc."
CAT,2026-06-01,0.826437939889729,positive,news,Hillsdale Investment Management Inc. Invests $5.06 Million in Terex Corporation $TEX
CAT,2026-06-01,0.9343103915452957,positive,news,Analysts Raise Price Targets on Caterpillar (CAT) as Growth Drivers Strengthen
CAT,2026-05-31,0.051226526498794556,positive,news,"Ag Equipment News: Combine Sales on the Rise, Deere Rotary Cutters and More"
CAT,2026-05-31,-0.944615924730897,negative,news,CNH Industrial N.V. $CNH Shares Sold by Legal & General Group Plc
CAT,2026-05-30,0.9320123586803675,positive,news,ProPetro Holding Corp. (PUMP): Leopold Aschenbrenner Remains Bullish
CAT,2026-05-30,0.9343466702848673,positive,news,Is Caterpillar's China Exposure a Blessing or a Curse Amid Trade Tensions
CAT,2026-05-30,-0.012399185448884964,neutral,news,How Will Ulta Beauty Stock React To Its Upcoming Earnings?
CAT,2026-05-30,0.8985887691378593,positive,news,Corcept Therapeutics Stock On Fire: Up 26% With 8-Day Winning Streak
CAT,2026-05-30,0.9165730103850365,positive,news,Corcept Therapeutics Stock On Fire: Up 26% With 8-Day Winning Streak
CAT,2026-05-30,0.06823692377656698,neutral,news,Years of Rewards: $43 Bil From Caterpillar Stock
CAT,2026-05-30,0.9305803328752518,positive,news,"Caterpillar, Inc. Stock 12‑Month Price Target Raised to $964.81, Implies 10% Upside"
CAT,2026-05-29,-0.9678739472292364,negative,news,Caterpillar Inc. stock underperforms Friday when compared to competitors
DE,2026-06-05,0.6539032161235809,positive,news,"TD Asset Management Inc Sells 197,847 Shares of Deere & Company $DE"
DE,2026-06-05,0.9351964015513659,positive,news,Deere & Company $DE Shares Purchased by Cibc World Market Inc.
DE,2026-06-05,0.93468302115798,positive,news,Deere Stock 7-Day Winning Spree: Stock Climbs 12%
DE,2026-06-04,0.6440915018320084,positive,news,Deere recovers $272M in tariff refunds
DE,2026-06-04,0.8317473288625479,positive,news,"JPMorgan Adjusts Price Target on Deere & Company to $590 From $560, Maintains Neutral Rating"
DE,2026-06-04,-0.9462431725114584,negative,news,Mazzotti era comes to an end within John Deere
DE,2026-06-04,-0.7088580951094627,negative,news,"Bowen Hanes & Co. Inc. Sells 3,430 Shares of Deere & Company $DE"
DE,2026-06-04,-0.8117170557379723,negative,news,Bank of New York Mellon Corp Has $743.89 Million Stake in Deere & Company $DE
DE,2026-06-03,0.9346884004771709,positive,news,A Look At Deere (DE) Valuation As Tariff Cuts Lift Sector Sentiment And Cost Outlook
DE,2026-06-03,0.6235174685716629,positive,news,CNH Industrial Soars 11.17% to Intraday High Amid Strong Performance
DE,2026-06-03,0.6632586792111397,positive,news,"Demand Is Booming for New No Tech, Repairable Tractor"
DE,2026-06-03,0.901477562263608,positive,news,Deere & Company $DE Shares Acquired by Westpac Banking Corp
DE,2026-06-03,0.9236835241317749,positive,news,Orient Securities Keeps Their Buy Rating on Netease Inc (9999)
DE,2026-06-03,-0.7819254025816917,negative,news,The Toro Company (TTC) Reports Earnings Tomorrow: What To Expect
DE,2026-06-02,-0.5265015251934528,negative,news,The Precedent: Federal Circuit Reverses Indefiniteness Ruling on Means-Plus-Function Analysis in Gramm v. Deere & Co.
DE,2026-06-02,0.7371622174978256,positive,news,Why Deere (DE) Is Up 9.5% After Tightening 2026 Guidance And Boosting Capital Returns – And What's Next
DE,2026-06-02,0.9330830276012421,positive,news,Why AGCO (AGCO) Stock Is Up Today
