ticker,date,sentiment_score,sentiment_label,content_type,title
AAPL,2026-04-13,-0.9603049578145146,negative,news,Alphabet Stock Dips in Pre-Market as AI Spending and Antitrust Pressures Weigh on GOOG
AAPL,2026-04-13,0.925336929038167,positive,news,Corning Stock Is Up 311% Over the Past Year. Is It a Buy in 2026?
AAPL,2026-04-13,0.888715535402298,positive,news,Apple Inc. $AAPL Holdings Boosted by Westmount Partners LLC
AAPL,2026-04-13,0.8719606585800648,positive,news,"Applied Materials to construct new buildings for manufacturing, logistics operations in expansion"
AAPL,2026-04-13,0.25723642855882645,neutral,news,The Fortress and the Future: A Comprehensive Research Feature on JPMorgan Chase & Co. (JPM)
AAPL,2026-04-13,0.8894591806456447,positive,news,Qualcomm expands Snap and Bosch partnerships
AAPL,2026-04-13,0.9199462030082941,positive,news,My Personal CFO LLC Increases Position in Apple Inc. $AAPL
AAPL,2026-04-13,0.5808738591149449,positive,news,"Apple testing four designs, mulls oval camera lenses for its AI glasses - report"
AAPL,2026-04-13,0.8704749159514904,positive,news,iShares MSCI World ETF: SpaceX-Börsengang!
AAPL,2026-04-12,-0.9355354197323322,negative,news,Applied Materials Sees Stake Decrease from HF Advisory Group
AAPL,2026-04-12,0.6765905376523733,positive,news,The 5 Best Perks That Come With The Apple Card
AAPL,2026-04-12,0.8836165843531489,positive,news,Warren Buffett’s bold American Express bet pays off
AAPL,2026-04-12,0.49352454766631126,positive,news,"AI Cyber Risks Trigger White House Talks with Microsoft, Alphabet, and Major Banks"
AAPL,2026-04-12,-0.8372539095580578,negative,news,"Robeco Institutional Asset Management B.V. Has $226.60 Million Stake in VeriSign, Inc. $VRSN"
AAPL,2026-04-12,0.8886711020022631,positive,news,Better Warren Buffett Stock: American Express vs. Visa
AAPL,2026-04-12,-0.9188946885988116,negative,news,iShares MSCI World ETF Braces for a Triple Threat of Change
AAPL,2026-04-12,-0.9453593930229545,negative,news,Carnegie Investment Counsel Has $6.99 Million Position in Taiwan Semiconductor Manufacturing Company Ltd. $TSM
AAPL,2026-04-12,-0.9313804395496845,negative,news,"Birch Financial Group LLC Sells 2,391 Shares of Apple Inc. $AAPL"
AAPL,2026-04-12,0.004476344212889671,neutral,news,"Fidelity Yield Enhanced Equity ETF ETF Price, Holdings, & News (BATS:FYEE)"
AAPL,2026-04-12,0.014058751985430717,neutral,news,"Investar Holding Corp Stock Live Price, Chart, Analysis, News & Forecast – Buy, Sell & Trade US Equities Today"
AAPL,2026-04-11,0.03974846005439758,positive,news,Tech Valuations Back to Pre-AI Boom Levels
AAPL,2026-04-11,0.7897102860733867,positive,news,Best Buy Co. Inc. stock (US0865161014): Is its consumer electronics moat strong enough to unlock new upside?
AAPL,2026-04-11,0.14887088257819414,neutral,news,"PayPal Holdings, Inc. Trade Ideas — BSESOF:2PP"
AAPL,2026-04-11,0.9202229455113411,positive,news,TUG ETF Volume Surges as Nvidia Options Bear Bites
AAPL,2026-04-11,-0.6111476682126522,negative,news,"Micron Technology, Inc. Trade Ideas — BSESOF:MTE"
AAPL,2026-04-11,-0.9119103625416756,negative,news,iShares MSCI World ETF Braces for a Dual Shock
AAPL,2026-04-11,-0.9219284579157829,negative,news,"Towson Apple store closure “perplexes” leader, shoppers split"
AAPL,2026-04-11,0.932247607037425,positive,news,Inflation ETF Posts Gains as March CPI Jumps to 3.3%
AAPL,2026-04-11,0.9380696304142475,positive,news,Westend Capital Management LLC Increases Position in Apple Inc. $AAPL
AAPL,2026-04-11,0.9376798961311579,positive,news,Garmin Ltd. Experiences Revision in Its Stock Evaluation Amid Strong Financial Performance
AAPL,2026-04-11,0.21227332949638367,positive,news,Supreme Court Ruling Bolsters Xiao-I’s Legal Battle Against Apple
AAPL,2026-04-11,-0.008720723912119865,neutral,news,Applied Finance Valuation Large Cap ETF (VSLU) ETF Holders - Institutional Ownership
AAPL,2026-04-11,-0.9556950498372316,negative,news,Apple Inc. $AAPL Shares Sold by Orrstown Financial Services Inc.
AAPL,2026-04-11,0.8988176975399256,positive,news,Snap partners with Qualcomm to power upcoming AI glasses release
AAPL,2026-04-11,0.9256965294480324,positive,news,Apple MacBook Neo opens the door to $32bn TAM: BofA
AAPL,2026-04-11,-0.9246143773198128,negative,news,Brookstone Capital Management Reduces Stock Holdings in Apple Inc. $AAPL
AAPL,2026-04-11,0.01190563291311264,neutral,news,SCHX ETF | Schwab U.S. Large-Cap ETF
AAPL,2026-04-11,0.7508814632892609,positive,news,Assessing Cellebrite DI (CLBT) Valuation After Its Spring 2026 Digital Forensics Release
AAPL,2026-04-11,0.3126502921804786,neutral,news,"Could Investing $10,000 in SCHB Make You a Millionaire?"
AAPL,2026-04-11,0.4049522094428539,neutral,news,"Could Investing $10,000 in SCHB Make You a Millionaire?"
AAPL,2026-04-11,-0.9286585822701454,negative,news,iShares MSCI World ETF: A Fee Fight and a Forced Reshuffle
AAPL,2026-04-11,-3.906339406967163e-05,neutral,news,"Roundhill AAPL WeeklyPay ETF To Go Ex-Dividend On April 13th, 2026 With 0.24642 USD Dividend Per Share"
AAPL,2026-04-11,-0.9647238249890506,negative,news,News | Apple closes three stores at malls it claims are ‘declining’
AAPL,2026-04-10,0.7840331010520458,positive,news,Qualcomm just gave us a reason to take Snap's AR smart glasses more seriously
AAPL,2026-04-10,0.021180374547839165,neutral,news,Roundhill AAPL WeeklyPay ETF announces weekly distribution of $0.2464
AAPL,2026-04-10,-0.9596602004021406,negative,news,Apple is closing stores in three states as it begins to pull back on mall locations
AAPL,2026-04-10,-0.8838690258562565,negative,news,Boston Scientific Corporation (BSX) Shareholders Who Lost Money Have Opportunity to Lead Securities Fraud Lawsuit
AAPL,2026-04-10,0.9342131391167641,positive,news,Intel Stock Gains 50% in 8 Days. Why the Company Has a ‘Renewed Lease on Life.’
AAPL,2026-04-10,-0.9587536361068487,negative,news,Apple Makes Rare Decision to Shut Down 3 Stores. It Points to a Growing Problem
AAPL,2026-04-10,0.9235605308786035,positive,news,HP Inc. stock (US40434L1052): Is PC market recovery strong enough to drive sustainable gains?
AMD,2026-04-13,0.6155957635492086,positive,news,"Supermicro Introduces Compact, Energy-Efficient Systems to Accelerate Adoption of Intelligent Edge AI"
AMD,2026-04-13,0.704989050514996,positive,news,"Supermicro Introduces Compact, Energy-Efficient Systems to Accelerate Adoption of Intelligent Edge AI"
AMD,2026-04-13,0.4174652248620987,neutral,news,A 2.5L server and two more: Supermicro pushes AI to stores and clinics
AMD,2026-04-13,0.9140321295708418,positive,news,The Great Silicon Resurgence: An In-Depth Research Report on Intel Corporation (INTC)
AMD,2026-04-13,0.9344093948602676,positive,news,"Robeco Institutional Asset Management B.V. Purchases 82,295 Shares of Comfort Systems USA, Inc. $FIX"
AMD,2026-04-13,0.8922258950769901,positive,news,"Zacks Industry Outlook Highlights Micron Technology, Advanced Micro Devices, Hewlett Packard and Agilysys"
AMD,2026-04-13,0.3470567539334297,neutral,news,"Advanced Micro Devices, Inc. stock (US0079031078): Is AI demand acceleration now the real test for sustained growth?"
AMD,2026-04-13,0.9274292290210724,positive,news,AMD.SW Stock Surges 490% in Pre-Market: High Volume Mover Alert
AMD,2026-04-13,0.8337070355191827,positive,news,POSCO : DX Accelerates Manufacturing AI Innovation with Domestic NPU Instead of GPU
AMD,2026-04-12,0.8269418105483055,positive,news,Evaluating Cirrus Logic (CRUS) After A Strong Share Price Run And Mixed Valuation Signals
AMD,2026-04-12,0.5617358833551407,positive,news,Here’s What The Street Thinks About Advanced Micro Devices (AMD)
AMD,2026-04-12,0.0010922010987997055,neutral,news,AMYY Options Volatility — NASDAQ:AMYY
AMD,2026-04-12,0.7971488684415817,positive,news,Celestica Stock (CLS) Opinions on Technical Breakout and AI Momentum
AMD,2026-04-12,0.8907488519325852,positive,news,"Advanced Micro Devices, Inc. stock (US0079031078): Is AI dominance strong enough to unlock new upsid"
AMD,2026-04-12,0.00272369384765625,neutral,news,AMDG Options Volatility — NASDAQ:AMDG
AMD,2026-04-12,0.9273322355002165,positive,news,"Applied Materials, Inc. stock (US0382221051): Is semiconductor equipment demand strong enough to unlock new upside?"
AMD,2026-04-12,0.899428553879261,positive,news,Plug Power (PLUG) Surges 25% After Earnings Beat — Can the Momentum Continue?
AMD,2026-04-12,0.006289934739470482,neutral,news,AMDG Options Chain — NASDAQ:AMDG
AMD,2026-04-12,0.07538966834545135,neutral,news,"Micron Technology, Inc. Trade Ideas — TURQUOISE:MUN"
AMD,2026-04-12,0.1862228810787201,positive,news,"Comfort Systems USA, Inc. $FIX Shares Sold by Beacon Harbor Wealth Advisors Inc."
AMD,2026-04-12,0.09040920436382294,neutral,news,"Micron Technology, Inc. Trade Ideas — BSESOF:MTE"
AMD,2026-04-12,-0.0034969598054885864,neutral,news,"ALBT SEC Filings - Avalon Globocare Corp 10-K, 10-Q, 8-K Forms"
AMD,2026-04-12,0.567125647328794,positive,news,"Cathie Wood’s ARK buys Palantir stock, sells AMD shares"
AMD,2026-04-11,0.9292028658092022,positive,news,Bitcoin News: Morgan Stanley Just Launched the Cheapest Bitcoin ETF on the Market
AMD,2026-04-11,0.9370302185416222,positive,news,What's Going On With Advanced Micro Devices Stock Friday?
AMD,2026-04-11,-0.012150172144174576,neutral,news,"Advanced Micro Devices, Inc. Shs Cert Deposito Arg Repr 0.1 Shs Trade Ideas — BCBA:AMD"
AMD,2026-04-11,0.9285794831812382,positive,news,"Ritholtz Wealth Management Acquires 1,146 Shares of ASML Holding N.V. $ASML"
AMD,2026-04-11,0.8612745590507984,positive,news,Wall Street Analysts Are Bullish on Top Technology Picks
AMD,2026-04-11,0.9263813905417919,positive,news,8-Day Rally Sends Advanced Micro Devices Stock Up 25%
AMD,2026-04-11,0.5349861374124885,positive,news,Riot Board Shift Gives Shareholders More Say On AI Pivot Risks
AMD,2026-04-11,-0.003911301493644714,neutral,news,"ON Stock Price, Quote & Chart | ON SEMICONDUCTOR (NASDAQ:ON)"
AMD,2026-04-10,-0.42000383138656616,negative,news,Advanced Micro Devices Inc (AMD) Stock Up 3.5% but GF Value Says Overvalued -- GF Score: 93/100
AMD,2026-04-10,-0.08147014863789082,neutral,news,What's going on with Advanced Micro Devices stock Friday?
AMD,2026-04-10,0.899516673758626,positive,news,A Look At Texas Instruments (TXN) Valuation After A High Profile Analyst Upgrade To Buy
AMD,2026-04-10,0.9378157882019877,positive,news,This Semiconductor Stock Is All You Need To Be Buying
AMD,2026-04-10,0.9366492684930563,positive,news,Linde plc stock (IE000S9YS4E6): Is its industrial gases dominance strong enough for U.S. investor upside?
AMD,2026-04-10,0.9350237399339676,positive,news,"AMD Gains 4%, Broadcom Climbs 5%: The AI Chip Rally Has Two Very Different Winners Today"
AMD,2026-04-10,0.9349283836781979,positive,news,Advanced Micro Devices (AMD) Stock Surges 6% Following TSMC's Impressive Q1 Revenue Report
AMD,2026-04-10,0.9261521603912115,positive,news,Advanced Micro Devices (AMD) Stock Rises 6% After TSMC Reports 35% Sales Jump
AMD,2026-04-10,0.8853821447119117,positive,news,Bank of America Says Marvell and AMD Are 2 Top ‘AI Compute’ Stocks to Buy Now
AMD,2026-04-10,0.9358784016221762,positive,news,Montes Archimedes Acquisition (ROIV) Raised to Buy: Key Information You Need
AMD,2026-04-10,0.8012636676430702,positive,news,ASE Technology (NYSE:ASX) Reaches New 1-Year High - Here's What Happened
AMD,2026-04-10,0.9322971068322659,positive,news,AMD Stock Is Soaring This Morning. Here's Why Investors Are Excited
AMD,2026-04-10,-0.7678413018584251,negative,news,"Is AMD Stock's 31.42X P/E Still Worth it? Buy, Sell or Hold?"
AMD,2026-04-10,-0.39097803831100464,negative,news,"Is AMD Stock's 31.42X P/E Still Worth it? Buy, Sell or Hold?"
AMD,2026-04-10,-0.966601051390171,negative,news,Intuit Inc Stock (INTU) Moved Down by 3.42% on Apr 10: Drivers Behind the Movement
AMD,2026-04-10,0.8407799005508423,positive,news,"Is AMD Stock's 31.42X P/E Still Worth it? Buy, Sell or Hold?"
AMD,2026-04-10,0.7397819682955742,positive,news,"Is AMD Stock's 31.42X P/E Still Worth it? Buy, Sell or Hold?"
AMD,2026-04-10,0.8556884303689003,positive,news,Taiwan Semiconductor Stock Soars 20% YTD: Time to Hold or Book Profit?
WMT,2026-04-13,0.6844493271782994,positive,news,The Infrastructure Giant: A Comprehensive 2026 Research Feature on Amazon.com (AMZN)
WMT,2026-04-13,0.939215955324471,positive,news,Costco's International Sales Surge Signals Shift in Growth Mix
WMT,2026-04-13,0.9274569619446993,positive,news,"Stanley Laman Group Ltd. Purchases 3,655 Shares of Caterpillar Inc. $CAT"
WMT,2026-04-13,0.890942114405334,positive,news,Zacks Industry Outlook Highlights Walmart and Kroger
WMT,2026-04-13,-0.9078197330236435,negative,news,Walmart Inc. $WMT Shares Sold by Factory Mutual Insurance Co.
WMT,2026-04-13,-0.4341993033885956,negative,news,Diversify Advisory Services LLC Reduces Stake in Walmart Inc. $WMT
WMT,2026-04-13,0.9328718036413193,positive,news,Carnegie Investment Counsel Grows Holdings in Walmart Inc. $WMT
WMT,2026-04-12,0.9360106671229005,positive,news,Alcon Inc stock (CH0432492467): Is vision care dominance strong enough to unlock new upside?
WMT,2026-04-12,0.9276904938742518,positive,news,Walmart Inc. stock (US9311421039): Is e-commerce acceleration strong enough to unlock new upside?
WMT,2026-04-12,0.9135973146185279,positive,news,Walmart Inc. stock (US9311421039): Is e-commerce acceleration strong enough to unlock new upside?
WMT,2026-04-12,-0.19528589397668839,neutral,news,"PayPal Holdings, Inc. Trade Ideas — BSESOF:2PP"
WMT,2026-04-12,0.9338180013000965,positive,news,Spirepoint Private Client LLC Raises Holdings in Walmart Inc. $WMT
WMT,2026-04-12,0.9117362489923835,positive,news,Triad Wealth Partners LLC Has $4.50 Million Stock Position in Walmart Inc. $WMT
WMT,2026-04-12,0.28207405004650354,neutral,news,"Coca-Cola offers state-specific collectible can designs, including Kansas"
WMT,2026-04-12,-0.890824269503355,negative,news,Brookwood Investment Group LLC Cuts Stake in Walmart Inc. $WMT
WMT,2026-04-12,0.0080504659563303,neutral,news,"UPBD.O Stock News Today | Earnings, Events & Price Alerts"
WMT,2026-04-12,-0.08121884800493717,neutral,news,"GODN Stock News Today | Earnings, Events & Price Alerts"
WMT,2026-04-12,0.22331449389457703,positive,news,Is WWW’s Ms. Rachel Footwear Tie-Up a Signal About Its Long-Term Brand Momentum Strategy?
WMT,2026-04-12,-0.7935308143496513,negative,news,The ‘Snackflation’ Breaking Point: Why Your $7 Bag of Chips Is About to Get Cheaper
WMT,2026-04-11,-0.9625379899516702,negative,news,Dollar Tree Inc. stock underperforms Tuesday when compared to competitors
WMT,2026-04-11,0.7724987780675292,positive,news,Ulta Beauty Inc. stock (US90384S3031): Is its beauty retail dominance strong enough to unlock new upside?
WMT,2026-04-11,0.9066839418374002,positive,news,Ulta Beauty Extends Reach With Space NK Deal And Messi Fragrances
WMT,2026-04-11,-0.8948938678950071,negative,news,The Reason You Don't See McDonald's Inside Walmart Stores Anymore
WMT,2026-04-11,-0.012423710897564888,neutral,news,American Tower Corporation Trade Ideas — MIL:1AMT
WMT,2026-04-11,-0.22289004921913147,negative,news,These Florida grocery stores are cheaper than Walmart. Is Publix?
WMT,2026-04-11,-0.9460345599800348,negative,news,OFI Invest Asset Management Lowers Holdings in Walmart Inc. $WMT
WMT,2026-04-11,0.71091572009027,positive,news,Institutional Case for Sotera Health: Quality-Adjusted Valuation Reflects a 25% Projected Discount to Anticipated Cash Flow
WMT,2026-04-11,0.9315103329718113,positive,news,Walmart Inc. $WMT Shares Acquired by Jackson Square Capital LLC
WMT,2026-04-11,0.1386164091527462,neutral,news,Your next can of Coke might have Mount Rushmore on it
WMT,2026-04-11,0.9216506704688072,positive,news,"Cliftonlarsonallen Wealth Advisors LLC Purchases 10,074 Shares of Walmart Inc. $WMT"
WMT,2026-04-11,0.07329113595187664,neutral,news,Columbia Variable Portfolio - Balanced Fund's PepsiCo Inc(PEP) Holding History
WMT,2026-04-11,-0.29542189836502075,negative,news,Addenda Capital Inc. Has $9.50 Million Holdings in Walmart Inc. $WMT
WMT,2026-04-11,-0.01633254811167717,neutral,news,WMT Stock Chart | WALMART INC (NASDAQ:WMT)
WMT,2026-04-11,0.3907162044197321,neutral,news,"La Tiara taco shells return: Gladstone, General Mills celebrate factory reopening"
WMT,2026-04-11,0.8462273087352514,positive,news,Casey's General Stores Joins S&P 500 As Investor Base Evolves
WMT,2026-04-10,-0.9660020377486944,negative,news,"H-1B visa demand falls: Walmart, Amazon, JPMorgan Chase cut hiring"
WMT,2026-04-10,0.00577240064740181,neutral,news,WWW (Wolverine World Wide) EPS (Diluted) : $1.13 (TTM As of Dec. 2025)
WMT,2026-04-10,0.46650894079357386,neutral,news,Walmart Inc stock (US9311421039): Is everyday low pricing still the unbeatable edge for U.S. investo
WMT,2026-04-10,0.9169520437717438,positive,news,The Bull Case For Costco (COST) Could Change Following March’s Double-Digit Sales And E-Commerce Surge
WMT,2026-04-10,0.12283681891858578,neutral,news,Walmart Inc. stock (US9311421039): Is its everyday low price strategy still the real test amid U.S. retail shifts?
WMT,2026-04-10,0.9387227203696966,positive,news,Costco's Comparable Sales Stay Resilient Despite Calendar Headwind
WMT,2026-04-10,0.8670164495706558,positive,news,Walmart vs. Costco: Which Store Actually Has Better Prices?
WMT,2026-04-10,0.7296422244980931,positive,news,Kroger expands program to help shoppers save on groceries
WMT,2026-04-10,0.8156744567677379,positive,news,Sealed Air Corp. stock (US81211K1007): Is its packaging resilience strong enough for U.S. investor portfolios now?
WMT,2026-04-10,0.27943951543420553,neutral,news,Home Depot Ranks on NRF Top 50 Global Retailers List
WMT,2026-04-10,0.9110955484211445,positive,news,CVS Health Corp. stock (US1266501006): Is its pharmacy-retail model strong enough to unlock new upsi
WMT,2026-04-10,0.5527816768735647,positive,news,Clorox Co. stock (US1890541097): Is consumer staples stability strong enough for upside now?
WMT,2026-04-10,0.8935701949521899,positive,news,Amazon.com Inc. stock (US0231351067): Is AWS growth strong enough to unlock new upside?
WMT,2026-04-10,0.9059350080788136,positive,news,Costco Wholesale Corporation stock (US22160K1051): Is membership renewal strength now the real test
WMT,2026-04-10,0.0032272785902023315,neutral,news,Investors heavily search Walmart Inc. (WMT): Here is what you need to know
PNC,2026-04-13,0.7179987207055092,positive,news,Chemed secures $450 million revolving credit facility
PNC,2026-04-13,0.8402782091870904,positive,news,Chemed locks in a $450M credit line with room to add $250M
PNC,2026-04-13,0.82660977775231,positive,news,Chemed Corporation Announces a Five-Year $450 Million Amended and Restated Credit Agreement
PNC,2026-04-13,-0.6640584766864777,negative,news,"Sumitomo Mitsui Trust Group Inc. Trims Stock Position in The PNC Financial Services Group, Inc $PNC"
PNC,2026-04-13,0.12891198694705963,neutral,news,Ennis (EBF) Expected to Announce Quarterly Earnings on Monday
PNC,2026-04-13,-0.010537361726164818,neutral,news,PNC Financial Gears Up For Q1 Print; Here Are The Recent Forecast Changes From Wall Street's Most Accurat
PNC,2026-04-12,0.7439475581049919,positive,news,"The PNC Financial Services Group, Inc (NYSE:PNC) Announces $1.70 Quarterly Dividend"
PNC,2026-04-12,0.9260420817881823,positive,news,PNC Financial Announces $1.70 Quarterly Dividend
PNC,2026-04-12,-0.8894098866730928,negative,news,Cambiar Investors Reduces Stake in PNC Financial Services Group
PNC,2026-04-12,-0.9410604145377874,negative,news,"Cambiar Investors LLC Sells 5,827 Shares of The PNC Financial Services Group, Inc $PNC"
PNC,2026-04-12,0.9348464915528893,positive,news,Banco Bilbao Vizcaya Argentaria S.A. stock (ES0113211835): Is its U.S. expansion strong enough to un
PNC,2026-04-11,-0.39115166664123535,negative,news,S&T Bancorp Receives Average 'Hold' Rating from Analysts
PNC,2026-04-11,0.012701768428087234,neutral,news,Wall Street's insights into key metrics ahead of the PNC Financial Services Group (PNC) Q1 earnings
PNC,2026-04-11,-0.8003226295113564,negative,news,"Massachusetts Financial Services Co. MA Sells 73,129 Shares of The PNC Financial Services Group, Inc $PNC"
PNC,2026-04-11,-0.42279553413391113,negative,news,Riverview Bancorp Shares Cross 200-Day Average
PNC,2026-04-11,-0.8249010257422924,negative,news,Buska Wealth Management LLC Lowers Stake in Invesco QQQ $QQQ
PNC,2026-04-10,-0.0012247003614902496,neutral,news,Will Procter & Gamble (PG) beat quarterly earnings? Predi...
PNC,2026-04-10,0.9355072611942887,positive,news,OFI Invest Asset Management Boosts PNC Financial Holdings
PNC,2026-04-10,-0.055360227823257446,negative,news,"51,347 Shares in Rayonier Inc. $RYN Bought by Oak Thistle LLC"
PNC,2026-04-10,0.9337993636727333,positive,news,"OFI Invest Asset Management Raises Stock Holdings in The PNC Financial Services Group, Inc $PNC"
PNC,2026-04-10,0.9242137316614389,positive,news,BNC Wealth Management Boosts Stake in PNC Financial Services
PNC,2026-04-10,0.9117758516222239,positive,news,What Bank OZK (OZK)'s 63rd Straight Dividend Increase Means For Shareholders
PNC,2026-04-10,0.813045752234757,positive,news,"Tudor Investment Corp ET AL Buys Shares of 320,067 Pattern Group Inc. $PTRN"
PNC,2026-04-10,0.5786854270845652,positive,news,Univest Financial Corp stock: What you should know before investing now
PNC,2026-04-10,0.9309262745082378,positive,news,"113,099 Shares in Suzano S.A. Sponsored ADR $SUZ Purchased by Aberdeen Group plc"
PNC,2026-04-09,0.7442788816988468,positive,news,PNC Bank Saves with LOGAN and SBCubs | Cubs
PNC,2026-04-09,0.014879781752824783,neutral,news,"Net revenue of PNC Financial Services Group, Inc. (The) – NYSE:PNC"
PNC,2026-04-09,0.8805516827851534,positive,news,BlueLinx (NYSE: BXC) proxy details 750K-share incentive plan boost
PNC,2026-04-09,0.14852655120193958,neutral,news,Citizens hires PNC veteran to drive treasury growth in two regions
PNC,2026-04-09,0.9310270640999079,positive,news,PNC Financial Services Group Inc. stock outperforms competitors on strong trading day
PNC,2026-04-09,0.5270220693200827,positive,news,Regions Financial Corp stock: What investors should know now
PNC,2026-04-09,0.037329720333218575,neutral,news,PNC Lead Arranger for $600 Million Credit Facility for Phoenix Service Partners
PNC,2026-04-09,0.9263627594336867,positive,news,Texas gas-compression company secures up to $600M to expand
PNC,2026-04-09,0.9089781455695629,positive,news,Pure Cycle (NASDAQ:PCYO) Share Price Passes Above Two Hundred Day Moving Average - Should You Sell?
PNC,2026-04-09,0.8312560468912125,positive,news,"Mister Car Wash, Inc. (NYSE:MCW) Receives Consensus Recommendation of ""Hold"" from Analysts"
PNC,2026-04-09,0.9305557273328304,positive,news,"BIP Wealth LLC Invests $1.24 Million in The PNC Financial Services Group, Inc $PNC"
PNC,2026-04-09,-0.029324164614081383,neutral,news,"Net revenue after provisions of PNC Financial Services Group, Inc. (The) – NYSE:PNC"
PNC,2026-04-09,0.03915516659617424,neutral,news,"The PNC Financial Services Group, Inc (PNC) earnings expected to grow: What to know ahead of next week's release"
PNC,2026-04-09,0.8717708280310035,positive,news,KeyCorp Uses Financial Mobility Insights To Deepen Advisory Led Banking Relationships
PNC,2026-04-09,0.013772903010249138,neutral,news,Marex Group plc Ordinary Shares (MRX) Stock Trends and Sentiment 2026 $MRX
PNC,2026-04-08,0.9255571532994509,positive,news,Goldman Sachs Sees Opportunity in PNC After Recent Bank Selloff
PNC,2026-04-08,0.8717327453196049,positive,news,PNC Surpasses Community Benefits Plan Commitment With $119 Billion in Community Investments
PNC,2026-04-08,0.8930590711534023,positive,news,PNC Financial Services Group Inc. stock underperforms Wednesday when compared to competitors despite daily gains
PNC,2026-04-08,0.9236801527440548,positive,news,F.N.B. Corp stock: What investors need to know in 2026
PNC,2026-04-08,0.878296690993011,positive,news,"Jefferies Adjusts Price Target on PNC Financial Services to $255 From $250, Maintains Buy Rating"
PNC,2026-04-08,0.8756280951201916,positive,news,PNC Surpasses Community Benefits Plan Commitment With $119 Billion in Community Investments
PNC,2026-04-08,0.9289933796972036,positive,news,"The PNC Financial Services Group, Inc (PNC) Earnings Expected to Grow: What to Know Ahead of Next Week's Release"
PNC,2026-04-08,0.41814884543418884,positive,news,Assessing PNC Financial Services Group (PNC) Valuation After Recent Share Price Moves
PNC,2026-04-08,0.8302685879170895,positive,news,The PNC Financial Services Group (PNC) Expected to Announce Earnings on Wednesday
PNC,2026-04-08,-0.06688126921653748,neutral,news,"DFNL Stock News Today | Earnings, Events & Price Alerts"
CVS,2026-04-13,-0.9451712854206562,negative,news,Sumitomo Mitsui Trust Group Inc. Cuts Holdings in CVS Health Corporation $CVS
CVS,2026-04-13,0.928704054094851,positive,news,Johnson & Johnson stock (US4781601046): Is its pharma pivot strong enough to drive U.S. investor ret
CVS,2026-04-12,0.9193138377740979,positive,news,UnitedHealth Group Incorporated stock (US91324P1021): Is its integrated care model strong enough to unlock new upside?
CVS,2026-04-12,0.4793232399970293,positive,news,CVS Health Corporation (CVS): Legal Clarity and Core Strengths Support the Bull Case
CVS,2026-04-12,0.9259329065680504,positive,news,UnitedHealth Group Incorporated stock (US91324P1021): Is its integrated care model strong enough to unlock new upside?
CVS,2026-04-12,0.9401238355785608,positive,news,Robeco Institutional Asset Management B.V. Raises Position in CVS Health Corporation $CVS
CVS,2026-04-12,-0.9529827730730176,negative,news,Burney Co. Trims Stake in CVS Health
CVS,2026-04-12,0.05210542120039463,neutral,news,Carnegie Investment Counsel Purchases New Shares in CVS Health Corporation $CVS
