ticker,date,sentiment_score,sentiment_label,content_type,title
BA,2026-06-08,0.6041808845475316,positive,news,Celebrating 250 Years of American Innovation
BA,2026-06-08,-0.9181137345731258,negative,news,WINTON GROUP Ltd Reduces Stock Holdings in ExxonMobil Corporation $XOM
BA,2026-06-08,0.9314962262287736,positive,news,"FedEx, China Southern Airlines to explore cargo cooperation"
BA,2026-06-08,0.9297838043421507,positive,news,"FedEx, China Southern Airlines to explore cargo cooperation"
BA,2026-06-08,0.24411450326442719,neutral,news,"The Boeing Company stock (US0970231058): New CEO, cost cuts and certification steps keep investors on edge"
BA,2026-06-07,0.9384006718173623,positive,news,Why American Airlines' Longest-Ever Flight Needs Just 51 Business Class Suites To Pencil Out
BA,2026-06-07,0.929860726930201,positive,news,Boeing clears key 777X certification hurdle as FAA approves next flight tests (BA:NYSE)
BA,2026-06-07,0.021206682547926903,neutral,news,ProShares Ultra Industrials Holdings
BA,2026-06-07,0.9320430681109428,positive,news,16-Hour Flights: Delta Air Lines Launches Brand-New Ultra-Long Route [Map]
BA,2026-06-07,-0.9549367316067219,negative,news,Italy’s ITA Airways weighs lawsuit over Pratt & Whitney engine faults By Reuters
BA,2026-06-07,-0.9420000370591879,negative,news,"United CEO blasts Rolls-Royce over contract dispute, questions supplier commitment (UAL:NASDAQ)"
BA,2026-06-07,0.0661211721599102,neutral,news,Defense Spending Is Surging. MISL Bets on Tech. ITA Bets on Tradition.
BA,2026-06-07,0.13031848799437284,neutral,news,Defense Spending Is Surging. MISL Bets on Tech. ITA Bets on Tradition.
BA,2026-06-07,-0.9415962100028992,negative,news,"Strategic Wealth Investment Group LLC Sells 18,438 Shares of The Boeing Company $BA"
BA,2026-06-07,0.9368656612932682,positive,news,"ING Groep NV Buys 736,861 Shares of The Boeing Company $BA"
BA,2026-06-07,0.9367793928831816,positive,news,ING Groep NV Increases Stake in RTX Corporation $RTX
BA,2026-06-07,0.17015649564564228,neutral,news,Havemeyer Place LP Invests $4.32 Million in The Boeing Company $BA
BA,2026-06-07,-0.7448009923100471,negative,news,Havemeyer Place LP Takes Position in FTAI Aviation Ltd. $FTAI
BA,2026-06-07,0.874113354831934,positive,news,"Pinebridge Investments LLC Acquires Shares of 50,677 The Boeing Company $BA"
BA,2026-06-07,0.9285587444901466,positive,news,Ryanair Holdings PLC $RYAAY Shares Purchased by Capital World Investors
BA,2026-06-07,-0.40111252665519714,negative,news,"Fiduciary Management Inc. WI Sells 259,551 Shares of Ryanair Holdings PLC $RYAAY"
BA,2026-06-07,-0.3003537356853485,negative,news,Capital World Investors Has $6.54 Billion Stake in GE Aerospace $GE
BA,2026-06-07,-0.8878481090068817,negative,news,"Capital International Inc. CA Acquires 23,959 Shares of FTAI Aviation Ltd. $FTAI"
BA,2026-06-07,0.9296072944998741,positive,news,"BI Asset Management Fondsmaeglerselskab A S Buys 44,842 Shares of The Boeing Company $BA"
BA,2026-06-06,0.9324905667454004,positive,news,Riyadh Air receives first Boeing 787 Dreamliners ahead of service launch (BA:NYSE)
BA,2026-06-06,-0.7301150728017092,negative,news,Seagate Technology Holdings PLC Trade Ideas — XETR:847
BA,2026-06-06,0.8601150847971439,positive,news,American plans new long-haul market after Doha exit
BA,2026-06-06,0.9255165196955204,positive,news,"MCF Advisors LLC Buys 8,401 Shares of The Boeing Company $BA"
BA,2026-06-06,-0.8552371170371771,negative,news,"Jim Cramer Says “Right Now, Boeing Trades With the War”"
BA,2026-06-06,0.5349360881373286,positive,news,Historic: Delta Launches Its 1st Flight on New Transatlantic Route This Weekend [Map]
BA,2026-06-06,0.7677046358585358,positive,news,"WINTON GROUP Ltd Sells 5,994 Shares of The Boeing Company $BA"
BA,2026-06-06,-0.31751081347465515,negative,news,TD Asset Management Inc Has $71.63 Million Stake in The Boeing Company $BA
BA,2026-06-06,0.8985817208886147,positive,news,Boeing Employee tells why the company didn’t develop the 757 instead of the older 737
BA,2026-06-06,0.005082309246063232,neutral,news,TXT - Textron Inc Stock Price and Quote
BA,2026-06-06,0.8888390688225627,positive,news,Northrop Grumman Deepens Role In DARPA Rocket Motor Program Progress
BA,2026-06-06,0.911460917443037,positive,news,RTX (RTX) Valuation Check After Jefferies Upgrade And New SPY-6 Defense Contract
EMR,2026-06-08,0.8393089082092047,positive,news,Illinois Tool Works stock (US4523081093): Industrial earnings story with steady margins in focus
EMR,2026-06-08,0.838886029087007,positive,news,Emerson Electric Co. (EMR) Partners with SiMa.ai to Pursue $153.9 Billion Industrial AI Opportunities
EMR,2026-06-08,0.9350733533501625,positive,news,"ING Groep NV Buys Shares of 63,192 Emerson Electric Co. $EMR"
EMR,2026-06-08,-0.6483364254236221,negative,news,"Clearbridge Investments LLC Sells 309,325 Shares of Emerson Electric Co. $EMR"
EMR,2026-06-07,0.9194809775799513,positive,news,What Emerson Electric (EMR)'s Industrial AI and Corrosion Deals Mean For Shareholders
EMR,2026-06-07,0.8901087362319231,positive,news,WINTON GROUP Ltd Invests $6.10 Million in Emerson Electric Co. $EMR
EMR,2026-06-07,-0.9450283106416464,negative,news,"Fjarde AP Fonden Fourth Swedish National Pension Fund Sells 9,300 Shares of Emerson Electric Co. $EMR"
EMR,2026-06-07,-0.36685192584991455,negative,news,"TD Asset Management Inc Sells 11,090 Shares of Emerson Electric Co. $EMR"
EMR,2026-06-06,-0.9488371135666966,negative,news,"Cibc World Market Inc. Sells 100,326 Shares of Emerson Electric Co. $EMR"
EMR,2026-06-05,-0.9657568223774433,negative,news,Emerson Electric Co. stock underperforms Friday when compared to competitors
EMR,2026-06-05,0.026525288820266724,positive,news,Emerson's Intelligent Devices Segment Gains Momentum: Can It Sustain?
EMR,2026-06-05,0.9304209426045418,positive,news,Emerson Electric Co. (EMR) is Attracting Investor Attention: Here is What You Should Know
EMR,2026-06-05,0.9369893483817577,positive,news,Emerson Electric Co. $EMR Shares Acquired by CIBC Asset Management Inc
EMR,2026-06-04,0.9318292662501335,positive,news,RBC Capital raises Emerson stock price target on cost management
EMR,2026-06-04,0.9396855505183339,positive,news,Eaton Rallies 32% YTD: Should Investors Bet on the Stock Now?
EMR,2026-06-04,0.9362207222729921,positive,news,Eaton Rallies 32% YTD: Should Investors Bet on the Stock Now?
EMR,2026-06-04,0.9387365952134132,positive,news,Eaton Rallies 32% YTD: Should Investors Bet on the Stock Now?
EMR,2026-06-04,-0.9563194382935762,negative,news,Emerson Electric (EMR) Down 4.8% Since Last Earnings Report: Can It Rebound?
EMR,2026-06-04,-0.9562091119587421,negative,news,Emerson Electric (EMR) Down 4.8% Since Last Earnings Report: Can It Rebound?
EMR,2026-06-04,0.04944730922579765,neutral,news,Don't Ignore The Insider Selling In Emerson Electric
EMR,2026-06-04,0.5638471990823746,positive,news,Is Emerson Electric Stock Underperforming the S&P 500?
EMR,2026-06-04,0.8802261240780354,positive,news,Bank of New York Mellon Corp Increases Position in Emerson Electric Co. $EMR
EMR,2026-06-03,0.9380955267697573,positive,news,Dover Corp. stock (US25985P1030): shares edge higher after recent gains on NYSE
EMR,2026-06-03,0.9421148858964443,positive,news,AMETEK Inc. stock (US0311001004): NYSE shares edge higher on steady volume and institutional interest
EMR,2026-06-03,0.9318080060184002,positive,news,Emerson Electric Co. $EMR Shares Acquired by Westpac Banking Corp
EMR,2026-06-03,0.9386408310383558,positive,news,Marble Wealth LLC Buys New Position in Emerson Electric Co. $EMR
EMR,2026-06-03,0.8993330113589764,positive,news,Global Hyperscale Data Center Deal Might Change The Case For Investing In Generac Holdings (GNRC)
EMR,2026-06-02,0.935341889038682,positive,news,AMETEK Inc stock (US0311001004): Shares rise as NYSE volume stays solid after recent institutional buying
EMR,2026-06-02,0.03172709234058857,neutral,news,"Emerson Electric (NYSE: EMR) EVP-linked trust sells 11,500 shares"
EMR,2026-06-02,0.5596016421914101,positive,news,Assessing Emerson Electric (EMR) Valuation After New AI And Corrosion Management Partnerships
EMR,2026-06-02,0.9282730473205447,positive,news,Emerson Electric Co. $EMR Shares Acquired by MUFG Securities EMEA plc
EMR,2026-06-02,0.46402255445718765,positive,news,"Emerson Electric Insiders Sell US$2.6m Of Stock, Possibly Signalling Caution"
EMR,2026-06-02,0.1869361698627472,positive,news,"BNP Paribas Sells 51,057 Shares of Emerson Electric Co. $EMR"
EMR,2026-06-01,-0.9506900124251842,negative,news,Emerson Electric Co. stock underperforms Monday when compared to competitors
EMR,2026-06-01,-0.015074536204338074,neutral,news,[144] EMERSON ELECTRIC CO SEC Filing
EMR,2026-06-01,0.9168826900422573,positive,news,Emerson Electric Co. $EMR Stock Position Raised by Nomura Asset Management Co. Ltd.
EMR,2026-05-31,0.935033792629838,positive,news,Norges Bank Takes $1.05 Billion Position in Emerson Electric Co. $EMR
EMR,2026-05-31,0.9322708807885647,positive,news,Northwestern Mutual Wealth Management Co. Has $61.02 Million Stock Holdings in Emerson Electric Co. $EMR
EMR,2026-05-31,0.9270776491612196,positive,news,Intech Investment Management LLC Grows Position in Emerson Electric Co. $EMR
EMR,2026-05-31,0.9215006548911333,positive,news,Eurizon Capital SGR S.p.A. Takes $50.22 Million Position in Emerson Electric Co. $EMR
EMR,2026-05-30,-0.9584680749103427,negative,news,National Pension Service Decreases Holdings in Emerson Electric Co. $EMR
EMR,2026-05-29,0.9174560382962227,positive,news,Emerson Electric Co. stock underperforms Friday when compared to competitors despite daily gains
EMR,2026-05-29,0.8444515094161034,positive,news,"Geode Capital Management LLC Acquires 76,488 Shares of Emerson Electric Co. $EMR"
EMR,2026-05-28,-0.8615189641714096,negative,news,ITW Fell 7% in the Last 30 Days. Here’s What Could Drive the Stock in 2026
EMR,2026-05-28,-0.8998519740998745,negative,news,Emerson Electric Co. stock outperforms competitors on strong trading day
EMR,2026-05-28,0.9364049676805735,positive,news,Nordson Corporation stock (US6556631025): Q2 beat and higher target keep focus on Nasdaq listing
EMR,2026-05-28,0.3142864862456918,neutral,news,Huntington National Bank Has $122.33 Million Stock Position in Emerson Electric Co. $EMR
EMR,2026-05-28,0.9337016064673662,positive,news,Emerson Electric Co. $EMR Shares Purchased by Foundations Investment Advisors LLC
EMR,2026-05-27,0.8598255841061473,positive,news,Emerson Electric To Co-Develop Corrosion Monitoring Systems With Saudi's Aramco
EMR,2026-05-27,-0.7225401103496552,negative,news,"King Luther Capital Management Corp Sells 21,195 Shares of Emerson Electric Co. $EMR"
VLO,2026-06-08,0.6883278340101242,positive,news,Valero Energy Corp. stock underperforms Monday when compared to competitors despite daily gains
VLO,2026-06-08,-0.7539616674184799,negative,news,"WINTON GROUP Ltd Sells 126,010 Shares of Halliburton Company $HAL"
VLO,2026-06-08,0.9370195139199495,positive,news,Franklin Resources Inc. Increases Stake in Valero Energy Corporation $VLO
VLO,2026-06-08,0.928985713981092,positive,news,Hilton Head Capital Partners LLC Takes Position in Chevron Corporation $CVX
VLO,2026-06-08,0.9276113845407963,positive,news,Should Vanguard Mid-Cap Value Index Fund ETF Shares (VOE) Be on Your Investing Radar?
VLO,2026-06-08,0.8839780990965664,positive,news,Should Vanguard Mid-Cap Value Index Fund ETF Shares (VOE) Be on Your Investing Radar?
VLO,2026-06-08,0.5408626571297646,positive,news,Goldman Sachs Group Inc. Boosts Stake in PBF Energy Inc. $PBF
VLO,2026-06-08,-0.9455802030861378,negative,news,Chevron Corporation $CVX Shares Sold by Franklin Resources Inc.
VLO,2026-06-08,0.938132781535387,positive,news,Prudential PLC Grows Position in Valero Energy Corporation $VLO
VLO,2026-06-08,0.7233974728733301,positive,news,Best Growth Stocks to Buy for June 8th
VLO,2026-06-07,0.7745374888181686,positive,news,A Look At Valero Energy (VLO) Valuation As Strong Earnings Hopes Clash With Insider Selling Concerns
VLO,2026-06-07,-0.0027312971651554108,neutral,news,"BP plc - ADR (BP) News, Articles, Events & Latest Updates"
VLO,2026-06-05,0.9343776181340218,positive,news,SKYQ Stock Is Up Nearly 400% In April – Can It Sustain The Rally?
VLO,2026-06-05,-0.6789842844009399,negative,news,China's Inventory Build Could be Over
VLO,2026-06-05,0.8442069767042994,positive,news,"E Financials: Revenue Breakdown, Margins & Competitor Comparison"
VLO,2026-06-05,-0.9416307546198368,negative,news,"U.S. oil exports surge, draining domestic crude inventories toward rock bottom"
VLO,2026-06-05,0.8300445899367332,positive,news,Marathon Petroleum and DAQO New Energy have been highlighted as Zacks Bull and Bear of the Day
VLO,2026-06-05,0.7285457029938698,positive,news,Marathon Petroleum and DAQO New Energy have been highlighted as Zacks Bull and Bear of the Day
VLO,2026-06-05,-0.28620412945747375,negative,news,Marathon Petroleum and DAQO New Energy have been highlighted as Zacks Bull and Bear of the Day
VLO,2026-06-05,0.9361463040113449,positive,news,Cibc World Market Inc. Has $34.78 Million Position in Marathon Petroleum Corporation $MPC
VLO,2026-06-04,0.9342685360461473,positive,news,"Valero Energy Corporation (VLO) Hit a 52 Week High, Can the Run Continue?"
VLO,2026-06-04,0.1860124384984374,neutral,news,Best Growth Stocks to Buy for June 4th
VLO,2026-06-04,-0.924527034163475,negative,news,"Bank of New York Mellon Corp Sells 133,772 Shares of Valero Energy Corporation $VLO"
VLO,2026-06-03,0.8731567673385143,positive,news,Valero Energy Corp. stock underperforms Wednesday when compared to competitors despite daily gains
VLO,2026-06-03,0.8154830699786544,positive,news,Nevada’s Only Refinery Unveils Plan for Sustainable Jet Fuel Production
VLO,2026-06-02,0.9063017088919878,positive,news,Valero Energy Corp stock (US91913Y1001): Q2 2026 earnings date set as shares hover near 52-week high
VLO,2026-06-02,0.034227630123496056,neutral,news,Valero schedules July 30 call for Q2 2026 results discussion
VLO,2026-06-02,0.02271306049078703,neutral,news,"Valero Energy Corporation to Announce Second Quarter 2026 Earnings Results on July 30, 2026"
VLO,2026-06-02,0.1260838257148862,neutral,news,Eric Mullins Joins TechnipFMC Board As Capital And Risk Focus Grow
VLO,2026-06-02,0.9143295595422387,positive,news,"Zacks Investment Ideas feature highlights: XLE, Valero, Marathon and Phillips 66"
VLO,2026-06-02,-0.9532639654353261,negative,news,Goldman Sachs expects elevated refined fuel margins through 2026 on Hormuz disruption
VLO,2026-06-01,0.92040591314435,positive,news,Valero Energy Corp stock (US91913Y1001): Shares trade near 52-week high after fresh analyst updates
VLO,2026-06-01,0.4568011462688446,positive,news,Valero Energy Corp. stock outperforms competitors on strong trading day
VLO,2026-06-01,0.47415601275861263,neutral,news,TechnipFMC Appoints Eric D. Mullins to its Board of Directors
VLO,2026-05-31,0.5060263425111771,positive,news,Valero Energy Corp stock (US91913Y1001): shares little changed as investors await fresh catalysts
VLO,2026-05-31,-0.5354587435722351,negative,news,Savant Capital LLC Lowers Holdings in Marathon Petroleum Corporation $MPC
VLO,2026-05-30,0.929998068138957,positive,news,What Just Happened to SCHD's Portfolio
VLO,2026-05-29,0.8517380403354764,positive,news,"180 Million Barrels Of Oil Sands, A 5,000 BPD Permitted Nevada Refinery, And A New Multi-Party SAF Collaboration Just Stacked Onto The U.S. Domestic Refining Capacity Conversation"
VLO,2026-05-29,0.9353611432015896,positive,news,Valero Energy Corp stock (US91913Y1001): shares edge higher after dividend update while valuation stays in focus
VLO,2026-05-29,0.927437137812376,positive,news,Phillips 66 Rose 7% Over the Last 30 Days. Here’s What Could Drive the Stock in 2026
VLO,2026-05-29,0.8908518627285957,positive,news,"PN Bakken: MDU, Calumet team up on 20,000 b/d refinery"
VLO,2026-05-29,0.9064531773328781,positive,news,"6,380 Shares in Valero Energy Corporation $VLO Acquired by Integrity Alliance LLC."
VLO,2026-05-29,0.7434663670137525,positive,news,"180 Million Barrels Of Oil Sands, A 5,000 BPD Permitted Nevada Refinery, And A New Multi-Party SAF Collaboration Just Stacked Onto The U.S. Domestic Refining Capacity Conversation"
VLO,2026-05-28,0.9222066048532724,positive,news,Valero Energy Corp. stock outperforms competitors on strong trading day
VLO,2026-05-28,0.9110533343628049,positive,news,"Allstate Corp Buys 12,982 Shares of Valero Energy Corporation $VLO"
VLO,2026-05-27,0.13340091053396463,neutral,news,"Quanta Services (NYSE: PWR) adds $1B buyback, dividend and new director"
VLO,2026-05-27,-0.7122798785567284,negative,news,FEATURE | Jones Act waivers have had little effect in lowering US fuel prices
VLO,2026-05-26,0.7063905764371157,positive,news,"John Dorfman: BNYM, Valero stand out for buybacks"
VLO,2026-05-26,0.9248403310775757,positive,news,"TAL Stock Price, Quote & Chart | TAL EDUCATION GROUP- ADR (NYSE:TAL)"
VLO,2026-05-26,0.9004318937659264,positive,news,GPRE - Analysts Revise Green Plains Price Target Amid Mixed Sentiment and Industry Developments
TMUS,2026-06-09,0.8465201412327588,positive,news,T-Mobile expands tech development hub in India
TMUS,2026-06-08,0.5601138295605779,positive,news,AT&T plans $45B+ for investors as CFO outlines 2026 strategy
TMUS,2026-06-08,-0.05704961717128754,neutral,news,"AT&T, T-Mobile and Verizon join cable's 'STRIKE' force against network vandalism"
TMUS,2026-06-08,-0.7867332324385643,negative,news,"Verizon, AT&T, and T-Mobile were selling your location data, and they can finally be punished for it"
TMUS,2026-06-07,0.2357371747493744,positive,news,"AT&T, Verizon, and T-Mobile all sold your location data and the Supreme Court just ruled"
TMUS,2026-06-07,0.9336910434067249,positive,news,"Los Angeles Capital Management LLC Buys 72,922 Shares of T-Mobile US, Inc. $TMUS"
TMUS,2026-06-07,-0.9625736884772778,negative,news,T-Mobile customers are still screaming at the carrier to abandon its T-Life plans
TMUS,2026-06-07,0.9360662065446377,positive,news,"Capital International Investors Boosts Holdings in T-Mobile US, Inc. $TMUS"
TMUS,2026-06-07,-0.45774151384830475,negative,news,"Dearborn Partners LLC Has $24 Million Stake in T-Mobile US, Inc. $TMUS"
TMUS,2026-06-07,0.7388925421983004,positive,news,"T-Mobile's record-breaking subsidy for the Razr Fold makes ""On Us"" deal for foldable iPhone likely"
TMUS,2026-06-06,0.10313224792480469,positive,news,"Vestcor Inc Sells 9,477 Shares of T-Mobile US, Inc. $TMUS"
TMUS,2026-06-06,-0.8529926016926765,negative,news,"BI Asset Management Fondsmaeglerselskab A S Reduces Stake in T-Mobile US, Inc. $TMUS"
TMUS,2026-06-06,0.6359089314937592,positive,news,T-Mobile Makes a Big Change to Its 5G Home Internet Service
TMUS,2026-06-06,0.11917826533317566,neutral,news,T-Mobile Puts a Clear Speed Limit on Its Rely Home Internet Option
TMUS,2026-06-05,-0.034685730934143066,negative,news,T-Mobile's most affordable 5G home internet plan just got worse
TMUS,2026-06-05,0.7956301495432854,positive,news,Can AT&T's Extended Tie-Ups for Connected Car Accelerate Growth?
TMUS,2026-06-05,0.4911447996273637,positive,news,"T-Mobile US launches Dynamic CX, using AI to prepare networks for the World Cup and ‘mass gatherings’"
TMUS,2026-06-05,-0.5464439652860165,negative,news,Mike Sievert Joins Alaska Air Board As Telecom Focus Meets Undervalued Shares
TMUS,2026-06-05,0.9241233495995402,positive,news,T-Mobile US Opens New India Tech Center
TMUS,2026-06-05,0.9341765772551298,positive,news,"T-Mobile US, Inc. $TMUS Shares Purchased by Cibc World Market Inc."
TMUS,2026-06-05,0.9303423827514052,positive,news,"Oppenheimer Upgrades AT&T Inc. (T), Here’s Why"
TMUS,2026-06-04,0.4330699574202299,neutral,news,Delta Air Lines Adds Free Inflight Drinks As Permanent Perk For T-Mobile Members
TMUS,2026-06-04,-0.9646965460851789,negative,news,T-Mobile US Inc Stock (TMUS) Moved Down by 3.09% on Jun 4: What Signal Does It Send?
TMUS,2026-06-04,0.9239600915461779,positive,news,Verizon Communications (VZ) Announced Results for Annual 2026 Shareholder Meeting
TMUS,2026-06-04,0.9280180986970663,positive,news,JPMorgan Maintains Overweight Rating on Array Digital Infrastructure (AD)
TMUS,2026-06-04,-0.9418108928948641,negative,news,T-Mobile US Inc. stock outperforms competitors despite losses on the day
TMUS,2026-06-04,0.16690783388912678,neutral,news,"Goldman Sachs, Johnson & Johnson, MetLife Named Among Newsweek’s World’s Greenest Companies 2026"
TMUS,2026-06-04,0.411195058375597,neutral,news,How Investors Are Reacting To T-Mobile US (TMUS) Using USGA Golf Events To Showcase 5G Network Slicing
TMUS,2026-06-04,0.4485603189095855,neutral,news,"T-Mobile Introduces Dynamic CX, AI-Powered Technology Designed to Help Keep Customers Connected During Summer’s Biggest Live Events"
TMUS,2026-06-04,0.40726387966424227,neutral,news,Former T-Mobile CEO Joins Alaska Board
TMUS,2026-06-04,0.2567844446748495,neutral,news,T-Mobile uses AI to spot huge crowds and steady phone service
TMUS,2026-06-04,0.9050112664699554,positive,news,JPMorgan Maintains Overweight Rating on Array Digital Infrastructure (AD)
TMUS,2026-06-04,-0.9525596434250474,negative,news,"After Almost 15,000 Miles, How Efficient Is the 2025 Toyota 4Runner Hybrid TRD Off-Road Premium?"
TMUS,2026-06-04,0.024062948301434517,neutral,news,"T-Mobile US, Inc. Shs Sponsored Canadian Depository Receipt Hedged Reg S Trade Ideas — FWB:TM50"
TMUS,2026-06-04,-0.9410280399024487,negative,news,"T-Mobile US, Inc. $TMUS Shares Sold by TD Asset Management Inc"
TMUS,2026-06-04,0.8334503509104252,positive,news,Alaska Air Group adds former T-Mobile CEO Sievert to Board
TMUS,2026-06-04,0.9143783235922456,positive,news,"According to a statement from the state government, T-Mobile US Inc (TMUS) is planning a major expansion of its operations center in Hyderabad, India."
TMUS,2026-06-04,0.9080734802410007,positive,news,T-Mobile invests in two partnerships to expand US internet access
TMUS,2026-06-04,0.917517863214016,positive,news,"T-Mobile US, Inc. (NASDAQ:TMUS) Receives Average Rating of ""Moderate Buy"" from Analysts"
TMUS,2026-06-04,0.5137699991464615,positive,news,Delta Air Lines Surprises Passengers With Free Beverage Perk After Cutting In-Flight Service On Hundreds Of Flights
TMUS,2026-06-04,-0.9529060320928693,negative,news,Bold new T-Mobile bet has customers grimacing
TMUS,2026-06-04,0.04513482376933098,neutral,news,"T-Mobile US, Inc. Shs Sponsored Canadian Depository Receipt Hedged Reg S Revenue Breakdown – FWB:TM50"
TMUS,2026-06-03,-0.9063561614602804,negative,news,Contractor evidence and Verizon internal communications make the case that the FCC can no longer ignore
TMUS,2026-06-03,0.8798111034557223,positive,news,Telecom executive Mike Sievert joins Alaska Air Group board of directors
TMUS,2026-06-03,-0.01343235932290554,neutral,news,"Taxes of T-Mobile US, Inc. Shs Sponsored Canadian Depository Receipt Hedged Reg S – FWB:TM50"
TMUS,2026-06-03,-0.9675147621892393,negative,news,T-Mobile US Inc Stock (TMUS) Moved Down by 3.36% on Jun 3: Drivers Behind the Movement
TMUS,2026-06-03,-0.9686024920083582,negative,news,T-Mobile US Inc. stock underperforms Wednesday when compared to competitors
TMUS,2026-06-03,0.6645982218906283,positive,news,"Alaska Air Group announces Mike Sievert, the telecom executive behind T-Mobile's disruptive growth and innovation, will join board of directors"
TMUS,2026-06-03,-0.9635336641222239,negative,news,T-Mobile (TMUS) slides 3.8% as investors parse conference update; clear single catalyst not evident
TMUS,2026-06-03,-0.8968958556652069,negative,news,AT&T most at risk as consumers migrate towards satellite -- Oppenheimer (T:NYSE)
EL,2026-06-06,0.11321283038705587,neutral,news,Wynn Resorts CEO Craig Billings among US business leaders to have met with Chinese Foreign Minister Wang Yi
EL,2026-06-06,0.22172911651432514,neutral,news,Wynn Resorts CEO Craig Billings among US business leaders to meet with Chinese Foreign Minister Wang Yi
EL,2026-06-06,0.20774756371974945,neutral,news,Procter & Gamble Stock Capital Return Hits $83 Bil
EL,2026-06-05,-0.12092773243784904,neutral,news,"Did The Estee Lauder Companies, Inc. Insiders Breach their Fiduciary Duties to Shareholders?"
EL,2026-06-04,0.2543277833610773,neutral,news,US soccer captain Tim Ream shares his childhood bedwetting story
EL,2026-06-03,0.346158679574728,neutral,news,Estée Lauder (NYSE: EL) details $1.551B in approved restructuring charges
EL,2026-06-03,0.3343263156712055,neutral,news,Top Wide-Moat Stocks to Buy for Steady Long-Term Returns
EL,2026-06-03,-0.8802351988852024,negative,news,Assessing Olaplex Holdings (OLPX) Valuation After A Year Of Mixed Returns And Earnings Pressure
EL,2026-06-02,0.9366311803460121,positive,news,"Ulta delivers beauty-fueled beat with top- and bottom-line beat, raises FY26 profit outlook (ULTA:NASDAQ)"
EL,2026-06-02,0.9132780153304338,positive,news,Wall Street Analysts Are Bullish on Top Healthcare Picks
EL,2026-06-01,-0.956524571403861,negative,news,Jim Cramer Discusses the Analyst Price Target Cut for Ulta Beauty
EL,2026-05-30,-0.00795774906873703,neutral,news,EYE - National Vision Holdings Inc Stock Price and Quote
EL,2026-05-30,-0.012399185448884964,neutral,news,How Will Ulta Beauty Stock React To Its Upcoming Earnings?
EL,2026-05-28,0.005789846181869507,neutral,news,Aerin Lauder (NYSE: EL) details 7.2% stake and $120M credit line
EL,2026-05-28,0.09162088111042976,neutral,news,What Does Global Oil Shock Modeling Show Stock Traders?
EL,2026-05-28,0.776196526363492,positive,news,$270m investment in Connecticut Global Innovation Centre
EL,2026-05-27,0.9357270188629627,positive,news,Innventure (INV) Q4 2025 Earnings Transcript
EL,2026-05-27,0.12367904186248779,positive,news,Procter & Gamble Co Stock (PG) Moved Up by 3.39% on May 27: What Signal Does It Send?
