ticker,date,sentiment_score,sentiment_label,content_type,title
CVS,2026-04-11,-0.894098561257124,negative,news,Trump Administration Walks Back Key Claims in New York Health Fraud Case: Report
CVS,2026-04-11,0.9354607742279768,positive,news,CVS Health Tops Daily Volume Chart as Medicare Boost and Institutional Buying Surge Past $540 Million
CVS,2026-04-11,-0.7046116143465042,negative,news,Coerente Capital Management Trims Stock Position in CVS Health Corporation $CVS
CVS,2026-04-11,-0.7982428446412086,negative,news,CVS Health Corporation $CVS Shares Sold by Factory Mutual Insurance Co.
CVS,2026-04-11,0.9256452731788158,positive,news,CVS Health Corp. Stock Hits Day High with Strong 6.74% Surge
CVS,2026-04-11,0.9374752007424831,positive,news,CVS Health Tops Daily Volume Chart as Medicare Boost and Institutional Buying Surge Past $540 Million
CVS,2026-04-10,0.7231273213401437,positive,news,CVS Health Corp. stock (US1266501006): Is its pharmacy-retail model strong enough to unlock new upside?
CVS,2026-04-10,0.9309834763407707,positive,news,UnitedHealth Stock Edges Higher After Medicare Advantage Payment Update
CVS,2026-04-10,-0.9493111604824662,negative,news,FOCUS-Patients scramble to find estrogen patches as shortage worsens after US FDA champions use
CVS,2026-04-10,0.7854078691452742,positive,news,2 Recession Resistant Dividend Stocks to Buy Now While They're Still Cheap
CVS,2026-04-10,0.3211810290813446,positive,news,Douglas Lane & Associates LLC Cuts Holdings in CVS Health Corporation $CVS
CVS,2026-04-10,0.7847934365272522,positive,news,Flagship Capital Management Inc. Invests $2.16 Million in CVS Health Corporation $CVS
CVS,2026-04-10,0.7983508985489607,positive,news,Jim Cramer Says “CVS Is Real”
CVS,2026-04-09,0.6879051849246025,positive,news,Baxter Launches Pilot Program for Therapy Animals in Healthcare Settings
CVS,2026-04-09,-0.9434327580966055,negative,news,"AVAH Stock Price, Quote & Chart | AVEANNA HEALTHCARE HOLDINGS (NASDAQ:AVAH)"
CVS,2026-04-09,-0.5765468776226044,negative,news,"CVS Health, US Seek Tax-Refund Suit Stay Pending Deal Approval"
CVS,2026-04-09,-0.6569536551833153,negative,news,"CVS Health, US Seek Tax-Refund Suit Stay Pending Deal Approval"
CVS,2026-04-09,0.9191527152433991,positive,news,Sonoma Pharmaceuticals enters manufacturing agreement with Kenvue Brands By Investing.com
CVS,2026-04-09,0.49706811644136906,positive,news,Aetna Better Health® of Virginia opens new community resource center in Roanoke
CVS,2026-04-08,0.911620763130486,positive,news,Providers say paperwork is health care's top problem in Aetna survey
CVS,2026-04-08,0.4392775595188141,positive,news,Insulet (NasdaqGS:PODD) Stock Price
CVS,2026-04-08,-0.31937867403030396,negative,news,CVS Health Corporation $CVS Shares Sold by Yousif Capital Management LLC
CVS,2026-04-08,0.8964131744578481,positive,news,Mail Order Pharmacy Market to Get an Explosive Growth | CVS Health
CVS,2026-04-08,0.8862884985283017,positive,news,Aetna Provider Survey Reveals Optimism and Opportunities to Simplify Health Care
CVS,2026-04-08,0.9222767483443022,positive,news,Aetna Provider Survey Reveals Optimism and Opportunities to Simplify Health Care
CVS,2026-04-08,0.07298839092254639,neutral,news,"Goldman Sachs Adjusts Price Target on Colgate-Palmolive to $98 From $100, Maintains Buy Rating"
CVS,2026-04-08,0.931612391024828,positive,news,Elevance Health Stock Soars After 2.48% Medicare Rate Increase
CVS,2026-04-08,0.9318948946893215,positive,news,CVS Stock Rises After CMS Medicare Advantage Update
CVS,2026-04-07,0.9311255346983671,positive,news,"Humana, CVS Climb After Medicare Finalizes 2.48% Rate Hike (1)"
CVS,2026-04-07,0.4194119991734624,neutral,news,"UNIFI®, Makers of REPREVE®, Celebrates Recycled and Circular Innovation with Ninth Annual REPREVE® Champions of Sustainability Awards"
CVS,2026-04-07,0.9165543541312218,positive,news,"UnitedHealth Rockets 11%, Humana Climbs 9% as Medicare Advantage Rate Decision Crushes Regulatory Fears"
CVS,2026-04-07,0.9331278782337904,positive,news,Humana Stock Pops 11% As CMS Finalizes 2027 Medicare Advantage Rates
CVS,2026-04-07,0.9280215743929148,positive,news,"Alignment Healthcare, Centene, CVS Health, Elevance Health, and Clover Health Stocks Trade Up, What You Need To Know"
CVS,2026-04-07,0.9239017385989428,positive,news,"Alignment Healthcare, Centene, CVS Health, Elevance Health, and Clover Health Stocks Trade Up, What You Need To Know"
CVS,2026-04-07,0.9281488843262196,positive,news,Alignment Healthcare Stock Rockets 18% as Medicare Advantage Growth Momentum Ignites Investor Rally
CVS,2026-04-07,0.9309538751840591,positive,news,CVS Health Stock Surges 7% on Positive Medicare Outlook as Turnaround Gains Momentum
CVS,2026-04-07,0.9303349871188402,positive,news,Alignment Healthcare Jumps More Than 16% During the Day – What’s Driving This Rally?
CVS,2026-04-07,0.9312897399067879,positive,news,United Health Group – The Medicaid decision supports the price
CVS,2026-04-07,0.9359927661716938,positive,news,"UnitedHealth, Humana, CVS Jump As CMS Boosts Medicare Payments"
COP,2026-04-13,0.9055060837417841,positive,news,The Permian Juggernaut: A Comprehensive Research Feature on Diamondback Energy (FANG)
COP,2026-04-13,0.8953418545424938,positive,news,"Bernstein Adjusts Price Target on ConocoPhillips to $121 From $98, Maintains Outperform Rating"
COP,2026-04-13,-0.9530015829950571,negative,news,Morgan Stanley maintains oil price forecasts and predicts slow recovery in supply
COP,2026-04-13,0.9178702188655734,positive,news,UK oil giants BP tap into Africa’s next major oil hotspot with new exploration licenses
COP,2026-04-13,-0.9145369455218315,negative,news,Sumitomo Mitsui Trust Group Inc. Lowers Stake in ConocoPhillips $COP
COP,2026-04-13,0.8760155914351344,positive,news,The Permian Juggernaut: A Comprehensive Research Feature on Diamondback Energy (FANG)
COP,2026-04-13,0.8054090314544737,positive,news,Chevron confirms oil discovery at Bandit prospect in Gulf of America
COP,2026-04-12,0.9238088093698025,positive,news,"Oil Surges 7% on Hormuz Blockade, U.S. Gulf Tanker Rush — 3 Stocks to Buy Now"
COP,2026-04-12,-0.9459082596004009,negative,news,Talos Energy (TALO) Is Down 7.2% After Iran Ceasefire Pressures Oil Prices Has The Bull Case Changed?
COP,2026-04-11,-0.9289970528334379,negative,news,True North Advisors Cuts Stake in ConocoPhillips
COP,2026-04-11,-0.9577604262158275,negative,news,Garrison Bradford & Associates Inc. Trims Quanta Services Stake
COP,2026-04-11,-0.9555619768798351,negative,news,RFG Bristol Wealth Advisors Reduces Stake in Waste Management
COP,2026-04-11,0.9369455222040415,positive,news,Wells Fargo Raises Magnolia Oil & Gas Price Target to $32
COP,2026-04-11,0.5190317593514919,positive,news,A self-proclaimed “Permian nerd” looks ahead at ConocoPhillips
COP,2026-04-11,-0.9628532715141773,negative,news,Cantor Fitzgerald Trims Holdings in ConocoPhillips
COP,2026-04-11,-0.9411457236856222,negative,news,"True North Advisors LLC Sells 12,061 Shares of ConocoPhillips $COP"
COP,2026-04-11,0.9349690424278378,positive,news,Coerente Capital Management Boosts EOG Resources Stake
COP,2026-04-11,-0.915290255099535,negative,news,Massachusetts Financial Services Co. MA Trims Stock Position in ConocoPhillips $COP
COP,2026-04-11,-0.9601069297641516,negative,news,Cantor Fitzgerald Investment Advisors L.P. Trims Holdings in ConocoPhillips $COP
COP,2026-04-11,0.24932381603866816,neutral,news,ConocoPhillips Weighs Venezuela Return And Portfolio Risks For Investors
COP,2026-04-11,-0.7204073965549469,negative,news,"ConocoPhillips (NYSE:COP) Receives Consensus Recommendation of ""Moderate Buy"" from Brokerages"
COP,2026-04-11,-0.9625998120754957,negative,news,Kosmos Energy Stock Plummets After Downgrade and Public Offering - News and Statistics
COP,2026-04-10,0.8501796312630177,positive,news,ConocoPhillips Evaluates Venezuela Drilling Return in 2026 - News and Statistics
COP,2026-04-10,-0.9382134322077036,negative,news,Texas Pacific Land Shares Plummet Amid Board Member’s Passing
COP,2026-04-10,0.9397257659584284,positive,news,Is Magnolia Oil & Gas Corp (MGY) Stock Performing Better Than Other Oils-Energy Companies This Year?
COP,2026-04-10,0.6582308690994978,positive,news,ConocoPhillips Assessing Oil Opportunities in Venezuela
COP,2026-04-10,0.8432359844446182,positive,news,"Is It a Good Time to Invest in Devon Energy Corporation (DVN), One of the Most Popular Stocks?"
COP,2026-04-10,0.9014383275061846,positive,news,Is ConocoPhillips Positioned to Capitalize on Rising LNG Demand?
COP,2026-04-10,0.8982139620929956,positive,news,BMO Capital Remains a Buy on Phillips 66 (PSX)
COP,2026-04-10,0.717350859194994,positive,news,BMO Capital Remains a Buy on Phillips 66 (PSX)
COP,2026-04-10,0.9351897053420544,positive,news,Is ConocoPhillips Positioned to Capitalize on Rising LNG Demand?
COP,2026-04-10,-0.9111007042229176,negative,news,Barclays Sticks to Their Buy Rating for Schlumberger (SLB)
COP,2026-04-10,0.12343896925449371,neutral,news,ConocoPhillips visits Venezuela to evaluate oil opportunities
COP,2026-04-10,-0.4253918081521988,negative,news,Ceasefire Reframes ConocoPhillips Qatar LNG Disruption And Valuation Upside
COP,2026-04-10,-0.04536145552992821,neutral,news,ConocoPhillips sends team to Venezuela to evaluate oil prospects
COP,2026-04-10,0.9365797154605389,positive,news,Oil Staying Above $90: A Growth Catalyst for EOG Resources?
COP,2026-04-10,-0.8517025485634804,negative,news,A Look At Woodside Energy Group’s Valuation After Oil Price Pullback On Easing Supply Fears
COP,2026-04-09,0.9216808155179024,positive,news,EOG Resources raises Q1 2026 tax expense outlook on higher oil prices
COP,2026-04-09,0.06281879357993603,neutral,news,ConocoPhillips sends team to Venezuela to evaluate oil prospects - Bloomberg news
COP,2026-04-09,-0.06004556268453598,neutral,news,ConocoPhillips Sends Team To Venezuela To Evaluate Oil Prospects - Bloomberg News
COP,2026-04-09,0.564100724644959,positive,news,ConocoPhillips Sends Team to Venezuela to Evaluate Oil Prospects
COP,2026-04-09,-0.24100838601589203,neutral,news,Iran war fuels rush to energy ETFs. Climate investors see no reason to chase returns.
COP,2026-04-09,0.5612514270469546,positive,news,ConocoPhillips goes to Venezuela to evaluate oil opportunities (COP:NYSE)
COP,2026-04-09,0.8993877423927188,positive,news,Entergy Texas breaks ground on Legend and Lone Star power stations
COP,2026-04-09,-0.8765310384333134,negative,news,Is It Too Late To Consider Canadian Natural Resources (TSX:CNQ) After Its 71% One-Year Rally?
COP,2026-04-09,-0.7948997914791107,negative,news,"Oil Prices Could Surge Even if Hormuz Reopens, Warns Morgan Stanley"
COP,2026-04-09,0.6393079534173012,positive,news,"MVO Stock Price, Quote & Chart | MV OIL TRUST (NYSE:MVO)"
COP,2026-04-09,0.9303086576983333,positive,news,Is ConocoPhillips Positioned to Benefit From Elevated Oil Prices?
COP,2026-04-09,0.9446568256244063,positive,news,Is ConocoPhillips Positioned to Benefit From Elevated Oil Prices?
COP,2026-04-09,0.9241856671869755,positive,news,Oil Staying Above $90: A Growth Catalyst for EOG Resources?
CHTR,2026-04-11,0.8253727983683348,positive,news,8-Day Rally Sends Canadian Imperial Bank of Commerce Stock Up 12%
CHTR,2026-04-11,0.9329493809491396,positive,news,Liberty Broadband Stock Rises Above 50-Day Moving Average
CHTR,2026-04-11,-0.9659214913845062,negative,news,"JPMorgan Chase & Co. Sells 99,910 Shares of Liberty Broadband Corporation $LBRDA"
CHTR,2026-04-11,0.9309492502361536,positive,news,"Toronto-Dominion Bank Stock Surges 11%, With A 9-Day Winning Spree"
CHTR,2026-04-11,-0.9443483185023069,negative,news,Liberty Broadband (NASDAQ:LBRDK) Stock Price Passes Above Fifty Day Moving Average - Here's Why
CHTR,2026-04-11,0.903326041996479,positive,news,Palo Alto Networks Stock at Support Zone – Bargain or Trap?
CHTR,2026-04-11,0.8231134628877044,positive,news,6-Day Rally Sends Astera Labs Stock Up 40%
CHTR,2026-04-11,-0.43927209079265594,negative,news,"Microchip Technology Stock Surges 19%, With A 8-Day Winning Spree"
CHTR,2026-04-11,0.8279171707108617,positive,news,8-Day Rally Sends Canadian Imperial Bank of Commerce Stock Up 12%
CHTR,2026-04-10,0.8680692128837109,positive,news,7-Day Rally Sends Microchip Technology Stock Up 19%
CHTR,2026-04-10,0.9267450366169214,positive,news,Fox Corp. (Class B) stock (US35137L2043): Is its media content moat strong enough for streaming wars
CHTR,2026-04-10,0.9146186038851738,positive,news,Akamai Technologies Inc. stock (US00971T1016): Is its edge computing shift strong enough to unlock n
CHTR,2026-04-10,0.9214516943320632,positive,news,Millicom taps TAM-1 to boost connectivity
CHTR,2026-04-10,0.9154681973159313,positive,news,Aehr Test Systems (+9.0%): Record Bookings Overshadow Q3 Earnings Miss
CHTR,2026-04-10,-0.8922443855553865,negative,news,Federal judge extends restraining order on $6.2B merger of local TV giants Nexstar and Tegna
CHTR,2026-04-10,0.5811913758516312,positive,news,"TFI International Stock Surges 19%, With A 8-Day Winning Spree"
CHTR,2026-04-10,0.2441098988056183,positive,news,"TFI International Stock Surges 19%, With A 8-Day Winning Spree"
CHTR,2026-04-10,0.6778397113084793,positive,news,7-Day Rally Sends Microchip Technology Stock Up 19%
CHTR,2026-04-09,0.005359577015042305,neutral,news,SVC Stock Fund Price and Chart — NASDAQ:SVC
CHTR,2026-04-09,0.08542759530246258,neutral,news,Liberty Broadband Corp stock: What you need to know for smart investing now
CHTR,2026-04-09,0.45104134269058704,neutral,news,Liberty Broadband Corp stock: What you need to know for smart investing now
CHTR,2026-04-09,-0.9659341499209404,negative,news,Liberty Broadband (NASDAQ:LBRDA) Stock Price Crosses Above 50-Day Moving Average - Time to Sell?
CHTR,2026-04-08,-0.03295635059475899,neutral,news,"LBRDB Stock News Today | Earnings, Events & Price Alerts"
CHTR,2026-04-08,0.9193229824304581,positive,news,Lenoir City Public Utility Makes Speedy Progress On Tennessee Fiber Build
CHTR,2026-04-08,-0.9543002350255847,negative,news,"Nexstar asks states, including Colorado, for $150M bond to cover damages from order slowing merger with Tegna"
CHTR,2026-04-08,0.9238806879147887,positive,news,Did SG Americas’ Stake Surge Just Shift Liberty Broadband’s (LBRD.K) Charter-Linked Investment Narrative?
CHTR,2026-04-07,0.924832814373076,positive,news,T-Mobile US Bundles Mint Mobile And Expands 5G As Shares Lag Targets
CHTR,2026-04-07,0.8672505170106888,positive,news,T-Mobile’s Mint Launches New Bundles Targeting Cable
CHTR,2026-04-07,0.33632546477019787,neutral,news,$45 a month now buys home internet and unlimited wireless
CHTR,2026-04-06,0.9339019320905209,positive,news,Did SG Americas’ Stake Surge Just Shift Liberty Broadband’s (LBRD.K) Charter-Linked Investment Narrative?
CHTR,2026-04-06,-0.22360584139823914,negative,news,How Investors May Respond To Charter Communications (CHTR) Push For Political Spending Disclosure And AI Initiatives
CHTR,2026-04-05,-0.9640291263349354,negative,news,The Communication Services Select Sector SPDR Fund : XLC
CHTR,2026-04-05,0.0183670986443758,neutral,news,"EchoStar Corporation (SATS) stock price, news, quote and history"
CHTR,2026-04-04,0.0032928790897130966,neutral,news,Free cash flow per share of Liberty Broadband Corp. Class A – TRADEGATE:8L8
CHTR,2026-04-04,0.9173824163153768,positive,news,Is RingCentral’s (RNG) Cox AI Contact Center Deal Quietly Reframing Its Competitive Moat?
CHTR,2026-04-04,0.03560347855091095,neutral,news,Charter Communications (NASDAQ: CHTR) sees $965M exchangeable debt repaid in cash
CHTR,2026-04-03,0.9268414545804262,positive,news,Liberty Broadband Stake Increased by SG Americas Securities
CHTR,2026-04-03,0.30178604181855917,neutral,news,Microbulk Gas Supply System Market Is Going to Boom | Linde plc • Messer Group GmbH • Praxair Technology Inc
CHTR,2026-04-02,0.039186013862490654,neutral,news,Liberty Broadband cuts Charter (NASDAQ: CHTR) stake by 643K shares
CHTR,2026-04-02,-0.020171988755464554,neutral,news,"OMI.N Stock: Price, Forecast, Financials & AI Analysis"
CHTR,2026-04-02,-0.6471969485282898,negative,news,A Look At Charter Communications (CHTR) Valuation After Q1 Pressure And New AI Leadership Move
CHTR,2026-04-01,0.2495992761105299,neutral,news,Catalyst for Girls Award recipients to be honored at luncheon | NONPROFIT REGISTER
CHTR,2026-04-01,0.9145535873249173,positive,news,T-Mobile might buy Uniti Group's Kinetic fiber assets
CHTR,2026-04-01,0.9050094624981284,positive,news,T-Mobile might buy Uniti Group's Kinetic fiber assets
CHTR,2026-04-01,-0.6571124494075775,negative,news,AT&T Shares Rise 6.9% in Six Months: How to Play the Stock?
CHTR,2026-04-01,0.8187149576842785,positive,news,Evercore ISI reiterates In Line rating on AT&T stock at $28
CHTR,2026-04-01,0.8461602618917823,positive,news,Cable One Inc Stock: Business Model Resilience and Investor Considerations Amid Broadband Sector Shi
CHTR,2026-04-01,0.8444533166475594,positive,news,Cable One Inc Stock: Business Model Resilience and Investor Considerations Amid Broadband Sector Shi
CHTR,2026-04-01,0.22081820107996464,neutral,news,"31,650 Shares in Liberty Broadband Corporation $LBRDK Bought by Elser Financial Planning Inc"
CHTR,2026-04-01,-0.11955729126930237,negative,news,XLC ETF’s Unsteady Surge Depends on Oil Prices and Fed Policy—Be Alert for a Sudden Reversal
AEP,2026-04-13,0.9290195032954216,positive,news,BMO Capital raises American Electric Power stock price target to $141
AEP,2026-04-13,-0.2919105887413025,negative,news,"HBW Advisory Services LLC Sells 9,045 Shares of American Electric Power Company, Inc. $AEP"
AEP,2026-04-13,0.7386946231126785,positive,news,"Sumitomo Mitsui Trust Group Inc. Sells 33,841 Shares of American Electric Power Company, Inc. $AEP"
AEP,2026-04-12,0.8551351497881114,positive,news,American Electric Power Increases Hybrid Fleet
AEP,2026-04-12,-0.8738165311515331,negative,news,Kansas ranchers fight transmission line
AEP,2026-04-12,0.12228510901331902,neutral,news,"Analysts Are Bullish on These Energy Stocks: Valero Energy (VLO), Propetro Holding (PUMP)"
AEP,2026-04-11,0.9331681858748198,positive,news,American Electric Power Shares Acquired by SpringVest Wealth Management
AEP,2026-04-11,0.9360648766160011,positive,news,Howard Capital Boosts Stake in American Electric Power
AEP,2026-04-11,0.9303911896422505,positive,news,"American Electric Power Company, Inc. $AEP Shares Acquired by SpringVest Wealth Management LLC"
AEP,2026-04-10,0.19530805479735136,neutral,news,"CEG Stock Price, Quote & Chart | CONSTELLATION ENERGY (NASDAQ:CEG)"
AEP,2026-04-10,-0.2253773808479309,negative,news,Bloom Energy Corporation Class A Trade Ideas — VIE:BE
AEP,2026-04-09,0.9276953712105751,positive,news,American Electric Power Co. Inc. stock outperforms competitors on strong trading day
AEP,2026-04-09,0.9343972057104111,positive,news,American Electric Power stock hits all-time high at 135.11 USD
AEP,2026-04-09,-0.007922809571027756,neutral,news,"NextEra Energy will post Q1 results April 23, webcast at 9 a.m. ET"
AEP,2026-04-09,0.11469981353729963,neutral,news,Should You Consider Adding Franklin U.S. Low Volatility High Dividend Index ETF (LVHD) to Your Investment Portfolio?
AEP,2026-04-08,0.9243843760341406,positive,news,"American Electric Power Co. Inc. stock rises Wednesday, still underperforms market"
AEP,2026-04-08,-0.8480982594192028,negative,news,Consumers Energy execs grilled on dam sale: How does it make sense?
AEP,2026-04-08,0.9136372720822692,positive,news,Georgia Power needs 200 lineworkers a year as grid expansion grows
AEP,2026-04-08,-0.9193312395364046,negative,news,Jefferies Keeps Their Buy Rating on Xcel Energy (XEL)
AEP,2026-04-08,0.9210938289761543,positive,news,OGE Energy Corp stock: Steady growth in a stable utility sector
AEP,2026-04-08,0.4620648082345724,neutral,news,American Electric Power Company (NasdaqGS:AEP) Stock Forecast & Analyst Predictions
AEP,2026-04-08,-0.9651835574768484,negative,news,The amount of electricity sold by Korea Electric Power Corporation (KEPCO) to manufacturing companie..
AEP,2026-04-07,0.06487270165234804,neutral,news,Precision Trading with American Electric Power Company Inc. (AEP) Risk Zones
AEP,2026-04-07,0.8307479918003082,positive,news,"NextEra Energy, Inc. Experiences Revision in Its Stock Evaluation Amid Competitive Market Dynamics"
AEP,2026-04-06,-0.9371938668191433,negative,news,"Consumers group challenges AEP, FirstEnergy transmission project as power demand surges"
AEP,2026-04-06,0.900760967284441,positive,news,Georgia Power says grid upgrades cut outages in half in some areas
AEP,2026-04-06,0.873726075515151,positive,news,Quanta Services Just Unveiled Its Most Ambitious 5-Year Plan Yet. Here’s What It Means for Investors
AEP,2026-04-06,0.9020887496881187,positive,news,Anterix Expands Private Wireless Leadership with New 10 MHz Grid Deployment
AEP,2026-04-06,-0.7024708241224289,negative,news,"Aberdeen Group plc Reduces Holdings in American Electric Power Company, Inc. $AEP"
AEP,2026-04-05,-0.11052378639578819,neutral,news,"Tennessee Valley Authority president, CEO announces plans to retire"
AEP,2026-04-05,0.4015427976846695,positive,news,The Korea Electric Power Corporation (KEPCO) announced on the 5th that it will reduce about 513 giga..
AEP,2026-04-05,0.7459962964057922,positive,news,Korea Electric Power Corporation has pledged to cut total energy consumption by approximately 5% from last year's levels.
AEP,2026-04-05,-0.0589277446269989,neutral,news,"Kepco, power group CEOs slash energy use to confront Middle East crisis - CHOSUNBIZ"
AEP,2026-04-04,0.7462762761861086,positive,news,Privately Funded 765-kV Grid Build for Ohio Data Campus Might Change The Case For Investing In American Electric Power Company (AEP)
AEP,2026-04-04,0.9048064686357975,positive,news,WEC Energy Near 52-Week Highs as 3.9 Gigawatts of Data Center Load Drives 2028 Acceleration
AEP,2026-04-03,0.028946188278496265,neutral,news,"American Electric Power Company (AEP): US Department of Energy, SB Energy, and AEP Ohio announce planned investments"
AEP,2026-04-03,0.4881493244320154,positive,news,"AEP Financials: Revenue Breakdown, Margins & Competitor Comparison"
AEP,2026-04-03,0.9346565715968609,positive,news,American Electric Power’s $72 Billion Capital Plan Just Got Bigger: Why It Could Set New Highs in 2026
AEP,2026-04-03,-0.17107161693274975,neutral,news,"National Grid plc (NGG) stock price, news, quote and history"
AEP,2026-04-03,0.9177038576453924,positive,news,"AEP CEO's compensation could hit $36.6M, topping region's highest-paid public company leader"
AEP,2026-04-03,0.5734060555696487,positive,news,"Between American Electric Power and Constellation Energy, Which Stock Looks Set to Break Out?"
AEP,2026-04-03,0.1623246343806386,neutral,news,American Electric Power (AEP) director granted 324 phantom stock units
AEP,2026-04-02,0.1727690901607275,neutral,news,AEP (AEP) director Sandra Beach Lin granted new phantom stock units
AEP,2026-04-02,0.08871343079954386,neutral,news,AEP (AEP) director receives phantom stock unit award tied to 324 shares
AEP,2026-04-02,0.2369299056008458,neutral,news,AEP (NYSE: AEP) director receives new phantom stock unit award
AEP,2026-04-02,0.32867766357958317,neutral,news,AEP (AEP) director receives phantom stock unit grant tied to shares
AEP,2026-04-02,0.02533207554370165,neutral,news,AEP (AEP) director Von Thaer receives phantom stock unit award
AEP,2026-04-02,0.08014385495334864,neutral,news,American Electric Power (AEP) director receives phantom stock grant
AEP,2026-04-02,0.001057719811797142,neutral,news,American Electric Power (AEP) director granted 324 phantom stock-linked units
AEP,2026-04-02,0.8157905675470829,positive,news,PUCO approves AEP request to raise Ohio electric bills by about $8 a month
GS,2026-04-13,-0.04942168481647968,neutral,sec_filing,GS 8-K Filing - 2026-04-13
GOOGL,2026-04-10,-0.05879989638924599,neutral,sec_filing,GOOGL 8-K Filing - 2026-04-10
OXY,2026-04-10,-0.05577090382575989,neutral,sec_filing,OXY 8-K Filing - 2026-04-10
CAT,2026-04-10,-0.03390050679445267,neutral,sec_filing,CAT 8-K Filing - 2026-04-10
CVX,2026-04-09,-0.0316502433270216,neutral,sec_filing,CVX 8-K Filing - 2026-04-09
AMZN,2026-04-09,-0.05207393690943718,neutral,sec_filing,AMZN 8-K Filing - 2026-04-09
EOG,2026-04-09,-0.05283371917903423,neutral,sec_filing,EOG 8-K Filing - 2026-04-09
SLB,2026-04-08,-0.05365506745874882,neutral,sec_filing,SLB 8-K Filing - 2026-04-08
USB,2026-04-08,-0.057408783584833145,neutral,sec_filing,USB 8-K Filing - 2026-04-08
XOM,2026-04-08,-0.023865364491939545,neutral,sec_filing,XOM 8-K Filing - 2026-04-08
INTC,2026-04-08,-0.025281770154833794,neutral,sec_filing,INTC 8-K Filing - 2026-04-08
COF,2026-04-07,-0.05630152486264706,neutral,sec_filing,COF 8-K Filing - 2026-04-07
ORCL,2026-04-06,-0.029577016830444336,neutral,sec_filing,ORCL 8-K Filing - 2026-04-06
CSCO,2026-04-06,-0.0640218984335661,neutral,sec_filing,CSCO 8-K Filing - 2026-04-06
AVGO,2026-04-06,-0.04617438651621342,neutral,sec_filing,AVGO 8-K Filing - 2026-04-06
PSX,2026-04-06,-0.039251863956451416,neutral,sec_filing,PSX 8-K Filing - 2026-04-06
C,2026-04-03,-0.03721959330141544,neutral,sec_filing,C 8-K Filing - 2026-04-03
INTC,2026-04-03,-0.02451992966234684,neutral,sec_filing,INTC 8-K Filing - 2026-04-03
ABBV,2026-04-03,-0.05223179794847965,neutral,sec_filing,ABBV 8-K Filing - 2026-04-03
TSLA,2026-04-02,-0.04335886240005493,neutral,sec_filing,TSLA 8-K Filing - 2026-04-02
AVGO,2026-04-02,-0.03956793621182442,neutral,sec_filing,AVGO 8-K Filing - 2026-04-02
GOOGL,2026-04-02,-0.05394752696156502,neutral,sec_filing,GOOGL 8-K Filing - 2026-04-02
SBUX,2026-04-02,-0.03124214895069599,neutral,sec_filing,SBUX 8-K Filing - 2026-04-02
MU,2026-04-01,-0.026513418182730675,neutral,sec_filing,MU 8-K Filing - 2026-04-01
NKE,2026-04-01,-0.06070697866380215,neutral,sec_filing,NKE 10-Q Filing - 2026-04-01
