ticker,date,sentiment_score,sentiment_label,content_type,title
JPM,2026-06-09,0.8209185656160116,positive,news,JPMorgan Chase Trades at a Big Premium to Bank of America. Is It Worth the Difference?
JPM,2026-06-09,0.8625070843845606,positive,news,JPMorgan Chase Trades at a Big Premium to Bank of America. Is It Worth the Difference?
JPM,2026-06-09,0.9127572476863861,positive,news,"Fox Run Management L.L.C. Makes New $1.46 Million Investment in ExlService Holdings, Inc. $EXLS"
JPM,2026-06-09,-0.9330527856945992,negative,news,"United Rentals, Inc. $URI Shares Sold by LGT Capital Partners LTD."
JPM,2026-06-09,0.1768440678715706,neutral,news,Fifth Third joining NYSE from Nasdaq in largest bank stock shift ever
JPM,2026-06-09,-0.9483534079045057,negative,news,"Franklin Resources Inc. Reduces Stock Position in Roper Technologies, Inc. $ROP"
JPM,2026-06-09,0.022664066404104233,neutral,news,JPMorgan (JPM) offers Uncapped Digital Barrier Notes with 55.35% contingent return
JPM,2026-06-09,0.7725545167922974,positive,news,Analysts Offer Insights on Financial Companies: American Express (AXP) and Ethos Technologies Inc. Class A (LIFE)
JPM,2026-06-09,-0.4724615216255188,negative,news,"Ross Stores, Inc. $ROST Shares Sold by JPMorgan Chase & Co."
JPM,2026-06-09,0.9320677686482668,positive,news,"ING Groep NV Buys Shares of 62,107 Archer Daniels Midland Company $ADM"
JPM,2026-06-09,0.30593554209917784,neutral,news,"ING Groep NV Purchases Shares of 46,072 Phillips 66 $PSX"
JPM,2026-06-09,-0.38039979338645935,negative,news,Bank of America Securities Remains a Hold on Vornado Realty (VNO)
JPM,2026-06-09,-0.7176153883337975,negative,news,Overseas Research Selection Daily Report 0609 | UBS Group: The Fed's threshold for raising interest rates remains high; disruptions in the Strait of Hormuz may prompt a rate cut.
JPM,2026-06-09,0.13832587376236916,neutral,news,Meena Subramanyam
JPM,2026-06-09,0.29239825531840324,neutral,news,KeyBanc Sticks to Its Buy Rating for Xcel Energy (XEL)
JPM,2026-06-09,-0.67152239382267,negative,news,"Natixis Advisors LLC Sells 13,779 Shares of BWX Technologies, Inc. $BWXT"
JPM,2026-06-09,0.5889899134635925,positive,news,"Vestcor Inc Sells 9,056 Shares of DT Midstream, Inc. $DTM"
JPM,2026-06-09,0.765748668462038,positive,news,"Geode Capital Management LLC Has $65.80 Million Holdings in Four Corners Property Trust, Inc. $FCPT"
JPM,2026-06-09,0.9345864038914442,positive,news,Goldman Sachs Group Inc. Has $117.58 Million Stock Position in Curtiss-Wright Corporation $CW
JPM,2026-06-09,0.9251685682684183,positive,news,"Erste Asset Management GmbH Buys 26,829 Shares of Tesla, Inc. $TSLA"
JPM,2026-06-09,0.8072127252817154,positive,news,"World’s largest banks pledged $906bn to fossil fuel companies in ‘unfathomable’ increase in 2025, report finds"
JPM,2026-06-09,0.9332212526351213,positive,news,"Capital World Investors Purchases 5,048 Shares of Old Dominion Freight Line, Inc. $ODFL"
JPM,2026-06-09,-0.9148309025913477,negative,news,"Tesla Stock Forecast | SpaceX Listing, Q1 Results"
JPM,2026-06-09,-0.8936297371983528,negative,news,"Bank of New York Mellon Corp Sells 9,074 Shares of XPO, Inc. $XPO"
JPM,2026-06-09,-0.9597787968814373,negative,news,"Bank of New York Mellon Corp Reduces Position in Reinsurance Group of America, Incorporated $RGA"
JPM,2026-06-09,-0.9565959507599473,negative,news,Bank of New York Mellon Corp Has $82.21 Million Position in Allegion PLC $ALLE
JPM,2026-06-09,-0.8808275796473026,negative,news,"Bank of New York Mellon Corp Buys 368,191 Shares of The Gap, Inc. $GAP"
JPM,2026-06-09,-0.9144959878176451,negative,news,Galaxy Digital lowers odds of CLARITY Act passage to 60% as deadline nears
JPM,2026-06-09,0.8017879575490952,positive,news,Do TD’s New Capital Raises And Digital Wins Reframe Its Investment Story For Toronto-Dominion (TSX:TD)?
JPM,2026-06-09,0.0839256513863802,neutral,news,Jefferson Shreve from Indiana’s 6th district invests heavily in JP Morgan and Morgan Stanley By Investing.com
JPM,2026-06-09,-0.0733393207192421,neutral,news,"JPMorgan (JPM) prices 5.70% callable notes; monthly interest, long maturity"
JPM,2026-06-09,0.8348945137113333,positive,news,JPMorgan Chase Tests Tokenized Deposits And Quantum AI For Future Payments
JPM,2026-06-09,0.8759910985827446,positive,news,JPMorgan Chase (JPM) Valuation Check As Tokenized Deposit Network Targets Faster Blockchain Payments
JPM,2026-06-08,-0.011471491307020187,neutral,news,"Proposed resale notice — ABEO (Nasdaq: ABEO) lists 25,000 shares"
JPM,2026-06-08,0.7654821863397956,positive,news,"Amazon Sells C$14 Billion in Bonds, Sets Canadian Record"
JPM,2026-06-08,0.9352666325867176,positive,news,Arista Networks (NYSE:ANET) Trading Up 1.3% Following Analyst Upgrade
JPM,2026-06-08,0.7323120413348079,positive,news,Fifth Third Bancorp stock (US3167731005): dividend move and regional banking focus
JPM,2026-06-08,0.7755328444764018,positive,news,DaVita Secures $500 Million Incremental Term Loan B-2 Under Credit Facility With JPMorgan
JPM,2026-06-08,0.7870832225307822,positive,news,"When Commercial Lending Forgets the Customer, It Forgets the Relationship"
JPM,2026-06-08,0.8328358232975006,positive,news,IDEAYA Biosciences plans $300 million stock offering
JPM,2026-06-08,0.35938331577926874,neutral,news,Hubbell Completes $1.9 Billion Senior Notes Offering to Help Fund NSI Acquisition
SCHW,2026-06-09,-0.018274052068591118,neutral,news,Charles Schwab Corp (CENX) Form 144 shows proposed sale tied to awards
SCHW,2026-06-09,-0.9638121770694852,negative,news,Why GENZ’s High Yield Can’t Survive Its Shift From Casinos to Apps
SCHW,2026-06-08,0.017444318160414696,neutral,news,"Charles Schwab (AMPX) Rule 144 notice: 125,000 RSU shares proposed for sale"
SCHW,2026-06-08,0.23602834343910217,positive,news,Charles Schwab Corp. stock (US8085131050): Trading activity index rebounds while shares tread water
SCHW,2026-06-08,0.0027035418897867203,neutral,news,"CAVCO INDUSTRIES, INC. SEC Filing"
SCHW,2026-06-08,0.04096786864101887,neutral,news,"Zacks.com featured highlights include Ross Stores, TE Connectivity, Cenovus Energy, Globe Life and The Charles Schwab"
SCHW,2026-06-08,0.14871222339570522,neutral,news,"Zacks.com featured highlights include Ross Stores, TE Connectivity, Cenovus Energy, Globe Life and The Charles Schwab"
SCHW,2026-06-08,0.8588663823902607,positive,news,Schwab Trading Activity Index™: STAX Score Rebounds in May
SCHW,2026-06-08,0.10160814877599478,neutral,news,"Zacks.com featured highlights include Ross Stores, TE Connectivity, Cenovus Energy, Globe Life and The Charles Schwab"
SCHW,2026-06-08,0.21764671802520752,neutral,news,"Zacks.com featured highlights include Ross Stores, TE Connectivity, Cenovus Energy, Globe Life and The Charles Schwab"
SCHW,2026-06-08,0.41110341623425484,neutral,news,"Zacks.com featured highlights include Ross Stores, TE Connectivity, Cenovus Energy, Globe Life and The Charles Schwab"
SCHW,2026-06-08,-0.013390067964792252,neutral,news,"Affiliate sales total 25,404 shares for LASR (Symbol: LASR)"
SCHW,2026-06-08,0.015828970819711685,neutral,news,SMB vs. SCHO: The Short-Term Bond Decision That Starts With Your Tax Return
SCHW,2026-06-08,0.86177066154778,positive,news,"The Charles Schwab Corp stock (US8085131055): Dividend, price and analyst tone in focus"
SCHW,2026-06-08,0.8288677725940943,positive,news,Is VEA the Smartest Investment You Can Make Right Now?
SCHW,2026-06-07,0.005748249590396881,neutral,news,"ETFs Investing in Forgent Power Solutions, Inc. Class A Stocks"
SCHW,2026-06-07,0.8834570720791817,positive,news,Is VEA the Smartest Investment You Can Make Right Now?
SCHW,2026-06-06,0.016274789348244667,neutral,news,ETFs Investing in Regal Rexnord Corporation Stocks
SCHW,2026-06-06,0.009347934275865555,neutral,news,"ETFs Investing in Molina Healthcare, Inc. Stocks"
SCHW,2026-06-06,0.016328657045960426,neutral,news,"ETFs Investing in AutoNation, Inc. Stocks"
SCHW,2026-06-06,0.01068115420639515,neutral,news,"ETFs Investing in Everus Construction Group, Inc. Stocks"
SCHW,2026-06-06,-0.009156890213489532,neutral,news,Schwab Fundamental U.S. Large Company ETF : FNDX
SCHW,2026-06-06,-0.21718904376029968,negative,news,The Charles Schwab Corporation $SCHW Shares Sold by Mount Capital Ltd
SCHW,2026-06-06,-0.2691207528114319,negative,news,"152,845 Shares in The Charles Schwab Corporation $SCHW Purchased by PBU The Pension Fund of Early Childhood & Youth Educators"
SCHW,2026-06-06,0.031235063448548317,neutral,news,Charles Schwab Cash Sorting Story Shapes Retirement Planning Focus
SCHW,2026-06-05,0.09285785630345345,neutral,news,Investors Weigh LQD and SCHQ for Fixed-Income Exposure
SCHW,2026-06-05,-0.043948227539658546,neutral,news,"BorgWarner Inc. (BWA) Rule 144 notice lists 3,800 and 1,200 shares"
SCHW,2026-06-05,0.0916867284104228,neutral,news,Charles Schwab Corp. stock (US8085131050): shares hover around mid-90s ahead of next earnings update
SCHW,2026-06-05,0.09499943256378174,neutral,news,"LQD vs. SCHQ: Why the ""Safer"" Bond Fund Has Not Always Been the Better Choice"
SCHW,2026-06-05,-0.08408220671117306,neutral,news,Charles Schwab (NYSE: SKY) Form 144 shows insider sale of restricted stock
SCHW,2026-06-05,0.5843376647680998,positive,news,Schwab opens up trading on crypto futures.
SCHW,2026-06-05,0.8698350470513105,positive,news,"HOOD, Webull & Other Brokerages Gain as FINRA Eliminates PDT Rule"
SCHW,2026-06-05,0.017865357920527458,neutral,news,"Schwab Strategic Trust - Schwab U.S. TIPS ETF announces Monthly dividend, payable on June 05, 2026"
SCHW,2026-06-05,0.011643152683973312,neutral,news,"ETFs Investing in Nomura Real Estate Holdings, Inc. Stocks"
SCHW,2026-06-04,-0.9482033988460898,negative,news,"ENNIS, INC. ($EBF) CEO 2026 Pay Revealed"
SCHW,2026-06-04,0.9269310720264912,positive,news,"CIBC Asset Management Inc Acquires 156,229 Shares of The Charles Schwab Corporation $SCHW"
SCHW,2026-06-04,-0.4761575274169445,negative,news,"Schwab (SCHW) CFO reports 6,519-share tax withholding on RSU settlement"
SCHW,2026-06-04,-0.027287375181913376,neutral,news,Teresa L. Dick reports multiple FANG share sales (NASDAQ: FANG)
SCHW,2026-06-04,0.09886535629630089,neutral,news,"[144] ImmunityBio, Inc. SEC Filing"
SCHW,2026-06-04,0.06012386362999678,neutral,news,ETFs Investing in SiTime Corporation Stocks
SCHW,2026-06-04,0.9133993526920676,positive,news,Toronto-Dominion Should See US Loan Growth Turn Positive in Fiscal 2026
SCHW,2026-06-04,-0.9023686349391937,negative,news,LPL Financial Holdings Inc. $LPLA Shares Sold by TD Asset Management Inc
SCHW,2026-06-04,0.014214958995580673,neutral,news,Schwab short-term US Treasury ETF declares monthly distribution of $0.0743
SCHW,2026-06-04,0.0466174203902483,neutral,news,ETFs Investing in INVISIO AB Stocks
SCHW,2026-06-04,-0.9527968233451247,negative,news,"How AI Could Crush Schwab, and the Industry's Cash Cow"
SCHW,2026-06-04,0.3230610005557537,neutral,news,SCHF and SPDW Both Surged 35% in the Last Year. Here's How They're Different.
SCHW,2026-06-04,-0.8524210713803768,negative,news,7-Day Sell-Off Sends Intercontinental Exchange Stock Down -9.5%
SCHW,2026-06-03,0.9375922530889511,positive,news,Charles Schwab Corp. stock (US8085131050): platform upgrade news and steady trading ahead of U.S. ma
SCHW,2026-06-03,0.934179775416851,positive,news,The Charles Schwab Corporation $SCHW Shares Purchased by Greenwich Wealth Management LLC
SCHW,2026-06-03,0.8709667571820319,positive,news,Shepherd Street Advisors LLC Invests $1.76 Million in The Charles Schwab Corporation $SCHW
JNJ,2026-06-09,0.8787842695601285,positive,news,"Johnson & Johnson to Acquire Firefly Bio, Inc. to Expand Oncology Pipeline with Novel Degrader Antibody Conjugate Platform"
JNJ,2026-06-08,0.5647159172222018,positive,news,J&J glows with $1B buyout of Firefly and its degrader platform tech
JNJ,2026-06-08,0.9412907622754574,positive,news,"Should You Buy, Sell or Hold ABBV Stock After It Rises 12% in a Month?"
JNJ,2026-06-08,0.8571556084789336,positive,news,"J&J to acquire Firefly, maker of ‘degrader’ antibody drugs, for up to $1B"
JNJ,2026-06-08,0.9378368705511093,positive,news,Eli Lilly and Co Stock (LLY) Moved Up by 3.37% on Jun 8: What Signal Does It Send?
JNJ,2026-06-08,0.19849390629678965,neutral,news,"Incyte, Galmed, and Johnson & Johnson Announce Acquisitions Totaling $3 Billion"
JNJ,2026-06-08,-0.6579238176345825,negative,news,Assessing Bausch + Lomb (NYSE:BLCO) Valuation After Blink Triple Care Preservative Free U.S. Launch
JNJ,2026-06-08,0.9149007303640246,positive,news,J&J lights up $1bn offer for pan-KRAS developer Firefly
JNJ,2026-06-08,0.7965723723173141,positive,news,M&A News: Johnson & Johnson (JNJ) Reaches a Massive $1B Deal for Firefly Bio to Expand Its Oncology Pipeline
JNJ,2026-06-08,-0.7909368574619293,negative,news,Can MariTide Save Amgen Stock From Its Fading Blockbusters?
JNJ,2026-06-08,0.9125996865332127,positive,news,Johnson & Johnson to Buy Firefly Bio for $1 Billion - WSJ
JNJ,2026-06-08,0.9246781980618834,positive,news,Is AbbVie Stock The Right Defensive Pick In This Volatile Market?
JNJ,2026-06-08,0.8367736283689737,positive,news,J&J to buy cancer drug technology developer Firefly Bio for $1 billion
JNJ,2026-06-08,0.8459557187743485,positive,news,Johnson & Johnson to buy Firefly Bio for $1 billion
JNJ,2026-06-08,0.8733057104982436,positive,news,Johnson & Johnson inks $1B deal for tech targeting 'undruggable' KRAS
JNJ,2026-06-08,0.48008469864726067,positive,news,Ionis Pharmaceuticals adds Ludwig Hantson to board
JNJ,2026-06-08,0.925191143527627,positive,news,LASE Stock Rockets As Anti‑Drone Win Fuels Defense Momentum
JNJ,2026-06-08,0.9224416445940733,positive,news,Roche signs $2.3bn blood cancer drug agreement with Nurix Therapeutics
JNJ,2026-06-08,0.9345106519758701,positive,news,AbbVie Stock Price Target $350: Why TIKR Model Shows Around 54% Upside From Here
JNJ,2026-06-08,0.9329574052244425,positive,news,"LPL Financial LLC Buys 54,322 Shares of Johnson & Johnson $JNJ"
JNJ,2026-06-08,0.5413531046360731,positive,news,"10,175 Shares in Johnson & Johnson $JNJ Bought by Hilton Head Capital Partners LLC"
JNJ,2026-06-08,-0.8654858954250813,negative,news,Northwestern Mutual Wealth Management Co. Has $1.42 Million Position in Kenvue Inc. $KVUE
JNJ,2026-06-08,0.8911418095231056,positive,news,Will Late-Stage Immunology and Oncology Wins Redefine Johnson & Johnson's (JNJ) Post-Biosimilar Narrative?
JNJ,2026-06-08,0.21645236015319824,positive,news,"Franklin Resources Inc. Sells 5,342,443 Shares of Johnson & Johnson $JNJ"
JNJ,2026-06-07,0.9000775627791882,positive,news,StockWatch: Abivax Survives a Roller Coaster Week
JNJ,2026-06-07,-0.8938146233558655,negative,news,Why Laser Photonics (LASE) Is Up 237.3% After New Defense And Medical Laser Orders And Evaluation
JNJ,2026-06-07,0.19514033198356628,positive,news,Why Laser Photonics (LASE) Is Up 237.3% After New Defense And Medical Laser Orders And Evaluation
JNJ,2026-06-07,-0.41490310430526733,negative,news,Assessing UroGen Pharma (URGN) Valuation After Jelmyto Patent Settlement With Teva
JNJ,2026-06-07,0.9322690311819315,positive,news,Johnson & Johnson Stock at $233: Why Wall Street Mean Target of $253 May Still Underestimate the Pipeline
JNJ,2026-06-07,-0.5541458129882812,negative,news,XML Financial LLC Has $13.12 Million Stock Position in Johnson & Johnson $JNJ
JNJ,2026-06-07,0.8323863334953785,positive,news,"Havemeyer Place LP Takes $1.91 Million Position in Fidelity National Information Services, Inc. $FIS"
JNJ,2026-06-07,-0.06382900476455688,negative,news,"Modus Advisors LLC Has $526,000 Stake in Kenvue Inc. $KVUE"
JNJ,2026-06-07,0.9391904734075069,positive,news,"Los Angeles Capital Management LLC Purchases 255,236 Shares of Johnson & Johnson $JNJ"
JNJ,2026-06-07,0.9413209268823266,positive,news,Capital International Investors Increases Position in Johnson & Johnson $JNJ
JNJ,2026-06-06,0.9168350864201784,positive,news,Johnson & Johnson Dividend Stock Analysis: 64 Years of Increases and Current Valuation - News and Statistics
JNJ,2026-06-06,0.9289644844830036,positive,news,Johnson And Johnson ASCO 2026 Data Adds Depth To JNJ Valuation Story
JNJ,2026-06-06,0.22865039482712746,neutral,news,These Investors Earned 20% to 33% Returns Using The Same Philosophy on Completely Different Stocks
JNJ,2026-06-06,-0.6031431779265404,negative,news,J&J wins talc-related cancer case in California (JNJ:NYSE)
JNJ,2026-06-06,0.9289945801720023,positive,news,Pinebridge Investments LLC Makes New $50.20 Million Investment in Johnson & Johnson $JNJ
JNJ,2026-06-06,-0.878898374736309,negative,news,"Aldeyra Therapeutics CEO Todd Brady buys $418,450 in stock"
JNJ,2026-06-06,0.9363447278738022,positive,news,Prudential PLC Increases Position in CVS Health Corporation $CVS
JNJ,2026-06-06,0.9319556765258312,positive,news,111 Capital Makes New $1.74 Million Investment in Johnson & Johnson $JNJ
JNJ,2026-06-06,0.9049426093697548,positive,news,"Pay Less, Gain More: JAZZ Tops Johnson & Johnson Stock"
JNJ,2026-06-06,-0.8075705021619797,negative,news,Johnson & Johnson beats lawsuit alleging that talc caused 3 women’s cancer
JNJ,2026-06-06,0.8547696620225906,positive,news,Assessing Bristol Myers Squibb (BMY) Valuation After Fresh EU Opdivo Approval And New Phase 3 Oncology Data
JNJ,2026-06-06,0.9051053393632174,positive,news,"J&J, Medtronic back CereVasc’s $85M funding round"
JNJ,2026-06-05,0.8629720844328403,positive,news,Is Amgen An Undervalued Stock Or Value Trap?
JNJ,2026-06-05,-0.9597623664885759,negative,news,Cooper Companies (COO) Margin Hit And Q2 Loss Challenge Bullish Earnings Narratives
JNJ,2026-06-05,-0.340774230659008,neutral,news,J&J beats lawsuit alleging that talc caused three women's cancer
JNJ,2026-06-05,0.86568708345294,positive,news,Johnson & Johnson Scores Defense Verdict in 2nd Talc Bellwether in Los Angeles Superior Court
DHR,2026-06-09,0.9322974914684892,positive,news,Everpure Jumps 34% in a Year: Should Investors Bet on the Stock?
DHR,2026-06-08,0.9321367256343365,positive,news,SIRI Stock Surges 5% After-Hours On S&P MidCap 400 Inclusion
DHR,2026-06-08,0.026952079497277737,neutral,news,"As Danaher nears Masimo deal, Sirius XM moves into S&P index"
DHR,2026-06-08,0.8277475703507662,positive,news,Danaher Corp. stock (US2358511028): Diagnostics and life science group after recent earnings in focu
DHR,2026-06-08,0.5360224926844239,positive,news,Phenomenex Introduces Luna Omega HILIC LC Columns to Increase Sensitivity and Consistency in Polar Compound Analysis
DHR,2026-06-08,0.7809394677169621,positive,news,Phenomenex Introduces Luna Omega HILIC LC Columns to Increase Sensitivity and Consistency in Polar Compound Analysis
DHR,2026-06-08,0.9009726345539093,positive,news,Danaher Corporation (DHR) Stock Analysis: Unveiling a 32.54% Potential Upside for Investors
DHR,2026-06-08,0.9323340374976397,positive,news,HR TODAY Honors Danaher India for Innovative Talent Attraction Strategy at Cepheid India
DHR,2026-06-07,0.9366242922842503,positive,news,Why Wall Street Sees Danaher (DHR) Benefiting From Improving Industry Conditions
DHR,2026-06-06,-0.013898234814405441,neutral,news,Danaher Insiders Sold US$235m Of Shares Suggesting Hesitancy
DHR,2026-06-06,0.9311136193573475,positive,news,"Natixis Advisors LLC Acquires 168,917 Shares of Fortive Corporation $FTV"
DHR,2026-06-05,0.33517155051231384,positive,news,Reassessing Danaher (DHR) Valuation After Mixed Share Performance And Conflicting Undervaluation Signals
DHR,2026-06-05,0.7817012937739491,positive,news,IDBS i3 2026 forum in Boston showcases real-world customer outcomes in data-driven BioPharma
DHR,2026-06-04,0.19614660553634167,neutral,news,Danaher (DHR) Initiated with a Buy at DZ BANK AG
DHR,2026-06-04,0.427849686704576,neutral,news,What is multiomics? A simple guide to the future of biology
DHR,2026-06-04,0.9312145989388227,positive,news,Danaher Corp. stock outperforms competitors on strong trading day
DHR,2026-06-04,0.12144411914050579,neutral,news,West Pharma Appoints Former Thermo Fisher Executive Michel Lagarde as CEO
DHR,2026-06-04,-0.9654045375064015,negative,news,"Jim Cramer on Danaher: “At These Prices, It’s Clearly Overvalued”"
DHR,2026-06-04,-0.9490199340507388,negative,news,"Jim Cramer on Danaher: “At These Prices, It’s Clearly Overvalued”"
DHR,2026-06-03,0.03559111896902323,neutral,news,"Dh Masi Finance Inc. Enters into Note Purchase and Guaranty Agreement for Issuance of CHF 2,382,280,000 Senior Notes Guaranteed by Danaher Corporation"
DHR,2026-06-03,0.028504561632871628,neutral,news,Danaher (NYSE: DHR) issues long-dated CHF senior notes for general purposes
DHR,2026-06-03,-0.061620473861694336,negative,news,Danaher Corp. stock outperforms competitors on strong trading day
DHR,2026-06-03,0.7783634085208178,positive,news,Leica Biosystems Announces Expansion of Collaboration to Scale Precision Medicine and Develop AI-Powered Diagnostics
DHR,2026-06-03,0.6706355568021536,positive,news,Leica Biosystems Announces Expansion of Collaboration to Scale Precision Medicine and Develop AI-Powered Diagnostics
DHR,2026-06-02,0.9292361242696643,positive,news,What Danaher (DHR)'s New AI-Enabled SCIEX Mass Spec Platform Means For Shareholders
DHR,2026-06-02,-0.9653341770172119,negative,news,Danaher Corp. stock outperforms competitors despite losses on the day
DHR,2026-06-02,-0.8973224684596062,negative,news,Danaher Corp. stock (US2358511028): Wolfe Research starts coverage as shares trade lower
DHR,2026-06-02,0.6008305102586746,positive,news,DHR Assumed by Wolfe Research -- Rating Set to Peer Perform
DHR,2026-06-02,0.4798731207847595,positive,news,Wolfe Research initiates Danaher stock coverage with Peerperform rating
DHR,2026-06-01,0.5311027625575662,positive,news,Wolfe Research initiates Danaher stock coverage with Peerperform rating By Investing.com
DHR,2026-06-01,0.437828928232193,neutral,news,Wolfe Research initiates Danaher stock coverage with Peerperform rating
DHR,2026-06-01,-0.8522917330265045,negative,news,Danaher Corp. stock (US2358511028): shares ease while investors digest product updates and analyst b
DHR,2026-06-01,-0.9435625281184912,negative,news,Dominion Energy Inc stock (US2358511028): shares ease after recent ex-dividend date
DHR,2026-06-01,0.08482244238257408,neutral,news,Avoiding Lag: Real-Time Signals in (DHR) Movement
DHR,2026-06-01,0.835454273968935,positive,news,SCIEX unveils 1-sample-per-second mass spec to speed early discovery
DHR,2026-06-01,-0.9636964006349444,negative,news,Danaher Corp. stock underperforms Monday when compared to competitors
DHR,2026-06-01,0.026839938014745712,neutral,news,[8-K] HONEYWELL INTERNATIONAL INC Reports Material Event
DHR,2026-06-01,0.9363977732136846,positive,news,IDT partners with Illumina on oncology research workflow
DHR,2026-06-01,0.8178031728602946,positive,news,Integrated DNA Technologies Announces End-to-End Oncology Research Workflows Optimized on Illumina Software for Faster Insights
DHR,2026-06-01,0.11680440604686737,neutral,news,Avantor (AVTR) Appoints Ludovic Brellier as EVP and Chief Transformation Officer
DHR,2026-06-01,0.7557334490120411,positive,news,"Phenomenex Launches Endrix Long Life Columns, Redefining Column Durability and Method Reliability"
DHR,2026-06-01,0.9255635710433125,positive,news,Norges Bank Invests $491.93 Million in Fortive Corporation $FTV
DHR,2026-06-01,0.21369005925953388,neutral,news,Avantor (AVTR) Appoints Ludovic Brellier as EVP and Chief Transformation Officer
DHR,2026-05-31,-0.030369462445378304,neutral,news,A - Agilent Technologies Inc Stock Price and Quote
DHR,2026-05-29,-0.9418691955506802,negative,news,Is Danaher Stock Underperforming the S&P 500?
DHR,2026-05-29,0.8453201125375926,positive,news,Leica Biosystems and CellCarta Expand Collaborative Companion Diagnostic Development Model to Accelerate Commercialization Globally
DHR,2026-05-29,0.924627622589469,positive,news,Danaher Corp. stock outperforms competitors on strong trading day
DHR,2026-05-29,-0.9550783168524504,negative,news,Is Danaher Stock Underperforming the S&P 500?
DHR,2026-05-29,0.3992195725440979,positive,news,Waters Corp. stock outperforms competitors on strong trading day
DHR,2026-05-28,0.9107868047431111,positive,news,Danaher Corp. stock (US2358511028): valuation metrics in focus after Q1 guidance raise
BA,2026-06-09,0.9296072889119387,positive,news,Boeing deliveries jump 33% to 60 in May
BA,2026-06-09,-0.15968453884124756,negative,news,Boeing Delivers 60 Aircraft in May After Repairing Wiring Issue
BA,2026-06-09,0.9345732275396585,positive,news,TIAA Trust National Association Grows Stock Holdings in The Boeing Company $BA
BA,2026-06-09,-0.9548877459019423,negative,news,AeroVironment (AVAV) Is Down 9.5% After SCAR Lawsuits And Space Impairment Headlines - What's Changed
BA,2026-06-09,0.1805661842226982,neutral,news,"Clearbridge Investments LLC Acquires Shares of 847,079 Ryanair Holdings PLC $RYAAY"
BA,2026-06-09,0.9310894589871168,positive,news,Defense Stocks Draw Hedge Funds and Bullish Analysts
BA,2026-06-09,0.9278978984802961,positive,news,Boeing 737 Max: New Everett assembly line to launch July 6
BA,2026-06-08,0.9277545548975468,positive,news,Boeing sets launch date for its first Everett 737 Max production line
BA,2026-06-08,0.9323624577373266,positive,news,Boeing 737 Max: New Everett assembly line to launch July 6
BA,2026-06-08,0.9219430275261402,positive,news,"Alaska eyes joint ventures, Latin America partnerships"
BA,2026-06-08,0.9304959001019597,positive,news,Ryanair Holdings plc stock (IE00BYTBXV33): record profits and aggressive expansion keep investors watching
BA,2026-06-08,0.545653447508812,positive,news,Lockheed Martin Stock Won a $4.8 Billion PAC-3 Contract While Trading 24% Below Its 1-Year High. Here’s What Analysts Say
BA,2026-06-08,-0.8855401948094368,negative,news,Honeywell reaffirms annual forecast ahead of aerospace spinoff
BA,2026-06-08,0.4514712328091264,neutral,news,Embraer sees long-term opportunity for E2 jets in China despite slow progress (EMBJ:NYSE)
