ticker,date,sentiment_score,sentiment_label,content_type,title
AAPL,2026-04-27,-0.8478376269340515,negative,news,Xylem faces earnings test with analysts trimming expectations By Investing.com
AAPL,2026-04-27,0.2098175287246704,positive,news,Top 3 catalysts for Nasdaq 100 Index and QQQ ETF this week
AAPL,2026-04-27,0.9371154047548771,positive,news,Stifel raises SiteOne Landscape stock price target on acquisition By Investing.com
AAPL,2026-04-27,0.9217724297195673,positive,news,Weaver Capital Management LLC Has $10.35 Million Holdings in Apple Inc. $AAPL
AAPL,2026-04-27,0.9251094255596399,positive,news,Evercore ISI reiterates Apple stock rating on iPhone strength
AAPL,2026-04-27,-0.8812891142442822,negative,news,5 Stocks That Could Pop (or Drop) After Berkshire’s Annual Meeting
AAPL,2026-04-27,-0.9629156263545156,negative,news,Apple Inc. $AAPL Stake Lowered by Ledyard National Bank
AAPL,2026-04-27,-0.677008256316185,negative,news,Apple Inc. $AAPL Shares Sold by McElhenny Sheffield Capital Management LLC
AAPL,2026-04-27,0.023832814767956734,neutral,news,Palmer Luckey Says Apple's New CEO John Ternus May Have Built Early VR Gear He Used As A Teen: 'His Only
AAPL,2026-04-27,0.7580331936478615,positive,news,Capital Investment Advisory Services LLC Grows Stake in Apple Inc. $AAPL
AAPL,2026-04-27,0.31731289625167847,positive,news,"Cliftonlarsonallen Wealth Advisors LLC Purchases 9,435 Shares of Apple Inc. $AAPL"
AAPL,2026-04-27,-0.9528922280296683,negative,news,Apple Inc. $AAPL is Center For Asset Management LLC's 10th Largest Position
AAPL,2026-04-27,0.926867444999516,positive,news,AK Global Asset Management LLC Makes New $21.17 Million Investment in Apple Inc. $AAPL
AAPL,2026-04-27,0.28775618225336075,neutral,news,Apple (AAPL) Appoints Johny Srouji as Chief Hardware Officer
AAPL,2026-04-27,0.4058250915259123,neutral,news,Apple (AAPL) Appoints Johny Srouji as Chief Hardware Officer
AAPL,2026-04-26,-0.015476394444704056,neutral,news,AAPY | Kurv Yield Premium Strategy Insider Trading
AAPL,2026-04-26,0.34655787143856287,neutral,news,PayPal Holdings Inc stock (US70450Y1038): Is its product innovation edge strong enough to unlock new upside?
AAPL,2026-04-26,-0.944932222366333,negative,news,"Boston Trust Walden Lets Go of 93,000 Qualys (QLYS) Shares"
AAPL,2026-04-26,-0.0032546035945415497,neutral,news,Innospec declares $0.87 dividend
AAPL,2026-04-26,0.08194351848214865,neutral,news,"Jim Cramer Discussed AI Circular Deals, Top Quantum Plays & These 22 Stocks"
AAPL,2026-04-26,0.8913819529116154,positive,news,PayPal Stock Gets a Fresh Wall Street Lift — But the Sell Rating Says the Hard Part Isn’t Over
AAPL,2026-04-26,0.9368714578449726,positive,news,Invesco NASDAQ 100 ETF Rises on Mega-Cap Tech Strength
AAPL,2026-04-26,0.5600386559963226,positive,news,Apple (AAPL) Receives a Rating Update from a Top Analyst
AAPL,2026-04-26,-0.7441444396972656,negative,news,The Walt Disney Company $DIS Shares Sold by Impax Asset Management Group plc
AAPL,2026-04-26,0.025279352441430092,neutral,news,JPMorgan Global Select Equity ETF Global Select Equity ETF
AAPL,2026-04-26,0.41690949629992247,neutral,news,"After 45 Days, I Figured Out Exactly Who the MacBook Neo Is For"
AAPL,2026-04-26,-0.9572412203997374,negative,news,Apple Inc. $AAPL Holdings Decreased by Naviter Wealth LLC
AAPL,2026-04-26,-0.9636655924841762,negative,news,Perfromance Wealth Partners LLC Trims Holdings in Apple Inc. $AAPL
AAPL,2026-04-26,0.049550171941518784,neutral,news,Apple’s CEO transition is one of the most carefully choreographed in corporate history. Here's what comes next
AAPL,2026-04-26,0.03103802353143692,neutral,news,Berkshire Hathaway Inc. Class B Trade Ideas — BSESOF:BRYN
AAPL,2026-04-26,0.929575520567596,positive,news,"Advisors Capital Management LLC Acquires 50,943 Shares of CocaCola Company (The) $KO"
AAPL,2026-04-26,-0.9504171814769506,negative,news,"VeriSign, Inc. $VRSN Shares Sold by Abacus FCF Advisors LLC"
AAPL,2026-04-26,0.020619379356503487,neutral,news,"Allspring LT Large Core ETF (ALRG) Stock Price, Holdings, Dividend Yield"
AAPL,2026-04-26,-0.9247583970427513,negative,news,Robert Bender&Associates Cuts Apple Inc Stake by 23K Shares
AAPL,2026-04-26,-0.9258349426090717,negative,news,Robert Bender&Associates Cuts Apple Inc Stake by 23K Shares
AAPL,2026-04-25,0.9278195090591908,positive,news,"Is Himax a ‘stealth’ supplier to Nvidia, Apple? HIMX stock pops to nearly 1-year high after hedge fund flags possible links"
AAPL,2026-04-25,0.9328524805605412,positive,news,SPDR S&P 500 ETF Trust Sees Gains and Strong Inflows
AAPL,2026-04-25,-0.3012465834617615,negative,news,"Goldman Sachs Holds $330 Apple (AAPL) Stock Target, Calls Current Weakness a Buying Opportunity Before April 30 Earnings"
AAPL,2026-04-25,0.8341799452900887,positive,news,"Nvidia leads market cap race as Microsoft, Apple stocks decline"
AAPL,2026-04-25,0.023486681282520294,neutral,news,Paloma Acquisition Corp I (PALO)
AAPL,2026-04-25,0.9161761738359928,positive,news,"Kercheville Advisors LLC Invests $671,000 in Taiwan Semiconductor Manufacturing Company Ltd. $TSM"
AAPL,2026-04-25,0.42152318730950356,neutral,news,Apple CEO change could put Houston in the tech spotlight
AAPL,2026-04-25,-0.8850856982171535,negative,news,Apple Inc. $AAPL is Modera Wealth Management LLC's 7th Largest Position
AAPL,2026-04-25,-0.953374519944191,negative,news,Physicians Financial Services Inc. Has $57.32 Million Position in Apple Inc. $AAPL
AAPL,2026-04-25,0.7747681448236108,positive,news,"EWTX Price Today: Edgewise Therapeutics, Inc. Stock Price, Quote & Chart | MEXC"
AAPL,2026-04-25,0.366633802652359,positive,news,Masimo Corporation $MASI Shares Bought by Cwm LLC
AAPL,2026-04-25,-0.9481264911592007,negative,news,Apple Inc. $AAPL Holdings Lowered by Azzad Asset Management Inc. ADV
AAPL,2026-04-25,0.9031556956470013,positive,news,"Apple Inc. (NASDAQ:AAPL) Given Consensus Recommendation of ""Moderate Buy"" by Analysts"
AAPL,2026-04-25,0.793269807472825,positive,news,Apple Inc. (AAPL) Appointed John Ternus as CEO
AAPL,2026-04-25,0.030102236196398735,neutral,news,"WHFCL Price Today: WhiteHorse Finance, Inc. Stock Price, Quote & Chart | MEXC"
CSCO,2026-04-27,0.259206622838974,positive,news,"Pictet Asset Management Holding SA Sells 72,887 Shares of Cisco Systems, Inc. $CSCO"
CSCO,2026-04-27,0.8022390604019165,positive,news,"M&T Bank Corp Has $4.61 Million Holdings in Cisco Systems, Inc. $CSCO"
CSCO,2026-04-27,0.9398051165044308,positive,news,"D.A. Davidson & CO. Has $38.13 Million Holdings in Cisco Systems, Inc. $CSCO"
CSCO,2026-04-27,0.9375317376106977,positive,news,"Anchyra Partners LLC Makes New Investment in Cisco Systems, Inc. $CSCO"
CSCO,2026-04-27,0.9378015100955963,positive,news,"Aprio Wealth Management LLC Has $6.04 Million Stake in Cisco Systems, Inc. $CSCO"
CSCO,2026-04-27,0.40732449293136597,positive,news,"Ashton Thomas Private Wealth LLC Trims Stake in Cisco Systems, Inc. $CSCO"
CSCO,2026-04-27,-0.7724479660391808,negative,news,"1834 Investment Advisors Co. Has $3.31 Million Stock Holdings in Cisco Systems, Inc. $CSCO"
CSCO,2026-04-27,0.7955843042582273,positive,news,"BWG Global Downgrades Cisco Systems (CSCO), Cites Checks"
CSCO,2026-04-27,0.921161001548171,positive,news,"BWG Global Downgrades Cisco Systems (CSCO), Cites Checks"
CSCO,2026-04-26,0.9297803370282054,positive,news,"Cisco Systems, Inc. stock (US17275R1023): Is its AI networking edge strong enough to unlock new upsi"
CSCO,2026-04-26,0.9352789334952831,positive,news,"Vanguard Group Inc. Boosts Stock Holdings in Cisco Systems, Inc. $CSCO"
CSCO,2026-04-26,0.9358580308035016,positive,news,"Huntleigh Advisors Inc. Increases Holdings in Cisco Systems, Inc. $CSCO"
CSCO,2026-04-26,0.9398160306736827,positive,news,"Sanctuary Advisors LLC Grows Stake in Cisco Systems, Inc. $CSCO"
CSCO,2026-04-26,-0.7298253551125526,negative,news,"Cisco Systems, Inc. $CSCO Shares Sold by Courier Capital LLC"
CSCO,2026-04-26,0.872999370098114,positive,news,"AEGON ASSET MANAGEMENT UK Plc Sells 36,163 Shares of Cisco Systems, Inc. $CSCO"
CSCO,2026-04-25,0.5985686471685767,positive,news,"Kaltura to Present Agentic Revenue Engagement Platform at Forrester B2B Summit 2026, Showcasing the Shift From Static Content Publishing to Intent-Aware, AI-Powered Buyer Journeys"
CSCO,2026-04-25,0.5200292514637113,positive,news,Cisco Systems’ Quantum Switch Push Puts Networking Giant in Race for the Next Internet
CSCO,2026-04-25,0.8902090266346931,positive,news,Assessing Harmonic (HLIT) Valuation After Recent Share Price Strength And Broadband Growth Expectations
CSCO,2026-04-25,0.9178448189049959,positive,news,Palo Alto Networks Stock Jumps as AI Cyber Fears Become Its Next Big Test
CSCO,2026-04-25,0.9225450679659843,positive,news,"Calix, Inc. Just Beat Analyst Forecasts, And Analysts Have Been Updating Their Predictions"
CSCO,2026-04-25,0.8127505127340555,positive,news,"Cisco Systems, Inc. $CSCO Stock Holdings Increased by Munich Reinsurance Co Stock Corp in Munich"
CSCO,2026-04-25,0.919256703928113,positive,news,Did Extreme’s AI Platform ONE Adoption and TCO Claims Just Shift Extreme Networks' (EXTR) Investment Narrative?
CSCO,2026-04-25,0.8335621133446693,positive,news,Extreme Networks (NASDAQ:EXTR) Downgraded to Buy Rating by Wall Street Zen
CSCO,2026-04-25,-0.15986844897270203,neutral,news,Justices To Focus On Alien Tort Statute In Cisco Spying Case
CSCO,2026-04-25,0.8113442976027727,positive,news,Semtech Acquires HieFo Corp. for $34M
CSCO,2026-04-24,0.9323429614305496,positive,news,Extreme Networks Platform ONE Adoption Highlights AI Automation And Cost Focus
CSCO,2026-04-24,0.33142008259892464,neutral,news,VoIP analytics transforms call data into business insights
CSCO,2026-04-24,-0.18664748966693878,neutral,news,5 clues your network has shadow AI
CSCO,2026-04-24,0.9283530469983816,positive,news,Cisco Systems (CSCO): Can It Hit Trillion Dollar Milestone?
CSCO,2026-04-24,0.31781234219670296,neutral,news,"Kaltura to Present Agentic Revenue Engagement Platform at Forrester B2B Summit 2026, Showcasing the Shift From Static Content Publishing to Intent-Aware, AI-Powered Buyer Journeys"
CSCO,2026-04-24,0.5051243100315332,positive,news,"Kaltura to Present Agentic Revenue Engagement Platform at Forrester B2B Summit 2026, Showcasing the Shift From Static Content Publishing to Intent-Aware, AI-Powered Buyer Journeys"
CSCO,2026-04-24,0.9350823760032654,positive,news,"Quent Long Short Global Small Cap Fund LP Takes $1.94 Million Position in Cisco Systems, Inc. $CSCO"
CSCO,2026-04-24,0.9195270538330078,positive,news,"Dan Ives Compares Intel's Comeback To Rocky Balboa, Says AI Trade Is In Its Third Innings"
CSCO,2026-04-24,0.9342132396996021,positive,news,"Diversified Enterprises LLC Acquires 11,657 Shares of Cisco Systems, Inc. $CSCO"
CSCO,2026-04-24,0.3053150102496147,neutral,news,"Kaltura to Present Agentic Revenue Engagement Platform at Forrester B2B Summit 2026, Showcasing the Shift From Static Content Publishing to Intent-Aware, AI-Powered Buyer Journeys"
CSCO,2026-04-24,0.9419244835153222,positive,news,Arista Networks (ANET) Is Up 7.2% After AI Data Center Demand Tightens Ethernet Switch Supply
CSCO,2026-04-23,0.9341372828930616,positive,news,"You’ve Never Heard of This 1 ETF, and It Keeps Crushing the SPY"
CSCO,2026-04-23,0.9004005044698715,positive,news,Cisco Cashes in on AI Order Momentum: More Upside Ahead in 2026?
CSCO,2026-04-23,-0.9595373887568712,negative,news,Cisco Systems Inc. stock outperforms competitors despite losses on the day
CSCO,2026-04-23,0.5444625532254577,positive,news,"Cisco Introduces Universal Quantum Switch, Advancing the Path to a Quantum Network"
CSCO,2026-04-23,0.30474228598177433,neutral,news,"Prioritizing Security, Privacy, and Trust in the AI Era | Cisco FY25 Purpose Report"
CSCO,2026-04-23,0.17960212007164955,neutral,news,"Prioritizing Security, Privacy, and Trust in the AI Era | Cisco FY25 Purpose Report"
CSCO,2026-04-23,0.2903465637937188,neutral,news,"Cisco Introduces Universal Quantum Switch, Advancing the Path to a Quantum Network"
CSCO,2026-04-23,0.4978508744388819,positive,news,"Cisco Introduces Universal Quantum Switch, Advancing the Path to a Quantum Network"
CSCO,2026-04-23,0.5561903417110443,positive,news,Cisco unveils universal switch for the quantum networking era
CSCO,2026-04-23,0.4825598392635584,neutral,news,"Cisco Introduces Universal Quantum Switch, Advancing the Path to a Quantum Network"
CSCO,2026-04-23,-0.6681619957089424,negative,news,Motorola Solutions (NYSE:MSI) - Stock Analysis
CSCO,2026-04-23,-0.47252586483955383,negative,news,"PFG Advisors Has $1.96 Million Position in Cisco Systems, Inc. $CSCO"
CSCO,2026-04-23,0.696673721075058,positive,news,F5 (FFIV) Valuation Check As Recurring Software Revenue And Margins Shape The Story
CSCO,2026-04-23,0.9373724618926644,positive,news,"Cisco Systems, Inc. $CSCO Shares Acquired by B. Metzler seel. Sohn & Co. AG"
QCOM,2026-04-27,0.45522827561944723,neutral,news,"OpenAI Eyes 'AI Agent' Smartphone With Qualcomm And MediaTek, Targets App-Free Experience By 2028: Report"
QCOM,2026-04-27,0.9350879266858101,positive,news,"D.A. Davidson & CO. Buys 10,697 Shares of Qualcomm Incorporated $QCOM"
QCOM,2026-04-27,-0.8318729475140572,negative,news,Ashton Thomas Private Wealth LLC Has $7.82 Million Holdings in Qualcomm Incorporated $QCOM
QCOM,2026-04-26,0.11103928461670876,neutral,news,"Autonomous & Self-Driving Vehicle News Tesla, Pony.ai, NVIDIA, Moia, Beep, Innoviz, SiMa.ai, Hesai, Karsan, WeRide, PlusAI, Arbe & Zoox. | auto connected car news"
QCOM,2026-04-26,0.9085562154650688,positive,news,Silicon Motion (SIMO) Stock Jumps 8% as Investors Bet on AI Storage
QCOM,2026-04-26,0.9176595620810986,positive,news,"Chery, Qualcomm Sign Agreement to Expand Cooperation"
QCOM,2026-04-26,0.9374963752925396,positive,news,PagerDuty Surges As Activist Investor Rumors Swirl
QCOM,2026-04-26,-0.8597753271460533,negative,news,"Verdence Capital Advisors LLC Sells 24,823 Shares of Qualcomm Incorporated $QCOM"
QCOM,2026-04-26,0.45796583592891693,positive,news,"Huntleigh Advisors Inc. Purchases 18,164 Shares of Qualcomm Incorporated $QCOM"
QCOM,2026-04-26,-0.23081400990486145,negative,news,"Capital Investment Services of America Inc. Sells 5,563 Shares of Qualcomm Incorporated $QCOM"
QCOM,2026-04-26,0.9334899876266718,positive,news,AEGON ASSET MANAGEMENT UK Plc Makes New $51.35 Million Investment in Qualcomm Incorporated $QCOM
QCOM,2026-04-26,0.933582067489624,positive,news,Advisors Capital Management LLC Boosts Position in Qualcomm Incorporated $QCOM
QCOM,2026-04-26,-0.7969224601984024,negative,news,Assessing Datavault AI (DVLT) Valuation After Its Name Change And Recent Share Price Recovery
QCOM,2026-04-25,0.03834092617034912,positive,news,Qualcomm Q2 Earnings Preview: AI Optionality Is Back In Focus
QCOM,2026-04-25,-0.0005273707211017609,neutral,news,How Will PACCAR Stock React To Its Upcoming Earnings?
QCOM,2026-04-25,0.9213327020406723,positive,news,"Concurrent Investment Advisors LLC Purchases 35,166 Shares of Qualcomm Incorporated $QCOM"
QCOM,2026-04-24,0.9366805404424667,positive,news,"Nvidia stock closes at record, pushing market cap past $5 trillion"
QCOM,2026-04-24,0.9347596205770969,positive,news,"Lattice Semiconductor (LSCC) Stock Is Up, What You Need To Know"
QCOM,2026-04-24,0.9316655807197094,positive,news,"Power Integrations and Teradyne Stocks Trade Up, What You Need To Know"
QCOM,2026-04-24,0.9332298450171947,positive,news,"Applied Materials and Photronics Stocks Trade Up, What You Need To Know"
QCOM,2026-04-24,0.9365399517118931,positive,news,"Lattice Semiconductor (LSCC) Stock Is Up, What You Need To Know"
QCOM,2026-04-24,-0.9624314615502954,negative,news,Why Is HCA Healthcare Stock Tanking Friday? - HCA Healthcare (NYSE:HCA)
QCOM,2026-04-24,0.8776019560173154,positive,news,Magnachip Launches 8th-generation Ultra Low-Rss(on) 12V BatteryFET Designed for Smartphone Battery Power Efficiency
QCOM,2026-04-24,0.9340100418776274,positive,news,"Applied Materials and Photronics Stocks Trade Up, What You Need To Know"
QCOM,2026-04-24,0.9302990343421698,positive,news,"Amtech and Penguin Solutions Shares Skyrocket, What You Need To Know"
QCOM,2026-04-24,0.5681096911430359,positive,news,Ceva’s 5G NTN Modem IP Could Democratize Modems for Satellite Terminals
QCOM,2026-04-24,0.9319733399897814,positive,news,"Allegro MicroSystems and Monolithic Power Systems Shares Skyrocket, What You Need To Know"
QCOM,2026-04-24,0.9243993945419788,positive,news,Synopsys Stock Climbs As TSMC And NASA Deals Spotlight AI Edge
QCOM,2026-04-24,0.7753775492310524,positive,news,"Nasdaq 100 Marks Fresh Records, Intel Jumps 23% On AI Chip Mania: Stock Market Today"
QCOM,2026-04-24,0.4583921432495117,positive,news,Qualcomm Inc. stock outperforms competitors on strong trading day
QCOM,2026-04-24,-0.9595013363286853,negative,news,IBRX Stock Slides As FDA Warning Letter Sparks Class Actions
QCOM,2026-04-24,0.06124657578766346,neutral,news,"Steel Dynamics Insider Sold Shares Worth $1,088,428, According to a Recent SEC Filing"
QCOM,2026-04-24,0.9371770098805428,positive,news,Qualcomm Inc Stock (QCOM) Moved Up by 7.81% on Apr 24: What Investors Need To Know
QCOM,2026-04-24,0.5574701633304358,positive,news,Ceva’s 5G NTN Modem IP Could Democratize Modems for Satellite Terminals
QCOM,2026-04-24,-0.8365849032998085,negative,news,"Amkor's Near-Term Outlook Makes The Stock A Hold - Apple (NASDAQ:AAPL), Amkor Technology (NASDAQ:AMKR)"
QCOM,2026-04-24,0.9336893130093813,positive,news,MaxLinear Stock Jumps 67% as AI Data-Center Demand Powers Outlook
QCOM,2026-04-24,0.9195231683552265,positive,news,Synopsys Stock Turns Back Toward AI Chip Race After New TSMC Design Push
QCOM,2026-04-24,0.9291726648807526,positive,news,Qualcomm Stock Is Climbing In Sympathy With Intel's Q1 Results
QCOM,2026-04-24,0.9342361744493246,positive,news,"World Investment Advisors Acquires 8,130 Shares of Qualcomm Incorporated $QCOM"
QCOM,2026-04-24,0.10156026482582092,positive,news,Is Qualcomm The Next AI Stock To Surge?
QCOM,2026-04-24,0.8380462527275085,positive,news,Will Edison International’s Board Refresh Accelerate Its AI and Digital Ambitions?
QCOM,2026-04-24,-0.01996234804391861,neutral,news,QCML Price History for Graniteshares 2X Long Qcom Daily ETF
QCOM,2026-04-24,0.9284900724887848,positive,news,Arm Holdings (ARM) Valuation Check After AGI CPU Launch And New AI Alliances
QCOM,2026-04-24,0.8429562821984291,positive,news,NBC Securities Inc. Has $3.20 Million Stock Position in Qualcomm Incorporated $QCOM
QCOM,2026-04-24,0.8583512050099671,positive,news,"One software stack, 3 chip platforms: WeRide widens driver-assist reach"
QCOM,2026-04-24,-0.09457167983055115,negative,news,Kerusso Capital Management LLC Boosts Stock Position in Qualcomm Incorporated $QCOM
QCOM,2026-04-24,-0.5913693457841873,negative,news,M&T Bank Corp Grows Position in Robert Half Inc. $RHI
QCOM,2026-04-24,-0.7595171630382538,negative,news,Is Qualcomm’s Dividend Amid Handset Weakness Reframing Its Diversification Story for QCOM Investors?
QCOM,2026-04-23,-0.9658405994996428,negative,news,Qualcomm (NASDAQ:QCOM) Shares Down 1.6% - Time to Sell?
QCOM,2026-04-23,-0.9686745996586978,negative,news,Qualcomm Inc. stock underperforms Thursday when compared to competitors
MCD,2026-04-27,0.299409843981266,neutral,news,McDonald’s to open on Melbourne street once dubbed ‘world’s coolest’ after winning legal challenge
MCD,2026-04-26,0.8908615987747908,positive,news,McDonald’s Corporation (MCD): One of the Best Low Risk High Growth Stocks to Buy
MCD,2026-04-26,0.31698810402303934,neutral,news,Chipotle Mexican Grill stock (US1696561059): Why Google Discover changes matter more now
MCD,2026-04-26,0.8945836769416928,positive,news,McDonald’s Corporation (MCD): One of the Best Low Risk High Growth Stocks to Buy
MCD,2026-04-26,0.03786977380514145,neutral,news,All The Ways The 1960s Filet-O-Fish Differed From The 2026 Version
MCD,2026-04-26,0.06619240809231997,neutral,news,Restaurant Brands takes a new approach to China as a minority joint venture partner
MCD,2026-04-25,-0.0014329086989164352,neutral,news,McDonald's Corporation (MCD) Stock Price Today
MCD,2026-04-25,0.9160747937858105,positive,news,McDonald's Stock 2026 Outlook: Why Wall Street Sees MCD as a Buy With $341 Target
MCD,2026-04-25,-0.9592276941984892,negative,news,"Shareholders of Krispy Kreme Should Contact Faruqi & Faruqi Before July 15, 2025 to Discuss Your Rights - DNUT"
MCD,2026-04-24,0.6995688583701849,positive,news,"McDonald’s ""Best Of Green"" Report Recognizes Environmental Innovations from around the World"
MCD,2026-04-24,0.9331083577126265,positive,news,"Rothschild & Co Redburn Upgrades McDonald’s (MCD), Morgan Stanley Trims PT"
MCD,2026-04-24,-0.14308501221239567,neutral,news,"McDonald’s USA president Erlinger sells $100,805 in stock"
MCD,2026-04-24,0.14196044951677322,neutral,news,The Mexican Fast Food Chain You Can Find Tucked Inside Some Walmart Stores
MCD,2026-04-24,0.9067700300365686,positive,news,Will Pizza Hut’s Strategic Review and Loyalty Push Reshape Yum! Brands’ (YUM) Long‑Term Narrative?
MCD,2026-04-24,-0.9631642149761319,negative,news,McDonald's Corp. stock underperforms Friday when compared to competitors
MCD,2026-04-24,0.43759971857070923,positive,news,A Look At Restaurant Brands International (QSR) Valuation After Earnings Beat And Upgraded Sentiment
MCD,2026-04-24,0.6731336265802383,positive,news,Domino’s Pizza earnings on deck as sales growth concerns mount By Investing.com
MCD,2026-04-24,-0.006760736927390099,neutral,news,"Joseph Erlinger 10b5-1 sales at McDonald's (MCD) include 2,626-share trade"
MCD,2026-04-24,0.5577478557825089,positive,news,Investors Heavily Search McDonald's Corporation (MCD): Here is What You Need to Know
MCD,2026-04-24,-0.9430244099348783,negative,news,A Look At Domino’s Pizza (DPZ) Valuation After Recent Share Price Volatility
MCD,2026-04-24,-0.9555453145876527,negative,news,"McDonald’s USA president Erlinger sells $100,805 in stock By Investing.com"
MCD,2026-04-24,0.562517162412405,positive,news,McDonald's Joins Roundtable on Sustainable Palm Oil
MCD,2026-04-24,0.8406970389187336,positive,news,McDonald's USA Outlines 10-Year Plan for Ending Gestation Stall Use
MCD,2026-04-24,-0.833453981205821,negative,news,Insider Sell: Joseph Erlinger Sells Shares of McDonald's Corp (MCD)
MCD,2026-04-23,0.03564379923045635,neutral,news,Insider Sell: Joseph Erlinger Sells Shares of McDonald's Corp (MCD)
MCD,2026-04-23,-0.5691913217306137,negative,news,"McDonald’s USA president Erlinger sells $100,805 in stock By Investing.com"
MCD,2026-04-23,-0.013972902670502663,neutral,news,McDonald's (MCD) USA president sells 333 shares in open-market trade
MCD,2026-04-23,-0.13251647353172302,negative,news,Is Chipotle Mexican Grill (CMG) Pricing In Too Much Optimism After Recent Share Price Swings
MCD,2026-04-23,0.1219535544514656,neutral,news,"Chicken Tenders, but Make Them Loco"
MCD,2026-04-23,0.918904272839427,positive,news,Rothschild Redburn upgrades McDonald’s stock rating on value reset By Investing.com
MCD,2026-04-22,-0.22125696390867233,neutral,news,"5 Bold, Measurable Predictions for Restaurant Tech"
MCD,2026-04-22,0.6217824863269925,positive,news,"3 reasons I'd invest $5,000 in the iShares S&P 500 IVV ETF"
MCD,2026-04-22,0.9347833301872015,positive,news,Are Papa John’s (PZZA) Deli-Style Sandwiches A Small Menu Tweak Or A Strategic Repositioning?
MCD,2026-04-21,0.254027153365314,neutral,news,Littelfuse names Anne’Marie D’Angelo as chief legal officer
MCD,2026-04-21,0.027772124856710434,neutral,news,McDonald’s appoints Mustafa Husain as U.S. Chief Information Officer
MCD,2026-04-21,0.7047010585665703,positive,news,New PAR Technology Report: Loyalty Members Outspending Anonymous Guests for First Time
MCD,2026-04-21,-0.8648371063172817,negative,news,McDonald’s Q1 profit seen slightly below estimates as Jefferies trims sales outlook
MCD,2026-04-21,-0.8488163538277149,negative,news,McDonald’s Bid to Re-register ‘Extra Value Meal’ Trademark Denied by USPTO
MCD,2026-04-21,0.9266695361584425,positive,news,McDonald's added its most U.S. locations since 2002 last year
MCD,2026-04-21,-0.9675212567672133,negative,news,A Look At Chipotle Mexican Grill’s Valuation As It Rolls Out A Redesigned Loyalty Program
MCD,2026-04-21,0.09446180798113346,neutral,news,McDonald’s appoints Mustafa Husain as U.S. Chief Information Officer
MCD,2026-04-21,0.08401786722242832,neutral,news,Yum! Brands (YUM) Receives a Hold from RBC Capital
MCD,2026-04-21,0.26720657758414745,neutral,news,McDonald's Corporation stock (US5801351017): Is franchise resilience now the real test for steady returns?
MCD,2026-04-21,0.3977435901761055,neutral,news,McDonald's Corporation stock (US5801351017): Is franchise model strength enough to counter rising co
MCD,2026-04-21,0.9184822114184499,positive,news,Yum! Brands Inc. stock (US9884981013): Is its franchise-heavy model resilient enough for steady grow
MCD,2026-04-20,-0.9365475513041019,negative,news,Here's Why McDonald's (MCD) Fell More Than Broader Market
MCD,2026-04-20,-0.9666722314432263,negative,news,McDonald's Corp. stock underperforms Monday when compared to competitors
MCD,2026-04-20,0.904260789975524,positive,news,Chipotle Mexican Grill stock (US1696561059): Is digital ordering strength now the real growth lever?
MCD,2026-04-20,0.9145682398229837,positive,news,Chipotle Mexican Grill stock (US1696561059): Is digital ordering strength now the real growth lever?
MCD,2026-04-20,0.601940237917006,positive,news,McDonald's Corp stock (US5801351017): Is franchise efficiency now the real growth lever?
BAC,2026-04-27,0.6948081403970718,positive,news,Southwest Airlines (NYSE:LUV) Price Target Raised to $47.00 at TD Cowen
BAC,2026-04-27,0.6131555065512657,positive,news,"Barclays Adjusts Price Target on Mid-America Apartment Communities to $137 From $138, Maintains Equalweight Rating"
