ticker,date,sentiment_score,sentiment_label,content_type,title
PFE,2026-02-03,0.9224287606775761,positive,news,Pfizer's experimental drug shows up to 12.3% weight loss in mid-stage trial
PFE,2026-02-03,0.8865046929568052,positive,news,Once-a-month Pfizer obesity shot cuts 12.3% weight in mid-stage trial
PFE,2026-02-03,0.7993591278791428,positive,news,Goldman Sachs Maintains Neutral on Pfizer (PFE) Amid Rising Margin Pressure
PFE,2026-02-03,-0.912445567548275,negative,news,AGF Management Ltd. Lowers Position in Pfizer Inc. $PFE
PFE,2026-02-03,-0.08685246109962463,negative,news,Pfizer Inc. $PFE Shares Sold by Heritage Investors Management Corp
PFE,2026-02-03,-0.11651280522346497,negative,news,Goldman Sachs Maintains Neutral on Pfizer (PFE) Amid Rising Margin Pressure
PFE,2026-02-03,0.8540404196828604,positive,news,"C4 Therapeutics, Inc. (CCCC): A Bull Case Theory"
PFE,2026-02-03,0.9269972257316113,positive,news,Experimental COVID Pill Shows Edge Over Paxlovid as Traws Hits Key Milestones
PFE,2026-02-02,0.9262058474123478,positive,news,Pfizer Reshapes Portfolio With Metsera Deal Novavax Pact And R&D Push
PFE,2026-02-02,0.9187339451164007,positive,news,Pfizer stock (PFE) edges up ahead of Feb. 3 earnings as obesity pricing shifts and RSV dispute draw focus
PFE,2026-02-02,0.2590194521471858,neutral,news,"Achieve Life Sciences, Inc. (ACHV): A Bull Case Theory"
PFE,2026-02-02,-0.009282737970352173,neutral,news,"PepsiCo, AMD, Amgen, and more set to report earnings Tuesday"
PFE,2026-02-02,-0.8921438846737146,negative,news,Sanofi Found In Breach Of UK Pharmaceutical Marketing Code Over Beyfortus Claims
PFE,2026-02-02,-0.9161988440901041,negative,news,UK body raps Sanofi for disparaging Pfizer's RSV jab
PFE,2026-02-02,-0.9438822120428085,negative,news,Pfizer Q4 earnings preview: All eyes on pipeline as blockbusters near patent cliff (PFE:NYSE)
PFE,2026-02-02,0.7422535307705402,positive,news,How Novo Nordisk’s new Wegovy pill is transforming the weight-loss drug market
PFE,2026-02-02,0.2165611032396555,neutral,news,What's in Store for These 5 Pharma Bigwigs This Earnings Season?
PFE,2026-02-02,0.9377445988357067,positive,news,Regeneron Pharmaceuticals (NASDAQ:REGN) Price Target Raised to $800.00
PFE,2026-02-02,-0.6706728562712669,negative,news,H.C. Wainwright Highlight Curative Potential of Legend Biotech Corporation (LEGN)'s Carvykti Despite Sales Miss
PFE,2026-02-02,0.8141912771388888,positive,news,"Should You Buy, Hold, or Sell BMY Stock Ahead of Q4 Earnings?"
PFE,2026-02-02,-0.9077569013461471,negative,news,Sanofi is reprimanded by a U.K. trade group for misleading claims about a Pfizer vaccine
PFE,2026-02-02,-0.2623923122882843,negative,news,UK industry body says Sanofi in breach over RSV therapy claims against Pfizer
PFE,2026-02-02,0.9253814127296209,positive,news,Needle-free allergy rescue for kids wins key EU support
PFE,2026-02-02,-0.6938478499650955,negative,news,Jim Cramer expresses concern about Pfizer despite its “terrific yield”
PFE,2026-02-02,0.9068461302667856,positive,news,"Should You Buy, Hold, or Sell BMY Stock Ahead of Q4 Earnings?"
PFE,2026-02-02,0.9327976014465094,positive,news,"Dermatophytic Onychomycosis Treatment Market Booming with Rapid Growth Through 2033 | Novartis AG, Pfizer Inc"
PFE,2026-02-02,0.9313462525606155,positive,news,Assessing Teva Pharmaceutical Industries’ Valuation After Strong 2025 Earnings And Analyst Upgrades
PFE,2026-02-02,-0.41546788811683655,neutral,news,"Markets Brief: Microsoft Stock Under Pressure, Pharma Earnings and Jobs Report on Deck"
PFE,2026-02-02,0.9338340237736702,positive,news,"Great Lakes Advisors LLC Makes New Investment in Regeneron Pharmaceuticals, Inc. $REGN"
PFE,2026-02-02,0.8775387704372406,positive,news,Jones Financial Companies Lllp Has $78.84 Million Position in Pfizer Inc. $PFE
PFE,2026-02-02,-0.6833527535200119,negative,news,Pfizer Q4 Earnings Preview: Analysts Expect Decline
PFE,2026-02-02,-0.002361401915550232,neutral,news,"PFE Pfizer Inc. (NYSE) Pre-market 02 Feb 2026: Earnings tomorrow, guidance focus"
PFE,2026-02-02,-0.9495612466707826,negative,news,Pfizer Likely To Report Lower Q4 Earnings; These Most Accurate Analysts Revise Forecasts Ahead Of Earnings Call
PFE,2026-02-02,-0.8716987073421478,negative,news,Pfizer (PFE) Q4 2025 Earnings Preview: Revenue Decline Expected - News and Statistics
PFE,2026-02-01,0.8715914059430361,positive,news,Sarepta’s Elevidys Data Reshapes Duchenne Risk Profile For Long-Term Investors
PFE,2026-02-01,0.02191641926765442,neutral,news,Pharming Group receives Complete Response Letter from U.S. FDA for sNDA for Joenja® (leniolisib) in children aged 4 to 11 years with APDS
PFE,2026-02-01,0.2583576776087284,neutral,news,Pharming Group receives Complete Response Letter from U.S. FDA for sNDA for Joenja® (leniolisib) in children aged 4 to 11 years with APDS
PFE,2026-02-01,0.8120467960834503,positive,news,Sarepta’s Elevidys Data Reshapes Duchenne Risk Profile For Long-Term Investors
PFE,2026-02-01,0.8970668241381645,positive,news,AbbVie stock rises into weekend as Feb. 4 earnings loom — what traders watch next
PFE,2026-02-01,0.9213700201362371,positive,news,Pfizer Reshapes Portfolio With Metsera Deal And Obesity Oncology Pivot
CI,2026-02-03,0.505237489938736,positive,news,"(TDG) TransDigm Expects Fiscal 2026 Net Sales Range $9.85B to $10.04B, vs. FactSet Est of $9.93B"
CI,2026-02-03,-0.7938059121370316,negative,news,"UnitedHealth, CVS, Humana Face Double Trouble As Trump's Medicare Cuts Are Just The Start—PBM 'Spread Pricing' Comes Under Fire"
CI,2026-02-02,-0.7857851088047028,negative,news,Will Rising Costs Hit Molina's Q4 Earnings? Key Insights Here
CI,2026-02-02,-0.8713663183152676,negative,news,Will Rising Costs Hit Molina's Q4 Earnings? Key Insights Here
CI,2026-02-02,-0.9606710821390152,negative,news,Morgan Stanley downgrades Humana on Medicare Advantage risks By Investing.com
CI,2026-02-02,-0.9401193354278803,negative,news,Morgan Stanley downgrades Humana on Medicare Advantage risks
CI,2026-02-02,0.6077494574710727,positive,news,"Jefferies Initiates Coverage on Cybin With Buy Rating, CA$29.88 Price Target"
CI,2026-02-02,-0.044176094233989716,neutral,news,"48,000,000 Class A Ordinary Shares of CTW Cayman are subject to a Lock-Up Agreement Ending on 2-FEB-2026."
CI,2026-02-01,0.011079616844654083,neutral,news,Business People: U.S. Bancorp President & CEO Gunjan Kedia to add chair to her titles
CI,2026-01-30,0.8944250252097845,positive,news,"Cincinnati Financial Corporation Declares Regular Quarterly Cash Dividend, Payable on April 15, 2026"
CI,2026-01-30,0.543156374245882,positive,news,"Jefferies Initiates Coverage on enGene With Buy Rating, $28 Price Target"
CI,2026-01-29,-0.9300583153963089,negative,news,Should UnitedHealth’s Medicare Outlook And Restructuring Require Action From Privia Health Group (PRVA) Investors?
CI,2026-01-29,-0.062667116522789,neutral,news,"Hussman Strategic Advisors Inc. Invests $1.41 Million in Healthcare Services Group, Inc. $HCSG"
CI,2026-01-29,0.933153934776783,positive,news,"Takeda Pharmaceutical Fiscal Q3 Core Earnings, Revenue Rise; Full-Year Outlook Updated"
CI,2026-01-28,-0.9565206645056605,negative,news,"US Health Insurer Elevance Health Issues Soft Outlook, Lower Premium Forecast For 2026"
CI,2026-01-28,-0.9588276436552405,negative,news,Insurers Brace For Extended 'Managed Retreat' Following 2027 MA Proposal (NYSEARCA:IHF)
CI,2026-01-28,0.8984632063657045,positive,news,Elevance Health (ELV) Deep-Dive: Navigating the 2026 Regulatory Storm and the Carelon Transformation
CI,2026-01-28,0.0489959754049778,neutral,news,"Alliance Resource Partners Keeps Quarterly Dividend at $0.60 per Share, Payable Feb. 13 to Holders of Record on Feb. 6"
CI,2026-01-27,-0.9582393057644367,negative,news,Why Alignment Healthcare (ALHC) Stock Is Falling Today
CI,2026-01-27,-0.9622001117095351,negative,news,Why Humana (HUM) Stock Is Falling Today
CI,2026-01-27,-0.6289857476949692,negative,news,Is It Time To Reassess CVS Health (CVS) After Its 55% One Year Share Price Rise
CI,2026-01-27,-0.7501043453812599,negative,news,CVS Health stock price target lowered to $95 by BofA on CMS rate proposal
CI,2026-01-26,-0.12266215682029724,negative,news,UnitedHealth Is Set to Report Earnings. What Wall Street Can Expect.
CI,2026-01-26,-0.8138209283351898,negative,news,"Simplicity Wealth LLC Reduces Position in Elevance Health, Inc. $ELV"
CI,2026-01-25,-0.8361046463251114,negative,news,Baird Calls UnitedHealth Group Incorporated (UNH)’s ACA Rebate a Strategic Move With Broader Industry Implications
CI,2026-01-25,-0.8420713096857071,negative,news,Baird Calls UnitedHealth Group Incorporated (UNH)'s ACA Rebate a Strategic Move With Broader Industry Implications
CI,2026-01-25,-0.5395626425743103,negative,news,Apple Inc. $AAPL Shares Sold by Cigna Investments Inc. New
CI,2026-01-24,0.8365221694111824,positive,news,Healthcare Services Group (NASDAQ:HCSG) Rating Lowered to Buy at Wall Street Zen
CI,2026-01-23,-0.8280508331954479,negative,news,Will Intensified PBM Antitrust Scrutiny Change CVS Health's (CVS) Vertically Integrated Pricing Narrative?
CI,2026-01-23,0.471842372789979,neutral,news,Winter storm incoming: CVS offers 10-day refills and crisis support
CI,2026-01-23,-0.8582350369542837,negative,news,Insurance CEO hearings: Takeaways from a long day on Capitol Hill
CI,2026-01-23,0.2482758155092597,neutral,news,Humana Inc Is Suddenly Everywhere – But Is HUM Stock Actually Worth Your Money?
CI,2026-01-22,-0.896073704585433,negative,news,"Congress grills UnitedHealth CEO Stephen Hemsley on claim denials, insurance costs"
CI,2026-01-22,0.3759846230968833,neutral,news,The Truth About ICHRAs: Busting 5 Myths Holding Employers Back
CI,2026-01-22,0.9119950300082564,positive,news,"Omada Health (NASDAQ:OMDA) Earns ""Buy"" Rating from Needham & Company LLC"
CI,2026-01-22,0.9234556164592505,positive,news,"CVS Health details prior auth cuts, drug savings push | CVS Stock News"
CI,2026-01-22,0.7722002109512687,positive,news,UnitedHealth promises to return ObamaCare profits to customers
CI,2026-01-22,0.11637432035058737,neutral,news,Burford Capital Ltd Appoints Elizabeth J. Shin as Senior Vice President and Head of Korea
CI,2026-01-21,-0.932015847414732,negative,news,"Judge Tosses Drug Pricing Conspiracy Case Against CVS, UnitedHealth, Evernorth"
CI,2026-01-21,0.1463429182767868,neutral,news,UnitedHealth CEO vows to rebate Obamacare profits to customers
CI,2026-01-21,0.7636162517592311,positive,news,Improving postpartum care with mobile Women & Infants Hospital
CI,2026-01-21,0.930331788957119,positive,news,UnitedHealth to offer rebates to its Obamacare customers
CI,2026-01-21,-0.004343925043940544,neutral,news,Qualcomm Schedules First Quarter Fiscal 2026 Earnings Release and Conference Call
CI,2026-01-21,0.7093883752822876,positive,news,UnitedHealth CEO Hemsley says insurer will rebate ACA profits to consumers
CI,2026-01-21,0.8872209619730711,positive,news,Is Cigna Group (CI) Pricing Look Anomaly After Mixed Returns And DCF Signal?
CI,2026-01-21,-0.8662064857780933,negative,news,Is Cigna Group (CI) Pricing Look Anomaly After Mixed Returns And DCF Signal?
CI,2026-01-20,0.13958223909139633,neutral,news,"Trinseo PLC Appoints Carol Flaton and Jill Frizzley as Independent Directors to Board, Effective January 16, 2026"
CI,2026-01-19,0.3293909430503845,positive,news,UnitedHealth stock back in focus: Bernstein sticks with $444 target as UNH earnings near
CI,2026-01-18,-0.967703920789063,negative,news,UnitedHealth stock price falls into holiday-short week as Trump health plan raises stakes for UNH earnings
CI,2026-01-16,0.01662149280309677,neutral,news,"Trump Unveils 'Great Healthcare Plan,' Takes Aim At PBM 'Kickbacks'"
HON,2026-02-03,0.10323357582092285,positive,news,Principal Financial Group Inc. Decreases Holdings in Honeywell International Inc. $HON
HON,2026-02-03,0.9139332128688693,positive,news,Honeywell Expands IntuVue RDR-7000 Radar Capabilities
HON,2026-02-02,0.6259661316871643,positive,news,A Look At Honeywell (HON) Valuation After Q4 Earnings Beat And Record Backlog Update
HON,2026-02-02,0.083436144515872,neutral,news,Honeywell Faces Bid For Fee Advancement In Russia Case
HON,2026-02-02,-0.4260527044534683,neutral,news,Honeywell Faces Bid For Fee Advancement In Russia Case
HON,2026-02-02,0.8466685488820076,positive,news,"Top Stock Reports for Exxon Mobil, Lockheed Martin & Honeywell"
HON,2026-02-02,0.2788576865568757,neutral,news,"Top Stock Reports for Exxon Mobil, Lockheed Martin & Honeywell"
HON,2026-02-02,0.8982709385454655,positive,news,Jim Cramer is enthusiastic about Honeywell’s (HON) quantum spinoff
HON,2026-02-02,0.9309833142906427,positive,news,Rothschild & Co Redburn Issues Positive Forecast for Honeywell International (NASDAQ:HON) Stock Price
HON,2026-02-02,0.8242820925079286,positive,news,Honeywell eyes Asia with SkyShot uncrewed fighter engine launch
HON,2026-02-02,0.9230583366006613,positive,news,"Rothschild & Co Redburn Adjusts Price Target on Honeywell International to $235 From $222, Maintains Neutral Rating"
HON,2026-02-02,0.8934147451072931,positive,news,Pratt & Whitey's Eagle Services Asia Engine MRO Leverages Automation
HON,2026-02-01,0.8780037169344723,positive,news,Honeywell Aerospace Eyes Expanding Asia-Pacific Defense Market
HON,2026-02-01,0.8456986732780933,positive,news,Honeywell Collaborates With Kortech To Automate Infrastructure Projects Across Middle East And North Africa
HON,2026-02-01,0.914281852543354,positive,news,Y Intercept Hong Kong Ltd Takes Position in GE HealthCare Technologies Inc. $GEHC
HON,2026-02-01,0.9227575622498989,positive,news,Thrivent Financial for Lutherans Raises Stock Holdings in Honeywell International Inc. $HON
HON,2026-02-01,-0.263277143239975,negative,news,Great Lakes Advisors LLC Has $1.90 Million Stock Position in Honeywell International Inc. $HON
HON,2026-01-31,-0.9230831433087587,negative,news,Keybank National Association OH Has $68.01 Million Holdings in GE HealthCare Technologies Inc. $GEHC
HON,2026-01-31,0.7835834352299571,positive,news,Jim Cramer Is Enthusiastic About Honeywell's (HON) Quantum Spinoff
HON,2026-01-31,0.7127373330295086,positive,news,Fortive Corp. Stock Is Quietly Going Off – Is This Sleeper Tech Play Actually Worth Your Money?
HON,2026-01-31,0.9159240145236254,positive,news,3M Reshapes Portfolio With Divestiture Review And Footprint Cuts
HON,2026-01-31,0.9306557048112154,positive,news,Private Wealth Partners LLC Raises Stake in Honeywell International Inc. $HON
HON,2026-01-31,-0.923968767747283,negative,news,"Keybank National Association OH Sells 6,955 Shares of Honeywell International Inc. $HON"
HON,2026-01-30,0.9103398900479078,positive,news,JP Morgan Raises Price Target for Honeywell Intl (HON) to $260
HON,2026-01-30,0.929850060492754,positive,news,JPMorgan Chase & Co. Raises Honeywell International (NASDAQ:HON) Price Target to $260.00
HON,2026-01-30,-0.6685417760163546,negative,news,DOL warns pro-plaintiff ruling in Honeywell case could threaten 401(k) matches
HON,2026-01-30,0.600214347243309,positive,news,"Honeywell Q4 2025 Results: Profit Beat, Revenue Miss, 2026 Outlook - News and Statistics"
HON,2026-01-30,-0.6230773106217384,negative,news,"Analysts Have Conflicting Sentiments on These Industrial Goods Companies: ManpowerGroup (MAN), Honeywell International (HON) and GE Vernova Inc. (GEV)"
HON,2026-01-30,0.9347592182457447,positive,news,Honeywell Q4 Earnings Review: Margin Expansion Is Just Beginning (NASDAQ:HON)
HON,2026-01-30,0.9270473569631577,positive,news,Honeywell’s Margin Expansion Play: What the Bears Are Missing
HON,2026-01-30,0.930222230963409,positive,news,Honeywell International Inc. (NASDAQ:HON) Q4 2025 Earnings Call Transcript
HON,2026-01-30,0.9319698568433523,positive,news,"TD Waterhouse Canada Inc. Buys 6,452 Shares of Honeywell International Inc. $HON"
HON,2026-01-30,0.926547659561038,positive,news,Honeywell stock price steadies premarket after earnings beat and faster aerospace spin-off plan
HON,2026-01-30,0.9253695830702782,positive,news,"AlphaQuest LLC Acquires 5,866 Shares of Honeywell International Inc. $HON"
HON,2026-01-30,0.8563991971313953,positive,news,"AE Wealth Management LLC Purchases 14,216 Shares of Honeywell International Inc. $HON"
HON,2026-01-30,0.8084774035960436,positive,news,Honeywell outlines 6–9% EPS growth target for 2026 as portfolio transformation accelerates
HON,2026-01-30,0.9310087654739618,positive,news,Toyota keeps title as top carmaker with record sales in 2025
HON,2026-01-29,0.8951271325349808,positive,news,Honeywell International Q4 Earnings Call Highlights
HON,2026-01-29,0.9011474307626486,positive,news,Honeywell's Bifurcated Segment-Level Performance Is a Product of Vastly Different End Markets
HON,2026-01-29,0.9254087377339602,positive,news,Why Honeywell (HON) Stock Is Up Today
HON,2026-01-29,0.9033644292503595,positive,news,JPMorgan Turns More Constructive on Honeywell (HON) in 2026 Outlook
HON,2026-01-29,0.8644785322248936,positive,news,JPMorgan turns more constructive on Honeywell (HON) in 2026 outlook
HON,2026-01-29,0.9280649572610855,positive,news,"HON's Q4 Earnings Top Estimates, Aerospace Technologies Sales Up Y/Y"
HON,2026-01-29,0.9361006058752537,positive,news,"Caterpillar stock rises on revenue and earnings beats, demand for power-generation equipment"
HON,2026-01-29,-0.6697454676032066,negative,news,Woodward Exit From China Gas Trucks Refocuses Industrial Segment Priorities
HON,2026-01-29,0.9308598898351192,positive,news,"Honeywell beats estimates as orders rise, aerospace spin-off timeline moves up (HON:NASDAQ)"
HON,2026-01-29,0.9305864619091153,positive,news,Honeywell (HON) Schedules Investor Day Focusing on Aerospace and Automation in June
HON,2026-01-29,0.9286001026630402,positive,news,Honeywell guidance tops estimates as aerospace separation looms
HON,2026-01-29,0.8687256528064609,positive,news,Honeywell (HON) Anticipates Aerospace Division Separation by Q3
HON,2026-01-29,0.935423944145441,positive,news,Mirae Asset Global Investments Co. Ltd. Increases Stock Position in Honeywell International Inc. $HON
EMR,2026-02-03,-0.9286279510706663,negative,news,Emerson Electric Co. $EMR Shares Sold by Principal Financial Group Inc.
EMR,2026-02-03,0.9395532738417387,positive,news,EnerSys (ENS) Reports Q4: Everything You Need To Know Ahead Of Earnings
EMR,2026-02-03,0.9129396490752697,positive,news,Timken (TKR) Reports Earnings Tomorrow: What To Expect
EMR,2026-02-03,0.9344415497034788,positive,news,A Look At Acuity Brands (AYI) Valuation After A 17% Dividend Increase
EMR,2026-02-02,0.42305800318717957,positive,news,"Summit Global Investments Sells 57,333 Shares of Emerson Electric Co. $EMR"
EMR,2026-02-02,-0.8700402118265629,negative,news,Allied Investment Advisors LLC Decreases Position in Emerson Electric Co. $EMR
EMR,2026-02-02,0.9339532386511564,positive,news,Emerson Electric (EMR) Reports Earnings Tomorrow: What To Expect
EMR,2026-02-02,0.8511071503162384,positive,news,Emerson Electric (EMR) Reports Earnings Tomorrow: What To Expect
EMR,2026-02-02,0.3843751549720764,positive,news,Emerson Electric (EMR) Set to Announce Earnings Tomorrow: Here’s What You Should Know
EMR,2026-02-01,-0.5770685225725174,negative,news,"Knights of Columbus Asset Advisors LLC Sells 11,359 Shares of Emerson Electric Co. $EMR"
EMR,2026-02-01,-0.14322122931480408,negative,news,Is Emerson Electric (EMR) Price Justified After 8% Monthly Gain And DCF Upside Potential
EMR,2026-02-01,-0.8683589659631252,negative,news,Federated Hermes Inc. Cuts Position in Emerson Electric Co. $EMR
EMR,2026-02-01,-0.7243917882442474,negative,news,What Recent Gains Mean For Emerson Electric (EMR) Valuation Versus Cash Flow Estimates
EMR,2026-02-01,0.04338638857007027,neutral,news,What Recent Gains Mean For Emerson Electric (EMR) Valuation Versus Cash Flow Estimates
EMR,2026-01-31,-0.26374123990535736,neutral,news,Is Generac Holdings (GNRC) Still Attractive After Recent Share Price Rebound?
EMR,2026-01-31,0.6401111632585526,positive,news,Emerson Electric Co. $EMR Shares Purchased by Mirae Asset Global Investments Co. Ltd.
EMR,2026-01-31,0.9408153239637613,positive,news,Keybank National Association OH Grows Stock Holdings in Emerson Electric Co. $EMR
EMR,2026-01-31,-0.7305583655834198,negative,news,Emerson Electric (EMR) Reports Earnings Tomorrow: What To Expect
EMR,2026-01-31,0.08054057415574789,neutral,news,How Emerson Electric Company (EMR) Affects Rotational Strategy Timing
EMR,2026-01-30,0.9198549576103687,positive,news,Emerson Gears Up to Report Q1 Earnings: Here's What to Expect
EMR,2026-01-30,0.5062028616666794,positive,news,"New York State Common Retirement Fund Sells 42,500 Shares of Emerson Electric Co. $EMR"
EMR,2026-01-30,0.8855404490604997,positive,news,Cryogenic Equipment Market By Top Trending Companies- Linde plc
EMR,2026-01-30,-0.8706715553998947,negative,news,Emerson Electric stock hits all-time high at 151.85 USD By Investing.com
EMR,2026-01-30,0.8124183099716902,positive,news,Emerson Electric (EMR) Gains As Market Dips: What You Should Know
EMR,2026-01-30,0.8714300058782101,positive,news,Why the Market Dipped But DXP Enterprises (DXPE) Gained Today
EMR,2026-01-29,-0.930875675752759,negative,news,Emerson Electric stock hits all-time high at 151.85 USD
EMR,2026-01-29,0.8456283435225487,positive,news,Assessing Emerson Electric (EMR) Valuation After Oppenheimer Downgrade And Cautious Growth Outlook
EMR,2026-01-29,-0.8352637812495232,negative,news,Strategic Advisors LLC Reduces Stock Holdings in Emerson Electric Co. $EMR
EMR,2026-01-29,0.9305215924978256,positive,news,Fidelis Capital Partners LLC Increases Stock Holdings in Emerson Electric Co. $EMR
EMR,2026-01-29,0.9385239109396935,positive,news,Bank of New York Mellon Corp Boosts Stake in Emerson Electric Co. $EMR
EMR,2026-01-28,0.9129044283181429,positive,news,"Truist Financial Corp Acquires 59,821 Shares of Emerson Electric Co. $EMR"
EMR,2026-01-28,0.9364553494378924,positive,news,Little House Capital LLC Makes New Investment in Emerson Electric Co. $EMR
EMR,2026-01-28,0.593470111489296,positive,news,"$14.68 Billion Power and Hand Tools Market Outlook, 2030 Featuring Bosch, Danaher Corp., Stanley Black & Decker, Atlas Copco, Emerson Electric and More"
EMR,2026-01-28,-0.3119209110736847,negative,news,Will Oppenheimer's Downgrade and Rising Short Interest Change Emerson Electric's (EMR) Narrative?
EMR,2026-01-28,-0.024638652801513672,neutral,news,Will Oppenheimer's Downgrade and Rising Short Interest Change Emerson Electric's (EMR) Narrative?
EMR,2026-01-28,0.13746745139360428,neutral,news,"$14.68 Billion Power and Hand Tools Market Outlook, 2030"
EMR,2026-01-28,0.3235655529424548,neutral,news,"$14.68 Billion Power and Hand Tools Market Outlook, 2030 Featuring Bosch, Danaher Corp., Stanley Black & Decker, Atlas Copco, Emerson Electric and More"
EMR,2026-01-27,-0.027733534574508667,negative,news,Eaton (ETN) Earnings Expected to Grow: Should You Buy?
EMR,2026-01-27,0.9054331220686436,positive,news,"Emerson, Ametek downgraded at Oppenheimer; Grainger, TE Connectivity upgraded (EMR:NYSE)"
EMR,2026-01-27,-0.8928131777793169,negative,news,This Emerson Electric Analyst Is No Longer Bullish; Here Are Top 5 Downgrades For Tuesday
EMR,2026-01-27,0.9211801718920469,positive,news,Emerson Electric (EMR) Expected to Announce Quarterly Earnings on Tuesday
EMR,2026-01-26,-0.4360073506832123,negative,news,Q3 Earnings Roundup: Vontier (NYSE:VNT) And The Rest Of The Internet of Things Segment
EMR,2026-01-26,0.9305256325751543,positive,news,National Wealth Management Group LLC Takes Position in Emerson Electric Co. $EMR
EMR,2026-01-26,0.925310991704464,positive,news,Mitsubishi UFJ Trust & Banking Corp Has $35.91 Million Stock Position in Emerson Electric Co. $EMR
EMR,2026-01-26,0.9330774331465364,positive,news,Emerson Electric Co. $EMR Shares Purchased by UniSuper Management Pty Ltd
EMR,2026-01-25,0.2480478286743164,positive,news,"Newport Trust Company LLC Sells 128,097 Shares of Emerson Electric Co. $EMR"
EMR,2026-01-25,-0.8931629545986652,negative,news,Emerson Electric Co. $EMR Shares Sold by Resona Asset Management Co. Ltd.
EMR,2026-01-25,-0.9596669338643551,negative,news,Emerson Electric Co. $EMR Shares Sold by Teacher Retirement System of Texas
EMR,2026-01-25,0.03141897916793823,positive,news,"Simplicity Wealth LLC Sells 16,575 Shares of Emerson Electric Co. $EMR"
EMR,2026-01-25,0.8426486849784851,positive,news,Emerson Electric Stock Balances Industrial Grit With AI Ambition As Wall Street Stays Cautiously Bul
EOG,2026-02-03,-0.9344014041125774,negative,news,"EOG Resources, Inc. (EOG) Resources Hit by Downgrade, Eyes Utica Upside"
EOG,2026-02-03,0.27531883120536804,positive,news,EOG Resources (EOG) outlook adjusted as RBC trims 2026 oil assumptions
EOG,2026-02-03,-0.9613033486530185,negative,news,EOG Resources (EOG) Outlook Adjusted as RBC Trims 2026 Oil Assumptions
EOG,2026-02-02,-0.8745509348809719,negative,news,Liberty Energy Inc. SEC 10-K Report
EOG,2026-02-02,-0.9353831075131893,negative,news,Mesa Royalty Trust: Quiet Royalty Play Tests Investors’ Patience As Oil Sentiment Softens
EOG,2026-02-02,0.5853001624345779,positive,news,Are Wall Street Analysts Predicting EOG Resources Stock Will Climb or Sink?
EOG,2026-02-02,0.8728929236531258,positive,news,Are Wall Street Analysts Predicting EOG Resources Stock Will Climb or Sink?
EOG,2026-02-02,-0.39160245656967163,negative,news,"Principal Financial Group Inc. Has $205.38 Million Position in EOG Resources, Inc. $EOG"
EOG,2026-02-02,-0.9252191092818975,negative,news,"Yacktman Asset Management LP Sells 40,624 Shares of EOG Resources, Inc. $EOG"
EOG,2026-02-02,0.936765443533659,positive,news,"EOG Resources, Inc. $EOG Shares Purchased by Mediolanum International Funds Ltd"
EOG,2026-02-02,0.4951002271845937,positive,news,Ovintiv Appoints Gregory P. Hill To Board of Directors
EOG,2026-02-01,0.9367623785510659,positive,news,"National Pension Service Grows Position in EOG Resources, Inc. $EOG"
