ticker,date,sentiment_score,sentiment_label,content_type,title
PEP,2026-04-25,0.00546417199075222,neutral,news,A1839D Bond Analysis — Key Metrics
PEP,2026-04-25,0.8046208135783672,positive,news,Coca-Cola Stock Faces a Big Week as World Cup Push Meets Earnings Test
PEP,2026-04-25,-0.1681917905807495,neutral,news,Hershey rethinks cocoa sourcing as price shocks reshape what 'chocolate' even means
PEP,2026-04-25,0.18934082984924316,positive,news,"M&T Bank Corp Trims Stock Position in PepsiCo, Inc. $PEP"
PEP,2026-04-25,-0.9272155240178108,negative,news,"Calamos Advisors LLC Cuts Stock Holdings in PepsiCo, Inc. $PEP"
PEP,2026-04-24,0.9375582337379456,positive,news,"Barclays Raises PepsiCo (PEP) PT, Says Volume Recovery is Finally Showing"
PEP,2026-04-24,0.9406649647280574,positive,news,"Is PepsiCo, Inc. (PEP) A Good Stock To Buy Now?"
PEP,2026-04-24,0.921544773504138,positive,news,PepsiCo Inc. (PEP): Fortress for Capital Preservation Amid Geopolitical Instability
PEP,2026-04-24,0.8816657559946179,positive,news,Mesa Welcomes New Swire Coca-Cola Facility
PEP,2026-04-24,0.10760646592825651,neutral,news,Big Food Companies Revamp to Keep Up With Newcomers
PEP,2026-04-24,0.9157562535256147,positive,news,"Kerusso Capital Management LLC Has $4.72 Million Stock Holdings in PepsiCo, Inc. $PEP"
PEP,2026-04-24,-0.9038773160427809,negative,news,"Absher Wealth Management LLC Has $36.42 Million Stock Holdings in PepsiCo, Inc. $PEP"
PEP,2026-04-24,-0.9001871719956398,negative,news,"Arizona State Retirement System Decreases Stake in PepsiCo, Inc. $PEP"
PEP,2026-04-23,0.9277249481528997,positive,news,Altria Group Inc Stock (MO) Closed Up by 3.04% on Apr 23: What Investors Need To Know
PEP,2026-04-23,0.20522199757397175,neutral,news,PepsiCo (PEP) Proxy filing Summary
PEP,2026-04-23,0.9207008853554726,positive,news,Yummy No More! Yum! Brands Stock (YUM) Rises on Plan to Sell Pizza Hut
PEP,2026-04-23,-0.9674776219762862,negative,news,PepsiCo (PEP) Q1 2025 earnings summary
PEP,2026-04-23,0.8566971058025956,positive,news,PepsiCo expands Quaker portfolio with Protein Rice Crisps
PEP,2026-04-23,0.9281522929668427,positive,news,Why is Coca-Cola stock gaining today?
PEP,2026-04-23,0.9255968909710646,positive,news,"Torray Investment Partners LLC Purchases 13,051 Shares of PepsiCo, Inc. $PEP"
PEP,2026-04-23,0.9309554975479841,positive,news,"Teacher Retirement System of Texas Has $70.73 Million Stock Holdings in PepsiCo, Inc. $PEP"
PEP,2026-04-23,0.7834941186010838,positive,news,"Juno Financial Group LLC Purchases New Shares in PepsiCo, Inc. $PEP"
PEP,2026-04-23,-0.5192510336637497,negative,news,"Teacher Retirement System of Texas Sells 32,571 Shares of Monster Beverage Corporation $MNST"
PEP,2026-04-23,0.5992747647687793,positive,news,PepsiCo debuts Quaker Protein Rice Crisps
PEP,2026-04-23,0.9330784268677235,positive,news,"Earnings Flash (KDP) Keurig Dr Pepper Posts Q1 Revenue $3.98B, vs. FactSet Est of $3.84B"
PEP,2026-04-23,0.5993173941969872,positive,news,Coca Cola Tests App Based Airport Experience To Deepen Investor Story
PEP,2026-04-23,-0.9419402666389942,negative,news,"B. Metzler seel. Sohn & Co. AG Lowers Stock Position in PepsiCo, Inc. $PEP"
PEP,2026-04-23,0.023886287584900856,neutral,news,XS233728586 Bond Analysis — Key Metrics
PEP,2026-04-22,0.0138985775411129,neutral,news,Hershey Trust Co. sells $5.7m of Hershey Co. common stock By Investing.com
PEP,2026-04-22,0.8595422860234976,positive,news,Is Celsius (CELH) Using Boutique Fitness Partnerships to Quietly Redefine Its Competitive Moat?
PEP,2026-04-22,0.9332105219364166,positive,news,"PepsiCo Gains As Google Cloud Partnership Boosts AI, Supply Chain Plans"
PEP,2026-04-22,0.47942167334258556,positive,news,"Analysts’ Top Consumer Goods Picks: Coca-Cola (KO), Limoneira Co (LMNR)"
PEP,2026-04-22,0.9185967342928052,positive,news,PepsiCo turns to Google AI for supply chain and store execution
PEP,2026-04-22,0.9293284248560667,positive,news,"Universal Beteiligungs und Servicegesellschaft mbH Raises Stock Holdings in PepsiCo, Inc. $PEP"
KHC,2026-04-25,-0.9614259712398052,negative,news,Kraft Heinz Stock Gets Fresh Dividend Cut Warning Ahead of May 6 Earnings
KHC,2026-04-25,-0.9464694494381547,negative,news,Newell Brands Lawsuit Puts CrockPot Safety And Valuation Gap In Focus
KHC,2026-04-24,0.23488123528659344,neutral,news,An NFL team and a lifetime of ketchup? What's on the menu for draft pick No. 57
KHC,2026-04-24,-0.6788135208189487,negative,news,Buffett Steps Down As Berkshire Backs Kraft Heinz And New Valuation
KHC,2026-04-24,-0.8183941729366779,negative,news,"Universal Beteiligungs und Servicegesellschaft mbH Sells 137,199 Shares of Kraft Heinz Company $KHC"
KHC,2026-04-24,0.9031271422281861,positive,news,Zurcher Kantonalbank Zurich Cantonalbank Increases Holdings in Kraft Heinz Company $KHC
KHC,2026-04-24,-0.903690692037344,negative,news,OVERSEA CHINESE BANKING Corp Ltd Trims Stock Position in Kraft Heinz Company $KHC
KHC,2026-04-24,0.1016938891261816,neutral,news,Free ketchup for life to be given to 2026 NFL Draft's 57th pick
KHC,2026-04-24,-0.8957495167851448,negative,news,Is It Time To Reassess Kraft Heinz (KHC) After A 21% Share Price Slide?
KHC,2026-04-23,-0.008669793605804443,negative,news,This Ridiculously Cheap Warren Buffett Stock Could Make You Richer
KHC,2026-04-23,0.7228149008005857,positive,news,This Ridiculously Cheap Warren Buffett Stock Could Make You Richer
KHC,2026-04-23,0.5735329389572144,positive,news,This Ridiculously Cheap Warren Buffett Stock Could Make You Richer
KHC,2026-04-23,0.5765746813267469,positive,news,Food science student lands job with Kraft Heinz after global experience
KHC,2026-04-23,0.8077834746800363,positive,news,Kraft Heinz Launches Capri Sun Hydrate: Electrolyte Drink for Children - News and Statistics
KHC,2026-04-23,0.8526307195425034,positive,news,Milestone Asset Management LLC Purchases New Holdings in Kraft Heinz Company $KHC
KHC,2026-04-23,-0.6461156010627747,negative,news,Kraft Heinz (NASDAQ:KHC) Stock Rating Upgraded by Zacks Research
KHC,2026-04-23,0.4504303513094783,neutral,news,Kraft Heinz’s Capri Sun expands into functional beverages with kid’s hydration line
KHC,2026-04-22,-0.6431192010641098,negative,news,Does J. M. Smucker (SJM) Offer Value After A 15% One-Year Share Price Decline?
KHC,2026-04-22,0.06518349424004555,neutral,news,12 Best Costco Food Finds For Under $5
KHC,2026-04-22,0.7837958591990173,positive,news,Capri Sun debuts juice pouch with added electrolytes
KHC,2026-04-22,0.7016859985888004,positive,news,Kraft Heinz Extends Reach With Kids’ Hydration And NFL Draft Push
KHC,2026-04-22,0.4781626872718334,neutral,news,12 Best Warren Buffett Stocks to Invest in Now
KHC,2026-04-21,-0.9671654654666781,negative,news,Kraft Heinz Co. stock underperforms Tuesday when compared to competitors
KHC,2026-04-21,0.8718834738247097,positive,news,"Mozzarella Cheese Market Is Booming So Rapidly |The Kraft Heinz Company, Fonterra Co-operative Group Limited, Groupe Lactalis S.A., Grande Cheese Company"
KHC,2026-04-21,0.571953215636313,positive,news,Capri Sun introduces electrolyte enhanced drink
KHC,2026-04-21,0.7846026504412293,positive,news,Conagra Brands Inc stock (US2058871029): Why does its grocery staples model matter more now?
KHC,2026-04-21,0.7867776481434703,positive,news,"Capri Sun Unveils ‘Hydrate,’ One of the First-to-Market Drinks with Electrolytes Designed Just for Kids"
KHC,2026-04-21,0.6646710131317377,positive,news,"Capri Sun Unveils ‘Hydrate,’ One of the First-to-Market Drinks with Electrolytes Designed Just for Kids"
KHC,2026-04-21,0.4558920571580529,neutral,news,Heinz kicks off NFL deal by inducting 57th draft pick into new club
KHC,2026-04-21,0.15719037503004074,neutral,news,HEINZ Turns the 57th Pick Into “Mr. 57” at This Year’s NFL Draft
KHC,2026-04-21,0.09127069171518087,neutral,news,PA-KRAFT-HEINZ-COMPANY
KHC,2026-04-21,-0.19381733238697052,neutral,news,"Stifel Adjusts Price Target on General Mills to $40 From $44, Maintains Buy Rating"
KHC,2026-04-21,0.14787420351058245,neutral,news,HEINZ Turns the 57th Pick Into “Mr. 57” at This Year’s NFL Draft
KHC,2026-04-21,0.8392377495765686,positive,news,RBC Capital upgrades Unilever stock rating on valuation By Investing.com
KHC,2026-04-21,0.9275700356811285,positive,news,J.M. Smucker Co stock (US8326961037): Is its pet food dominance strong enough to drive steady invest
KHC,2026-04-20,0.13988287560641766,neutral,news,E.l.f. promotes longtime CMO Kory Marchisotto to president
KHC,2026-04-20,0.9188385074958205,positive,news,Conagra to upgrade Mexico manufacturing plant
KHC,2026-04-20,-0.9178443849086761,negative,news,Mirae Asset Global Investments Co. Ltd. Has $12.69 Million Position in Kraft Heinz Company $KHC
KHC,2026-04-20,-0.9600486187264323,negative,news,First Horizon Corp Has $3.12 Million Stock Holdings in Kraft Heinz Company $KHC
KHC,2026-04-20,0.8629525229334831,positive,news,"PepsiCo, Inc. stock (US7134481081): Why does its snack and beverage dominance matter more now?"
KHC,2026-04-20,0.9306940343230963,positive,news,Frank's RedHot Sauce: Steady Demand Amid Flavor Wars Could Lift McCormick Stock
KHC,2026-04-20,0.02642173506319523,neutral,news,"Kraft Foods | History, Products, Facts, & Merger"
KHC,2026-04-20,0.8998222751542926,positive,news,Did Kraft Heinz’s (KHC) Premium Mac & Cheese Push Reveal a New Brand Elevation Strategy?
KHC,2026-04-20,0.9281735653057694,positive,news,"PepsiCo, Inc. stock (US7134481081): Why does its snack dominance matter more now for steady returns?"
KHC,2026-04-19,0.9335896307602525,positive,news,Spam Dosenfleisch: Hormel's Steady Sales Anchor Amid Shifting Consumer Tastes
AEP,2026-04-27,-0.329675555229187,negative,news,"Morgan Stanley Adjusts American Electric Power Price Target to $136 From $137, Maintains Overweight Rating"
AEP,2026-04-27,0.9340936001390219,positive,news,"Concurrent Investment Advisors LLC Purchases 13,832 Shares of American Electric Power Company, Inc. $AEP"
AEP,2026-04-26,0.926418119110167,positive,news,American Electric Power (NASDAQ:AEP) Upgraded by Wall Street Zen to Hold Rating
AEP,2026-04-25,0.9363044900819659,positive,news,"Teacher Retirement System of Texas Has $15.61 Million Stake in American Electric Power Company, Inc. $AEP"
AEP,2026-04-24,0.6308137103915215,positive,news,American Water Charitable Foundation Awards Grants to Six Nonprofits
AEP,2026-04-24,-0.16071730107069016,neutral,news,TVA announces planned outage in Jackson County
AEP,2026-04-24,0.19202982727438211,neutral,news,Wisconsin Energy Corporation Stock Price: A Full Guide to WEC
AEP,2026-04-24,0.88955367077142,positive,news,KEPCO Moves Into Vietnam Nuclear and Power Infrastructure
AEP,2026-04-23,0.8612734442576766,positive,news,"South Carolina nuclear plant gets 20 more years to power 570,000 homes"
AEP,2026-04-23,0.16689247637987137,neutral,news,Georgia Power urges storm prep ahead of Monday severe weather
AEP,2026-04-23,0.8856949955224991,positive,news,"32 large-load customers: why Georgia Power wants up to 6,000 MW more"
AEP,2026-04-23,0.09405693411827087,positive,news,American Electric Power Co. Inc. stock underperforms Thursday when compared to competitors despite daily gains
AEP,2026-04-23,-0.5869989395141602,negative,news,American Electric Power (NASDAQ:AEP) Price Target Cut to $138.00 by Analysts at BMO Capital Markets
AEP,2026-04-23,0.4515487514436245,positive,news,FirstEnergy Ohio Rate Plan Could Add $4-$5 a Month to Bills as May 22 Filing Nears
AEP,2026-04-23,-0.17705734074115753,neutral,news,"NextEra posts Q1 results, management webcast starts at 9 a.m. ET"
AEP,2026-04-23,0.9366704486310482,positive,news,"G&S Capital LLC Acquires 10,183 Shares of American Electric Power Company, Inc. $AEP"
AEP,2026-04-23,-0.9563359869644046,negative,news,"UPDATE: Sen. Ossoff probes AI data centers’ impact on Georgia power bills, residents react"
AEP,2026-04-22,-0.6111901700496674,negative,news,Utility CEOs highly paid
AEP,2026-04-22,0.935336772352457,positive,news,American Electric Power (NASDAQ:AEP) Rating Increased to Strong-Buy at Truist Financial
AEP,2026-04-22,0.9376457780599594,positive,news,"American Electric Power Company, Inc. $AEP Stake Raised by Zurcher Kantonalbank Zurich Cantonalbank"
AEP,2026-04-22,0.930943719111383,positive,news,"American Electric Power Company, Inc. $AEP Shares Purchased by M&T Bank Corp"
AEP,2026-04-22,0.9031825885176659,positive,news,"CPC Advisors LLC Takes Position in American Electric Power Company, Inc. $AEP"
AEP,2026-04-22,0.9357571341097355,positive,news,"American Electric Power Company, Inc. $AEP Stake Lifted by Eagle Global Advisors LLC"
AEP,2026-04-22,0.8981259483844042,positive,news,Plus Power inks storage agreement with TVA for 800-MWh BESS in Alabama
AEP,2026-04-22,0.9153024964034557,positive,news,Assessing American Electric Power (AEP) Valuation After Recent Share Price Momentum
AEP,2026-04-21,-0.9577030828222632,negative,news,NextEra Energy (NYSE:NEE) Shares Down 1.4% - Here's Why
AEP,2026-04-21,-0.9624147526919842,negative,news,American Electric Power Co. Inc. stock outperforms competitors despite losses on the day
AEP,2026-04-21,0.38578364439308643,neutral,news,Fifth Third Bancorp re-elects 16 directors at annual meeting
AEP,2026-04-21,0.7460228651762009,positive,news,"American Electric Power Co., Inc. Experiences Valuation Adjustment Amid Competitive Market Landscape"
AEP,2026-04-21,-0.9074201136827469,negative,news,This Mohawk Industries Analyst Is No Longer Bullish; Here Are Top 2 Downgrades For Tuesday
AEP,2026-04-21,0.9349942672997713,positive,news,American Electric Power (NASDAQ:AEP) Price Target Raised to $143.00 at Raymond James Financial
AEP,2026-04-21,-0.1525256633758545,neutral,news,American Electric Power (NASDAQ:AEP) Given New $136.00 Price Target at Morgan Stanley
AEP,2026-04-21,0.901153719983995,positive,news,"Tenaska, TVA sign agreement for 225 MW battery project in Tennessee"
AEP,2026-04-21,0.4865080714225769,positive,news,"Morgan Stanley Adjusts Price Target on American Electric Power to $136 From $137, Maintains Overweight Rating"
AEP,2026-04-21,0.3666713470593095,neutral,news,Seaport Global upgrades American Electric Power (AEP)
AEP,2026-04-21,0.7011340484023094,positive,news,Analysts Offer Insights on Energy Companies: Paladin Energy Ltd (OtherPALAF) and Hallador Energy Company (HNRG)
AEP,2026-04-21,0.8690815232694149,positive,news,"Korea Electric Power Corporation is taking the lead in environmental, social and governance (ESG) management with pollution reduction technologies, such as successful localization of marine-specific eco-friendly insulation oil."
AEP,2026-04-21,0.2741946270689368,neutral,news,Seaport Global upgrades American Electric Power (AEP)
AEP,2026-04-21,-0.004783149808645248,neutral,news,"Lobbying Update: $1,209,000 of AMERICAN ELECTRIC POWER COMPANY INC. AND AFFILIATED CORPORATIONS lobbying was just disclosed"
AEP,2026-04-20,0.8221294484101236,positive,news,Edison International initiated with a Hold at Truist
AEP,2026-04-20,0.8354919282719493,positive,news,Sempra Energy initiated with a Buy at Truist
AEP,2026-04-20,0.20161770191043615,neutral,news,PPL Corp stock (US69351T1060): Why Google Discover changes matter more now
AEP,2026-04-20,0.8232942479662597,positive,news,Better Utility Stock: American Electric Power vs. NextEra Energy
AEP,2026-04-20,0.848581095226109,positive,news,Better Utility Stock: American Electric Power vs. NextEra Energy
AEP,2026-04-20,0.9306859225034714,positive,news,American Electric Power (NASDAQ:AEP) Price Target Raised to $144.00 at Wells Fargo & Company
AEP,2026-04-20,0.9313449244946241,positive,news,"Wells Fargo Adjusts Price Target on American Electric Power to $144 From $141, Maintains Overweight Rating"
AEP,2026-04-20,0.9183710115030408,positive,news,"Wells Fargo Adjusts Price Target on American Electric Power to $144 From $141, Maintains Overweight Rating"
AEP,2026-04-20,0.5488372594118118,positive,news,This Plexus Analyst Turns Bullish; Here Are Top 4 Upgrades For Monday
AEP,2026-04-20,0.9066929705440998,positive,news,This Plexus Analyst Turns Bullish; Here Are Top 4 Upgrades For Monday
AEP,2026-04-20,0.923873545601964,positive,news,"Seaport Global Upgrades American Electric Power to Buy From Neutral, Price Target Is $145"
VZ,2026-04-27,-0.0583785492926836,neutral,sec_filing,VZ 8-K Filing - 2026-04-27
MDT,2026-04-27,-0.0649913065135479,neutral,sec_filing,MDT 8-K Filing - 2026-04-27
JPM,2026-04-24,-0.06299063563346863,neutral,sec_filing,JPM 8-K Filing - 2026-04-24
ACN,2026-04-24,-0.07024397887289524,neutral,sec_filing,ACN 8-K Filing - 2026-04-24
INTC,2026-04-24,-0.025581203401088715,neutral,sec_filing,INTC 8-K Filing - 2026-04-24
INTC,2026-04-24,-0.07452591322362423,neutral,sec_filing,INTC 10-Q Filing - 2026-04-24
PNC,2026-04-24,-0.07486708648502827,neutral,sec_filing,PNC 8-K Filing - 2026-04-24
CHTR,2026-04-24,-0.08862095326185226,neutral,sec_filing,CHTR 10-Q Filing - 2026-04-24
CHTR,2026-04-24,-0.07439097575843334,neutral,sec_filing,CHTR 8-K Filing - 2026-04-24
PG,2026-04-24,-0.0546843446791172,neutral,sec_filing,PG 10-Q Filing - 2026-04-24
PG,2026-04-24,-0.05271040461957455,neutral,sec_filing,PG 8-K Filing - 2026-04-24
TXN,2026-04-24,-0.08958049304783344,neutral,sec_filing,TXN 10-Q Filing - 2026-04-24
SLB,2026-04-24,-0.0598932895809412,neutral,sec_filing,SLB 8-K Filing - 2026-04-24
JPM,2026-04-23,-0.06186340190470219,neutral,sec_filing,JPM 8-K Filing - 2026-04-23
LMT,2026-04-23,-0.027834374457597733,neutral,sec_filing,LMT 8-K Filing - 2026-04-23
USB,2026-04-23,-0.06059815734624863,neutral,sec_filing,USB 8-K Filing - 2026-04-23
IBM,2026-04-23,-0.08452450670301914,neutral,sec_filing,IBM 10-Q Filing - 2026-04-23
LMT,2026-04-23,-0.0721741346642375,neutral,sec_filing,LMT 10-Q Filing - 2026-04-23
CMCSA,2026-04-23,-0.06135362945497036,neutral,sec_filing,CMCSA 10-Q Filing - 2026-04-23
HON,2026-04-23,-0.06491386145353317,neutral,sec_filing,HON 10-Q Filing - 2026-04-23
CMCSA,2026-04-23,-0.036135101690888405,neutral,sec_filing,CMCSA 8-K Filing - 2026-04-23
COF,2026-04-23,-0.05339956097304821,neutral,sec_filing,COF 8-K Filing - 2026-04-23
NFLX,2026-04-23,-0.022978581488132477,neutral,sec_filing,NFLX 8-K Filing - 2026-04-23
AXP,2026-04-23,-0.05402412451803684,neutral,sec_filing,AXP 8-K Filing - 2026-04-23
AXP,2026-04-23,-0.08113264106214046,neutral,sec_filing,AXP 10-Q Filing - 2026-04-23
TMO,2026-04-23,-0.054254479706287384,neutral,sec_filing,TMO 8-K Filing - 2026-04-23
TMUS,2026-04-23,-0.061743540689349174,neutral,sec_filing,TMUS 8-K Filing - 2026-04-23
TSLA,2026-04-23,-0.06476709898561239,neutral,sec_filing,TSLA 10-Q Filing - 2026-04-23
HON,2026-04-23,-0.039297668263316154,neutral,sec_filing,HON 8-K Filing - 2026-04-23
BA,2026-04-22,-0.09948118403553963,neutral,sec_filing,BA 10-Q Filing - 2026-04-22
AMGN,2026-04-22,-0.04554589465260506,neutral,sec_filing,AMGN 8-K Filing - 2026-04-22
BA,2026-04-22,-0.04449589177966118,neutral,sec_filing,BA 8-K Filing - 2026-04-22
TSLA,2026-04-22,-0.04852934926748276,neutral,sec_filing,TSLA 8-K Filing - 2026-04-22
TXN,2026-04-22,-0.07918705977499485,neutral,sec_filing,TXN 8-K Filing - 2026-04-22
JNJ,2026-04-22,-0.10502648819237947,neutral,sec_filing,JNJ 10-Q Filing - 2026-04-22
IBM,2026-04-22,-0.040867291390895844,neutral,sec_filing,IBM 8-K Filing - 2026-04-22
T,2026-04-22,-0.09623539447784424,neutral,sec_filing,T 8-K Filing - 2026-04-22
T,2026-04-22,-0.09637369960546494,neutral,sec_filing,T 8-K Filing - 2026-04-22
SCHW,2026-04-22,-0.046375520527362823,neutral,sec_filing,SCHW 8-K Filing - 2026-04-22
UNH,2026-04-21,-0.06196884624660015,neutral,sec_filing,UNH 8-K Filing - 2026-04-21
DHR,2026-04-21,-0.04779297672212124,neutral,sec_filing,DHR 8-K Filing - 2026-04-21
COF,2026-04-21,-0.05594370514154434,neutral,sec_filing,COF 8-K Filing - 2026-04-21
GE,2026-04-21,-0.05741818621754646,neutral,sec_filing,GE 8-K Filing - 2026-04-21
DHR,2026-04-21,-0.06412039324641228,neutral,sec_filing,DHR 10-Q Filing - 2026-04-21
GE,2026-04-21,-0.1081026503816247,neutral,sec_filing,GE 10-Q Filing - 2026-04-21
MMM,2026-04-21,-0.07824591547250748,neutral,sec_filing,MMM 10-Q Filing - 2026-04-21
MMM,2026-04-21,-0.06809587217867374,neutral,sec_filing,MMM 8-K Filing - 2026-04-21
RTX,2026-04-21,-0.06589020416140556,neutral,sec_filing,RTX 10-Q Filing - 2026-04-21
RTX,2026-04-21,-0.029894130304455757,neutral,sec_filing,RTX 8-K Filing - 2026-04-21
ADBE,2026-04-21,-0.04342059977352619,neutral,sec_filing,ADBE 8-K Filing - 2026-04-21
AVGO,2026-04-21,-0.04315502569079399,neutral,sec_filing,AVGO 8-K Filing - 2026-04-21
GS,2026-04-20,-0.051668452098965645,neutral,sec_filing,GS 8-K Filing - 2026-04-20
AAPL,2026-04-20,-0.04101712442934513,neutral,sec_filing,AAPL 8-K Filing - 2026-04-20
ABT,2026-04-17,-0.027362946420907974,neutral,sec_filing,ABT 8-K Filing - 2026-04-17
NFLX,2026-04-17,-0.057659126818180084,neutral,sec_filing,NFLX 10-Q Filing - 2026-04-17
ABT,2026-04-16,-0.04229276441037655,neutral,sec_filing,ABT 8-K Filing - 2026-04-16
USB,2026-04-16,-0.062030382454395294,neutral,sec_filing,USB 8-K Filing - 2026-04-16
SCHW,2026-04-16,-0.043232208117842674,neutral,sec_filing,SCHW 8-K Filing - 2026-04-16
PEP,2026-04-16,-0.04115649126470089,neutral,sec_filing,PEP 8-K Filing - 2026-04-16
PEP,2026-04-16,-0.05174899846315384,neutral,sec_filing,PEP 10-Q Filing - 2026-04-16
BAC,2026-04-15,-0.04034295864403248,neutral,sec_filing,BAC 8-K Filing - 2026-04-15
PNC,2026-04-15,-0.07990655489265919,neutral,sec_filing,PNC 8-K Filing - 2026-04-15
COST,2026-04-15,-0.03939340077340603,neutral,sec_filing,COST 8-K Filing - 2026-04-15
MS,2026-04-15,-0.08105474151670933,neutral,sec_filing,MS 8-K Filing - 2026-04-15
C,2026-04-14,-0.043889373540878296,neutral,sec_filing,C 8-K Filing - 2026-04-14
META,2026-04-14,-0.05131789483129978,neutral,sec_filing,META 8-K Filing - 2026-04-14
AMZN,2026-04-14,-0.05669515207409859,neutral,sec_filing,AMZN 8-K Filing - 2026-04-14
JNJ,2026-04-14,-0.06270360201597214,neutral,sec_filing,JNJ 8-K Filing - 2026-04-14
WFC,2026-04-14,-0.06715822778642178,neutral,sec_filing,WFC 8-K Filing - 2026-04-14
MPC,2026-04-13,-0.04055165499448776,neutral,sec_filing,MPC 8-K Filing - 2026-04-13
GS,2026-04-13,-0.04942168481647968,neutral,sec_filing,GS 8-K Filing - 2026-04-13
CAT,2026-04-13,-0.030708108097314835,neutral,sec_filing,CAT 8-K Filing - 2026-04-13
CAT,2026-04-10,-0.03390050679445267,neutral,sec_filing,CAT 8-K Filing - 2026-04-10
GOOGL,2026-04-10,-0.05879989638924599,neutral,sec_filing,GOOGL 8-K Filing - 2026-04-10
OXY,2026-04-10,-0.05577090382575989,neutral,sec_filing,OXY 8-K Filing - 2026-04-10
CVX,2026-04-09,-0.0316502433270216,neutral,sec_filing,CVX 8-K Filing - 2026-04-09
AMZN,2026-04-09,-0.05207393690943718,neutral,sec_filing,AMZN 8-K Filing - 2026-04-09
EOG,2026-04-09,-0.05283371917903423,neutral,sec_filing,EOG 8-K Filing - 2026-04-09
XOM,2026-04-08,-0.023865364491939545,neutral,sec_filing,XOM 8-K Filing - 2026-04-08
SLB,2026-04-08,-0.05365506745874882,neutral,sec_filing,SLB 8-K Filing - 2026-04-08
CSCO,2026-04-06,-0.0640218984335661,neutral,sec_filing,CSCO 8-K Filing - 2026-04-06
AVGO,2026-04-06,-0.04617438651621342,neutral,sec_filing,AVGO 8-K Filing - 2026-04-06
ORCL,2026-04-06,-0.029577016830444336,neutral,sec_filing,ORCL 8-K Filing - 2026-04-06
PSX,2026-04-06,-0.039251863956451416,neutral,sec_filing,PSX 8-K Filing - 2026-04-06
C,2026-04-03,-0.03721959330141544,neutral,sec_filing,C 8-K Filing - 2026-04-03
ABBV,2026-04-03,-0.05223179794847965,neutral,sec_filing,ABBV 8-K Filing - 2026-04-03
SBUX,2026-04-02,-0.03124214895069599,neutral,sec_filing,SBUX 8-K Filing - 2026-04-02
GOOGL,2026-04-02,-0.05394752696156502,neutral,sec_filing,GOOGL 8-K Filing - 2026-04-02
MU,2026-04-01,-0.026513418182730675,neutral,sec_filing,MU 8-K Filing - 2026-04-01
NKE,2026-04-01,-0.06070697866380215,neutral,sec_filing,NKE 10-Q Filing - 2026-04-01
XOM,2026-03-31,-0.031028231605887413,neutral,sec_filing,XOM 8-K Filing - 2026-03-31
TMUS,2026-03-31,-0.06409978494048119,neutral,sec_filing,TMUS 8-K Filing - 2026-03-31
NKE,2026-03-31,-0.04764658771455288,neutral,sec_filing,NKE 8-K Filing - 2026-03-31
SBUX,2026-03-30,-0.035717956721782684,neutral,sec_filing,SBUX 8-K Filing - 2026-03-30
WMT,2026-03-27,-0.06663712859153748,neutral,sec_filing,WMT 8-K Filing - 2026-03-27
MU,2026-03-25,-0.029868463054299355,neutral,sec_filing,MU 8-K Filing - 2026-03-25
CVX,2026-03-25,-0.032587235793471336,neutral,sec_filing,CVX 8-K Filing - 2026-03-25
ADBE,2026-03-25,-0.06865557841956615,neutral,sec_filing,ADBE 10-Q Filing - 2026-03-25
PYPL,2026-03-25,-0.060616401955485344,neutral,sec_filing,PYPL 8-K Filing - 2026-03-25
TMO,2026-03-24,-0.05496080033481121,neutral,sec_filing,TMO 8-K Filing - 2026-03-24
MDT,2026-03-24,-0.0658507663756609,neutral,sec_filing,MDT 8-K Filing - 2026-03-24
LOW,2026-03-23,-0.14283552579581738,neutral,sec_filing,LOW 10-K Filing - 2026-03-23
DIS,2026-03-20,-0.036704374477267265,neutral,sec_filing,DIS 8-K Filing - 2026-03-20
CVS,2026-03-19,-0.049309276044368744,neutral,sec_filing,CVS 8-K Filing - 2026-03-19
ACN,2026-03-19,-0.09015217795968056,neutral,sec_filing,ACN 10-Q Filing - 2026-03-19
QCOM,2026-03-19,-0.046762121841311455,neutral,sec_filing,QCOM 8-K Filing - 2026-03-19
HD,2026-03-18,-0.028121234849095345,neutral,sec_filing,HD 10-K Filing - 2026-03-18
WFC,2026-03-18,-0.07463504932820797,neutral,sec_filing,WFC 8-K Filing - 2026-03-18
PSX,2026-03-18,-0.03893051855266094,neutral,sec_filing,PSX 8-K Filing - 2026-03-18
DE,2026-03-16,-0.05719688721001148,neutral,sec_filing,DE 8-K Filing - 2026-03-16
CRM,2026-03-16,-0.09598692879080772,neutral,sec_filing,CRM 8-K Filing - 2026-03-16
AMAT,2026-03-13,-0.059957271441817284,neutral,sec_filing,AMAT 8-K Filing - 2026-03-13
WMT,2026-03-13,-0.059248268604278564,neutral,sec_filing,WMT 8-K Filing - 2026-03-13
CRM,2026-03-13,-0.08697684295475483,neutral,sec_filing,CRM 8-K Filing - 2026-03-13
VZ,2026-03-13,-0.054988980293273926,neutral,sec_filing,VZ 8-K Filing - 2026-03-13
ADI,2026-03-12,-0.0497656874358654,neutral,sec_filing,ADI 8-K Filing - 2026-03-12
