ticker,date,sentiment_score,sentiment_label,content_type,title
AAPL,2026-06-10,0.25654075760394335,neutral,news,"AT&T Launches Unlimited Day Pass, Bringing Connectivity to iPad Users Regardless of Carrier"
AAPL,2026-06-10,0.31999772414565086,neutral,news,"AT&T Launches Unlimited Day Pass, Bringing Connectivity to iPad Users Regardless of Carrier"
AAPL,2026-06-10,-0.9623482897877693,negative,news,"AAPL stock slides, but is it a reaction to AI announcements?"
AAPL,2026-06-10,-0.9341098293662071,negative,news,"What's Going On With Apple Stock Wednesday? - Apple (NASDAQ:AAPL), Alphabet (NASDAQ:GOOG)"
AAPL,2026-06-10,0.9237585868686438,positive,news,"Apple: Hey Siri, Let's Get Apple's AI Strategy Back on Track"
AAPL,2026-06-10,-0.9574762089177966,negative,news,Seven Grand Managers LLC Reduces Position in Apple Inc. $AAPL
AAPL,2026-06-10,0.9283596538007259,positive,news,Godfrey Financial Associates Inc. Invests $1.87 Million in NVIDIA Corporation $NVDA
AAPL,2026-06-10,-0.9588629435747862,negative,news,"Telegram Returns To Apple Watch With Native App Supporting Messages, GIFs And Video Playback"
AAPL,2026-06-10,0.1830798201262951,neutral,news,How iOS 27 Gives Us An Early Look At Apple's Foldable iPhone
AAPL,2026-06-10,-0.9611575836315751,negative,news,SSR Mining Stock Declines Amid Falling Gold and Silver Prices
AAPL,2026-06-09,-0.9614646248519421,negative,news,Apple Inc (AAPL) Stock Down 3.6% but Still Overvalued -- GF Scor
AAPL,2026-06-09,0.9233660381287336,positive,news,Apple Kicks Off WWDC. How to Play AAPL Stock Here.
AAPL,2026-06-09,-0.5427348762750626,negative,news,"Micron, Marvell, Super Micro, Coherent, Smucker, and More Stocks That Explain Today’s Market"
AAPL,2026-06-09,-0.9026650711894035,negative,news,"Jobs Data, a Space IPO, and a Steady Fed: iShares MSCI World ETF Faces a Jam-Packed Week"
AAPL,2026-06-09,0.05629853717982769,neutral,news,What to know about upcoming SpaceX IPO
AAPL,2026-06-09,0.9252895843237638,positive,news,Morgan Stanley Revises Apple Stock Price Target on WWDC Catalyst
AAPL,2026-06-09,-0.9627318410202861,negative,news,Market Indexes Retreat Tuesday as the Tech Sell-Off Returns
AAPL,2026-06-09,0.7360951835289598,positive,news,iPadOS 27 Improves The iPad With 5 New Features
AAPL,2026-06-09,-0.9479638338088989,negative,news,"Apple Stock Falls After WWDC: Analyst Says 'Step In The Right Direction,' But Monetization Questions Remain"
AAPL,2026-06-09,-0.9564263997599483,negative,news,"MercadoLibre's Growth Is Accelerating, but the Stock Is Down 38%: What Is the Market Missing?"
AAPL,2026-06-09,0.40542925242334604,neutral,news,Can-Am Launches BRP GO! On-Road Navigation
AAPL,2026-06-09,-0.9667215505614877,negative,news,Apple Inc Stock (AAPL) Moved Down by 3.42% on Jun 9: What Investors Need To Know
AAPL,2026-06-09,0.9420321192592382,positive,news,What Lit a Fire Under Qualcomm Stock?
AAPL,2026-06-09,0.7166832936927676,positive,news,I just met the new Siri. Here's what it's actually like
AAPL,2026-06-09,0.8901922749355435,positive,news,"Apple's WWDC 2026 Event Shows 'Clearer' Paths to Monetizing AI, Morgan Stanley Says"
AAPL,2026-06-09,-0.6989134550094604,negative,news,"AI Selloff Was a ‘Wake-Up Call’ for Investors, Wells Fargo Says"
AAPL,2026-06-09,-0.9672747794538736,negative,news,Trump Media stock hits 52-week low at 3.8 USD
AAPL,2026-06-09,0.587552934885025,positive,news,NetEase Inc stock (KYG6427A1022): earnings momentum and gaming pipeline in focus after recent pullba
AAPL,2026-06-09,0.4042446045204997,neutral,news,Water.org and Founding Partners Launch Get Blue™ to Bring Water Home™ Through Everyday Actions
AAPL,2026-06-09,-0.8964557647705078,negative,news,iShares MSCI USA Momentum Factor ETF : MTUM
AAPL,2026-06-09,0.907569844275713,positive,news,Wedbush Says Apple (NASDAQ: AAPL) WWDC Signals A Foundational AI Consumer Platform Shift With Siri AI Unveiling
AAPL,2026-06-09,0.33009801618754864,neutral,news,Apple Taps Google and Nvidia to Power Next-Generation AI
AAPL,2026-06-09,0.9018465420231223,positive,news,"Taiwan Semiconductor Manufacturing (NYSE:TSM) CEO Acquires $11,401.50 in Stock"
AAPL,2026-06-09,0.8758365716785192,positive,news,Southern Co Launches New Equity Distribution Program
AAPL,2026-06-09,-0.00924583338201046,neutral,news,"Form 497AD OFS Credit Company, Inc."
AAPL,2026-06-09,-0.9393883533775806,negative,news,"Apple failed to make its AI tool to comply to EU regulations, EU Commission says"
AAPL,2026-06-09,-0.9315376607701182,negative,news,Apple’s AI Push Fails To Impress Wall Street: Analysts Say New AI Features Won’t Spark iPhone Upgrade Cycle
AAPL,2026-06-09,-0.4488312155008316,negative,news,Apple’s AI Push Fails To Impress Wall Street: Analysts Say New AI Features Won’t Spark iPhone Upgrade Cycle
AAPL,2026-06-09,0.9317528698593378,positive,news,Morgan Stanley raises Apple stock price target to $360 on AI strategy
AAPL,2026-06-09,0.9300419818609953,positive,news,Morgan Stanley raises Apple stock price target to $360 on AI strategy
AAPL,2026-06-09,0.9208261948078871,positive,news,"TD Cowen Adjusts Price Target on Apple to $350 From $335, Maintains Buy Rating"
AAPL,2026-06-09,0.662660539150238,positive,news,"Apple expands parental controls at WWDC with web, category limits"
AAPL,2026-06-09,0.07388710603117943,neutral,news,"Alphabet Inc - Ordinary Shares - Class C (GOOG) News, Articles, Events & Latest Updates"
AAPL,2026-06-09,0.9340781103819609,positive,news,The Walt Disney Company $DIS Shares Bought by Cerity Partners LLC
AAPL,2026-06-09,0.8933830987662077,positive,news,Linden Rose Investment LLC Purchases New Shares in NVIDIA Corporation $NVDA
AAPL,2026-06-09,0.9254588428884745,positive,news,Churchill Financial Advisors LLC Makes New $17.15 Million Investment in Apple Inc. $AAPL
AAPL,2026-06-09,0.852881483733654,positive,news,"BLI Banque de Luxembourg Investments Takes $7.71 Million Position in VeriSign, Inc. $VRSN"
AAPL,2026-06-09,0.9350677598267794,positive,news,NVIDIA Corporation $NVDA Shares Bought by Allstate Corp
AAPL,2026-06-09,0.1090685073286295,neutral,news,APPLE INC : Gets a Neutral rating from UBS
AAPL,2026-06-09,0.15071422513574362,neutral,news,Should Franklin U.S. Large Cap Multifactor Index ETF (FLQL) Be on Your Investing Radar?
AVGO,2026-06-10,0.8745798608288169,positive,news,What’s Driving Fresh Market Interest In General Motors?
AVGO,2026-06-10,-0.9601835934445262,negative,news,Why Is Broadcom Stock Falling Wednesday?
AVGO,2026-06-10,-0.9630482820793986,negative,news,A Look At Take Two Interactive Software (TTWO) Valuation After Recent Share Price Weakness
AVGO,2026-06-10,-0.9319579377770424,negative,news,How Wide Is the Road Ahead for Teradyne Stock?
AVGO,2026-06-10,-0.9111820869147778,negative,news,Insights Into Analog Devices's Performance Versus Peers In Semiconductors & Semiconductor Equipment Sector
AVGO,2026-06-10,0.28379610273987055,neutral,news,"Qualcomm, Aramco, Saudi Arabia’s RDIA and HUMAIN announce startups selected for Design in Saudi Arabia with AI 2026"
AVGO,2026-06-10,-0.7998097091913223,negative,news,Savant Capital LLC Has $41.43 Million Stock Position in Alphabet Inc. $GOOGL
AVGO,2026-06-10,-0.934729378670454,negative,news,Rothschild Investment LLC Cuts Stake in Alphabet Inc. $GOOGL
AVGO,2026-06-10,0.9367015268653631,positive,news,Why is STMicroelectronics stock climbing today? By Investing.com
AVGO,2026-06-10,-0.9491245485842228,negative,news,Assessing HIVE Digital Technologies (TSX:HIVE) Valuation After Recent Share Price Pullback
AVGO,2026-06-10,0.9337659142911434,positive,news,"Apollo Global Management Inc. (NYSE:APO) Given Average Rating of ""Moderate Buy"" by Analysts"
AVGO,2026-06-10,0.9348583156242967,positive,news,Corcept Therapeutics (CORT) Valuation After New Korlym CATALYST And MOMENTUM Trial Data
AVGO,2026-06-10,-0.76419298350811,negative,news,A Look At Critical Metals (CRML) Valuation After Tanbreez Project Progress Update
AVGO,2026-06-09,-0.9659299626946449,negative,news,The Warning Sign Inside Arista Networks Stock’s Great News
AVGO,2026-06-09,0.914199098944664,positive,news,Bernstein initiates Rockwell Automation stock coverage at Market Perform By Investing.com
AVGO,2026-06-09,-0.7284897621721029,negative,news,UBS Autocallable Notes Linked to Broadcom Inc. (AMUB) — Matures 06/11/2027
AVGO,2026-06-09,0.00016963481903076172,neutral,news,UBS launches Broadcom-linked autocall notes (AMUB) with high contingent coupon
AVGO,2026-06-09,-0.9491338580846786,negative,news,"Skyworks Solutions, Western Digital, and Teradyne Shares Are Falling, What You Need To Know"
AVGO,2026-06-09,0.6284978641197085,positive,news,Arista unveils 1.6T rack-scale switch family for AI infrastructure
AVGO,2026-06-09,0.21637908183038235,neutral,news,Micron Appoints Alexis Black Björlin to Board of Directors
AVGO,2026-06-09,0.922599209472537,positive,news,A Look At ArcBest (ARCB) Valuation After Its Recent Share Price Surge
AVGO,2026-06-09,-0.876398716121912,negative,news,"IPG Photonics, Intel, and Monolithic Power Systems Stocks Trade Down, What You Need To Know"
AVGO,2026-06-09,-0.9410749543458223,negative,news,"IPG Photonics, Intel, and Monolithic Power Systems Stocks Trade Down, What You Need To Know"
AVGO,2026-06-09,0.07940039038658142,neutral,news,Production AI reshapes private cloud
AVGO,2026-06-09,-0.06852519512176514,negative,news,"Penguin Solutions, AMD, and Impinj Stocks Trade Down, What You Need To Know"
AVGO,2026-06-09,0.9393651131540537,positive,news,AMD Rides on Strong AI Infrastructure Growth: More Upside Ahead?
AVGO,2026-06-09,-0.6086793579161167,negative,news,UBS (AMUB) launches Broadcom-linked autocallable notes with 16.35% coupon
AVGO,2026-06-09,-0.9368501417338848,negative,news,Exploring The Competitive Space: Analog Devices Versus Industry Peers In Semiconductors & Semiconductor Equipment
AVGO,2026-06-09,-0.9678913853131235,negative,news,Arm Holdings PLC Stock (ARM) Moved Down by 5.88% on Jun 9: What Signal Does It Send?
AVGO,2026-06-09,-0.6938997209072113,negative,news,Lumentum Stock Falls 15% in a Month: Is This Dip a Buying Opportunity?
AVGO,2026-06-09,0.8895330764353275,positive,news,"Dear Nvidia Stock Fans, Mark Your Calendars for June 11"
AVGO,2026-06-09,0.943578639999032,positive,news,MaxLinear Up 354% YTD: Is the Stock Still Worth Considering?
AVGO,2026-06-09,-0.9431630494073033,negative,news,"Scott Galloway Says Tesla, Nvidia, Broadcom Could Get Caught In The Crossfire Of The Space X IPO"
AVGO,2026-06-09,0.7614049827679992,positive,news,The AI supersystem shift: Why Arista’s 1.6T announcement is an Ethernet inflection point
AVGO,2026-06-09,0.6919276528060436,positive,news,"Broadcom, Apollo, Blackstone Launch $35 Billion AI Infrastructure Platform"
AVGO,2026-06-09,0.6956189293414354,positive,news,Broadcom Inc. (AVGO) registers $6.0B to enable resale of 2035/2036 notes
AVGO,2026-06-09,0.8674985370598733,positive,news,Arista unveils new AI networking systems as demand for larger clusters grows (ANET:NYSE)
AVGO,2026-06-09,-0.920968359336257,negative,news,Broadcom's Private Cloud Outlook 2026 Reveals an AI Tipping Point as Production Inference Shifts Decisively to Private Cloud
AVGO,2026-06-09,0.8363078339025378,positive,news,Broadcom's Private Cloud Outlook 2026 Reveals an AI Tipping Point as Production Inference Shifts Decisively to Private Cloud
AVGO,2026-06-09,0.9003190733492374,positive,news,Apollo Leads $35 Billion Capital Solution for Broadcom AI XPV Platform in Partnership with Blackstone and Leading Global Banks
AVGO,2026-06-09,0.8430325770750642,positive,news,Apollo Leads $35 Billion Capital Solution for Broadcom AI XPV Platform in Partnership with Blackstone and Leading Global Banks
AVGO,2026-06-09,0.8337560412473977,positive,news,A $35B push to power AI: Apollo backs Broadcom's XPV plan
AVGO,2026-06-09,-0.9556349730119109,negative,news,Indian companies fall out of MSCI EM top 10 aid AI stock rush
AVGO,2026-06-09,0.7365704849362373,positive,news,"Allegro MicroSystems and Monolithic Power Systems Shares Are Soaring, What You Need To Know"
AVGO,2026-06-09,0.6441615633666515,positive,news,Does Astera Labs Stock Offer Real Shelter or Just a Faster Ride?
AVGO,2026-06-09,0.7545123063027859,positive,news,Is SoFi Select 500 ETF (SFY) a Strong ETF Right Now?
AVGO,2026-06-09,0.838072020560503,positive,news,Apollo and Blackstone Said to Complete $35 Billion Private Credit Deal to Provide ‘Chip Financing’ for Anthropic’s Computing Power Expansion
INTC,2026-06-10,0.09054055530577898,neutral,news,"The Zacks Analyst Blog Highlights Intel, CrowdStrike, Honeywell International , Capstone Energy+ and Lulu's Fashion Lounge"
INTC,2026-06-10,0.5614796057343483,positive,news,"SKT, NTT, Chunghwa Telecom to jointly launch $500 mil. AI fund"
INTC,2026-06-10,-0.9449122156947851,negative,news,"Motley Fool Wealth Management LLC Has $7.99 Million Stock Position in HealthEquity, Inc. $HQY"
INTC,2026-06-10,0.9155438570305705,positive,news,Is State Street SPDR NYSE Technology ETF (XNTK) a Strong ETF Right Now?
INTC,2026-06-10,0.9324585804715753,positive,news,Cibc World Market Inc. Increases Stock Position in D-Wave Quantum Inc. $QBTS
INTC,2026-06-10,0.5336326668038964,positive,news,Skyworks Showcases Software-Defined Power Portfolio for AI Infrastructure and Intelligent Mobility at PCIM Europe 2026
INTC,2026-06-10,0.8956032460555434,positive,news,"Elon Musk Praises Tesla's 'Awesome' AI Chip Team, Says AI6 May Set New Wafer Intelligence Record"
INTC,2026-06-10,0.5214253664016724,positive,news,"Alibaba, BYD, Baidu added to US restricted list; Further issuance of Alibaba 5x Long ZVNW"
INTC,2026-06-10,-0.9463327471166849,negative,news,A Look At Mondaycom (MNDY) Valuation As Shares Slide Over The Past Week
INTC,2026-06-09,-0.8700561337172985,negative,news,PMGC Holdings Shareholders Approve Governance-Related Bylaw Amendments
INTC,2026-06-09,-0.9639488682150841,negative,news,Lumentum (NASDAQ:LITE) Shares Down 8.2% - What's Next?
INTC,2026-06-09,0.8487725351005793,positive,news,"Apollo Shareholders Back Board, Executive Pay and Auditor"
INTC,2026-06-09,-0.9647157867439091,negative,news,Intel Corp Stock (INTC) Moved Down by 8.32% on Jun 9: Facts Behind the Movement
INTC,2026-06-09,-0.05268218368291855,neutral,news,"Top Analyst Reports for Intel, CrowdStrike & Honeywell"
INTC,2026-06-09,0.9330233167856932,positive,news,"SNPS: AI, Ansys integration, and robust partnerships drive growth, innovation, and margin expansion"
INTC,2026-06-09,0.5212250957265496,positive,news,"With The SpaceX IPO Imminent, Nvidia And Tesla Accelerate The Race For Physical AI"
INTC,2026-06-09,0.9276951756328344,positive,news,LG Display Co Ltd (ADR) stock (US5023351025): earnings volatility and turnaround hopes
INTC,2026-06-09,0.9006974548101425,positive,news,ASML breaks $700B market cap barrier: Here's the rally drivers and key risks
INTC,2026-06-09,0.8760137003846467,positive,news,Should iShares MSCI USA Value Factor ETF (VLUE) Be on Your Investing Radar?
INTC,2026-06-09,0.9281536154448986,positive,news,Hilton Head Capital Partners LLC Takes Position in Intel Corporation $INTC
INTC,2026-06-09,0.7559690340422094,positive,news,"NTT partners with SK Group, Chunghwa Telecom to build AI infra"
INTC,2026-06-09,0.9279286041855812,positive,news,Bull of the Day: Ultra Clean Holdings (UCTT)
INTC,2026-06-09,0.8771477583795786,positive,news,"RGTI, INFQ Stocks Gain Overnight: Bernstein Thinks Rigetti And Infleqtion Could Be Early Winners In Quantum Race"
INTC,2026-06-09,-0.20259401202201843,negative,news,"Brandywine Global Investment Management LLC Sells 5,770 Shares of Taiwan Semiconductor Manufacturing Company Ltd. $TSM"
INTC,2026-06-09,0.9292261227965355,positive,news,"RGTI, INFQ Stocks Gain Overnight: Bernstein Thinks Rigetti And Infleqtion Could Be Early Winners In Quantum Race"
INTC,2026-06-09,0.7529860138893127,positive,news,"New TI chip watches EV batteries from inside, warning early"
INTC,2026-06-09,0.9131411574780941,positive,news,This Sector Has Dominated ETF Returns So Far in 2026
INTC,2026-06-09,0.8769775950349867,positive,news,Qualcomm vs. Silicon Motion: Which Semiconductor Stock Wins Now?
INTC,2026-06-09,-0.937065040692687,negative,news,Intel Corp (INTC) Stock Up 11.1% but GF Value Says Overvalued -- GF Score: 67/100
INTC,2026-06-09,0.8932501152157784,positive,news,Today’s Market Recap: MSCI Paves the Way for SpaceX IPO to Be Included Quickly； OpenAI Secretly Filed for IPO.
INTC,2026-06-09,0.524325480684638,positive,news,Elite Express Appoints Ye Hua as New CFO
INTC,2026-06-08,0.9240360297262669,positive,news,"Intel jumps 11% as Google names it AI chip manufacturer; ASML surges on Musk Terafab catalyst, SOXX +5.9%"
INTC,2026-06-08,-0.7077965289354324,negative,news,"BlackLine director Mika Yamamoto sells over $85,000 in shares"
INTC,2026-06-08,0.9328268431127071,positive,news,"U.S. ETF Express | GraniteShares 2X Long INTC Daily ETF Was the Top Gainer, Rising 22.79%"
INTC,2026-06-08,0.9161920733749866,positive,news,INHD Stock Erupts As Low-Float Trader Focus Intensifies
INTC,2026-06-08,0.8477982627227902,positive,news,Intel 14A AI chip push: Cadence joins deeper foundry pact
INTC,2026-06-08,0.8654199671000242,positive,news,Cadence Announces Collaboration with Intel Foundry to Accelerate Intel 14A Process Optimization for HPC and Mobile Designs
INTC,2026-06-08,-0.8404226079583168,negative,news,Intel Stock Extends AI Rally As Wall Street Hikes Targets
INTC,2026-06-08,0.5619956254959106,positive,news,"Forget Intel Corporation: As Rising Yields Shake Wall Street, This Unstoppable AI Powerhouse Is a No-Brainer Buy"
INTC,2026-06-08,0.9374642446637154,positive,news,"Coeur Mining CDE Rallies On Dividend, Index Win"
INTC,2026-06-08,-0.9342275261878967,negative,news,GMHS Stock Slides As Volatility Grips Gamehaus Holdings
MU,2026-06-10,-0.9670116086490452,negative,news,Qualcomm Inc Stock (QCOM) Moved Down by 5.39% on Jun 10: What Signal Does It Send?
MU,2026-06-10,-0.9634527545422316,negative,news,Western Digital Corp Stock (WDC) Moved Down by 4.50% on Jun 10: What Investors Need To Know
MU,2026-06-10,0.9296669345349073,positive,news,Lam Research Corp Stock (LRCX) Moved Up by 3.51% on Jun 10: A Full Analysis
MU,2026-06-10,0.9395917085930705,positive,news,"Seagate Technology Stock’s Operating Margins Hit 36%: Does the HAMR Road Map Justify a $1,876 Target?"
MU,2026-06-10,0.012785958126187325,neutral,news,"Analysts Conflicted on These Technology Names: Micron (MU), Lumentum Holdings (LITE) and SailPoint, Inc. (SAIL)"
MU,2026-06-10,0.8880597949028015,positive,news,"Semicon giant Applied Materials opens $600m Singapore plant, adds 1,000 jobs amid AI chip boom"
MU,2026-06-10,-0.750574879348278,negative,news,CenterBook Partners LP Has $1.58 Million Position in Microchip Technology Incorporated $MCHP
MU,2026-06-10,0.817618241533637,positive,news,"ETB: Good Income Fund, But High Tech Exposure Could Be A Risk"
MU,2026-06-10,0.10740713402628899,neutral,news,"GraniteShares 2x Long MU Daily ETF To Carry Out 25-for-1 Stock Split On June 25th, 2026"
MU,2026-06-09,0.12579325679689646,neutral,news,Arista Networks’ Bechtolsheim sells $34.7m in ANET stock
MU,2026-06-09,0.32342881988734007,neutral,news,Micron Appoints Alexis Black Björlin to Board of Directors
MU,2026-06-09,-0.9669755226932466,negative,news,Sony Group Corp Stock (SONY) Closed Down by 3.72% on Jun 9: Key Drivers Unveiled
MU,2026-06-09,-0.9669344564899802,negative,news,Salesforce Inc Stock (CRM) Moved Down by 4.07% on Jun 9: What Signal Does It Send?
MU,2026-06-09,-0.9666134491562843,negative,news,Analog Devices Inc Stock (ADI) Moved Down by 3.13% on Jun 9: Facts Behind the Movement
MU,2026-06-09,-0.9520383579656482,negative,news,"Micron Sinks 6%, Western Digital Falls 5% but SanDisk Holds Steady"
MU,2026-06-09,-0.966978776268661,negative,news,Taiwan Semiconductor Manufacturing Co Ltd Stock (TSM) Moved Down by 4.10% on Jun 9: What Signal Does It Send?
MU,2026-06-09,-0.9664993057958782,negative,news,Cisco Systems Inc Stock (CSCO) Moved Down by 4.78% on Jun 9: Key Drivers Unveiled
MU,2026-06-09,-0.9653662191703916,negative,news,"U.S. Stocks Move Sharply | Nasdaq Plunges Late at Night, Extending Losses to 2%; Micron Technology (MU.US) Drops Over 4.8%"
MU,2026-06-09,0.9336000308394432,positive,news,Micron Up 750%? Two Russell 2000 Stocks Just Beat It - Bloom Energy (NYSE:BE)
MU,2026-06-09,0.9301135642454028,positive,news,Hilton stock reaches all-time high of 346.91 USD By Investing.com
MU,2026-06-09,0.9384426195174456,positive,news,Applied Materials Inc Stock (AMAT) Moved Up by 5.85% on Jun 9: Key Drivers Unveiled
MU,2026-06-09,0.9384701512753963,positive,news,SanDisk Corporation Stock (SNDK) Opened Up by 4.08% on Jun 9: What Signal Does It Send?
MU,2026-06-09,0.8992495015263557,positive,news,Lam Research Corp Stock (LRCX) Opened Up by 3.99% on Jun 9: What Signal Does It Send?
MU,2026-06-09,0.9290442019701004,positive,news,Western Digital Corp Stock (WDC) Opened Up by 3.01% on Jun 9: Key Drivers Unveiled
MU,2026-06-09,-0.8052846118807793,negative,news,JOBY Stock: Are You Buying A Future Or A Mirage?
MU,2026-06-09,0.9314955733716488,positive,news,Rocket Lab (RKLB) Stock Surges as SpaceX Alternative Gains Traction
MU,2026-06-09,0.9354996886104345,positive,news,Credo Technology Group Holding Ltd Stock (CRDO) Closed Up by 7.29% on Jun 8: Key Drivers Unveiled
MU,2026-06-08,0.9008408822119236,positive,news,"Intech Investment Management LLC Purchases New Position in Allegro MicroSystems, Inc. $ALGM"
MU,2026-06-08,-0.8346267379820347,negative,news,UBS (NYSE: UBS) launches Trigger Yield Notes tied to Micron (AMUB) with high coupon
MU,2026-06-08,0.9336489699780941,positive,news,Astera Labs Inc Stock (ALAB) Closed Up by 9.13% on Jun 8: What Investors Need To Know
MU,2026-06-08,0.921583503484726,positive,news,Coherent Corp Stock (COHR) Moved Up by 8.49% on Jun 8: Facts Behind the Movement
MU,2026-06-08,0.895374677143991,positive,news,SMH vs. SOXX: Which Semiconductor ETF Is Better?
MU,2026-06-08,-0.9272903874516487,negative,news,US 2-Year Yield Is Headed To 5%: Will The AI Chip Rally Break? - Micron Technology (NASDAQ:MU)
MU,2026-06-08,0.9344936013221741,positive,news,Corning Inc Stock (GLW) Moved Up by 5.55% on Jun 8: What Signal Does It Send?
MU,2026-06-08,0.6989322453737259,positive,news,"Stock Market Today, June 8: Marvell, Intel, and Micron Lead Tech Stock Rebound"
SBUX,2026-06-10,-0.3154630735516548,neutral,news,"Zacks Investment Ideas feature highlights: Eli Lilly, Home Depot, Procter & Gamble and Starbucks"
SBUX,2026-06-10,0.8261064346879721,positive,news,"Starbucks explores stake sale in Japan business, Bloomberg reports By Investing.com"
SBUX,2026-06-10,0.9298414941877127,positive,news,"Motley Fool Asset Management LLC Purchases 27,497 Shares of Starbucks Corporation $SBUX"
SBUX,2026-06-10,0.9075486622750759,positive,news,Starbucks (SBUX) Explores Options for Japanese Business Amid China Stake Sale
SBUX,2026-06-10,0.9312562625855207,positive,news,SBUX Stock Extends Rally: Starbucks Reportedly Explores Japan Stake Sale As CEO Sees More Global Growth Ahead
SBUX,2026-06-10,0.8405027128756046,positive,news,"Starbucks Weighs Japan Stake Sale In Strategic Review, Bloomberg Reports"
SBUX,2026-06-10,-0.38032039999961853,negative,news,Can Chili’s Same-Store Momentum Offset Margin Pressures Across Brinker International’s Portfolio (EAT)?
SBUX,2026-06-10,0.14959267061203718,neutral,news,"Starbucks said to weigh Japan unit options, including a stake sale, Bloomberg News reports"
SBUX,2026-06-09,0.0010517630726099014,neutral,news,[Form 4] STARBUCKS CORP Insider Trading Activity
SBUX,2026-06-09,0.9138245740905404,positive,news,"Starbucks Brews Up Plan for at Least 5,000 More U.S. Stores"
SBUX,2026-06-09,0.9300687108188868,positive,news,Starbucks shares rise as investors focus on summer beverage innovation and CEO conference appearance
SBUX,2026-06-09,0.8929599486291409,positive,news,Starbucks CEO says chain can double its international store count By Investing.com
SBUX,2026-06-09,0.9306565802544355,positive,news,"Starbucks Can Double Its Store Count Outside of the US, CEO Says"
SBUX,2026-06-09,-0.20548543334007263,negative,news,Starbucks Corp. stock outperforms competitors on strong trading day
SBUX,2026-06-09,0.47162186075001955,neutral,news,Turning Everyday Actions into Water Access: Inside Ecolab’s Role in Get Blue™
SBUX,2026-06-09,0.2609522007405758,neutral,news,"Matt Damon, Starbucks and Amazon join 'Get Blue' push on global water crisis"
SBUX,2026-06-09,0.3653598986566067,neutral,news,"Matt Damon's new campaign calls on Gap, Starbucks, and Amazon to help give water back to the earth"
SBUX,2026-06-09,0.5638974905014038,positive,news,A Look At Papa John’s (PZZA) Valuation As Toy Story 5 Partnership And AI Ordering Rollout Take Shape
SBUX,2026-06-08,0.9324438571929932,positive,news,"Starbucks Sees Encouraging Growth beyond the Morning Rush, CNBC Reports"
SBUX,2026-06-08,-0.9579322943463922,negative,news,Coffee Market Caught Between Surplus Expectations and Persistent Tightness
SBUX,2026-06-08,0.745223268866539,positive,news,"Brinker International director Allen sells $143,600 in shares"
SBUX,2026-06-08,0.9313050340861082,positive,news,Starbucks stock (US8552441094): March-quarter results keep the turnaround in focus
SBUX,2026-06-08,-0.9496746435761452,negative,news,Starbucks Decided AI Inventory Management Isn’t So Great After All
SBUX,2026-06-08,0.9357902212068439,positive,news,"ING Groep NV Acquires 138,875 Shares of Starbucks Corporation $SBUX"
SBUX,2026-06-08,-0.7909363061189651,negative,news,Can MariTide Save Amgen Stock From Its Fading Blockbusters?
SBUX,2026-06-08,0.004958678036928177,neutral,news,Clough Hedged Equity ETF (CBLS) - Latest News and Information - 股市爆料同學會
SBUX,2026-06-08,0.9299948113039136,positive,news,"Trust Co of Kansas Acquires 7,179 Shares of The Walt Disney Company $DIS"
SBUX,2026-06-08,0.9191448390483856,positive,news,Capital Group Private Client Services Inc. Grows Holdings in Starbucks Corporation $SBUX
