ticker,date,sentiment_score,sentiment_label,content_type,title
SBUX,2026-06-07,0.8879325082525611,positive,news,"McDonald’s bets on fancier chicken, airier restaurants to keep luring diners"
SBUX,2026-06-06,-0.9095031172037125,negative,news,The Price of Perfection for Analog Devices Stock
SBUX,2026-06-06,0.09753472171723843,neutral,news,Starbucks' Most Iconic Frappuccino Is Making a Comeback This Summer—Here’s How to Get One
SBUX,2026-06-06,0.13375965505838394,neutral,news,Pumpkin Spice Latte: How Starbucks Seasonal Icon Fits US Tastes
SBUX,2026-06-06,-0.8137586116790771,negative,news,WINTON GROUP Ltd Reduces Position in McDonald's Corporation $MCD
SBUX,2026-06-05,-0.8922758102416992,negative,news,NLRB Finds Starbucks Violated Labor Law in Pair of New Opinions
SBUX,2026-06-05,0.5359290689229965,positive,news,Starbucks Corp stock (US8552441094): Shares ease after recent rebound while valuation stays in focus
SBUX,2026-06-05,-0.060162631794810295,neutral,news,Brady Brewer sells SBUX stock via Fidelity (SBUX) across Mar–May 2026
SBUX,2026-06-05,0.598145236261189,positive,news,Starbucks (SBUX) Ties Part of Tech Bonuses to AI Usage
SBUX,2026-06-05,0.1728040874004364,positive,news,Starbucks Corp. stock underperforms Friday when compared to competitors despite daily gains
SBUX,2026-06-05,0.6863486990332603,positive,news,Delta Has 9 Million Amex Cardmembers — Who Are Carrying A Lot Of Debt
SBUX,2026-06-05,0.4477856010198593,positive,news,"Chipotle vs Starbucks: One Turnaround Is Real, One Is Just Smoke"
SBUX,2026-06-05,0.05152862332761288,neutral,news,"National Donut Day deals 2026: Get freebies at Krispy Kreme, Dunkin'"
SBUX,2026-06-05,0.9346589948982,positive,news,WCG Wealth Advisors LLC Boosts Holdings in Starbucks Corporation $SBUX
SBUX,2026-06-05,0.02008841559290886,neutral,news,"National Doughnut Day 2026: How to get free doughnuts from Krispy Kreme, Dunkin’ and more"
SBUX,2026-06-05,0.9211600162088871,positive,news,Cibc World Market Inc. Increases Holdings in Starbucks Corporation $SBUX
SBUX,2026-06-05,-0.6122362241148949,negative,news,The Bear Case: How CMG Behaves During Market Shocks
SBUX,2026-06-05,0.024564487859606743,neutral,news,"15 National Donut Day Deals: Get Free Dunkin’, Krispy Kreme and More"
SBUX,2026-06-04,0.09363565221428871,neutral,news,New Kroger Marketplace to open Friday in West Chester Township
SBUX,2026-06-04,-0.962478032335639,negative,news,Starbucks Corp. stock outperforms competitors despite losses on the day
SBUX,2026-06-04,0.9335053404793143,positive,news,"McDonald’s Unveils New Growth Strategy to Stay Ahead of Rising Competition, CNBC Reports"
BAC,2026-06-10,-0.8547603599727154,negative,news,JPMorgan Wins TRO Against $1.85B Morgan Stanley Team
BAC,2026-06-10,0.22535169031471014,neutral,news,Amazon Inks $17.5 Billion Loan in Financing Led by Citigroup
BAC,2026-06-10,0.792626447044313,positive,news,Bank of America rolls out referral program and payment tools
BAC,2026-06-10,0.9341614628210664,positive,news,"C Highlights Turnaround Progress, Solid Q2 Trading & IB Outlook"
BAC,2026-06-10,0.41054101940244436,neutral,news,"Bank of America Introduces New Ways to Reward Clients, Manage Payments and Track Credit"
BAC,2026-06-10,0.7059951899573207,positive,news,JPMorgan’s Lake sees longer road to agentic commerce adoption
BAC,2026-06-10,0.8609514385461807,positive,news,Wells Fargo CFO Just Confirmed $50B in NII. Here’s Why the Stock Still Looks Cheap
BAC,2026-06-10,-0.943794634193182,negative,news,JPMorgan Stock Has Lost 15% From Its Peak. Here’s Where the Stock Could Go
BAC,2026-06-10,-0.05479586124420166,negative,news,BTIG lowers Entergy stock price target on valuation adjustment
BAC,2026-06-10,0.9271538686007261,positive,news,What's Going On With Amazon Stock Wednesday?
BAC,2026-06-10,0.23179129976779222,neutral,news,Huntington Bank opens branch in Kernersville
BAC,2026-06-10,-0.9238645378500223,negative,news,REG - British Land Co PLC Bank of America Corp - Holding(s) in Company
BAC,2026-06-10,0.9308045543730259,positive,news,Franklin Resources Inc. Increases Stock Holdings in Howmet Aerospace Inc. $HWM
BAC,2026-06-10,-0.9434421490877867,negative,news,"Goldman Sachs Group Inc. Sells 713,518 Shares of FTAI Aviation Ltd. $FTAI"
BAC,2026-06-10,0.5834878012537956,positive,news,Japan's three largest banks aim for joint stablecoin issue by March
BAC,2026-06-10,-0.5680435299873352,negative,news,"Deutsche Bank AG Sells 772,799 Shares of Wells Fargo & Company $WFC"
BAC,2026-06-10,0.6966146556660533,positive,news,Caldwell Investment Management Ltd. Acquires New Holdings in Jacobs Solutions Inc. $J
BAC,2026-06-10,0.47627690341323614,neutral,news,Amazon inks $17.5B loan in financing led by Citigroup
BAC,2026-06-10,0.9002541480585933,positive,news,"HDFC Bank, peers increase FCNR deposit rates to 6% after RBI move"
BAC,2026-06-10,0.930410067550838,positive,news,"CenterBook Partners LP Invests $2.45 Million in DICK'S Sporting Goods, Inc. $DKS"
BAC,2026-06-10,0.9231755277141929,positive,news,"Bank of New York Mellon Corp Acquires 36,392 Shares of Zions Bancorporation, N.A. $ZION"
BAC,2026-06-10,0.8183282460086048,positive,news,"Cibc World Market Inc. Invests $2.11 Million in VeriSign, Inc. $VRSN"
BAC,2026-06-10,-4.8857182264328e-06,neutral,news,REG - Baillie Gifford US Bank of America Corp - Holding(s) in Company
BAC,2026-06-10,-0.27266329526901245,negative,news,"Baxter International (BAX) Faces Tough Road Ahead, Says Citi in Downgrade"
BAC,2026-06-10,0.05856672301888466,neutral,news,Is Citigroup (C) Still Attractive After A 76.6% One Year Share Price Surge?
BAC,2026-06-10,0.7658646311610937,positive,news,"Bank of America Highlights Surging Demand for AI-Led Treasury, Fx Solutions in Asia Pacific"
BAC,2026-06-10,0.9225535113364458,positive,news,Wells Fargo CFO Forecasts Rising Net Interest Income Amid Loan Growth
BAC,2026-06-09,0.9204249149188399,positive,news,Morgan Stanley Targeting $10 Trillion in Client Assets at Wealth Unit
BAC,2026-06-09,-0.8600950166583061,negative,news,Morgan Stanley sees US dollar weakening as Fed holds rates By Investing.com
BAC,2026-06-09,0.8077042028307915,positive,news,Affiliated Managers Group Secures $1.25 Billion Five-Year Revolving Credit Facility Led by Bank of America
BAC,2026-06-09,0.2182015348225832,neutral,news,Banco Bilbao Vizcaya Argentaria S.A. stock (ES0113211835): BBVA focuses on retail banking and digita
BAC,2026-06-09,0.8246929356828332,positive,news,"Rafael Santana, WAB president and CEO, sells $607,921 in company stock"
BAC,2026-06-09,0.9348588325083256,positive,news,"Morgan Stanley 'wide awake' to acquisition opportunities, CEO says"
BAC,2026-06-09,0.2536929128691554,neutral,news,BofA Kicks Off FIFA World Cup 2026™ With 2 Million Free Fan Bands and Fan Experiences Nationwide
BAC,2026-06-09,0.01947982981801033,neutral,news,Ameriprise (NYSE: AMP) prices 4.800% 2031 and 5.350% 2036 senior notes
BAC,2026-06-09,0.07425152976065874,neutral,news,BofA Kicks Off FIFA World Cup 2026™ With 2 Million Free Fan Bands and Fan Experiences Nationwide
BAC,2026-06-09,-0.00992700457572937,neutral,news,OceanFirst dumps $1.4B rent-stabilized loan book days after Flushing merger
BAC,2026-06-09,-0.05905526876449585,neutral,news,Equity Residential stock (US29476E1073): Merger plans with AvalonBay reshape outlook for apartment REIT
BAC,2026-06-09,0.29733020812273026,neutral,news,How Bank of America is using AI to improve customer experience
BAC,2026-06-09,0.6735912011936307,positive,news,Old National Bancorp stock (US6800331075): dividend payer with Midwest banking footprint in focus
BAC,2026-06-09,0.0897501390427351,neutral,news,Higher For Longer Banking Plays One Dividend Engine One Risk Test
BAC,2026-06-09,0.9402542877942324,positive,news,BofA Says Trading Revenue Is Trending Better Than 15% Projection
BAC,2026-06-09,0.04141414724290371,neutral,news,"Goldman Sachs (GS) sells $9M 6.00% callable notes due 2046, callable from 2029"
BAC,2026-06-09,0.45907308254390955,neutral,news,Citi hires Andrew Conway as global chair of consumer and retail investment banking
BAC,2026-06-09,0.7756315665319562,positive,news,Citi hires Andrew Conway as global chair of consumer and retail investment banking
BAC,2026-06-09,0.8930120952427387,positive,news,Valley National Bancorp stock hits 52-week high at 14.12 USD
BAC,2026-06-09,0.7575812265276909,positive,news,BofA warns investors to take profits as 70% of the bank’s bear market signals flash red
BAC,2026-06-09,0.9259438291192055,positive,news,State Street Corp stock hits all-time high at 164.04 USD
BAC,2026-06-09,0.9304168410599232,positive,news,Amazon.com Inc. (AMZN) Buy Rating Reiterated by BofA Securities
SCHW,2026-06-10,0.9354969626292586,positive,news,"Zacks Industry Outlook Highlights Morgan Stanley, The Charles Schwab and Interactive Brokers"
SCHW,2026-06-10,0.5222271233797073,positive,news,Key facts: BTC ETF Outflows $2.97B; Res ~65K tgt 72–74K; Extreme Fear
SCHW,2026-06-10,0.07103290036320686,neutral,news,"ETFs Investing in Mattel, Inc. Stocks"
SCHW,2026-06-09,0.22052024118602276,neutral,news,Fortune 45 LLC's Schwab International Equity ETF(SCHF) Holding History
SCHW,2026-06-09,-0.01827405020594597,neutral,news,Charles Schwab Corp (CENX) Form 144 shows proposed sale tied to awards
SCHW,2026-06-09,-0.9638121817260981,negative,news,Why GENZ’s High Yield Can’t Survive Its Shift From Casinos to Apps
SCHW,2026-06-08,0.017444390803575516,neutral,news,"Charles Schwab (AMPX) Rule 144 notice: 125,000 RSU shares proposed for sale"
SCHW,2026-06-08,0.9361500982195139,positive,news,Bank of New York Mellon Corp Boosts Position in KeyCorp $KEY
SCHW,2026-06-08,0.23603180050849915,positive,news,Charles Schwab Corp. stock (US8085131050): Trading activity index rebounds while shares tread water
SCHW,2026-06-08,0.002703620120882988,neutral,news,"CAVCO INDUSTRIES, INC. SEC Filing"
SCHW,2026-06-08,0.04096798412501812,neutral,news,"Zacks.com featured highlights include Ross Stores, TE Connectivity, Cenovus Energy, Globe Life and The Charles Schwab"
SCHW,2026-06-08,0.1487126862630248,neutral,news,"Zacks.com featured highlights include Ross Stores, TE Connectivity, Cenovus Energy, Globe Life and The Charles Schwab"
SCHW,2026-06-08,0.8588661551475525,positive,news,Schwab Trading Activity Index™: STAX Score Rebounds in May
SCHW,2026-06-08,0.10160861536860466,neutral,news,"Zacks.com featured highlights include Ross Stores, TE Connectivity, Cenovus Energy, Globe Life and The Charles Schwab"
SCHW,2026-06-08,0.21764713153243065,neutral,news,"Zacks.com featured highlights include Ross Stores, TE Connectivity, Cenovus Energy, Globe Life and The Charles Schwab"
SCHW,2026-06-08,0.41110463067889214,neutral,news,"Zacks.com featured highlights include Ross Stores, TE Connectivity, Cenovus Energy, Globe Life and The Charles Schwab"
SCHW,2026-06-08,-0.01339002326130867,neutral,news,"Affiliate sales total 25,404 shares for LASR (Symbol: LASR)"
SCHW,2026-06-08,0.015828803181648254,neutral,news,SMB vs. SCHO: The Short-Term Bond Decision That Starts With Your Tax Return
SCHW,2026-06-08,0.8617708645761013,positive,news,"The Charles Schwab Corp stock (US8085131055): Dividend, price and analyst tone in focus"
SCHW,2026-06-08,0.4943392835557461,positive,news,"Zacks.com featured highlights include Ross Stores, TE Connectivity, Cenovus Energy, Globe Life and The Charles Schwab"
SCHW,2026-06-08,0.8288683658465743,positive,news,Is VEA the Smartest Investment You Can Make Right Now?
SCHW,2026-06-07,0.005748314782977104,neutral,news,"ETFs Investing in Forgent Power Solutions, Inc. Class A Stocks"
SCHW,2026-06-07,0.8834569826722145,positive,news,Is VEA the Smartest Investment You Can Make Right Now?
SCHW,2026-06-07,0.004723668098449707,neutral,news,"ETFs Investing in Casella Waste Systems, Inc. Class A Stocks"
SCHW,2026-06-06,0.016274867579340935,neutral,news,ETFs Investing in Regal Rexnord Corporation Stocks
SCHW,2026-06-06,0.009347988292574883,neutral,news,"ETFs Investing in Molina Healthcare, Inc. Stocks"
SCHW,2026-06-06,0.016328725963830948,neutral,news,"ETFs Investing in AutoNation, Inc. Stocks"
SCHW,2026-06-06,0.010681206360459328,neutral,news,"ETFs Investing in Everus Construction Group, Inc. Stocks"
SCHW,2026-06-06,-0.009156834334135056,neutral,news,Schwab Fundamental U.S. Large Company ETF : FNDX
SCHW,2026-06-06,-0.21719172596931458,negative,news,The Charles Schwab Corporation $SCHW Shares Sold by Mount Capital Ltd
SCHW,2026-06-06,-0.8002348728477955,negative,news,Charles Schwab Digital Upgrades Spark Questions On Usage And Valuation Upside
SCHW,2026-06-06,-0.2691251337528229,negative,news,"152,845 Shares in The Charles Schwab Corporation $SCHW Purchased by PBU The Pension Fund of Early Childhood & Youth Educators"
SCHW,2026-06-06,0.031235186383128166,neutral,news,Charles Schwab Cash Sorting Story Shapes Retirement Planning Focus
SCHW,2026-06-05,0.09285789541900158,neutral,news,Investors Weigh LQD and SCHQ for Fixed-Income Exposure
SCHW,2026-06-05,-0.04394805617630482,neutral,news,"BorgWarner Inc. (BWA) Rule 144 notice lists 3,800 and 1,200 shares"
SCHW,2026-06-05,0.09168703854084015,neutral,news,Charles Schwab Corp. stock (US8085131050): shares hover around mid-90s ahead of next earnings update
SCHW,2026-06-05,0.0949993897229433,neutral,news,"LQD vs. SCHQ: Why the ""Safer"" Bond Fund Has Not Always Been the Better Choice"
SCHW,2026-06-05,-0.0840819925069809,neutral,news,Charles Schwab (NYSE: SKY) Form 144 shows insider sale of restricted stock
SCHW,2026-06-05,0.5843399297446012,positive,news,Schwab opens up trading on crypto futures.
SCHW,2026-06-05,0.8698354382067919,positive,news,"HOOD, Webull & Other Brokerages Gain as FINRA Eliminates PDT Rule"
SCHW,2026-06-05,0.017865480855107307,neutral,news,"Schwab Strategic Trust - Schwab U.S. TIPS ETF announces Monthly dividend, payable on June 05, 2026"
SCHW,2026-06-05,0.011643240228295326,neutral,news,"ETFs Investing in Nomura Real Estate Holdings, Inc. Stocks"
SCHW,2026-06-04,-0.9482033709064126,negative,news,"ENNIS, INC. ($EBF) CEO 2026 Pay Revealed"
SCHW,2026-06-04,0.9269310655072331,positive,news,"CIBC Asset Management Inc Acquires 156,229 Shares of The Charles Schwab Corporation $SCHW"
SCHW,2026-06-04,-0.47615769505500793,negative,news,"Schwab (SCHW) CFO reports 6,519-share tax withholding on RSU settlement"
SCHW,2026-06-04,-0.027287129312753677,neutral,news,Teresa L. Dick reports multiple FANG share sales (NASDAQ: FANG)
SCHW,2026-06-04,0.0988655686378479,neutral,news,"[144] ImmunityBio, Inc. SEC Filing"
SCHW,2026-06-04,0.060124109499156475,neutral,news,ETFs Investing in SiTime Corporation Stocks
SCHW,2026-06-04,0.9133994597941637,positive,news,Toronto-Dominion Should See US Loan Growth Turn Positive in Fiscal 2026
USB,2026-06-10,-0.9632757259532809,negative,news,Why is Norwegian Cruise Line stock sliding today?
USB,2026-06-10,-0.9196618162095547,negative,news,"Cunning Capital Partners LP Has $2.70 Million Stock Position in HCA Healthcare, Inc. $HCA"
USB,2026-06-09,0.9023415315896273,positive,news,Regional bank to spend $40M upgrading 56 St. Louis-area branches
USB,2026-06-09,0.9146788334473968,positive,news,CG Advances Wealth Management Push With Majority Stake in MAI
USB,2026-06-09,-0.9478684850037098,negative,news,"WINTON GROUP Ltd Acquires New Stake in American Healthcare REIT, Inc. $AHR"
USB,2026-06-08,0.03225316293537617,neutral,news,U.S. Bancorp (USB) issues $1.299M 5.70% callable notes maturing 2046
USB,2026-06-08,-0.9358823243528605,negative,news,Mizuho cuts Vail Resorts stock price target on weak visitation
USB,2026-06-08,-0.9241990391165018,negative,news,2 Large-Cap Stocks Worth Your Attention and 1 We Turn Down
USB,2026-06-08,0.14920816104859114,neutral,news,"30,221 Shares in Altria Group, Inc. $MO Bought by Hilton Head Capital Partners LLC"
USB,2026-06-08,0.8909256625920534,positive,news,Pinebridge Investments LLC Takes Position in Duke Energy Corporation $DUK
USB,2026-06-07,0.9236178211867809,positive,news,Norges Bank Makes New $61.86 Million Investment in Kite Realty Group Trust $KRG
USB,2026-06-06,0.9341679476201534,positive,news,"HCA Healthcare, Inc. $HCA Shares Purchased by Vestcor Inc"
USB,2026-06-06,0.924994345754385,positive,news,A Look At U.S. Bancorp (USB) Valuation As Multi Year Returns And Fidelity Partnership Assumptions Set The Tone
USB,2026-06-06,0.032732103019952774,neutral,news,"[8-K] DOMINION ENERGY, INC Reports Material Event"
USB,2026-06-05,0.7345316642895341,positive,news,U.S. Bancorp Completes Acquisition Of BTIG
USB,2026-06-05,0.02854190766811371,neutral,news,"U.S. Bancorp (USB) prices callable 10‑year notes at 5.41%, up to $40 fees"
USB,2026-06-05,0.04278680216521025,neutral,news,U.S. Bancorp (USB) prices 5.625% senior callable notes maturing 2041
USB,2026-06-05,0.8266100268810987,positive,news,Dominion Energy Agrees to $825 Million Senior Notes Issuance
USB,2026-06-05,0.05525223258882761,neutral,news,Dominion Energy prices $825M of 5.35% senior notes due 2036
USB,2026-06-05,-0.9233840573579073,negative,news,Is It Time To Reconsider U.S. Bancorp (USB) After Its Strong 1-Year Share Price Gain?
USB,2026-06-04,0.4194997167214751,neutral,news,U.S. Bank closes $1B BTIG acquisition as Charlotte executives steer integration
USB,2026-06-04,-0.9477957133203745,negative,news,Is U.S. Bancorp Stock Underperforming the Nasdaq?
USB,2026-06-04,-0.42105019092559814,negative,news,Is U.S. Bancorp Stock Underperforming the Nasdaq?
USB,2026-06-04,0.9391018059104681,positive,news,"Geode Capital Management LLC Buys 109,974 Shares of SEI Investments Company $SEIC"
USB,2026-06-04,0.005999017506837845,neutral,news,U.S. Bancorp to Speak at the Morgan Stanley U.S. Financials Conference
USB,2026-06-04,-0.9649402247741818,negative,news,"The Bancorp and Live Oak Bancshares Shares Plummet, What You Need To Know"
USB,2026-06-04,0.8210043935105205,positive,news,First Horizon (NYSE:FHN) Stock Price
USB,2026-06-03,0.9046550197526813,positive,news,Norges Bank Makes New $234.24 Million Investment in United Airlines Holdings Inc $UAL
USB,2026-06-03,0.9362631570547819,positive,news,"BW Gestao de Investimentos Ltda. Makes New $1.40 Million Investment in Ross Stores, Inc. $ROST"
USB,2026-06-03,0.026045439764857292,neutral,news,U.S. Bancorp (NYSE: USB) to issue 10-yr callable notes at 5.00%
USB,2026-06-03,0.015437478199601173,neutral,news,[424B3] US BANCORP \DE\ Prospectus Filed Pursuant to Rule 424(b)(3)
USB,2026-06-02,0.908347082324326,positive,news,Kennametal Inc. and Kennametal Europe Gmbh Enter Amendments to Credit Agreements Increasing Revolving Credit and Term Loan Facilities
USB,2026-06-02,0.9030635845847428,positive,news,"U.S. Bancorp Completes BTIG Buyout, Expands Capital Markets Platform"
USB,2026-06-02,0.782732620369643,positive,news,"U.S. Bancorp Completes BTIG Buyout, Expands Capital Markets Platform"
USB,2026-06-02,0.00810297392308712,neutral,news,U.S. Bancorp (USB) offers 5.40% callable notes due May 2041
USB,2026-06-02,0.9304283261299133,positive,news,U.S. Bancorp Closes Acquisition of BTIG
USB,2026-06-02,0.9337058011442423,positive,news,"Palo Alto Networks, Inc. $PANW Stake Lifted by Peapack Gladstone Financial Corp"
USB,2026-06-02,0.9284341419115663,positive,news,Press Release: U.S. Bancorp Completes Acquisition of BTIG
USB,2026-06-02,0.8075460102409124,positive,news,"BW Gestao de Investimentos Ltda. Acquires Shares of 102,473 Core Natural Resources, Inc. $CNR"
USB,2026-06-01,0.8287802543491125,positive,news,#47 Valley Bank's COO is Building an AI-ready bank
USB,2026-06-01,0.11651844903826714,neutral,news,NSTS Bancorp shareholders elect directors and approve auditor appointment
USB,2026-06-01,0.015549283474683762,neutral,news,U.S. Bancorp (NYSE: USB) registers 6.6M shares issued in merger
USB,2026-06-01,0.1793798143044114,neutral,news,"U.S. Bancorpcompleted the acquisition of BTIG, LLC from Condor Trading LP."
USB,2026-06-01,0.5906424708664417,positive,news,BMO Hires TD’s van Arragon for Domestic Business Banking Role
USB,2026-06-01,0.009704524651169777,neutral,news,Federated Hermes Enhanced Income ETF(PAYR) - 股價行情、配息與走勢圖 - 股市爆料同學會
USB,2026-06-01,0.005221433937549591,neutral,news,U.S. Bancorp (USB) offers 5.70% callable notes due June 2046
USB,2026-06-01,0.10306337289512157,neutral,news,U.S. Bancorp closes acquisition of BTIG
USB,2026-06-01,0.8653110042214394,positive,news,U.S. Bancorp completes acquisition of BTIG By Investing.com
MRK,2026-06-10,0.9330569636076689,positive,news,Camzyos Priority Review And New Oncology Data Could Be A Game Changer For Bristol-Myers Squibb (BMY)
MRK,2026-06-10,0.9422151818871498,positive,news,IDEXX Laboratories Stock’s 63% Gross Margin Story: Here’s What the Numbers Say About a $909 Target
MRK,2026-06-10,0.8224642351269722,positive,news,Merck Stock Moves Above 50-Day SMA: Assessing Its Investment Case
MRK,2026-06-10,-0.9243142027407885,negative,news,"Wills Financial Group LLC Lowers Position in Merck & Co., Inc. $MRK"
MRK,2026-06-10,0.9311971021816134,positive,news,"TIAA Trust National Association Has $29.33 Million Holdings in Merck & Co., Inc. $MRK"
MRK,2026-06-10,0.7193735828623176,positive,news,"North Dallas Bank & Trust Co. Purchases Shares of 11,958 Merck & Co., Inc. $MRK"
MRK,2026-06-10,0.9359815940260887,positive,news,"Letko Brosseau & Associates Inc. Increases Holdings in Merck & Co., Inc. $MRK"
MRK,2026-06-10,-0.7587730810046196,negative,news,"Merck & Co., Inc. $MRK Stock Holdings Decreased by GFS Advisors LLC"
MRK,2026-06-10,0.937297385185957,positive,news,"Merck & Co., Inc. $MRK Shares Acquired by Brandes Investment Partners LP"
MRK,2026-06-10,0.9335189098492265,positive,news,"Brandes Investment Partners LP Acquires 45,860 Shares of CVS Health Corporation $CVS"
MRK,2026-06-09,0.17383155226707458,positive,news,"Gilead, Merck Report Positive Phase III HIV Study Data, End NSCLC Study"
MRK,2026-06-09,0.7893553860485554,positive,news,"Merck & Co., Inc. stock (US58933Y1055): Cancer portfolio drives growth amid patent and pricing quest"
MRK,2026-06-09,0.9229363203048706,positive,news,BioNTech (BNTX) and Bristol Myers Share New Results From ROSETTA Lung-02 Study
MRK,2026-06-09,0.788431148044765,positive,news,UnitedHealth Group Sparks Healthcare Rotation Buzz
MRK,2026-06-09,-0.033582236617803574,neutral,news,7 Health Care Stocks With Whale Alerts In Today's Session
MRK,2026-06-09,0.93870382104069,positive,news,Exelixis stock hits all-time high at 52.98 USD By Investing.com
MRK,2026-06-09,-0.7989629283547401,negative,news,"Merck, Gilead serve ‘sweet and sour’ spread after HIV win, cancer stumble"
MRK,2026-06-09,0.9314953405410051,positive,news,"Pfizer, Inc. (PFE) Stock Analysis: Exploring a 12% Potential Upside Amid Robust Free Cash Flow and Strong Dividend Yield"
MRK,2026-06-09,0.6020331755280495,positive,news,"Merck (MRK) Explores Treatment Options for Rare Ebola Strain, Reuters Reports"
MRK,2026-06-09,0.25768670067191124,neutral,news,"Merck (MRK) Explores Treatment Options for Rare Ebola Strain, Reuters Reports"
MRK,2026-06-09,0.6352214217185974,positive,news,"GSK in talks to buy cancer drugmaker Nuvalent for over $9 bln, FT reports"
MRK,2026-06-08,0.6651136418804526,positive,news,"[Press release] Gilead and Merck announce positive topline results from two Phase 3 studies evaluating islatravir/lenacapavir, an oral once-weekly HIV treatment"
MRK,2026-06-08,0.9324047518894076,positive,news,"Merck, Gilead share positive phase 3 results from combination HIV pill"
MRK,2026-06-08,0.776168892160058,positive,news,Gilead and Merck’s Once-Weekly HIV Combo Pill Works in Trials
MRK,2026-06-08,0.06003093719482422,neutral,news,"ETFs Investing in Merck & Co., Inc. Stocks"
MRK,2026-06-08,0.9099975004792213,positive,news,"Gilead and Merck Announce Positive Topline Results From Two Phase 3 Studies Evaluating Islatravir/Lenacapavir, an Oral Once-Weekly HIV Treatment"
MRK,2026-06-08,0.9246784383431077,positive,news,Is AbbVie Stock The Right Defensive Pick In This Volatile Market?
MRK,2026-06-08,0.6718637216836214,positive,news,"CG Oncology Touts Cretostimogene Data, BLA Progress in Bladder Cancer Push"
MRK,2026-06-08,-0.05368500202894211,neutral,news,Discover RadNet And 2 Other Stocks Estimated To Be Trading Below Intrinsic Value
MRK,2026-06-08,0.9343557264655828,positive,news,Mercury General Corp stock (US58933Y1055): insurance player among June’s stronger gainers
MRK,2026-06-08,0.8179423734545708,positive,news,J&J makes $1B bet on emerging DAC space by netting Firefly Bio
MRK,2026-06-07,0.9000776149332523,positive,news,StockWatch: Abivax Survives a Roller Coaster Week
MRK,2026-06-07,-0.42457854747772217,negative,news,"Merck & Co., Inc. $MRK Stake Cut by ING Groep NV"
MRK,2026-06-07,0.9384447494521737,positive,news,"Los Angeles Capital Management LLC Increases Stake in Merck & Co., Inc. $MRK"
MRK,2026-06-07,-0.777920126914978,negative,news,"Los Angeles Capital Management LLC Sells 676,504 Shares of Gilead Sciences, Inc. $GILD"
MRK,2026-06-07,-0.9559458028525114,negative,news,"Dearborn Partners LLC Decreases Holdings in Merck & Co., Inc. $MRK"
MRK,2026-06-06,0.9113830318674445,positive,news,Recommended High-Yield ETF: Schwab U.S. Dividend Equity ETF
MRK,2026-06-06,0.11321296729147434,neutral,news,Wynn Resorts CEO Craig Billings among US business leaders to have met with Chinese Foreign Minister Wang Yi
MRK,2026-06-06,0.22172916121780872,neutral,news,Wynn Resorts CEO Craig Billings among US business leaders to meet with Chinese Foreign Minister Wang Yi
MRK,2026-06-06,0.6715890467166901,positive,news,"Vestcor Inc Sells 22,707 Shares of Merck & Co., Inc. $MRK"
MRK,2026-06-06,0.9294930594041944,positive,news,"Westfield Capital Management Co. LP Invests $5.64 Million in Merck & Co., Inc. $MRK"
MRK,2026-06-06,0.8959629898890853,positive,news,"PBU The Pension Fund of Early Childhood & Youth Educators Purchases Shares of 95,333 Gilead Sciences, Inc. $GILD"
MRK,2026-06-06,0.9417504165321589,positive,news,"BI Asset Management Fondsmaeglerselskab A S Grows Position in Merck & Co., Inc. $MRK"
