ticker,date,sentiment_score,sentiment_label,content_type,title
AAPL,2026-06-09,0.8901920393109322,positive,news,"Apple's WWDC 2026 Event Shows 'Clearer' Paths to Monetizing AI, Morgan Stanley Says"
AAPL,2026-06-09,0.40424263291060925,neutral,news,Water.org and Founding Partners Launch Get Blue™ to Bring Water Home™ Through Everyday Actions
AAPL,2026-06-09,0.9075700603425503,positive,news,Wedbush Says Apple (NASDAQ: AAPL) WWDC Signals A Foundational AI Consumer Platform Shift With Siri AI Unveiling
AAPL,2026-06-09,0.3300974862650037,neutral,news,Apple Taps Google and Nvidia to Power Next-Generation AI
AAPL,2026-06-09,-0.9393883477896452,negative,news,"Apple failed to make its AI tool to comply to EU regulations, EU Commission says"
AAPL,2026-06-09,-0.9315376561135054,negative,news,Apple’s AI Push Fails To Impress Wall Street: Analysts Say New AI Features Won’t Spark iPhone Upgrade Cycle
AAPL,2026-06-09,-0.4488346725702286,negative,news,Apple’s AI Push Fails To Impress Wall Street: Analysts Say New AI Features Won’t Spark iPhone Upgrade Cycle
AAPL,2026-06-09,0.9317528735846281,positive,news,Morgan Stanley raises Apple stock price target to $360 on AI strategy
AAPL,2026-06-09,0.9300419818609953,positive,news,Morgan Stanley raises Apple stock price target to $360 on AI strategy
AAPL,2026-06-09,0.6626581260934472,positive,news,"Apple expands parental controls at WWDC with web, category limits"
AAPL,2026-06-09,0.07388697378337383,neutral,news,"Alphabet Inc - Ordinary Shares - Class C (GOOG) News, Articles, Events & Latest Updates"
AAPL,2026-06-09,0.9340781252831221,positive,news,The Walt Disney Company $DIS Shares Bought by Cerity Partners LLC
AAPL,2026-06-09,0.9254588149487972,positive,news,Churchill Financial Advisors LLC Makes New $17.15 Million Investment in Apple Inc. $AAPL
AAPL,2026-06-09,0.8528812443837523,positive,news,"BLI Banque de Luxembourg Investments Takes $7.71 Million Position in VeriSign, Inc. $VRSN"
AAPL,2026-06-09,0.9350677598267794,positive,news,NVIDIA Corporation $NVDA Shares Bought by Allstate Corp
AAPL,2026-06-09,0.10906851105391979,neutral,news,APPLE INC : Gets a Neutral rating from UBS
AAPL,2026-06-09,0.03930278122425079,neutral,news,Apple Downplays Concerns Using Google AI Models Will Undermine Privacy
AAPL,2026-06-09,-0.83245450258255,negative,news,"CNBC Daily Open: Tim Cook's last WWDC, tech IPOs and Middle East tensions"
AAPL,2026-06-09,0.665186963044107,positive,news,Apple unveils an upgraded Siri voice assistant with new AI features at its annual conference
AAPL,2026-06-09,-0.9615209111943841,negative,news,Apple Finally Released A Brand-New Siri. Then Its Share Price Cratered.
AAPL,2026-06-08,-0.8429704643785954,negative,news,"ANTITRUST NEWS: Epic Games opposes Apple petition for certiorari in steering dispute (Jun 8, 2026)"
AAPL,2026-06-08,0.5931156873703003,positive,news,MSCI confirms early index inclusion rules ahead of SpaceX IPO By Reuters
AAPL,2026-06-08,0.8958454811945558,positive,news,Apple refines Liquid Glass design and expands child safety tools at WWDC
AAPL,2026-06-08,0.7969848234206438,positive,news,"Apple wires Anthropic, Google and OpenAI AI into its app-building tools"
AAPL,2026-06-08,0.21783392317593098,neutral,news,Apple debuts Siri AI as a more personal assistant built on Gemini
AAPL,2026-06-08,0.8900895714759827,positive,news,"Hey, Siri: Apple just announced a long-awaited AI update"
AAPL,2026-06-08,-0.6462838985025883,negative,news,Apple’s New Siri AI Represents a Make-or-Break Moment for Founders
AAPL,2026-06-08,0.430447107180953,neutral,news,Wearables data is entering clinical care as adoption grows
AAPL,2026-06-08,0.9321473808959126,positive,news,Why is this Wealth Manager Buying 1 Million Shares of Harley Davidson?
AAPL,2026-06-08,0.3712072893977165,neutral,news,Apple renames Siri as ‘Siri AI’ with new push into artificial intelligence
AAPL,2026-06-08,0.7811231529340148,positive,news,From Siri AI to child safety tools: Key takeaways from Apple's WWDC
AAPL,2026-06-08,0.0405704565346241,neutral,news,Moody's Publishes Generative AI Slide Deck on Agentic Workflows
AAPL,2026-06-08,-0.09871847182512283,neutral,news,Apple users will have more control over Liquid Glass with iOS 27
AAPL,2026-06-08,0.47042318154126406,neutral,news,Apple Just Announced ‘Siri AI.’ Is the Company Finally Going to Deliver a Good Siri?
AAPL,2026-06-08,0.845321474596858,positive,news,Apple's AI Ambition Has A Picks-and-Shovels Trade — Here's Who Could Win
AAPL,2026-06-08,0.2714749099686742,neutral,news,Apple builds Siri AI and photo editing into new Apple Intelligence
AAPL,2026-06-08,0.411499141715467,neutral,news,Apple Intelligence brings powerful AI capabilities into everyday experiences
AAPL,2026-06-08,0.5648623276501894,positive,news,Apple’s Siri is finally getting a big AI upgrade
AAPL,2026-06-08,0.8455202672630548,positive,news,"WWDC26: Apple unveils next generation of Apple Intelligence, Siri AI, powerful parental controls, and an expansive set of software improvements"
AAPL,2026-06-08,0.2271624505519867,positive,news,"Apple Investors Give Lukewarm Reaction to New Siri, AI Platform"
AAPL,2026-06-08,0.8296923786401749,positive,news,Intel's Stock Is Soaring. Hopes of Chipmaking Deals With Google and Nvidia Are Lifting the Shares.
AAPL,2026-06-08,-0.9610054939985275,negative,news,"WIX Stock Drops To Lowest Levels Since January 2017 – Reduction In Revenue, Bookings Guidance Dampen Investor Sentiment"
AAPL,2026-06-08,-0.8052905611693859,negative,news,Apple iPhone Users Win Class Certification for Biometric Suit
AAPL,2026-06-08,-0.7060736753046513,negative,news,Apple's Beta Website Says 'We'll Be Back Soon' Just Ahead of WWDC
AAPL,2026-06-08,0.9358147829771042,positive,news,NUBURU (BURU) Stock Climbs as Tekne Acquisition Reaches Italian Regulatory Milestone
AAPL,2026-06-08,0.7490463191643357,positive,news,Apple expected to unveil new AI features at last developers conference with CEO Tim Cook
AAPL,2026-06-08,0.4591261148452759,positive,news,Is Intel Corporation (INTC) A Good Stock To Buy Now?
AAPL,2026-06-08,0.9112095404416323,positive,news,Apple Is 'Famously Late To New Markets': Why Gene Munster Says 2026 Is 'The Most Important WWDC' In 43 Years
AAPL,2026-06-08,0.018226169049739838,neutral,news,Tim Cook's Final WWDC Prediction Market Preview: What Will Apple Announce For The Next Era?
AAPL,2026-06-08,0.8408570466563106,positive,news,Inno Holdings Inc. Contracts Development of AI Sales Agent for Used Mobile Phone Market
ADBE,2026-06-09,-0.589061051607132,negative,news,Glacier Bancorp (GBCI) Valuation Check After Recent Mixed Share Price Performance
ADBE,2026-06-09,-0.9598361309617758,negative,news,TD Cowen Slashes Adobe Stock Target Price Ahead of Q2 Earnings; Citing Slowing Growth Trends
ADBE,2026-06-08,0.9254971127957106,positive,news,Cadence Design Systems Inc. stock outperforms competitors on strong trading day
ADBE,2026-06-08,-0.96772142034024,negative,news,Adobe Inc. stock underperforms Monday when compared to competitors
ADBE,2026-06-08,0.9330118130892515,positive,news,Why is Fabrinet stock rallying 5% today? By Investing.com
ADBE,2026-06-08,-0.49115604162216187,negative,news,"Earnings Volatility Watch: Oracle, Adobe And 8 Stocks Set For Big Swings This Week"
ADBE,2026-06-08,0.26852969266474247,neutral,news,Oracle and Adobe are part of Zacks Earnings Preview
ADBE,2026-06-08,0.9169689770787954,positive,news,"TD Cowen Maintains Adobe(ADBE.US) With Hold Rating, Maintains Target Price $285"
ADBE,2026-06-08,0.7335987985134125,positive,news,Adobe price tries to gather positive momentum - Forecast today - 08-06-2026
ADBE,2026-06-08,-0.9547781366854906,negative,news,"Volatility Shares 2x Ether ETF (NASDAQ: ETHU) Turns $10,000 Into $2,160 Since New Year's Day As Leverage Math Destroys Retail Holders"
ADBE,2026-06-08,0.7390034478157759,positive,news,"Adobe Q2 2026 Earnings Preview — June 11, Street Expects $5.81 EPS"
ADBE,2026-06-08,0.9176834989339113,positive,news,"LG Display Co Ltd (ADR) stock (US5023351025): Earnings pressure, restructuring and opportunities in OLED"
ADBE,2026-06-08,0.8337346594780684,positive,news,Meet the Bank CEO Who’s Still Embracing Social Impact
ADBE,2026-06-06,-0.014006292447447777,neutral,news,Adobe Inc (Derivatives) to Euro Price Today | Live ADBE to EUR Converter & Exchange Rate
ADBE,2026-06-05,-0.716192739084363,negative,news,Trump Loaded Up on ServiceNow Stock at the Peak of SaaS-pocalypse Fears. What Comes Next for Software Stocks.
ADBE,2026-06-05,0.7662738859653473,positive,news,"Oracle Q4 2026 Earnings Preview — June 10, Street Expects $1.96 EPS"
ADBE,2026-06-05,-0.030818922445178032,neutral,news,What’s Happening in the Markets This Week
ADBE,2026-06-05,-0.9650286380201578,negative,news,Adobe Inc. stock underperforms Friday when compared to competitors
ADBE,2026-06-05,-0.2828573249280453,neutral,news,"Adobe Inc (Derivatives) Price | ADBE Price Today, Live Chart, USD converter, Market Capitalization"
ADBE,2026-06-05,0.9206177163869143,positive,news,"Citigroup Adjusts Price Target on Adobe to $264 From $253, Maintains Neutral Rating"
ADBE,2026-06-05,0.5877039274200797,positive,news,From vision to reality: Delivering progress across design and make industries
ADBE,2026-06-05,0.064796706661582,neutral,news,How Lydia Hall turned a parenting challenge into Adobe’s first app for kids
ADBE,2026-06-04,0.7971152467653155,positive,news,Sitecore acquires Scrunch for answer engine optimization
ADBE,2026-06-04,0.936386788263917,positive,news,Adobe Systems (ADBE) Reports Next Week: Wall Street Expects Earnings Growth
ADBE,2026-06-04,0.7519135372713208,positive,news,Tech Firm Veeva Relocates to 62K-SF Office at Vornado’s Penn 2
ADBE,2026-06-04,0.9225980397313833,positive,news,Adobe Stock 2026 Outlook: Q2 Earnings on June 11 and a $25 Billion Buyback in Place
ADBE,2026-06-04,0.1171976001933217,neutral,news,Amex Platinum vs. Business Platinum: Which Card Is Best for You?
ADBE,2026-06-04,0.6651696786284447,positive,news,Adobe Systems (ADBE) Reports Next Week: Wall Street Expects Earnings Growth
ADBE,2026-06-04,0.9325577765703201,positive,news,Glassy Mountain Advisors Inc. Increases Stake in Taiwan Semiconductor Manufacturing Company Ltd. $TSM
ADBE,2026-06-04,-0.9527993248775601,negative,news,"Bank of New York Mellon Corp Sells 34,571 Shares of Cadence Design Systems, Inc. $CDNS"
ADBE,2026-06-04,0.0013324078172445297,neutral,news,HRB News | H&R BLOCK INC (NYSE:HRB)
ADBE,2026-06-04,-0.7194981127977371,negative,news,"Anirudh Devgan Sells 25,005 Shares of Cadence Design Systems (NASDAQ:CDNS) Stock"
ADBE,2026-06-04,-0.8652943857014179,negative,news,"Cadence Design Systems (NASDAQ:CDNS) VP Sells $2,789,276.71 in Stock"
ADBE,2026-06-03,-0.9377746321260929,negative,news,Here's Why Adobe Systems (ADBE) Fell More Than Broader Market
ADBE,2026-06-03,-0.9682643231935799,negative,news,Adobe Inc. stock underperforms Wednesday when compared to competitors
ADBE,2026-06-03,0.0575694777071476,neutral,news,Autonomous service still needs a human handoff
ADBE,2026-06-03,0.1650405041873455,neutral,news,How to choose a B2B e-commerce platform
ADBE,2026-06-03,-0.9532834347337484,negative,news,Adobe considering two internal executives for CEO position
ADBE,2026-06-03,0.5014504725113511,positive,news,"Adobe Eyes Two Internal Leaders, AI Outsiders for CEO Role"
ADBE,2026-06-03,0.8750904141925275,positive,news,Regions Bank earns No. 1 spot for bank satisfaction
ADBE,2026-06-03,0.46517549455165863,positive,news,"Billion-Dollar Cash Flow, 8% Growth, And A Category That's Done Expanding: The Docusign Problem"
ADBE,2026-06-03,0.050043340772390366,neutral,news,"Adobe looks internally, externally, to replace CEO Narayen: report (ADBE:NASDAQ)"
ADBE,2026-06-03,0.038586078211665154,neutral,news,This Trade for Adobe Systems Profits if the Stock Stays Above $220
ADBE,2026-06-03,0.1080159479752183,neutral,news,Adobe’s CMO on agentic tools for marketers and responsible AI governance
ADBE,2026-06-03,-0.6770991757512093,negative,news,Palantir's $369 Billion Valuation Requires Unprecedented Federal Market Share (PLTR)
ADBE,2026-06-03,0.3560042381286621,positive,news,A Look At Tandem Diabetes Care (TNDM) Valuation After Recent Share Price Volatility
ADBE,2026-06-03,0.04158039577305317,neutral,news,The CREATOR Act is the protection artists need in the age of AI
ADBE,2026-06-03,-0.2843446731567383,negative,news,A Look At Brighthouse Financial (BHF) Valuation As The Aquarian Deal And Earnings Path Take Shape
ADBE,2026-06-02,0.869857395067811,positive,news,DoubleVerify Holdings (DV) Gets a Buy from J.P. Morgan
QCOM,2026-06-09,0.9134205859154463,positive,news,SLB Collaborates With Qualcomm On Edge AI Solutions For Energy Operations
QCOM,2026-06-09,0.838487652130425,positive,news,SLB Collaborates with Qualcomm on Edge AI Solutions for Energy Operations
QCOM,2026-06-09,-0.8749001659452915,negative,news,A Look At Taiwan Semiconductor Manufacturing (NYSE:TSM) Valuation After Strong Recent Share Price Gains
QCOM,2026-06-09,0.7529849866405129,positive,news,"New TI chip watches EV batteries from inside, warning early"
QCOM,2026-06-08,-0.9058181270956993,negative,news,Qualcomm Hit With Second Redstone Patent Suit Over Core Design
QCOM,2026-06-08,-0.8892468754202127,negative,news,Qualcomm Hit With Second Redstone Patent Suit Over Core Design
QCOM,2026-06-08,0.04582332633435726,neutral,news,"Qualcomm Options Spot-On: On June 8th, 79,154 Contracts Were Traded, With 1.16 Million Open Interest"
QCOM,2026-06-08,0.5525895040482283,positive,news,"SDG&E, Qualcomm and UC San Diego Launch Edge AI Collaboration to Advance Wildfire and Extreme-Weather Response"
QCOM,2026-06-08,0.2203371962532401,neutral,news,"SDG&E, Qualcomm launch AI wildfire monitoring system in California"
QCOM,2026-06-08,0.9182971157133579,positive,news,Impinj Jumps 8.6% Amid Sector-Wide Rally
QCOM,2026-06-08,0.0034199953079223633,neutral,news,[144] Granite Point Mortgage Trust Inc. SEC Filing
QCOM,2026-06-08,-0.8420294299721718,negative,news,India Inc exits MSCI EM top 10 as AI-driven stocks dominate benchmark
QCOM,2026-06-08,0.9071531221270561,positive,news,US Stocks Rebound From Selloff as Nvidia Leads Big-Tech Gains
QCOM,2026-06-08,0.9344322681427002,positive,news,Barclays Raises Hewlett Packard Enterprise (HPE) Price Target on Sustained Demand Strength
QCOM,2026-06-08,0.789834595285356,positive,news,Intel (INTC) and Hitachi Team Up to Accelerate Physical AI Across Industries
QCOM,2026-06-08,0.031200498342514038,neutral,news,"Bristol-Myers Upgraded, Broadcom Downgraded: Updated Rankings on Top Blue-Chip Stocks"
QCOM,2026-06-08,0.832117335870862,positive,news,Teradyne Introduces Integrated Test Solution for AI and Data Center Devices in Collaboration with Tokyo Electron
QCOM,2026-06-08,-0.27488337457180023,negative,news,QUALCOMM Incorporated (QCOM) is Attracting Investor Attention: Here is What You Should Know
QCOM,2026-06-08,0.8094563996419311,positive,news,Citizens Sees Microsoft (MSFT) AI Strategy Supporting Long-Term Upside
QCOM,2026-06-08,-0.7911211475729942,negative,news,Broadcom’s Post-Earnings Slide Highlights These ETFs
QCOM,2026-06-08,0.5873116254806519,positive,news,Apple (AAPL) Is A Top Stock In Billionaire Ken Fisher’s Portfolio
QCOM,2026-06-08,0.938588934019208,positive,news,Is Humana Stock Outperforming the Nasdaq?
QCOM,2026-06-08,0.600556917488575,positive,news,QUALCOMM Incorporated stock (US7475251036): AI boom meets sharp pullback after Dragonfly reveal
QCOM,2026-06-08,0.9376323465257883,positive,news,Stifel Raises Marvell (MRVL) Price Target on AI Data Center Opportunity
QCOM,2026-06-08,0.8068248624913394,positive,news,AMD’s £2bn UK AI push backs new supercomputers and fusion research
QCOM,2026-06-08,0.319031092338264,neutral,news,"Innodisk Showcases Full Qualcomm Dragonwing Edge AI Lineup at Computex 2026, Spanning Dragonwing IQ8 Through IQ10"
QCOM,2026-06-08,0.22918196767568588,neutral,news,"Innodisk Showcases Full Qualcomm Dragonwing Edge AI Lineup at Computex 2026, Spanning Dragonwing IQ8 Through IQ10"
QCOM,2026-06-08,0.9354908019304276,positive,news,Stifel Raises Marvell (MRVL) Price Target on AI Data Center Opportunity
QCOM,2026-06-08,0.00017554685473442078,neutral,news,QUALCOMM Incorporated Shs Canadian Depository Receipt Hedged Reg S Trade Ideas — NEO:QCOM
QCOM,2026-06-07,0.9135689781978726,positive,news,Can Power Integrations (POWI) GaN AI Data Center Push Redefine Its Competitive Moat?
QCOM,2026-06-07,0.0149918831884861,neutral,news,Qualcomm Co-Founder Irwin Jacobs Was Told To Study Hotel Management — Instead He Built A $253 Billion Gia
QCOM,2026-06-07,0.4056758573278785,neutral,news,"14 AI Stocks Making Headlines on Wall Street: Qualcomm, Microsoft, and More"
QCOM,2026-06-07,0.9275667229667306,positive,news,"Dear Qualcomm Stock Fans, Mark Your Calendars for June 24"
QCOM,2026-06-06,0.929377842694521,positive,news,"The Smartest Dividend ETF to Buy With $1,000 Right Now -- and It's Up 19% in 2026"
QCOM,2026-06-06,0.8695785813033581,positive,news,Vise Technologies Inc. Grows Position in Qualcomm Incorporated $QCOM
QCOM,2026-06-06,0.8200498959049582,positive,news,"78,611 Shares in Qualcomm Incorporated $QCOM Bought by PBU The Pension Fund of Early Childhood & Youth Educators"
QCOM,2026-06-06,-0.9453827030956745,negative,news,"EULAV Asset Management Sells 8,000 Shares of Qualcomm Incorporated $QCOM"
QCOM,2026-06-06,-0.9171168524771929,negative,news,What Just Happened To Stocks…
QCOM,2026-06-06,-0.9435064289718866,negative,news,Is This Pullback in Hecla Mining Stock an Opportunity or a Trap?
QCOM,2026-06-06,-0.9581957757472992,negative,news,Mineralys Therapeutics Stock In Shambles: Down -25% With 6-Day Losing Streak
QCOM,2026-06-05,-0.9508388889953494,negative,news,"Indie semiconductor COO Wittmann sells $190,446 shares"
QCOM,2026-06-05,-0.9229722693562508,negative,news,What Just Happened To Stocks…
QCOM,2026-06-05,-0.9668743312358856,negative,news,"Intel, AMD stocks slide again in aftermath of Broadcom's weak outlook"
QCOM,2026-06-05,-0.9671547673642635,negative,news,Qualcomm Inc Stock (QCOM) Moved Down by 9.52% on Jun 5: What Signal Does It Send?
QCOM,2026-06-05,-0.9670161223039031,negative,news,Qualcomm Inc. stock underperforms Friday when compared to competitors
QCOM,2026-06-05,-0.967340693809092,negative,news,Tech stocks today: Chip stocks remain pressured as Broadcom earnings spook AI investors
QCOM,2026-06-05,0.9200262576341629,positive,news,WCG Wealth Advisors LLC Grows Holdings in Qualcomm Incorporated $QCOM
QCOM,2026-06-05,0.6971831545233727,positive,news,Total Wealth Planning & Management Inc. Makes New Investment in Qualcomm Incorporated $QCOM
QCOM,2026-06-05,0.9001168571412563,positive,news,Harvest Fund Management Co. Ltd Raises Stock Position in Qualcomm Incorporated $QCOM
MCD,2026-06-09,0.9338742662221193,positive,news,LPL Financial LLC Raises Stake in McDonald's Corporation $MCD
MCD,2026-06-09,0.9128464302048087,positive,news,"Fox Run Management L.L.C. Purchases Shares of 6,231 McDonald's Corporation $MCD"
MCD,2026-06-09,0.9319286961108446,positive,news,"Cerity Partners LLC Acquires 22,249 Shares of McDonald's Corporation $MCD"
MCD,2026-06-09,-0.3811172544956207,negative,news,Fiera Capital Corp Cuts Stock Position in McDonald's Corporation $MCD
MCD,2026-06-09,0.9328442756086588,positive,news,"CenterBook Partners LP Invests $3.49 Million in Texas Roadhouse, Inc. $TXRH"
MCD,2026-06-08,0.7452235594391823,positive,news,"Brinker International director Allen sells $143,600 in shares"
MCD,2026-06-08,0.07289509661495686,neutral,news,Ashlee Weisser elevated to CFO at First Watch (NASDAQ: FWRG)
MCD,2026-06-08,-0.039835125207901,negative,news,Is Uber Stock Poised For A Rally?
MCD,2026-06-08,0.9357902416959405,positive,news,"ING Groep NV Acquires 138,875 Shares of Starbucks Corporation $SBUX"
MCD,2026-06-08,0.48411968257278204,neutral,news,McDonald’s outlines new strategic course
MCD,2026-06-08,0.8559337258338928,positive,news,Franklin Resources Inc. Has $1.30 Billion Stock Position in McDonald's Corporation $MCD
MCD,2026-06-08,0.937473151832819,positive,news,McDonald's Corporation $MCD Shares Purchased by O Shaughnessy Asset Management LLC
MCD,2026-06-08,-0.928792666643858,negative,news,"TD Asset Management Inc Sells 174,064 Shares of Texas Roadhouse, Inc. $TXRH"
MCD,2026-06-08,0.1872472269460559,neutral,news,"Capital World Investors Buys 23,851 Shares of McDonald's Corporation $MCD"
MCD,2026-06-08,0.9132696948945522,positive,news,"Texas Roadhouse, Inc. $TXRH Position Increased by Capital World Investors"
MCD,2026-06-08,0.8128904141485691,positive,news,"BNP Paribas Financial Markets Boosts Holdings in Texas Roadhouse, Inc. $TXRH"
MCD,2026-06-07,0.8661347925662994,positive,news,"McDonald’s bets on fancier chicken, airier restaurants to keep luring diners"
MCD,2026-06-07,0.8879322232678533,positive,news,"McDonald’s bets on fancier chicken, airier restaurants to keep luring diners"
MCD,2026-06-07,0.8865352850407362,positive,news,"McDonald’s bets on fancier chicken, airier restaurants to keep luring diners"
MCD,2026-06-07,-0.8034421177580953,negative,news,The Biggest Scandals In McDonald's History
MCD,2026-06-07,0.9041299605742097,positive,news,"WINTON GROUP Ltd Invests $4.01 Million in Texas Roadhouse, Inc. $TXRH"
MCD,2026-06-07,-0.7988585531711578,negative,news,McDonald's Corporation $MCD Shares Sold by Capital Research Global Investors
MCD,2026-06-07,0.9212097115814686,positive,news,"Capital International Sarl Acquires 6,079 Shares of McDonald's Corporation $MCD"
MCD,2026-06-06,0.5133437113836408,positive,news,How Spam became one of the most iconic American brands of all time
MCD,2026-06-06,0.42513761296868324,neutral,news,"McDonald's tests new AI drive-thru system, Archy IQ (MCD:NYSE)"
MCD,2026-06-06,-0.8137584403157234,negative,news,WINTON GROUP Ltd Reduces Position in McDonald's Corporation $MCD
MCD,2026-06-06,0.9161511640995741,positive,news,McDonald's Corporation $MCD Shares Acquired by Vise Technologies Inc.
MCD,2026-06-06,-0.9277714528143406,negative,news,111 Capital Decreases Stake in McDonald's Corporation $MCD
MCD,2026-06-06,0.06408563256263733,positive,news,McDonald's testing AI drive-thru order-taking system called ArchIQ at five locations across country
MCD,2026-06-05,-0.8024675250053406,negative,news,Assessing Restaurant Brands International’s Valuation After Governance Support And New Growth Initiatives
MCD,2026-06-05,-0.9494060147553682,negative,news,Livforsakringsbolaget Skandia Omsesidigt Has $1.26 Million Stock Position in McDonald's Corporation $MCD
MCD,2026-06-05,0.9244758253917098,positive,news,"Prudential PLC Acquires 7,950 Shares of McDonald's Corporation $MCD"
MCD,2026-06-05,0.024564402177929878,neutral,news,"15 National Donut Day Deals: Get Free Dunkin’, Krispy Kreme and More"
MCD,2026-06-04,0.7702315850183368,positive,news,"McDonald's Next Strategy: Menu Innovation, In-Store Tech, and Hospitality Focus in 2026 - News and Statistics"
MCD,2026-06-04,0.8826574664562941,positive,news,Burger King Mandalorian Kids Meal Highlights Restaurant Brands Family Push
MCD,2026-06-04,0.5204899879172444,positive,news,McDonald’s announces latest corporate strategy initiative
MCD,2026-06-04,0.9335053535178304,positive,news,"McDonald’s Unveils New Growth Strategy to Stay Ahead of Rising Competition, CNBC Reports"
MCD,2026-06-04,0.9346248935908079,positive,news,TD Asset Management Inc Grows Stake in McDonald's Corporation $MCD
MCD,2026-06-04,0.025446457788348198,neutral,news,"National Donut Day: Get free donuts at Krispy Kreme, Dunkin', more"
MCD,2026-06-03,0.1712862141430378,neutral,news,Exclusive: Inside Yum's effort to predict what customers will crave next
MCD,2026-06-03,-0.949617313221097,negative,news,Starbucks Corp. stock (US8552441094): shares ease on Nasdaq as investors digest turnaround plan and Q2 earnings
MCD,2026-06-03,-0.9673873861320317,negative,news,McDonald's Corp. stock underperforms Wednesday when compared to competitors
MCD,2026-06-03,0.8324723113328218,positive,news,McDonald’s has a new strategy: Make its stores “easier to run”
MCD,2026-06-03,-0.8869983050972223,negative,news,Rice Partnership LLC Cuts Stake in McDonald's Corporation $MCD
MCD,2026-06-03,0.9293803218752146,positive,news,"10,232 Shares in McDonald's Corporation $MCD Bought by Marble Wealth LLC"
MCD,2026-06-03,0.9336253609508276,positive,news,CIBC Asset Management Inc Boosts Stock Holdings in McDonald's Corporation $MCD
MCD,2026-06-03,0.778647338040173,positive,news,"Geode Capital Management LLC Grows Position in Texas Roadhouse, Inc. $TXRH"
MCD,2026-06-03,-0.9531713183969259,negative,news,Bridges Investment Management Inc. Reduces Stock Position in McDonald's Corporation $MCD
MCD,2026-06-03,0.40478119254112244,positive,news,"Bank of New York Mellon Corp Purchases 40,506 Shares of McDonald's Corporation $MCD"
MCD,2026-06-03,0.8736282642930746,positive,news,"McDonald’s bets on fancier chicken, airier restaurants to keep luring diners"
JPM,2026-06-09,0.625654324889183,positive,news,How The Truist Financial (TFC) Story Is Shifting As Analyst Views Diverge
JPM,2026-06-09,0.7554902387782931,positive,news,New Chase tools let small-business owners track credit and customers
JPM,2026-06-09,0.3485284745693207,positive,news,Citigroup stock hits 52-week high at 135.83 USD By Investing.com
JPM,2026-06-09,0.9259438160806894,positive,news,State Street Corp stock hits all-time high at 164.04 USD
JPM,2026-06-09,0.9357178043574095,positive,news,PAR Technology (NYSE:PAR) Upgraded at JPMorgan Chase & Co.
JPM,2026-06-09,0.8430321007035673,positive,news,Apollo Leads $35 Billion Capital Solution for Broadcom AI XPV Platform in Partnership with Blackstone and Leading Global Banks
JPM,2026-06-09,0.7919614426791668,positive,news,Here's How AI-Driven Hiring Shifts Could Reshape Banks' Performances
JPM,2026-06-09,0.5772038847208023,positive,news,Analysts’ Opinions Are Mixed on These Utilities Stocks: Centerpoint Energy (CNP) and Entergy (ETR)
