ticker,date,sentiment_score,sentiment_label,content_type,title
AAPL,2026-02-19,0.06568490713834763,neutral,news,Peeling Back the Apple: Shareholder Activists Seek to Expose Company's China Entanglements
AAPL,2026-02-19,0.07298308610916138,neutral,news,"Steve Jobs Saved Apple by Overcoming ‘Divestiture Aversion.’ It Will Work for You, Too"
AAPL,2026-02-19,0.9272964904084802,positive,news,A Shift in Leadership: NVIDIA Tops Holdings in iShares MSCI World ETF
AAPL,2026-02-19,0.8824387043714523,positive,news,AI: Clearer view on Apple's AI Wearables. RTZ #1002
AAPL,2026-02-19,0.9320659823715687,positive,news,"Woodline Partners LP Boosts Apple Inc Stake by 472,035 Shares"
AAPL,2026-02-19,-0.9080060301348567,negative,news,"I Can't Go Into Details Legally"": Carnival Cruise Line Ambassador Issues Rare Warning To Passengers After Guest Falls Victim To Fake Group"
AAPL,2026-02-19,0.927698839455843,positive,news,"Chilton Investment Co LLC Boosts Apple Stake by 4,741 Shares"
AAPL,2026-02-19,0.36053117364645004,neutral,news,Google and Apple bring AI music creation to mainstream consumers
AAPL,2026-02-19,-0.6558497995138168,negative,news,"Synaptics (NASDAQ:SYNA) Insider Sells $48,919.68 in Stock"
AAPL,2026-02-19,0.0008342564105987549,neutral,news,"Apple Podcast Connect's terms of service, Feb 18, 2026"
AAPL,2026-02-18,-0.8999247141182423,negative,news,British Consumer Association Withdraws Competition Claim Against Qualcomm
AAPL,2026-02-18,0.9331843256950378,positive,news,"Cadence Design Systems shares pop on earnings beat, custom chip optimism"
AAPL,2026-02-18,0.012508168816566467,neutral,news,Apple Watch could miss hypertension diagnoses in seniors
AAPL,2026-02-18,0.28964874148368835,positive,news,Morning Business Report: FAA orders merit-based pilot certification as Apple expands and Wendy’s closes stores
AAPL,2026-02-18,-0.9255244620144367,negative,news,"PayPal (PYPL) is Facing Stiff Competition From Apple, Believes Jim Cramer"
AAPL,2026-02-18,0.28980589658021927,neutral,news,Apple to kill app support for Intel-based Macs next year
AAPL,2026-02-18,0.5035036951303482,positive,news,"Google Gemini, Apple Add Music-Focused Generative AI Features"
AAPL,2026-02-18,0.9410784300416708,positive,news,Apple (AAPL) Just Overtook the 20-Day Moving Average
AAPL,2026-02-18,0.9373382311314344,positive,news,Newmont's Q4 Earnings Expected to Show Strong Growth
AAPL,2026-02-18,-0.8849168121814728,negative,news,"Wells Fargo & Company Reaffirms ""Equal Weight"" Rating for Masimo (NASDAQ:MASI)"
AAPL,2026-02-18,-0.9379902835935354,negative,news,Valley Wealth Sells $11 Million of Invesco KBW Bank ETF
AAPL,2026-02-18,0.9341701194643974,positive,news,Westinghouse Air Brake Technologies stock hits all-time high at 262.55 USD
AAPL,2026-02-18,-0.9622730324044824,negative,news,"Berkshire reduces Apple stake, FDA to review Moderna vaccine"
AAPL,2026-02-18,-0.9658968551084399,negative,news,PayPal CEO Exit Coincides With Weakest Quarterly Performance in Years; Investors Question Timing of Leadership Announcement
AAPL,2026-02-18,-0.8057383075356483,negative,news,Apple’s Services Juggernaut Hits Record Highs Amid Growing Hardware Headwinds
AAPL,2026-02-18,-0.002086237072944641,neutral,news,Mark Zuckerberg said he reached out to Apple CEO Tim Cook to discuss 'wellbeing of teens and kids'
AAPL,2026-02-18,-0.08811164647340775,neutral,news,"The 2x Leveraged SSO ETF Can Double Your Returns, Until Volatility Strikes"
AAPL,2026-02-18,0.14226576499640942,neutral,news,"Apple, Ulta Beauty, AstraZeneca And A Real Estate Stock On CNBC's 'Final Trades'"
AAPL,2026-02-18,0.19605982676148415,neutral,news,"The 2x Leveraged SSO ETF Can Double Your Returns, Until Volatility Strikes"
AAPL,2026-02-18,-0.9163354430347681,negative,news,Buffett Dumps More Apple
AAPL,2026-02-18,-0.9621873125433922,negative,news,"PayPal (PYPL) is Facing Stiff Competition From Apple, Believes Jim Cramer"
AAPL,2026-02-18,-0.9436999438330531,negative,news,"This is the most under-owned megacap tech stock, according to Morgan Stanley"
AAPL,2026-02-18,-0.8166496828198433,negative,news,\'Double-dipping\' dispute over Qualcomm iPhone chips finally ends
AAPL,2026-02-18,-0.8883985094726086,negative,news,Apple Quietly Drops ESG Links From Top Executives’ Pay Packages
AAPL,2026-02-18,0.14254741929471493,neutral,news,Right Now Retirees Should Forget Dividend Stocks And Flip to This Income Strategy Instead
AAPL,2026-02-18,0.9397420156747103,positive,news,Advisors Capital Management LLC Grows Stake in Medtronic PLC $MDT
AAPL,2026-02-18,0.9057875648140907,positive,news,Vodafone Adds 20.4 Million Shares to Treasury in Ongoing Buyback
AAPL,2026-02-18,0.9299304820597172,positive,news,Danaher buys patient monitoring specialist Masimo in $9.9B deal
AAPL,2026-02-18,0.6619601771235466,positive,news,Apple Eyeing Meta And Snap’s Turf? 3 New AI Gadgets Reportedly In Works
AAPL,2026-02-18,0.1751950765028596,neutral,news,Closing the Intent-to-Execution Gap May Define Next Wave of AI Investment
AAPL,2026-02-18,0.7266687527298927,positive,news,"Buffett Pivots: Berkshire Sells Amazon, Buys NYT in Portfolio Shake-up"
AAPL,2026-02-18,0.8837664164602757,positive,news,"Buffett Pivots: Berkshire Sells Amazon, Buys NYT in Portfolio Shake-up"
AAPL,2026-02-18,-0.9683294263668358,negative,news,Why Vulcan Materials (VMC) Shares Are Trading Lower Today
AAPL,2026-02-17,0.44007900916039944,neutral,news,Apple Accelerates Development of Three AI-Powered Wearable Devices
AAPL,2026-02-17,-0.9388347873464227,negative,news,"Buffett's Final Filing: Berkshire Initiates New York Times Stake, Slashes Amazon Position Before CEO Transition"
AAPL,2026-02-17,-0.4981917291879654,negative,news,Stocks Recover on Strength in Apple and Airline Stocks
AAPL,2026-02-17,0.2722804704681039,neutral,news,Apple Podcasts to Support Video Shows in Major Update
AAPL,2026-02-17,0.7596422675997019,positive,news,Apple Is Making a Major Change to Its Podcasts App. It Arrives This Spring
AAPL,2026-02-17,0.9275626055896282,positive,news,What's Going On With Apple Stock Tuesday?
AAPL,2026-02-17,0.9114265078678727,positive,news,Apple’s AI push welcomed by Wedbush analysts amid investor trepidation
CRM,2026-02-19,-0.9536511087790132,negative,news,"The Buyout Case for Salesforce Is Real, but Marc Benioff Stands in the Way"
CRM,2026-02-18,-0.9355578804388642,negative,news,The PEPM Death Spiral: How AI Automation is Cannibalizing the Human Capital Management Sector
CRM,2026-02-18,-0.8580915965139866,negative,news,Jim Cramer Discusses Salesforce (CRM) Stock
CRM,2026-02-18,-0.930517852306366,negative,news,Qualcomm’s Analysts Are Throwing in the Towel—Time to Be Brave?
CRM,2026-02-18,0.9170261332765222,positive,news,Global Payments builds salesforce
CRM,2026-02-18,-0.9146903771907091,negative,news,Salesforce.com (CRM) Earnings Expected to Grow: Should You Buy?
CRM,2026-02-18,-0.9635085230693221,negative,news,"Safety Insurance Group, Inc. Plans Quarterly Dividend of $0.92 (NASDAQ:SAFT)"
CRM,2026-02-18,0.9339040443301201,positive,news,L3Harris Is Up 28% in the Last 6 Months. Here’s Where the Stock Could Go in 2026
CRM,2026-02-18,-0.7792306467890739,negative,news,"Cercano Management LLC Sells 43,313 Shares of S&P Global Inc. $SPGI"
CRM,2026-02-18,0.9400490652769804,positive,news,Comfort Systems USA Is Up 20% in the Last 30 Days. Here’s What to Expect in 2026
CRM,2026-02-18,-0.9594537261873484,negative,news,Zacks Research Has Negative Outlook for ARE Q1 Earnings
CRM,2026-02-18,0.7073211064562201,positive,news,AcuityMD Announces AcuityMD for Salesforce on Salesforce AppExchange
CRM,2026-02-18,-0.9020774140954018,negative,news,The Death of the 'Seat': How AI Agents Triggered the 2026 SaaSpocalypse for Salesforce and Adobe
CRM,2026-02-18,0.48188617173582315,neutral,news,Saltbox Mgmt Launches Halston Aerospace: An Interactive Demo of the End-to-End B2B Journey on Salesforce
CRM,2026-02-18,-0.9003140926361084,negative,news,The Top 5 Analyst Questions From Paycom's Q4 Earnings Call
CRM,2026-02-18,0.9377851150929928,positive,news,PNC Financial Services Group Inc. Boosts Stake in Ford Motor Company $F
CRM,2026-02-18,0.5841522943228483,positive,news,AcuityMD Announces AcuityMD for Salesforce on Salesforce AppExchange
CRM,2026-02-18,0.907581053674221,positive,news,ServiceNow Insiders Buy as Wall Street Panics Over an AI SaaSpocalypse
CRM,2026-02-18,0.8676909022033215,positive,news,Salesforce vs. Oracle: Which Cloud Software Stock Is the Better Bet?
CRM,2026-02-18,0.8878121990710497,positive,news,Frontline plc (NYSE:FRO) Sees Call Volume Spike in NYSE Composite
CRM,2026-02-17,0.08459964767098427,neutral,news,Ardagh Metal Packaging (NYSE:AMBP) Short Interest Up on NYSE Composite
CRM,2026-02-17,0.2252189815044403,positive,news,"Starboard Value raises stakes in Kenvue, Riot Platforms By Reuters"
CRM,2026-02-17,0.6950695440173149,positive,news,ValueAct Capital's Strategic Move: BlackRock Inc. Takes Center Stage with 10.59% Portfolio Share
CRM,2026-02-17,0.8977734800428152,positive,news,Salesforce's acquisition of Cimulate to boost AI shopping
CRM,2026-02-17,0.881003157235682,positive,news,IBM named a Leader in the 2026 Gartner® Magic Quadrant™ for Augmented Data Quality Solutions
CRM,2026-02-17,-0.9331123903393745,negative,news,Stock Traders Buy High Volume of Oceaneering International Call Options (NYSE:OII)
CRM,2026-02-17,-0.14938262104988098,neutral,news,7 New 5-Star Stocks This Week
CRM,2026-02-17,-0.8748479150235653,negative,news,Salesforce.com (CRM) Stock Falls Amid Market Uptick: What Investors Need to Know
CRM,2026-02-17,0.016303032636642456,neutral,news,"‘Heads I win, tails I win’ market environment"
CRM,2026-02-17,0.9080353686586022,positive,news,Why Gartner keeps ranking Salesforce's Informatica a data quality Leader
CRM,2026-02-17,0.9317401256412268,positive,news,Pan American Silver Set to Announce Q4 Earnings
CRM,2026-02-17,0.933563407510519,positive,news,Omnicom Named a Leader in Commerce Services by Independent Research Firm
CRM,2026-02-17,0.9342157747596502,positive,news,Amazon’s Financial Backing Sends Gaxos.ai Shares Soaring
CRM,2026-02-17,0.26687173917889595,neutral,news,Salesperson Inc. Launches First-Ever National B2B Salesperson Day to Honor America's 1.6 Million Business-to-Business Sales Professionals
CRM,2026-02-17,0.8433879390358925,positive,news,Morgan Stanley upgrades Veeva after 45% plunge from peak to stock’s 10-year low
CRM,2026-02-17,0.4900544248521328,positive,news,Salesforce vs. Oracle: Which Cloud Software Stock Is the Better Bet?
CRM,2026-02-17,0.9053467474877834,positive,news,Qlik Named a Leader in the 2026 Gartner® Magic Quadrant™ for Augmented Data Quality Solutions
CRM,2026-02-17,0.8582812286913395,positive,news,Tyler Technologies logs 10th straight year on GovTech 100 list
CRM,2026-02-17,0.9098747484385967,positive,news,"AI to coordinate two-thirds of field service teams by 2028, ISG says"
CRM,2026-02-17,0.9016599208116531,positive,news,Wix and QuickBooks link up to put small-business money and websites together
CRM,2026-02-17,0.62513018399477,positive,news,Salesforce vs. Oracle: Which Cloud Software Stock Is the Better Bet?
CRM,2026-02-17,0.731602692976594,positive,news,"Korro Bio (NASDAQ:KRRO) Upgraded to ""Outperform"" at William Blair"
CRM,2026-02-17,0.9156661704182625,positive,news,"ServiceNow, Inc. (NOW): Needham Maintains a Buy Rating"
CRM,2026-02-17,0.924328101798892,positive,news,Salesforce Inc. $CRM Position Lifted by NEOS Investment Management LLC
CRM,2026-02-17,0.9218021454289556,positive,news,Salesforce Inc. $CRM Shares Purchased by Skandinaviska Enskilda Banken AB publ
CRM,2026-02-17,0.9371756184846163,positive,news,"Mondrian Investment Partners LTD Buys Shares of 544,196 Salesforce Inc. $CRM"
CRM,2026-02-17,0.9392825094982982,positive,news,ServiceNow Inc (NOW) Sees Subscription Sales Accelerating in 2026
CRM,2026-02-17,-0.9407775839790702,negative,news,Adobe Inc (ADBE)’s Upside Potential Tested by Lawsuits and Strategy Shifts
CRM,2026-02-17,-0.0018394887447357178,negative,news,PNC Financial Services Group Inc. Increases Holdings in Citigroup Inc. $C
TXN,2026-02-19,0.929753502830863,positive,news,Texas Instruments Incorporated $TXN Shares Bought by Rothschild & Co Wealth Management UK Ltd
TXN,2026-02-19,0.02303493767976761,neutral,news,"The Zacks Analyst Blog Applied Materials, McDonald's, Texas Instruments and Lulu's Fashion Lounge"
TXN,2026-02-19,0.8467344641685486,positive,news,Texas Instruments By Law Shift Reframes Legal Risks And Valuation Context
TXN,2026-02-18,0.9211243838071823,positive,news,"Top Research Reports for Applied Materials, McDonald's & Texas Instruments"
TXN,2026-02-18,0.9351098537445068,positive,news,Analog Devices Stock Rises After Earnings. The Chipmaking Business Is Booming.
TXN,2026-02-18,0.9391103275120258,positive,news,Analog Devices surges after Q1 results and outlook beat estimates
TXN,2026-02-18,0.935909966006875,positive,news,Analog Devices Stock Rises After Earnings. Chip Maker’s Strong Year Continues.
TXN,2026-02-18,0.9375351602211595,positive,news,Ingalls & Snyder LLC Has $9.54 Million Stock Position in STMicroelectronics N.V. $STM
TXN,2026-02-18,0.7106026643887162,positive,news,"CenterBook Partners LP Buys 140,702 Shares of Texas Instruments Incorporated $TXN"
TXN,2026-02-18,0.6595299728214741,positive,news,First National Bank of Omaha Makes New Investment in Texas Instruments Incorporated $TXN
TXN,2026-02-18,-0.9544219793751836,negative,news,"M&G PLC Sells 12,624 Shares of Texas Instruments Incorporated $TXN"
TXN,2026-02-18,0.39785978849977255,neutral,news,"TI to Acquire Silicon Labs, Plus Other News in the Semiconductor World"
TXN,2026-02-17,-0.9513052850961685,negative,news,SCHD ETF gets extremely overbought: Is it a good dividend stock?
TXN,2026-02-17,-0.2164464294910431,negative,news,NEOS Investment Management LLC Raises Stock Position in Texas Instruments Incorporated $TXN
TXN,2026-02-17,0.9220735915005207,positive,news,Texas Instruments Incorporated $TXN Shares Bought by Skandinaviska Enskilda Banken AB publ
TXN,2026-02-17,0.8868847945705056,positive,news,Mondrian Investment Partners LTD Makes New Investment in Texas Instruments Incorporated $TXN
TXN,2026-02-17,-0.9016074389219284,negative,news,STMicroelectronics Stock: Slight Decline Despite Solid Quarterly Momentum
TXN,2026-02-16,0.9397156815975904,positive,news,Analog Devices to Report Q1 Earnings: What's in Store for the Stock?
TXN,2026-02-16,0.7456710785627365,positive,news,Vanguard Group Inc. Grows Position in Texas Instruments Incorporated $TXN
TXN,2026-02-16,-0.8140227682888508,negative,news,"Are MCFT, SLAB, WBS, TWO Obtaining Fair Deals for their Shareholders?"
TXN,2026-02-16,0.630573776550591,positive,news,"HighTower Advisors LLC Purchases 26,873 Shares of Texas Instruments Incorporated $TXN"
TXN,2026-02-16,-0.8944163639098406,negative,news,"Insiders At Texas Instruments Sold US$5.4m In Stock, Alluding To Potential Weakness"
TXN,2026-02-16,0.9351258650422096,positive,news,Analog Devices to Report Q1 Earnings: What's in Store for the Stock?
TXN,2026-02-16,-0.9577369093894958,negative,news,Capital Planning Advisors LLC Cuts Stake in Texas Instruments Incorporated $TXN
TXN,2026-02-16,0.8434746279381216,positive,news,Inside the 200MW AI data centers AMD and TCS want to build in India
TXN,2026-02-16,0.40714624896645546,neutral,news,Want Decades of Passive Income? Buy This Index Fund and Hold It Forever.
TXN,2026-02-15,0.8344219718128443,positive,news,Want Decades of Passive Income? Buy This Index Fund and Hold It Forever.
TXN,2026-02-15,0.9170753639191389,positive,news,Troy Asset Management Ltd Has $33.60 Million Stock Holdings in Texas Instruments Incorporated $TXN
TXN,2026-02-15,0.8079726006835699,positive,news,"Public Sector Pension Investment Board Purchases 9,945 Shares of Texas Instruments Incorporated $TXN"
TXN,2026-02-15,-0.9258964899927378,negative,news,Illinois Municipal Retirement Fund Has $5.12 Million Stock Holdings in Texas Instruments Incorporated $TXN
TXN,2026-02-15,0.8996821399778128,positive,news,Assessing Texas Instruments (TXN) Valuation After Strong Recent Share Price Momentum
TXN,2026-02-14,-0.7972970455884933,negative,news,Schwab US Dividend Equity ETF Sees Inflows Amid Mixed Performance
TXN,2026-02-14,0.9369616359472275,positive,news,Texas Instruments Climbed 20% in the Last 30 Days. Here’s Where It Could Go in 2026
TXN,2026-02-14,0.934780839830637,positive,news,"Ameritas Advisory Services LLC Acquires 5,854 Shares of Texas Instruments Incorporated $TXN"
TXN,2026-02-14,0.6240683943033218,positive,news,The Truth About ON Semiconductor Corp: Is This ‘Boring’ Chip Stock Your Next Power Move?
TXN,2026-02-14,0.6155984327197075,positive,news,Microchip Technology Targets Edge AI Servers And EVs With New Push
TXN,2026-02-13,0.9298323299735785,positive,news,Texas Instruments Buys Silicon Labs As AI And Valuation Questions Loom
TXN,2026-02-13,0.8141826344653964,positive,news,Here's How Much $1000 Invested In Texas Instruments 20 Years Ago Would Be Worth Today
TXN,2026-02-13,0.06518304347991943,positive,news,Is It Too Late To Consider Tower Semiconductor (TSEM) After Its 177% One Year Surge?
TXN,2026-02-13,0.5071845715865493,positive,news,"Fund Update: 144,500 TEXAS INSTRUMENTS (TXN) shares added to Findlay Park Partners LLP portfolio"
TXN,2026-02-13,-0.9644034886732697,negative,news,Texas Instruments Incorporated $TXN Shares Sold by Atria Investments Inc
TXN,2026-02-13,-0.9535225722938776,negative,news,GS Investments Inc. Has $2.11 Million Stock Holdings in Texas Instruments Incorporated $TXN
TXN,2026-02-13,0.9373619798570871,positive,news,"Trio-Tech Reports 82% Revenue Growth in Q2 FY2026, Reflecting Expanding Role in AI and EV Semiconductor Reliability Testing"
TXN,2026-02-13,0.8551702350378036,positive,news,Analog Devices Inc. Is Quietly Eating the Chip World – Is This Stock Your Next Power Move?
TXN,2026-02-12,-0.9623090708628297,negative,news,"Insider Selling: Texas Instruments (NASDAQ:TXN) CFO Sells 64,532 Shares of Stock"
TXN,2026-02-12,-0.9236721154302359,negative,news,"Insider Selling: Texas Instruments (NASDAQ:TXN) VP Sells 10,248 Shares of Stock"
TXN,2026-02-12,-0.9616229962557554,negative,news,Texas Instruments (TXN) stock slips after early jump as chip sector weakens ahead of CPI
TXN,2026-02-12,-0.9550669090822339,negative,news,Varma Mutual Pension Insurance Co Lowers Stake in Texas Instruments Incorporated $TXN
TXN,2026-02-12,0.22455516271293163,neutral,news,Analog Devices Weighs Shareholder Rights Against Long Term Governance Priorities
TXN,2026-02-12,0.9129044264554977,positive,news,Texas Instruments (NASDAQ:TXN) Upgraded at DZ Bank
SBUX,2026-02-19,-0.8516678772866726,negative,news,"First National Bank of Omaha Acquires Shares of 24,081 Starbucks Corporation $SBUX"
SBUX,2026-02-18,0.2509063435718417,neutral,news,Burger King's president is giving customers his phone number
SBUX,2026-02-18,0.8607864379882812,positive,news,“Sustained Oversight Failures of Labor Relations”: Starbucks Stock (NASDAQ:SBUX) Gains Despite New Investor Concerns
SBUX,2026-02-18,0.9365200530737638,positive,news,Intraday volume spike lifts KO.SW The Coca-Cola Company to CHF59.76 on 18 Feb 2026: watch CHF61.37 resistance
SBUX,2026-02-18,-0.9563770443201065,negative,news,Starbucks: Dividend at a Crossroads as Turnaround Unfolds
SBUX,2026-02-18,-0.9496453916653991,negative,news,Starbucks' investor group urges shareholders to replace directors over labor row
SBUX,2026-02-18,-0.8835970256477594,negative,news,Goldman Sachs scraps DEI criteria for its board as business case for boardroom diversity grows
SBUX,2026-02-18,-0.9542726734653115,negative,news,Can Synopsys Stock Recover If Markets Fall?
SBUX,2026-02-17,0.9267769679427147,positive,news,Assessing Brinker International's Valuation After Strong Quarter And Raised Guidance Attract Analyst Upgrades
SBUX,2026-02-17,-0.9503228086978197,negative,news,Starbucks Corporation $SBUX Shares Sold by Glenview Trust Co
SBUX,2026-02-17,-0.5889526158571243,negative,news,Aberdeen Group plc Decreases Holdings in Kimberly-Clark Corporation $KMB
SBUX,2026-02-16,0.9318481795489788,positive,news,PNC Financial Services Group Inc. Raises Holdings in Starbucks Corporation $SBUX
SBUX,2026-02-16,0.9261540584266186,positive,news,"Assetmark Inc. Acquires 45,332 Shares of First Trust Core Investment Grade ETF $FTCB"
SBUX,2026-02-16,0.886657364666462,positive,news,"With BTS’ V as its brand ambassador, the launch of South Korean brand Compose Coffee could give Starbucks, operated in the Philippines by the Tantocos’ Rustan Coffee Corporation, more serious competition"
SBUX,2026-02-15,-0.9621715201064944,negative,news,McDonald’s stock price dips after a late-week swing as upgrades collide with a busy macro calendar
SBUX,2026-02-14,0.6028156727552414,positive,news,McDonald’s stock: MCD pulls back from $335 high as Argus upgrades; traders watch new McCafé drinks
SBUX,2026-02-14,0.25103007536381483,neutral,news,Pumpkin Spice Latte: Why Starbucks’ Most Hyped Drink Still Owns Fall
SBUX,2026-02-14,0.6656205579638481,positive,news,Pumpkin Spice Latte: Why Starbucks’ Most Hyped Drink Still Owns Fall
SBUX,2026-02-14,-0.2633916139602661,negative,news,A Look At Chipotle Mexican Grill (CMG) Valuation After First Comp Sales Decline And Ackman Exit
SBUX,2026-02-14,0.9346485529094934,positive,news,Assetmark Inc. Raises Holdings in Starbucks Corporation $SBUX
SBUX,2026-02-14,0.9182764887809753,positive,news,Prospecting: Restaurant Brands Tops Estimates Despite Popeyes U.S. Slump.
SBUX,2026-02-13,0.9320159796625376,positive,news,Golden Arches Glimmer: McDonald’s Defies Economic Headwinds with Dominant Q4 Earnings Beat
SBUX,2026-02-13,-0.012846533209085464,neutral,news,Daily Coffee Report 2/13/26
SBUX,2026-02-13,0.9246895732358098,positive,news,Dutch Bros Inc. SEC 10-K Report
SBUX,2026-02-13,-0.9540679734200239,negative,news,Starbucks Corporation $SBUX Shares Sold by Cibc World Market Inc.
SBUX,2026-02-12,-0.9660444650799036,negative,news,How Chipotle lost its sizzle
SBUX,2026-02-12,0.08024339750409126,neutral,news,Braskem Announces Petrobras Waives Preemptive and Tag-Along Rights in Potential Share Transfer
SBUX,2026-02-12,0.9409811533987522,positive,news,"McDonald's Q4 Earnings & Revenues Beat Estimates, Rise Y/Y"
SBUX,2026-02-12,0.8766243234276772,positive,news,Filet Mignon or Filet-o-Fish? Here's How McDonald's Plans to Keep Courting Wealthier Customers
SBUX,2026-02-12,0.7354724854230881,positive,news,(HWM) Howmet Aerospace Inc. Expects Q1 Adjusted EPS Range $1.09 - $1.11
SBUX,2026-02-12,-0.9256620332598686,negative,news,SCS Capital Management Cuts Amazon.com Stake Under Abbiati
SBUX,2026-02-12,-0.3296429216861725,negative,news,"SCS Capital Management Trims Apple Inc Stake by 8,300 Shares"
SBUX,2026-02-12,-0.9424520079046488,negative,news,Manitou Investment Management Cuts Alphabet Inc. Class A Stake
SBUX,2026-02-12,-0.9170098155736923,negative,news,Suncoast Equity Management Cuts Alphabet Inc. Class A Stake
SBUX,2026-02-11,0.9106791699305177,positive,news,Higher prices and pizzas on china: Papa Johns bets on premium as it returns to a pizza-mature India
SBUX,2026-02-11,-0.8638698421418667,negative,news,Agios Pharm set to report earnings amid thalassemia drug rollout By Investing.com
SBUX,2026-02-11,0.8052692711353302,positive,news,Starbucks stock price today: SBUX steadies as menu reset rolls out and jobs data lifts Wall Street
SBUX,2026-02-11,-0.6938021574169397,negative,news,Norfolk Southern Warns of Significant Risks if Proposed Mergers Fail or Face Delays
SBUX,2026-02-11,-0.6577684432268143,negative,news,Say farewell to Kroger stores as grocery store confirms ‘company-wide decision’
SBUX,2026-02-11,0.9329569675028324,positive,news,"Golden Arches, Digital Future: A Deep Dive into McDonald’s (MCD) Following 2026 Performance Surge"
SBUX,2026-02-11,-0.9393055513501167,negative,news,Alps Advisors Inc. Decreases Holdings in Starbucks Corporation $SBUX
SBUX,2026-02-11,-0.9365625195205212,negative,news,Execution Risks Cloud Marsh & McLennan’s Thrive and BCS Efficiency Plans
SBUX,2026-02-11,0.7699295282363892,positive,news,"Fisher Asset Management Boosts Amazon.com Stake by 489,924 Shares"
SBUX,2026-02-11,-0.962249661795795,negative,news,Intermede Investment Partners Cuts Alphabet Class C Position
SBUX,2026-02-10,-0.5981452986598015,negative,news,Target CEO Fiddelke promotes two executives; 500 jobs cut - Bizwomen
SBUX,2026-02-10,0.9130398854613304,positive,news,Brinker International (EAT) Valuation Check After Raised 2026 Guidance And Solid Earnings Performance
SBUX,2026-02-10,-0.8704637736082077,negative,news,ProShare Advisors LLC Has $120.27 Million Position in Starbucks Corporation $SBUX
SBUX,2026-02-10,-0.33819031715393066,negative,news,How Chipotle Mexican Grill Stock Gained 30%
SBUX,2026-02-09,0.8453628462739289,positive,news,"Yum! Brands Bets Big on Bytes and Bots: How the Fast-Food Giant Is Rewiring 60,000 Restaurants for an AI-Powered Future"
GS,2026-02-19,-0.9289523139595985,negative,news,"Presima Securities ULC Sells 10,286 Shares of Equinix, Inc. $EQIX"
GS,2026-02-19,0.9341398505493999,positive,news,Goldman Sachs Optimistic on Credo Technology's Future
GS,2026-02-19,0.938124431297183,positive,news,Goldman Sachs initiates Credo Technology stock coverage with buy rating
GS,2026-02-19,-0.9600748931989074,negative,news,American Express Company $AXP Shares Sold by Alberta Investment Management Corp
GS,2026-02-19,-0.8764594160020351,negative,news,5 Insightful Analyst Questions From Wynn Resorts's Q4 Earnings Call
GS,2026-02-19,-0.3029862940311432,negative,news,Goldman Says Most Large-Cap Stock Pickers Beat Market Since 2007
GS,2026-02-19,0.7702827230095863,positive,news,Goldman Says Most Large-Cap Stock Pickers Beat Market Since 2007
GS,2026-02-19,-0.9562947768718004,negative,news,JPMorgan Chase & Co. Reduces Position in Credicorp Ltd. $BAP
